,subreddit,title,url,upvote_ratio,ups,downs,score
0,worldnews,Analysis of Twitter algorithm code reveals social medium down-ranks tweets about Ukraine,https://www.yahoo.com/news/analysis-twitter-algorithm-code-reveals-072800540.html,0.84,80058,0,80058
1,worldnews,Russian officers used female combat soldiers as sex slaves - report,https://www.jpost.com/international/article-736134,0.85,54566,0,54566
2,worldnews,Sanna Marin concedes defeat in Finland election as SDP beaten into third place,https://www.theguardian.com/world/2023/apr/02/sanna-marin-finland-election-sdp-social-democratic-national-coalition,0.95,15268,0,15268
3,worldnews,"Saudis to cut oil production by 500,000 barrels per day",https://abcnews.go.com/amp/International/wireStory/saudis-cut-oil-production-500000-barrels-day-98302307,0.95,8535,0,8535
4,worldnews,China's loans to Africa worry World Bank President David Malpass,https://www.bbc.co.uk/news/business-65140363,0.94,4397,0,4397
5,worldnews,Paris votes to ban rental e-scooters,https://www.bbc.co.uk/news/world-europe-65154854,0.97,4343,0,4343
6,worldnews,Ukrainian official offers plan for a Crimea without Russia,https://apnews.com/article/russia-ukraine-war-crimea-9da550b396f42cc267a4808bf99d5e6d,0.96,3790,0,3790
7,worldnews,"‘If we can do it, you can do it’: US anti-abortion groups ramp up activities in UK",https://www.theguardian.com/world/2023/apr/02/us-anti-abortion-groups-uk-far-right,0.92,2810,0,2810
8,worldnews,"Russia will implement voluntary cut in oil production of 500,000 bpd until the end of 2023",https://news.cgtn.com/news/2023-04-02/Russia-to-cut-in-oil-production-of-500-000-bpd-till-the-end-of-2023-1iGlyhbCOZi/index.html,0.95,2453,0,2453
9,worldnews,Czech Defence Minister says her country will supply more military aid to Ukraine,https://www.pravda.com.ua/eng/news/2023/04/2/7396122/,0.96,2200,0,2200
10,worldnews,Powerful 7.0-magnitude earthquake hits Papua New Guinea,https://bnonews.com/index.php/2023/04/powerful-7-0-magnitude-earthquake-hits-papua-new-guinea/,0.97,1585,0,1585
11,worldnews,Australia’s soaring interest rates have trapped ‘mortgage prisoners’ into crushing repayments,https://www.theguardian.com/australia-news/2023/apr/02/australia-soaring-interest-rates-have-trapped-mortgage-prisoners-into-crushing-repayments,0.95,1422,0,1422
12,worldnews,Rewilding animals could be key for climate: Report,https://news.mongabay.com/2023/03/rewilding-animals-could-be-key-for-climate-report/,0.95,1370,0,1370
13,worldnews,OPP officer found guilty of sexually assaulting unconscious woman and filming it,https://www.cbc.ca/news/canada/ottawa/opp-officer-sexual-assault-jason-redmond-1.6797839,0.96,1167,0,1167
14,worldnews,Thousands protest in Portugal over housing crisis,https://www.reuters.com/world/europe/thousands-protest-portugal-over-housing-crisis-2023-04-01/,0.95,899,0,899
15,worldnews,'Empty Promises': Wives Of Russian Soldiers Fighting In Ukraine Say Pay Is Not What Was Promised,https://www.rferl.org/a/russia-soldiers-salaries-unpaid-ukraine-invasion/32345161.html,0.97,807,0,807
16,worldnews,Finland’s center-right party claims win amid tight election,https://apnews.com/article/finland-parliamentary-election-sanna-marin-494e6d181a21e6f4cda00524e2468e4a,0.92,737,0,737
17,worldnews,"Japan buys Russian oil above $60-a-barrel cap, breaking with US allies: report",https://www.foxbusiness.com/markets/japan-buys-russian-oil-above-60-barrel-cap-breaking-us-allies-report,0.63,554,0,554
18,worldnews,More oil producers join Saudis in surprise production cuts,https://apnews.com/article/saudi-oil-production-cut-6d34316ce6820c749d2a6cd66a9fffea,0.93,449,0,449
19,worldnews,"/r/WorldNews Live Thread: Russian Invasion of Ukraine Day 404, Part 1 (Thread #545)",https://www.reddit.com/live/18hnzysb1elcs,0.97,300,0,300
20,worldnews,Air force downs unidentified aircraft in north amid escalating tensions with Iran,https://www.timesofisrael.com/air-force-downs-unidentified-aircraft-in-north-amid-escalating-tensions-with-iran/,0.85,207,0,207
21,worldnews,Israel shoots down drone coming from Syria following strikes,https://apnews.com/article/syria-israel-airstrikes-homs-a1f99061a041632c126804f27ca393e1,0.91,205,0,205
22,worldnews,Japan probed China Communist Party member over leaking farm tech data,https://english.kyodonews.net/news/2023/04/7267209f526b-japan-probed-china-communist-party-member-over-leaking-farm-tech-data.html,0.93,203,0,203
23,worldnews,Clearview AI scraped 30 billion images from Facebook and gave them to cops: it puts everyone into a 'perpetual police line-up',https://www.businessinsider.com/clearview-scraped-30-billion-images-facebook-police-facial-recogntion-database-2023-4,0.93,116,0,116
24,worldnews,The 'mind blowing' Paralympics scandal threatening the integrity of the Games,https://www.abc.net.au/news/2023-04-03/paralympic-games-classification-system-exploited-australian/102165924?utm_campaign=abc_news_web&amp;utm_content=link&amp;utm_medium=content_shared&amp;utm_source=abc_news_web,0.92,110,0,110
25,worldnews,"BRICS alliance working to create its own currency, says Russian official",https://www.livemint.com/news/world/brics-alliance-working-to-create-its-own-currency-says-russian-official-11680445842563.html,0.86,109,0,109
