,subreddit,title,url,upvote_ratio,ups,downs,score
0,worldnews,"Trump's ""final offer"" for peace requires Ukraine to accept Russian occupation",https://www.axios.com/2025/04/22/trump-russia-ukraine-peace-plan-crimea-donbas,0.9,36064,0,36064
1,worldnews,China invites European countries to form united front against Trump tariffs,https://www.scmp.com/news/china/diplomacy/article/3307568/china-invites-european-countries-form-united-front-against-trump-tariffs?module=top_story&amp;pgtype=homepage,0.96,21402,0,21402
2,worldnews,'This is a very dangerous moment' — Zelensky warns against US withdrawal from peace effort,https://kyivindependent.com/this-is-a-very-dangerous-moment-zelensky-on-potential-us-withdrawal-from-peace-talks/,0.97,16515,0,16515
3,worldnews,China says it wants to partner with Canada to push back against American ‘bullying’,https://www.ctvnews.ca/world/trumps-tariffs/article/china-says-it-wants-to-partner-with-canada-to-push-back-against-american-bullying/,0.95,14896,0,14896
4,worldnews,China Responds to Trump's Softening Tone on Trade,https://www.newsweek.com/china-responds-trump-trade-softening-tone-2062930,0.96,12233,0,12233
5,worldnews,"Trump reinserts himself into Canadian politics, saying 'as a state, it works great'",https://www.cbc.ca/news/politics/trump-canada-politics-1.7516951,0.94,6860,0,6860
6,worldnews,Finland departures to the US down 9%,https://yle.fi/a/74-20157571,0.96,5335,0,5335
7,worldnews,High-profile Ukraine peace talks collapse,https://www.nbcnews.com/news/world/ukraine-talks-rubio-witkoff-london-putin-zelenskyy-trump-russia-war-rcna202525,0.96,4787,0,4787
8,worldnews,Ukraine talks downgraded in London as Kyiv rejects Trump’s ‘final offer’,https://www.aljazeera.com/news/2025/4/23/ukraine-peace-talks-resume-in-london,0.98,4634,0,4634
9,worldnews,France: Europe will demand respect for Ukraine's territorial integrity in any peace deal,https://www.yahoo.com/news/france-europe-demand-respect-ukraines-140058028.html,0.98,4377,0,4377
10,worldnews,"Trump blames Zelenskyy for rejecting Ukraine-Russia negotiations, claims a deal was very close",https://www.nbcnews.com/news/world/ukraine-talks-rubio-witkoff-london-putin-zelenskyy-trump-russia-war-rcna202525?taid=68092b13da87f4000140fe47&amp;utm_campaign=trueanthem&amp;utm_medium=social&amp;utm_source=twitter,0.92,3791,0,3791
11,worldnews,Spain hits first weekday of 100% renewable power on national grid,https://www.pv-magazine.com/2025/04/22/spain-hits-first-weekday-of-100-renewable-power-on-national-grid/,0.99,3239,0,3239
12,worldnews,Jordan bans all activities of “Muslim Brotherhood”,https://en.royanews.tv/news/59104,0.97,3194,0,3194
13,worldnews,Trump tells DOD to move more forces equipped for combat into Middle East as US ups pressure on Houthis,https://www.yahoo.com/news/trump-tells-dod-move-more-213453255.html,0.96,2939,0,2939
14,worldnews,Poland's top diplomat decries Russia's war in Ukraine: 'Don't you have enough land?',https://www.euronews.com/2025/04/23/polands-top-diplomat-decries-russias-war-in-ukraine-dont-you-have-enough-land,0.98,2894,0,2894
15,worldnews,Switzerland introduces new EU sanctions targeting Russian media,https://www.swissinfo.ch/eng/foreign-affairs/switzerland-introduces-new-eu-sanctions-targeting-russian-media/89202011?utm_source=multiple&amp;utm_medium=website&amp;utm_campaign=news_en&amp;utm_content=o&amp;utm_term=wpblock_highlighted-compact-news-carousel,0.98,2284,0,2284
16,worldnews,"Indus Water Treaty paused, no entry to Pakistanis: India responds to J&amp;K attack",https://www.indiatoday.in/amp/india/story/indus-water-treaty-suspended-attari-checkpost-shut-government-response-pahalgam-attack-2713599-2025-04-23,0.94,1291,0,1291
17,worldnews,France: Europe will demand respect for Ukraine's territorial integrity in any peace deal,https://www.pravda.com.ua/eng/news/2025/04/23/7508850/,0.97,1273,0,1273
18,worldnews,"Mexico’s president hits back at US anti-immigration ads, calls them ‘discriminatory propaganda’",https://www.cnn.com/2025/04/23/americas/mexico-dhs-anti-immigration-ad-kristi-noem-latam-intl/index.html,0.93,635,0,635
19,worldnews,Trump kills US agency funding Africa infrastructure,https://www.france24.com/en/live-news/20250424-trump-kills-us-agency-funding-africa-infrastructure,0.91,471,0,471
20,worldnews,"Israel’s Gaza aid blockade is ‘intolerable,’ France, Germany and U.K. say",https://www.washingtonpost.com/world/2025/04/23/israel-hamas-war-gaza-aid/,0.77,451,0,451
21,worldnews,"Ukraine's Zelenskiy notes 'emotions' in talks, alludes to dispute with U.S. over Crimea",https://www.reuters.com/world/europe/ukraines-zelenskiy-notes-emotions-talks-hopes-joint-work-will-produce-peace-2025-04-23/,0.95,361,0,361
22,worldnews,"Kyiv Hit by Massive Russian Missile and Drone Attack: 21 Injured, People Trapped Under Rubble",https://united24media.com/latest-news/kyiv-hit-by-massive-russian-missile-and-drone-attack-six-injured-people-trapped-under-rubble-7831,0.98,177,0,177
23,worldnews,"/r/WorldNews Live Thread: Russian Invasion of Ukraine Day 1155, Part 1 (Thread #1302)",https://www.reddit.com/live/18hnzysb1elcs,0.97,156,0,156
24,worldnews,Anti-Hamas protests on rise in Gaza as group's iron grip slips,https://www.bbc.co.uk/news/articles/c175z14r8pro,0.93,146,0,146
25,worldnews,EU fines Apple €500M and Meta €200M for breaking Europe’s digital rules – POLITICO,https://www.politico.eu/article/eu-fines-apple-meta-breaking-europe-digital-markets-act-dma/,0.99,137,0,137
