,subreddit,title,url,upvote_ratio,ups,downs,score
0,worldnews,South Africa to side with Russia on push for redesigned global order,https://www.theglobeandmail.com/world/article-south-africa-to-side-with-russia-on-push-for-redesigned-global-order/,0.87,34180,0,34180
1,worldnews,Germany to send Leopard 2 tanks to Ukraine — reports,https://www.dw.com/en/germany-to-send-leopard-2-tanks-to-ukraine-report/a-64503898?maca=en-rss-en-all-1573-rdf,0.93,30608,0,30608
2,worldnews,Indian university warns students not to screen BBC documentary on Modi,https://www.reuters.com/world/india/indian-university-warns-against-screening-bbc-documentary-modi-2023-01-24/,0.94,13536,0,13536
3,worldnews,Brazil's Lula appoints Indigenous ministers to reverse Amazon deforestation,https://www.csmonitor.com/World/Americas/2023/0123/Brazil-appoints-Indigenous-ministers-to-reverse-Amazon-deforestation,0.98,8576,0,8576
4,worldnews,"Finland must consider joining NATO without Sweden, says minister",https://www.euronews.com/2023/01/24/finland-must-considering-joining-nato-without-sweden-says-minister,0.96,7174,0,7174
5,worldnews,Putin says Russian pharmacies are short on some medicines,https://www.reuters.com/business/healthcare-pharmaceuticals/putin-says-russian-pharmacies-are-short-some-medicines-2023-01-24/,0.96,6895,0,6895
6,worldnews,U.S. closer to approving ‘significant number’ of Abrams tanks to Ukraine,https://www.politico.com/news/2023/01/24/u-s-approving-abrams-tanks-ukraine-00079218,0.96,3994,0,3994
7,worldnews,Belarus leader says he has been asked to seal a non-aggression pact with Ukraine,https://www.reuters.com/world/europe/belarus-leader-says-he-has-been-asked-seal-non-aggression-pact-with-ukraine-2023-01-24/,0.96,3611,0,3611
8,worldnews,Zelenskiy ramps up anti-corruption drive as 15 Ukrainian officials exit,https://www.theguardian.com/world/2023/jan/24/zelenskiy-anti-corruption-drive-15-ukrainian-officials-exit,0.96,3186,0,3186
9,worldnews,"Russia faces ‘incredible poverty’, warns ex-IMF chief",https://www.msn.com/en-gb/news/world/russia-faces-incredible-poverty-warns-ex-imf-chief/ar-AA16yABc,0.96,2866,0,2866
10,worldnews,"Finnish Olympic Committee calls for competition ban on Russia, Belarus.",https://yle.fi/a/74-20014408,0.97,2168,0,2168
11,worldnews,UN Official Says Evidence Of War Crimes Against Children In Ukraine,https://www.rferl.org/a/ukraine-un-commission-war-crimes-dzumhur/32236213.html,0.97,1856,0,1856
12,worldnews,Kremlin declines to say if Putin will seek re-election in 2024,https://www.ctvnews.ca/world/kremlin-declines-to-say-if-putin-will-seek-re-election-in-2024-1.6242087,0.95,1829,0,1829
13,worldnews,Ukraine corruption scandal: String of officials resign in Kyiv,https://www.euronews.com/2023/01/24/ukraine-corruption-scandal-string-of-officials-resign-in-kyiv,0.95,1365,0,1365
14,worldnews,"Evidence of 'genocide' among Brazil's indigenous Yanomami, says minister",https://www.reuters.com/world/americas/evidence-genocide-among-brazils-indigenous-yanomami-says-minister-2023-01-23/,0.97,1316,0,1316
15,worldnews,Ukraine's Commander-in-Chief inherits US$1 million and donates it to Ukrainian army,https://www.pravda.com.ua/eng/news/2023/01/24/7386365/,0.97,936,0,936
16,worldnews,Wagner Group used UK law firm to silence journalist and avoid sanctions,https://www.newsweek.com/wagner-group-boss-had-u-k-help-targeting-journalist-report-1776175,0.95,935,0,935
17,worldnews,"A Ukraine victory in 2023 would be ‘big boost’ to global economy, Freeland says - National | Globalnews.ca",https://globalnews.ca/news/9433201/ukraine-canada-tanks-freeland-economy/,0.92,693,0,693
18,worldnews,"US finalizing plans to send Abrams tanks to Ukraine, US officials say",https://amp.cnn.com/cnn/2023/01/24/politics/us-abram-tanks-ukraine/index.html,0.94,474,0,474
19,worldnews,"Russia Mobilizes Ukrainians From Occupied Regions To Fight Own Country, Use As 'Human Shield'",https://www.ibtimes.com/russia-mobilizes-ukrainians-occupied-regions-fight-own-country-use-human-shield-3660576,0.95,452,0,452
20,worldnews,Russian citizens continue to be punished for expressing anti-war sentiment,https://www.lemonde.fr/en/international/article/2023/01/25/russian-citizens-continue-to-be-punished-for-expressing-anti-war-sentiment_6012952_4.html,0.94,442,0,442
21,worldnews,Netherlands considers sending 18 Leopard tanks to Ukraine,https://news.yahoo.com/netherlands-considers-sending-18-leopard-210900494.html,0.96,366,0,366
22,worldnews,"/r/WorldNews Live Thread: Russian Invasion of Ukraine Day 336, Part 1 (Thread #477)",https://www.reddit.com/live/18hnzysb1elcs,0.97,260,0,260
23,worldnews,"Duda says Nato Article 5 is not theoretical, but binding and very practical",https://www.thefirstnews.com/article/duda-says-nato-article-5-is-not-theoretical-but-binding-and-very-practical-36002,0.96,247,0,247
24,worldnews,Japan PM’s solution to dire birthrate has already been rejected by young | Japan | The Guardian,https://www.theguardian.com/world/2023/jan/24/japan-birthrate-population-pm-solution-already-rejected-by-young,0.94,160,0,160
25,worldnews,Russia warns West of ‘global catastrophe’ for arming Ukraine,https://globalnews.ca/news/9428459/russia-ukraine-west-arming/,0.83,101,0,101
