,subreddit,title,url,upvote_ratio,ups,downs,score
0,worldnews,Russia begins talks of ending the war to save the economy – Reuters,https://unn.ua/en/news/russia-begins-talks-of-ending-the-war-to-save-the-economy-reuters,0.95,27356,0,27356
1,worldnews,"Iran stops negotiations with U.S., vows to 'completely' block Strait of Hormuz: State media",https://www.cnbc.com/2026/06/01/iran-us-negotiations-strait-of-hormuz.html,0.97,19217,0,19217
2,worldnews,Trump Says He Doesn't Care If 'Very Boring' Talks With Iran Are Over,https://www.usatoday.com/story/news/politics/2026/06/01/trump-iran-peace-talks-over-israel-lebanon/90356859007/,0.96,12852,0,12852
3,worldnews,"Kyiv hit by large wave of Russian strikes, people feared trapped in apartment building rubble",https://www.cnn.com/2026/06/01/europe/russia-attack-kyiv-building-damage-intl-hnk,0.98,8708,0,8708
4,worldnews,"3,400 deaths in a day: India's extreme heat days are deadlier than we imagined",https://www.indiatoday.in/science/story/india-heatwave-deaths-study-extreme-heat-public-health-emergency-climate-change-2920200-2026-06-01,0.96,5569,0,5569
5,worldnews,"Iran halts ceasefire talks with US, says it will keep Strait of Hormuz closed",https://thehill.com/policy/defense/5903844-iran-accuses-trump-ceasefire-violations/,0.97,3125,0,3125
6,worldnews,US bombs Iranian military sites and Tehran targets American troops in Kuwait,https://apnews.com/article/iran-us-irael-war-kuwait-strikes-88daa9f90b48baaa7beb18e35515c59d,0.97,2692,0,2692
7,worldnews,Southampton man jailed for life for murder of student with ‘religious’ knife,https://www.theguardian.com/uk-news/2026/jun/01/southampton-man-jailed-life-murder-student-religious-knife-vickrum-digwa-henry-nowak,0.95,2007,0,2007
8,worldnews,Greek shipping magnate George Procopiou warns Iran that Greeks have a long history of “breaking blockades.”,https://www.theglobeandmail.com/world/article-strait-of-hormuz-dynacom-tankers-management-george-prokopiou/,0.95,1903,0,1903
9,worldnews,Israel says France has banned Israeli ‌government officials from participating in a major weapons show in the country,https://www.reuters.com/business/aerospace-defense/israels-defence-ministry-says-france-bans-israeli-officials-defence-show-2026-06-01/,0.94,1699,0,1699
10,worldnews,"Iran Suspended Talks, Struck Kuwait, and Threatened Hormuz — the Audience Was the Senate",https://houseofsaud.com/iran-escalated-for-the-senate-not-for-trump/#trump-contradiction,0.95,1653,0,1653
11,worldnews,"Ebola may have been spreading unchecked since January, aid groups fear",https://www.telegraph.co.uk/global-health/science-and-disease/ebola-outbreak-may-have-begun-in-january-aid-groups-fear/?WT.mc_id=tmgoff_reddit_in-january-aid-groups-fear/&amp;accesscontrol=facebookchannel_open,0.96,1400,0,1400
12,worldnews,Russian Billionaire Can’t Scuttle $300 Million Yacht Forfeiture,https://news.bloomberglaw.com/banking-law/russian-billionaire-cant-scuttle-300-million-yacht-forfeiture,0.96,920,0,920
13,worldnews,EU agrees deal for deporting migrants to third-country 'return hubs',https://www.france24.com/en/europe/20260602-eu-agrees-deal-for-deporting-migrants-to-third-country-return-hubs,0.95,831,0,831
14,worldnews,Zelensky: Ukraine Can Strike Russian Logistics Across All Occupied Territory,https://www.kyivpost.com/post/77305,0.96,775,0,775
15,worldnews,Finland seizes nearly €4m in Russian assets,https://yle.fi/a/74-20229298,0.98,650,0,650
16,worldnews,Russia bans aviation fuel exports until November 30,https://www.reuters.com/business/energy/russia-bans-aviation-fuel-exports-until-november-30-2026-06-01/,0.97,569,0,569
17,worldnews,"Zelensky: Europe Needs Anti-Ballistic Shield After 73 Missiles, 656 Drones Strike",https://www.kyivpost.com/post/77341,0.96,401,0,401
18,worldnews,"Russia launched 37% more attacks but still lost ground in May, Ukrainian war tracker says",https://www.yahoo.com/news/world/articles/russia-launched-37-more-attacks-061208306.html,0.96,331,0,331
19,worldnews,"/r/WorldNews Live Thread: Russian Invasion of Ukraine Day 1559, Part 1 (Thread #1706)",https://www.reddit.com/live/18hnzysb1elcs,0.98,261,0,261
20,worldnews,/r/WorldNews Discussion Thread: US and Israel launch attack on Iran; Iran retaliates (Thread #18),https://www.reddit.com/r/worldnews/comments/1tlutp0/rworldnews_discussion_thread_us_and_israel_launch/,0.85,207,0,207
21,worldnews,USA proposes 25% tariff to punish Brazil over trade practices,https://www.reuters.com/world/americas/trump-administration-proposes-25-tariff-punish-brazil-over-trade-practices-2026-06-02/,0.88,172,0,172
22,worldnews,Russia’s Kyiv Strike Burns Chinese EV Brand Zeekr’s Dealer Showroom to the Ground,https://united24media.com/war-in-ukraine/russias-kyiv-strike-burns-chinese-ev-brand-zeekrs-dealer-showroom-to-the-ground-19405,0.9,93,0,93
23,worldnews,Claude is Offline: Anthropic Hits a Global Wall,https://www.ndtv.com/artificial-intelligence/anthropic-ai-chatbot-claude-faces-major-global-outage-affecting-thousands-of-users-11579758,0.62,66,0,66
24,worldnews,"Over half of all Belgians see the US as an adversary, more so than China",https://www.vrt.be/vrtnws/en/2026/06/01/over-half-of-all-belgians-see-the-us-as-an-adversary-more-so-th/,0.86,59,0,59
