,subreddit,title,url,upvote_ratio,ups,downs,score
0,worldnews,"Journalists who found Adrian Dittman's ""true identity"" are strangely forced to delete posts on X",https://www.dailydot.com/debug/elon-musk-adrian-dittman-journalists/?amp,0.94,29403,0,29403
1,worldnews,Netanyahu postpones Gaza ceasefire deal over Hamas 'last minute crisis',https://www.newsweek.com/netanyahu-postpones-gaza-ceasefire-deal-hamas-crisis-2015854,0.93,14644,0,14644
2,worldnews,Trump's Treasury pick Bessent calls for stronger sanctions on Russia over Ukraine war,https://www.reuters.com/world/trumps-treasury-pick-bessent-calls-stronger-sanctions-russia-over-ukraine-war-2025-01-16/,0.96,8627,0,8627
3,worldnews,French Special Forces Held Secret Exercise to Counter Belarus Attack on Ukraine,https://www.kyivpost.com/post/45513,0.98,6546,0,6546
4,worldnews,Russian drone shot down near presidential palace during Starmer's Ukraine visit,https://news.sky.com/story/russian-drone-shot-down-near-presidential-palace-during-starmers-ukraine-visit-13290189,0.98,5685,0,5685
5,worldnews,"US company behind Teflon tries to block EU’s forever chemicals ban, claims NGO",https://www.politico.eu/article/chemours-chemicals-block-european-pfas-ban-claim-corporate-europe-observatory/,0.98,4183,0,4183
6,worldnews,"Ukraine will not abandon NATO membership nor accept alternative options, Ukraine's foreign minister says",https://www.pravda.com.ua/eng/news/2025/01/15/7493660/,0.98,4140,0,4140
7,worldnews,UK pledges support for Ukraine with 'landmark' 100-year deal,https://www.bbc.co.uk/news/articles/cvgem31jekvo,0.97,4097,0,4097
8,worldnews,NATO: Norwegian F-35s deployed after Russian aircraft entered Polish airspace,https://www.reuters.com/world/europe/nato-norwegian-f-35s-deployed-after-russian-aircraft-entered-polish-airspace-2025-01-16/,0.95,2456,0,2456
9,worldnews,Zelenskyy: There's a chance to end war this year if Trump puts pressure on Russia,https://www.pravda.com.ua/eng/news/2025/01/16/7493854/,0.96,2258,0,2258
10,worldnews,Russian Ship Sinking: Spy Ship Yantar Diving on Wreck,https://www.navalnews.com/naval-news/2025/01/russian-ship-sinking-spy-ship-yantar-diving-on-wreck/,0.96,2131,0,2131
11,worldnews,Worst global growth for 6 years forecast due to tariffs,https://www.bbc.co.uk/news/articles/ce9n0l2p7meo,0.94,2117,0,2117
12,worldnews,"Trump has not withdrawn threat against Denmark, says PM Mette Frederiksen after phone call
",https://www.dr.dk/nyheder/politik/i-sin-samtale-med-mette-frederiksen-ville-trump-ikke-traekke-told-trusler-tilbage,0.94,2081,0,2081
13,worldnews,"Israel supplied Iran with centrifuge platforms containing explosives, top official acknowledges",https://apnews.com/article/iran-nuclear-israel-sabotage-centrifuges-gaza-war-fed9c52e6826cb495d602d8ce43a1047,0.95,1838,0,1838
14,worldnews,'Out of Control': Russia's CPI Inflation Up Again to 9.5% in December,https://www.themoscowtimes.com/2025/01/16/out-of-control-russias-cpi-inflation-up-again-to-95-in-december-a87639,0.98,1572,0,1572
15,worldnews,Google won't add fact-checks despite new EU law,https://www.axios.com/2025/01/16/google-fact-check-eu,0.94,1241,0,1241
16,worldnews,Mark Carney runs for leader of Canada's Liberal Party,https://www.bbc.com/news/articles/c3vppxe99ndo,0.92,939,0,939
17,worldnews,Russian diplomats secretly enter closed area of British Parliament during tour - Guardian,https://unn.ua/en/news/russian-diplomats-secretly-enter-closed-area-of-british-parliament-during-tour-guardian,0.98,938,0,938
18,worldnews,China Pounces on Russia's Fire Sale of Prized Assets,https://www.newsweek.com/china-russia-coal-trade-2016065,0.95,801,0,801
19,worldnews,Gaza hostage and ceasefire deal officially signed in Doha,https://www.axios.com/2025/01/17/gaza-israel-ceasefire-hostage-deal-signed,0.94,744,0,744
20,worldnews,South Korea slams Hegseth over North Korea 'nuclear power' comments,https://usatoday.com/story/news/politics/elections/2025/01/15/hegseth-spooks-south-korea-north-nuclear-power/77721780007/,0.94,453,0,453
21,worldnews,Russian Soldier Jailed for Accidentally Shooting Down Friendly Helicopter,https://www.themoscowtimes.com/2025/01/16/russian-soldier-jailed-for-accidentally-shooting-down-friendly-helicopter-a87630,0.96,390,0,390
22,worldnews,China's population falls for a third consecutive year,https://www.reuters.com/world/china/chinas-population-falls-third-consecutive-year-2025-01-17/,0.92,272,0,272
23,worldnews,"Russian diplomats accessed restricted area of UK parliament, The Guardian reports",https://www.pravda.com.ua/eng/news/2025/01/16/7493976/,0.94,269,0,269
24,worldnews,NATO deploys Norwegian F-35 fighters for 1st time during Russian Jan. 15 attack on Ukraine,https://kyivindependent.com/nato-deploys-norwegian-f-35-fighters-for-1st-time-during-russian-jan-15-attack-on-ukraine/,0.94,178,0,178
25,worldnews,"/r/WorldNews Live Thread: Russian Invasion of Ukraine Day 1058, Part 1 (Thread #1205)",https://www.reddit.com/live/18hnzysb1elcs,0.98,134,0,134
