,subreddit,title,url,upvote_ratio,ups,downs,score
0,worldnews,Polish leader says US Republican senators should be ashamed for scuttling Ukrainian aid,https://www.ajc.com/news/nation-world/polish-leader-says-us-republican-senators-should-be-ashamed-for-scuttling-ukrainian-aid/7MEZNIY575BINI2F26OWJT6GFA/,0.9,20101,0,20101
1,worldnews,Putin challenger says he is barred from election,https://www.bbc.co.uk/news/world-europe-68237791,0.94,18221,0,18221
2,worldnews,Mexico overtakes China as the leading source of goods imported to US,https://abcnews.go.com/US/wireStory/mexico-overtakes-china-leading-source-goods-imported-us-107034221,0.97,17214,0,17214
3,worldnews,Massive Explosion Hits Russian Plant Making Nuclear Capable ICBMs,https://www.newsweek.com/explosion-russian-military-weapons-plant-nuclear-udmurt-votkinsk-1868050,0.98,6572,0,6572
4,worldnews,Russia Storming Avdiivka with ‘Very Large Forces’,https://www.kyivpost.com/post/27774,0.96,5895,0,5895
5,worldnews,"Israel cannot use Oct. 7 as ‘license to dehumanize others,’ Blinken warns in Tel Aviv",https://www.timesofisrael.com/israel-cannot-use-oct-7-as-a-license-to-dehumanize-others-fumes-blinken-in-tel-aviv/,0.85,5433,0,5433
6,worldnews,"Ukraine’s top commander, Zaluzhny, officially out",https://www.washingtonpost.com/world/2024/02/08/valery-zaluzhny-commander-ukraine-removed/,0.96,4546,0,4546
7,worldnews,Russia deploying Starlink in Ukraine—reports,https://www.newsweek.com/russia-starlink-ukraine-war-elon-musk-1868125,0.95,4014,0,4014
8,worldnews,Britain increases artillery shell production ‘eight-fold’,https://ukdefencejournal.org.uk/britain-increases-artillery-shell-production-eight-fold/,0.97,3208,0,3208
9,worldnews,Scholz ahead of US visit: Russian victory in Ukraine would imperil us all,https://www.pravda.com.ua/eng/news/2024/02/8/7440986/,0.97,2811,0,2811
10,worldnews,"Bolsonaro named target in Brazil coup probe, ordered to surrender passport",https://www.washingtonpost.com/world/2024/02/08/bolsonaro-named-target-brazil-coup-probe-ordered-surrender-passport/?utm_campaign=wp_main&amp;utm_medium=social&amp;utm_source=reddit.com,0.97,2444,0,2444
11,worldnews,Hezbollah military commander killed in Israeli drone strike in Lebanon,https://m.jpost.com/breaking-news/article-785763,0.95,2204,0,2204
12,worldnews,"WSJ Exclusive | Russian Intelligence Is Pushing False Claims of U.S. Biological Testing in Africa, U.S. Says",https://www.wsj.com/world/africa/russian-intelligence-is-pushing-false-claims-of-u-s-biological-testing-in-africa-u-s-says-ea817592?st=ir9wo6ty55ehrcc,0.95,1889,0,1889
13,worldnews,Meta suspends Iran's Supreme Leader Ali Khamenei’s Facebook and Instagram accounts,https://www.i24news.tv/en/news/middle-east/iran-eastern-states/1707402124-facebook-instagram-accounts-of-iran-s-khamenei-suspended,0.96,1494,0,1494
14,worldnews,"Killer whale pod trapped by sea ice in Japan has seemingly escaped, local official says",https://abcnews.go.com/International/10-killer-whales-trapped-sea-ice-japan/story?id=106997902,0.97,1241,0,1241
15,worldnews,Zelenskiy Says Time for Renewed Leadership of Armed Forces,https://www.bloomberg.com/news/articles/2024-02-08/zelenskiy-says-time-for-renewed-leadership-of-armed-forces,0.95,1067,0,1067
16,worldnews,"Bolsonaro and Allies Planned a Coup, Brazil Police Say",https://www.nytimes.com/2024/02/08/world/americas/brazil-police-raid-bolsonaro-attempted-coup-investigation.html,0.95,909,0,909
17,worldnews,Iranian Finger Amputations Continue Against International Law,https://www.iranintl.com/en/202402083948,0.94,856,0,856
18,worldnews,"Found in Gaza: Iranian envelopes stuffed with cash, bearing Sinwar's name - I24NEWS",https://www.i24news.tv/en/news/israel-at-war/1707404868-idf-s-latest-gaza-find-iranian-envelopes-stuffed-with-cash-bearing-sinwar-s-name,0.87,746,0,746
19,worldnews,/r/WorldNews Live Thread for 2023 Israel-Hamas Crisis (Thread 45),https://www.reddit.com/live/1bsso361afr0r,0.88,730,0,730
20,worldnews,Russian anti-war Putin rival Nadezhdin plans Supreme Court appeal after election ban,https://www.reuters.com/world/europe/russian-anti-war-putin-rival-nadezhdin-says-he-has-been-barred-election-2024-02-08/?utm_source=reddit.com,0.95,483,0,483
21,worldnews,Cyber-attack by Ukrainian Defence Intelligence: large-scale failure of Russian drone control program occurs,https://news.yahoo.com/cyber-attack-ukrainian-defence-intelligence-135453587.html,0.95,474,0,474
22,worldnews,"Unprecedented Amazon drought was primarily caused by climate change, not El Niño, study finds",https://english.elpais.com/climate/2024-02-08/unprecedented-amazon-drought-was-primarily-caused-by-climate-change-not-el-nino-study-finds.html,0.91,315,0,315
23,worldnews,Putin signals he's open to prisoner swap for Wall Street Journal reporter Evan Gershkovich's release,https://www.cbsnews.com/news/tucker-carlson-vladimir-putin-interview-evan-gershkovich/,0.9,282,0,282
24,worldnews,"/r/WorldNews Live Thread: Russian Invasion of Ukraine Day 716, Part 1 (Thread #862)",https://www.reddit.com/live/18hnzysb1elcs,0.97,219,0,219
25,worldnews,"Irish unification referendum by 2030, Sinn Fein leader tells Sky News",https://news.sky.com/story/irish-unification-referendum-by-2030-sinn-fein-leader-tells-sky-news-13066545,0.87,73,0,73
26,worldnews,Iranian state-backed hackers interrupted TV streaming services in the United Arab Emirates to broadcast a deepfake newsreader delivering a report on the war in Gaza,https://www.theguardian.com/technology/2024/feb/08/iran-backed-hackers-interrupt-uae-tv-streaming-services-with-deepfake-news,0.88,64,0,64
