,subreddit,title,url,upvote_ratio,ups,downs,score
0,worldnews,"Missile attack on Kremenchuk hit shopping mall with over 1,000 civilians, building is on fire – Zelensky",https://en.interfax.com.ua/news/general/841939.html,0.9,61790,0,61790
1,worldnews,"Supreme Court of New Zealand rules ""Family First"" (a Conservative Christian Lobby group that advocates for a ban on abortion and gay marriage) does not qualify for charity status.",https://www.rnz.co.nz/news/national/469924/family-first-does-not-qualify-for-charitable-status-supreme-court-rules,0.87,59726,0,59726
2,worldnews,Abandoning God: Christianity plummets as ‘non-religious’ surges in census,https://www.smh.com.au/national/abandoning-god-christianity-plummets-as-non-religious-surges-in-census-20220627-p5awvz.html,0.89,30009,0,30009
3,worldnews,Zelensky warns Belarusians: Don't let Putin drag you into war,https://www.newsweek.com/zelensky-warns-belarusians-putin-drag-war-ukraine-nuclear-missiles-1719367,0.96,8913,0,8913
4,worldnews,Russia Says Putin Will Be Part Of G20 Summit—Setting Stage For Showdown With Western Leaders,https://www.forbes.com/sites/dereksaul/2022/06/27/russia-says-putin-will-be-part-of-g20-summit-setting-stage-for-showdown-with-western-leaders/,0.96,7113,0,7113
5,worldnews,France says Russia must answer for missile strike on Ukrainian mall,https://www.reuters.com/world/europe/france-says-russia-must-answer-missile-strike-ukrainian-mall-2022-06-27/,0.97,5373,0,5373
6,worldnews,Hundreds of children taken from Ukraine found in Russia’s Taganrog,https://www.kyivpost.com/ukraine-politics/hundreds-of-children-taken-from-ukraine-found-in-russias-taganrog.html,0.97,4765,0,4765
7,worldnews,India Bans Single-Use Plastic Products From July 1,https://www.outlookindia.com/travel/india-bans-single-use-plastic-products-from-july-1-news-203887,0.97,4598,0,4598
8,worldnews,"Ukraine war: The price of freedom is worth paying, says Boris Johnson",https://www.bbc.com/news/uk-politics-61949714,0.94,3049,0,3049
9,worldnews,"Libraries in Canada hit by wave of hate, threats, as right-wing groups protest all-age drag events",https://www.cbc.ca/news/investigates/libraries-threats-all-age-drag-1.6501247,0.9,2466,0,2466
10,worldnews,Ukraine war: Russian strike on shopping a centre a war crime - G7 leaders,https://www.bbc.com/news/world-europe-61956711,0.97,1629,0,1629
11,worldnews,Lithuania hit with 'intensive' cyber attacks amid Kaliningrad row,https://www.lrt.lt/en/news-in-english/19/1727836/lithuania-hit-with-intensive-cyber-attacks-amid-kaliningrad-row,0.97,1568,0,1568
12,worldnews,UK doctors demand pay rise of up to 30% over five years,https://www.theguardian.com/society/2022/jun/27/uk-doctors-demand-pay-rise-of-up-to-30-over-five-years,0.95,1121,0,1121
13,worldnews,"Russia denies debt default, directs foreign bondholders to speak directly to those withholding the payments that Moscow claims to have made.",https://www.aljazeera.com/economy/2022/6/27/russia-tells-investors-to-go-to-western-financial-agents,0.93,929,0,929
14,worldnews,Johnson issues open invitation to Russian scientists ‘dismayed by Putin’s violence’,https://www.theguardian.com/world/2022/jun/27/johnson-issues-open-invitation-to-russian-scientists-dismayed-by-putins-violence?utm_term=Autofeed&amp;CMP=twt_b-gdnnews&amp;utm_medium=Social&amp;utm_source=Twitter#Echobox=1656366045,0.95,849,0,849
15,worldnews,Russia's Medvedev says any NATO encroachment on Crimea could lead to World War Three,https://www.reuters.com/world/europe/russias-medvedev-says-any-nato-encroachment-crimea-could-lead-world-war-three-2022-06-27/,0.88,777,0,777
16,worldnews,Biden Shows Massive Support of Ukraine To Hold Russia Accountable,https://newsflector.com/biden-shows-massive-support-of-ukraine-to-hold-russia-accountable/,0.92,722,0,722
17,worldnews,Swiss intel service: Watch out for redeployed Russian spies,https://apnews.com/article/russia-ukraine-putin-espionage-government-and-politics-97b9f6268efc5caefd311679d0567a03,0.97,687,0,687
18,worldnews,Russia's Medvedev: NATO encroachment in Crimea could lead to WW3.,https://www.i24news.tv/en/news/ukraine-conflict/1656377747-russia-s-medvedev-nato-encroachment-in-crimea-could-lead-to-ww3,0.88,596,0,596
19,worldnews,U.S. ambassador on missile attack on Kremenchuk: World will bring Kremlin to justice,https://www.ukrinform.net/rubric-polytics/3516579-us-ambassador-on-missile-attack-on-kremenchuk-world-will-bring-kremlin-to-justice.html,0.95,574,0,574
20,worldnews,"Mennonite colony builds bridge, clears forest in Bolivian protected area: bridge appears to have been built without authorization from the government and without an environmental impact assessment",https://news.mongabay.com/2022/06/mennonite-colony-builds-bridge-clears-forest-in-bolivian-protected-areas/,0.94,431,0,431
21,worldnews,Cisco to quit Russia and Belarus due to Ukraine war,https://www.datacenterdynamics.com/en/news/cisco-to-quit-russia-and-belarus-due-to-ukraine-war/,0.96,421,0,421
22,worldnews,New Zealand ‘grossly underprepared’ as deadly drug fentanyl causes string of overdoses | New Zealand,https://www.theguardian.com/world/2022/jun/27/new-zealand-grossly-underprepared-as-deadly-drug-fentanyl-causes-string-of-overdoses,0.95,406,0,406
23,worldnews,"100-Year-Old Giant Sturgeon Caught In Canada, Thrown Back In River",https://www.ndtv.com/offbeat/100-year-old-giant-sturgeon-caught-in-canada-thrown-back-in-river-3101968,0.97,252,0,252
24,worldnews,"/r/WorldNews Live Thread: Russian Invasion of Ukraine Day 125, Part 1 (Thread #265)",https://www.reddit.com/live/18hnzysb1elcs,0.97,182,0,182
25,worldnews,"The government of Lithuania announced on Monday that it had been hit by an “intense” cyberattack, likely launched from Moscow",https://securityaffairs.co/wordpress/132676/cyber-warfare-2/lithuania-massive-ddos.html,0.99,141,0,141
