,subreddit,title,url,upvote_ratio,ups,downs,score
0,worldnews,King formally strips Andrew of prince title and HRH style,https://news.sky.com/story/king-formally-strips-andrew-of-prince-title-and-hrh-style-13464744,0.96,18207,0,18207
1,worldnews,Astronauts stranded in space after their return capsule is struck by object in orbit,https://uk.news.yahoo.com/astronauts-stranded-spacecraft-hit-suspected-071642519.html,0.97,17735,0,17735
2,worldnews,German nurse gets life in jail after killing 10 to reduce work,https://www.bbc.com/news/articles/cz0xgrv7543o?xtor=AL-71-%5Bpartner%5D-%5Bbbc.news.twitter%5D-%5Bheadline%5D-%5Bnews%5D-%5Bbizdev%5D-%5Bisapi%5D&amp;at_medium=social&amp;at_format=link&amp;at_link_origin=BBCWorld&amp;at_bbc_team=editorial&amp;at_ptr_name=twitter&amp;at_campaign_type=owned&amp;at_link_id=0C423CCC-BABA-11F0-8A47-90132AE393FF&amp;at_campaign=Social_Flow&amp;at_link_type=web_link,0.97,15927,0,15927
3,worldnews,"Russia Sending Mentally Disabled Men to Front to Replace Heavy Losses, Ukrainian Intel Says",https://united24media.com/latest-news/russia-sending-mentally-disabled-men-to-front-to-replace-heavy-losses-ukrainian-intel-says-13175,0.96,10278,0,10278
4,worldnews,Ukrainian drones with loudspeakers broadcast surrender instructions as Pokrovsk counterattack succeeds,https://euromaidanpress.com/2025/11/07/frontline-report-2025-11-06-2/,0.97,10181,0,10181
5,worldnews,"Russian Rebels Burn Dozens of Locomotives Supplying Putin’s War, HUR Says",https://www.kyivpost.com/post/63791,0.99,10141,0,10141
6,worldnews,"'I'm not going to represent our country there' — Trump to skip G20 summit, dashing hopes of brokering meeting between Zelensky, Putin",https://kyivindependent.com/im-not-going-to-represent-our-country-there-trump-to-skip-g20-summit-amid-criticism-of-south-africa/,0.96,4811,0,4811
7,worldnews,Boeing officially off the hook for criminal charges in deadly crashes that killed 346 people,https://www.cbc.ca/news/world/boeing-criminal-case-agreement-9.6969078,0.97,4544,0,4544
8,worldnews,Ukraine jails Russian soldier for life for killing POW in first such ruling,https://www.reuters.com/world/europe/ukraine-jails-russian-soldier-life-killing-pow-first-such-ruling-2025-11-06/,0.98,3909,0,3909
9,worldnews,Hamas weapons cache intended to target European Jewish institutions discovered in Vienna,https://www.jpost.com/international/islamic-terrorism/article-873017,0.83,2889,0,2889
10,worldnews,Rutte: NATO Now Outproduces Russia in Ammunition After Years of Lag,https://united24media.com/latest-news/rutte-nato-now-outproduces-russia-in-ammunition-after-years-of-lag-13168,0.98,2806,0,2806
11,worldnews,Germany Cracks Down On Muslim Groups Viewed As Threats To Its Constitutional Order,https://www.etvbharat.com/amp/en/international/germany-cracks-down-on-muslim-groups-viewed-as-threats-to-its-constitutional-order-enn25110504600,0.96,2447,0,2447
12,worldnews,Russia’s oil ghost fleet circles the oceans as buyers vanish - many are staying clear of Russiona oil,https://euromaidanpress.com/2025/11/05/russia-ghost-fleet-buyers-vanish/,0.97,2146,0,2146
13,worldnews,"Ukraine Enlists 2,000 Colombians to Reinforce Front Lines Against Russia: “My fighters fulfill their duties — and very successfully. I try to convey to them that they are accomplishing something great here, something that affects us all.”",https://thedefensepost.com/2025/11/05/ukraine-enlists-colombia-russia/,0.96,1678,0,1678
14,worldnews,"Child bride faces execution in Iran unless she pays £80,000 in ‘blood money’ | Global development",https://www.theguardian.com/global-development/2025/nov/03/child-bride-faces-execution-in-iran-unless-she-pays-80000-in-blood-money,0.94,1349,0,1349
15,worldnews,Trump Officials Accused of Bullying Tactics to Kill a Climate Measure,https://www.nytimes.com/2025/11/06/climate/trump-climate-international-bullying.html,0.97,1127,0,1127
16,worldnews,Ukrainian Forces Wipe Out Russian Shahed Launch Hub in Occupied Donetsk,https://www.kyivpost.com/post/63768,0.98,1061,0,1061
17,worldnews,Astronauts stranded in space after their return capsule is struck by mystery object in orbit,https://uk.news.yahoo.com/astronauts-stranded-spacecraft-hit-suspected-071642519.html?guccounter=1&amp;guce_referrer=aHR0cHM6Ly93d3cuZ29vZ2xlLmNvbS8&amp;guce_referrer_sig=AQAAAI3BRt1USh5dm7yDbHVZuxlI1Z-bQzeI-iCpCBXKCsQS8tlKjzxuL5KeV4fouH0-1_aiKOng4PMWFjQqn0SnAkXIZP8BTzRUhyDruC_Qz2cZ2NOShhMefc_PMTPub6wKkyif6CSk8uU1UlcbHrp1DK5_RnatqZoCnRIuiJ7BrvQV,0.93,806,0,806
18,worldnews,"Iran’s Main Dam Supplying Tehran to Run Dry Within Days: A major dam that supplies drinking water to Iran’s capital and a neighboring province will run out of water within 15 days, a water official said on Wednesday, as the country faces a deepening water crisis",https://iranwire.com/en/news/146117-irans-main-dam-supplying-tehran-to-run-dry-within-days/,0.95,537,0,537
19,worldnews,"US urges Europe to move faster to phase out Russian gas, expand pipeline networks to Ukraine",https://apnews.com/article/greece-trump-energy-ukraine-lng-gas-europe-a745cb9a96667d70e760cd9b30b7381a,0.96,508,0,508
20,worldnews,"NATO Overtakes Russia in Ammunition Production: ‘We Are Turning the Tide,’ Rutte Says",https://www.kyivpost.com/post/63774,0.98,502,0,502
21,worldnews,Ukrainian flag removed from Czech Parliament building,https://english.radio.cz/okamura-orders-removal-ukrainian-flag-parliament-building-8868142,0.91,489,0,489
22,worldnews,Norway suspends $2.1tn oil fund’s ethics rules to avoid selling Big Tech stakes,https://www.irishtimes.com/business/2025/11/05/norway-suspends-21tn-oil-funds-ethics-rules-to-avoid-selling-big-tech-stakes/,0.93,268,0,268
23,worldnews,Egypt says 36 stolen historic artifacts handed over by U.S. authorities,https://www.cbsnews.com/news/egypt-stolen-historic-artifacts-returned-by-us-authorities/,0.94,256,0,256
24,worldnews,"/r/WorldNews Live Thread: Russian Invasion of Ukraine Day 1352, Part 1 (Thread #1499)",https://www.reddit.com/live/18hnzysb1elcs,0.96,126,0,126
