,subreddit,title,url,upvote_ratio,ups,downs,score
0,worldnews,CNN: Russians are increasingly raping Ukrainian men on occupied territories,https://www.pravda.com.ua/eng/news/2024/06/4/7459183/,0.89,23824,0,23824
1,worldnews,WHO confirms first death in Mexico from bird flu never seen in humans,https://www.nbcnews.com/health/health-news/confirms-first-death-mexico-bird-flu-never-seen-humans-rcna155745,0.95,14419,0,14419
2,worldnews,Russia: Gazprom will need at least a decade to recover the gas sales volumes lost due to sanctions,https://www.agenzianova.com/en/news/Russia-Gazprom-will-need-at-least-a-decade-to-recover-the-gas-sales-volumes-lost-with-the-sanctions/,0.95,5395,0,5395
3,worldnews,Putin reportedly wears bulletproof vest at public events amid ‘unprecedented’ security,https://novayagazeta.eu/articles/2024/06/05/putin-reportedly-wears-bulletproof-vest-at-public-events-amid-unprecedented-security-en-news,0.96,3519,0,3519
4,worldnews,"French military instructors in Ukraine would be a 'legitimate target' and may already be active, says Russia",https://www.businessinsider.com/french-military-trainers-in-ukraine-would-be-legitimate-targets-russia-2024-6,0.95,3478,0,3478
5,worldnews,Spain’s Ramallah embassy plan stalls as diplomats unwilling to relocate,https://www.jns.org/spains-ramallah-embassy-plan-stalls-as-diplomats-unwilling-to-relocate/,0.93,3051,0,3051
6,worldnews,Tokyo government to launch dating app to boost birthrate,https://japantoday.com/category/national/tokyo-govt-to-launch-dating-app-to-boost-birth-rate,0.97,3051,0,3051
7,worldnews,UN chief says world is on ‘highway to climate hell’ as planet endures 12 straight months of unprecedented heat,https://edition.cnn.com/2024/06/05/climate/12-months-record-heat-un-speech/index.html,0.93,2834,0,2834
8,worldnews,Russian soldier who killed 7 comrades with grenade given 23-year sentence,https://novayagazeta.eu/articles/2024/06/05/russian-soldier-who-killed-7-comrades-with-grenade-given-23-year-sentence-en-news,0.97,2559,0,2559
9,worldnews,Putin warns that Russia could provide long-range weapons to others to strike Western targets,https://apnews.com/article/russia-putin-ukraine-e192904652221b29efdc88d0af23114e,0.93,2544,0,2544
10,worldnews,Ukraine Regains Ground in Kharkiv as Dozens of Russian Troops 'Surrender',https://www.newsweek.com/ukraine-kharkiv-russia-update-soldiers-surrender-1908029,0.97,1782,0,1782
11,worldnews,Gene therapy enables five children who were born deaf to hear,https://www.newscientist.com/article/2434183-gene-therapy-enables-five-children-who-were-born-deaf-to-hear/,0.98,1761,0,1761
12,worldnews,"Bowel disease breakthrough as researchers make ‘holy grail’ discovery - Researchers have discovered a major driver of inflammatory bowel disease (IBD) and several other immune disorders that affect the spine, liver and arteries, raising hopes for millions of people worldwide.",https://www.theguardian.com/society/article/2024/jun/05/bowel-disease-hope-researchers-find-biological-pathway,0.98,1733,0,1733
13,worldnews,World hits streak of record temperatures as UN warns of 'climate hell',https://www.reuters.com/sustainability/world-hits-streak-record-temperatures-un-warns-climate-hell-2024-06-05/,0.92,1182,0,1182
14,worldnews,Glaring Absence at D-Day Events Seals Russia's Pariah Status,https://www.kyivpost.com/post/33820,0.93,699,0,699
15,worldnews,WHO confirms first human case of avian influenza A(H5N2) in Mexico,https://www.reuters.com/world/americas/who-confirms-first-human-case-avian-influenza-ah5n2-mexico-2024-06-05/,0.93,698,0,698
16,worldnews,Jerusalem braces for Israeli nationalist flag march through Muslim Quarter,https://www.theguardian.com/world/article/2024/jun/05/jerusalem-israeli-nationalist-flag-march-muslim-areas,0.81,687,0,687
17,worldnews,Toyota apologizes for cheating on vehicle testing and halts production of three models,https://www.cnbc.com/2024/06/04/toyota-apologizes-for-cheating-on-vehicle-testing-and-halts-production-of-three-models.html?__source=iosappshare%7Ccom.apple.UIKit.activity.CopyToPasteboard,0.95,671,0,671
18,worldnews,Kremlin says US is blackmailing China by threatening sanctions over exports to Russia,https://www.reuters.com/world/kremlin-says-us-is-blackmailing-china-by-threatening-sanctions-over-exports-2024-06-05/,0.86,605,0,605
19,worldnews,"Explosive-laden drone attack injures 11 in Hurfeish, northern Israel - I24NEWS",https://www.i24news.tv/en/news/israel/diplomacy/artc-explosive-laden-drone-attack-injures-11-in-hurfeish-northern-israel,0.91,568,0,568
20,worldnews,Russia Destroys Over Half of Ukraine’s Power Generation – FT Reports,https://www.kyivpost.com/post/33825,0.87,398,0,398
21,worldnews,Putin warns that Russia could supply arms to other countries to strike west,https://www.theguardian.com/world/article/2024/jun/05/russia-ukraine-war-us-weapons,0.78,259,0,259
22,worldnews,"/r/WorldNews Live Thread: Russian Invasion of Ukraine Day 834, Part 1 (Thread #980)",https://www.reddit.com/live/18hnzysb1elcs,0.96,234,0,234
23,worldnews,Taliban publicly flogs 63 people including women accused of crimes. UN condemns it,https://abcnews.go.com/International/wireStory/taliban-publicly-flogs-63-people-including-women-accused-110866588,0.93,201,0,201
24,worldnews,/r/WorldNews Live Thread for Israel-Hamas War (Thread #52),https://www.reddit.com/live/1bsso361afr0r,0.74,150,0,150
25,worldnews,US expecting Russian naval exercises in Caribbean this summer,https://www.reuters.com/world/us-expecting-russian-naval-exercises-caribbean-this-summer-2024-06-05/,0.92,150,0,150
26,worldnews,Tajikistan Set To Outlaw Islamic Hijab After Years Of Unofficial Ban,https://www.rferl.org/a/tajikistan-islamic-hijab-ban-head-scarf/32979116.html,0.92,93,0,93
