,subreddit,title,url,upvote_ratio,ups,downs,score
0,worldnews,Belgium freezes Russian assets worth EUR 58 billion,https://news.yahoo.com/belgium-freezes-russian-assets-worth-095100114.html,0.97,14281,0,14281
1,worldnews,"At least 20 torture centers in Kherson were directly financed by the Kremlin, international lawyers say in a new report",https://www.cnbc.com/2023/03/02/ukraine-russia-war-kherson-torture-centers-financed-by-kremlin.html,0.97,11388,0,11388
2,worldnews,Putin signs bill to suspend last nuclear arms pact with US,https://apnews.com/article/russia-us-nuclear-pact-suspension-ukraine-putin-e579b7562fb816d899e037d1d271a8c5,0.96,7203,0,7203
3,worldnews,A mysterious fleet is helping Russia ship oil around the world. And it's growing | CNN Business,https://edition.cnn.com/2023/03/01/business/russia-oil-shadow-fleet/index.html,0.96,6859,0,6859
4,worldnews,Little Mermaid in Denmark vandalised with colours of Russian flag,https://www.theguardian.com/world/2023/mar/02/little-mermaid-denmark-vandalised-colours-russian-flag,0.93,5488,0,5488
5,worldnews,Scientists discover corridor in Great Pyramid of Giza,https://www.reuters.com/world/middle-east/scientists-discover-corridor-great-pyramid-giza-2023-03-02/,0.97,3226,0,3226
6,worldnews,Moldovan parliament condemns Russian invasion of Ukraine,https://news.yahoo.com/moldovan-parliament-condemns-russian-invasion-140940568.html,0.97,3079,0,3079
7,worldnews,Turkey taken to International Court for ‘crimes against humanity’,https://www.euractiv.com/section/politics/news/turkey-taken-to-international-court-for-crimes-against-humanity/,0.96,3023,0,3023
8,worldnews,"India Is Buying Russian Oil Below the Western Price Cap, US Officials Say.",https://www.bloomberg.com/news/articles/2023-03-01/india-is-buying-russian-oil-below-the-western-price-cap-officials-say,0.95,2500,0,2500
9,worldnews,"Anime-inspired teenage gangs that originated in Moscow plaguing streets of Ukraine's cities, Kyiv says",https://www.cnn.com/2023/03/02/europe/anime-inspired-russian-gangs-ukraine-intl/index.html,0.92,1913,0,1913
10,worldnews,Alarm Raised Over “Chilling Execution Spree” In Iran,https://iranwire.com/en/news/114364-rights-groups-denounce-chilling-execution-spree-in-iran/,0.97,1316,0,1316
11,worldnews,British Navy says it has seized smuggled Iranian weapons in Gulf,https://www.reuters.com/world/british-navy-says-it-has-seized-smuggled-iranian-weapons-gulf-2023-03-02/,0.96,1283,0,1283
12,worldnews,"Hungary further delays vote on Sweden, Finland joining NATO",https://apnews.com/article/hungary-delays-sweden-finland-nato-vote-508d7497259570c5fa15e547d8c4b005,0.93,927,0,927
13,worldnews,Russian politician charged for 'mocking' Putin with spaghetti video,https://www.jpost.com/omg/article-733238,0.95,816,0,816
14,worldnews,U.S. hosts war games for Ukraine ahead of next phase of Russia conflict,https://www.reuters.com/world/europe/us-hosts-war-games-ukraine-ahead-next-phase-russia-conflict-2023-03-02/,0.95,677,0,677
15,worldnews,"Carbon dioxide emissions reached a record high in 2022: Communities around the world emitted more carbon dioxide in 2022 than in any other year on records dating to 1900, a result of air travel rebounding from the pandemic and more cities turning to coal as a low-cost source of power.",https://apnews.com/article/climate-emissions-global-warming-carbon-dioxide-coal-494ef490f16abe381ea2a4107f779670,0.93,671,0,671
16,worldnews,Argentina pulls out of pact with UK on Falklands,https://www.brusselstimes.com/388221/argentina-pulls-out-of-pact-with-uk-on-falklands-malvinas,0.94,551,0,551
17,worldnews,Iranian Teachers Call For Protest Against School Chemical Attacks,https://www.iranintl.com/en/202303026672,0.97,503,0,503
18,worldnews,"Norway's government on Thursday apologized to indigenous Sami reindeer herders affected by wind farms that were declared illegal after they were built, following a week of protests by activists",https://www.france24.com/en/live-news/20230302-norway-apologises-for-illegal-wind-farms-on-indigenous-land,0.92,378,0,378
19,worldnews,"/r/WorldNews Live Thread: Russian Invasion of Ukraine Day 373, Part 1 (Thread #514)",https://www.reddit.com/live/18hnzysb1elcs,0.97,294,0,294
20,worldnews,Greece train crash: 57 people confirmed dead as public anger grows,https://www.bbc.com/news/world-europe-64820085,0.94,272,0,272
21,worldnews,'China loses more than 40 million workers as population ages',https://www.firstpost.com/world/china-loses-more-than-40-million-workers-as-population-ages-report-12230832.html,0.93,233,0,233
22,worldnews,Ukraine orders mandatory evacuation of vulnerable residents from the front-line city of Kupyansk and adjacent northeastern territories as fears mount Russia will retake the key city and rail hub,https://www.straitstimes.com/world/europe/ukraine-orders-vulnerable-residents-to-evacuate-front-line-city,0.91,189,0,189
23,worldnews,"Nearly 3,500 sea lions in Peru die of H5N1 bird flu",https://bnonews.com/index.php/2023/03/nearly-3500-sea-lions-in-peru-die-of-h5n1-bird-flu/,0.96,121,0,121
24,worldnews,iPhone Maker Foxconn plans $700 million India plant in shift From China,https://www.bloomberg.com/news/articles/2023-03-03/iphone-maker-plans-700-million-india-plant-in-shift-from-china,0.93,105,0,105
25,worldnews,"China is building six times more new coal plants than other countries, report finds",https://www.npr.org/2023/03/02/1160441919/china-is-building-six-times-more-new-coal-plants-than-other-countries-report-fin,0.89,85,0,85
