,subreddit,title,url,upvote_ratio,ups,downs,score
0,worldnews,Germany ends nuclear era as last reactors power down,https://www.euractiv.com/section/energy/news/germany-ends-nuclear-era-as-last-reactors-power-down/,0.88,22697,0,22697
1,worldnews,S. Korea fires warning shots after N. Korean patrol boat crosses maritime border,https://en.yna.co.kr/view/AEN20230416001551325,0.97,19153,0,19153
2,worldnews,One of the most prolific pro-Russia propaganda channels is run by a former US Navy officer living in Washington,https://www.businessinsider.com/russia-propoganda-social-media-run-former-us-naval-officer-2023-4,0.97,7381,0,7381
3,worldnews,Ukraine and Russia hold major Easter prisoners-of-war exchange,https://www.pravda.com.ua/eng/news/2023/04/16/7398073/,0.97,7190,0,7190
4,worldnews,US emerges as India's biggest trading partner in FY23 at $128.55 billion,https://www.businesstoday.in/latest/in-focus/story/us-emerges-as-indias-biggest-trading-partner-in-fy23-at-12855-billion-377549-2023-04-16,0.96,6794,0,6794
5,worldnews,Putin meets with China's defense minister in Moscow,https://news.yahoo.com/putin-meets-chinas-defense-minister-184917226.html?soc_src=social-sh&amp;soc_trk=tw&amp;tsrc=twtr,0.96,6051,0,6051
6,worldnews,NATO member Finland breaks ground on Russia border fence,https://www.abc.net.au/news/2023-04-16/nato-member-finland-breaks-ground-on-russia-border-fence/102228216,0.97,5063,0,5063
7,worldnews,"Polish PM Says Relations With Hungary 'Changed A Lot' Over Ukraine, Now Looking To Romania, Baltic States",https://www.rferl.org/a/poland-hungary-relations-morawiecki-romania-baltic/32362722.html,0.96,2957,0,2957
8,worldnews,"EU says unilateral trade action unacceptable after Poland, Hungary ban Ukraine grain, food imports",https://www.reuters.com/world/europe/polish-ban-ukrainian-grain-food-imports-apply-transit-says-minister-2023-04-16/,0.96,2910,0,2910
9,worldnews,Bavaria mulls reopening nuclear plant under state control,https://www.dw.com/en/germany-bavaria-mulls-reopening-nuclear-plant-under-state-control/a-65336730,0.95,2768,0,2768
10,worldnews,Peruvian archaeologists unearth 500-year-old Inca ceremonial bath,https://www.reuters.com/lifestyle/peruvian-archaeologists-unearth-500-year-old-inca-ceremonial-bath-2023-04-14/,0.97,2319,0,2319
11,worldnews,Islamic State attack on Syrian truffle hunters kills at least 26,https://www.abc.net.au/news/2023-04-17/is-attack-syria-truffle-hunters-kill-26/102229768,0.96,2009,0,2009
12,worldnews,"/r/WorldNews Live Thread: Russian Invasion of Ukraine Day 417, Part 1 (Thread #558)",https://www.reddit.com/live/18hnzysb1elcs,0.95,1809,0,1809
13,worldnews,"Russians boasted that just 1% of fake social profiles are caught, leak shows: The estimate is contained in a document that is part of a trove of top-secret material leaked in a Discord chatroom",https://www.washingtonpost.com/technology/2023/04/16/russia-disinformation-discord-leaked-documents/,0.95,1689,0,1689
14,worldnews,Former Indian lawmaker killed live on TV while in police custody | CNN,https://edition.cnn.com/2023/04/16/india/former-indian-lawmaker-killed-intl/index.html,0.9,1661,0,1661
15,worldnews,UN report: Modern weapons being smuggled to Haiti from US,https://apnews.com/article/haiti-weapons-gangs-us-trafficking-f06bfb0a7d3b46a1e14ebd7bea95fd71,0.94,1485,0,1485
16,worldnews,"S. Korea, U.S. to kick off large-scale combined air drills this week | Yonhap News Agency",https://m-en.yna.co.kr/view/AEN20230416000900325,0.95,1166,0,1166
17,worldnews,France seeks to reassure Taiwan over Macron’s controversial remarks,https://www.france24.com/en/europe/20230416-france-seeks-to-reassure-taiwan-over-macron-s-controversial-remarks,0.93,897,0,897
18,worldnews,US conducts raid against ISIS fighters in Syria: Official,https://abcnews.go.com/International/us-conducts-raid-isis-fighters-syria-official/story?id=98625209,0.97,827,0,827
19,worldnews,"Iran has sentenced 10 members of the armed forces to prison after finding them guilty of involvement in the downing of a Ukrainian airliner. Iranian forces shot down Ukraine International Airlines flight PS752 shortly after its takeoff from Tehran on January 8, 2020, killing all 176 people on board",https://www.rfi.fr/en/international-news/20230416-iran-court-jails-10-troops-over-2020-ukraine-jet-downing,0.97,698,0,698
20,worldnews,Zelenskyy Calls For ‘Security Guarantees’ For Ukraine As Putin Ally Urges Moscow To End Fighting,https://www.eurasiareview.com/17042023-zelenskyy-calls-for-security-guarantees-for-ukraine-as-putin-ally-urges-moscow-to-end-fighting/,0.94,442,0,442
21,worldnews,"Iran's Quds Force ordered rocket barrages at Israel from Gaza, Lebanon",https://www.jpost.com/breaking-news/article-739260,0.92,426,0,426
22,worldnews,"Six soldiers killed, 30 missing in attempt to rescue kidnapped pilot in West Papua | Indonesia",https://www.theguardian.com/world/2023/apr/17/six-soldiers-killed-30-missing-in-attempt-to-rescue-kidnapped-pilot-in-west-papua,0.95,320,0,320
23,worldnews,EU rejects Ukraine grain bans by Poland and Hungary,https://www.bbc.com/news/world-europe-65292698,0.93,253,0,253
24,worldnews,31 People Collecting Truffles In Syrian Desert Killed By ISIS: Report,https://www.ndtv.com/world-news/26-people-collecting-truffles-in-syrian-desert-killed-by-isis-report-3953286?fbclid=PAAabjZ8X57k7J7l65OS_4iSetKeXjV1IdBlEjWqcxYeYfBUmMgtKqySMXMd8,0.93,120,0,120
25,worldnews,US warship sails through Taiwan Strait following China war games,https://www.aljazeera.com/news/2023/4/17/us-warship-sails-through-taiwan-strait-following-china-war-games,0.91,81,0,81
