,subreddit,title,url,upvote_ratio,ups,downs,score
0,worldnews,Ukraine rips Elon Musk for disrupting sneak attack on Russian fleet with Starlink cutoff,https://www.cnbc.com/2023/09/07/ukraine-rips-musk-disrupting-sneak-attack-russian-navy.html,0.84,45989,0,45989
1,worldnews,Putin's mouthpiece lashed out after the US announced plan to send $5.4 million in seized Russian oligarch funds to Ukrainian veterans,https://www.businessinsider.com/russian-oligarchs-millions-funds-ukraine-vets-state-department-2023-9,0.95,16263,0,16263
2,worldnews,Anti-Putin Russians Kill FSB Border Guard During Cross-Border Raid,https://www.kyivpost.com/post/21361,0.98,8167,0,8167
3,worldnews,Police discover 80 Russian torture chambers in Ukraine,https://www.ukrinform.net/rubric-ato/3758961-police-discover-80-russian-torture-chambers-in-ukraine.html,0.96,6544,0,6544
4,worldnews,1.2m Palestinians face devastating humanitarian crisis because of US aid block,https://www.middleeastmonitor.com/20230907-1-2m-palestinians-face-devastating-humanitarian-crisis-because-of-us-aid-block/,0.82,5154,0,5154
5,worldnews,Cuba arrests 17 for trafficking young men to fight for Russia in Ukraine,https://www.reuters.com/world/cuba-arrests-17-trafficking-young-men-fight-russia-ukraine-2023-09-08/,0.98,4743,0,4743
6,worldnews,Ukraine's Zelensky says Putin killed mercenary boss Prigozhin,https://www.jpost.com/breaking-news/article-758198,0.96,3723,0,3723
7,worldnews,Ukraine's Foreign Ministry calls on world not to recognise ''elections'' in occupied territories and initiates new sanctions,https://www.pravda.com.ua/eng/news/2023/09/8/7418963/,0.97,2697,0,2697
8,worldnews,More than half of Wagner Group camp in Belarus dismantled,https://www.pravda.com.ua/eng/news/2023/09/8/7418962/,0.98,1876,0,1876
9,worldnews,"Ireland will unite in my lifetime – and must protect its British minority, says Leo Varadkar",https://www.telegraph.co.uk/news/2023/09/08/leo-varadkar-ireland-unite-in-my-lifetime-british-minority/,0.91,1848,0,1848
10,worldnews,‘A critical moment’: UN warns world will miss climate targets unless fossil fuels phased out,https://www.theguardian.com/environment/2023/sep/08/un-report-calls-for-phasing-out-of-fossil-fuels-as-paris-climate-goals-being-missed,0.93,1575,0,1575
11,worldnews,Lithuania to supply Ukraine with 1.5 million projectiles,https://www.pravda.com.ua/eng/news/2023/09/8/7419021/,0.97,1132,0,1132
12,worldnews,Outcry over official Spanish definition of Jew as 'greedy or usurious' person,https://www.timesofisrael.com/outcry-over-official-spanish-definition-of-jew-as-greedy-or-usurious-person/,0.91,771,0,771
13,worldnews,"Scientists grow whole model of human embryo, without sperm or egg",https://www.bbc.com/news/health-66715669,0.96,766,0,766
14,worldnews,Syrians tear down poster of Assad in Syria as protests swell,https://www.jpost.com/middle-east/article-758193,0.97,726,0,726
15,worldnews,Russia summons Armenia's ambassador as ties fray and exercises with US troops approach,https://apnews.com/article/russia-armenia-ambassador-us-military-exercises-bae87ab453d2db84cebf910673f65011,0.96,710,0,710
16,worldnews,Germany charges two men with treason in Russia spying case,https://www.dw.com/en/germany-charges-two-men-with-treason-in-russia-spying-case/a-66761064,0.97,492,0,492
17,worldnews,Ukraine will be ready for EU membership in 2 years – official,https://www.pravda.com.ua/eng/news/2023/09/8/7419065/,0.92,475,0,475
18,worldnews,Magnitude 7 earthquake strikes Morocco - GFZ,https://www.reuters.com/world/africa/magnitude-7-earthquake-strikes-morocco-gfz-2023-09-08/,0.96,465,0,465
19,worldnews,EU purchases of Russian LNG up 40% compared to pre-war levels.,https://www.euronews.com/my-europe/2023/08/30/eu-purchases-of-russian-lng-up-40-compared-to-pre-war-levels-new-study-finds,0.86,351,0,351
20,worldnews,UN: 'Elections' in Russian-Occupied Areas of Ukraine Have 'No Legal Ground',https://www.voanews.com/a/un-russian-elections-in-ukrainian-occupied-territories-have-no-legal-ground-/7260440.html,0.97,288,0,288
21,worldnews,"/r/WorldNews Live Thread: Russian Invasion of Ukraine Day 563, Part 1 (Thread #709)",https://www.reddit.com/live/18hnzysb1elcs,0.98,250,0,250
22,worldnews,Environmentalists condemn Australia’s ‘woeful record’ after 48 plants and animals added to threatened species list,"https://www.theguardian.com/australia-news/2023/sep/07/environmentalists-condemn-australias-woeful-record-after-48-plants-and-animals-added-to-threatened-species-list#:~:text=%E2%80%9CWe%20need%20stronger%20laws%20to,our%20unique%20animals%20and%20plants.",0.94,218,0,218
23,worldnews,Northern Ireland: Call for calm as police attacked with petrol bombs and missiles in Derry,https://www.breakingnews.ie/ireland/call-for-calm-as-police-attacked-with-petrol-bombs-and-missiles-in-derry-1524174.html,0.95,207,0,207
24,worldnews,Japan foreign minister Hayashi makes unannounced visit to Ukraine,https://english.kyodonews.net/news/2023/09/a3fd291acc37-urgent-japan-foreign-minister-hayashi-makes-unannounced-visit-to-ukraine.html,0.94,109,0,109
25,worldnews,Morocco earthquake: 296 killed as buildings damaged,https://www.bbc.com/news/world-africa-66759069,0.95,76,0,76
