,subreddit,title,url,upvote_ratio,ups,downs,score
0,worldnews,Russia fines Wikipedia for publishing facts instead of Kremlin war propaganda,https://arstechnica.com/tech-policy/2023/02/russia-fines-wikipedia-for-publishing-facts-instead-of-kremlin-war-propaganda/,0.87,58717,0,58717
1,worldnews,US seeks allies' backing for possible China sanctions over Ukraine war,https://news.yahoo.com/exclusive-us-seeks-allies-backing-201612215.html,0.91,32768,0,32768
2,worldnews,Finnish parliament passes NATO bill,https://www.jpost.com/breaking-news/article-733060,0.97,13562,0,13562
3,worldnews,Moscow accuses Ukraine of multiple attempted drone strikes deep inside Russian territory,https://edition.cnn.com/2023/03/01/europe/russia-ukraine-drones-alleged-attacks-intl-hnk/index.html,0.95,11147,0,11147
4,worldnews,Hungary's ruling party to back Finland and Sweden's NATO bid,https://www.jpost.com/breaking-news/article-733107,0.97,6339,0,6339
5,worldnews,"""Today, we can say that Russia's energy blackmail has failed"": EU looks set to end the winter heating season with its gas storage facilities more than half full, despite a huge drop in Russian pipeline gas supplies, says EU energy commissioner Kadri Simson.",https://www.montelnews.com/news/1447137/eu-to-end-winter-with-gas-storage-over-50-full--ec,0.97,6322,0,6322
6,worldnews,South Korea's Yoon says Japan changed from aggressor to partner,https://english.kyodonews.net/news/2023/03/3d039138feed-s-koreas-yoon-says-japan-changed-from-aggressor-to-partner.html,0.97,6139,0,6139
7,worldnews,"Eduardo Mendúa, Ecuadorian Who Fought Oil Extraction on Indigenous Land, Is Shot to Death",https://insideclimatenews.org/news/28022023/eduardo-mendua-ecuador-shot-death/,0.98,5285,0,5285
8,worldnews,Swiss bankers face trial accused of helping Putin's friend transfer cash,https://www.reuters.com/business/finance/swiss-bankers-face-trial-accused-helping-putins-friend-transfer-cash-2023-03-01/,0.97,4759,0,4759
9,worldnews,"Russia's oil and gas revenue plunged 40% in January as western sanctions take a toll, IEA says",https://markets.businessinsider.com/news/commodities/russias-oil-gas-western-sanctions-war-ukraine-price-cap-eu-2023-3,0.97,3166,0,3166
10,worldnews,Putin paying Palestinians to fight in Ukraine,https://www.jpost.com/international/article-732932,0.91,2219,0,2219
11,worldnews,"India, world's largest democracy, leads global list of internet shutdowns",https://edition.cnn.com/2023/03/01/tech/internet-shutdowns-india-report-intl-hnk/index.html,0.91,1961,0,1961
12,worldnews,"Gas Attacks On 10 Girls' Schools In Iran, Over 100 Hospitalised: Report",https://www.ndtv.com/world-news/gas-attacks-on-10-girls-schools-in-iran-over-100-hospitalised-report-3825872,0.96,1714,0,1714
13,worldnews,Iran nuclear: IAEA inspectors find uranium particles enriched to 83.7%,https://www.bbc.com/news/world-middle-east-64810145,0.94,981,0,981
14,worldnews,US slams Israeli minister’s ‘disgusting’ comments about Palestinian village.,https://english.alarabiya.net/News/middle-east/2023/03/01/US-slams-Israeli-minister-s-repugnant-and-disgusting-comments-on-Palestinian-vill,0.88,753,0,753
15,worldnews,"Kherson torture centres were planned by Russian state, say lawyers",https://www.theguardian.com/world/2023/mar/02/kherson-torture-centres-were-planned-by-russian-state-say-lawyers,0.95,686,0,686
16,worldnews,"In an Epic Battle of Tanks, Russia Was Routed, Repeating Earlier Mistakes",https://www.nytimes.com/2023/03/01/world/europe/ukraine-russia-tanks.html,0.94,508,0,508
17,worldnews,German Court Places Limits On Mass Surveillance Enabled By Peter Thiel’s Palantir Software,https://www.techdirt.com/2023/02/28/german-court-places-limits-on-mass-surveillance-enabled-by-peter-thiels-palantir-software/,0.96,339,0,339
18,worldnews,"/r/WorldNews Live Thread: Russian Invasion of Ukraine Day 372, Part 1 (Thread #513)",https://www.reddit.com/live/18hnzysb1elcs,0.98,303,0,303
19,worldnews,Al Qaeda leader in Yemen killed in airstrike attributed to US - report,https://www.jpost.com/middle-east/article-733095,0.95,296,0,296
20,worldnews,Russia won't go dry: Indian liquors to replace Western brands in Moscow,https://www.msn.com/en-in/news/world/russia-won-t-go-dry-indian-liquors-to-replace-western-brands-in-moscow/amp/ar-AA185DSJ,0.88,237,0,237
21,worldnews,"A new Moai, one of Easter Island's iconic statues, was found in the bed of a dry laguna in a volcano crater, the Indigenous community that administers the site on the Chilean island has said",https://www.france24.com/en/live-news/20230301-new-moai-statue-found-in-easter-island-volcano-crater-laguna,0.97,182,0,182
22,worldnews,Nato boss Jens Stoltenberg says Ukraine to join bloc in 'long term',https://www.bbc.co.uk/news/world-europe-64797212,0.91,158,0,158
23,worldnews,"Kherson torture centres were planned by Russian state, say lawyers | Ukraine | The Guardian",https://www.theguardian.com/world/2023/mar/02/kherson-torture-centres-were-planned-by-russian-state-say-lawyers?CMP=Share_AndroidApp_Other,0.95,96,0,96
24,worldnews,"Chinese app TikTok a 'potential national security risk', says White House",https://www.business-standard.com/article/international/chinese-app-tiktok-a-potential-national-security-risk-says-white-house-123030200103_1.html,0.92,82,0,82
25,worldnews,Russian man detained over daughter’s pro-Ukraine drawings | Russia,https://www.theguardian.com/world/2023/mar/01/russian-detained-over-anti-war-statements-and-daughter-taken-into-care,0.85,61,0,61
