,subreddit,title,url,upvote_ratio,ups,downs,score
0,worldnews,"IDF strikes Hezbollah underground headquarters, kills 50 terrorists",https://www.jpost.com/breaking-news/article-823804,0.7,18694,0,18694
1,worldnews,"Osama bin Laden's son ordered to leave France, says minister",https://www.lemonde.fr/en/politics/article/2024/10/08/osama-bin-laden-s-son-ordered-to-leave-france-says-minister_6728613_5.html,0.96,15595,0,15595
2,worldnews,"North Korean soldiers are likely dying for Putin in Ukraine, Seoul says",https://www.politico.eu/article/north-korean-soldiers-are-likely-fighting-in-ukraine-seouls-defense-minister-says/,0.97,12214,0,12214
3,worldnews,Putin’s villa demolished amid fears of Ukrainian attack,https://tvpworld.com/82720372/putins-villa-demolished-amid-fears-of-ukrainian-attack,0.97,10775,0,10775
4,worldnews,Hezbollah calls for unconditional cease-fire regardless of fighting in Gaza,https://www.ynetnews.com/article/h1huyrz1ye,0.91,3881,0,3881
5,worldnews,Hezbollah endorses Lebanon ceasefire efforts for the first time as Israel ramps up offensive,https://edition.cnn.com/2024/10/08/middleeast/hezbollah-endorses-lebanon-ceasefire-first-time-israel-war-intl/index.html,0.93,3881,0,3881
6,worldnews,"For a second day, Ukrainian hackers hit Russian institutions ",https://www.washingtonpost.com/world/2024/10/08/russia-ukraine-hack-vgtrk-courts/?utm_campaign=wp_main&amp;utm_medium=social&amp;utm_source=reddit.com,0.97,3428,0,3428
7,worldnews,Ukraine strikes a Russian oil hub as Zelenskyy says the war is in 'a very important phase',https://apnews.com/article/russia-ukraine-war-crimea-oil-terminal-1d78b9819d1c4680a3f1ab8b34a24a6a,0.98,3230,0,3230
8,worldnews,"Israel says senior Hezbollah official probably dead, Hezbollah backs truce efforts",https://www.reuters.com/world/middle-east/hezbollah-strikes-israel-gaza-war-anniversary-fears-grow-over-middle-east-2024-10-07/,0.93,3044,0,3044
9,worldnews,"Hungary blocks EU sanctions changes, holding up $50 billion G7 loan package for Ukraine",https://kyivindependent.com/hungary-to-hold-up-50-billion-g7-loan-for-ukraine-until-after-the-us-election/,0.97,1879,0,1879
10,worldnews,"Iran threatens to escalate if Israel attacks, says nuclear or oil targets a ‘red line’",https://www.timesofisrael.com/iran-threatens-to-escalate-if-israel-attacks-says-nuclear-or-oil-targets-a-red-line/,0.9,1772,0,1772
11,worldnews,Netanyahu issues ultimatum on Gallant trip to US: Talk to Biden and Cabinet approval,https://www.ynetnews.com/article/hkasd1mkjg,0.86,1440,0,1440
12,worldnews,"Ukraine ignites Russian strategic bases, flames span from Crimea to Urals",https://euromaidanpress.com/2024/10/08/frontline-report-ukraine-ignites-russian-strategic-bases-flames-span-from-crimea-to-urals/,0.98,1170,0,1170
13,worldnews,"Netanyahu: Israel killed ‘Nasrallah’s replacement, and his replacement’s replacement’",https://www.timesofisrael.com/netanyahu-israel-killed-nasrallahs-replacement-and-his-replacements-replacement,0.91,1006,0,1006
14,worldnews,"Russia blocks instant messaging platform Discord, TASS reports",https://www.reuters.com/technology/russia-blocks-instant-messaging-platform-discord-tass-reports-2024-10-08/,0.96,966,0,966
15,worldnews,"/r/WorldNews Live Thread: Russian Invasion of Ukraine Day 957, Part 1 (Thread #1104)",https://www.reddit.com/live/18hnzysb1elcs,0.96,929,0,929
16,worldnews,"Vancouver anti-Israeli protester burns flag, shouts 'death to Canada'",https://nationalpost.com/news/canada/anti-israeli-protesters-burn-canadian-flag,0.88,867,0,867
17,worldnews,"Foxconn building Nvidia superchip facility in Mexico, execs say",https://www.reuters.com/technology/foxconn-says-it-is-building-worlds-largest-manufacturing-facility-for-nvidias-2024-10-08/,0.96,725,0,725
18,worldnews,Pierre Poilievre says Israel preventing Iran from getting nuclear weapons would be a ‘gift’ to humanity,https://www.thestar.com/politics/federal/pierre-poilievre-says-israel-preventing-iran-from-getting-nuclear-weapons-would-be-a-gift-to/article_e354f304-859a-11ef-8047-f390e2d228d5.html,0.87,713,0,713
19,worldnews,Musk's X gets OK to resume service in Brazil after bending to top court's demands,https://www.reuters.com/technology/brazil-attorney-general-backs-reinstating-social-medial-platform-x-2024-10-08/,0.92,705,0,705
20,worldnews,Hamas has moved its command centers into Gazan schools,https://m.jpost.com/israel-news/article-823796,0.79,668,0,668
21,worldnews,UN rights chief warns of ‘widespread and systematic’ torture of Ukrainian POWs,https://news.un.org/en/story/2024/10/1155491,0.96,421,0,421
22,worldnews,Putin Abandons and Destroys Black Sea Villa in Another Sign of Growing Paranoia,https://www.kyivpost.com/post/40182,0.96,411,0,411
23,worldnews,US Group Offers $1 Million for Gaza LGBTQ Pride Parade,https://themedialine.org/people/us-group-offers-1-million-for-gaza-lgbtq-pride-parade/,0.75,284,0,284
24,worldnews,/r/WorldNews Live Thread: Israel at War (Thread #71),https://www.reddit.com/live/1bsso361afr0r,0.83,274,0,274
25,worldnews,Leaders condemn B.C. rally where 'death to Canada' cry went up,https://www.cbc.ca/news/canada/british-columbia/death-to-canada-vancouver-rally-1.7346760,0.91,165,0,165
26,worldnews,A Cartel Double-Cross Turns a Mexican State Into a War Zone,https://www.nytimes.com/2024/10/08/world/americas/mexico-sinaloa-cartel-war.html?smid=re-share,0.98,141,0,141
