,subreddit,title,url,upvote_ratio,ups,downs,score
0,worldnews,"President Volodymyr Zelenskyy ""We have received political signals at the highest level – good signals – including from the United States, from our European friends. According to all reports, aid shipments have been restored.""",https://kyivindependent.com/aid-shipments-have-been-restored-zelensky-says-amid-halt-of-us-weapons-deliveries/,0.96,26190,0,26190
1,worldnews,Trump announces 30% tariffs on EU and Mexico,https://www.reuters.com/business/trump-announces-30-tariffs-eu-2025-07-12/,0.94,15821,0,15821
2,worldnews,"Admiral Kuznetsov, Russia’s only aircraft carrier, set to be scrapped after years of setbacks",https://economictimes.indiatimes.com/news/international/us/admiral-kuznetsov-russias-only-aircraft-carrier-set-to-be-scrapped-after-years-of-setbacks/articleshow/122401973.cms,0.98,8553,0,8553
3,worldnews,Siberian Pipeline Blast Reportedly Halts Gas Flow to Russian Arms Factories,https://united24media.com/latest-news/siberian-pipeline-blast-reportedly-halts-gas-flow-to-russian-arms-factories-9835,0.98,7602,0,7602
4,worldnews,NATO Ally Bordering Russia Withdraws From International Weapons Treaty,https://www.newsweek.com/nato-ally-bordering-russia-withdraws-international-weapons-treaty-2098107,0.81,6999,0,6999
5,worldnews,Chinese Naval Vessel Spotted Off Hawaiian Coast,https://ijr.com/chinese-naval-vessel-spotted-off-hawaiian-coast/,0.95,5924,0,5924
6,worldnews,"Putin urges Iran to take ""zero enrichment"" nuclear deal with U.S.",https://www.axios.com/2025/07/12/putin-iran-nuclear-deal-uranium-enrichment,0.96,4312,0,4312
7,worldnews,World Bank mobilises $80 billion to reconstruct Ukraine,https://www.vaticannews.va/en/world/news/2025-07/world-bank-mobilises-80-billion-reconstruct-ukraine-bjerde.html,0.98,3089,0,3089
8,worldnews,"Germany-funded long-range weapons to arrive in Ukraine by late July, general says",https://kyivindependent.com/germany-funded-long-range-arms-to-arrive-in-ukraine-by-late-july-general-says/,0.98,2761,0,2761
9,worldnews,"Taiwan says it detected 11 Chinese aircraft, 7 naval vessels, 1 ship as it prepares to resist China's invasion | Today News",https://www.livemint.com/news/world/taiwan-says-it-detected-11-chinese-aircraft-7-naval-vessels-1-ship-as-it-prepares-to-resist-chinas-invasion-11752372501054.html,0.9,2692,0,2692
10,worldnews,"As Israel strikes Yemen, investigation reveals UN funding Houthis' massive oil tanker",https://www.haaretz.com/israel-news/security-aviation/2025-07-09/ty-article/as-israel-strikes-yemen-investigation-reveals-un-funding-houthis-massive-oil-tanker/00000197-ee33-d0a0-a1df-eeff2e5e0000,0.83,2301,0,2301
11,worldnews,"""Unnecessary trade barriers"": US hits out at India's dairy certificate requirements at WTO",https://timesofindia.indiatimes.com/business/india-business/unnecessary-trade-barriers-us-hits-out-at-indias-dairy-certificate-requirements-at-wto-raises-issue-amidst-trade-deal-talks/articleshow/122383325.cms,0.95,1927,0,1927
12,worldnews,"Russia warns US, South Korea and Japan against forming security alliance targeting North Korea",https://apnews.com/article/north-korea-russia-lavrov-us-27e06451ab945fbfc74d9703fac7b581,0.95,1759,0,1759
13,worldnews,Top Russian diplomat meets North Korea’s Kim Jong Un as Pyongyang is pulled deeper into Ukraine war,https://www.cnn.com/2025/07/11/asia/russia-north-korea-lavrov-ukraine-intl-hnk,0.98,1237,0,1237
14,worldnews,"UN: Russian attacks kill 232 Ukrainian civilians in June, highest monthly toll in three years",https://euromaidanpress.com/2025/07/12/june-becomes-deadliest-month-for-ukraine-civilians-as-russia-escalates-terror-attacks-tenfold/,0.96,954,0,954
15,worldnews,EU's von der Leyen warns of countermeasures if U.S. 30% tariffs go ahead,https://www.reuters.com/world/eus-von-der-leyen-warns-countermeasures-if-us-30-tariffs-go-ahead-2025-07-12/?taid=68726a7adef8870001ced3f6&amp;utm_campaign=trueAnthem:+Trending+Content&amp;utm_medium=trueAnthem&amp;utm_source=twitter,0.96,930,0,930
16,worldnews,"US demands clarity from allies on their role in potential war over Taiwan, FT reports",https://www.reuters.com/world/china/us-demands-clarity-allies-their-role-potential-war-over-taiwan-ft-reports-2025-07-12/,0.94,900,0,900
17,worldnews,Germany’s Drone Killer in Action: Ukraine Deploys Skynex to Destroy 7 Russian Shaheds Overnight,https://united24media.com/latest-news/germanys-drone-killer-in-action-ukraine-deploys-skynex-to-destroy-7-russian-shaheds-overnight-9842,0.98,871,0,871
18,worldnews,"Indigenous leaders call for cancellation of Kneecap concerts over alleged support for Hamas, Hezbollah: ""allowing the Irish hip-hop group to perform its four sold-out shows in Canada would constitute a defilement of the land""",https://nationalpost.com/news/canada/indigenous-leaders-call-for-cancellation-of-kneecap-concerts-over-alleged-support-for-hamas-hezbollah,0.66,650,0,650
19,worldnews,"Russia attacks Ukraine again with drones and missiles, killing two",https://www.reuters.com/world/russias-drones-missile-barrage-targets-ukraines-west-kills-two-2025-07-12/,0.94,553,0,553
20,worldnews,HSBC becomes first UK bank to quit industry’s net zero alliance,https://www.theguardian.com/business/2025/jul/11/hsbc-leaves-net-zero-banking-alliance-climate-crisis,0.94,397,0,397
21,worldnews,"Russia and Belarus plan to create AI model based on ""traditional values""",https://www.pravda.com.ua/eng/news/2025/07/11/7521365/index.amp,0.89,298,0,298
22,worldnews,"As South Korea becomes a key arms supplier to US allies, its best customer is on the edge of a warzone | CNN",https://www.cnn.com/2025/07/12/asia/poland-south-korea-tank-deal-intl-hnk-ml,0.96,260,0,260
23,worldnews,Cambodian sites of Khmer Rouge brutality added to UNESCO heritage list,https://apnews.com/article/cambodia-khmer-rouge-unesco-072f06ec2039fd2fb0a6496cbc3dd20c,0.95,218,0,218
24,worldnews,Iranian advisor posts video depicting nuclear strike on Israel,https://www.jpost.com/middle-east/iran-news/article-860794,0.83,171,0,171
25,worldnews,"/r/WorldNews Live Thread: Russian Invasion of Ukraine Day 1235, Part 1 (Thread #1382)",https://www.reddit.com/live/18hnzysb1elcs,0.93,120,0,120
