,subreddit,title,url,upvote_ratio,ups,downs,score
0,worldnews,Border guards: Ukraine troops reach border with Russia in Kharkiv region’s north,https://www.ukrinform.net/rubric-ato/3569308-border-guards-ukraine-troops-reach-border-with-russia-in-kharkiv-regions-north.html,0.93,57167,0,57167
1,worldnews,Xi leaves China for first time since COVID pandemic began to meet Putin,https://www.reuters.com/world/china/xi-leaves-china-first-time-since-covid-pandemic-began-meet-putin-2022-09-11/,0.93,31848,0,31848
2,worldnews,Zelensky says it’s ‘not even possible’ that Trump did not recognize Putin threat,https://thehill.com/policy/international/3638376-zelensky-says-its-not-even-possible-that-trump-did-not-recognize-putin-threat/,0.93,10973,0,10973
3,worldnews,World's Largest Container Line Reroutes Around Endangered Blue Whales,https://www.businessinsider.com/worlds-largest-container-line-reroutes-around-endangered-blue-whales-2022-9,0.98,10904,0,10904
4,worldnews,Putin loyalist Kadyrov criticises Russian army’s performance over Ukraine retreat,https://www.theguardian.com/world/2022/sep/11/putin-loyalist-kadyrov-criticises-russian-armys-performance-over-ukraine-retreat,0.97,6530,0,6530
5,worldnews,Germany urges swift support for counteroffensive,https://m.dw.com/en/russia-ukraine-updates-germany-urges-swift-support-for-counteroffensive/a-63083738,0.97,5721,0,5721
6,worldnews,Russian classical pianist Polina Osetinskaya had another concert canceled in her home country after she spoke out against Moscow’s invasion of Ukraine,https://www.rferl.org/a/russian-pianist-osetinskaya-canceled-concerts-anti-war-views/32028768.html,0.97,5261,0,5261
7,worldnews,"Ukraine's Zaporizhzhia nuclear power plant has been shut down for safety, operator says, after repeated warnings of a radiation disaster",https://www.businessinsider.com/zaporizhzhia-power-plant-stopped-safety-operator-says-2022-9?utm_source=feedly&amp;utm_medium=webfeeds,0.98,4870,0,4870
8,worldnews,Lithuania set to open Taiwan representative office and risk further anger from Beijing,https://www.scmp.com/news/china/diplomacy/article/3192109/lithuania-set-open-taiwan-representative-office-and-risk?module=lead_hero_story&amp;pgtype=homepage,0.97,2929,0,2929
9,worldnews,"Paris plans to turn off Eiffel Tower's lights early to save electricity, report says",https://www.businessinsider.com/paris-to-turn-off-eiffel-tower-lights-early-save-electricity-2022-9,0.97,2727,0,2727
10,worldnews,"Sweden's right-wing opposition parties are on track to win a narrow majority of 175 seats in the 349-seat parliament on Sunday, the country's election authority says as 78% of districts have reported results.",https://www.reuters.com/world/europe/swedens-right-wing-win-majority-parliamentary-seats-preliminary-election-result-2022-09-11/,0.95,1896,0,1896
11,worldnews,"Putin says Nord Stream gas pipeline to Europe ‘practically’ closed, blames West for crisis",https://americanmilitarynews.com/2022/09/putin-says-nord-stream-gas-pipeline-to-europe-practically-closed-blames-west-for-crisis/,0.93,1844,0,1844
12,worldnews,King Charles III won't have to pay inheritance tax on $750 million estate,https://www.axios.com/2022/09/11/king-charles-inheritance-tax-queen-elizabeth,0.9,1213,0,1213
13,worldnews,"Antigua and Barbuda to vote on whether to remove British monarch as head of state, PM says",https://www.cnn.com/2022/09/11/americas/antigua-barbuda-referendum-republic-king-charles-intl/index.html,0.96,1070,0,1070
14,worldnews,"Ukraine region of Kharkiv reports blackouts, water cuts after Russian attacks, governor says",https://www.reuters.com/world/europe/ukraine-region-kharkiv-reports-blackouts-water-cuts-after-russian-attacks-2022-09-11/,0.96,942,0,942
15,worldnews,Researchers discover how air pollution leads to cancer by activating damaged cells - drugs to stop cancer forming may now be possible,https://www.bbc.co.uk/news/health-62797777,0.97,824,0,824
16,worldnews,Thousands of low-income households in Belgium to receive energy bill relief via solar power,https://www.euronews.com/my-europe/2022/09/09/thousands-of-low-income-households-in-belgium-to-receive-energy-bill-relief-via-solar-powe,0.96,694,0,694
17,worldnews,Ukraine accuses Russia of attacking power grid in revenge for offensive,https://www.reuters.com/world/europe/ukraine-accuses-russia-attacking-power-grid-revenge-offensive-2022-09-11/,0.96,648,0,648
18,worldnews,"/r/WorldNews Live Thread: Russian Invasion of Ukraine Day 201, Part 1 (Thread #341)",https://www.reddit.com/live/18hnzysb1elcs,0.96,592,0,592
19,worldnews,Tokyo Olympics bribery scandal widens as Osaka-based ad firm raided,https://www.japantimes.co.jp/news/2022/09/05/national/tokyo-olympics-bribery-scandal-daiko/,0.95,324,0,324
20,worldnews,Russia hits power stations after Ukraine counteroffensive,https://apnews.com/article/russia-ukraine-zelenskyy-kyiv-kharkiv-77988f0d236f26025159709918f78181,0.95,300,0,300
21,worldnews,Moscow Officials Urge Putin to GTFO: ‘Everything Went Wrong’,https://news.yahoo.com/moscow-officials-urge-putin-gtfo-030517069.html,0.94,299,0,299
22,worldnews,"Ukrainian women and children in need of more organised support, say activists",https://www.thenationalnews.com/uae/2022/09/09/ukrainian-women-and-children-in-need-of-more-organised-support-says-activist/,0.91,243,0,243
23,worldnews,"China can’t cooperate with the U.N. human rights office after it released a report criticizing Beijing’s policies against Uyghurs and other ethnic groups in western Xinjiang, according to a top Chinese diplomat",https://www.asahi.com/ajw/articles/14715861,0.94,200,0,200
24,worldnews,Japan says new U.S. EV law may violate international law,https://www.reuters.com/article/usa-autos-taxcredit-japan-idUKL4N30F23O,0.9,183,0,183
25,worldnews,Tokyo plans to require that new homes have solar panels from 2025,https://www.japantimes.co.jp/news/2022/09/09/national/tokyo-solar-panel-new-homes/,0.94,152,0,152
26,worldnews,r/Worldnews Washington D.C. In-Person Meet-Up,https://www.reddit.com/r/worldnews/comments/xafpi7/rworldnews_washington_dc_inperson_meetup/,0.35,0,0,0
