,subreddit,title,url,upvote_ratio,ups,downs,score
0,worldnews,"PM Marin: ""I danced, sang, and partied - perfectly legal things""",https://yle.fi/news/3-12581734,0.85,48536,0,48536
1,worldnews,Police call for Bolsonaro to be charged for spreading Covid misinformation,https://www.theguardian.com/world/2022/aug/18/jair-bolsonaro-covid-misinformation-charge-brazil-police?CMP=Share_iOSApp_Other,0.88,43268,0,43268
2,worldnews,Ukraine warns Russia it intends to take back Crimea,https://www.foxnews.com/world/ukraine-warns-russia-intends-take-crimea?intcmp=tw_fnc,0.93,21747,0,21747
3,worldnews,"Zelenskyy: World must make Russia withdraw from Zaporizhzhia Nuclear Power Plant, or else all nuclear security agreements are worthless",https://www.pravda.com.ua/eng/news/2022/08/18/7363902/,0.94,14359,0,14359
4,worldnews,Putin critic living in exile found dead outside upscale DC apartment after police respond to 'jumper' call,https://www.aol.com/news/putin-critic-living-exile-found-230212838.html,0.97,12985,0,12985
5,worldnews,Brittney Griner: Russian Penal Colonies Resemble Gulag Labor Camps,https://www.insider.com/brittney-griner-russian-penal-colony-resembles-gulag-labor-camps-2022-8,0.92,7154,0,7154
6,worldnews,Russia warns radioactive waste could hit Germany if accident occurs at damaged nuclear power plant,https://www.cnbc.com/2022/08/18/russia-warns-nuclear-plants-radioactive-material-could-cover-europe.html?utm_term=Autofeed&amp;utm_medium=Social&amp;utm_content=Main&amp;utm_source=Twitter#Echobox=1660825075,0.96,5650,0,5650
7,worldnews,"Russia has allegedly told Zaporizhzhia nuclear plant workers to stay home on Friday amid shelling allegations, says Ukraine",https://www.nbcnews.com/news/world/russia-says-may-shut-zaporizhzhia-nuclear-plant-shelling-continues-rcna43673,0.97,3789,0,3789
8,worldnews,Bodies of Saudi asylum seeker sisters found dead in Sydney repatriated to country they fled,https://www.theguardian.com/australia-news/2022/aug/18/bodies-of-saudi-asylum-seeker-sisters-found-dead-in-sydney-repatriated-to-country-they-fled,0.97,3610,0,3610
9,worldnews,The Russian military has deployed warplanes armed with state-of-the-art hypersonic missiles to the country’s Kaliningrad region,https://abcnews.go.com/International/wireStory/russia-deploys-hypersonic-missiles-baltic-exclave-88539753,0.92,3561,0,3561
10,worldnews,Blasts Rock Russian Bases All Around Ukraine As Kyiv Strikes With Rockets And Drones,https://www.forbes.com/sites/davidaxe/2022/08/18/russian-bases-are-blowing-up-all-around-ukraine-as-rockets-and-drones-lash-out/?sh=664cb49374e3,0.98,2970,0,2970
11,worldnews,Estonia officially bans Russian tourists from entering country,https://www.axios.com/2022/08/18/estonia-russia-travel-ban-ukraine-war,0.97,2640,0,2640
12,worldnews,Russia refuses to create a demilitarised zone around Zaporizhzhia Nuclear Power Plant,https://www.pravda.com.ua/eng/news/2022/08/18/7363846/,0.96,2146,0,2146
13,worldnews,U.S. approves of Ukraine striking Russian-occupied Crimea,https://www.politico.com/newsletters/national-security-daily/2022/08/17/u-s-approves-of-ukraine-striking-russian-occupied-crimea-00052364,0.96,2017,0,2017
14,worldnews,Fires and explosions reported at military targets in Russia and Crimea,https://www.theguardian.com/world/2022/aug/18/fires-and-explosions-reported-at-military-targets-in-russia-and-crimea?CMP=Share_iOSApp_Other,0.97,1509,0,1509
15,worldnews,‘Spanish Stonehenge’ only seen four times before emerges from depleted dam | The stones are believed to date back to 5000 BC.,https://www.standard.co.uk/news/world/spanish-stonehenge-dolmen-of-guadalperal-valdecanas-caceres-b1019554.html,0.97,1453,0,1453
16,worldnews,"Russia to stage ‘provocation’ at nuclear plant, warns Ukrainian military | Ukraine",https://www.theguardian.com/world/2022/aug/18/un-chief-presidents-zelenskiy-erdogan-talks-ukraine-grain-nuclear-plant,0.96,1332,0,1332
17,worldnews,IKEA to liquidate its Russian unit as Ukraine conflict continues,https://www.retail-insight-network.com/news/ikea-russian-unit/,0.97,1229,0,1229
18,worldnews,Billionaire Peter Thiel refused consent for sprawling lodge in New Zealand,https://www.theguardian.com/technology/2022/aug/18/peter-thiel-refused-consent-for-sprawling-lodge-in-new-zealand-local-council,0.96,863,0,863
19,worldnews,"Scientists find simple, safe method to destroy 'forever chemicals'",https://www.france24.com/en/live-news/20220818-scientists-find-simple-safe-method-to-destroy-forever-chemicals,0.95,841,0,841
20,worldnews,"Erdoğan on situation at Zaporizhzhia Nuclear Power Plant: We don’t want another Chornobyl, we are on Ukraine’s side",https://www.pravda.com.ua/eng/news/2022/08/18/7363896/,0.97,817,0,817
21,worldnews,"A US judge sentenced an extradited Liberian man to 63 months in prison for conspiring to traffic millions of dollars' worth of horns and ivory from endangered rhinoceros and elephants, federal prosecutors said Thursday",https://www.france24.com/en/live-news/20220818-us-judge-sentences-wildlife-trafficker-to-more-than-5-years-in-jail,0.98,664,0,664
22,worldnews,Anti-Putin businessman’s suicide to be investigated by DC police,https://m.jpost.com/international/article-715076,0.96,521,0,521
23,worldnews,Volodymyr Zelensky: Latin American countries should know truth about Russian aggression in Ukraine | odessa-journal.com,https://odessa-journal.com/volodymyr-zelensky-latin-american-countries-should-know-truth-about-russian-aggression-in-ukraine/,0.92,409,0,409
24,worldnews,"/r/WorldNews Live Thread: Russian Invasion of Ukraine Day 177, Part 1 (Thread #317)",https://www.reddit.com/live/18hnzysb1elcs,0.98,317,0,317
25,worldnews,North Korea rejects Seoul’s ‘foolish’ offer to trade economic aid for denuclearization,https://globalnews.ca/news/9070958/north-korea-south-trade-denuclearization/,0.96,267,0,267
26,worldnews,North Korea tells South Korean president to 'shut his mouth' after offer of aid,https://www.reuters.com/world/asia-pacific/nkorea-leaders-sister-says-north-will-never-deal-with-skoreas-audacious-2022-08-18/,0.95,225,0,225
