,subreddit,title,url,upvote_ratio,ups,downs,score
0,worldnews,Japan's prime minister calls for 'immediate cancellation' of Chinese military drills,https://www.france24.com/en/asia-pacific/20220805-japan-s-prime-minister-calls-for-immediate-cancellation-of-chinese-military-drills,0.93,46221,0,46221
1,worldnews,"Canada announced Friday it will ban the import of handguns beginning on August 19, as part of a wider proposed freeze in the wake of high-profile mass shootings in the United States",https://www.france24.com/en/live-news/20220805-canada-to-ban-handgun-imports-minister,0.89,16902,0,16902
2,worldnews,"North Korea Offers Russia 100,000 ‘Volunteers’ for War on Ukraine",https://www.nationalreview.com/news/north-korea-offers-russia-100000-volunteers-for-war-on-ukraine-russian-state-tv-says,0.88,14310,0,14310
3,worldnews,India is closely monitoring the movement of a Chinese “spy ship” that is on its way to Sri Lanka.,https://indianexpress.com/article/explained/explained-global/china-vessel-yuan-wang-5-sri-lanka-india-concern-explained-8067508/,0.95,9504,0,9504
4,worldnews,Israel hits Gaza with air strikes as tensions escalate,https://www.aljazeera.com/news/2022/8/5/israel-hits-gaza-with-air-strikes-as-tensions-escalate,0.91,8580,0,8580
5,worldnews,Great Barrier Reef areas show highest coral cover seen in 36 years,https://www.cnbc.com/2022/08/04/great-barrier-reef-areas-show-highest-coral-cover-seen-in-36-years.html,0.97,3885,0,3885
6,worldnews,"China, Russia walk out of ASEAN meet overshadowed by Taiwan tensions",https://english.kyodonews.net/news/2022/08/bf9c01699b0e-urgent-china-russia-walk-out-during-japans-remarks-at-asean-related-meeting.html,0.95,3427,0,3427
7,worldnews,Head of Russian Hypersonics Lab Arrested for Treason - TASS,https://www.usnews.com/news/world/articles/2022-08-05/head-of-russian-hypersonics-lab-arrested-for-treason-tass,0.97,2824,0,2824
8,worldnews,"‘They all knew’: textile company misled regulators about use of toxic PFAS, documents show | Thousands more residents outside the original contamination zone may be drinking tainted water",https://www.theguardian.com/environment/2022/aug/05/saint-gobain-textile-company-toxic-pfas,0.97,2169,0,2169
9,worldnews,Start Of England’s River Thames Dries Up For First Time—Latest Iconic Waterway Hit By Droughts And Heat Waves,https://www.msn.com/en-US/weather/topstories/start-of-englands-river-thames-dries-up-for-first-timelatest-iconic-waterway-hit-by-droughts-and-heat-waves/ar-AA10jvxX?ocid=sapphireappshare,0.97,2129,0,2129
10,worldnews,Apple warns suppliers to follow China rules on 'Taiwan' labeling,https://asia.nikkei.com/Spotlight/Supply-Chain/Apple-warns-suppliers-to-follow-China-rules-on-Taiwan-labeling,0.93,1844,0,1844
11,worldnews,"Russia attacks Zaporizhzhia Nuclear Power Plant again, striking near nuclear reactor",https://www.pravda.com.ua/eng/news/2022/08/5/7362071/,0.94,1582,0,1582
12,worldnews,U.S. readies new $1 billion Ukraine weapons package,https://www.reuters.com/world/europe/exclusive-us-readies-new-1-billion-ukraine-weapons-package-2022-08-05/,0.92,1247,0,1247
13,worldnews,Latvia indefinitely stops issuing visas to Russian citizens / Article,https://eng.lsm.lv/article/economy/transport/latvia-indefinitely-stops-issuing-visas-to-russian-citizens.a468189/,0.96,1147,0,1147
14,worldnews,3 more ships with grain depart Ukraine ports under UN deal,https://apnews.com/article/russia-ukraine-middle-east-turkey-istanbul-8b2d69e905f542e094deaa261c1a35d9,0.96,1137,0,1137
15,worldnews,"Bulgaria Sent 4,200 Tons of Weapons to Ukraine - Secretly via Poland",https://www.eurointegration.com.ua/eng/news/2022/08/5/7144530/,0.96,1021,0,1021
16,worldnews,"Low water levels mean Rhine is days from being shut for cargo | Germany’s Rhine, one of Europe’s key waterways, is just days away from being closed to commercial traffic because of very low levels caused by drought, authorities and industry have warned.",https://www.theguardian.com/world/2022/aug/05/rhine-low-water-levels-shut-cargo,0.96,978,0,978
17,worldnews,"Following MBT supplies, North Macedonia to give Ukraine four Su-25 jets",https://www.ukrinform.net/rubric-ato/3543908-following-mbt-supplies-north-macedonia-to-give-ukraine-four-su25-jets-media.html,0.96,977,0,977
18,worldnews,‘Unworthy to be a father’: man in China arrested for marrying off mentally disabled teen daughter to three older men for profit,https://www.scmp.com/news/people-culture/trending-china/article/3187717/unworthy-be-father-man-china-arrested-marrying,0.93,556,0,556
19,worldnews,Russians conducted a poll in the occupied territories whether people want to join the Russian Federation: few are willing – Russian media,https://www.pravda.com.ua/eng/news/2022/08/5/7362062/,0.95,545,0,545
20,worldnews,Taiwan official leading missile production found dead in hotel - official media,https://www.reuters.com/world/asia-pacific/taiwan-official-leading-missile-production-found-dead-hotel-official-media-2022-08-06/,0.98,478,0,478
21,worldnews,"Bulgaria indefinitely stops issuing tourist visas to Russians, as well as visas for property owner",https://ukrainetoday.org/2022/08/05/bulgaria-suspends-issuance-of-visas-to-russians/,0.97,463,0,463
22,worldnews,Snickers maker apologises for ad suggesting Taiwan is a country,https://www.indiatoday.in/world/story/snickers-maker-apologises-advert-suggesting-taiwan-country-1984391-2022-08-06,0.85,383,0,383
23,worldnews,Fungi Species New to Science Discovered in Scottish Highlands,https://www.goodnewsnetwork.org/fungi-species-new-to-science-discovered-in-scottish-highlands/,0.96,326,0,326
24,worldnews,Pentagon chiefs’ calls to China go unanswered amid Taiwan crisis,https://www.politico.com/news/2022/08/05/pentagon-china-calls-taiwan-00050175,0.91,194,0,194
25,worldnews,US will ‘pursue’ Russian offer to discuss Griner prisoner swap,https://www.aljazeera.com/news/2022/8/5/russia-says-ready-to-discuss-prisoner-swap-with-us,0.78,181,0,181
26,worldnews,"/r/WorldNews Live Thread: Russian Invasion of Ukraine Day 164, Part 1 (Thread #304)",https://www.reddit.com/live/18hnzysb1elcs,0.94,168,0,168
