,subreddit,title,url,upvote_ratio,ups,downs,score
0,worldnews,Trump Accused of ‘Giving His Mates Inside Information’ to Make Big Bets on Market in Fiery Speech from British Lawmaker,https://www.mediaite.com/politics/trump-accused-of-giving-his-mates-inside-information-to-make-big-bets-on-market-in-fiery-speech-from-british-lawmaker/,0.98,27060,0,27060
1,worldnews,Trump confirms Saudi crown prince is pushing him to continue Iran war,https://www.turkiyetoday.com/world/trump-confirms-saudi-crown-prince-is-pushing-him-to-continue-iran-war-3216835,0.96,22881,0,22881
2,worldnews,Drug Camp That Hegseth Said U.S. Bombed in Ecuador Was Actually Dairy Farm: Report,https://uk.news.yahoo.com/drug-camp-hegseth-said-u-003644045.html,0.97,20716,0,20716
3,worldnews,Iran military spokesperson says US is negotiating with itself,https://www.reuters.com/world/middle-east/iran-military-spokesperson-says-us-is-negotiating-with-itself-state-media-2026-03-25/,0.97,15239,0,15239
4,worldnews,A Russian aviation blogger was killed in a fatal air defense error after his ultralight aircraft was mistaken for a Ukrainian drone and shot down,https://tvpworld.com/92270896/russian-aviation-blogger-killed-in-air-defense-blunder-near-moscow,0.97,14724,0,14724
5,worldnews,"Trump to hit Iran harder if Tehran does not accept defeat, White House says",https://www.reuters.com/world/asia-pacific/trump-hit-iran-harder-if-tehran-does-not-accept-defeat-white-house-says-2026-03-25/,0.95,8418,0,8418
6,worldnews,Israel fears Donald Trump could announce Iran ceasefire despite low deal odds,https://www.jpost.com/middle-east/iran-news/article-891213,0.96,5601,0,5601
7,worldnews,"Iran ready to seize Bahrain and UAE coastlines if US makes a ground invasion in Iran, Iranian state media warns","https://www.middleeasteye.net/news/iran-ready-seize-bahrain-and-uae-coastlines-if-us-makes-mistake-iranian-expert-warns#:~:text=Youtube-,Iran%20ready%20to%20seize%20Bahrain%20and%20UAE%20coastlines%20if%20US,New%20MEE%20newsletter:%20Jerusalem%20Dispatch",0.97,4482,0,4482
8,worldnews,UN calls for reparations to remedy the 'historical wrongs' of trafficking enslaved Africans,https://www.mynbc5.com/article/un-reparations-trafficking-enslaved-africans/70847259,0.79,4176,0,4176
9,worldnews,"Iran warns its ready to open new front in Yemen, close Bab al-Mandab Strait with Houthis - report",https://www.jpost.com/middle-east/iran-news/article-891193,0.97,3971,0,3971
10,worldnews,"Russian government ordered Moscow internet blackout, The Bell reports",https://kyivindependent.com/orders-to-shut-down-internet-in-moscow-came-from-government-independent-russian-outlets-sources-confirm/,0.98,3608,0,3608
11,worldnews,Spanish PM warns Iran war 'far worse' than Iraq in 2003,https://www.euronews.com/2026/03/25/spains-prime-minister-pedro-sanchez-warns-iran-war-far-worse-than-iraq-in-2003,0.9,2024,0,2024
12,worldnews,UAE ambassador to US warns against ending Iran war too soon,https://www.jpost.com/middle-east/article-891215,0.95,1921,0,1921
13,worldnews,The U.S. Said It Helped Bomb a Drug Camp. It Was a Dairy Farm.,https://www.nytimes.com/2026/03/24/world/americas/us-ecuador-drug-camp-bombing-dairy-farm.html?unlocked_article_code=1.VlA.IAXf.JXmzcnExAYLX&amp;smid=url-share,0.94,1674,0,1674
14,worldnews,"Trump may announce Iran ceasefire by weekend, Israeli officials say",https://www.ynetnews.com/article/skz97511jbl,0.87,1411,0,1411
15,worldnews,UN votes to recognise slavery as 'gravest crime against humanity',https://www.bbc.com/news/articles/cvg06q36052o,0.85,1130,0,1130
16,worldnews,UK armed forces authorised to board Russian tankers in British waters,https://www.theguardian.com/uk-news/2026/mar/25/uk-armed-forces-authorised-to-board-russia-tankers-shadow-fleet,0.98,781,0,781
17,worldnews,"Iran wants Lebanon included in any ceasefire, sources say",https://www.reuters.com/world/asia-pacific/iran-wants-lebanon-included-any-ceasefire-sources-say-2026-03-25/,0.95,746,0,746
18,worldnews,"Russia Preparing to Hit Ukraine’s Water Supply Systems, Zelenskyy Warns",https://united24media.com/latest-news/russia-preparing-to-hit-ukraines-water-supply-systems-zelenskyy-warns-17276,0.96,663,0,663
19,worldnews,"Russia Hits All of Ukraine with Nearly 1,000 Weapons in 24 Hours, Setting a New Record",https://united24media.com/war-in-ukraine/russia-hits-all-of-ukraine-with-nearly-1000-weapons-in-24-hours-setting-a-new-record-17258,0.96,533,0,533
20,worldnews,Iranian foreign minister says “we do not plan on any negotiations” with the United States,https://wtop.com/world/2026/03/iranian-foreign-minister-says-we-do-not-plan-on-any-negotiations-with-the-united-states/,0.95,517,0,517
21,worldnews,Germany's defence minister claims Trump has 'no exit strategy' in Iran,https://www.abc.net.au/news/2026-03-26/germany-says-trump-no-exit-strategy-in-iran-war/106498880,0.97,326,0,326
22,worldnews,"Trump claims Iran proposed making him Supreme Leader: I said, 'No, thank you' (Video in link)",https://www.indiatoday.in/world/story/trump-iran-supreme-leader-winning-war-leadership-fear-killed-negotiations-talks-2887201-2026-03-26,0.74,142,0,142
23,worldnews,"/r/WorldNews Live Thread: Russian Invasion of Ukraine Day 1491, Part 1 (Thread #1638)",https://www.reddit.com/live/18hnzysb1elcs,0.95,128,0,128
24,worldnews,/r/WorldNews Discussion Thread: US and Israel launch attack on Iran; Iran retaliates (Thread #11),https://www.reddit.com/r/worldnews/comments/1s402bg/rworldnews_discussion_thread_us_and_israel_launch/,0.91,9,0,9
