,subreddit,title,url,upvote_ratio,ups,downs,score
0,worldnews,US Military Says Sank Three Huthi Vessels That Attacked Container Ship In Red Sea and opened fire on the US helicopters,https://www.barrons.com/news/us-military-says-sank-three-huthi-vessels-that-attacked-container-ship-in-red-sea-32c2f671,0.95,9764,0,9764
1,worldnews,Queen of Denmark announces abdication live on TV,https://www.bbc.co.uk/news/world-europe-67854395,0.95,9661,0,9661
2,worldnews,Argentine president begins flying commercial to lead example in country’s cost-cutting measures,https://gazettengr.com/argentine-president-begins-flying-commercial-to-lead-example-in-countrys-cost-cutting-measures/,0.94,6243,0,6243
3,worldnews,"Australia Is First Nation to Ban Popular, but Deadly, ""Engineered"" Stone",https://www.newser.com/story/344002/one-nation-is-first-to-ban-popular-but-deadly-stone.html,0.96,5848,0,5848
4,worldnews,UK and US weigh air strikes on missile launch sites in Yemen,https://www.standard.co.uk/news/uk/houthi-rebels-yemen-red-sea-shipping-attack-oil-gas-uk-us-b1128720.html,0.96,4332,0,4332
5,worldnews,"Russia claims it killed Ukrainian intelligence officers in attack on Kharkiv hotel, Ukraine’s Defence Intelligence says it’s nonsense",https://www.pravda.com.ua/eng/news/2023/12/31/7435305/,0.96,2741,0,2741
6,worldnews,US: Ordinary Russian civilians are also bearing the brunt of the Kremlin’s brutal war,https://kyivindependent.com/russia-says-20-dead-following-attack-on-belgorod/,0.94,2337,0,2337
7,worldnews,Netanyahu rejects claims accusing Israel of genocide in Gaza,https://thehill.com/policy/international/4383588-netanyahu-rejects-claims-accusing-israel-of-genocide-in-gaza/,0.86,1882,0,1882
8,worldnews,"'100-200,000, not two million': Israel's finance minister envisions depopulated Gaza",https://www.haaretz.com/israel-news/2023-12-31/ty-article/100-200-000-not-two-million-israels-finance-minister-envisions-depopulated-gaza/0000018c-bfe8-d6c4-ab8d-fffc0b910000,0.84,1845,0,1845
9,worldnews,Russian Report Says 74 Sailors Died In Ukraine's Attack On Novocherkassk,https://www.rferl.org/a/russia-74-sailors-dead-novocherkassk-attack-ukraine-crimea/32752785.html,0.97,1789,0,1789
10,worldnews,"USS Gerald R. Ford to Leave the Eastern Mediterranean, ABC Says",https://www.bloomberg.com/news/articles/2023-12-31/uss-gerald-r-ford-to-leave-the-eastern-mediterranean-abc-says,0.95,1512,0,1512
11,worldnews,"Latvian Foreign Ministry: Even if Ukraine liberates its territory, Russia’s threat to Europe will remain",https://www.pravda.com.ua/eng/news/2023/12/31/7435341/,0.97,1497,0,1497
12,worldnews,Taiwan considers joining ICC to deter potential China invasion,https://www.theguardian.com/world/2023/dec/31/taiwan-considers-joining-icc-to-deter-potential-china-invasion,0.96,1332,0,1332
13,worldnews,Israel's Netanyahu rejects South Africa’s claims of genocide as Cyprus-Gaza sea corridor set to open,https://www.timesofisrael.com/pm-rejects-south-africas-claims-of-genocide-as-cyprus-gaza-sea-corridor-set-to-open/,0.86,1147,0,1147
14,worldnews,Britain ‘considering airstrikes’ on Houthi rebels after Red Sea attacks,https://www.theguardian.com/world/2023/dec/31/britain-considering-airstrikes-on-houthi-rebels-after-red-sea-attacks,0.95,1008,0,1008
15,worldnews,"In rare apology, Israeli minister says she 'sinned' for her role in reforms that tore country apart",https://abcnews.go.com/International/wireStory/rare-apology-israeli-minister-sinned-role-reforms-tore-106021842,0.9,935,0,935
16,worldnews,India shut internet more times than any other country in 2023. Manipur blackout Northeast's longest,https://theprint.in/india/india-shut-internet-more-times-than-any-other-country-in-2023-manipur-blackout-northeasts-longest/1906283/,0.92,912,0,912
17,worldnews,Heaviest snow in South Korea's capital Seoul for more than 40 years,https://news.sky.com/story/heaviest-snow-in-south-koreas-capital-seoul-for-more-than-40-years-13039985,0.97,769,0,769
18,worldnews,/r/WorldNews Live Thread for 2023 Israel-Hamas Crisis (Thread 44),https://www.reddit.com/live/1bsso361afr0r,0.86,553,0,553
19,worldnews,Israel says it's ready to let ships bring aid to Gaza,https://www.reuters.com/world/middle-east/israel-ready-let-ships-bring-aid-gazas-shores-minister-2023-12-31/,0.9,506,0,506
20,worldnews,China's military purge deepens,https://www.axios.com/2023/12/31/xi-jinping-china-military-corruption-purge,0.93,436,0,436
21,worldnews,"North Korea's Kim orders military to 'thoroughly annihilate' US, South Korea if provoked",https://apnews.com/article/north-korea-kim-us-missiles-nuclear-6c8834f71ac43bb9d0addc404fe00f18,0.89,278,0,278
22,worldnews,Greens demand full release of government documents on ‘disastrous’ decision to join Iraq invasion,https://www.theguardian.com/australia-news/2024/jan/01/greens-demand-full-release-of-government-documents-on-disastrous-decision-to-join-iraq-invasion,0.84,241,0,241
23,worldnews,"/r/WorldNews Live Thread: Russian Invasion of Ukraine Day 677, Part 1 (Thread #823)",https://www.reddit.com/live/18hnzysb1elcs,0.96,208,0,208
24,worldnews,IDF downs two apparent drones launched at Israel by Iran-backed Iraqi militia,https://www.timesofisrael.com/idf-downs-two-apparent-drones-launched-at-israel-by-iran-backed-iraqi-militia/,0.89,205,0,205
25,worldnews,Separatist Bosnian Serb leader Milorad Dodik vows to tear his country apart despite US warnings,https://apnews.com/article/bosnian-serbs-secession-threat-1072c96ce29c1f118a9b5a84bbd5ff9e,0.93,194,0,194
26,worldnews,Hamas launches barrage of rockets at Israel as New Year begins,https://m.jpost.com/breaking-news/article-780253,0.85,140,0,140
