,subreddit,title,url,upvote_ratio,ups,downs,score
0,worldnews,US aircraft leave Spain after government says bases cannot be used for Iran attacks,https://www.straitstimes.com/world/europe/us-aircraft-leave-spain-after-government-says-bases-cannot-be-used-for-iran-attacks,0.95,34137,0,34137
1,worldnews,Russia bombed Hungary’s pipeline. Hungary deployed troops — against Ukraine. Opposition calls it a false flag to save Orbán’s collapsing election campaign,https://euromaidanpress.com/2026/03/01/russia-bombed-hungarys-pipeline-hungary-deployed-troops-against-ukraine/,0.95,25630,0,25630
2,worldnews,Qatar shoots down two Iranian Su-24 fighter jets,https://www.jpost.com/middle-east/article-888568,0.96,19704,0,19704
3,worldnews,"B.C. to adopt permanent daylight saving time, after springing forward 1 last time  | Globalnews.ca",https://globalnews.ca/news/11713160/bc-david-eby-niki-sharma-announcement-time/,0.97,15395,0,15395
4,worldnews,Private jet prices soar as wealthy scramble to leave Dubai,https://www.theguardian.com/world/2026/mar/02/dubai-private-jet-prices-soar-tourists-stuck-wealthy-leave,0.97,7033,0,7033
5,worldnews,"Iran death toll reaches 555 as US, Israel escalate attacks",https://www.aljazeera.com/news/2026/3/2/iran-death-toll-reaches-555-as-us-israel-escalate-attacks,0.95,5370,0,5370
6,worldnews,Macron says France will increase size of its nuclear arsenal,https://www.reuters.com/world/europe/macron-says-france-will-increase-size-its-nuclear-arsenal-2026-03-02/,0.98,5117,0,5117
7,worldnews,"Fire at US embassy complex in Riyadh after blast heard, sources say",https://www.reuters.com/world/fire-us-embassy-complex-riyadh-after-blast-heard-sources-say-2026-03-03/,0.98,4702,0,4702
8,worldnews,Iran threatens to set ships on fire if they enter Strait of Hormuz - National,https://globalnews.ca/news/11713355/iran-strait-of-hormuz-ships-threat/,0.97,4205,0,4205
9,worldnews,"Zelenskyy: Because of these hostilities, we cannot confirm meeting with US and Russia in Abu Dhabi",https://www.eurointegration.com.ua/eng/news/2026/03/2/7232288/,0.97,3770,0,3770
10,worldnews,Israel hacked Iran traffic cameras for years to pinpoint Khaemnei location prior to strike: News report,https://www.aninews.in/news/world/middle-east/israel-hacked-iran-traffic-cameras-for-years-to-pinpoint-khaemnei-location-prior-to-strike-news-report20260303083608/,0.97,3762,0,3762
11,worldnews,Belgium says US-Israel action on Iran 'does not meet' international law standards,https://www.aa.com.tr/en/europe/belgium-says-us-israel-action-on-iran-does-not-meet-international-law-standards/3846552,0.88,3571,0,3571
12,worldnews,British premier stands by decision not to join US-Israeli strikes on Iran,https://www.aa.com.tr/en/europe/british-premier-stands-by-decision-not-to-join-us-israeli-strikes-on-iran/3846994,0.95,3538,0,3538
13,worldnews,Donald Trump warns of longer Iran-Israel war as violence spreads,https://www.thehindu.com/news/international/trump-warns-of-longer-iran-war-as-violence-spreads/article70697744.ece,0.96,3050,0,3050
14,worldnews,Iran's women's soccer team refuse to sing national anthem at their Asian Cup game against South Korea.,https://www.news.com.au/sport/football/irans-womens-football-teams-defiant-national-anthem-act-at-asian-cup/news-story/52fce7d19a5392b2d8daf037037cc518,0.94,2321,0,2321
15,worldnews,Macron says France will allow temporary deployment of nuclear-armed jets to allied nations,https://www.nbcnews.com/world/europe/macron-says-france-will-allow-temporary-deployment-nuclear-armed-jets-rcna261326,0.96,2093,0,2093
16,worldnews,"US strikes on Iran triggered by Israel’s plan to launch attack, Rubio says",https://www.theguardian.com/us-news/2026/mar/02/rubio-us-attack-israel-iran,0.93,1212,0,1212
17,worldnews,Trump calls Kurdish leaders in Iran war effort,https://www.axios.com/2026/03/02/trump-iran-war-kurds-iraq,0.94,1076,0,1076
18,worldnews,Denmark to cooperate with France on nuclear deterrence,https://www.reuters.com/world/europe/denmark-cooperate-with-france-nuclear-deterrence-2026-03-02/,0.97,956,0,956
19,worldnews,Ukraine says it can help shoot down Iranian drones if there’s a ceasefire with Russia,https://www.newsnationnow.com/world/russia-at-war/ukraine-shoot-iran-drones-ceasefire-russia/,0.94,694,0,694
20,worldnews,Canada's Carney arrives in Australia for meeting of 'middle powers',https://www.reuters.com/world/americas/canadas-carney-arrives-australia-meeting-middle-powers-2026-03-03/,0.93,581,0,581
21,worldnews,'This issue concerns us' — Zelensky warns Middle East war could strain Ukraine air defense supplies,https://www.yahoo.com/news/articles/issue-concerns-us-zelensky-warns-184916468.html?guccounter=1,0.93,444,0,444
22,worldnews,/r/WorldNews Discussion Thread: US and Israel launch attack on Iran; Iran retaliates (Thread #4),https://www.reddit.com/r/worldnews/comments/1rj6zv7/rworldnews_discussion_thread_us_and_israel_launch/,0.88,247,0,247
23,worldnews,"U.S. Marines fired on protesters storming consulate in Karachi, officials say",https://www.reuters.com/world/asia-pacific/us-marines-fired-protesters-storming-consulate-karachi-officials-say-2026-03-03/,0.87,187,0,187
24,worldnews,"/r/WorldNews Live Thread: Russian Invasion of Ukraine Day 1468, Part 1 (Thread #1615)",https://www.reddit.com/r/worldnews/comments/1rjf818/rworldnews_live_thread_russian_invasion_of/,0.97,153,0,153
