,subreddit,title,url,upvote_ratio,ups,downs,score
0,worldnews,"Earth is 'big enough' for U.S. and China to succeed, Xi says as he meets Biden",https://www.cnbc.com/2023/11/15/xi-biden-at-apec-summit-china-us-leaders-meet-in-san-francisco.html,0.93,15125,0,15125
1,worldnews,Biden: Gaza op will end when Hamas can no longer murder Israelis,https://www.jns.org/biden-gaza-op-will-end-when-hamas-can-no-longer-murder-israelis/,0.82,10353,0,10353
2,worldnews,Russian Army Is Double Its Size on the Eve of Invasion and Likely Will Stay That Way – Report,https://www.kyivpost.com/post/24222,0.94,3720,0,3720
3,worldnews,Israeli opposition leader says time has come to replace Netanyahu,https://www.reuters.com/world/middle-east/israeli-opposition-leader-says-time-has-come-replace-netanyahu-2023-11-16/,0.94,3615,0,3615
4,worldnews,"Official: Russian army “eliminated” almost all Ukrainian literature in occupied Luhansk, Donetsk",https://euromaidanpress.com/2023/11/14/official-russian-army-eliminated-almost-all-ukrainian-literature-in-occupied-luhansk-donetsk/,0.95,3472,0,3472
5,worldnews,Survey finds majority in the West Bank support the Oct 7 massacre,https://www.i24news.tv/en/news/middle-east/palestinian-territories/1700158968-survey-finds-majority-in-the-west-bank-justify-the-oct-7-massacre,0.75,2860,0,2860
6,worldnews,"Chinese President Xi Jinping signaled that China will send new pandas to the U.S., calling them ""envoys of friendship between the Chinese and American peoples.""",https://abcnews.go.com/US/wireStory/chinese-president-signals-pandas-coming-united-states-104935091,0.95,2735,0,2735
7,worldnews,"No condemnation of Hamas: UN Security Council passes resolution calling for temporary cease-fire, hostage return",https://www.ynetnews.com/article/bkmex4m46,0.84,2589,0,2589
8,worldnews,Israel finds body of Gaza hostage near Al-Shifa hospital,https://www.jpost.com/breaking-news/article-773615,0.86,2437,0,2437
9,worldnews,100 officers deployed after Trudeau surrounded at Vancouver restaurant,https://bc.ctvnews.ca/100-officers-deployed-after-trudeau-surrounded-at-vancouver-restaurant-1.6646074,0.94,2377,0,2377
10,worldnews,France calls West Bank Israeli settler violence 'policy of terror',https://m.jpost.com/breaking-news/article-773533,0.85,1977,0,1977
11,worldnews,Biden: Israel’s Gaza operation will end when Hamas no longer able to murder Israelis,https://www.timesofisrael.com/biden-israels-gaza-operation-will-end-when-hamas-no-longer-able-to-murder-israelis/,0.86,1541,0,1541
12,worldnews,Zaporizhzhia Nuclear Power Plant's power unit 5 leaks from reactor's primary circuit,https://www.pravda.com.ua/eng/news/2023/11/16/7429109/,0.96,1465,0,1465
13,worldnews,McDonald's turns to Sedition Act as boycott bites despite PR campaigns,https://www.malaysianow.com/news/2023/11/15/mcdonalds-turns-to-sedition-act-as-boycott-bites-despite-pr-campaigns,0.92,1196,0,1196
14,worldnews,'Such a difficult life in Canada': Ukrainian immigrants leaving because it's so expensive,https://financialpost.com/news/economy/canada-expensive-ukrainian-immigrants-leaving,0.89,1166,0,1166
15,worldnews,Russian artist gets 7 years for anti-war price tags,https://www.bbc.com/news/world-europe-67437171,0.96,1124,0,1124
16,worldnews,"Bill to separate church from state to be introduced in UK parliament -- Sponsor Paul Scriven: ""The separation of the Church of England and the state is long overdue. We need to reflect Britain as it is today, not what it was back on the 1500s""",https://www.secularism.org.uk/news/2023/11/bill-to-separate-church-from-state-to-be-introduced-in-parliament,0.95,959,0,959
17,worldnews,IDF says Hamas hiding evidence of use of Shifa hospital as command centre,https://www.theguardian.com/world/2023/nov/16/idf-says-hamas-hiding-evidence-of-use-of-shifa-hospital-as-command-centre,0.79,802,0,802
18,worldnews,Israel drops leaflets warning people to flee southern Gaza towns,https://www.theguardian.com/world/2023/nov/16/israel-drops-leaflets-warning-people-to-flee-southern-gaza-towns,0.83,689,0,689
19,worldnews,Al Jazeera Forces Mom of Israeli Hostage to Debate Hamas Head of Hostages on Live TV,https://themessenger.com/news/meirav-gonan-al-jazeera-israeli-hostage-mom-hamas-debate,0.81,664,0,664
20,worldnews,/r/WorldNews Live Thread for 2023 Israel-Hamas Crisis (Thread 40),https://www.reddit.com/live/1bsso361afr0r,0.84,521,0,521
21,worldnews,"2 degrees, 40 feet: Scientists who study Earth’s ice say we could be committed to disastrous sea level rise",https://www.nbcnews.com/science/environment/scientists-study-earths-ice-say-committed-disastrous-sea-level-rise-rcna124981,0.93,426,0,426
22,worldnews,Army says it struck Hamas underground sites where senior commanders were hiding,https://www.timesofisrael.com/idf-says-it-struck-hamas-underground-sites-where-senior-commanders-were-hiding/,0.86,280,0,280
23,worldnews,Only 4% of countries propose eliminating multibillion-dollar subsidies for fossil fuels in their climate plans,https://english.elpais.com/climate/2023-11-16/only-4-of-countries-propose-eliminating-multibillion-dollar-subsidies-for-fossil-fuels-in-their-climate-plans.html,0.91,229,0,229
24,worldnews,"/r/WorldNews Live Thread: Russian Invasion of Ukraine Day 632, Part 1 (Thread #778)",https://www.reddit.com/live/18hnzysb1elcs,0.97,214,0,214
25,worldnews,‘I Just Wanted to Stop the War’: Russian Artist Sentenced to 7 Years for Price Tag Protest,https://www.themoscowtimes.com/2023/11/16/i-just-wanted-to-stop-the-war-russian-artist-sentenced-to-7-years-for-price-tag-protest-a83019,0.93,174,0,174
26,worldnews,Outgoing Human Rights Watch senior editor blasts group’s ‘infected’ work on Israel,https://www.timesofisrael.com/outgoing-human-rights-watch-senior-editor-blasts-groups-infected-work-on-israel/,0.89,99,0,99
