,subreddit,title,url,upvote_ratio,ups,downs,score
0,worldnews,"NATO member Latvia tells Russian envoy to leave, in solidarity with Estonia",https://www.jpost.com/breaking-news/article-729336,0.93,48553,0,48553
1,worldnews,Morocco becomes the first African country to give tanks to Ukraine,https://www.i24news.tv/en/news/ukraine-conflict/1674409784-morocco-gives-tanks-to-ukraine-report,0.95,21474,0,21474
2,worldnews,"It's now or never to stop Japan's shrinking population, PM says",https://www.reuters.com/world/asia-pacific/its-now-or-never-stop-japans-shrinking-population-pm-says-2023-01-23/?utm_campaign=fullarticle&amp;utm_medium=referral&amp;utm_source=inshorts,0.94,18321,0,18321
3,worldnews,Turkey's president says no support for Sweden's NATO bid,https://apnews.com/article/nato-politics-turkey-government-recep-tayyip-erdogan-f9a568da05914a4143a033e74067b6f4,0.93,14267,0,14267
4,worldnews,Estonia donates all of its 155mm howitzers and other weapons to Ukraine,https://english.nv.ua/nation/estonia-donates-all-of-its-155mm-howitzers-and-other-weapons-to-ukraine-50299305.html,0.97,11866,0,11866
5,worldnews,Russia Ordered White Supremacists to Bomb European Politicians,https://spanishnewstoday.com/russian_intelligence_suspected_of_ordering_white_supremacists_to_mail_bombs_in_spain_1984414-a.html,0.95,7723,0,7723
6,worldnews,Former top FBI official Charles McGonigal arrested over ties to Russian oligarch Oleg Deripaska,https://abcnews.go.com/US/former-fbi-official-charles-mcgonigal-arrested-ties-russian/story?id=96609658,0.98,4807,0,4807
7,worldnews,Leader Of Group Of Mothers And Wives Of Russian Soldiers Detained En Route To Moscow,https://www.rferl.org/a/russia-mothers-wives-soldiers-ukraine-war-detained/32235532.html,0.97,2865,0,2865
8,worldnews,Norway arrests former Wagner fighter who escaped from Russia,https://www.aljazeera.com/news/2023/1/23/former-wagner-group-fighter-arrested-in-norway,0.97,2731,0,2731
9,worldnews,"Archaeologists discovered a new papyrus of Egyptian Book of the Dead: Dubbed the ""Waziri papyrus,"" scholars are currently translating the text into Arabic",https://arstechnica.com/science/2023/01/archaeologists-discovered-a-new-papyrus-of-egyptian-book-of-the-dead/,0.97,1554,0,1554
10,worldnews,NASA Ingenuity helicopter completes 40th flight on Mars,https://techaint.com/2023/01/23/nasa-ingenuity-helicopter-completes-40th-flight-on-mars/,0.97,1469,0,1469
11,worldnews,Germany starts deploying Patriot air defence units to Poland,https://www.reuters.com/world/europe/germany-starts-deploying-patriot-air-defence-units-poland-2023-01-23/,0.97,1299,0,1299
12,worldnews,Giant iceberg the size of London breaks off Antarctica ice shelf,https://bnonews.com/index.php/2023/01/giant-iceberg-the-size-of-london-breaks-off-antarctica-ice-shelf/,0.95,1184,0,1184
13,worldnews,Muscovites were braving the threat of arrest to lay flowers at an improvised memorial to victims of a missile attack in Ukraine's central city of Dnipro,https://www.france24.com/en/live-news/20230123-russians-brave-arrest-to-decry-ukraine-nightmare,0.96,1085,0,1085
14,worldnews,Brazil and Argentina are gearing up to launch a joint currency that could become South America's euro,https://ca.finance.yahoo.com/news/brazil-argentina-gearing-launch-joint-113237145.html,0.93,1005,0,1005
15,worldnews,"Germany: 5 charged with treason in suspected terror plot. Public prosecutors said the suspects had planned to create ""civil war-like conditions"" in Germany. They are also accused of plotting to kidnap the health minister",https://www.dw.com/en/germany-5-charged-with-treason-in-suspected-terror-plot/a-64490289,0.96,890,0,890
16,worldnews,UK's king asks windfarm deal profits ($1.2B) be directed to public,https://abcnews.go.com/International/wireStory/uks-king-asks-windfarm-deal-profits-directed-public-96527742?cid=social_twitter_abcn,0.95,724,0,724
17,worldnews,Brazilian President Lula da Silva Calls for Respect for Venezuela and Cuba,https://www.telesurenglish.net/news/Brazilian-President-Calls-for-Respect-for-Venezuela-and-Cuba-20230123-0012.html,0.87,457,0,457
18,worldnews,Brazil: President Lula accuses Bolsonaro of ‘genocide’ after gold mining causes Indigenous deaths,https://www.euronews.com/green/2023/01/23/brazil-president-lula-accuses-bolsonaro-of-genocide-after-gold-mining-causes-indigenous-de,0.93,437,0,437
19,worldnews,"Ukraine deputy minister sacked for alleged theft of $400,000 | Ukraine | The Guardian",https://amp.theguardian.com/world/2023/jan/23/ukraine-deputy-minister-sacked-for-alleged-theft-of-400000,0.97,384,0,384
20,worldnews,"People across Japan urged to prepare for heavy snow, severe cold weather with up to 1 meter (40 inches) of snow expected on Tuesday",https://www3.nhk.or.jp/nhkworld/en/news/20230123_20/,0.96,348,0,348
21,worldnews,German Arms Firm Rheinmetall Says 139 Leopard Tanks Could Send To Ukraine,https://www.ndtv.com/world-news/german-arms-firm-rheinmetall-says-139-leopard-tanks-could-send-to-ukraine-3718584,0.94,275,0,275
22,worldnews,Morocco votes to 'reconsider' ties with European Union,https://www.france24.com/en/africa/20230123-morocco-votes-to-reconsider-ties-with-european-union,0.95,262,0,262
23,worldnews,"/r/WorldNews Live Thread: Russian Invasion of Ukraine Day 335, Part 1 (Thread #476)",https://www.reddit.com/live/18hnzysb1elcs,0.98,261,0,261
24,worldnews,Russian Embassy in Estonia halts processing of citizenship renunciation/cancellation due to too many requests,https://news.err.ee/1608855380/russian-embassy-in-estonia-halts-processing-of-citizenship-renunciation,0.97,176,0,176
25,worldnews,"Police in Brazil have strong evidence that an alleged drug trafficker ordered the murders of a British journalist and an Indigenous activist in the Amazon last June, a police chief said on Monday",https://www.france24.com/en/live-news/20230124-brazil-pins-murders-of-uk-reporter-activist-on-alleged-drug-lord,0.95,97,0,97
