,subreddit,title,url,upvote_ratio,ups,downs,score
0,worldnews,Bill Gates to give most of his $200 billion fortune to Africa,https://www.bbc.co.uk/news/articles/cn4qg5gzgzxo,0.86,34689,0,34689
1,worldnews,‘An Absolutely Brilliant Result’ – Zelensky Says All Operatives in ‘Spiderweb’ Drone Op in Russia Are Safe,https://www.kyivpost.com/post/53761,0.97,32670,0,32670
2,worldnews,"Ukraine to Make 10 Million Air, Land, Sea Drones a Year",https://www.kyivpost.com/post/53815,0.98,8011,0,8011
3,worldnews,Satellite Images Confirm 13 Russian Strategic Bombers Destroyed in Deep Ukrainian Drone Strike,https://united24media.com/latest-news/satellite-images-confirm-13-russian-strategic-bombers-destroyed-in-deep-ukrainian-drone-strike-8805,0.98,7730,0,7730
4,worldnews,"Zelenskyy comments on Russians' idea of a ""partial"" ceasefire: ""Idiots""",https://www.pravda.com.ua/eng/news/2025/06/2/7515278/,0.98,7537,0,7537
5,worldnews,"China accuses Trump of violation, threatens ""forceful measures""",https://www.newsweek.com/china-accuses-trump-violation-threatens-forceful-measures-2079640,0.97,6240,0,6240
6,worldnews,Ukrainian Land Forces Commander resigns after Russian attack that killed 12 soldiers on training grounds,https://kyivindependent.com/ukrainian-land-forces-commander-resigns-after-russian-attack-that-killed-12-soldiers-on-training-grounds/,0.97,3177,0,3177
7,worldnews,"Norway to help Ukraine cover 1 billion euro gas shortfall, Zelensky says",https://kyivindependent.com/norway-to-help-ukraine-cover-1-billion-euro-gas-shortfall-zelensky-says/,0.99,3045,0,3045
8,worldnews,U.S. nuclear deal offer allows Iran to enrich uranium,https://www.axios.com/2025/06/02/iran-nuclear-deal-proposal-enrich-uranium,0.96,2565,0,2565
9,worldnews,"Trump ‘Not Given Heads-Up’ on Ukraine’s Far-Reaching Drone Strikes in Russia, Officials Say",https://www.kyivpost.com/post/53759,0.94,2548,0,2548
10,worldnews,EU ambassador on Ukrainian operation targeting aircraft in Russia: Ukraine has cards,https://www.pravda.com.ua/eng/news/2025/06/2/7515199/,0.97,2476,0,2476
11,worldnews,Ukraine invited to Nato summit in The Hague this month,https://www.scmp.com/news/world/russia-central-asia/article/3312808/ukraine-invited-nato-summit-hague-month?module=top_story&amp;pgtype=homepage,0.99,2055,0,2055
12,worldnews,"Ukrainian strikes cut power to Russian-held areas, officials say",https://www.reuters.com/world/europe/ukrainian-strikes-cut-power-russian-held-areas-officials-say-2025-06-02/,0.98,2008,0,2008
13,worldnews,Canada to expedite nation-building projects to counter Trump,https://www.bbc.com/news/articles/clyrd24zg3eo,0.96,1415,0,1415
14,worldnews,"Ukraine and Russia agree to swap 6,000 bodies of soldiers killed in three-year war",https://www.yahoo.com/news/ukraine-russia-meet-turkey-peace-074346291.html,0.98,1322,0,1322
15,worldnews,Russians inflict systemic violence on LGBTQ+ people in occupied regions of Ukraine,https://gwaramedia.com/en/russians-inflict-systemic-violence-on-lgbtq-people-in-occupied-regions-of-ukraine/,0.91,1303,0,1303
16,worldnews,TikTok has banned worldwide the popular hashtag “SkinnyTok” linked to weight-loss videos following scrutiny from policymakers in Brussels and Paris,https://www.politico.eu/article/tiktok-skinnytok-ban-social-media-regulation/,0.94,971,0,971
17,worldnews,"Russia's Medinsky called Ukraine's demand for return of deported children a ""show for European old ladies""",https://www.pravda.com.ua/eng/news/2025/06/2/7515245/,0.94,918,0,918
18,worldnews,"Britain gets a defence boost aimed at sending a message to Russia, and to Trump",https://www.stuff.co.nz/world-news/360709747/britain-gets-defence-boost-aimed-sending-message-russia-and-trump,0.97,879,0,879
19,worldnews,Alberta Wildfires Shut Down About 7% of Canada’s Oil Production,https://www.bloomberg.com/news/articles/2025-06-02/alberta-wildfires-shut-down-about-7-of-canada-s-oil-production,0.96,670,0,670
20,worldnews,U.S. air travel falls in April amid trade war with Canada,https://www.ctvnews.ca/business/article/us-air-travel-from-canada-drops-in-april-in-the-wake-of-trade-tensions/,0.94,655,0,655
21,worldnews,Saudi Arabia says it will jointly fund Syria state salaries with Qatar,https://www.aljazeera.com/amp/news/2025/5/31/saudi-arabia-says-it-will-jointly-fund-syria-state-salaries-with-qatar,0.96,586,0,586
22,worldnews,'We face war in Europe' — UK announces major defense spending boost amid Russian threat,https://kyivindependent.com/we-face-war-in-europe-uk-announces-major-defense-spending-boost-amid-russian-threat/,0.97,335,0,335
23,worldnews,Zelenskyy urges Norwegian PM to invest in Ukrainian drones,https://www.pravda.com.ua/eng/news/2025/06/2/7515275/,0.98,171,0,171
24,worldnews,"/r/WorldNews Live Thread: Russian Invasion of Ukraine Day 1195, Part 1 (Thread #1342)",https://www.reddit.com/live/18hnzysb1elcs,0.97,171,0,171
25,worldnews,Head of FEMA said he was unaware of US hurricane season,https://www.reuters.com/world/us/fema-staff-confused-after-head-said-he-was-unaware-us-hurricane-season-sources-2025-06-02/,0.94,90,0,90
