,subreddit,title,url,upvote_ratio,ups,downs,score
0,worldnews,"Russia says its missiles hit Ukrainian military targets, but videos of a burning crater in a Kyiv park paint a very different picture",https://www.businessinsider.com/russia-claimed-striking-ukrainian-military-targets-video-shows-crater-park-2022-10,0.92,46925,0,46925
1,worldnews,Putin: Moscow will respond forcefully to Ukrainian attacks,https://www.reuters.com/world/europe/putin-moscow-will-respond-forcefully-ukrainian-attacks-2022-10-10/,0.87,46777,0,46777
2,worldnews,German embassy in Kyiv hit by Russian strikes,https://euroweeklynews.com/2022/10/10/breaking-german-embassy-in-kyiv-hit-by-russian-strikes/,0.91,29731,0,29731
3,worldnews,"U.S. States That Wish to Join Russia Will Be Considered, Says Duma Member",https://www.newsweek.com/american-states-that-wish-join-russia-will-considered-says-duma-member-1750336,0.84,26442,0,26442
4,worldnews,Ukraine's Zelenskiy: Russia deliberately timed strikes to inflict maximum damage,https://www.reuters.com/world/europe/ukraines-zelenskiy-russia-deliberately-timed-strikes-inflict-maximum-damage-2022-10-10/,0.95,15393,0,15393
5,worldnews,Germany to deliver air defence system to Ukraine within days -defence ministry,https://www.reuters.com/world/europe/germany-deliver-air-defence-system-ukraine-within-days-defence-ministry-2022-10-10/,0.97,11885,0,11885
6,worldnews,Sweden won't share Nord Stream investigation findings with Russia - PM,https://www.reuters.com/world/europe/sweden-wont-share-nord-stream-investigation-findings-with-russia-pm-2022-10-10/,0.97,8357,0,8357
7,worldnews,Biden promises Ukraine 'advanced air defense systems' after Russian missile strikes,https://www.cnn.com/2022/10/10/politics/biden-zelensky-advanced-air-defense-systems/index.html,0.96,8199,0,8199
8,worldnews,Zelenskyy says Russia used Shahed 'suicide drones' it got from Iran in its barrage of attacks on Ukrainian cities,https://www.businessinsider.com/zelenskyy-iran-shahed-drones-used-in-attacks-on-ukraine-cities-2022-10,0.97,6825,0,6825
9,worldnews,Russia's defence ministry: All targets hit in massive missile strikes on Ukraine,https://www.reuters.com/world/europe/russias-defence-ministry-all-targets-hit-massive-missile-strikes-ukraine-2022-10-10/,0.96,5939,0,5939
10,worldnews,Foreign Minister: Estonia Considers Russia a State Sponsor of Terrorism,https://news.err.ee/1608744877/foreign-minister-estonia-considers-russia-a-state-sponsor-of-terrorism,0.97,5697,0,5697
11,worldnews,Belarusian dictator announces joint force with Russia in response to ‘threat’ from Ukraine,https://www.msn.com/en-gb/news/world/belarusian-dictator-announces-joint-force-with-russia-in-response-to-threat-from-ukraine/ar-AA12O7tK?ocid=msedgntp&amp;cvid=518abb6f4ebd46a4d019116771de58b0,0.95,5678,0,5678
12,worldnews,"Sergei Surovikin, the commander now leading Russia's attacks on Ukraine, has been described as 'absolutely ruthless' by former colleagues: 'I am afraid his hands will be completely covered in Ukrainian blood'",https://www.businessinsider.com/colleagues-describe-russian-commander-sergei-surovikin-as-ruthless-2022-10?international=true&amp;r=US&amp;IR=T,0.96,4285,0,4285
13,worldnews,Russian Air Force Activity Near Polish Airspace Is 'Intensifying' According To The Italian Air Force,https://theaviationist.com/2022/10/10/russian-activity-near-poland-intensifying/,0.97,4223,0,4223
14,worldnews,"Belarus's Lukashenko warns Ukraine, deploys troops with Russia",https://www.reuters.com/world/europe/belarus-russia-form-joint-military-group-lukashenko-says-2022-10-10/,0.96,3854,0,3854
15,worldnews,U.N. publicly rejects Russia's call for secret vote on Ukraine,https://www.reuters.com/world/un-publicly-rejects-russias-call-secret-vote-ukraine-2022-10-10/?utm_source=reddit.com,0.98,2868,0,2868
16,worldnews,Poland advises its citizens to leave Belarus,https://www.reuters.com/world/europe/poland-advises-its-citizens-leave-belarus-2022-10-10/,0.98,2860,0,2860
17,worldnews,Iran protesters shot by police so afraid to go to hospitals they're asking U.S. doctors for help online,https://www.cbsnews.com/amp/news/iran-news-protests-deaths-people-shot-afraid-hospital-arrest-us-doctors-help/,0.97,2376,0,2376
18,worldnews,Russian ex-president Medvedev on Kyiv wanted list,https://www.reuters.com/world/europe/russian-ex-president-medvedev-kyiv-wanted-list-2022-10-10/,0.96,1825,0,1825
19,worldnews,"Energy workers join Iran protests, endangering regime’s coffers",https://www.timesofisrael.com/energy-workers-join-iran-protests-endangering-regimes-coffers/,0.97,1520,0,1520
20,worldnews,Russia's State Duma proposes return of basic military training to school curricula,https://euroweeklynews.com/2022/10/10/russia-military-training-school-curricula/,0.96,1384,0,1384
21,worldnews,U.N. publicly rejects Russia's call for secret vote on Ukraine,https://www.reuters.com/world/un-publicly-rejects-russias-call-secret-vote-ukraine-2022-10-10/,0.97,1365,0,1365
22,worldnews,"Kremlin decision to target Ukraine’s cities was political, not tactical",https://www.theguardian.com/world/2022/oct/10/kremlin-decision-to-target-ukraines-cities-was-political-not-tactical,0.96,877,0,877
23,worldnews,Nearly 500 pilot whales die in New Zealand beachings,https://bnonews.com/index.php/2022/10/nearly-500-pilot-whales-die-in-new-zealand-beachings/,0.97,566,0,566
24,worldnews,"/r/WorldNews Live Thread: Russian Invasion of Ukraine Day 230, Part 1 (Thread #371)",https://www.reddit.com/live/18hnzysb1elcs,0.98,527,0,527
25,worldnews,"People in Kyiv describe how, in a barrage of missiles, Russia shattered the hope of life returning to normal",https://www.businessinsider.com/kyiv-missile-strikes-attack-hurts-city-efforts-normality-peace-2022-10,0.92,322,0,322
26,worldnews,"UN General Assembly applauds Ukraine, shuns Russia in tense meeting just hours after deadly missile strikes",https://www.businessinsider.com/un-general-assembly-lauds-ukraine-shuns-russia-after-missile-strikes-2022-10,0.97,272,0,272
