,subreddit,title,url,upvote_ratio,ups,downs,score
0,worldnews,Iran cuts all diplomatic channels with US ahead of Trump’s Strait of Hormuz deadline,https://www.firstpost.com/world/iran-cuts-all-diplomatic-channels-with-us-ahead-of-trumps-strait-of-hormuz-deadline-13997645.html,0.96,49464,0,49464
1,worldnews,Pope Leo calls Trump's threat against Iran 'truly unacceptable',https://www.reuters.com/world/europe/pope-leo-calls-trumps-threat-against-iran-truly-unacceptable-2026-04-07/,0.96,36348,0,36348
2,worldnews,"Trump suspends Iran attack for two weeks, subject to Hormuz Strait opening",https://www.cnbc.com/2026/04/07/trump-iran-ceasefire-hormuz-strait.html?__source=iosappshare%7Ccom.apple.UIKit.activity.PostToTwitter,0.96,31600,0,31600
3,worldnews,Trump says 'a whole civilization will die tonight' if Iran does not make a deal,https://www.reuters.com/world/middle-east/trump-says-a-whole-civilization-will-die-tonight-if-iran-does-not-make-deal-2026-04-07/,0.95,29249,0,29249
4,worldnews,US strikes Iran’s main oil hub on Kharg Island as IRGC warns: 'Restraint is over',https://www.ynetnews.com/article/ol076ejw1,0.95,20325,0,20325
5,worldnews,"Iran has attacked Saudi Arabia's Jubail petrochemical complex, IRGC says",https://www.reuters.com/world/middle-east/iran-has-attacked-saudi-petrochemical-complex-jubail-fars-news-agency-says-2026-04-07/,0.97,11040,0,11040
6,worldnews,Iranians form human chains at power plants,https://www.lemonde.fr/en/international/article/2026/04/07/iranians-form-human-chains-at-power-plants-according-to-state-media-and-local-journalists_6752197_4.html,0.93,8492,0,8492
7,worldnews,"Reports in Iran: Explosions on Kharg 'Oil Island,' bridge attacked near Qom",https://www.ynetnews.com/article/i4rwg9g40,0.97,7735,0,7735
8,worldnews,"""Putin's mouse"": leaked phone call reveals lengths Orbán was willing to go to help Russia",https://www.pravda.com.ua/eng/news/2026/04/07/8029092/,0.98,6983,0,6983
9,worldnews,JD Vance accuses EU of ‘interference’ as he visits Hungary to help Orbán win election,https://www.theguardian.com/world/2026/apr/07/jd-vance-eu-interference-hungary-election-viktor-orban,0.96,6767,0,6767
10,worldnews,"Trump Considering Pakistani PM's Request he Extend Iran Deadline, White House Says",https://abcnews.com/amp/Politics/trump-pakistani-pms-request-extend-iran-deadline-white/story?id=131815293,0.96,6758,0,6758
11,worldnews,Iran seeks $2 mln vessel fee for Strait of Hormuz passage under its peace plan,https://m.economictimes.com/news/international/world-news/middle-east-war-iran-10-point-plan-strait-of-hormuz-fee-war-guarantees-sanctions-relief-donald-trump-deadline/articleshow/130076629.cms,0.96,6032,0,6032
12,worldnews,Viktor Orbán told Putin ‘I am at your service’ in October phone call | Viktor Orbán,https://www.theguardian.com/world/2026/apr/07/viktor-orban-told-putin-i-am-at-your-service-in-october-phonecall,0.98,3937,0,3937
13,worldnews,China and Russia veto U.N. resolution on protecting Hormuz shipping,https://www.reuters.com/world/china/china-vetoes-un-resolution-protecting-hormuz-shipping-2026-04-07/,0.97,3597,0,3597
14,worldnews,Ukrainian Navy extracts man who spent years hiding in occupied territory after shooting Russian soldier,https://united24media.com/latest-news/after-years-in-hiding-ukraine-extracts-man-from-russian-occupied-territory-17698,0.98,2215,0,2215
15,worldnews,"French foreign minister warns Trump against Iran threat, says escalation would be “particularly dangerous”",https://www.reuters.com/world/french-foreign-minister-barrot-hopes-trump-does-not-go-ahead-with-threat-against-2026-04-07/,0.96,1261,0,1261
16,worldnews,Iraq's Islamic Resistance says it is suspending operations for two weeks,https://www.reuters.com/world/middle-east/iraqs-islamic-resistance-says-it-is-suspending-operations-two-weeks-2026-04-08/,0.96,1211,0,1211
17,worldnews,Intelligence report warned of Iran's 'persistent threat' to US as White House downplayed the risk,https://www.reuters.com/world/us/intelligence-report-warned-irans-persistent-threat-us-white-house-downplayed-2026-04-08/,0.87,1143,0,1143
18,worldnews,"Iranian hackers' targeting of US critical infrastructure has escalated since start of war, US says",https://www.reuters.com/world/middle-east/iranian-hackers-targeting-us-critical-infrastructure-has-escalated-since-start-2026-04-07/,0.96,1072,0,1072
19,worldnews,Oil exports from Russia’s terminal in Novorossiysk suspended after UAV attack,https://www.pravda.com.ua/eng/news/2026/04/07/8029180/,0.97,807,0,807
20,worldnews,Iran says talks with US will begin in Pakistan’s Islamabad on Friday,https://www.aljazeera.com/news/2026/4/8/iran-says-talks-with-us-will-begin-in-pakistans-islamabad-on-friday,0.95,523,0,523
21,worldnews,Iranian civilians fear escalation as US pressures Tehran amid ongoing conflict,https://www.washingtonpost.com/world/2026/04/07/iran-war-fears-trump-infrastructure-economy-attacks/,0.82,294,0,294
22,worldnews,/r/WorldNews Discussion Thread: US and Israel launch attack on Iran; Iran retaliates (Thread #14),https://www.reddit.com/r/worldnews/comments/1sfbtp3/rworldnews_discussion_thread_us_and_israel_launch/,0.84,184,0,184
23,worldnews,"/r/WorldNews Live Thread: Russian Invasion of Ukraine Day 1504, Part 1 (Thread #1651)",https://www.reddit.com/live/18hnzysb1elcs,0.96,181,0,181
24,worldnews,Russia and China veto UN resolution to reopen Strait of Hormuz,https://www.reuters.com/world/china/china-vetoes-un-resolution-protecting-hormuz-shipping-2026-04-07/?utm_source=chatgpt.com,0.8,120,0,120
