,subreddit,title,url,upvote_ratio,ups,downs,score
0,worldnews,Finland allows Ukraine to strike Russia with Finnish weapons,https://www.pravda.com.ua/eng/news/2024/05/29/7458213/,0.94,33174,0,33174
1,worldnews,Rioters set fire to Israeli embassy in Mexico City,https://www.thejc.com/news/world/rioters-set-fire-to-israeli-embassy-in-mexico-city-tr3313lu,0.91,15483,0,15483
2,worldnews,A US official says an 'unacceptably high' number of US weapons components have landed in Russian hands,https://www.businessinsider.com/russian-weapons-large-number-us-parts-inside-says-us-official-2024-5,0.91,12220,0,12220
3,worldnews,North Korea flies 150 'feces-filled' balloons across border to the South,https://koreajoongangdaily.joins.com/news/2024-05-29/national/northKorea/North-Korea-flies-150-fecesfilled-balloons-across-border-to-the-South/2057086,0.96,9660,0,9660
4,worldnews,"Ukraine can use French weapons to strike inside Russia, Macron says | CNN",https://edition.cnn.com/2024/05/28/europe/ukraine-french-weapons-russia-macron-intl-hnk-ml/index.html,0.97,6093,0,6093
5,worldnews,Poland allows Ukraine to use Polish-supplied weapons to strike targets in Russia,https://www.pravda.com.ua/eng/news/2024/05/29/7458233/,0.97,5775,0,5775
6,worldnews,"Israel has tactical control of Gaza-Egypt border corridor and militaries have, in 10 days, discovered 20 tunnels that cross into Egypt",https://www.reuters.com/world/middle-east/israel-has-tactical-control-gaza-egypt-border-corridor-military-official-says-2024-05-29/,0.92,5236,0,5236
7,worldnews,Think tank close to Kremlin says Russia should consider a 'demonstrative' nuclear explosion,"https://www.reuters.com/world/europe/think-tank-close-kremlin-says-russia-should-consider-demonstrative-nuclear-2024-05-29/#:~:text=May%2029%20(Reuters)%20-%20A,arms%20against%20targets%20inside%20Russia.",0.93,3785,0,3785
8,worldnews,World-first tooth-regrowing drug will be given to humans in September,https://newatlas.com/medical/tooth-regrowing-human-trial/,0.97,3584,0,3584
9,worldnews,White House says Israel's Rafah strike and ground assault don't cross Biden's 'red line',https://www.nbcnews.com/news/world/israel-rafah-strike-ground-assault-dont-cross-bidens-red-line-rcna154428,0.86,3236,0,3236
10,worldnews,US to boycott UN tribute to Iran leader killed in helicopter crash,https://www.reuters.com/world/us-boycott-un-tribute-iran-leader-killed-helicopter-crash-2024-05-29/,0.96,3049,0,3049
11,worldnews,Delhi 'unbearable' as temperatures soar past 50C,https://bbc.com/news/articles/c166xxd4y36o,0.96,2637,0,2637
12,worldnews,Toxic substances 428 times above permitted limit found in children's shoes from China's Shein,https://www.koreatimes.co.kr/www/nation/2024/05/113_375473.html,0.97,2306,0,2306
13,worldnews,"Finland, Canada, Poland don't prohibit Ukraine from striking targets in Russia with their weapons",https://kyivindependent.com/finland-canada/,0.98,1005,0,1005
14,worldnews,South Korea says North Korea has fired a missile toward its eastern waters,https://apnews.com/article/north-korea-missile-test-kim-jong-un-tensions-89bbe080f9670093a4d9b47e66fd65fc?taid=6657a5bce860dd0001d02ae7&amp;utm_campaign=TrueAnthem&amp;utm_medium=AP&amp;utm_source=Twitter,0.94,659,0,659
15,worldnews,"Delivery of US weapons to Ukraine helping stabilize frontline, Blinken says",https://www.reuters.com/world/delivery-us-weapons-ukraine-helping-stabilize-frontline-blinken-says-2024-05-29/,0.96,581,0,581
16,worldnews,Israel says it's taken control of key area of Gaza's border with Egypt awash in smuggling tunnels,https://apnews.com/article/israel-palestinians-hamas-war-news-05-29-2024-7952f779552f41ef6fb44c3b662f5c48,0.9,542,0,542
17,worldnews,Top Biden aides signal openness to letting Ukraine strike Russia with US weapons,https://www.politico.com/news/2024/05/29/biden-aides-signal-openness-to-allowing-ukraine-to-strike-russia-with-us-weapons-00160462,0.97,518,0,518
18,worldnews,Chinese National Charged in ‘Largest Botnet Ever’ Tied to Billions in Stolen Covid-19 Relief Funds,https://www.wired.com/story/911-s5-botnet-arrest/,0.94,399,0,399
19,worldnews,"/r/WorldNews Live Thread: Russian Invasion of Ukraine Day 827, Part 1 (Thread #973)",https://www.reddit.com/live/18hnzysb1elcs,0.98,219,0,219
20,worldnews,The Armenian government has suspended the broadcast of Russia’s leading state TV channel in Armenia after it aired strong criticism of PM Nikol Pashinian,https://www.azatutyun.am/a/32970731.html,0.94,215,0,215
21,worldnews,"Japan spots China’s new spy, strike drone for first time over waters north of Okinawa. The news comes on the same day Tokyo says Chinese ships have sailed near disputed Diaoyu Islands for a record 158 consecutive days",https://www.scmp.com/news/china/military/article/3264458/japan-reports-first-sighting-new-pla-combat-drone-over-east-china-sea,0.95,178,0,178
22,worldnews,Taliban push for normalizing male-only higher education,https://www.voanews.com/a/taliban-push-for-normalizing-male-only-higher-education/7630263.html,0.87,150,0,150
23,worldnews,/r/WorldNews Live Thread for Israel-Hamas War (Thread #51),https://www.reddit.com/live/1bsso361afr0r,0.72,144,0,144
24,worldnews,"Delhi temperature hits 52.9C, shattering India’s national record",https://www.theguardian.com/world/article/2024/may/29/delhi-temperature-hits-499c-as-indias-capital-records-hottest-day,0.86,121,0,121
25,worldnews,"Montreal Jewish school targeted by gunfire, police say | CBC News",https://www.cbc.ca/news/canada/montreal/montreal-jewish-school-shot-1.7218941,0.88,95,0,95
26,worldnews,Israel claims control of Gaza's entire land border,https://www.bbc.com/news/articles/c1994g22ve9o,0.81,67,0,67
