,subreddit,title,url,upvote_ratio,ups,downs,score
0,worldnews,There are 40% more tigers in the world than previously estimated,https://www.npr.org/2022/07/23/1113186725/tigers-population-numbers-endangered-species,0.94,56568,0,56568
1,worldnews,Moldova ‘very worried’ about Russia invasion: ‘nobody is safe’,https://thehill.com/policy/international/3572426-moldova-very-worried-about-russia-invasion-nobody-is-safe/,0.95,15931,0,15931
2,worldnews,Russian Official Admits to Missile Strike on Odesa,https://www.voanews.com/a/russian-official-admits-to-missile-strike-on-odesa-/6671522.html,0.96,8520,0,8520
3,worldnews,"Saudi Arabia is planning to build two parallel, mirrored buildings that are nearly 500 metres tall and 120km long as part of its Neom desert megacity, according to a report published on Saturday.",https://www.middleeasteye.net/news/saudi-arabia-two-parallel-skyscrapers-neom,0.92,7813,0,7813
4,worldnews,"North Korean labour could be sent to rebuild Donbas, Russian ambassador says | North Korea",https://www.theguardian.com/world/2022/jul/19/north-korean-workers-could-help-rebuild-donbas-region-russian-ambassador-says,0.95,4842,0,4842
5,worldnews,"Russian tank attack in eastern Ukraine kills 2 Americans, Canadian and Swede",https://www.politico.com/news/2022/07/23/americans-killed-russian-tank-attack-00047567,0.96,3527,0,3527
6,worldnews,Ukraine war: Kyiv's forces moving towards occupied Kherson - Zelensky,https://www.bbc.com/news/world-europe-62283196,0.96,3373,0,3373
7,worldnews,World War I battlefield in southwest Slovenia is on fire and exploding 100-year-old ordnance,https://taskandpurpose.com/news/this-world-war-i-battlefield-slovenia-fire-unexploded-ordnance/,0.97,2727,0,2727
8,worldnews,Fifty-year extension for Australia’s biggest CO2 emitter attracts record number of appeals,https://www.theguardian.com/australia-news/2022/jul/23/fifty-year-extension-for-australias-biggest-co2-emitter-attracts-record-number-of-appeals,0.97,2557,0,2557
9,worldnews,Japanese volcano Sakurajima erupts as alert level 5 triggered,https://news.sky.com/story/japanese-volcano-sakurajima-erupts-as-alert-level-5-triggered-12658232,0.97,2329,0,2329
10,worldnews,Ukraine war: Russia denies causing global food crisis,https://www.bbc.co.uk/news/world-middle-east-62284377,0.93,1622,0,1622
11,worldnews,"Russian Soldiers Who Refuse To Fight In Ukraine Detained, Tortured: Report",https://www.ibtimes.com/russian-soldiers-who-refuse-fight-ukraine-detained-tortured-report-3584913,0.96,1467,0,1467
12,worldnews,Cracks appear in US$50 billion Russian-Chinese passenger jet project; The future of the CR-929 project appears increasingly uncertain as China looks to freeze Russia out of a share of the profits from its domestic market,https://www.scmp.com/news/china/diplomacy/article/3186359/us50-billion-russian-chinese-joint-venture-build-passenger-jet?module=In-house&amp;pgtype=homepage,0.95,1304,0,1304
13,worldnews,"Pope Francis meets with Indigenous leaders in Canada on ""trip of penance""",https://www.sbs.com.au/news/article/pope-francis-meets-with-indigenous-leaders-in-canada-on-trip-of-penance/pe3i3ryc5,0.92,1078,0,1078
14,worldnews,Iranian women under pressure as president stiffens hijab mandate: The Iranian government is cracking down on hijab violations in what many say is a bid to divert attention from the nation’s economic hardships.,https://www.al-monitor.com/originals/2022/07/iranian-women-under-pressure-raisi-stiffens-hijab-mandate,0.94,1068,0,1068
15,worldnews,China plans to turn the moon into outpost to defend Earth: scientists,https://www.scmp.com/news/china/science/article/3186279/china-plans-turning-moon-outpost-defending-earth-asteroids-say,0.89,985,0,985
16,worldnews,Human rights groups criticise EU’s Azerbaijan gas deal: Agreement with autocratic ruler to double supplies within five years comes as EU seeks to reduce reliance on Russian energy,https://www.theguardian.com/world/2022/jul/19/human-rights-groups-criticise-eus-azerbaijan-gas-deal,0.89,543,0,543
17,worldnews,Britain’s ‘great unretirement’: cost of living drives older people back to work,https://www.theguardian.com/business/2022/jul/25/britains-great-unretirement-cost-of-living-drives-older-people-back-to-work?CMP=Share_iOSApp_Other,0.96,510,0,510
18,worldnews,"'Even Russians expect defeat,' says Zelenskyy As the war enters its sixth month, the Ukrainian president vows his forces will ""inflict the highest possible damage on the enemy.""",https://www.dw.com/en/russia-ukraine-updates-even-russians-expect-defeat-says-zelenskyy/a-62576209,0.92,418,0,418
19,worldnews,Congo to Auction Land to Oil Companies: ‘Our Priority Is Not to Save the Planet’,https://www.nytimes.com/2022/07/24/world/africa/congo-oil-gas-auction.html,0.95,415,0,415
20,worldnews,"/r/WorldNews Live Thread: Russian Invasion of Ukraine Day 152, Part 1 (Thread #292)",https://www.reddit.com/live/18hnzysb1elcs,0.96,310,0,310
21,worldnews,‘They hunt us like stray cats’: pro-Russia separatists step up forced conscription as losses mount | Ukraine,https://www.theguardian.com/world/2022/jul/20/pro-russian-separatists-step-up-forced-conscription-as-losses-mount,0.95,274,0,274
22,worldnews,"Russia tells famine-fearing Africa it’s not to blame for food shortage: Badly needed grain has been piling up in Ukrainian ports since Moscow invaded, but Russia’s top diplomat is in Africa saying the West is to blame",https://www.nytimes.com/2022/07/24/world/europe/russia-grain-africa-lavrov.html,0.96,240,0,240
23,worldnews,India's scam central: India has seen a surge in cybercrimes amid improved Internet connectivity and increased unemployment,https://www.straitstimes.com/asia/south-asia/indias-scam-central-rural-villages-see-surge-in-cybercrimes,0.87,180,0,180
24,worldnews,"The police officer who shot at a 16-year-old boy during a farmers’ protest earlier this month is now the subject of a criminal investigation. The police officer, who could face attempted manslaughter charges, fired at the teenager who was driving a tractor during a protest near Heerenveen.",https://www.dutchnews.nl/news/2022/07/police-officer-faces-criminal-probe-over-farm-protest-shooting/,0.95,139,0,139
25,worldnews,China says South China Sea not a 'fighting arena' for major powers,https://www.reuters.com/world/china/china-says-south-china-sea-not-fighting-arena-major-powers-2022-07-25/,0.87,127,0,127
