,subreddit,title,url,upvote_ratio,ups,downs,score
0,worldnews,"The USA has authorized Denmark, Norway, and the Netherlands to transfer 65 F-16 Fighting Falcon fighter jets to Ukraine",https://www.zona-militar.com/en/2024/04/05/the-usa-has-authorized-denmark-norway-and-the-netherlands-to-transfer-65-f-16-fighting-falcon-fighter-jets-to-ukraine/,0.96,8203,0,8203
1,worldnews,"Russia inflicting illegal chemical attacks against Ukrainian soldiers, investigation finds",https://www.telegraph.co.uk/world-news/2024/04/06/russia-using-illegal-chemical-attacks-against-ukraine/,0.96,6477,0,6477
2,worldnews,"Hostage Elad Katzir murdered, body returned to Israel",https://m.jpost.com/breaking-news/article-795627,0.8,6415,0,6415
3,worldnews,Pipe transporting petroleum products to tankers blown up in Russia – Ukraine’s defense intel,https://www.ukrinform.net/rubric-ato/3849213-pipe-transporting-petroleum-products-to-tankers-blown-up-in-russia-ukraines-defense-intel.html,0.97,6337,0,6337
4,worldnews,"Mexico’s president says country will break diplomatic ties with Ecuador, after police raid embassy",https://apnews.com/article/mexico-ecuador-diplomatic-crisis-de5aa3a638b54fdfa3474c8ee25ca57e,0.98,5751,0,5751
5,worldnews,Israel's military says it has recovered body of a hostage from Gaza,https://www.bbc.co.uk/news/world-middle-east-68748242,0.85,4571,0,4571
6,worldnews,"More than 4,000 people evacuated in Russia after dam bursts",https://www.theguardian.com/world/2024/apr/06/more-than-4000-people-evacuated-in-russia-after-dam-bursts,0.96,4153,0,4153
7,worldnews,‘Simply mind-boggling’: world record temperature jump in Antarctic raises fears of catastrophe,https://www.theguardian.com/environment/2024/apr/06/simply-mind-boggling-world-record-temperature-jump-in-antarctic-raises-fears-of-catastrophe?CMP=Share_iOSApp_Other,0.96,3506,0,3506
8,worldnews,Estonia Just Found Another Million Shells For Ukraine,https://www.forbes.com/sites/davidaxe/2024/04/06/estonia-just-found-another-million-shells-for-ukraine/,0.97,3316,0,3316
9,worldnews,Egyptian authorities arrest 10 after a pro-Gaza rally calling for severing ties with Israel,https://apnews.com/article/egypt-gaza-rally-arrest-palestinians-israel-protest-03aeb63124d3118922ea7055a91777a6,0.94,3248,0,3248
10,worldnews,"Ottawa is being sued for restoring UNRWA funding by survivors of terror victims - By funding UNRWA, the litigants argue, the government is funding terror while violating its own policies on ensuring foreign aid aligns with Canadian values",https://nationalpost.com/news/canada-sued-for-restoring-unrwa-funding,0.86,1886,0,1886
11,worldnews,Tens of thousands protest in Hungary against Viktor Orbán’s government,https://www.theguardian.com/world/2024/apr/06/protest-march-budapest-hungary-peter-magyar-viktor-orban-government,0.97,1802,0,1802
12,worldnews,Myanmar military loses border town in another big defeat,https://www.bbc.com/news/world-asia-68750528,0.97,1470,0,1470
13,worldnews,Netherlands plans to transfer 24 F-16 fighters to Ukraine,https://www.ukrinform.net/rubric-ato/3849337-netherlands-plans-to-transfer-24-f16-fighters-to-ukraine.html,0.97,1294,0,1294
14,worldnews,"‘Significant consequences’ if Chinese firms help Russia’s war in Ukraine, US’s Yellen warns",https://www.politico.eu/article/janet-yellen-us-china-antony-blinken-nato-ukraine-russia-war/,0.95,1237,0,1237
15,worldnews,"Incendiary device hurled at German synagogue door, causing minor damage",https://www.timesofisrael.com/incendiary-device-hurled-at-german-synagogue-door-causing-minor-damage/,0.91,962,0,962
16,worldnews,"UN says Israel approved reopening of 20 bakeries, water pipeline in northern Gaza",https://www.timesofisrael.com/un-says-israel-approved-reopening-of-20-bakeries-water-pipeline-in-northern-gaza/,0.88,906,0,906
17,worldnews,"Hamas Actually Believed It Would Conquer Israel. In Preparation, It Divided the Country Into Cantons ",https://www.haaretz.com/israel-news/2024-04-05/ty-article-magazine/.highlight/hamas-actually-believed-it-would-conquer-israel-and-divided-it-into-cantons/0000018e-ab4a-dc42-a3de-abfad6fe0000,0.81,849,0,849
18,worldnews,‘Extreme’ US anti-abortion group ramps up lobbying in Westminster,https://www.theguardian.com/world/2024/apr/06/extreme-us-anti-abortion-group-ramps-up-lobbying-in-westminster,0.89,835,0,835
19,worldnews,IDF says it blew up Hamas tunnel that stretched hundreds of meters into Israel,https://www.timesofisrael.com/idf-says-it-blew-up-hamas-tunnel-that-stretched-hundred-of-meters-into-israel/,0.85,659,0,659
20,worldnews,US preparing for significant Iran attack on US or Israeli assets in the region as soon as next week | CNN Politics,https://www.cnn.com/2024/04/05/politics/us-israel-iran-retaliation-strike/index.html?Date=20240405&amp;Profile=cnnbrk&amp;utm_content=1712350970&amp;utm_medium=social&amp;utm_source=twitter,0.94,446,0,446
21,worldnews,Global rainforest loss continues at rate of 10 football pitches a minute,https://www.theguardian.com/environment/2024/apr/04/global-deforestation-rainforest-climate-goals-brazil-colombia-agriculture,0.92,422,0,422
22,worldnews,"China Is Providing Geospatial Intelligence to Russia, US Warns — Blinken briefed European allies on scope of Chinese support. China said to have stepped up help for Russian war on Ukraine",https://www.bloomberg.com/news/articles/2024-04-06/china-is-providing-geospatial-intelligence-to-russia-us-warns,0.93,416,0,416
23,worldnews,‘Hungarians rise’: Tens of thousands protest against Orban in Budapest,https://www.france24.com/en/europe/20240406-hungarians-rise-tens-of-thousands-protest-against-orban-in-budapest,0.95,367,0,367
24,worldnews,"UK to Deploy Royal Navy to Deliver Food, Supplies to Gaza Strip",https://www.bloomberg.com/news/articles/2024-04-06/uk-to-deploy-royal-navy-to-deliver-food-supplies-to-gaza-strip,0.87,283,0,283
25,worldnews,/r/WorldNews Live Thread for Israel-Hamas War (Thread 47),https://www.reddit.com/live/1bsso361afr0r,0.76,179,0,179
26,worldnews,"/r/WorldNews Live Thread: Russian Invasion of Ukraine Day 774, Part 1 (Thread #920)",https://www.reddit.com/live/18hnzysb1elcs,0.96,158,0,158
