,subreddit,title,url,upvote_ratio,ups,downs,score
0,worldnews,"At least 120 dead after stampede during Halloween festivities in Itaewon, South Korea",https://news.sky.com/story/dozens-injured-in-stampede-during-halloween-festivities-in-south-koreas-capital-seoul-12733277,0.94,64574,0,64574
1,worldnews,Russia says British navy personnel blew up Nord Stream gas pipelines,https://www.reuters.com/world/europe/russia-says-british-navy-personnel-blew-up-nord-stream-gas-pipelines-2022-10-29/,0.87,35629,0,35629
2,worldnews,US releases Guantanamo Bay’s oldest prisoner after holding him two decades without charge,https://news.yahoo.com/us-releases-guantanamo-bay-oldest-180630490.html,0.95,15166,0,15166
3,worldnews,"""no one chooses to become an addict"" - princess of Wales gives speech",https://www.bbc.co.uk/news/uk-63440985,0.92,8878,0,8878
4,worldnews,"US and China cannot 'change each other', Beijing tells American envoy in first official meeting",https://www.koreatimes.co.kr/www/world/2022/10/501_338812.html,0.96,6151,0,6151
5,worldnews,'Massive' drone attack on Black Sea Fleet - Russia,https://www.bbc.co.uk/news/world-europe-63437212,0.97,6041,0,6041
6,worldnews,Iran's Guards chief warns protesters: 'Today is last day of riots',https://www.france24.com/en/asia-pacific/20221029-iran-s-guards-chief-warns-protesters-today-is-last-day-of-riots,0.96,4442,0,4442
7,worldnews,Russia offering to replace Ukrainian grain with its own after withdrawing from the grain agreement,https://www.pravda.com.ua/eng/news/2022/10/29/7374113/,0.94,3196,0,3196
8,worldnews,Iran's Guards head warns protesters: Today is last day of riots,https://www.reuters.com/world/middle-east/irans-guards-head-tells-protesters-today-is-last-day-riots-2022-10-29/,0.96,3081,0,3081
9,worldnews,Russia says it is suspending a grain export deal with Ukraine,https://www.npr.org/2022/10/29/1132608672/russia-says-it-is-suspending-a-grain-export-deal-with-ukraine,0.95,1973,0,1973
10,worldnews,The Russian Black Sea Fleet May Have Lost Another Flagship | Forbes,https://www.forbes.com/sites/davidaxe/2022/10/29/the-russian-black-sea-fleet-may-have-lost-another-flagship/,0.97,1678,0,1678
11,worldnews,Crush kills at least 151 at Halloween festivities in Seoul,https://apnews.com/article/arrests-seoul-south-korea-61ba79a6f2c3e204c25fad9245fb36a2?utm_source=homepage&amp;utm_medium=TopNews&amp;utm_campaign=position_01,0.97,1457,0,1457
12,worldnews,"Truss phone was hacked by suspected Putin agents when she was foreign minister, the Daily Mail reports",https://www.reuters.com/world/uk/truss-phone-was-hacked-by-suspected-putin-agents-when-she-was-foreign-minister-2022-10-29/,0.95,1284,0,1284
13,worldnews,Volodymyr Zelensky: Russia is trying to make the Kherson region literally an exclusion zone; the world must react to this | odessa-journal.com,https://odessa-journal.com/volodymyr-zelensky-russia-is-trying-to-make-the-kherson-region-literally-an-exclusion-zone-the-world-must-react-to-this/,0.94,1264,0,1264
14,worldnews,"Expedition finds cache of cameras on remote Yukon glacier, 85 years after mountaineer left them behind",https://www.cbc.ca/news/canada/north/bradford-washburn-camera-cache-1.6633661,0.97,1229,0,1229
15,worldnews,Panicking Iranian officials seeking British passports to usher families out of country amid protests,https://www.foxnews.com/world/panicking-iranian-officials-seeking-british-passports-usher-family-members-out-country-amid-protests-report.amp?fbclid=IwAR3aMHxm1hIF2CLLcihZ0zYlO9N7CJUsAP2fvCeRvbueto8QjwcY12fZaoY,0.94,891,0,891
16,worldnews,Iran charges female journalists who helped break Amini’s story with being CIA spies,https://www.washingtonpost.com/world/2022/10/29/iran-journalists-charged-mahsa-amini-hamedi-mohammadi/,0.96,754,0,754
17,worldnews,Chinese Media Says Beijing to Use 'All Measures Necessary' Against Taiwan,https://www.newsweek.com/china-will-use-all-measures-necessary-control-taiwan-ccp-media-1755609?amp=1,0.92,683,0,683
18,worldnews,B.C. permanently bans use of rat poison,https://www.cbc.ca/news/canada/british-columbia/bc-permanently-bans-rat-poison-1.6633727,0.94,650,0,650
19,worldnews,Zelensky accuses Russia of trying to ‘return the threat of large-scale famine to Africa and Asia’,https://thehill.com/policy/international/russia/3710866-zelensky-accuses-russia-of-trying-to-return-the-threat-of-large-scale-famine-to-africa-and-asia/,0.95,539,0,539
20,worldnews,EU has frozen 17 billion euros in Russian assets,https://www.thesundaily.my/home/eu-has-frozen-17b-euros-in-russian-assets-official-IE10055287,0.97,524,0,524
21,worldnews,"More than 6,000 hatchlings of three species of endangered turtles have been released into lakes and lagoons in Peru's Amazon basin to help them repopulate, officials said Saturday",https://www.france24.com/en/live-news/20221029-more-than-6-000-baby-turtles-are-released-in-peru,0.97,438,0,438
22,worldnews,US Chip Sanctions ‘Kneecap’ China’s Tech Industry,https://www.wired.com/story/us-chip-sanctions-kneecap-chinas-tech-industry/#intcid=_wired-bottom-recirc_765107cf-81b5-495a-81bd-9c5d7d1f040d_cral2-2-reranked-by-vidi,0.96,427,0,427
23,worldnews,Poland chooses US to build its first nuclear power plant,https://abcnews.go.com/Business/wireStory/poland-chooses-us-build-nuclear-power-plant-92343151,0.96,327,0,327
24,worldnews,"/r/WorldNews Live Thread: Russian Invasion of Ukraine Day 249, Part 1 (Thread #390)",https://www.reddit.com/live/18hnzysb1elcs,0.94,320,0,320
25,worldnews,Zelenskyy calls for harsh response to Russia’s withdrawal from “grain deal” from UN and G20,https://www.pravda.com.ua/eng/news/2022/10/29/7374107/,0.95,260,0,260
26,worldnews,Zulu coronation: King Misuzulu crowned in historic South Africa ceremony,https://www.bbc.com/news/world-africa-63426528,0.93,255,0,255
