,subreddit,title,url,upvote_ratio,ups,downs,score
0,worldnews,Paedophiles could be stripped of parental rights under new law,https://www.bbc.com/news/uk-68830796,0.94,14588,0,14588
1,worldnews,European Parliament demands Palestinian Authority removes antisemitism from curriculum,https://allisrael.com/european-parliament-demands-palestinian-authority-removes-antisemitism-from-curriculum,0.88,7639,0,7639
2,worldnews,"Europeans care more about elephants than people, says Botswana president",https://www.theguardian.com/global-development/2024/apr/17/europeans-care-more-about-elephants-than-people-says-botswana-president-aoe?CMP=share_btn_url,0.91,7628,0,7628
3,worldnews,'Death to Israel' in Turkish parliament during Erdogan speech,https://www.ynetnews.com/article/h1b7hualr,0.94,5727,0,5727
4,worldnews,Sexual assault and brutal beatings: Iran renews violent hijab crackdown,https://m.jpost.com/middle-east/iran-news/iran-renews-violent-hijab-crackdown-widespread-arrests-reported-797603,0.93,4902,0,4902
5,worldnews,Iran president warns of 'massive' response if Israel launches 'tiniest invasion',https://apnews.com/article/israel-iran-hamas-latest-04-17-2024-7e4ba24fbb150f020a2d240dad9d462f,0.94,3327,0,3327
6,worldnews,"UK's Cameron, in Israel, says Israelis have decided to retaliate against Iran",https://www.reuters.com/world/middle-east/us-allies-plan-more-iran-sanctions-israel-war-cabinet-meet-again-2024-04-17/,0.92,2841,0,2841
7,worldnews,"9 arrests in Pearson gold heist, as police recover just $90K out of $20M in missing gold",https://www.thestar.com/news/gta/arrests-in-gold-and-cash-heist-at-pearson/article_fdf14418-fca8-11ee-94eb-13142f8dfcca.html,0.98,2724,0,2724
8,worldnews,"Nestlé flouts guidelines, adds sugar to infant milk sold in poorer nations: Report reveals added sugar in Nestlé’s baby-food products sold in Asia, Africa, and Latin America, while Nestlé’s main European markets, including the UK do not contain added sugar in formulas for young children.",https://www.firstpost.com/world/nestle-flouts-guidelines-adds-sugar-to-infant-milk-sold-in-poorer-nations-report-finds-13760564.html,0.97,2089,0,2089
9,worldnews,Hackers Linked to Russia’s Military Claim Credit for Sabotaging US Water Utilities,https://www.wired.com/story/cyber-army-of-russia-reborn-sandworm-us-cyberattacks/,0.96,2068,0,2068
10,worldnews,"Ukrainian Surgeons Perform Successful Brain Surgery on 4-year-old Northern Irish Child: The girl suffered from a rare form of epilepsy and UK doctors were reportedly unwilling to perform the complex surgery, eventually leading the family to seek help from a team of specialists in Lviv.",https://www.kyivpost.com/post/31247,0.96,2066,0,2066
11,worldnews,Israeli mayor says will name neighborhood after Joe Biden,https://www.ynetnews.com/article/skpe9116er,0.84,1858,0,1858
12,worldnews,"UK lawmakers back landmark bill to gradually phase out smoking for good. Once implemented — officials are aiming for 2027 — the legal age of sale that people in England can buy cigarettes will be raised by one year, every year until it is eventually illegal for the whole population.",https://abcnews.go.com/International/wireStory/uk-lawmakers-vote-landmark-bill-aiming-create-countrys-109299538,0.93,1541,0,1541
13,worldnews,"Iranians leaving Syria bases fearing Israeli attack, report",https://www.ynetnews.com/article/b1u0ewag0#autoplay,0.94,1289,0,1289
14,worldnews,"Netanyahu brushes off calls for restraint, saying Israel will decide how to respond to Iran's attack",https://apnews.com/article/israel-iran-tensions-hamas-war-news-32b1875bcf167b17ed28172f7146eaf7,0.9,1216,0,1216
15,worldnews,Erdogan to host Hamas chief Haniyeh in Turkey this weekend,https://www.timesofisrael.com/erdogan-to-host-hamas-chief-haniyeh-in-turkey-this-weekend/,0.94,1016,0,1016
16,worldnews,China sounds warning after Philippines and US announce most expansive military drills yet,https://www.theguardian.com/world/2024/apr/18/china-warning-balikatan-exercise-2024-philippines-us-military-drills,0.94,953,0,953
17,worldnews,"Striking Iran's nuclear facilities 'on the table', says ex-Mossad intelligence chief",https://news.sky.com/story/middle-east-latest-un-nuclear-watchdog-concerned-israel-could-target-iranian-nuclear-facilities-in-revenge-attack-12978800,0.92,902,0,902
18,worldnews,"German chancellor urges Xi Jinping to press Russia to end Ukraine war, saying ‘China’s word carries weight’",https://www.theguardian.com/world/2024/apr/17/german-chancellor-urges-xi-jinping-to-press-russia-to-end-ukraine-war-saying-chinas-word-carries-weight,0.95,636,0,636
19,worldnews,Amsterdam banning the construction of new hotels anywhere in the city,https://nltimes.nl/2024/04/17/amsterdam-banning-construction-new-hotels-anywhere-city,0.97,598,0,598
20,worldnews,/r/WorldNews Live Thread: Iran attacks Israel (Thread 4),https://www.reddit.com/live/1bsso361afr0r,0.84,580,0,580
21,worldnews,Qatar ending role as mediator in Israel-Hamas talks,https://www.ynetnews.com/article/s12lwopec,0.84,275,0,275
22,worldnews,"/r/WorldNews Live Thread: Russian Invasion of Ukraine Day 785, Part 1 (Thread #931)",https://www.reddit.com/live/18hnzysb1elcs,0.98,232,0,232
23,worldnews,Canada to start taxing tech giants in 2024 despite US complaints,https://techxplore.com/news/2024-04-canada-taxing-tech-giants-complaints.html,0.95,201,0,201
24,worldnews,Amsterdam bans new hotels in fight against mass tourism,https://www.reuters.com/world/europe/amsterdam-bans-new-hotels-fight-against-mass-tourism-2024-04-17/,0.94,126,0,126
25,worldnews,New footage published of Hamas kidnapping of Yarden Bibas,https://m.jpost.com/israel-hamas-war/article-797609,0.85,104,0,104
26,worldnews,Dutch PM offers to buy Patriot systems from allies for Ukraine,https://kyivindependent.com/dutch-pm-offers-to-buy-patriot-systems-from-allies-for-ukraine/,0.97,101,0,101
