,subreddit,title,url,upvote_ratio,ups,downs,score
0,worldnews,"Brazil's electoral court rejects Bolsonaro election challenge, also fined the parties in Bolsonaro's coalition to the tune of 22.9 million reais for what the court described as bad faith litigation.",https://www.theguardian.com/world/2022/nov/24/brazil-judge-fines-bolsonaro-allies-millions-after-bad-faith-election-challenge,0.96,25680,0,25680
1,worldnews,"Latvia plans to scrap Russian language classes, Lithuania may follow suit",https://www.lrt.lt/en/news-in-english/19/1827634/latvia-plans-to-scrap-russian-language-classes-lithuania-may-follow-suit,0.94,25568,0,25568
2,worldnews,Strike on Ukrainian maternity hospital kills 2-day-old baby,https://apnews.com/article/40fcb95d1940825b99188256ee218d0d,0.95,15697,0,15697
3,worldnews,Scotland blocked from holding independence vote by UK's Supreme Court,https://www.cnn.com/2022/11/23/uk/scottish-indepedence-court-ruling-gbr-intl/index.html,0.95,12244,0,12244
4,worldnews,"Ukrainian families reunite with children they say Russia kidnapped, put up for adoption",https://abcnews.go.com/International/ukrainian-families-reunite-children-russia-kidnapped-put-adoption/story?id=93798931,0.97,9393,0,9393
5,worldnews,"European Parliament has declared Russia as a ""state sponsor of terrorism""",http://www.euronews.com/my-europe/2022/11/23/ukraine-war-european-parliament-declares-russia-a-state-sponsor-of-terrorism,0.97,7600,0,7600
6,worldnews,Germany players cover mouths in team photo amid armband row,https://www.reuters.com/lifestyle/sports/germany-players-cover-mouths-team-photo-amid-armband-row-2022-11-23/,0.94,6797,0,6797
7,worldnews,"Twin blasts in Jerusalem kill 16-year-old, injure 18 in morning bus station attack",https://www.washingtonpost.com/world/2022/11/23/israel-jerusalem-bomb-bus-explosions/,0.94,6410,0,6410
8,worldnews,"Hamas, other terrorist groups, praise Jerusalem bombing attack",https://www.jpost.com/breaking-news/article-723170,0.89,5888,0,5888
9,worldnews,EU Parliament website down after passing resolution calling Russia a 'state sponsor of terrorism',https://www.msn.com/en-za/news/other/eu-parliament-website-down-after-passing-resolution-calling-russia-a-state-sponsor-of-terrorism/ar-AA14soPS,0.97,4274,0,4274
10,worldnews,Indian police say rats ate 600kg of cannabis from station storeroom,https://www.thenationalnews.com/world/2022/11/23/indian-police-say-rats-ate-600kg-of-cannabis-from-station-storeroom/?outputType=amp,0.97,3703,0,3703
11,worldnews,Finland and Sweden step up military aid to Ukraine ahead of winter,https://www.euronews.com/2022/11/23/finland-and-sweden-step-up-military-aid-to-ukraine-ahead-of-winter,0.97,2663,0,2663
12,worldnews,Türkiye's president vows to launch ground invasion of northern Syria,https://www.abc.net.au/news/2022-11-24/tuerkiye-president-vows-to-invade-northern-syria/101691884,0.93,2541,0,2541
13,worldnews,Zelensky says Russia using cold as 'weapon of mass destruction' - Insider Paper,https://insiderpaper.com/zelensky-says-russia-using-cold-as-weapon-of-mass-destruction/,0.93,2508,0,2508
14,worldnews,Boris Johnson claims France was 'in denial' before Russia's invasion of Ukraine,https://edition.cnn.com/2022/11/22/europe/boris-johnson-ukraine-invasion-europe-comments-intl/index.html,0.9,1654,0,1654
15,worldnews,Russia relaunches Soviet-era Moskvich car brand using a former Renault plant,https://www.cnbc.com/2022/11/23/russia-relaunches-soviet-era-moskvich-car-brand-using-a-former-renault-plant.html,0.94,1522,0,1522
16,worldnews,"Measles is now an imminent global threat, WHO and CDC say in a new report",https://www.nbcnews.com/health/health-news/measles-imminent-global-threat-due-pandemic-cdc-who-rcna58576,0.95,1512,0,1512
17,worldnews,UN report details horrifying Ukrainian accounts of abuse and torture in Russian prisons,https://www.cnbc.com/2022/11/23/ukraine-war-un-report-details-abuse-and-torture-in-russian-prisons.html,0.95,1496,0,1496
18,worldnews,"Ukrainians suffer in cold, darkness as president implores U.N. to punish Russia",https://www.reuters.com/world/europe/ukraine-setting-up-invincibility-centres-help-provide-heat-water-2022-11-22/,0.96,1295,0,1295
19,worldnews,Germany's Scholz says Putin can no longer win in Ukraine,https://www.dw.com/en/germanys-scholz-says-putin-can-no-longer-win-in-ukraine/a-63866430?maca=en-rss-en-all-1573-rdf,0.95,1178,0,1178
20,worldnews,Denmark FA consider withdrawing from FIFA as armband ban fallout continues,https://sportsbrief.com/football/28577-denmark-considering-withdrawing-fifa-nations-lose-confidence-footballs-governing-body/,0.97,1015,0,1015
21,worldnews,Russian Troops Fire At Own Soldiers While Retreating; Some Abandoned Without Food,https://www.ibtimes.com/russian-troops-fire-own-soldiers-while-retreating-some-abandoned-without-food-3639738,0.97,926,0,926
22,worldnews,Pope Francis compares Russia’s war in Ukraine to 1930s famine inflicted by Stalin,https://english.alarabiya.net/News/world/2022/11/23/Pope-Francis-compares-Russia-s-war-in-Ukraine-to-1930s-famine-inflicted-by-Stalin,0.94,683,0,683
23,worldnews,A protest rally in Tokyo on Nov. 25 will demand that Amazon.com provide better pay and shorter hours for delivery drivers in Japan who say their current working conditions are cruel and dangerous,https://www.asahi.com/ajw/articles/14775536,0.96,577,0,577
24,worldnews,Russian airstrikes on Ukraine are 'state terrorism',https://www.dw.com/en/russian-airstrikes-on-ukraine-are-state-terrorism/a-63866931,0.95,438,0,438
25,worldnews,"/r/WorldNews Live Thread: Russian Invasion of Ukraine Day 274, Part 1 (Thread #415)",https://www.reddit.com/live/18hnzysb1elcs,0.97,275,0,275
