,subreddit,title,url,upvote_ratio,ups,downs,score
0,worldnews,Russia Must ‘Feel the War It Started’ – Zelensky,https://www.kyivpost.com/post/78918,0.97,17335,0,17335
1,worldnews,Spain Records 212 Deaths Due To Heatwave In 4 Days,https://www.ndtv.com/world-news/spain-records-212-deaths-due-to-heatwave-in-4-days-report-11686151,0.97,17076,0,17076
2,worldnews,"Russia's 4th-largest oil refinery shuts down after Ukrainian drone strike, Reuters reports",https://kyivindependent.com/russias-4th-largest-oil-refinery-shuts-down-after-ukrainian-drone-strike-reuters-reports/,0.98,11428,0,11428
3,worldnews,Putin Pressures Lukashenko to Open New Front Against Ukraine as Belarus Resists,https://www.kyivpost.com/post/78950,0.97,6892,0,6892
4,worldnews,France intercepts Russian shadow fleet oil tanker off coast of Sicily,https://www.euronews.com/my-europe/2026/06/25/macron-says-france-intercepted-a-russian-shadow-fleet-oil-tanker-off-coast-of-sicily,0.98,6297,0,6297
5,worldnews,Ukraine war briefing: Zelenskyy declares 40-day Russia blitz to ‘influence the aggressor state’ | Ukraine,https://www.theguardian.com/world/2026/jun/26/ukraine-war-briefing-zelenskyy-40-day-russia-blitz,0.98,5879,0,5879
6,worldnews,"Ukrainian troops raise flag on Kinburn Spit in Mykolaiv Oblast held by Russian forces since 2022, military says",https://kyivindependent.com/ukrainian-troops-raise-flag-on-kinburn-spit-in-mykolaiv-oblast-held-by-russian-forces-since-2022-military-says/,0.98,5057,0,5057
7,worldnews,Russia Turns to India for Gasoline as Drone Strikes Cut Output by 25%,https://www.kyivpost.com/post/78905,0.97,3744,0,3744
8,worldnews,"As Ukraine seizes ‘first chance to win’, war horrors come home to Russia | Russia-Ukraine war News | Al Jazeera",https://www.aljazeera.com/news/2026/6/25/as-ukraine-seizes-first-chance-to-win-war-horrors-come-home-to-russia,0.97,3336,0,3336
9,worldnews,First-ever Code Red alert issued for heat in the Netherlands; Up to 40°C tomorrow,https://nltimes.nl/2026/06/25/first-ever-code-red-alert-issued-heat-netherlands-40degc-tomorrow,0.98,2857,0,2857
10,worldnews,Zelenskyy says Russia is shifting air defenses to Moscow and other key sites after drone strikes,https://apnews.com/article/russia-ukraine-war-drones-crimea-trump-25dc47db4d1a3b2908b8f060434aa765,0.98,1889,0,1889
11,worldnews,"Russia preparing possible ‘provocation’ in Baltic states or Poland, sources say",https://www.theguardian.com/world/2026/jun/26/russia-provocation-baltic-states-poland,0.95,1596,0,1596
12,worldnews,Israel to weigh first official recognition of Armenian genocide amid tensions with Turkey,https://www.ynetnews.com/article/s1njagozfe,0.91,1225,0,1225
13,worldnews,"European heatwave is worst ever and impossible without climate crisis, scientists say | Climate crisis",https://www.theguardian.com/environment/2026/jun/26/europe-heatwave-impossible-without-climate-crisis-scientists,0.96,1116,0,1116
14,worldnews,European Parliament President attempts to push through rejected Chat Control again tomorrow,https://www.politico.eu/article/president-vs-parliament-roberta-metsola-overrides-meps-bid-force-child-abuse-law/,0.96,1090,0,1090
15,worldnews,IDF captures Hezbollah drone factory and launch site hidden inside south Lebanon mountain,https://www.timesofisrael.com/idf-captures-hezbollah-drone-factory-and-launch-site-hidden-inside-south-lebanon-mountain/,0.81,932,0,932
16,worldnews,"Secretary general ahead of NATO summit to Russia: ""We know what you guys are doing and we are better at it""",https://www.pravda.com.ua/eng/news/2026/06/26/8041163/,0.97,808,0,808
17,worldnews,Canada commits $5M in aid as Venezuela reels from deadly earthquakes,https://globalnews.ca/news/11938151/canada-venezuela-earthquakes-aid/,0.96,461,0,461
18,worldnews,Iran strikes vessel pausing UN efforts to evacuate ships from Hormuz,https://edition.cnn.com/2026/06/25/middleeast/un-pauses-hormuz-evacuation-after-us-says-iran-behind-attack-intl-latam,0.94,408,0,408
19,worldnews,EU to propose blocking military-age Ukrainian men from refugee status,https://tvpworld.com/94012424/eu-to-propose-restricting-refugee-status-for-ukrainian-men-of-military-age,0.94,395,0,395
20,worldnews,"Samsung to announce $648 billion investments in South Korea, media report says",https://www.reuters.com/world/asia-pacific/samsung-invest-1000-trillion-won-south-korea-media-report-says-2026-06-25/,0.97,339,0,339
21,worldnews,Russia's Fourth-Largest Oil Refinery Suspends Operations After Ukrainian Drone Strike,https://united24media.com/war-in-ukraine/russias-fourth-largest-oil-refinery-suspends-operations-after-ukrainian-drone-strike-20187,0.99,328,0,328
22,worldnews,/r/WorldNews Discussion Thread: US and Israel launch attack on Iran; Iran retaliates (Thread #19),https://www.reddit.com/r/worldnews/comments/1u39jcq/rworldnews_discussion_thread_us_and_israel_launch/,0.9,238,0,238
23,worldnews,"/r/WorldNews Live Thread: Russian Invasion of Ukraine Day 1583, Part 1 (Thread #1730)",https://www.reddit.com/live/18hnzysb1elcs,0.96,203,0,203
24,worldnews,"India launches Operation Amistad: Dispatches 41 member medical team, relief supplies to earthquake-hit Venezuela",https://m.economictimes.com/news/defence/operation-amistad-india-dispatches-medical-team-relief-supplies-to-earthquake-hit-venezuela/amp_articleshow/132011589.cms,0.89,103,0,103
