,subreddit,title,url,upvote_ratio,ups,downs,score
0,worldnews,Zelenskyy: return of draft-age Ukrainian men from abroad is a matter of fairness,https://www.pravda.com.ua/eng/news/2026/04/14/8030112/,0.93,19332,0,19332
1,worldnews,Pentagon prepares for possible military operation in Cuba,https://eu.usatoday.com/story/news/world/2026/04/15/pentagon-ramps-up-secret-cuba-planning-trump/89623722007/,0.96,14248,0,14248
2,worldnews,"'Xi will give me big, fat hug': Trump says he opened Hormuz for China and the world",https://timesofindia.indiatimes.com/world/us/xi-will-give-me-big-fat-hug-trump-says-he-opened-hormuz-for-china-and-the-world/articleshow/130284475.cms,0.95,13249,0,13249
3,worldnews,New World Screwworm detected about 90 miles from the United States,https://www.kalb.com/2026/04/14/new-world-screwworm-detected-about-90-miles-united-states/,0.97,11099,0,11099
4,worldnews,US stacks three carrier groups and 10 destroyers to blockade Strait of Hormuz,https://www.thenationalnews.com/news/mena/2026/04/15/us-stacks-three-carrier-groups-and-10-destroyers-to-blockade-strait-of-hormuz/,0.95,9939,0,9939
5,worldnews,"Pope Leo, attacked again by Trump, says world needs message of peace",https://www.reuters.com/world/africa/pope-leo-attacked-again-by-trump-flies-cameroon-africa-tour-2026-04-15/,0.98,9484,0,9484
6,worldnews,Iran to execute first woman over anti-regime protests,https://torontosun.com/news/world/iran-execute-first-woman-anti-regime-protests,0.92,8062,0,8062
7,worldnews,Marines on way to Middle East seen using rifles with anti-drone smart scope,https://taskandpurpose.com/news/marines-drone-optic-2026/,0.97,7553,0,7553
8,worldnews,NATO Allies Pledge $60 Billion in Military Aid to Ukraine for 2026,https://www.kyivpost.com/post/74017,0.98,6659,0,6659
9,worldnews,Greenland's prime minister says citizens 'don't feel safe' after Trump's threats,https://www.nbcnews.com/politics/politics-news/greenland-prime-minister-citizens-dont-feel-safe-trump-threats-nato-rcna331857,0.97,4476,0,4476
10,worldnews,"Ukraine said it captured a Russian position using only ground robots and drones, no infantry, for the first time",https://www.businessinsider.com/ukraine-russia-position-taken-without-using-troops-just-robots-drones-2026-4,0.97,3474,0,3474
11,worldnews,Moscow walks away with billions as Trump's Russian oil waiver expires,https://kyivindependent.com/moscow-walks-away-with-billions-as-trumps-russian-oil-waiver-expires/,0.97,3379,0,3379
12,worldnews,"On Israel’s Holocaust Remembrance Day, Zelensky criminalizes antisemitism in Ukraine",https://www.timesofisrael.com/on-israels-holocaust-remembrance-day-zelensky-criminalizes-antisemitism-in-ukraine/,0.86,2713,0,2713
13,worldnews,Critical Atlantic current significantly more likely to collapse than thought,https://www.theguardian.com/environment/2026/apr/15/critical-atlantic-current-significantly-more-likely-to-collapse-than-thought,0.97,2541,0,2541
14,worldnews,Iran reportedly bought an in-orbit Chinese satellite to target US military sites in the Middle East — purchase agreement included ongoing ground control services based in China,https://www.tomshardware.com/tech-industry/iran-reportedly-bought-an-in-orbit-chinese-satellite-to-target-us-military-sites-in-the-middle-east-purchase-agreement-included-ongoing-ground-control-services-based-in-china,0.97,2334,0,2334
15,worldnews,Ukrainian Air Defense Intercepts All Russian Missiles in Under an Hour,https://united24media.com/latest-news/ukrainian-air-defense-intercepts-all-russian-missiles-in-under-an-hour-17953,0.97,1637,0,1637
16,worldnews,Norway Man Cured of HIV With Brother’s Stem Cells | The Oslo patient is the first person to be cured by a family member's bone marrow transplant.,https://gizmodo.com/norway-man-cured-of-hiv-with-brothers-stem-cells-2000746285,0.99,1534,0,1534
17,worldnews,"China tests deep-sea electro-hydrostatic actuator that can cut undersea cables at a depth of 3,500 meters",https://www.tomshardware.com/tech-industry/china-tests-deep-sea-electro-hydrostatic-actuator-that-can-cut-undersea-cables-at-a-depth-of-3-500-meters-state-hails-successful-trial-and-hints-at-deployment-readiness,0.96,1525,0,1525
18,worldnews,Vance calls end of Ukraine aid 'one of the proudest' achievements of Trump administration,https://kyivindependent.com/vance-calls-ending-ukraine-aid-one-of-the-proudest-achievements-of-trump-admin/,0.95,1245,0,1245
19,worldnews,US Navy blockade seems to be working as Iran-linked vessels halt or reverse course in Strait of Hormuz,https://www.smh.com.au/world/middle-east/trump-s-strait-of-hormuz-blockade-seems-to-be-working-so-far-20260416-p5zoan.html,0.83,939,0,939
20,worldnews,"Turkey, which had experienced almost no school shootings in its history until this week, experienced 2 school shootings in just two days.",https://www.bbc.com/news/articles/cn088n9e6e9o,0.96,827,0,827
21,worldnews,Pakistan hospital at centre of child HIV outbreak caught reusing syringes in BBC film,https://www.bbc.com/news/articles/clyrd818gd2o,0.97,653,0,653
22,worldnews,UK announces biggest ever drone package for Ukraine to push back Putin,https://www.gov.uk/government/news/uk-announces-biggest-ever-drone-package-for-ukraine-to-push-back-putin,0.96,579,0,579
23,worldnews,"/r/WorldNews Live Thread: Russian Invasion of Ukraine Day 1511, Part 1 (Thread #1658)",https://www.reddit.com/live/18hnzysb1elcs,0.97,492,0,492
24,worldnews,/r/WorldNews Discussion Thread: US and Israel launch attack on Iran; Iran retaliates (Thread #15),https://www.reddit.com/r/worldnews/comments/1shqn32/rworldnews_discussion_thread_us_and_israel_launch/,0.89,217,0,217
