,subreddit,title,url,upvote_ratio,ups,downs,score
0,worldnews,"Woman arrested in plot to assassinate President Volodymyr Zelenskyy, Ukraine says",https://abcnews.go.com/International/woman-arrested-plot-kill-president-volodymyr-zelenskyy-ukraine/story?id=102065597&amp;cid=social_twitter_abcn,0.95,19799,0,19799
1,worldnews,Nazi symbols and child pornography found in German police chats,https://www.euronews.com/2023/08/07/nazi-symbols-and-child-pornography-found-in-german-police-chats,0.94,14986,0,14986
2,worldnews,Kremlin Says 'Theoretically Possible' to Not Hold Presidential Elections,https://www.themoscowtimes.com/2023/08/07/kremlin-says-theoretically-possible-to-not-hold-presidential-elections-a82073,0.96,9468,0,9468
3,worldnews,Hackers break into website of Moscow Technical Inventory Bureau: Data transferred to Ukrainian forces,https://www.pravda.com.ua/eng/news/2023/08/7/7414519/,0.98,7280,0,7280
4,worldnews,"Thousands of US troops arrive in Red Sea amid ratcheting Iran tensions: More than 3,000 US sailors and marines aboard two warships have reached the Red Sea, US Navy says.",https://www.aljazeera.com/news/2023/8/7/thousands-of-us-troops-arrive-in-red-sea-amid-ratcheting-iran-tensions,0.97,5062,0,5062
5,worldnews,Russians attack Zaporizhzhia Oblast with projectiles loaded with chemical substance,https://www.pravda.com.ua/eng/news/2023/08/7/7414558/,0.96,4569,0,4569
6,worldnews,North Korean hackers breach computers of Russian corporation that produces cruise missiles,https://www.pravda.com.ua/eng/news/2023/08/7/7414545/,0.98,3173,0,3173
7,worldnews,U.S. lab says it repeated fusion energy feat — with higher yield,https://www.washingtonpost.com/climate-solutions/2023/08/06/nuclear-fusion-net-energy-gain-higher-yield/,0.97,2555,0,2555
8,worldnews,Tensions rise as Belarus begins military drills near Poland and Lithuania,https://www.theguardian.com/world/2023/aug/07/tensions-rise-as-belarus-begins-military-drills-near-poland-and-lithuania,0.97,2380,0,2380
9,worldnews,Taliban Prepare Suicide Bombers in Water Dispute With Iran,https://time.com/6302192/taliban-suicide-bombers-water-dispute-iran,0.97,2365,0,2365
10,worldnews,FBI agents’ murders leads police in Australia to rescue 13 children from alleged paedophile ring,https://www.theguardian.com/australia-news/2023/aug/08/australia-paedophile-ring-fbi-agent,0.97,2012,0,2012
11,worldnews,"China hacked Japan’s sensitive defense networks, officials say",https://www.washingtonpost.com/national-security/2023/08/07/china-japan-hack-pentagon/,0.97,1269,0,1269
12,worldnews,Japanese military’s role in “comfort women” system of sexual slavery has disappeared from the country's textbooks,https://english.hani.co.kr/arti/english_edition/e_international/1103348.html,0.95,1147,0,1147
13,worldnews,Biden signs law implementing first part of U.S. trade pact with Taiwan,https://www.reuters.com/world/us/biden-signs-law-implementing-first-part-us-trade-pact-with-taiwan-2023-08-07/,0.97,990,0,990
14,worldnews,"Ukraine says Jeddah talks 'huge blow' to Russia, new meeting agreed",https://www.reuters.com/world/ukraine-says-jeddah-talks-huge-blow-russia-new-meeting-agreed-2023-08-07/,0.97,898,0,898
15,worldnews,"Polish Border Guard asks for 1,000 more soldiers on Belarus frontier",https://www.reuters.com/world/europe/polish-border-guard-asks-1000-more-soldiers-belarus-frontier-2023-08-07/,0.97,890,0,890
16,worldnews,Ukraine declares war on Russia’s Black Sea shipping,https://www.politico.eu/article/ukraine-declares-war-on-russia-black-sea-shipping/?utm_source=RSS_Feed&amp;utm_medium=RSS&amp;utm_campaign=RSS_Syndication,0.97,757,0,757
17,worldnews,An Indigenous leader has inspired an Amazon city to grant personhood to an endangered river,https://apnews.com/article/brazil-amazon-wari-indigenous-nature-rights-deforestation-68af65663fb7bd1b9d2051ce10c17a46,0.95,662,0,662
18,worldnews,WHO issues global alert on a cold medicine made in India after a Bloomberg News test found it was tainted with toxic chemicals,https://www.bloomberg.com/news/articles/2023-08-07/who-warns-about-tainted-medicine-found-by-bloomberg-in-iraq?sref=xuVirdpv,0.95,602,0,602
19,worldnews,Indigenous leaders from across South America called Monday for bold steps to protect the Amazon and their ancestral lands ahead of a summit on saving the world's biggest rainforest,https://www.france24.com/en/live-news/20230807-indigenous-groups-call-for-bold-steps-at-amazon-summit,0.98,500,0,500
20,worldnews,Norway fines Facebook owner Meta over privacy breaches,https://www.reuters.com/technology/norway-data-regulator-fine-meta-over-privacy-breaches-2023-08-07/,0.97,339,0,339
21,worldnews,Italy earmarks €2.9 million to tackle blue crab invasion,https://www.channelnewsasia.com/world/italy-earmarks-eu29-million-tackle-blue-crab-invasion-3683066,0.95,274,0,274
22,worldnews,"/r/WorldNews Live Thread: Russian Invasion of Ukraine Day 531, Part 1 (Thread #677)",https://www.reddit.com/live/18hnzysb1elcs,0.98,265,0,265
23,worldnews,Japan urges Iran not to provide Russia with weapons for Ukraine war,https://english.kyodonews.net/news/2023/08/425afa574884-japan-urges-iran-not-to-provide-russia-with-weapons-for-ukraine-war.html,0.99,250,0,250
24,worldnews,Covid vaccine makers' stocks crash to multiyear lows,https://www.forbes.com.au/news/investing/covid-vaccine-makers-stocks-crash-to-multiyear-lows-monday-as-sales-keep-sliding/,0.92,187,0,187
25,worldnews,Pro-Ukrainian hackers breach Moscow engineering service website,https://english.nv.ua/nation/pro-ukrainian-hackers-breach-moscow-engineering-service-website-news-50344511.html,0.95,152,0,152
