,subreddit,title,url,upvote_ratio,ups,downs,score
0,worldnews,"U.S. Navy destroyers dispatched to Aleutians after Chinese, Russian vessels spotted nearby",https://www.alaskasnewssource.com/2023/08/06/us-navy-destroyers-dispatched-aleutians-after-chinese-russian-vessels-spotted-nearby/,0.96,14106,0,14106
1,worldnews,A flightless parrot is returning to mainland New Zealand after a 40-year absence,https://www.popsci.com/environment/kakapo-parrot-new-zealand/?fbclid=IwAR3uo_qJzXjeGgzg6TZlLvvYp8wwpg-4AbC7VvHUjW79GLoXB9bmgTyQz5Q,0.97,11024,0,11024
2,worldnews,"Russia spreading false claims about Qur’an burnings to harm Nato bid, says Sweden",https://www.theguardian.com/world/2023/aug/06/russia-spreading-false-claims-about-quran-burnings-to-harm-nato-bid-says-sweden,0.95,8713,0,8713
3,worldnews,Kremlin says they only want Ukrainian territories included in Russian Constitution,https://www.pravda.com.ua/eng/news/2023/08/6/7414442/,0.92,7090,0,7090
4,worldnews,Ukraine gets rid of Soviet symbols on Motherland monument in Kyiv,https://www.reuters.com/world/europe/ukraine-gets-rid-soviet-symbols-motherland-monument-kyiv-2023-08-06/,0.95,7065,0,7065
5,worldnews,"Russia rejects peace agreement, insisting its war in Ukraine will rage on 'for the foreseeable future'",https://www.businessinsider.com/russia-rejects-peace-says-war-to-continue-for-forseeable-future-2023-8?r=US&amp;IR=T,0.96,6289,0,6289
6,worldnews,"Italian PM Giorgia Meloni sues Placebo singer Brian Molko for calling her 'fascist, racist'",https://www.euronews.com/culture/2023/08/04/italian-pm-giorgia-meloni-sues-placebo-singer-brian-molko-for-calling-her-fascist-racist,0.96,5533,0,5533
7,worldnews,Wrongly convicted in Britain no longer forced to pay ‘saved living costs’ in prison,https://www.theguardian.com/society/2023/aug/06/wrongly-convicted-in-britain-no-longer-forced-to-pay-saved-living-costs-in-prison,0.97,3297,0,3297
8,worldnews,US intends to offer 38 second-hand F-16 fighters to Argentina,https://www.airdatanews.com/us-intends-to-offer-38-second-hand-f-16-fighters-to-argentina/,0.95,3046,0,3046
9,worldnews,Hiroshima mayor calls nuclear deterrence 'folly' as city marks 78th anniversary of atomic bombing,https://apnews.com/article/japan-hiroshima-atomic-bomb-nuclear-deterrence-us-0c39ca3b789400e98cf172519ac1f92f,0.95,2763,0,2763
10,worldnews,"Ancient Arrowhead Made of Meteorite Material Found in Switzerland, Mystifying Archaeologists",https://www.artnews.com/art-news/news/ancient-arrowhead-meteorite-switzerland-moringen-1234676110/,0.97,2668,0,2668
11,worldnews,Ukraine strikes key Crimea bridges with Storm Shadow missiles,https://news.yahoo.com/ukraine-strikes-key-crimea-bridges-192831236.html,0.97,2534,0,2534
12,worldnews,"Putin’s secret navy A small group of Western businesses holds back EU sanctions, and keeps money flowing into Russia’s war machine.",https://www.newstatesman.com/the-weekend-report/2023/08/putin-secret-greek-navy,0.97,2477,0,2477
13,worldnews,China releases TV documentary showcasing army's ability to attack Taiwan,https://apnews.com/article/china-taiwan-documentary-attack-invasion-chasing-dreams-4105d5f0bde59337d90f1e67d149b32c,0.93,1740,0,1740
14,worldnews,Ukraine says U.S and German air defence systems 'highly effective',https://www.reuters.com/world/europe/russia-launches-new-burst-missile-drone-attacks-ukrainian-air-force-says-2023-08-06/,0.97,1490,0,1490
15,worldnews,"In Kenya labor dispute, workers who clean up toxic content on Facebook, TikTok and ChatGPT for $3 an hour go to court. Content moderators in the African country have formed a union to defend themselves against Big Tech",https://english.elpais.com/science-tech/2023-08-05/in-kenya-labor-dispute-workers-who-clean-up-toxic-content-on-facebook-tiktok-and-chatgpt-for-3-an-hour-go-to-court.html,0.96,1181,0,1181
16,worldnews,"Slovenia has suffered its worst-ever floods. Damage could top 500 million euros, its leader says",https://apnews.com/article/slovenia-floods-damage-evacuations-roads-bridges-5d81e7b87261fc97f81f384ca52e0f99,0.97,1164,0,1164
17,worldnews,Niger closes airspace as it refuses to reinstate president,https://www.reuters.com/world/africa/calm-pervades-nigers-capital-deadline-reverse-coup-expires-2023-08-06/,0.97,1132,0,1132
18,worldnews,"Pope says Church open to everyone, including LGBT people, but has rules",https://www.reuters.com/world/pope-says-church-open-everyone-including-lgbt-people-has-rules-2023-08-06/,0.87,996,0,996
19,worldnews,A record 270 GW of solar is predicted worldwide for 2023,https://electrek.co/2023/08/03/a-record-270-gw-of-solar-is-predicted-worldwide-for-2023/?fbclid=IwAR2WGlWa2KFlQQNa7u-JF1Kg1YaZEoawj6Skn8UrrV3xwEigaZBdocjU7OU,0.97,515,0,515
20,worldnews,South American winter heatwave reaches almost 40C temperatures,https://www.itv.com/news/2023-08-04/south-american-winter-heatwave-reaches-almost-40c-temperatures,0.95,418,0,418
21,worldnews,"Russia passed a new law on Friday allowing courts to strip foreign owners from hostile countries of stakes in key Russian entities, in a purported attempt to protect strategic companies from foreign influence",https://www.jurist.org/news/2023/08/russia-passes-law-restricting-foreign-investment-in-russian-companies/,0.94,306,0,306
22,worldnews,Iraq on Sunday called on the United States and Britain to extradite former officials accused of facilitating the theft of $2.5 billion in public funds in one of the country's biggest-ever corruption cases,https://www.france24.com/en/middle-east/20230806-iraq-asks-us-uk-to-extradite-ex-officials-in-2-5-billion-corruption-scandal,0.95,305,0,305
23,worldnews,"/r/WorldNews Live Thread: Russian Invasion of Ukraine Day 530, Part 1 (Thread #676)",https://www.reddit.com/live/18hnzysb1elcs,0.97,274,0,274
24,worldnews,"Belarus’ opposition meet in Warsaw, plans strategy against Lukashenka",https://tvpworld.com/71806066/belarus-opposition-meet-in-warsaw-plans-strategy-against-lukashenka,0.97,249,0,249
25,worldnews,"A $700 million superyacht linked to Putin was seized in Italy last year. It's being treated to a refurb while it waits, and authorities won't say who's paying for it.",https://www.businessinsider.com/superyacht-scheherazade-seized-sanctions-vladimir-putin-italy-refurbish-refit-oligarch-2023-8,0.97,140,0,140
