,subreddit,title,url,upvote_ratio,ups,downs,score
0,worldnews,Pope Leo XIV condemns Russia's 'imperialist' invasion of Ukraine,https://kyivindependent.com/pope-leo-xiv-condemns-russias-imperialist-invasion-of-ukraine/,0.95,71552,0,71552
1,worldnews,India declares future terror attacks will be treated as act of war,https://m.economictimes.com/news/defence/india-declares-future-terror-attacks-will-be-treated-as-acts-of-war/articleshow/121056545.cms,0.94,24344,0,24344
2,worldnews,Pakistan launches 'military operation' against India | World News,https://news.sky.com/story/pakistan-launches-military-operation-against-india-13364836,0.95,18199,0,18199
3,worldnews,Violations reported after India and Pakistan agree to ceasefire,https://www.reuters.com/world/india/pakistan-says-three-air-bases-targeted-by-indian-missiles-2025-05-10,0.96,12048,0,12048
4,worldnews,China says it will stand by 'iron-clad friend' Pakistan,https://www.indiatoday.in/world/story/china-supports-pakistan-amid-tensions-with-india-2722893-2025-05-10,0.96,9040,0,9040
5,worldnews,Pope Leo XIV lays out his vision and identifies AI as a main challenge for humanity,https://apnews.com/article/pope-leo-vision-papacy-artificial-intelligence-36d29e37a11620b594b9b7c0574cc358,0.98,5698,0,5698
6,worldnews,US approves transfer of over 200 missiles from Germany to Ukraine - NYT,https://newsukraine.rbc.ua/news/us-approves-transfer-of-over-200-missiles-1746906763.html,0.98,4368,0,4368
7,worldnews,Quebec riding of Terrebonne flips to Liberals after recount shows candidate won by single vote,https://www.cbc.ca/news/politics/terrebone-recount-liberal-1.7532136,0.98,4062,0,4062
8,worldnews,"India-Pakistan conflict: Pakistan DGMO dialled Indian DGMO for ceasefire talks, FS Misri confirms",https://www.indiatvnews.com/news/india/india-pakistan-war-latest-news-pakistan-dgmo-dialled-indian-dgmo-at-3-30-pm-for-ceasefire-talks-fs-vikram-misri-confirms-2025-05-10-989691,0.94,3058,0,3058
9,worldnews,South Africa criticises US plan to accept white Afrikaners as refugees,https://www.bbc.com/news/articles/cx2q937wlqgo,0.93,2684,0,2684
10,worldnews,"China 'Strongly' Urges India, Pakistan To Avoid Escalation",https://www.barrons.com/news/china-strongly-urges-india-pakistan-to-avoid-escalation-a5887249,0.95,2679,0,2679
11,worldnews,"China buys Canadian and Australian wheat as heat hits crop, traders say",https://www.theglobeandmail.com/business/international-business/article-china-buys-canadian-and-australian-wheat-as-heat-hits-crop-traders-say/,0.98,2487,0,2487
12,worldnews,"Russian President Vladimir Putin proposes direct talks with Ukraine in Istanbul on May 15, ""without preconditions""",https://www.yahoo.com/news/russian-president-vladimir-putin-proposes-225805672.html,0.95,2426,0,2426
13,worldnews,"Soviet spacecraft Kosmos 482 crashes back to Earth, disappearing into Indian Ocean after 53 years in orbit",https://www.livescience.com/space/space-exploration/soviet-spacecraft-kosmos-482-crashes-back-to-earth-disappearing-into-indian-ocean-after-53-years-in-orbit,0.98,1829,0,1829
14,worldnews,"US ‘isn’t required to get permission from Israel’ to cut deal with Houthis, US Ambassador to Israel says.",https://www.timesofisrael.com/huckabee-says-us-not-required-to-get-permission-from-israel-to-cut-deal-with-houthis/,0.95,1580,0,1580
15,worldnews,Man admitted to Japan’s 2025 World Expo with 85-year-old ticket,https://www.theguardian.com/world/2025/may/08/japan-world-expo-2025-with-1940-ticket,0.97,1561,0,1561
16,worldnews,Trump says US and China negotiated 'total reset' in Geneva talks,https://www.reuters.com/world/trump-says-us-china-negotiated-total-reset-geneva-talks-2025-05-10/,0.93,1539,0,1539
17,worldnews,Lebanon purges Hezbollah staff from Beirut airport in fatal blow to terror group's smuggling - WSJ,https://www.jpost.com/middle-east/article-853441,0.96,1251,0,1251
18,worldnews,"UK sends ""Ikea-style"" mock-ups of weapons to Ukraine to fool Russians",https://www.pravda.com.ua/eng/news/2025/05/10/7511689/,0.97,1004,0,1004
19,worldnews,"Taiwan faces similar threat to Europe in 1930s, president says",https://www.theguardian.com/world/2025/may/08/taiwan-president-europe-second-world-war,0.91,393,0,393
20,worldnews,Polish nationalists stage anti-immigration demonstration ahead of polls,https://www.rfi.fr/en/international/20250510-polish-nationalists-stage-anti-immigration-demonstration-ahead-of-polls,0.9,314,0,314
21,worldnews,"US ‘not genuine’ in talks over Tehran’s nuclear program, Iranian official says",https://edition.cnn.com/2025/05/10/middleeast/us-iran-nuclear-talks-latam-intl,0.96,297,0,297
22,worldnews,South Korean conservative party fails in a bid to switch presidential candidates,https://apnews.com/article/south-korea-election-conservative-party-candidates-cc3141d0582486c6199b62f25d37445a,0.97,296,0,296
23,worldnews,/r/WorldNews Live Thread: India-Pakistan Conflict (Thread #4),https://www.reddit.com/live/1ez73mze729wj,0.89,259,0,259
24,worldnews,Khamenei endorses ‘Death to America’ chants ahead of nuclear talks,https://m.jpost.com/middle-east/iran-news/article-853447,0.89,181,0,181
25,worldnews,Bangladesh's interim government bans the former ruling party of ousted Prime Minister Sheikh Hasina,https://apnews.com/article/bangladesh-hasina-yunus-awami-league-78b40dfe9c92257f0042968c7b963c2a,0.95,149,0,149
26,worldnews,"/r/WorldNews Live Thread: Russian Invasion of Ukraine Day 1172, Part 1 (Thread #1319)",https://www.reddit.com/live/18hnzysb1elcs,0.98,102,0,102
