,subreddit,title,url,upvote_ratio,ups,downs,score
0,worldnews,"Russia launches massive attack: explosions ring out in Kyiv, Lviv and other cities",https://www.pravda.com.ua/eng/news/2023/12/29/7435024/,0.95,12135,0,12135
1,worldnews,Poland says Russian missile entered airspace then went into Ukraine,https://www.bbc.com/news/world-europe-67839340,0.96,9456,0,9456
2,worldnews,Biden on Russia’s aerial attacks on Ukraine: Putin ‘must be stopped’,https://thehill.com/homenews/administration/4381707-biden-on-russias-aerial-attacks-on-ukraine-putin-must-be-stopped/,0.94,8424,0,8424
3,worldnews,Hong Kong police vow to pursue democratic activist Agnes Chow for life,https://english.kyodonews.net/news/2023/12/baf238064a06-hk-police-vow-to-pursue-democratic-activist-chow-for-life.html,0.96,3393,0,3393
4,worldnews,Putin Shames Gilded Elite After ‘Almost Naked’ Party Scandal,https://www.bloomberg.com/news/articles/2023-12-29/putin-shames-gilded-elite-after-almost-naked-party-scandal,0.93,2933,0,2933
5,worldnews,Putin Forced to Relocate Ships in Crimea After Ukraine Strikes,https://www.bloomberg.com/news/articles/2023-12-29/russian-warship-crimea-ukraine-strikes-force-putin-to-relocate-ships,0.97,2801,0,2801
6,worldnews,Argentina pulls out of plans to join Brics bloc - BBC News,https://www.bbc.co.uk/news/world-latin-america-67842992.amp,0.96,2720,0,2720
7,worldnews,US ambassador: Ukraine urgently needs funding after massive Russian attack,https://kyivindependent.com/us-ambassador-ukraine-needs-funding-now/,0.95,2637,0,2637
8,worldnews,Milei’s mega-decree officially takes effect,https://buenosairesherald.com/politics/mileis-mega-decree-officially-takes-effect,0.94,2316,0,2316
9,worldnews,Beijing will ‘respond resolutely’ if Manila builds permanent structure on disputed reef,https://www.scmp.com/news/china/diplomacy/article/3246710/south-china-sea-beijing-will-respond-resolutely-if-manila-builds-permanent-structure-disputed-reef?module=top_story&amp;pgtype=homepage,0.95,1990,0,1990
10,worldnews,Britain is sending around 200 air defence missiles to Ukraine to help protect civilians and infrastructure from Russian drones and bombing,https://www.reuters.com/world/europe/britain-send-200-air-defence-missiles-ukraine-2023-12-29/,0.97,1921,0,1921
11,worldnews,Zelensky: World must respond to latest manifestation of terror,https://www.pravda.com.ua/eng/news/2023/12/29/7435145/,0.94,1776,0,1776
12,worldnews,South Africa files genocide case against Israel at World Court,https://www.reuters.com/world/south-africa-seeks-international-court-justice-genocide-order-against-israel-2023-12-29/,0.78,1705,0,1705
13,worldnews,"NATO, U.S. Consult With Warsaw After Apparent Intrusion Of Russian Missile Into Polish Airspace",https://www.rferl.org/a/nato-russia-missile-poland-airspace/32752828.html,0.97,1700,0,1700
14,worldnews,"Canada condemns Russian missile, drone attacks against Ukraine",https://www.ukrinform.net/rubric-polytics/3806735-canada-condemns-russian-missile-drone-attacks-against-ukraine.html,0.95,1634,0,1634
15,worldnews,Israel's military says it used the wrong bombs in strike on a Gaza refugee center that killed at least 86 people,https://www.businessinsider.com/idf-israel-wrong-bomb-refugee-center-attack-gaza-2023-12,0.8,1231,0,1231
16,worldnews,"Turkey says it arrested 32 suspected ISIS terrorists planning attacks against synagogues, churches - I24NEWS",https://www.i24news.tv/en/news/middle-east/levant-turkey/1703863793-arresting-32-suspected-terrorists-turkey-says-it-foiled-an-isis-plot-targeting-synagogues-churches,0.97,1197,0,1197
17,worldnews,Saudi TV says 11 senior IRGC members killed in Israel Syria strike,https://www.ynetnews.com/article/cwdq24jra,0.94,1030,0,1030
18,worldnews,Israel proposes a partial withdrawal of troops from Gaza in exchange for release of hostages,https://english.elpais.com/international/2023-12-29/israel-proposes-a-partial-withdrawal-of-troops-from-gaza-in-exchange-for-release-of-hostages.html,0.91,626,0,626
19,worldnews,/r/WorldNews Live Thread for 2023 Israel-Hamas Crisis (Thread 44),https://www.reddit.com/live/1bsso361afr0r,0.86,536,0,536
20,worldnews,Burundi president calls for stoning of gay couples,https://www.vanguardngr.com/2023/12/burundi-president-calls-for-stoning-of-gay-couples/,0.9,495,0,495
21,worldnews,Israel hoping to push UNRWA out of Gaza post-war -- report,https://www.timesofisrael.com/israel-hoping-to-push-unrwa-out-of-gaza-post-war-report/,0.86,409,0,409
22,worldnews,"Dmitry Medvedev has declared Russia's intention to capture the Ukrainian cities of Odessa, Dnipro, Kharkiv, Mykolaiv, and Kyiv",https://odessa-journal.com/dmitry-medvedev-has-declared-russias-intention-to-capture-the-ukrainian-cities-of-odessa-dnipro-kharkiv-mykolaiv-and-kyiv,0.93,363,0,363
23,worldnews,"Israel Discovers Hideout of Hamas Terror Chief Built Over Massive Secret Tunnel System, Destroys Both",https://themessenger.com/news/israel-discovers-hideout-hamas-terror-chief-secret-tunnels-sinwar-gaza,0.88,333,0,333
24,worldnews,Russia pivots oil sales to India amid Ukraine sanctions,https://www.dw.com//en/russia-pivots-oil-sales-to-india-amid-ukraine-sanctions/a-67831351,0.9,235,0,235
25,worldnews,"/r/WorldNews Live Thread: Russian Invasion of Ukraine Day 675, Part 1 (Thread #821)",https://www.reddit.com/live/18hnzysb1elcs,0.96,180,0,180
26,worldnews,Analysis: Putin promises Xi to 'fight for five years' in Ukraine,https://asia.nikkei.com/Editor-s-Picks/China-up-close/Analysis-Putin-promises-Xi-to-fight-for-five-years-in-Ukraine,0.82,84,0,84
