,subreddit,title,url,upvote_ratio,ups,downs,score
0,worldnews,"Biden approves antipersonnel mines for Ukraine, undoing his own policy ",https://www.washingtonpost.com/national-security/2024/11/19/biden-landmines-ukraine-russia/?utm_campaign=wp_main&amp;utm_medium=social&amp;utm_source=reddit.com,0.93,28282,0,28282
1,worldnews,Biden administration moves to forgive $4.7 billion of loans to Ukraine,https://www.reuters.com/world/biden-administrations-moves-forgive-47-billion-loans-ukraine-2024-11-20/,0.91,20319,0,20319
2,worldnews,"Russian Army division hit by desertions of ""whole regiment"": Report",https://www.newsweek.com/russian-army-division-hit-desertions-whole-regiment-report-1988712,0.95,20222,0,20222
3,worldnews,'Putin is weaker than US' — Zelensky outlines US role in ending war in Ukraine,https://kyivindependent.com/putin-is-weaker-than-us-zelensky-says/,0.95,12747,0,12747
4,worldnews,Ukraine Fires UK Storm Shadow Missiles at Russia for First Time,https://www.bloomberg.com/news/articles/2024-11-20/ukraine-fires-uk-storm-shadow-missiles-at-russia-for-first-time,0.96,7946,0,7946
5,worldnews,'Russia only wins if the West quits' — Gen. Ben Hodges,https://kyivindependent.com/russia-only-wins-if-the-west-quits-gen-ben-hodges/,0.97,6731,0,6731
6,worldnews,Danish Navy Stopped a Chinese Ship Suspected of Damaging Undersea Cables,https://defence24.com/armed-forces/danish-navy-stopped-a-chinese-ship-suspected-of-damaging-undersea-cables,0.98,5922,0,5922
7,worldnews,British Storm Shadow missiles strike targets INSIDE Russia,https://www.dailymail.co.uk/news/article-14107159/Moment-British-Storm-Shadow-missiles-strike-Russia-North-Korea-underground-bunker.html,0.97,5463,0,5463
8,worldnews,IDF finding far more Russian arms in Hezbollah’s possession than expected – report,https://www.timesofisrael.com/idf-finding-far-more-russian-arms-in-hezbollahs-possession-than-expected-report/,0.96,4988,0,4988
9,worldnews,"Ukraine’s Zelensky says North Korea may send up to 100,000 troops to Russia ",https://www.upi.com/Top_News/World-News/2024/11/20/Volodymyr-Zelensky-North-Korea-sends-100000-troops-Russia-Ukraine/9311732083070/,0.96,4171,0,4171
10,worldnews,"Russian Officers Caught Fabricating Frontline Success, Arrests Follow",https://www.dagens.com/war/russian-officers-caught-fabricating-frontline-success-arrests-follow,0.98,3522,0,3522
11,worldnews,US vetoes UN resolution demanding a cease-fire in Gaza because there's no link to a hostage release,https://apnews.com/article/un-gaza-resolution-veto-hamas-israel-hostages-b5281432fc2acdc1860adb3015392c0b,0.94,2901,0,2901
12,worldnews,Netanyahu offers $5 million to Palestinians for every Israeli hostage they help free,https://www.foxnews.com/world/netanyahu-offers-5-million-palestinians-every-israeli-hostage-help-free,0.91,2444,0,2444
13,worldnews,Ukraine Struck Russian Command Center in Belgorod: Kyiv,https://www.newsweek.com/ukraine-russia-command-center-belgorod-war-latest-1988768,0.98,2291,0,2291
14,worldnews,Danish Navy boards Chinese ship suspected in European undersea cable sabotage — Sweden’s Defense Ministry put freighter at the time and place of the disruption,https://www.tomshardware.com/tech-industry/danish-navy-tails-chinese-ship-suspected-in-european-undersea-cable-sabotage-swedens-defense-ministry-put-freighter-at-the-time-and-place-of-the-disruption,0.96,2122,0,2122
15,worldnews,"Germany delivers new military aid to Ukraine, including howitzers, Gepards",https://kyivindependent.com/germany-military-aid/,0.98,1525,0,1525
16,worldnews,Zelensky says ‘Israel made a mistake’ in holding back military support for Ukraine,https://www.timesofisrael.com/zelensky-says-israel-made-a-mistake-holding-back-military-support-for-ukraine/,0.91,1322,0,1322
17,worldnews,Hezbollah rocket strikes northern Israel kindergarten minutes after children left,https://www.ynetnews.com/article/rkw9qtizkl,0.89,1183,0,1183
18,worldnews,The Danish Navy boarded a Chinese cargo ship: who broke the cables at the bottom of the Baltic Sea: EADaily,https://eadaily.com/en/news/2024/11/20/the-danish-navy-boarded-a-chinese-cargo-ship-who-broke-the-cables-at-the-bottom-of-the-baltic-sea,0.95,1163,0,1163
19,worldnews,Leaked: Russian academia and firms building Putin's drone army,https://euobserver.com/eu-and-the-world/ar46fbe8cc,0.96,1043,0,1043
20,worldnews,EU disease agency considers quitting Elon Musk’s X over disinfo,https://www.politico.eu/article/european-health-agency-says-its-thinking-of-quitting-musks-x-for-good-reasons/,0.95,517,0,517
21,worldnews,Calls to shut down Chinese aquarium charging $50 to see a robot shark,https://au.news.yahoo.com/calls-to-shut-down-chinese-aquarium-charging-50-to-see-fake-shark-010632970.html,0.91,400,0,400
22,worldnews,'Water is more precious than gold here': Turkey's strikes on Syria's Kurds cut water supply to 1 million,https://www.ynetnews.com/article/sym6v45gjg,0.93,231,0,231
23,worldnews,A social media ban for children younger than 16 is introduced in Australia’s Parliament,https://apnews.com/article/australia-social-media-children-ban-e02305486cb44aa07dcaf2964bec4e3d,0.97,223,0,223
24,worldnews,"/r/WorldNews Live Thread: Russian Invasion of Ukraine Day 1001, Part 1 (Thread #1148)",https://www.reddit.com/live/18hnzysb1elcs,0.98,166,0,166
25,worldnews,/r/WorldNews Live Thread: Israel at War (Thread #77),https://www.reddit.com/live/1bsso361afr0r,0.78,105,0,105
26,worldnews,U.S. Nuclear Reactors Still Depend on Russia. That’s Becoming a Problem.,https://www.barrons.com/articles/russia-us-news-nuclear-energy-electricity-c6997988?refsec=energy&amp;mod=topics_energy,0.87,87,0,87
