,subreddit,title,url,upvote_ratio,ups,downs,score
0,worldnews,Slovakia hands over all 13 promised MiG fighter jets to Ukraine,https://www.reuters.com/world/europe/slovakia-hands-over-all-13-promised-mig-fighter-jets-ukraine-2023-04-17/,0.96,15730,0,15730
1,worldnews,CBC says it is ‘pausing’ its use of Twitter,https://torontosun.com/news/national/twitter-adds-government-funded-media-tag-to-cbc-account?utm_term=Autofeed&amp;utm_medium=Social&amp;utm_source=Twitter#Echobox=1681730430,0.95,11613,0,11613
2,worldnews,Dutch intelligence agency warns conspiracy theories pose ‘serious threat’,https://bnonews.com/index.php/2023/04/dutch-intelligence-agency-warns-conspiracy-theories-pose-serious-threat/,0.95,10004,0,10004
3,worldnews,"Russian spies are using Tinder to ensnare German soldiers and politicians to get them to disclose Ukraine war secrets, counterintelligence warns",https://www.businessinsider.nl/russian-spies-are-using-tinder-to-ensnare-german-soldiers-and-politicians-to-get-them-to-disclose-ukraine-war-secrets-counterintelligence-warns/,0.97,8845,0,8845
4,worldnews,Sweden: Absolut Vodka producer resumes exports to Russia,https://tvpworld.com/69127138/sweden-absolut-vodka-producer-resumes-exports-to-russia,0.94,8271,0,8271
5,worldnews,Ukrainian Ministry publishes list of athletes from Russia and Belarus who support war,https://www.pravda.com.ua/eng/news/2023/04/17/7398244/,0.95,6739,0,6739
6,worldnews,Five G7 countries agree to squeeze Russia out of international nuclear fuel market,https://www.pravda.com.ua/eng/news/2023/04/17/7398179/,0.97,6732,0,6732
7,worldnews,"Vladimir Kara-Murza, a critic of Russian President Vladimir Putin, sentenced to 25 years in jail",https://www.abc.net.au/news/2023-04-17/russian-vladimir-kara-murza-sentenced-to-25-years-in-jail/102233674,0.97,5603,0,5603
8,worldnews,Trudeau: Poilievre ‘has to run to American billionaires’ to attack CBC,https://nationalpost.com/news/politics/trudeau-says-poilievre-has-to-run-to-american-billionaires-to-attack-cbc,0.92,4161,0,4161
9,worldnews,Canadian coroners starting to reject excited delirium as cause of police-related deaths,https://www.cbc.ca/news/health/coroners-excited-delirium-1.6811083,0.96,3212,0,3212
10,worldnews,Japan Urges Dads to Make Time for Babies Amid Population Worries,https://news.bloombergtax.com/esg/japan-urges-dads-to-make-time-for-babies-amid-population-worries,0.96,2989,0,2989
11,worldnews,Pensioner tried to set fire to military recruitment office in north Russian town Usinsk,https://thebarentsobserver.com/en/life-and-public/2023/04/pensioner-tried-set-fire-military-recruitment-office-north-russian-town,0.97,2915,0,2915
12,worldnews,Cocaine worth nearly $440 million found floating in the sea off Italy | CNN,https://www.cnn.com/2023/04/17/europe/cocaine-440-million-haul-italy-intl-scli/index.html,0.98,2626,0,2626
13,worldnews,Russian Woman Detained In Sweden On Espionage Charge,https://www.rferl.org/a/russia-sweden-woman-detained-espionage/32364311.html,0.97,2544,0,2544
14,worldnews,"CBC pauses Twitter activity after being labelled ""government-funded media""",https://www.cbc.ca/news/world/cbc-twitter-government-funded-media-1.6812591,0.95,1932,0,1932
15,worldnews,Taiwan to buy 400 US anti-ship missiles intended to repel a China invasion,https://english.alarabiya.net/News/world/2023/04/18/Taiwan-to-buy-400-US-anti-ship-missiles-intended-to-repel-a-China-invasion,0.96,1828,0,1828
16,worldnews,Putin hails Russian navy's performance in Pacific drills,https://news.yahoo.com/putin-hails-russian-navys-performance-092107276.html?soc_src=social-sh&amp;soc_trk=tw&amp;tsrc=twtr,0.91,1278,0,1278
17,worldnews,Stand off in the sky: RAF and German fighter jets intercept Russian spy plane near Baltic countries,https://www.lbc.co.uk/news/raf-intercept-russian-spy-plane/,0.95,1183,0,1183
18,worldnews,Canada to pay $800m to settle land dispute with five First Nations | Payment represents acknowledgement government and British Columbia have failed to honour treaty signed in 1899,https://www.theguardian.com/world/2023/apr/17/canada-first-nations-land-claims-dispute-settlement,0.91,872,0,872
19,worldnews,Swiss-owned company’s Russian gold trades expose gap in western sanctions,https://www.swissinfo.ch/eng/business/swiss-owned-company-s-russian-gold-trades-expose-gap-in-western-sanctions/48441180?utm_campaign=swi-rss&amp;utm_source=multiple&amp;utm_medium=rss&amp;utm_content=o,0.95,679,0,679
20,worldnews,"Wagner ex-commanders tell Russian opposition media of their war crimes in Ukraine, Kyiv launches investigation",https://kyivindependent.com/wagner-ex-commanders-tell-russian-opposition-media-of-their-war-crimes-in-ukraine-as-kyiv-launches-investigation/,0.94,430,0,430
21,worldnews,"/r/WorldNews Live Thread: Russian Invasion of Ukraine Day 419, Part 1 (Thread #560)",https://www.reddit.com/live/18hnzysb1elcs,0.96,341,0,341
22,worldnews,National Wave of Schoolgirl Poisonings Tortures Iran,https://iranwire.com/en/news/115639-national-wave-of-schoolgirl-poisonings-tortures-iran/,0.95,286,0,286
23,worldnews,"Russian Foreign Minister arrives in Brazil to meet president, who made loud statements about Ukraine",https://news.yahoo.com/russian-foreign-minister-arrives-brazil-160312032.html?guccounter=1&amp;guce_referrer=aHR0cHM6Ly93d3cuZ29vZ2xlLmNvbS8&amp;guce_referrer_sig=AQAAAFBIJpHth8MkAWtCX-Sa_AO6h2CVOA6uxDMxA9dSR3byehUbNqlfWksL4ik2NS2cfXYgCtTcqyl490lED1hwLDGuFUVmwqxuJTSvTVDMhDu705Tk46nmT6q76rhX9-N7FUioqND45oYNTVQ1wjSqXdx856vJDE5TobTuHOxk_XZM,0.91,280,0,280
24,worldnews,Cocaine worth nearly $440 million found floating in the sea off Italy | CNN,https://edition.cnn.com/2023/04/17/europe/cocaine-440-million-haul-italy-intl-scli/index.html,0.92,251,0,251
25,worldnews,Russia constructs 800 km of defensive lines to head off Ukrainian counteroffensive,https://english.elpais.com/international/2023-04-17/russia-constructs-800-km-of-defensive-lines-to-head-off-ukrainian-counteroffensive.html,0.95,167,0,167
26,worldnews,"Canada’s National Leaders on Combatting Antisemitism and Islamophobia 🎙 Thursday 20 April 2023, 13h00 EDT, on Twitter Spaces",https://i.redd.it/fhcno55wdhua1.png,0.39,0,0,0
