,subreddit,title,url,upvote_ratio,ups,downs,score
0,worldnews,Cuba warns airlines that it will be out of fuel for planes in 24 hours,https://en.cibercuba.com/noticias/2026-02-09-u1-e13-s27061-nid320369-cuba-advierte-aerolineas-24-horas-quedara-combustible,0.97,17231,0,17231
1,worldnews,"Japan's Sanae Takaichi wins a landslide in snap election, exit polls project",https://www.nbcnews.com/world/japan/japans-sanae-takaichi-wins-landslide-snap-election-exit-polls-project-rcna257887,0.95,11352,0,11352
2,worldnews,"Pro-Ukrainian partisans disable military communication infrastructure in Russia's Belgorod Oblast, group claims",https://kyivindependent.com/pro-ukrainian-partisans-disable-military-communication-infrastructure-in-russias-belgorod-oblast-group-claims/,0.97,4323,0,4323
3,worldnews,"Ukraine war must become 'untenable' for Russia, Zelenskyy says after latest strikes",https://abcnews.go.com/International/ukraine-war-become-untenable-russia-zelenskyy-after-latest/story?id=129962849,0.98,2722,0,2722
4,worldnews,"UK threatens seizure of Russian shadow fleet tankers, The Guardian says",https://www.pravda.com.ua/eng/news/2026/02/08/8019973/,0.97,2497,0,2497
5,worldnews,Iran sentences Nobel laureate Narges Mohammadi to seven more years in prison,https://www.theguardian.com/world/2026/feb/08/iran-nobel-laureate-narges-mohammadi-seven-more-years-prison-hunger-strike,0.96,2369,0,2369
6,worldnews,‘We must get through the next few days’: Ukrainians face bitter cold without power,https://edition.cnn.com/2026/02/08/europe/ukrainians-attacks-cold-intl,0.98,2092,0,2092
7,worldnews,"Russian cyborg pigeon drones begin real-world testing phases, sparking concern over military misuse",https://www.jpost.com/international/article-885718,0.96,2030,0,2030
8,worldnews,Kyiv calls for Polish aid after 'massive' Russian attack on Ukraine power grid,https://www.france24.com/en/europe/20260207-kyiv-calls-for-polish-aid-after-massive-russian-attack-on-ukraine-power-grid,0.98,1860,0,1860
9,worldnews,Explosions heard in Kyiv amid double Russian ballistic missile attack,https://kyivindependent.com/explosions-heard-in-kyiv-amid-russian-missile-attack-3/,0.97,1217,0,1217
10,worldnews,The Czech PM directly blamed then-British prime minister Boris Johnson for the failure to complete the Russia- Ukraine negotiations.,https://newsukraine.rbc.ua/news/this-was-johnson-czech-prime-minister-shocks-1770508679.html,0.93,1202,0,1202
11,worldnews,"New Details Emerge in Assassination Attempt on Russian General: Attack in Lover’s Apartment, Suspect Detained in Dubai",https://militarnyi.com/en/news/assassination-attempt-on-russian-general/,0.96,1003,0,1003
12,worldnews,Conservatives win in Japan and Thailand,https://www.reuters.com/world/asia-pacific/japan-thailand-elections-live-voters-cast-ballots-snap-polls-2026-02-08/,0.91,923,0,923
13,worldnews,UK PM Starmer's chief of staff Morgan McSweeney quits over Mandelson fallout,https://www.reuters.com/world/uk/uk-pm-starmers-chief-staff-morgan-mcsweeney-quits-sky-news-reports-2026-02-08/,0.95,921,0,921
14,worldnews,"Empty Ukrainian embassy in Moscow fined for not paying US$71,000 electricity bill",https://www.pravda.com.ua/eng/news/2026/02/08/8020023/,0.96,822,0,822
15,worldnews,Iranians plead not to negotiate with the Islamic Republic,https://www.iranintl.com/en/202602063431,0.91,531,0,531
16,worldnews,Jimmy Lai jailed for 20 years in Hong Kong after nat. security conviction,https://hongkongfp.com/2026/02/09/breaking-jimmy-lai-jailed-for-20-years-in-hong-kong-after-nat-security-conviction/,0.94,523,0,523
17,worldnews,Dozens of flood warnings in England after days of non-stop rain,https://www.bbc.co.uk/news/articles/cje1eq9z08wo,0.96,489,0,489
18,worldnews,Zelenskyy explains why and how hard Ukraine strikes Russia's energy sector,https://www.pravda.com.ua/eng/news/2026/02/08/8020007/,0.92,476,0,476
19,worldnews,India and Canada agree to shared workplan to guide bilateral cooperation on national security,https://www.thehindu.com/news/national/national-security-advisor-ajit-doval-in-canada/article70608076.ece?utm_source=whatsapp&amp;utm_medium=social&amp;utm_campaign=th_channel,0.88,423,0,423
20,worldnews,"In Belgorod, about 80,000 people were left without heating after a missile attack",https://unn.ua/en/news/in-belgorod-about-80000-people-were-left-without-heating-after-a-missile-attack,0.95,418,0,418
21,worldnews,"Two arrests as police target anti-Zionist event in Birmingham, UK",https://www.bbc.co.uk/news/articles/cdr2l6mpdgro,0.86,164,0,164
22,worldnews,"/r/WorldNews Live Thread: Russian Invasion of Ukraine Day 1446, Part 1 (Thread #1593)",https://www.reddit.com/live/18hnzysb1elcs,0.97,139,0,139
23,worldnews,"One person dead from Nipah virus in Bangladesh, WHO says",https://www.theguardian.com/world/2026/feb/07/one-person-dead-from-nipah-virus-in-bangladesh-who-says,0.93,128,0,128
24,worldnews,Venezuela: Opposition leader Guanipa kidnapped after release,https://www.dw.com/en/venezuela-opposition-leader-guanipa-kidnapped-after-release/a-75864364,0.96,72,0,72
