,subreddit,title,url,upvote_ratio,ups,downs,score
0,worldnews,US warns of possible Pride Month attacks worldwide,https://www.bbc.com/news/world-us-canada-69013313,0.86,17001,0,17001
1,worldnews,Ukrainian attacks disrupt 14% of Russia's oil refining capacity – Pentagon,https://www.pravda.com.ua/eng/news/2024/05/18/7456422/,0.96,11577,0,11577
2,worldnews,Three Spanish tourists killed by gunmen in central Afghanistan,https://www.bbc.com/news/articles/c9wzvlz40wpo,0.95,8055,0,8055
3,worldnews,UK to get at least 25 new warships due to defence spending rise - Shapps,https://news.sky.com/story/uk-to-get-at-least-25-new-warships-thanks-to-defence-spending-rise-shapps-13135610,0.95,3855,0,3855
4,worldnews,Plan to ban sex education for children under nine,https://www.bbc.com/news/uk-politics-69013002,0.9,2731,0,2731
5,worldnews,Head of Canada’s intelligence agency warns Canadians not to use TikTok,https://www.theverge.com/2024/5/17/24159310/canadian-security-intelligence-service-tiktok-china-user-data,0.95,2633,0,2633
6,worldnews,Zelenskiy says air defences must quadruple to halt Russian advance,https://www.theguardian.com/world/article/2024/may/18/volodymyr-zelenskiy-expects-russian-offensive-in-northeast-ukraine-to-intensify,0.95,2296,0,2296
7,worldnews,PA’s Abbas accuses Hamas of giving Israel ‘pretexts’ for Gaza war with Oct. 7 attack,https://www.timesofisrael.com/pas-abbas-accuses-hamas-of-giving-israel-pretexts-for-gaza-war-with-oct-7-attack/,0.92,2243,0,2243
8,worldnews,Gantz to Netanyahu: If you don't change course by June 8 we will withdraw from the government,https://www.jpost.com/breaking-news/article-801652,0.94,2116,0,2116
9,worldnews,IDF confirms: Body of hostage Ron Binyamin recovered from Gaza,https://m.jpost.com/breaking-news/article-801580,0.91,1678,0,1678
10,worldnews,Young Iranian Jewish man facing imminent execution - report - I24NEWS,https://www.i24news.tv/en/news/middle-east/iran-eastern-states/artc-young-iranian-jewish-man-facing-imminent-execution-report,0.9,1318,0,1318
11,worldnews,"Russia not seeking Kharkiv capture, claims Putin",https://www.bbc.com/news/world-europe-69025424,0.89,1305,0,1305
12,worldnews,Israeli forces say Islamic Jihad leader killed in strike on West Bank,https://www.theguardian.com/world/article/2024/may/18/israeli-forces-say-islamic-jihad-leader-islam-khamayseh-killed-in-strike-on-west-bank-jenin,0.9,1051,0,1051
13,worldnews,"Poland to invest $2.5 billion to reinforce borders with Russia, Belarus",https://www.reuters.com/world/europe/poland-spend-around-25-bln-securing-eastern-border-says-pm-2024-05-18/,0.97,986,0,986
14,worldnews,"Zelensky wants China at Ukraine peace talks, cites ‘influence on Russia’",https://www.cnn.com/2024/05/18/europe/zelensky-china-ukraine-peace-talks-intl-hnk/index.html,0.95,986,0,986
15,worldnews,Iran’s regime slated to execute innocent young Jew on Monday,https://m.jpost.com/middle-east/iran-news/irans-regime-slated-to-execute-innocent-young-jew-on-monday-801589,0.85,830,0,830
16,worldnews,"Victorian premier accuses pro-Palestine protesters of bringing ‘violence, homophobia and antisemitism’ to Labor conference",https://www.theguardian.com/australia-news/article/2024/may/18/pro-palestine-protesters-crash-victorian-labor-state-conference-ahead-of-debate-on-israel-hamas-war,0.89,746,0,746
17,worldnews,U.S. warned Raiffeisen  Bank  access to dollar system could be curbed over Russia,https://www.reuters.com/business/us-warned-raiffeisen-access-dollar-system-could-be-curbed-over-russia-source-2024-05-15/,0.96,579,0,579
18,worldnews,Ukraine says Russian shelling targets civilians in Kharkiv region,https://www.reuters.com/world/europe/ukraine-investigates-civilian-injuries-battles-rage-kharkiv-region-2024-05-18/,0.94,374,0,374
19,worldnews,Iran arrests 260 people for spreading 'satanism and nudity',https://abcnews.go.com/International/wireStory/iran-arrests-260-people-including-3-european-citizens-110343684,0.93,283,0,283
20,worldnews,/r/WorldNews Live Thread for Israel-Hamas War (Thread #49),https://www.reddit.com/live/1bsso361afr0r,0.79,246,0,246
21,worldnews,"A Russian court has ordered that Deutsche Bank's and Commerzbank's assets, accounts, property and shares be seized in Russia as part of a lawsuit involving the German banks",https://www.france24.com/en/europe/20240518-russian-court-seizes-millions-euros-worth-german-bank-assets,0.93,195,0,195
22,worldnews,"/r/WorldNews Live Thread: Russian Invasion of Ukraine Day 816, Part 1 (Thread #962)",https://www.reddit.com/live/18hnzysb1elcs,0.95,186,0,186
23,worldnews,US repatriates 11 US citizens from northeast Syria,https://edition.cnn.com/2024/05/07/politics/us-citizens-syria/index.html,0.91,94,0,94
24,worldnews,Google Cloud accidentally deletes $125 billion Australian pension fund,https://www.business-standard.com/world-news/google-cloud-accidentally-deletes-125-billion-australian-pension-fund-124051800606_1.html,0.85,76,0,76
25,worldnews,"The Pakistani and Indian governments on Saturday urged their citizens in Kyrgyzstan to stay indoors after mob violence towards foreigners. Hundreds of Kyrgyz men on Friday attacked buildings in Bishkek where foreign students reside, including Pakistani and Indian nationals",https://www.dw.com/en/pakistan-india-urge-citizens-in-kyrgyzstan-to-stay-inside/a-69123379,0.93,68,0,68
26,worldnews,U.S. to have official in Tokyo dedicated to monitoring China,https://english.kyodonews.net/news/2024/05/a6eb4855b7a3-update1-us-to-have-official-in-tokyo-dedicated-to-monitoring-china.html,0.94,67,0,67
