,subreddit,title,url,upvote_ratio,ups,downs,score
0,worldnews,Ukraine Had A Chance To Blow Up Russia’s Best Warplanes On The Tarmac. The White House Said No - And Now It’s Too Late.,https://www.forbes.com/sites/davidaxe/2024/08/05/ukraine-had-a-chance-to-blow-up-russias-best-warplanes-on-the-tarmac-the-white-house-said-no-and-now-its-too-late/,0.88,21588,0,21588
1,worldnews,Japan Kills First Fin Whale Despite Global Condemnation,https://www.theinertia.com/news/japan-fin-whale-hunting-first-kill/,0.94,13876,0,13876
2,worldnews,Reports Suggest Ukrainian Forces May Have Breached Russian Borders in Kursk Region,https://united24media.com/latest-news/reports-suggest-ukrainian-forces-may-have-breached-russian-borders-in-kursk-region-1584,0.97,4342,0,4342
3,worldnews,Pro-Palestine demonstrators accused of antisemitism after protesting outside Fiddler on the Roof,https://uk.news.yahoo.com/pro-palestine-protesters-accused-antisemitism-104934061.html?guccounter=1&amp;guce_referrer=aHR0cHM6Ly9sLnRocmVhZHMubmV0Lw&amp;guce_referrer_sig=AQAAAMM8lbkrwF5BfGdN0KMguiLnLs_75uSQQ7I9PeszIxg813v1OvvHXrtkyg3zsWwMQh5_3wp0kMeQsMHUThdKKpu0heS_gUdM3UdygUC1qeSbSeWRTwo6skPt7m3fsCiJ3Lg_FShSV_WFMARUZXmDmwZqsTK_QJdrV24UKWXwFLS_,0.87,4232,0,4232
4,worldnews,Pakistan announces intention to supply arms to Iran at OIC meeting  - report,https://www.jpost.com/middle-east/article-813485,0.94,3803,0,3803
5,worldnews,Moscow claims clashes with Ukrainian troops on Russian soil,https://kyivindependent.com/ukraine-war-latest-moscow-claims-clashes-with-ukrainian-troops-on-russian-soil/,0.97,3405,0,3405
6,worldnews,"Kremlin Pushes Tehran Toward Aggression Against Israel, New Strategies Unveiled",https://odessa-journal.com/robert-lansing-institute-the-kremlin-is-stoking-a-major-war-in-the-middle-east,0.94,3116,0,3116
7,worldnews,"Hamas names Gaza leader Yahya Sinwar as chief following Haniyeh killing, statement says",https://www.reuters.com/world/middle-east/hamas-names-gaza-leader-yahya-sinwar-chief-following-haniyeh-killing-statement-2024-08-06/,0.94,2822,0,2822
8,worldnews,"Russian President Vladimir Putin on Tuesday called for the government to develop a program for overseas promotion of ""traditional Russian spiritual and moral values,"" a theme that the Kremlin has increasingly sounded in recent years",https://www.nbcnews.com/news/world/putin-calls-international-scheme-promoting-russian-values-rcna165338,0.92,2510,0,2510
9,worldnews,"Hezbollah launches drone attacks on Israel, says more to come",https://www.reuters.com/world/middle-east/lebanons-hezbollah-says-it-launched-drones-israel-retaliation-yet-come-2024-08-06/,0.94,2030,0,2030
10,worldnews,Bangladesh: Nobel Prize-winning Muhammad Yunus nominated to replace toppled PM Sheikh Hasina,https://www.telegraph.co.uk/world-news/2024/08/06/bangladesh-nobel-prize-winning-muhammad-yunus-replace-pm/,0.96,1864,0,1864
11,worldnews,"IDF identifies, strikes Hezbollah terrorists in southern Lebanon, destroys rocket launcher ",https://www.jpost.com/breaking-news/article-813595,0.88,1386,0,1386
12,worldnews,"Final unaccounted for October 7 victim died in onslaught, IDF confirms",https://www.timesofisrael.com/final-unaccounted-for-october-7-victim-died-in-onslaught-idf-confirms/,0.9,1090,0,1090
13,worldnews,Italy scrambles fighter jets to intercept aircraft over Baltic,https://m.jpost.com/breaking-news/article-813562,0.92,1013,0,1013
14,worldnews,"Explosion at oil refinery in Russia's Usinsk sparks major fire, reports say",https://newsukraine.rbc.ua/news/explosion-at-oil-refinery-in-russia-s-usinsk-1722947021.html,0.97,955,0,955
15,worldnews,US Revokes Sheikh Hasina’s Visa After Bangladesh Ouster As Ex-PM Seeks Asylum In The West,https://www.news18.com/world/us-revokes-visa-of-sheikh-hasina-amid-bangladesh-unrest-ex-pm-seeks-asylum-in-europe-8991997.html,0.97,888,0,888
16,worldnews,China launches its rival to Elon Musk's Starlink internet satellites,https://www.cnbc.com/2024/08/06/china-launches-its-rival-to-elon-musks-starlink-internet-satellites.html,0.92,827,0,827
17,worldnews,Hezbollah leader says group will respond but keeping Israelis waiting is part of ‘punishment’,https://www.cnn.com/2024/08/06/middleeast/hezbollah-leader-israelis-waiting-intl-latam/index.html,0.93,523,0,523
18,worldnews,"Iran executes over 300 individuals in first seven months of 2024, 49 in July alone",https://www.jpost.com/middle-east/iran-news/article-813635,0.94,472,0,472
19,worldnews,Australian government ‘deeply disappointed’ by Japan’s decision to expand commercial whaling target list,https://www.theguardian.com/environment/article/2024/aug/01/japan-whaling-expansion-australia-government-response,0.95,451,0,451
20,worldnews,Venezuela's Maduro Asks Supporters to Delete WhatsApp in Growing Crackdown,https://www.bloomberg.com/news/articles/2024-08-05/maduro-calls-venezuelans-to-delete-whatsapp-in-growing-crackdown,0.93,428,0,428
21,worldnews,"Israeli minister says it may be ‘moral’ to starve 2 million Gazans, but ‘no one in the world would let us’",https://edition.cnn.com/2024/08/06/middleeast/israeli-minister-smotrich-starve-gazans-intl/index.html,0.66,410,0,410
22,worldnews,Israel FM calls to 'swiftly eliminate' new Hamas leader and 'arch-terrorist' Yahya Sinwar,https://timesofindia.indiatimes.com/world/middle-east/israel-fm-israel-katz-calls-to-swiftly-eliminate-new-hamas-leader-and-arch-terrorist-yahya-sinwar/articleshow/112332165.cms,0.88,252,0,252
23,worldnews,Blinken warns Iran but also Israel not to 'escalate',https://www.rfi.fr/en/middle-east/20240806-blinken-warns-iran-but-also-israel-not-to-escalate,0.88,245,0,245
24,worldnews,"/r/WorldNews Live Thread: Russian Invasion of Ukraine Day 895, Part 1 (Thread #1042)",https://www.reddit.com/live/18hnzysb1elcs,0.97,225,0,225
25,worldnews,/r/WorldNews Live Thread for Israel-Hamas War (Thread #61),https://www.reddit.com/live/1bsso361afr0r,0.85,204,0,204
26,worldnews,Chinese American man convicted in US of spying on dissidents for China,https://www.theguardian.com/us-news/article/2024/aug/06/chinese-american-spy-convicted-shujun-wang-new,0.94,185,0,185
