,subreddit,title,url,upvote_ratio,ups,downs,score
0,worldnews,Shell and Vitol accused of prolonging Ukraine war with sanctions ‘loophole’,https://www.theguardian.com/business/2023/feb/19/shell-and-vitol-accused-of-prolonging-ukraine-war-with-sanctions-loophole,0.95,24207,0,24207
1,worldnews,Russia accuses Kyiv of planning to stage nuclear incident,https://www.jpost.com/international/article-732067,0.92,21779,0,21779
2,worldnews,Volodymyr Zelenskyy says Russia shelled 10 Ukrainian regions in last 24 hours,https://www.aa.com.tr/en/russia-ukraine-war/volodymyr-zelenskyy-says-russia-shelled-10-ukrainian-regions-in-last-24-hours/2824345,0.95,8659,0,8659
3,worldnews,"Putin is attempting to destabilise European countries to divert attention from Ukraine, warns Kosovo's president",https://news.sky.com/story/putin-is-attempting-to-destabilise-european-countries-to-divert-attention-from-ukraine-warns-kosovos-president-12815439,0.96,5503,0,5503
4,worldnews,Iran Nuclear Inspectors Detect Uranium Enriched to 84% Purity,https://www.bloomberg.com/news/articles/2023-02-19/iran-nuclear-inspectors-detect-uranium-enriched-to-84-purity#xj4y7vzkg,0.97,4986,0,4986
5,worldnews,EU urged to sanction Moldova oligarchs linked to unrest,https://www.luxtimes.lu/en/european-union/eu-urged-to-sanction-moldova-oligarchs-linked-to-unrest-63f1e09cde135b92364d42d2,0.96,3246,0,3246
6,worldnews,China to reveal peace plan for Russia/Ukraine war,https://www.businessinsider.co.za/trending/china-peace-proposal-for-ukraine-one-year-anniversary-nears-2023-2,0.89,3125,0,3125
7,worldnews,Doctors Without Borders gains access to quake zone in Syria,https://www.reuters.com/world/middle-east/teenager-rescued-rubble-turkey-10-days-after-quake-2023-02-16/,0.97,2849,0,2849
8,worldnews,Sweden warns against decoupling its Nato bid from Finland’s,https://www.ft.com/content/5cf233db-2daf-4d14-8ac5-8ddc40dde793,0.96,1956,0,1956
9,worldnews,US stages joint air exercises with Asian allies after North Korea's ICBM launch,https://www.reuters.com/world/asia-pacific/north-korea-confirms-it-tested-icbm-saturday-kcna-2023-02-18/,0.95,1742,0,1742
10,worldnews,US and G7 preparing large-scale sanctions for anniversary of Russian invasion,https://english.nv.ua/nation/us-and-g7-preparing-large-scale-sanctions-for-anniversary-of-russian-invasion-50304907.html,0.96,1649,0,1649
11,worldnews,US announces $100 million in earthquake relief funding for Turkey and Syria,https://www.cnn.com/2023/02/19/politics/us-relief-turkey-syria-earthquake/index.html,0.92,1220,0,1220
12,worldnews,"Iran said on cusp of ability to make nukes, having enriched uranium to 84% purity",https://www.timesofisrael.com/iran-said-on-cusp-of-ability-to-make-nukes-having-enriched-uranium-to-84-purity/,0.94,1126,0,1126
13,worldnews,"In Munich, Western allies vow support for Ukraine amid frustration over slow pace of aid",https://www.cbsnews.com/news/munich-security-conference-ukraine-military-aid-western-allies/,0.94,633,0,633
14,worldnews,Blinken says US has ‘no doubt’ China was conducting surveillance with balloon,https://edition.cnn.com/2023/02/19/politics/antony-blinken-chinese-spy-balloon/index.html,0.92,581,0,581
15,worldnews,"As war in Ukraine approaches one-year mark, foreign policy leaders call for increased military aid",https://www.usatoday.com/story/news/politics/2023/02/19/ukraine-russia-war-military-aid/11299630002/,0.93,477,0,477
16,worldnews,US and Ukraine ‘still having discussions’ amid pressure to supply F-16 jets | UN ambassador says US must ensure Ukrainians ‘have the training necessary … to use weapons systems we provide’,https://www.theguardian.com/world/2023/feb/19/us-f-16s-ukraine-un-ambassador,0.91,357,0,357
17,worldnews,"/r/WorldNews Live Thread: Russian Invasion of Ukraine Day 362, Part 1 (Thread #503)",https://www.reddit.com/live/18hnzysb1elcs,0.97,340,0,340
18,worldnews,"Russian Army Officials Accept $1,000 Bribes In Exchange For Soldiers' Vacations: Ukraine Intel",https://www.ibtimes.com/russian-army-officials-accept-1000-bribes-exchange-soldiers-vacations-ukraine-intel-3669521,0.93,331,0,331
19,worldnews,"Taiwan says crashed balloon likely Chinese, was carrying meteorological recording instruments 'without photographic or recording audio-visual or storage-related devices'",https://bdnews24.com/world/asia-pacific/ur94l5k67y,0.92,261,0,261
20,worldnews,Germany Raises Red Flags About Palantir’s Big Data Dragnet,https://www.wired.com/story/palantir-germany-gotham-dragnet/,0.94,258,0,258
21,worldnews,US says China considering arming Russia in Ukraine war,https://www.scmp.com/news/world/united-states-canada/article/3210776/us-says-china-considering-supplying-weapons-russia-ukraine-war?module=more_top_stories_asia&amp;pgtype=homepage,0.88,235,0,235
22,worldnews,"North Korea fires ballistic missile, warns of turning Pacific into 'firing range'",https://www.reuters.com/world/asia-pacific/north-korea-fires-ballistic-missile-south-korea-military-2023-02-19/,0.87,217,0,217
23,worldnews,Ukraine's Volodymyr Zelenskyy says Russia hit by 'extraordinarily significant' losses in east,https://www.abc.net.au/news/2023-02-20/russia-hit-extraordinarily-significant-loss-volodymyr-zelenskyy/101997216,0.92,153,0,153
24,worldnews,"r/WorldNews Live Audio 🎙 Supreme Court Reviews Social Media Platforms' Section 230 Immunities | Monday 20 February 2023, 09h00 PST / 12h00 EST",https://i.redd.it/j5ni81znzyia1.png,0.74,99,0,99
25,worldnews,Archaeologists Unearthed a Sumerian Palace and Temple from the 3rd Millennium BC,https://ulukayin.org/sumerian-palace-temple-from-the-3rd-millennium-bc/,0.95,72,0,72
26,worldnews,"Zelensky says Ukraine will defend Bakhmut, ‘but not at any price’",https://thehill.com/policy/international/3865895-zelensky-says-ukraine-will-defend-bakhmut-but-not-at-any-price/,0.93,66,0,66
