,subreddit,title,url,upvote_ratio,ups,downs,score
0,worldnews,Hamas launches rocket attack towards Tel Aviv area,https://www.bbc.co.uk/news/articles/ckrr0e3y29po,0.85,13304,0,13304
1,worldnews,"Ukrainian General Staff: Russia has lost 501,190 troops in Ukraine since Feb. 24, 2022",https://kyivindependent.com/general-staff-russia-has-lost-501-190-troops-in-ukraine-since-feb-24-2022/,0.94,10847,0,10847
2,worldnews,"Baltic states and Poland may deploy troops to Ukraine if Russia succeeds, media says",https://newsukraine.rbc.ua/news/baltic-states-poland-may-deploy-troops-to-1716731678.html,0.95,9758,0,9758
3,worldnews,China releases video showing simulated invasion of Taiwan,https://www.taiwannews.com.tw/news/5849335,0.95,5915,0,5915
4,worldnews,Biden calls Putin ''brutal tyrant'',https://www.pravda.com.ua/eng/news/2024/05/26/7457731/,0.95,5180,0,5180
5,worldnews,Six Nato nations have agreed to build a “drone wall” along their borders to defend themselves against Russian threats,https://www.telegraph.co.uk/world-news/2024/05/26/nato-nations-plan-drone-wall-to-protect-from-russia/,0.98,5071,0,5071
6,worldnews,‘22 killed’ in Israeli air strike on tents for displaced people,https://www.centralfifetimes.com/news/national/24347167.22-killed-israeli-air-strike-tents-displaced-people/,0.78,4455,0,4455
7,worldnews,"Ukrainian M1 Abrams Tanks Get Elaborate ‘Cope Cages,’ Soviet Explosive Reactive Armor",https://www.twz.com/land/ukrainian-m1-abrams-tanks-get-elaborate-cope-cages-soviet-explosive-reactive-armor,0.96,3056,0,3056
8,worldnews,Shoppers hit by rising prices as costs seen to soar over past five years,https://www.euronews.com/business/2024/05/26/shoppers-hit-by-rising-prices-as-costs-seen-to-soar-over-past-five-years,0.94,3015,0,3015
9,worldnews,Macron begins the first state visit to Germany by a French president in 24 years,https://apnews.com/article/germany-france-macron-state-visit-fc930bc6069fa21980de8e39972ade24,0.97,1542,0,1542
10,worldnews,Israeli Knesset to vote on declaring UNRWA a terrorist organization,https://www.jpost.com/israel-hamas-war/article-803734?utm_source=jpost.app.android&amp;utm_medium=share,0.84,1533,0,1533
11,worldnews,Palestinian Authority on verge of fiscal collapse as Smotrich withholds funds,https://www.jpost.com/israel-news/article-803699,0.9,1470,0,1470
12,worldnews,"Zelenskyy calls on world leaders, especially Biden and Xi, to support upcoming peace summit",https://www.channelnewsasia.com/world/ukraine-president-volodymyr-zelenskyy-peace-summit-switzerland-joe-biden-xi-jinping-4364596,0.94,1337,0,1337
13,worldnews,Far-right Israeli settlers step up attacks on aid trucks bound for Gaza,https://www.washingtonpost.com/world/2024/05/26/west-bank-aid-trucks-gaza-settlers/,0.8,1258,0,1258
14,worldnews,"We have no right to give up, says Russian human rights activist",https://tvpworld.com/77731502/interview-with-russian-human-rights-activist-evgenia-kara-murza,0.93,1130,0,1130
15,worldnews,Zelenskiy calls on world leaders to attend Ukraine ‘peace summit’ after deadly Kharkiv strike | Ukraine,https://www.theguardian.com/world/article/2024/may/26/ukraine-zelenskiy-calls-on-world-leaders-to-attend-peace-summit-deadly-kharkiv-strike,0.93,676,0,676
16,worldnews,Hezbollah missiles hit homes across northern Israel ,https://www.jns.org/hezbollah-missiles-hit-homes-across-northern-israel/,0.87,675,0,675
17,worldnews,‘Enormously exciting’ fossils found in New South Wales opal field suggest Australia had ‘age of monotremes’,https://www.theguardian.com/australia-news/article/2024/may/27/enormously-exciting-fossils-found-in-nsw-opal-field-suggest-australia-had-age-of-monotremes,0.98,543,0,543
18,worldnews,"'Palestinian Authority preparing to govern Gaza', say Prime Minister",https://www.euronews.com/my-europe/2024/05/26/palestinian-authority-preparing-to-govern-gaza-say-prime-minister,0.91,477,0,477
19,worldnews,Russia Steps Up a Covert Sabotage Campaign Aimed at Europe,https://www.nytimes.com/2024/05/26/us/politics/russia-sabotage-campaign-ukraine.html,0.95,398,0,398
20,worldnews,Four people injured in knife attack in Lyon metro,https://www.euronews.com/2024/05/26/four-people-injured-in-knife-attack-in-lyon-metro,0.96,397,0,397
21,worldnews,US expected to lift ban on sale of offensive weapons to Saudi Arabia,https://www.yahoo.com/news/us-expected-lift-ban-sale-115349892.html,0.89,315,0,315
22,worldnews,Software firm fined $74k for data breach caused by weak password; half a million users affected,https://www.straitstimes.com/singapore/poor-password-causes-software-firm-to-be-fined-74000-for-data-breach-affecting-half-a-million-users,0.96,283,0,283
23,worldnews,"'We Don't Want the UN Charter to Burn Down Like These Books' - Zelensky Records Appeal Amidst Kharkiv Printing House — The printing house was targeted by Russian missiles on May 23, resulting in seven fatalities, over 20 injuries, and the destruction of 50,000 publications. Kharkiv Printing House",https://www.kyivpost.com/post/33292,0.92,225,0,225
24,worldnews,"/r/WorldNews Live Thread: Russian Invasion of Ukraine Day 824, Part 1 (Thread #970)",https://www.reddit.com/live/18hnzysb1elcs,0.96,202,0,202
25,worldnews,Polish Foreign Minister supports permission to attack Russia with Western weapons: Moscow does not restrain itself,https://www.pravda.com.ua/eng/news/2024/05/26/7457740/,0.95,141,0,141
26,worldnews,/r/WorldNews Live Thread for Israel-Hamas War (Thread #51),https://www.reddit.com/live/1bsso361afr0r,0.67,81,0,81
