,subreddit,title,url,upvote_ratio,ups,downs,score
0,worldnews,Ukraine to Lose War if US Congress Withholds Aid: Zelensky,https://www.kyivpost.com/post/30731,0.92,12806,0,12806
1,worldnews,"Chechnya 'bans music that is too fast or too slow': The Russian republic has ruled that all music should ""correspond to a tempo of 80 to 116 beats per minute"" meaning all western rave and techno music would be banned",https://news.sky.com/story/chechnya-bans-music-that-is-too-fast-or-too-slow-13110266,0.97,10631,0,10631
2,worldnews,"China sending Russia 'rifle scopes, tank parts and rocket fuel'",https://www.telegraph.co.uk/world-news/2024/04/07/china-sending-russia-rifle-scopes-tank-parts-rocket-fuel/,0.95,10259,0,10259
3,worldnews,"Ukrainians may be tiring but won’t compromise with Putin, Zelenskyy’s chief of staff says",https://www.politico.eu/article/ukraine-war-andriy-yermak-interview-volodymyr-zelenskyy-russia/,0.94,8805,0,8805
4,worldnews,Boris Johnson: Arms embargo on Israel 'death wish of Western civilization',https://www.ynetnews.com/article/b1xn23a1c,0.81,6891,0,6891
5,worldnews,"Netanyahu: Israel isn’t preventing a hostage deal, Hamas is",https://www.jpost.com/breaking-news/article-795770,0.73,3449,0,3449
6,worldnews,Japan’s Kishida warns world at ‘historic turning point’ as he touts importance of US alliance | CNN,https://edition.cnn.com/2024/04/07/asia/japan-kishida-us-defense-intl-hnk/index.html,0.97,3218,0,3218
7,worldnews,Pro-Russia candidate Peter Pellegrini elected Slovakia president,https://www.npr.org/2024/04/07/1243279109/pro-russia-candidate-peter-pellegrini-elected-slovakia-president,0.94,2746,0,2746
8,worldnews,IDF withdraws advancing troops from the Gaza Strip,https://m.jpost.com/breaking-news/article-795724,0.92,2669,0,2669
9,worldnews,Office for National Statistics staff vote to strike over return to office,https://www.bbc.com/news/uk-politics-68744433,0.96,1631,0,1631
10,worldnews,‘Extreme’ US anti-abortion group ramps up lobbying in the UK,https://www.theguardian.com/world/2024/apr/06/extreme-us-anti-abortion-group-ramps-up-lobbying-in-westminster,0.89,1352,0,1352
11,worldnews,Iranian official warns Israel that its embassies are not safe after Damascus strike,https://abcnews.go.com/International/wireStory/iranian-official-warns-israel-embassies-safe-after-deadly-108961374,0.93,1325,0,1325
12,worldnews,Ecuador faces outrage after storming Mexican embassy to arrest former VP,https://edition.cnn.com/2024/04/07/americas/outrage-mexican-embassy-ecuador-intl/index.html,0.97,1226,0,1226
13,worldnews,"/r/WorldNews Live Thread: Russian Invasion of Ukraine Day 774, Part 1 (Thread #920)",https://www.reddit.com/live/18hnzysb1elcs,0.96,1038,0,1038
14,worldnews,Russian-controlled Zaporizhzhia nuclear reactor damaged following drone attack | CNN,https://edition.cnn.com/2024/04/07/europe/russian-controlled-zaporizhzhia-nuclear-reactor-damaged-following-drone-attack/index.html?Date=20240408&amp;Profile=CNN+International&amp;utm_content=1712535272&amp;utm_medium=social&amp;utm_source=twitter,0.97,994,0,994
15,worldnews,Germany's Scholz warns of the rise of right-wing populists ahead of upcoming EU elections | AP News,https://apnews.com/article/romania-scholz-eu-elections-populism-germany-socialists-27e704937de559c07e27cfa76be0b2c4,0.91,900,0,900
16,worldnews,Trudeau Unveils $1.8 Billion Plan to Boost AI Sector in Canada,https://www.bloomberg.com/news/articles/2024-04-07/trudeau-unveils-1-8-billion-plan-to-boost-ai-sector-in-canada,0.86,875,0,875
17,worldnews,Poland to introduce compulsory education for Ukrainian children,https://tvpworld.com/76787176/poland-to-introduce-compulsory-education-for-ukrainian-children-official,0.96,714,0,714
18,worldnews,Emergency declared in Russia's Orenburg region following dam collapse,https://novayagazeta.eu/articles/2024/04/07/emergency-declared-in-orenburg-region-following-dam-collapse-en-news,0.94,688,0,688
19,worldnews,Gallant: IDF withdrawal from Khan Yunis in preparation for Rafah operation,https://www.jpost.com/breaking-news/article-795818,0.86,433,0,433
20,worldnews,France's Macron dismisses Russian remarks suggesting Kyiv and Paris had a role in Moscow attack,https://www.ctvnews.ca/world/france-s-macron-dismisses-russian-remarks-suggesting-kyiv-and-paris-had-a-role-in-moscow-attack-1.6836147,0.94,386,0,386
21,worldnews,Macron says France 'lacked will' to stop 1994 Rwanda genocide - I24NEWS,https://www.i24news.tv/en/news/international/artc-macron-says-france-lacked-will-to-stop-1994-rwanda-genocide,0.91,253,0,253
22,worldnews,Musk challenges Brazil's order to block certain X accounts,https://www.reuters.com/technology/musk-challenges-brazils-order-block-certain-x-accounts-2024-04-07/,0.82,246,0,246
23,worldnews,/r/WorldNews Live Thread for Israel-Hamas War (Thread 47),https://www.reddit.com/live/1bsso361afr0r,0.77,194,0,194
24,worldnews,Court ruling effectively outlaws Islamic schools in India’s most populous state,https://edition.cnn.com/2024/03/24/india/india-madrasa-court-ruling-uttar-pradesh-intl-hnk/index.html,0.92,164,0,164
25,worldnews,Netanyahu says Israel 'one step from victory' in Gaza,https://www.channelnewsasia.com/world/israeli-prime-minister-benjamin-netanyahu-says-one-step-victory-gaza-hamas-war-4248991,0.66,136,0,136
26,worldnews,Iranian official warns Israel that its embassies are not safe after deadly Damascus strike,https://www.nbcnews.com/news/world/iranian-official-warns-israel-embassies-are-not-safe-deadly-damascus-s-rcna146758,0.88,135,0,135
