,subreddit,title,url,upvote_ratio,ups,downs,score
0,worldnews,"Finland’s foreign minister hints that Russia may have been involved in last week’s Quran-burning protest that threatens to derail Sweden’s accession to NATO: ""This is unforgivable,” Haavisto says.",https://english.alarabiya.net/News/world/2023/01/28/Finland-hints-at-Russia-s-involvement-in-Quran-burning-protest-in-Sweden,0.88,48560,0,48560
1,worldnews,Zelensky blasts Olympic committee move: ‘Any neutral flag of Russian athletes is stained with blood’,https://thehill.com/homenews/3834410-zelensky-blasts-olympic-committee-move-any-neutral-flag-of-russian-athletes-is-stained-with-blood/,0.88,16826,0,16826
2,worldnews,Pro-Western war hero Petr Pavel looks set to sweep Czech presidential vote,https://www.france24.com/en/europe/20230127-pro-western-former-general-pavel-set-to-sweep-czech-president-vote,0.97,8981,0,8981
3,worldnews,Sweden tells citizens to avoid crowds in Turkey after Koran burning,https://www.reuters.com/world/sweden-tells-citizens-avoid-crowds-turkey-after-koran-burning-2023-01-28/,0.97,6460,0,6460
4,worldnews,‘Ukraine is not our enemy’: Russians risk arrest to honour victims of war,https://www.theguardian.com/world/2023/jan/28/russians-arrest-victims-war-ukraine-kremlin-dissent-memorials,0.97,6191,0,6191
5,worldnews,"Lithuanian MP calls for barring Russian, Belarusian athletes from Paris Olympics",https://www.lrt.lt/en/news-in-english/19/1876696/lithuanian-mp-calls-for-barring-russian-belarusian-athletes-from-paris-olympics,0.96,5221,0,5221
6,worldnews,2 seriously wounded in another shooting attack in Jerusalem; attacker 'neutralized',https://www.timesofisrael.com/2-seriously-wounded-in-another-shooting-attack-in-jerusalem-attacker-neutralized/,0.92,4946,0,4946
7,worldnews,"Turkey alerts citizens to risk of attack in United States, Europe on heels of Western warnings",https://www.reuters.com/world/turkey-alerts-citizens-risk-attack-united-states-europe-heels-western-warnings-2023-01-28/,0.93,4907,0,4907
8,worldnews,Iran: Massive blast heard at military plant in Isfahan - I24NEWS,https://www.i24news.tv/en/news/middle-east/iran-eastern-states/1674941861-iran-massive-blast-heard-at-military-plant-in-isfahan,0.97,4468,0,4468
9,worldnews,"Finland Most Resistant to ‘Fake News,’ Report Finds",https://www.usnews.com/news/best-countries/articles/2023-01-27/finland-most-resistant-to-fake-news-report-finds,0.96,4071,0,4071
10,worldnews,"At the Pentagon, push to send F-16s to Ukraine picks up steam",https://www.politico.com/news/2023/01/28/pentagon-send-f-16s-ukraine-00080045,0.95,3425,0,3425
11,worldnews,"Ukraine: ‘Fast-track’ talks underway for missiles, planes",https://apnews.com/article/russia-ukraine-zelenskyy-politics-government-donetsk-119eacfc993491b4b66a117ddfe91696,0.96,1769,0,1769
12,worldnews,"Nearly 5,500 Russians Killed Last Week in War: Defense Ministry",https://www.newsweek.com/nearly-5500-russians-killed-last-week-war-defense-ministry-1777316,0.95,1357,0,1357
13,worldnews,Zelenskyy enacts sanctions against individuals and companies involved in transportation of Russian invaders and their equipment,https://www.pravda.com.ua/eng/news/2023/01/28/7386963/,0.94,1325,0,1325
14,worldnews,Tens of thousands of teachers march in Lisbon to demand better pay and conditions,https://www.reuters.com/world/europe/tens-thousands-teachers-march-lisbon-demand-better-pay-conditions-2023-01-28/,0.97,1300,0,1300
15,worldnews,UK scientists discover method to reduce steelmaking’s CO2 emissions by 90%,https://thenextweb.com/news/uk-scientists-discover-method-reduce-steelmakings-co2-emissions,0.97,924,0,924
16,worldnews,Ukraine accuses Russia of deliberately slowing grain shipments,https://euromaidanpress.com/2023/01/27/ukraine-accuses-russia-of-deliberately-slowing-grain-shipments/,0.94,836,0,836
17,worldnews,Ukraine says Russia's putting inflatable tanks on the battlefield — but the decoys deflated,https://www.yahoo.com/news/ukraine-says-russias-putting-inflatable-024429192.html,0.96,727,0,727
18,worldnews,Hundreds of climate activists were arrested in The Hague after blocking the A12 highway in both ways on Saturday afternoon in protest at government subsidies for fossil fuels such as oil and gas,https://www.dutchnews.nl/news/2023/01/hundreds-arrested-at-climate-protest-on-a12-in-the-hague/,0.95,699,0,699
19,worldnews,Pro-western Petr Pavel sweeps to landslide win in race for Czech presidency | Czech Republic,https://www.theguardian.com/world/2023/jan/28/petr-pavel-wins-landslide-victory-in-czech-presidential-elections,0.97,639,0,639
20,worldnews,"At least 25 die in Peru when bus plunges off cliff, police say",https://www.cbsnews.com/news/25-die-in-peru-when-bus-plunges-off-cliff-police-say/,0.97,622,0,622
21,worldnews,Israel to 'strengthen' settlements after shooting attacks,https://apnews.com/article/israel-jerusalem-west-bank-6e424c48e20f7b3df67a04aa0957a67a,0.86,490,0,490
22,worldnews,"German arms-maker Rheinmetall eyes boost in munitions output, HIMARS production in Germany",https://www.reuters.com/business/aerospace-defense/rheinmetall-eyes-boost-munitions-output-himars-production-germany-ceo-2023-01-28/,0.95,480,0,480
23,worldnews,Drone attack hits Iran ammunition factory – reports,https://www.theguardian.com/world/2023/jan/29/drone-attack-hits-iran-ammunition-factory-reports,0.97,282,0,282
24,worldnews,"/r/WorldNews Live Thread: Russian Invasion of Ukraine Day 340, Part 1 (Thread #481)",https://www.reddit.com/live/18hnzysb1elcs,0.96,250,0,250
25,worldnews,"North Korea has denied providing arms to Moscow after the United States said the nuclear-armed state supplied rockets and missiles to Russia's private military group Wagner. Even though photos show Russian rail cars entering North Korea, picking up munitions and returning to Russia",https://www.france24.com/en/live-news/20230129-north-korea-denies-arms-dealing-with-russia,0.95,119,0,119
