,subreddit,title,url,upvote_ratio,ups,downs,score
0,worldnews,Iran parliament working on bill that proposes €50m reward for killing Trump,https://www.iranintl.com/en/202605148010?source=share-link,0.97,16986,0,16986
1,worldnews,"Trump says Xi agrees Iran must open strait, China says war shouldn't have started",https://www.reuters.com/world/china/trump-says-xi-agrees-iran-must-open-strait-china-says-war-shouldnt-have-started-2026-05-16/,0.97,6814,0,6814
2,worldnews,‘Clearly marked’ United Nations vehicles struck by drones in Ukraine,https://ktla.com/news/video-clearly-marked-united-nations-vehicles-struck-by-drones-in-ukraine/,0.96,6727,0,6727
3,worldnews,"Ebola outbreak in Africa is 'public health emergency of international concern,' WHO says",https://abcnews.com/International/ebola-outbreak-africa-public-health-emergency-international-concern/story?id=133040670,0.96,6323,0,6323
4,worldnews,"At least 3 killed, numerous residential buildings hit in mass drone attack on Moscow region",https://kyivindependent.com/over-70-drones-reportedly-downed-near-moscow-russian-officials-claim/,0.98,5605,0,5605
5,worldnews,Rescue diver dies during search for bodies of Italians who drowned in Maldives caves,https://www.bbc.com/news/articles/c1w2gv1gdnjo,0.98,3513,0,3513
6,worldnews,"China Will Host Putin, Days After Trump’s Visit",https://www.nytimes.com/2026/05/16/world/europe/putin-china-visit-trump.html,0.98,3489,0,3489
7,worldnews,Trump’s description of Taiwan as a ‘good negotiating chip’ with China raises anxieties,https://apnews.com/article/taiwan-trump-arms-68eaac52b871e556aa6bd0509b101a90,0.97,3396,0,3396
8,worldnews,"France ready to develop ballistic missile defense with Ukraine, says Zelensky, calling it 'important step'",https://kyivindependent.com/france-ready-to-develop-ballistic-missile-defense-with-ukraine-zelensky-calls-it-important-step/,0.98,2315,0,2315
9,worldnews,Rwandan genocide suspect Kabuga dies in custody in The Hague at age 91,https://apnews.com/article/rwanda-genocide-suspect-kabuda-dies-hague-d9c0156deb1359429cb22ea8441974e9,0.98,2087,0,2087
10,worldnews,13 men killed by US military boat strikes identified: ‘These were flesh-and-blood people’,https://www.theguardian.com/us-news/2026/may/15/us-military-airstrikes-caribbean-pacific-victim-identities,0.84,1666,0,1666
11,worldnews,Canada confirms first hantavirus case in isolation in British Columbia,https://www.theguardian.com/world/2026/may/16/canada-first-hantavirus-case-british-columbia,0.91,1598,0,1598
12,worldnews,Israeli group sues Canadian human rights museum over 'Nakba' exhibit,https://nationalpost.com/news/canada/legal-action-looms-over-nakba-portrayal-at-cmhr-in-winnipeg,0.83,698,0,698
13,worldnews,Toddlers among more than 50 schoolchildren kidnapped in Nigeria,https://www.bbc.co.uk/news/articles/c202vrxlwqgo,0.96,687,0,687
14,worldnews,Canada deepens Arctic defense ties with Nordics after Trump threats,https://www.reuters.com/business/aerospace-defense/canada-deepens-arctic-defense-ties-with-nordics-after-trump-threats-2026-05-16/,0.96,629,0,629
15,worldnews,Venezuela says it deported close ally of Maduro to face judicial proceedings in US,https://apnews.com/article/venezuela-us-maduro-ally-057c22fe6e9b7022388eaeea2f1ecb52,0.93,497,0,497
16,worldnews,Zelenskyy's office head opposes mobilisation of men under 25: We would destroy country's future,https://www.pravda.com.ua/eng/news/2026/05/16/8035004/,0.94,379,0,379
17,worldnews,The Palestinian Authority is reinforcing and institutionalizing notorious 'pay-for-slay' policy,https://www.jpost.com/middle-east/article-896389,0.76,318,0,318
18,worldnews,WHO declares Ebola outbreak in DR Congo a global health emergency,https://www.bbc.com/news/articles/c2l2p0wwzzdo,0.95,284,0,284
19,worldnews,/r/WorldNews Discussion Thread: US and Israel launch attack on Iran; Iran retaliates (Thread #17),https://www.reddit.com/r/worldnews/comments/1t1399d/rworldnews_discussion_thread_us_and_israel_launch/,0.9,249,0,249
20,worldnews,"PM Modi warns of ‘return of massive poverty’, flags ‘disaster decade’ of Covid, wars, fuel crisis",https://www.hindustantimes.com/india-news/pm-modi-warns-of-return-of-poverty-lists-covid-wars-energy-crisis-as-global-dangers-101778942352877.html,0.9,202,0,202
21,worldnews,"/r/WorldNews Live Thread: Russian Invasion of Ukraine Day 1543, Part 1 (Thread #1690)",https://www.reddit.com/live/18hnzysb1elcs,0.94,168,0,168
22,worldnews,Poland makes history with first same-sex marriage registration following EU court ruling,https://www.euronews.com/my-europe/2026/05/14/poland-makes-history-with-first-same-sex-marriage-registration-following-eu-court-ruling,0.89,162,0,162
23,worldnews,Pope Leo to visit France in September in first official papal trip in 18 years,https://www.rfi.fr/en/france/20260516-pope-leo-to-visit-france-in-september-in-first-official-papal-trip-in-18-years,0.92,126,0,126
24,worldnews,South Korean scientists successfully 3D printed a living cornea aimed at restoring vision in blind patients,https://scienceaim.com/south-korean-scientists-successfully-3d-printed-a-living-cornea-aimed-at-restoring-vision-in-blind-patients/,0.97,52,0,52
