,subreddit,title,url,upvote_ratio,ups,downs,score
0,worldnews,Polls show Erdogan lags opposition by more than 10 points ahead of May vote,https://www.reuters.com/world/middle-east/polls-show-erdogan-lags-opposition-by-more-than-10-points-ahead-may-vote-2023-03-13/,0.95,30346,0,30346
1,worldnews,"'UK will not return Elgin Marbles to Greece', says Rishi Sunak",https://www.firstpost.com/world/uk-will-not-return-elgin-marbles-to-greece-says-rishi-sunak-12283672.html,0.94,12258,0,12258
2,worldnews,"Russia has resorted to recruiting inmates from women's prisons to serve in the Russian military in a bid to make up for its growing losses in Ukraine, according to both Ukrainian officials and an independent Russian prisons watchdog",https://www.themoscowtimes.com/2023/03/13/russia-turns-to-womens-prisons-for-fresh-recruits-reports-a80470,0.96,7874,0,7874
3,worldnews,"International Court to Open War Crimes Cases Against Russia, Officials Say",https://www.nytimes.com/2023/03/13/world/europe/icc-war-crimes-russia-ukraine.html?smid=nytcore-ios-share&amp;referringSource=articleShare,0.97,7570,0,7570
4,worldnews,"Regime change in Moscow 'definitely' the goal, Joly says, as Canada bans Russian steel, aluminum imports",https://nationalpost.com/news/politics/regime-change-in-moscow-definitely-the-goal-joly-says,0.97,6778,0,6778
5,worldnews,Toxic ‘forever chemicals’ found in toilet paper around the world |,https://www.theguardian.com/environment/2023/mar/13/toxic-forever-chemicals-pfas-toilet-paper,0.96,3776,0,3776
6,worldnews,Biden announces nuclear-powered submarines for Australia,https://apnews.com/article/cf330037f9e6befdec0f6c1658601462,0.96,2921,0,2921
7,worldnews,"Facing Intense Heat and Dust Storms, Iraq Aims to Plant 5 Million Trees",https://e360.yale.edu/digest/iraq-climate-change-5-million-trees,0.97,1835,0,1835
8,worldnews,Italy blames surge in migration on Russia's Wagner group,https://www.reuters.com/world/europe/italy-blames-surge-migration-russias-wagner-group-2023-03-13/,0.96,1233,0,1233
9,worldnews,German university quietly removes “comfort women” statue amid pressure from Japan,https://english.hani.co.kr/arti/english_edition/e_international/1083385.html,0.94,1096,0,1096
10,worldnews,Diplomats from nearly 200 nations and top climate scientists began a week-long huddle in Switzerland on Monday to distil nearly a decade of published science into a 20-odd-page warning about the existential danger of global warming and what to do about it,https://www.france24.com/en/live-news/20230313-governments-vet-crucial-un-climate-science-report,0.94,1073,0,1073
11,worldnews,"Russian Regions Told To Get Ready For New Drive To Recruit 400,000 Professional Soldiers – OpEd",https://www.eurasiareview.com/14032023-russian-regions-told-to-get-ready-for-new-drive-to-recruit-400000-professional-soldiers-oped/,0.96,900,0,900
12,worldnews,ICC to issue first arrest warrants linked to Russia’s invasion of Ukraine,https://www.theguardian.com/law/2023/mar/13/icc-to-issue-first-arrest-warrants-linked-to-russias-invasion-of-ukraine,0.95,766,0,766
13,worldnews,"Russia and China threaten to create global 'danger and disorder', says UK's Sunak",https://www.jpost.com/international/article-734199,0.89,753,0,753
14,worldnews,Ukrainian pilots are calling the US Air Force for tips on using US-made missiles and bombs,https://www.businessinsider.com/ukraine-calling-us-air-force-help-with-us-made-weapons-2023-3,0.95,752,0,752
15,worldnews,Swedish pension giant loses 12 billion kronor from US banks’ collapse,https://www.thelocal.se/20230313/swedish-pension-giant-loses-12-billion-kronor-from-us-banks-collapse/,0.91,502,0,502
16,worldnews,More Iranian Girls’ Schools Targeted By “Chemical Attacks” (Iran),https://iranwire.com/en/news/114742-more-iranian-girls-schools-targeted-by-chemical-attacks/,0.95,450,0,450
17,worldnews,Moldova Fears 'Hybrid Warfare Generated by Russia' — Defense Minister,https://www.themoscowtimes.com/2023/03/13/moldova-fears-hybrid-warfare-generated-by-russia-defense-minister-a80468,0.94,418,0,418
18,worldnews,Jesuits of Canada releases list of 27 members ‘credibly’ accused of child sex abuse | Globalnews.ca,https://globalnews.ca/news/9547935/canada-jesuits-list-priests-sexual-abuse/,0.94,378,0,378
19,worldnews,"Brazil's Bolsonaro will be subpoenaed in jewelry scandal, says minister",https://www.msn.com/en-gb/news/world/brazils-bolsonaro-will-be-subpoenaed-in-jewelry-scandal-says-minister/ar-AA18Al8U,0.93,364,0,364
20,worldnews,"Some 260,000 birds killed by avian influenza in Argentina",https://www.batimes.com.ar/news/argentina/some-260000-poultry-killed-by-avian-influenza-in-argentina.phtml,0.95,332,0,332
21,worldnews,Australian nuclear submarine program to cost up to $368b as AUKUS details unveiled in the US,https://www.abc.net.au/news/2023-03-14/aukus-nuclear-submarine-deal-announced/102087614,0.92,286,0,286
22,worldnews,"/r/WorldNews Live Thread: Russian Invasion of Ukraine Day 384, Part 1 (Thread #525)",https://www.reddit.com/live/18hnzysb1elcs,0.96,281,0,281
23,worldnews,Skunks found dead in Metro Vancouver had avian flu: government,https://vancouversun.com/news/local-news/metro-vancouver-dead-skunks-avian-flu,0.95,251,0,251
24,worldnews,"Canada on sidelines as U.S., Britain, Australia move ahead on new security deal| Trudeau has refused to say whether Canada was invited to join AUKUS",https://www.cbc.ca/news/politics/aukus-national-defence-britain-australia-1.6777498,0.91,202,0,202
25,worldnews,Canadian police investigating alleged Chinese 'police stations',https://abcnews.go.com/amp/International/canadian-police-investigating-alleged-chinese-police-stations/story?id=97773527,0.92,131,0,131
