,subreddit,title,url,upvote_ratio,ups,downs,score
0,worldnews,"U.S.-Iran talks end with no agreement, Vance says",https://www.axios.com/2026/04/12/iran-talks-pakistan-vance-no-deal,0.98,12139,0,12139
1,worldnews,U.S. warships cross Strait of Hormuz for first time since Iran war began,https://www.axios.com/2026/04/11/us-iran-navy-strait-of-hormuz,0.9,11392,0,11392
2,worldnews,Prostitution of minors in France rises by 43 percent in four years,https://www.rfi.fr/en/france/20260410-prostitution-of-minors-in-france-rises-by-43-percent-in-four-years,0.94,10001,0,10001
3,worldnews,‘God does not bless any conflict’: pope issues new rebuke over Iran war,https://www.theguardian.com/world/2026/apr/10/pope-leo-criticism-iran-war,0.98,9016,0,9016
4,worldnews,JD Vance says US delegation leaving Pakistan after failing to reach deal with Iran,https://www.theguardian.com/world/2026/apr/12/jd-vance-says-no-deal-us-iran-pakistan-talks-islamabad,0.98,6464,0,6464
5,worldnews,"Ukraine has warned that former members of a disbanded special police unit, who fled to Russia after 2014, may have been brought to Budapest by the Kremlin to stage provocations ahead of Hungary’s parliamentary elections",https://tvpworld.com/92580319/ex-berkut-members-in-budapest-ukraine-warns-of-russian-operation,0.98,6352,0,6352
6,worldnews,"Russia held them for years —Ukraine just brought home 182 prisoners, including Mariupol’s defenders",https://euromaidanpress.com/2026/04/11/russia-held-them-for-years-ukraine-just-brought-home-182-prisoners-including-mariupols-defenders/,0.98,4404,0,4404
7,worldnews,Pope Leo XIV denounces the ‘delusion of omnipotence’ he says fuels the US-Israeli war in Iran,https://apnews.com/article/pope-leo-usisraeli-war-iran-7309c5df6c7312b942e0510ea65502cb,0.97,4235,0,4235
8,worldnews,"Pakistan deploys 13,000 troops and fighter jets to Saudi Arabia",https://www.thehindu.com/news/international/pakistan-deploys-13000-troops-and-fighter-jets-to-saudi-arabia/article70853223.ece,0.97,2727,0,2727
9,worldnews,US military says two of its ships crossed through Strait of Hormuz,https://www.reuters.com/world/middle-east/us-military-says-two-its-ships-crossed-through-strait-hormuz-2026-04-11/,0.91,2035,0,2035
10,worldnews,Report: US-Iran talks hit stalemate over Strait of Hormuz,https://www.ynetnews.com/article/rytxtedhwl,0.96,1965,0,1965
11,worldnews,U.S. Intelligence Shows China Taking a More Active Role in Iran War,https://www.nytimes.com/2026/04/11/us/politics/china-iran-war-missiles-supplies.html,0.96,1539,0,1539
12,worldnews,"U.S.-Iran peace summit in Pakistan concludes with no deal, talks to continue on Sunday",https://www.cnbc.com/2026/04/11/us-iran-talks-set-to-begin-in-islamabad-after-delegations-arrive.html,0.97,1365,0,1365
13,worldnews,Iran warns of attack on US warship as peace talks open in Pakistan,https://www.yahoo.com/news/articles/iran-warns-attack-us-warship-153832152.html,0.95,1034,0,1034
14,worldnews,US-Iran talks on Strait of Hormuz reach 'deadlock' - FT,https://unn.ua/en/news/us-iran-talks-on-strait-of-hormuz-reach-deadlock-ft,0.96,933,0,933
15,worldnews,US negotiators leaving without a peace deal with Iran,https://www.reuters.com/world/asia-pacific/us-iran-talks-pause-now-disagreements-remain-2026-04-11/,0.96,819,0,819
16,worldnews,"Brazil seizes over 1,100 weapons and 1.5 tons of drugs from US, says official",https://www.reuters.com/world/americas/brazil-seizes-over-1100-weapons-15-tons-drugs-us-says-official-2026-04-10/,0.96,725,0,725
17,worldnews,Majority of Hungarians believe April 12 election will be rigged or manipulated,https://tvpworld.com/92475589/hungary-almost-80-of-public-fear-april-12-election-rigging,0.98,675,0,675
18,worldnews,"Mexico launches Universal Health Service registration, starting with elderly",https://mexiconewsdaily.com/mexico-living/mexico-universal-health-service-registration/,0.97,670,0,670
19,worldnews,Trump threatens China with ‘big problems’ if they arm Iranian regime,https://www.arabnews.com/node/2639594/world,0.94,641,0,641
20,worldnews,Most Corrupt Country: Hungarians Face Anger Over Corruption Amidst Orban's Wealth and Upcoming Elections | World News - The Times of India,https://timesofindia.indiatimes.com/world/europe/hungarians-growing-anger-at-living-in-eus-most-corrupt-state/articleshow/130051702.cms,0.96,598,0,598
21,worldnews,Hungarians decide whether to end 16 years of Orbán rule and elect rival,https://www.bbc.com/news/articles/cdxdepjrv95o,0.98,562,0,562
22,worldnews,"Israeli Minister Announces ‘Border Expansion’ in Palestine, Lebanon and Syria",https://novaramedia.com/2026/04/10/israeli-minister-announces-border-expansion-in-palestine-lebanon-and-syria/,0.84,169,0,169
23,worldnews,/r/WorldNews Discussion Thread: US and Israel launch attack on Iran; Iran retaliates (Thread #15),https://www.reddit.com/r/worldnews/comments/1shqn32/rworldnews_discussion_thread_us_and_israel_launch/,0.85,149,0,149
24,worldnews,"/r/WorldNews Live Thread: Russian Invasion of Ukraine Day 1508, Part 1 (Thread #1655)",https://www.reddit.com/live/18hnzysb1elcs,0.95,141,0,141
