,subreddit,title,url,upvote_ratio,ups,downs,score
0,worldnews,Nordic media reveals Russia’s secret operations in waters around their states,https://www.pravda.com.ua/eng/news/2023/04/19/7398468/,0.94,34538,0,34538
1,worldnews,Costa Rica exceeds 98% renewable electricity generation for the eighth consecutive year,https://www.bnamericas.com/en/news/costa-rica-exceeds-98-renewable-electricity-generation-for-the-eighth-consecutive-year,0.95,33005,0,33005
2,worldnews,South Korea could provide military aid to Ukraine if Russia targets civilians,https://koreajoongangdaily.joins.com/2023/04/19/national/politics/Korea-Yoon-Suk-Yeol-Ukraine/20230419105105925.html,0.96,10819,0,10819
3,worldnews,"Marine scientists have calculated the commercial value of the world's kelp forests, showing they provide billions of dollars in value to society and are capable of removing 4.91 megatons of carbon from the atmosphere every year.",https://newsroom.unsw.edu.au/news/science-tech/kelp-forests-multi-billion-dollar-ecosystem-our-waters?utm_source=reddit&amp;utm_medium=social,0.98,6572,0,6572
4,worldnews,"Mexico's president slams U.S. ""spying"" after 28 Sinaloa cartel members charged, including sons of ""El Chapo""",https://www.cbsnews.com/news/mexico-president-andres-manuel-lopez-obrador-us-spying-sinaloa-cartel-members-charged/?intcid=CNI-00-10aaa3b&amp;ftag=CNM-00-10aab4i,0.94,4364,0,4364
5,worldnews,"US cannot store arms in Philippines to defend Taiwan, Manila says in ‘friends to all’ policy",https://www.scmp.com/week-asia/politics/article/3217607/us-cannot-store-arms-philippines-defend-taiwan-manila-says-friends-all-policy?module=lead_hero_story&amp;pgtype=homepage,0.96,4343,0,4343
6,worldnews,Russian Memo Said War Leaves Moscow Too Reliant on Chinese Tech,https://www.bloomberg.com/news/articles/2023-04-19/russia-china-worries-set-out-in-private-memo-on-tech-risk,0.97,4331,0,4331
7,worldnews,"Severe heatwave engulfs Asia causing deaths and forcing schools to close | Extreme temperatures described as ‘worst April heatwave in Asian history’ as records tested in India, China, Thailand and Laos",https://www.theguardian.com/weather/2023/apr/19/severe-heatwave-asia-deaths-schools-close-india-china,0.96,3289,0,3289
8,worldnews,"Volcanic microbe eats CO2 ‘astonishingly quickly’, say scientists",https://www.msn.com/en-us/news/technology/volcanic-microbe-eats-co2-astonishingly-quickly-say-scientists/ar-AA1a3vdd?ocid=msedgdhp&amp;pc=U531&amp;cvid=7fc7ce0b08ac4720b00f47f2383c8a09&amp;ei=32,0.97,2938,0,2938
9,worldnews,"Russia warns South Korea against arming Ukraine in ‘unfriendly stance’, threatens retaliation involving North Korea",https://www.scmp.com/news/world/russia-central-asia/article/3217631/russia-warns-south-korea-against-arming-ukraine-unfriendly-stance-threatens-retaliation-involving?module=lead_hero_story&amp;pgtype=homepage,0.95,2846,0,2846
10,worldnews,Medvedev threatens Russia will arm North Korea if South Korea supplies arms to Ukraine,https://www.pravda.com.ua/eng/news/2023/04/19/7398503/,0.94,2696,0,2696
11,worldnews,New Zealand cat-killing competition for children axed after backlash,https://www.bbc.com/news/world-asia-65320162?xtor=AL-72-%5Bpartner%5D-%5Bbbc.news.twitter%5D-%5Bheadline%5D-%5Bnews%5D-%5Bbizdev%5D-%5Bisapi%5D&amp;at_campaign=Social_Flow&amp;at_campaign_type=owned&amp;at_link_origin=BBCWorld&amp;at_medium=social&amp;at_link_type=web_link&amp;at_ptr_name=twitter&amp;at_link_id=E3DCE9AE-DE92-11ED-A3FF-FE9B4744363C&amp;at_format=link&amp;at_bbc_team=editorial,0.94,2220,0,2220
12,worldnews,"Germany, Poland and others are pushing for new sanctions on Russia’s nuclear energy",https://www.cnbc.com/2023/04/19/germany-poland-and-others-are-pushing-for-new-sanctions-on-russias-nuclear-energy.html,0.96,2054,0,2054
13,worldnews,"Russia Is Importing Western Weapons Technology, Bypassing Sanctions",https://www.nytimes.com/2023/04/18/business/economy/us-russia-chips-sanctions.html?smid=tw-nytimesworld&amp;smtyp=cur,0.95,1391,0,1391
14,worldnews,"Biden preparing to send fresh shipment of ammo, missiles to Ukraine",https://www.politico.com/news/2023/04/19/biden-ukraine-ammo-austin-sweden-00092802,0.94,1389,0,1389
15,worldnews,Canadian Government Introducing Groundbreaking Legislation To Ban Cosmetics Animal Testing and Trade,https://mnialive.com/articles/canadian-government-introducing-groundbreaking-legislation-to-ban-cosmetics-animal-testing-and-trade/,0.95,1092,0,1092
16,worldnews,Germany Moves To Ban Most Oil And Gas Heating Systems From 2024,https://oilprice.com/Energy/Energy-General/Germany-Moves-To-Ban-Most-Oil-And-Gas-Heating-Systems-From-2024.html,0.93,728,0,728
17,worldnews,Top national security adviser to Brazil's Lula resigns after leaked CCTV cameras shows him amid jan-8 attacks,https://www.reuters.com/world/americas/top-security-adviser-brazils-president-abruptly-resigns-2023-04-19/,0.95,638,0,638
18,worldnews,Moscow ballet about Nureyev dropped due to ban on ‘LGBT propaganda’,https://www.theguardian.com/world/2023/apr/19/moscow-ballet-about-nureyev-dropped-due-to-ban-on-lgbt-propaganda,0.93,613,0,613
19,worldnews,‘Patriots for Patriots’: American-Made Missile System Arrives in Ukraine,https://www.kyivpost.com/post/16028,0.91,599,0,599
20,worldnews,Italian minister sparks fury for saying immigration leads to 'ethnic replacement',https://edition.cnn.com/2023/04/19/europe/italy-immigration-lollobrigida-intl/index.html,0.9,493,0,493
21,worldnews,"The US Supreme Court kept alive a massive money laundering prosecution against the Turkish state-run Halkbank, a sanctions case that sparked scandals roiling the leaders of two NATO allies",https://lawandcrime.com/high-profile/halkbank-criminal-case-survives-scotus-wont-dismiss-turkish-state-bank-sanctions-case-tied-to-trump-scandal/,0.95,353,0,353
22,worldnews,"/r/WorldNews Live Thread: Russian Invasion of Ukraine Day 421, Part 1 (Thread #562)",https://www.reddit.com/live/18hnzysb1elcs,0.97,331,0,331
23,worldnews,Young people in China struggle to find jobs as the country's youth unemployment rate rises,https://www.abc.net.au/news/2023-04-20/youth-unemployment-china-young-people-struggle-to-find-jobs/102216686,0.92,298,0,298
24,worldnews,Nasa says flash over Kyiv was not its satellite,https://www.bbc.com/news/world-europe-65331823?at_medium=RSS&amp;at_campaign=KARANGA,0.93,282,0,282
25,worldnews,"67 million children missed vaccines during pandemic: A decline in vaccine confidence comes after more than a decade of hard-earned gains in routine childhood immunization. Getting back on track will be a challenging task, UNICEF warned",https://www.dw.com/en/67-million-children-missed-vaccines-during-pandemic-unicef/a-65379603,0.89,89,0,89
