,subreddit,title,url,upvote_ratio,ups,downs,score
0,worldnews,"Women students tell Iran's president to ""get lost"" as unrest rages",https://www.reuters.com/world/middle-east/iranians-keep-up-heat-leaders-with-protests-strikes-2022-10-08/,0.93,49587,0,49587
1,worldnews,"Russia's State Duma calls bridge explosion a ""declaration of war""",https://euroweeklynews.com/2022/10/08/russia-state-duma-explosion-crimean-bridge-declaration-of-war/,0.92,44489,0,44489
2,worldnews,Scotland 'snow-free' for fourth time in six years. Only happened nine times in last three hundred years.,https://www.bbc.co.uk/news/uk-scotland-highlands-islands-63184780,0.93,41268,0,41268
3,worldnews,Iran: Leaked documents reveal top-level orders to armed forces to ‘mercilessly confront’ protesters,https://www.amnesty.org/en/latest/news/2022/09/iran-leaked-documents-reveal-top-level-orders-to-armed-forces-to-mercilessly-confront-protesters/,0.96,25984,0,25984
4,worldnews,Russians can’t predict when Crimean Bridge will be restored: all trains to Crimea cancelled,https://www.pravda.com.ua/eng/news/2022/10/8/7370887/,0.97,20610,0,20610
5,worldnews,"American in Ukraine details fighting unarmed Russians: ""It's just insane""",https://www.newsweek.com/american-ukraine-details-fighting-unarmed-russians-its-just-insane-1750069,0.95,12016,0,12016
6,worldnews,Dutch city looks into pardon for witches murdered in the 17th century,https://nltimes.nl/2022/10/08/roermond-looks-pardon-witches-murdered-17th-century,0.95,7477,0,7477
7,worldnews,Liz Truss approval ratings reach new lows after Tory conference,https://www.theguardian.com/politics/2022/oct/08/liz-truss-approval-ratings-reach-new-lows-after-tory-conference,0.97,6320,0,6320
8,worldnews,Russia names air force general to lead its forces in Ukraine,https://www.reuters.com/world/europe/russia-names-air-force-general-lead-its-forces-ukraine-2022-10-08/,0.97,5642,0,5642
9,worldnews,"So much is happening in sub-Saharan Africa right now, from Kenya’s recent wild presidential election to Nigeria’s upcoming one. Not to mention the famine in the Horn of Africa and danger in Sahel. I’m the Africa editor for Al Jazeera: Ask me anything about sub-Saharan Africa.",https://www.reddit.com/r/worldnews/comments/xxctqc/so_much_is_happening_in_subsaharan_africa_right/,0.94,5056,0,5056
10,worldnews,The I.M.F. said $1.3 billion in emergency funding for Ukraine had been approved by its board.,https://www.nytimes.com/2022/10/08/world/europe/the-imf-said-1-3-billion-in-emergency-funding-for-ukraine-had-been-approved-by-its-board.html,0.96,4089,0,4089
11,worldnews,Ukraine expels Iranian students following Iran drone sales to Russia,https://www.middleeasteye.net/news/ukraine-expels-iranian-students-drone-sales,0.97,3657,0,3657
12,worldnews,Microplastics found in human breast milk for the first time,https://www.theguardian.com/environment/2022/oct/07/microplastics-human-breast-milk-first-time,0.95,2454,0,2454
13,worldnews,Hacktivist Group Disrupts Iranian State TV News With Antigovernment Message,https://www.iranintl.com/en/202210085084,0.98,1914,0,1914
14,worldnews,U.S. accuses Russia of exploiting Africa resources to fund Ukraine war.,https://www.reuters.com/world/us-accuses-russia-exploiting-africa-resources-fund-ukraine-war-2022-10-06/,0.95,1610,0,1610
15,worldnews,Belarus: Former DW reporter Andrei Alexandrov has been handed a 14-year prison term. Human rights activists and journalists in Belarus believe this is a clear case of revenge by Alexander Lukashenko's regime,https://www.dw.com/en/belarus-former-dw-reporter-and-media-trainer-behind-bars/a-63366584,0.96,1581,0,1581
16,worldnews,Taiwan: Lawmakers across political party lines yesterday expressed their disagreement with a suggestion by Tesla and SpaceX chief executive officer Elon Musk that Taiwan become a special administrative region of China,https://www.taipeitimes.com/News/front/archives/2022/10/09/2003786700,0.93,1436,0,1436
17,worldnews,"Putin wants new ‘grand bargain’ with the West, says Turkish official",https://news.yahoo.com/putin-wants-grand-bargain-west-160100422.html,0.94,1381,0,1381
18,worldnews,Russian 'Elite' Guard Arresting Military in Moscow: Ukraine Intelligence,https://www.msn.com/en-us/news/world/russian-elite-guard-arresting-military-in-moscow-ukraine-intelligence/ar-AA12KgKO?ocid=msedgdhp&amp;pc=U531&amp;cvid=6dca21d1e90849f493552482a5431dac,0.91,1060,0,1060
19,worldnews,Taiwan parties slam Musk over 'special administrative zone' suggestion,https://focustaiwan.tw/cross-strait/202210080012,0.93,906,0,906
20,worldnews,Haiti asks world for military help to curb chaos,https://us.yahoo.com/news/haiti-asks-world-military-help-040830710.html,0.94,687,0,687
21,worldnews,Liz Truss facing rural rebellion over anti-nature ‘growth’ push,https://www.theguardian.com/environment/2022/oct/08/liz-truss-facing-rural-rebellion-over-anti-nature-growth-push,0.94,585,0,585
22,worldnews,North Korea fires off two more missiles for seventh launch in two weeks | The Japan Times,https://www.japantimes.co.jp/news/2022/10/09/asia-pacific/north-korea-missiles-launch-october-9/,0.94,542,0,542
23,worldnews,Putin allies are pushing for swift retaliation after an explosion on a key Crimean bridge delivered another humiliation for the Russian president,https://www.businessinsider.com/putin-allies-push-for-retaliation-after-crimea-bridge-blast-humiliation-2022-10?international=true&amp;r=US&amp;IR=T,0.95,432,0,432
24,worldnews,"/r/WorldNews Live Thread: Russian Invasion of Ukraine Day 228, Part 1 (Thread #369)",https://www.reddit.com/live/18hnzysb1elcs,0.96,427,0,427
25,worldnews,China lashes out at latest U.S. export controls on chips,https://apnews.com/article/technology-business-china-global-trade-47eed4a9fa1c2f51027ed12cf929ff55,0.92,312,0,312
26,worldnews,US warns India on dealing with Russia: “Pakistan is Plan B”,https://www.gzeromedia.com/us-warns-india-on-dealing-with-russia-pakistan-is-plan-b,0.9,235,0,235
