,subreddit,title,url,upvote_ratio,ups,downs,score
0,worldnews,Ukrainian troops are crippling Russia's supply bridges by slamming drones repeatedly into the asphalt,https://www.businessinsider.com/ukraine-mid-range-drone-crimea-bridge-slam-asphalt-strike-2026-6,0.97,13923,0,13923
1,worldnews,"UAE paid Iran $3B, agreed to release $10B more to halt attacks - Reuters",https://www.iranintl.com/en/202606128540,0.96,12932,0,12932
2,worldnews,Ukraine to ask for $20B to make Russia ‘burn’,https://www.politico.eu/article/exclusive-ukraine-to-ask-for-20-billion-emergency-defense-aid-at-rammstein-to-finish-off-russia/,0.95,10045,0,10045
3,worldnews,Donald Trump claims Iran leaked false information on peace deal terms,https://www.jpost.com/middle-east/iran-news/article-899213,0.94,4503,0,4503
4,worldnews,Russia Confiscates $7.6Bln in Assets in Largest Nationalization Yet,https://www.themoscowtimes.com/2026/06/12/russia-confiscates-76bln-in-assets-in-largest-nationalization-yet-a92991,0.97,4124,0,4124
5,worldnews,"U.S. and Iran have 'final, agreed upon text' of a deal, Pakistan prime minister says",https://www.cnbc.com/2026/06/12/iran-deal-trump-pakistan-sharif.html,0.93,3825,0,3825
6,worldnews,"Putin admits Ukraine attacks hitting Russian economy, society",https://www.aljazeera.com/news/2026/6/12/putin-admits-ukraine-attacks-hitting-russian-economy-society?traffic_source=rss,0.97,3426,0,3426
7,worldnews,"Russia May Launch Oreshnik Missile at Ukraine on Friday, Air Force Warns",https://www.kyivpost.com/post/78044,0.96,3208,0,3208
8,worldnews,"Russian Lawmaker Warns Of ‘Social Explosion’ Amid War Losses, Demands ‘Public Plan’ To End War",https://www.kyivpost.com/post/78051,0.97,2784,0,2784
9,worldnews,EU to ban airlines from charging parents to sit with children,https://www.straitstimes.com/world/europe/eu-to-ban-airlines-from-charging-parents-to-sit-with-children,0.98,2674,0,2674
10,worldnews,"Ukraine hits fuel supplies to Crimea, sparking a fuel crisis on the Russian-held peninsula",https://apnews.com/article/russia-ukraine-crimea-peninsula-fuel-war-a744652874e95ce38ec7ecd8d512e821,0.98,2500,0,2500
11,worldnews,"Russia wrapped a whole building in an anti-drone cage, satellite imagery shows. Ukraine fired on it with cruise missiles.",https://www.businessinsider.com/russia-wrapped-building-anti-drone-cage-ukraine-used-missiles-2026-6,0.98,2204,0,2204
12,worldnews,"Over 225,000 Russian soldiers killed in Ukraine identified by media investigation",https://kyivindependent.com/over-225-000-russian-soldiers-killed-in-ukraine-identified-by-media-investigation/,0.96,1284,0,1284
13,worldnews,UAE denies transferring frozen funds to Iran,https://www.ynetnews.com/article/m3ablq01v,0.95,1131,0,1131
14,worldnews,Ebola Outbreak Spreads to Crowded Displacement Camp,https://www.reuters.com/business/healthcare-pharmaceuticals/ebola-outbreak-spreads-crowded-displacement-camp-congo-2026-06-12/,0.96,1077,0,1077
15,worldnews,Antarctica’s west coast missing an area of sea ice the size of France as temperatures peak 20C above average,https://www.theguardian.com/world/2026/jun/13/antarcticas-west-coast-missing-an-area-of-sea-ice-the-size-of-france-as-temperatures-peak-20c-above-average,0.96,862,0,862
16,worldnews,Jailed South Korea ex-president gets 30 more years for sending drones into North,https://www.bbc.com/news/articles/c17ydny8zyro,0.97,782,0,782
17,worldnews,Four UK pro-Palestinian activists jailed for violent raid on Israeli defense factory,https://www.timesofisrael.com/four-uk-pro-palestinian-activists-jailed-for-violent-raid-on-israeli-defense-factory/,0.83,608,0,608
18,worldnews,"India joins elite club with successful ballistic missile defence, anti-ship missile trials",https://www.hindustantimes.com/india-news/india-joins-elite-club-with-successful-ballistic-missile-defence-anti-ship-missile-trials-101781278990240.html,0.85,549,0,549
19,worldnews,Trump says US military strike killed leader of Tren de Aragua gang with help from Venezuela,https://apnews.com/article/trump-tren-de-aragua-gang-venezuela-344db66dfac87df7ca93d57ea77cd520,0.85,434,0,434
20,worldnews,Putin Admits Russian Troops ‘Can’t Raise Their Heads’ Because of Ukrainian Drones,https://www.kyivpost.com/post/78086,0.96,425,0,425
21,worldnews,Nine Russian LGBTQ groups banned this year for being deemed ‘extremist’,https://www.washingtonblade.com/2026/05/29/nine-russian-lgbtq-groups-deemed-extremist-banned/,0.87,214,0,214
22,worldnews,"/r/WorldNews Live Thread: Russian Invasion of Ukraine Day 1570, Part 1 (Thread #1717)",https://www.reddit.com/live/18hnzysb1elcs,0.95,191,0,191
23,worldnews,/r/WorldNews Discussion Thread: US and Israel launch attack on Iran; Iran retaliates (Thread #19),https://www.reddit.com/r/worldnews/comments/1u39jcq/rworldnews_discussion_thread_us_and_israel_launch/,0.81,102,0,102
24,worldnews,'Iran committing indefinitely to never procure or develop nuclear weapons': Senior US Official,https://www.aninews.in/news/world/us/iran-committing-indefinitely-to-never-procure-or-develop-nuclear-weapons-senior-us-official20260613091607,0.77,74,0,74
