,subreddit,title,url,upvote_ratio,ups,downs,score
0,worldnews,"Ukraine’s defenders defeat 72nd Russian brigade near Bakhmut, liberate territory and capture prisoners",https://www.pravda.com.ua/eng/news/2023/05/10/7401474/,0.93,38776,0,38776
1,worldnews,"Japan is in talks to open a NATO office as Ukraine war makes world less stable, foreign minister says",https://edition.cnn.com/2023/05/10/asia/japan-foreign-minister-hayashi-nato-intl-hnk/index.html,0.94,31526,0,31526
2,worldnews,US approves first transfer of seized Russian funds to Ukraine,https://www.aljazeera.com/news/2023/5/10/us-approves-first-transfer-of-seized-russian-funds-to-ukraine,0.95,24111,0,24111
3,worldnews,Putin announces call up of Russians to military training camps,https://www.pravda.com.ua/eng/news/2023/05/10/7401558/,0.95,20700,0,20700
4,worldnews,Pentagon confirms downing of Russian 'hypersonic' missile by Ukraine,https://www.jpost.com/international/article-742614,0.97,13995,0,13995
5,worldnews,A mysterious object has been found that is 10 million times brighter than the sun. Scientists can't work out why it hasn't exploded,https://www.businessinsider.nl/a-mysterious-object-has-been-found-that-is-10-million-times-brighter-than-the-sun-scientists-cant-work-out-why-it-hasnt-exploded/,0.96,9461,0,9461
6,worldnews,Military object found in Polish forest was Russian missile,https://www.reuters.com/world/europe/military-object-found-polish-forest-was-russian-missile-media-2023-05-10/,0.97,6641,0,6641
7,worldnews,Erdoğan gives public workers 45 percent pay rise in Turkey's tight election race,https://www.politico.eu/article/erdogan-gives-civil-servants-45-percent-pay-rise-in-turkeys-tight-election-race/,0.96,6309,0,6309
8,worldnews,Kremlin calls Polish decision to rename Kaliningrad 'hostile act',https://www.reuters.com/world/europe/kremlin-calls-polish-decision-rename-kaliningrad-hostile-act-2023-05-10/,0.95,5605,0,5605
9,worldnews,Spain plans to ban outdoor work in extreme heat,https://apnews.com/article/spain-ban-on-outdoor-work-extreme-heat-d598486cef63906b73662401db2bdde8,0.98,4387,0,4387
10,worldnews,Poland to use name Krolewiec instead of Kaliningrad,https://www.pap.pl/en/news/news%2C1570624%2Cpoland-use-name-krolewiec-instead-kaliningrad.html,0.96,3488,0,3488
11,worldnews,There is good news about ammunition – Zelenskyy,https://www.yahoo.com/news/good-news-ammunition-zelenskyy-192714005.html,0.94,2627,0,2627
12,worldnews,Ukraine Is Neutralizing Russian Air Defense Systems Ahead Of The Counteroffensive,https://www.forbes.com/sites/vikrammittal/2023/05/10/ukraine-is-neutralizing-russian-air-defense-systems-ahead-of-the-counteroffensive/?sh=5f53b5ab43b2,0.97,2453,0,2453
13,worldnews,"The United States has for the first time transferred millions seized from a Russian oligarch to a fund for rebuilding Ukraine. Some $5.4 million seized from Russian tycoon Konstantin Malofeyev was handed over to the State Department to be used to ""remediate the harms of Russia's unjust war""",https://www.themoscowtimes.com/2023/05/11/us-sets-54mln-seized-from-russian-oligarch-for-ukraine-reconstruction-a81089,0.96,1872,0,1872
14,worldnews,"Activists hurled cake at Volkswagen bosses on Wednesday, as the German carmaker's annual shareholders' meeting was disrupted by protests over human rights and climate change",https://www.france24.com/en/live-news/20230510-protesters-throw-cake-at-volkswagen-shareholders-meeting,0.96,1853,0,1853
15,worldnews,Colombia Chamber of Representatives Passes Marijuana Legalization Bill,https://themarijuanaherald.com/2023/05/colombia-chamber-of-representatives-passes-marijuana-legalization-bill/,0.97,1540,0,1540
16,worldnews,"After 1,000 days in China detention, family renews call for release of Australian TV anchor Cheng Lei",https://edition.cnn.com/2023/05/09/china/cheng-lei-china-australia-1000-days-intl-hnk/index.html,0.95,1491,0,1491
17,worldnews,Kremlin calls Polish decision to rename Kaliningrad 'hostile act',https://www.reuters.com/world/europe/kremlin-calls-polish-decision-rename-kaliningrad-hostile-act-2023-05-10/,0.92,1095,0,1095
18,worldnews,Britain's highest court ruled Wednesday it was too late for people in Nigeria's Niger delta region to lodge pollution claims against energy giant Shell after a huge oil spill more than one decade ago,https://www.rfi.fr/en/business-and-tech/20230510-shell-wins-legal-case-over-nigeria-oil-spill,0.93,1085,0,1085
19,worldnews,Czech president: Ukraine could have our L-159 jets,https://www.reuters.com/world/europe/czech-president-ukraine-could-have-our-l-159-jets-2023-05-10/,0.95,1008,0,1008
20,worldnews,Missiles hitting Ukraine: Navalny’s associates publish investigation on corruption in Russian missile industry,https://www.pravda.com.ua/eng/news/2023/05/10/7401549/,0.96,933,0,933
21,worldnews,Japan's Kishida says Taiwan's security is global issue,https://asia.nikkei.com/Editor-s-Picks/Interview/Japan-s-Kishida-says-Taiwan-s-security-is-global-issue,0.92,458,0,458
22,worldnews,"/r/WorldNews Live Thread: Russian Invasion of Ukraine Day 442, Part 1 (Thread #583)",https://www.reddit.com/live/18hnzysb1elcs,0.97,441,0,441
23,worldnews,A massive protest in Belgrade on Monday expressed anger at the role of reality TV programs in creating a culture of violence seen as a factor in the two mass shootings that plunged Serbia into mourning last week,https://www.france24.com/en/europe/20230510-glorifying-violence-serbian-protesters-blame-mass-shootings-on-shock-reality-tv-shows,0.94,305,0,305
24,worldnews,Türkiye reportedly defers $600M of energy payment to Russia,https://www.dailysabah.com/business/energy/turkiye-reportedly-defers-600m-of-energy-payment-to-russia,0.89,106,0,106
25,worldnews,Taiwan to receive HIMARS one year earlier than expected: Military,https://focustaiwan.tw/politics/202305100015,0.95,78,0,78
