,subreddit,title,url,upvote_ratio,ups,downs,score
0,worldnews,"Russia amplified hurricane disinformation to drive Americans apart, researchers find",https://www.aol.com/russia-amplified-hurricane-disinformation-drive-221838585.html,0.94,12202,0,12202
1,worldnews,Lukashenko says North Korean troops fighting for Putin would be ‘escalation’ of Ukraine war,https://www.politico.eu/article/alexander-lukashenko-north-korean-troops-escalation-ukraine-war-vladimir-putin/,0.97,11967,0,11967
2,worldnews,Modi Says BRICS Must Avoid Being an Anti-West Group as It Grows,https://www.bloomberg.com/news/articles/2024-10-24/modi-says-brics-must-avoid-being-an-anti-west-group-as-it-grows?srnd=homepage-europe,0.93,11653,0,11653
3,worldnews,Hungarian opposition ahead of Orbán's party for first time in 18 years ,https://www.pravda.com.ua/eng/news/2024/10/24/7481180/,0.98,6495,0,6495
4,worldnews,Russia's Su-35 Fighter Is 'Dropping Like Flies' in Ukraine War,https://nationalinterest.org/blog/buzz/russias-su-35-fighter-dropping-flies-ukraine-war-211278,0.9,6403,0,6403
5,worldnews,"North Korean troops fighting Ukraine will be 'fair game,' U.S. warns Putin",https://www.nbcnews.com/news/world/north-korean-troops-russia-ukraine-fair-game-us-putin-rcna176989,0.97,6032,0,6032
6,worldnews,Elon Musk’s Secret Conversations With Vladimir Putin,https://www.rawstory.com/amp/elon-musk-2669477305-2669477305,0.94,5878,0,5878
7,worldnews,"Russian intelligence paid $5,000 to recruit arsonists in Poland","https://www.polskieradio.pl/395/7786/Artykul/3438674,russian-intelligence-paid-5000-to-recruit-arsonists-in-poland",0.97,4012,0,4012
8,worldnews,IDF unveils new evidence of Hamas-Al Jazeera collaboration,https://www.ynetnews.com/article/hksfq6dgjg,0.85,3520,0,3520
9,worldnews,Canada to reduce immigration targets as Trudeau acknowledges his policy failed,https://apnews.com/article/canada-immigration-reduction-trudeau-dabd4a6248929285f90a5e95aeb06763,0.95,3039,0,3039
10,worldnews,Israel says it killed Hamas commander who doubled as U.N. aid worker,https://www.reuters.com/world/middle-east/israel-says-it-killed-hamas-commander-who-doubled-un-aid-worker-2024-10-24/,0.9,3035,0,3035
11,worldnews,Russian spy nabbed in Poland after 10-month manhunt,"https://www.polskieradio.pl/395/7784/Artykul/3438623,russian-spy-nabbed-in-poland-after-10month-manhunt",0.98,2866,0,2866
12,worldnews,"IDF raids Hezbollah Radwan Forces underground bases, discovers massive cache of weapons",https://www.jpost.com/israel-news/article-825939,0.92,2833,0,2833
13,worldnews,"World on track for catastrophic 3 degrees Celsius warming, UN warns",https://www.politico.eu/article/united-nations-emissions-gap-global-warming-data-climate-change-report/,0.92,2609,0,2609
14,worldnews,Russia warns South Korea of 'security consequences' if it joins Ukraine conflict,https://koreajoongangdaily.joins.com/news/2024-10-24/national/diplomacy/Russia-warns-South-Korea-of-security-consequences-if-it-joins-Ukraine-conflict/2162393,0.94,2303,0,2303
15,worldnews,Russian Military Convoy Attacked In Chechnya,https://www.barrons.com/news/russian-military-convoy-attacked-in-chechnya-b8126dee,0.98,1934,0,1934
16,worldnews,IDF says it killed Hamas man who led massacre at Re’im shelter -- an UNRWA worker,https://www.timesofisrael.com/idf-says-it-killed-hamas-man-who-led-massacre-at-reim-shelter-an-unrwa-worker/,0.9,1784,0,1784
17,worldnews,"North Korea sending young conscripts to Ukraine as cannon fodder, says South",https://koreajoongangdaily.joins.com/news/2024-10-24/national/northKorea/North-Korea-sending-young-conscripts-to-Ukraine-as-cannon-fodder-says-South/2162561,0.97,1768,0,1768
18,worldnews,Islamic terrorists massacre 150 in Burkina Faso,https://www.catholicnewsagency.com/news/259953/islamic-terrorists-massacre-150-in-burkina-faso,0.94,1363,0,1363
19,worldnews,North Koreans training in Russia are now in combat zone: Ukraine Defense Intelligence,https://thehill.com/policy/defense/4951989-north-korean-forces-russia-ukraine-combat-zone/,0.97,1315,0,1315
20,worldnews,North Korea has joined Putin’s war effort. A timid West must respond,https://www.smh.com.au/world/europe/north-korea-has-joined-putin-s-war-effort-a-timid-west-must-respond-20241024-p5kl56.html,0.93,719,0,719
21,worldnews,Ukraine reaches record figure in drone production,https://global.espreso.tv/russia-ukraine-war-ukraine-reaches-record-figure-in-drone-production-plans-exceeded,0.96,560,0,560
22,worldnews,"Russia aided Houthis in targeting global shipping, disrupting trade",https://www.jpost.com/middle-east/article-826019,0.98,292,0,292
23,worldnews,/r/WorldNews Live Thread: Israel at War (Thread #73),https://www.reddit.com/live/1bsso361afr0r,0.89,275,0,275
24,worldnews,Iran Prepares for War but Hopes to Avert One as It Braces for Israeli Strikes,https://www.nytimes.com/2024/10/24/world/middleeast/iran-israel-attack-plans.html,0.81,208,0,208
25,worldnews,"Ukraine knows how to strike deep inside Russia, it just needs the money to do so",https://kyivindependent.com/ukraine-says-it-has-recipe-for-long-range-capabilities-only-needs-financial-backing/,0.93,192,0,192
26,worldnews,"/r/WorldNews Live Thread: Russian Invasion of Ukraine Day 974, Part 1 (Thread #1121)",https://www.reddit.com/live/18hnzysb1elcs,0.98,182,0,182
