,subreddit,title,url,upvote_ratio,ups,downs,score
0,worldnews,"Hamas operates all over Germany, investigation finds",https://www.ynetnews.com/article/byhkvvh8p,0.84,10871,0,10871
1,worldnews,Putin threatens Finland with ''problems'',https://www.pravda.com.ua/eng/news/2023/12/17/7433423/,0.93,10230,0,10230
2,worldnews,Ukraine starts mass production of 750 km range “kamikaze” drones,https://euromaidanpress.com/2023/12/17/ukraine-starts-mass-production-of-750-km-range-kamikaze-drones/,0.97,6731,0,6731
3,worldnews,"Ukrainian Forces Reportedly Press Fight Inside Russia, Target Air Base, Battle Near Border Village",https://www.rferl.org/a/ukraine-russia-odesa-drone-strikes-missiles-zelenskiy-aid/32734096.html,0.97,2778,0,2778
4,worldnews,Al-Qaeda releases South African hostage Gerco van Deventer after six years.,https://www.news24.com/news24/southafrica/news/al-qaeda-releases-south-african-hostage-gerco-van-deventer-after-six-years-gift-of-the-givers-20231217,0.97,1948,0,1948
5,worldnews,"‘Stop the fight and start negotiations,’ Israel hostage families say",https://www.arabnews.com/node/2426916/middle-east,0.81,1814,0,1814
6,worldnews,Millions of Chinese Blacklisted for Debt as Loan Defaults Hit Record High,https://www.voanews.com/a/millions-of-chinese-blacklisted-for-debt-as-loan-defaults-hit-record-high/7397512.html,0.96,1598,0,1598
7,worldnews,Argentina's new president to appoint his rabbi as ambassador to Israel,https://www.ynetnews.com/article/rjbymidua,0.92,1365,0,1365
8,worldnews,"Palestinians must find new path from Israeli rule after war, PA official says",https://m.jpost.com/israel-hamas-war/article-778384,0.88,1323,0,1323
9,worldnews,Jewish and Arab volunteers help Arab Israeli farmers suffering from labor shortage amid war in Gaza,https://www.timesofisrael.com/volunteers-help-arab-israeli-farmers-suffering-from-labor-shortage-amid-war-in-gaza/,0.88,1252,0,1252
10,worldnews,"North Korea fires suspected ballistic missile, condemns U.S. for raising tensions",https://www.reuters.com/world/asia-pacific/north-korea-fires-suspected-ballistic-missile-south-korea-japan-say-2023-12-17/,0.93,1147,0,1147
11,worldnews,"Pro-Ukrainian Fighters Infiltrate Belgorod Region, Ukraine's Intel Confirms.",https://www.kyivpost.com/post/25608,0.97,916,0,916
12,worldnews,Austria backs EU Russia sanctions after Ukraine removes Raiffeisen from blacklist,https://www.reuters.com/world/europe/austria-backs-eu-russia-sanctions-after-ukraine-removes-raiffeisen-blacklist-2023-12-16/,0.96,812,0,812
13,worldnews,Israel uncovers 'biggest Hamas tunnel' near Gaza border — Reuters,https://www.reuters.com/world/middle-east/israel-uncovers-biggest-hamas-tunnel-near-gaza-border-2023-12-17/,0.84,635,0,635
14,worldnews,Germany: Far-right AfD wins first city mayoral election,https://www.dw.com/en/germany-far-right-afd-wins-first-city-mayoral-election/a-67750487,0.93,543,0,543
15,worldnews,US to announce expanded protection force for Red Sea shipping,https://www.theguardian.com/world/2023/dec/17/us-to-announce-expanded-protection-force-for-red-sea-shipping,0.95,509,0,509
16,worldnews,Senior PA official: Hamas must 'reconsider all its policies and methods' after war,https://www.timesofisrael.com/senior-pa-official-hamas-must-reconsider-all-its-policies-and-methods-after-war/,0.9,356,0,356
17,worldnews,"North Korea fires another missile into sea in resumption of weapons testing, South Korea says",https://apnews.com/article/north-korea-missile-launch-bc0391e981b2eedce5dc17734e27ee0c?taid=657f891fec2e7f000102b895&amp;utm_campaign=TrueAnthem&amp;utm_medium=AP&amp;utm_source=Twitter,0.95,307,0,307
18,worldnews,Pakistan uses artificial rain to combat smog,https://www.france24.com/en/environment/20231216-pakistan-uses-artificial-rain-to-combat-smog,0.93,271,0,271
19,worldnews,/r/WorldNews Live Thread for 2023 Israel-Hamas Crisis (Thread 44),https://www.reddit.com/live/1bsso361afr0r,0.77,218,0,218
20,worldnews,Ukrainian drone video provides a grim look at casualties as Russian troops advance toward Avdiivka,https://apnews.com/article/russia-ukraine-war-drone-video-avdiivka-902278b0f4cbad2d7dab7f5b79c80da8,0.91,203,0,203
21,worldnews,"/r/WorldNews Live Thread: Russian Invasion of Ukraine Day 663, Part 1 (Thread #809)",https://www.reddit.com/live/18hnzysb1elcs,0.94,198,0,198
22,worldnews,"Israel finds large tunnel adjacent to Gaza border, raising new questions about prewar intelligence",https://apnews.com/article/israel-tunnel-war-gaza-hamas-350dbabc2890ee3c4fc2ec33c2a53f09,0.86,190,0,190
23,worldnews,'I'LL PUT YOU SIX FEET DEEP': Chaos ensues during anti-Zara rally at Eaton Centre,https://torontosun.com/news/local-news/ill-put-you-six-feet-deep-chaos-ensues-during-anti-zara-rally-at-eaton-centre,0.86,167,0,167
24,worldnews,Vladimir Putin is running Russia’s economy dangerously hot,https://www.economist.com/finance-and-economics/2023/12/10/vladimir-putin-is-running-russias-economy-dangerously-hot,0.89,110,0,110
25,worldnews,"Israel finds large tunnel adjacent to Gaza border, raising new questions about prewar intelligence",https://apnews.com/article/israel-tunnel-war-gaza-hamas-350dbabc2890ee3c4fc2ec33c2a53f09?utm_source=copy&amp;utm_medium=share,0.88,106,0,106
26,worldnews,North Korea fires what appears to be long-range ballistic missile | Reuters,https://www.reuters.com/world/asia-pacific/north-korea-fires-ballistic-missile-south-korea-says-2023-12-17/,0.91,100,0,100
