,subreddit,title,url,upvote_ratio,ups,downs,score
0,worldnews,Panic in eastern Ukraine as Trump entertains idea of giving parts of it to Russia,https://www.cnn.com/2025/08/11/europe/eastern-ukraine-trump-russia-ceasefire-intl-latam,0.93,15197,0,15197
1,worldnews,Zelenskyy insists Ukraine will not pull its forces out of Donbas,https://tvpworld.com/88304278/zelenskyy-insists-ukraine-will-not-pull-its-forces-out-of-donbas,0.96,15079,0,15079
2,worldnews,UN will add Hamas to blacklist of groups that commit sexual violence as weapon of war,https://www.ynetnews.com/article/bjvvy6ddeg,0.89,6797,0,6797
3,worldnews,"Russia found 1,000 old tanks in Siberia—they miss when they move, but it’s all that’s left",https://euromaidanpress.com/2025/08/08/russia-t72a-tanks-siberia-ukraine/,0.93,6522,0,6522
4,worldnews,China announces 75.8% tariffs on Canadian canola,https://calgary.citynews.ca/2025/08/12/china-announces-75-8-tariffs-on-canadian-canola/,0.96,5001,0,5001
5,worldnews,Zelenskyy says Putin not preparing to end war as Russian forces make breakthrough,https://abcnews.go.com/International/zelenskyy-putin-preparing-end-war-despite-trump-summit/story?id=124567946,0.98,4403,0,4403
6,worldnews,"China reacts to Trump, Putin meeting without Ukraine, EU",https://www.newsweek.com/china-trump-putin-russia-ukraine-war-2112170?utm_source=reddit&amp;utm_campaign=reddit_influencers,0.95,4341,0,4341
7,worldnews,"Ukraine will not cede land that could be Russian springboard for new war, Zelenskyy says",https://www.theguardian.com/world/2025/aug/12/ukraine-russia-donbas-springboard-for-war-zelenskyy,0.98,3846,0,3846
8,worldnews,"Ukrainian drones strike 'only Russian facility' producing helium for rockets, HUR source claims",https://kyivindependent.com/ukrainian-drones-strike-only-russian-facility-producing-helium-for-rockets-hur-source-claims/,0.98,3577,0,3577
9,worldnews,Iran posts chart of Israeli leaders it plans to kill,https://www.jns.org/iran-posts-chart-of-israeli-leaders-it-plans-to-kill/,0.91,3299,0,3299
10,worldnews,IDF clip shows terror operatives posing as World Central Kitchen staff in central Gaza,https://www.timesofisrael.com/idf-clip-shows-terror-operatives-posing-as-world-central-kitchen-staff-in-central-gaza/,0.73,3269,0,3269
11,worldnews,"Scandal erupts in Hungary over PM Orbán's summer residence and park with zebras ""like Yanukovych had"" – photos",https://www.pravda.com.ua/eng/news/2025/08/12/7525767/,0.97,2885,0,2885
12,worldnews,North Koreans tell BBC they are being sent to work 'like slaves' in Russia,https://bbc.com/news/articles/c2077gwjlvxo,0.97,2793,0,2793
13,worldnews,Canada wildfire season already second worst on record as experts warn of ‘new reality’,https://www.theguardian.com/world/2025/aug/11/canada-wildfire-season,0.96,1613,0,1613
14,worldnews,South Korean court orders arrest of wife of jailed ex-President Yoon Suk Yeol,https://www.yahoo.com/news/articles/south-korean-court-orders-arrest-151230231.html,0.97,1252,0,1252
15,worldnews,"Russia to hold emergency talks with oil firms as fuel prices surge, media reports",https://kyivindependent.com/russia-to-hold-emergency-talks-with-oil-firms-as-fuel-prices-surge/,0.95,946,0,946
16,worldnews,Orban refuses joint EU statement backing Ukraine ahead of Trump-Putin meeting,https://kyivindependent.com/orban-refuses-to-sign-joint-eu-statement-backing-ukraine-ahead-of-trump-putin-summit/,0.96,936,0,936
17,worldnews,Israel is in talks to possibly resettle Palestinians from Gaza in South Sudan,https://apnews.com/article/israel-palestinians-hamas-war-gaza-relocation-south-sudan-15191c194cb6f972bc627a382d830edd,0.82,741,0,741
18,worldnews,NZ Education Minister cuts Māori words from future junior books,https://www.rnz.co.nz/news/national/569782/education-minister-cut-maori-words-from-future-junior-books-documents-reveal,0.89,436,0,436
19,worldnews,Zelenskyy: Ukrainian forces liberate 6 of 18 occupied villages or key locations in Sumy Oblast,https://www.pravda.com.ua/eng/news/2025/08/12/7525888/,0.96,354,0,354
20,worldnews,Azov fighters take up defence line on Pokrovsk front,https://www.pravda.com.ua/eng/news/2025/08/12/7525750/,0.93,320,0,320
21,worldnews,EU to Send €1.6 Billion from Frozen Russian Assets to Ukraine,https://www.kyivpost.com/post/58002,0.97,231,0,231
22,worldnews,"Russia suspected of hacking US federal court filing system, NYT reports",https://kyivindependent.com/russia-suspected-of-hacking-us-federal-court-filing-system-nyt-reports/,0.98,165,0,165
23,worldnews,"OCTA: 'Sharp rise' in Philippines food poverty, jumps to 43%",https://www.gmanetwork.com/news/topstories/nation/955618/octa-research-sharp-rise-ph-food-poverty-jumps-to-43/story/,0.93,139,0,139
24,worldnews,Wildfires rage across southern Europe as temperatures pass 40C,https://www.bbc.com/news/articles/cdd3my4e0pqo,0.94,135,0,135
25,worldnews,"/r/WorldNews Live Thread: Russian Invasion of Ukraine Day 1266, Part 1 (Thread #1413)",https://www.reddit.com/live/18hnzysb1elcs,0.97,120,0,120
