,subreddit,title,url,upvote_ratio,ups,downs,score
0,worldnews,"Alleged Israeli airstrike in Syria destroyed warehouse with over 1,000 Iran-made missiles",https://jpost.com/middle-east/article-715710,0.91,26803,0,26803
1,worldnews,Dmitri Medvedev said that Russia would not stop its military campaign in Ukraine even if Kyiv officially renounced its aspiration to join NATO.,https://www.usnews.com/news/world/articles/2022-08-26/russia-cant-stop-war-even-if-ukraine-drops-nato-hopes-putin-ally,0.95,13518,0,13518
2,worldnews,South Korea risks a major population crash as the country marks its second consecutive year with the world's lowest fertility rate,https://fortune.com/2022/08/24/south-korea-risks-a-major-population-crash-as-the-country-marks-its-second-consecutive-year-with-the-worlds-lowest-fertility-rate/,0.96,8539,0,8539
3,worldnews,"China to Waive Some Africa Loans, Offer $10 Billion in IMF Funds",https://www.bloomberg.com/news/articles/2022-08-23/china-to-waive-some-africa-loans-offer-10-billion-in-imf-funds,0.93,3776,0,3776
4,worldnews,Russian S-300 Missile System Slips Through Bosporus Towards War In Ukraine - Naval News,https://www.navalnews.com/naval-news/2022/08/russian-s-300-missile-system-slips-through-bosporus-towards-war-in-ukraine/,0.96,3746,0,3746
5,worldnews,Poland and South Korea to seal $5.8 billion military deal,https://apnews.com/article/russia-ukraine-poland-mariusz-blaszczak-789acfe0edeed10f19b5248a26119fe3,0.97,1872,0,1872
6,worldnews,Current Siberian heating is unprecedented during the past seven millennia,https://www.nature.com/articles/s41467-022-32629-x,0.96,1595,0,1595
7,worldnews,"Seven countries have withdrawn their recognition of Kosovo's independence, Serbia's president Aleksandar Vucic claimed on Saturday without naming them",https://www.aa.com.tr/en/europe/serbia-says-7-countries-withdrew-recognition-of-kosovo/2670756,0.94,1563,0,1563
8,worldnews,‘Time has run out’: UN fails to reach agreement to protect marine life | This fifth round of discussions was meant to establish a UN Ocean Treaty that would protect biodiversity in international waters,https://www.theguardian.com/world/2022/aug/27/united-nations-ocean-treaty-marine-life,0.96,1253,0,1253
9,worldnews,Germany prepares for possible nationalisation of Gazprom Germania,https://www.reuters.com/business/energy/germany-prepares-possible-nationalisation-gazprom-germania-paper-2022-08-27/?taid=630aa4518903300001b145f8&amp;utm_campaign=trueAnthem:+Trending+Content&amp;utm_medium=trueAnthem&amp;utm_source=twitter,0.97,1080,0,1080
10,worldnews,Climate change is increasing frequency of fish mass die-offs,https://www.sciencedaily.com/releases/2022/08/220826131213.htm,0.94,719,0,719
11,worldnews,"South Korea, Poland sign $5.8 billion tank, howitzer contract",https://www.reuters.com/world/south-korea-poland-sign-58-billion-tank-howitzer-contract-2022-08-27/,0.96,655,0,655
12,worldnews,Ukraine claims 200 elite Russian soldiers killed in base strike in Luhansk,https://www.yahoo.com/news/ukraine-claims-200-elite-russian-133728041.html,0.94,526,0,526
13,worldnews,Two Air France pilots were suspended after coming to blows in the cockpit of an Airbus jetliner during a flight between Geneva and Paris,https://www.bloomberg.com/news/articles/2022-08-27/air-france-pilots-suspended-after-in-flight-cockpit-brawl?cmpid=socialflow-twitter-business&amp;utm_medium=social&amp;utm_source=twitter&amp;utm_campaign=socialflow-organic&amp;utm_content=business,0.95,509,0,509
14,worldnews,Powerful explosions heard near the occupiers’ base in Kherson,https://www.pravda.com.ua/eng/news/2022/08/27/7365061/,0.93,440,0,440
15,worldnews,P.E.I. school teacher stumbles upon fossil that may be 300 million years old,https://www.cbc.ca/news/canada/prince-edward-island/pei-300-million-fossil-found-pei-1.6564455,0.95,375,0,375
16,worldnews,"/r/WorldNews Live Thread: Russian Invasion of Ukraine Day 186, Part 1 (Thread #326)",https://www.reddit.com/live/18hnzysb1elcs,0.95,295,0,295
17,worldnews,"At least 23 people dead, 140 injured in violent clashes between rival militias in Libyan capital of Tripoli",https://edition.cnn.com/2022/08/27/world/violent-clashes-rival-militias-libya/index.html,0.96,267,0,267
18,worldnews,Politicians denounce video of Alberta man verbally harassing Deputy Prime Minister Chrystia Freeland,https://calgary.ctvnews.ca/politicians-denounce-video-of-alberta-man-verbally-harassing-deputy-prime-minister-chrystia-freeland-1.6045106,0.9,264,0,264
19,worldnews,Three off-duty Dutch commandos shot outside hotel in Indianapolis,https://www.bbc.com/news/world-us-canada-62703857,0.94,236,0,236
20,worldnews,"Boris Johnson: Time for West to double support for Ukraine, not go wobbly",https://www.ukrinform.net/rubric-polytics/3559476-johnson-time-for-west-to-double-support-for-ukraine-not-go-wobbly.html,0.9,231,0,231
21,worldnews,Pakistan floods: Tens of thousands flee homes as country's PM warns 'magnitude of calamity' is worse than feared | World News,https://news.sky.com/story/pakistan-floods-tens-of-thousands-flee-homes-as-countrys-pm-warns-magnitude-of-calamity-is-worse-than-feared-12683500,0.95,156,0,156
22,worldnews,Russians torture staff of Zaporizhzhia Nuclear Power Plant before IAEA delegation arrival – Energoatom,https://www.pravda.com.ua/eng/news/2022/08/27/7365006/,0.92,153,0,153
23,worldnews,"Ukraine is preparing measures for the mandatory evacuation of citizens from parts of the Kharkiv, Zaporizhia, and Mykolaiv regions.",https://www.ukrinform.net/rubric-ato/3558873-three-more-ukrainian-regions-to-face-mandatory-civilian-evacuation-vice-pm.html,0.91,145,0,145
24,worldnews,China heatwave: 'Most extreme heat event in world history',https://www.nzherald.co.nz/world/extreme-china-heatwave-could-lead-to-global-chaos-and-food-shortages/D3FVWMBGHJQD355FDM5R43MG4I/,0.92,138,0,138
25,worldnews,Kremlin spreads fake claiming 90% of residents of Donetsk and Luhansk regions want to join Russia,https://www.ukrinform.net/rubric-society/3559437-kremlin-spreads-fake-claiming-90-of-residents-of-donetsk-and-luhansk-regions-want-to-join-russia.html,0.87,128,0,128
26,worldnews,Indian politician boasts about getting Muslims killed – on camera,https://www.aljazeera.com/news/2022/8/24/indian-politician-boasts-about-getting-muslims-killed-on-camera,0.82,69,0,69
