,subreddit,title,url,upvote_ratio,ups,downs,score
0,worldnews,Scientists in disbelief as temperatures soar to 37C in South America in the middle of winter,https://www.abc.net.au/news/2023-08-04/south-america-extreme-heat-mid-winter-climate-change-scientists/102678662,0.92,27728,0,27728
1,worldnews,Lithuania has declared more than a thousand citizens of Russia and Belarus living in the country to be threats to national security and said it is stripping them of their permanent residency permits,https://abcnews.go.com/International/wireStory/lithuania-declares-1000-belarusians-russians-national-security-risks-102012549,0.95,22203,0,22203
2,worldnews,Videos Show Russia Is Lying About Ukraine’s Secret Attack on its Ship,https://www.thedailybeast.com/videos-show-russia-is-lying-about-ukraines-secret-attack-on-its-ship,0.95,13660,0,13660
3,worldnews,Latvia to ask thousands of Russian citizens to leave the country,https://www.lrt.lt/en/news-in-english/19/2050380/latvia-to-ask-thousands-of-russian-citizens-to-leave-the-country,0.97,7569,0,7569
4,worldnews,"Russia's so desperate for soldiers that it's offering a $5,200 sign-on bonus to recruit from neighboring Kazakhstan",https://www.businessinsider.com/russia-army-military-kazakhstan-recruit-soldiers-bonus-manpower-shortage-war-2023-8,0.96,6660,0,6660
5,worldnews,"Russia court sentences Alexey Navalny, jailed opposition leader and Putin critic, to 19 more years in prison",https://www.cbsnews.com/news/alexey-navalny-russia-putin-critic-extremism-verdict-prison-sentence/,0.97,5482,0,5482
6,worldnews,‘We have to fight two enemies’: Ukraine’s female soldiers decry stigma and harassment,https://www.theguardian.com/world/2023/aug/04/fighting-two-enemies-ukraine-female-soldiers-decry-harassment,0.93,5138,0,5138
7,worldnews,Ukraine says Russia planning 'false flag' attack at Belarus refinery,https://www.reuters.com/world/europe/ukraine-says-russia-planning-false-flag-attack-belarus-refinery-2023-08-04/,0.96,4121,0,4121
8,worldnews,China warns Japan not to support NATO expansion,https://www.globalvillagespace.com/china-warns-japan-not-to-support-nato-expansion/,0.94,3183,0,3183
9,worldnews,Sixteen people have now been detained by Warsaw who were allegedly spying for the Kremlin. Poland is also alarmed by the movement of thousands of Russia's Wagner mercenary fighters close to its joint border with Belarus,https://www.dw.com/en/poland-arrests-belarusian-accused-of-spying-for-russia/a-66441989,0.98,2837,0,2837
10,worldnews,Ruble hits lowest value against USD since early in Ukraine war,https://apnews.com/article/russia-ruble-value-declines-2629f2b9c1efce62de2f414f4bb787e5,0.97,2386,0,2386
11,worldnews,Protests held across Europe in solidarity with lesbian mothers in Italy,https://gcn.ie/protests-lesbian-mothers-italy/,0.93,2234,0,2234
12,worldnews,James Webb telescope captures end stages of dying star's life,https://www.bbc.com/news/science-environment-66397231,0.98,1861,0,1861
13,worldnews,Killing of American biologist in Mexico adds to rising violence against scientists there: 3rd fatal incident involving researchers studying the environment in different parts of Mexico in recent years,https://news.mongabay.com/2023/08/killing-of-u-s-biologist-adds-to-rising-violence-against-scientists-in-mexico/,0.97,1462,0,1462
14,worldnews,Russia says JPMorgan stops processing its grain payments,https://www.reuters.com/world/europe/russia-says-jpmorgan-stops-processing-its-grain-payments-2023-08-04/,0.97,1391,0,1391
15,worldnews,New Ukraine stamp shows F-16 jets 'rubbing out' Kremlin,https://www.france24.com/en/live-news/20230804-new-ukraine-stamp-shows-f-16-jets-rubbing-out-kremlin,0.94,659,0,659
16,worldnews,U.S. company Haas appears to still indirectly supply Russian arms industry with technology,https://www.pbs.org/newshour/show/u-s-company-haas-appears-to-still-indirectly-supply-russian-arms-industry-with-technology,0.96,565,0,565
17,worldnews,Lithuania To Close Two Border Crossings With Belarus,https://www.barrons.com/news/lithuania-to-close-two-border-crossings-with-belarus-2dfecd1d,0.97,468,0,468
18,worldnews,"/r/WorldNews Live Thread: Russian Invasion of Ukraine Day 528, Part 1 (Thread #674)",https://www.reddit.com/live/18hnzysb1elcs,0.98,433,0,433
19,worldnews,"New coup plot details fuel fears about Germany’s far right: A former German lawmaker who also served as a judge led members of a far-right terrorist group that was plotting to overthrow the government on a tour of the Reichstag, home of the country’s parliament, according to prosecutors",https://www.nbcnews.com/news/world/reichsburger-coup-plot-afd-germany-far-right-fears-rcna97742,0.94,359,0,359
20,worldnews,"Ukrainian drones hit a key Russian port, damaged naval ship, and targetting Russian Oil",https://www.aljazeera.com/news/2023/8/4/ukraine-drones-hit-russias-key-port-damage-naval-ship-ukrainian-official,0.96,332,0,332
21,worldnews,Ukrainian Armed Forces break through first line of defence and reach intermediate line in some southern areas,https://www.pravda.com.ua/eng/news/2023/08/4/7414271/,0.94,319,0,319
22,worldnews,Russia says tanker hit in Ukrainian attack near Crimea,https://www.bbc.com/news/world-europe-66412842,0.95,285,0,285
23,worldnews,"Coup: Tinubu notifies Nigerian Senate of ECOWAS’ decision to deploy military, enforce no-flight zone, cut off electricity in Niger",https://dailynigerian.com/coup-tinubu-notifies-nigerian/,0.96,215,0,215
24,worldnews,"Lithuania deems 1,164 Belarusian and Russian nationals a threat, revokes residence permits and visas",https://www.lrt.lt/en/news-in-english/19/2050524/lithuania-deems-1-164-belarusian-and-russian-nationals-a-threat-revokes-residence-permits-and-visas,0.94,124,0,124
25,worldnews,NASA restores contact with Voyager 2 spacecraft after mistake led to weeks of silence,https://www.abc.net.au/news/2023-08-05/nasa-restores-contact-with-voyager-2-spacecraft-after-mistake/102693086,0.95,102,0,102
