,subreddit,title,url,upvote_ratio,ups,downs,score
0,worldnews,Norway to supply Ukraine with twice as many F-16 aircraft as officially announced,https://www.pravda.com.ua/eng/news/2025/06/11/7516662/,0.97,19529,0,19529
1,worldnews,Iran says Israel and US will “pay dearly” for attack,https://www.pravda.com.ua/eng/news/2025/06/13/7516912/,0.94,18538,0,18538
2,worldnews,Iran pulls out of nuclear talks with the US,https://thehill.com/policy/international/5348689-iran-nuclear-deal-talks-suspended/,0.97,15017,0,15017
3,worldnews,"Mossad planted kamikaze drone base near Iranian capital, major covert strike reveals",https://www.ynetnews.com/article/rkgersf7xg#google_vignette,0.96,13705,0,13705
4,worldnews,"Iran launches missiles toward Israel, IDF says",https://www.cnbc.com/2025/06/13/trump-urges-iran-to-reach-nuclear-deal-before-there-is-nothing-left-.html,0.94,9616,0,9616
5,worldnews,"Ukraine is paying civilians up to $2,400 a month to shoot down Russian drones with whatever they can find",https://www.businessinsider.com/ukraine-pay-civilians-shoot-down-drones-own-guns-cars-2025-6,0.99,8219,0,8219
6,worldnews,"Swedish pension fund AP7 said on Friday it has blacklisted and sold all its shares in electric vehicle maker Tesla, citing violations of union rights in the United States.",https://www.reuters.com/sustainability/boards-policy-regulation/swedish-pension-fund-ap7-blacklists-tesla-has-sold-entire-stake-2025-06-13/,0.98,5880,0,5880
7,worldnews,"US military intervenes to intercept missiles that Iran fired in retaliation at Israel, official says",https://apnews.com/article/iran-explosions-israel-tehran-00234a06e5128a8aceb406b140297299,0.96,5240,0,5240
8,worldnews,"Iran's Supreme Leader Khamenei is alive, security source tells Reuters",https://www.reuters.com/world/middle-east/irans-supreme-leader-khamenei-is-alive-security-source-tells-reuters-2025-06-13/,0.97,4846,0,4846
9,worldnews,Israel reportedly strikes at Fordow nuclear site after destroying Natanz,https://www.jpost.com/middle-east/iran-news/article-857640,0.97,4459,0,4459
10,worldnews,Latvia Bans Russian and Belarusian Citizens from Working in Critical Infrastructure,https://united24media.com/latest-news/latvia-bans-russian-and-belarusian-citizens-from-working-in-critical-infrastructure-9110,0.98,3444,0,3444
11,worldnews,Macron says Israel has the 'right to defend itself',https://www.lemonde.fr/en/international/article/2025/06/13/macron-says-israel-after-its-strikes-on-iran-has-the-right-to-defend-itself_6742315_4.html,0.83,3406,0,3406
12,worldnews,Trump tells ABC Israel strikes on Iran 'excellent' and warns 'more to come',https://abcnews.go.com/Politics/trump-tells-abc-israel-strikes-iran-excellent-warns/story?id=122807155,0.94,2821,0,2821
13,worldnews,"Iran's above-ground enrichment plant at Natanz destroyed, IAEA chief says",https://www.reuters.com/world/middle-east/irans-above-ground-enrichment-plant-natanz-destroyed-iaea-chief-says-2025-06-13/,0.97,2648,0,2648
14,worldnews,Black Box Of Air India Plane Recovered From The Crash Site In Ahmedabad,https://www.ndtv.com/india-news/black-box-of-air-india-plane-recovered-from-the-crash-site-in-ahmedabad-8659805?pfrom=home-ndtv_topscroll,0.98,2047,0,2047
15,worldnews,Japan warns of collision risks after Chinese fighter jet’s ‘abnormal approaches’,https://www.scmp.com/week-asia/politics/article/3314153/japan-warns-collision-risks-after-chinese-fighter-jets-abnormal-approaches?module=top_story&amp;pgtype=homepage,0.96,1420,0,1420
16,worldnews,"Trump Said US Was Aware of Israel’s Plans to Attack Iran, WSJ Reports",https://www.usnews.com/news/world/articles/2025-06-13/trump-said-us-was-aware-of-israels-plans-to-attack-iran-wsj-reports,0.96,1414,0,1414
17,worldnews,"Iran's Quds Force chief Esmail Qaani killed by Israel, NYT reports",https://www.jpost.com/middle-east/iran-news/article-857636,0.96,1255,0,1255
18,worldnews,2025 Israel - Iran Conflict (Part II),https://www.reddit.com/live/1f6c5t0liqj9c/,0.93,1216,0,1216
19,worldnews,Canada to join major European rearmament deal as early as June 23: sources,https://www.cbc.ca/news/politics/canada-signing-onto-european-rearment-deal-eu-canada-summit-1.7560891,0.98,976,0,976
20,worldnews,Estonia delivers another batch of artillery ammunition to Ukraine,https://www.pravda.com.ua/eng/news/2025/06/13/7517041/,0.97,592,0,592
21,worldnews,"Stocks slump, oil prices surge after Israel attacks Iran",https://www.reuters.com/world/china/global-markets-wrapup-1pix-2025-06-13/,0.94,578,0,578
22,worldnews,Israeli military says it arrested Hamas members in Syria,https://www.reuters.com/world/middle-east/israeli-military-says-it-arrested-hamas-members-syria-2025-06-12/,0.87,548,0,548
23,worldnews,"Vietnam officially joins Brics as ‘partner country’, Brazil announces",https://www.scmp.com/news/china/article/3314414/vietnam-officially-joins-brics-partner-country-brazil-announces,0.94,453,0,453
24,worldnews,US helps Israel shoot down barrage of Iranian missiles,https://apnews.com/article/iran-israel-strikes-us-troops-973bc18970689bac42d82342bd29f601,0.88,435,0,435
25,worldnews,"Ukrainian MiG-29 strikes Russian drone hub, ammo depot in Zaporizhzhia direction, releases video",https://kyivindependent.com/ukrainian-mig-29-strikes-russian-drone-hub-ammo-depot-in-zaporizhzhia-direction/,0.97,282,0,282
26,worldnews,"/r/WorldNews Live Thread: Russian Invasion of Ukraine Day 1206, Part 1 (Thread #1353)",https://www.reddit.com/live/18hnzysb1elcs,0.96,160,0,160
