,subreddit,title,url,upvote_ratio,ups,downs,score
0,worldnews,Russian missile hits civilian vessel under Liberian flag off Odesa coast,https://www.ukrinform.net/rubric-ato/3784439-russian-missile-hits-bulker-under-liberian-flag-off-odesa-coast.html,0.95,11092,0,11092
1,worldnews,Israel says it does not intend to 'reoccupy' Gaza or control it for long time,https://www.reuters.com/world/middle-east/israel-says-it-does-not-intend-reoccupy-gaza-or-control-it-long-time-2023-11-08/,0.89,4342,0,4342
2,worldnews,"Orcas Sink Fourth Boat Off Iberia, Unnerving Sailors",https://www.nytimes.com/2023/11/07/world/africa/orcas-sink-yacht-gibraltar.html?campaign_id=9&amp;emc=edit_nn_20231108&amp;instance_id=107218&amp;nl=the-morning&amp;regi_id=53831380&amp;segment_id=149481&amp;te=1&amp;user_id=fe5d662adf685ae9dedd7464c832fcdf,0.98,4106,0,4106
3,worldnews,"This year 'virtually certain' to be warmest in 125,000 years, EU scientists say",https://www.reuters.com/business/environment/this-year-virtually-certain-be-warmest-125000-years-eu-scientists-say-2023-11-08/,0.93,3892,0,3892
4,worldnews,Hamas leaders say they have no regrets after the October 7 attack and that the goal was to 'overthrow' the status quo,https://www.businessinsider.com/hamas-goal-october-7-attack-israel-gaza-war-2023-11,0.93,3300,0,3300
5,worldnews,Zelenskyy says Ukraine will one day join the European Union,https://www.dw.com/en/zelenskyy-says-ukraine-will-one-day-join-the-european-union/a-67336907,0.94,3195,0,3195
6,worldnews,"US Reaper drone shot down near Yemen by Iranian-backed Houthi militants, defense official says",https://abcnews.go.com/International/us-reaper-drone-shot-yemen-official/story?id=104729976,0.96,3019,0,3019
7,worldnews,"Blinken: Hamas cannot run Gaza, transition needed",https://sg.news.yahoo.com/blinken-hamas-cannot-run-gaza-124645282.html,0.94,2784,0,2784
8,worldnews,Hamas slams UNRWA for ‘colluding’ with Israel in southward movement of Gazans,https://www.timesofisrael.com/liveblog_entry/hamas-slams-unrwa-for-colluding-with-israel-in-southward-movement-of-gazans/,0.9,1975,0,1975
9,worldnews,Uyghur film-maker claims he was tortured by authorities in China,https://www.theguardian.com/global-development/2023/nov/08/uyghur-film-maker-ikram-nurmehmet-claims-he-was-tortured-by-authorities-in-china,0.93,1610,0,1610
10,worldnews,"Transgender people can be baptized Catholic, serve as godparents, Vatican says",https://www.reuters.com/world/transsexuals-can-be-baptized-catholic-serve-godparents-vatican-says-2023-11-08/,0.9,1590,0,1590
11,worldnews,Trudeau says world must 'get back on track' to two-state solution,https://www.thecanadianpressnews.ca/national/trudeau-says-world-must-get-back-on-track-to-two-state-solution/article_d552a932-dde2-523a-9ddb-18f8537694a6.html,0.8,1574,0,1574
12,worldnews,US launches 2nd round of airstrikes on Iran-backed groups it says attacked American troops,https://abcnews.go.com/Politics/us-launches-2nd-round-airstrikes-iran-backed-groups/story?id=104728321,0.97,1557,0,1557
13,worldnews,Kenya announces public holiday for nationwide tree planting in reforestation drive,https://edition.cnn.com/2023/11/08/africa/kenya-public-holiday-tree-planting-intl-scli/index.html,0.98,1076,0,1076
14,worldnews,Journalists with Hamas terrorists: Watchdog questions international media's presence at October 7 massacre scenes,https://www.ynetnews.com/article/byf1woyma#autoplay,0.89,1045,0,1045
15,worldnews,Russia reportedly is using Ukrainian POWs to fight in their homeland on Moscow's side,https://apnews.com/article/russia-ukraine-prisoners-war-pows-65d82938ad0f0d2336192c763619a9fd,0.95,1022,0,1022
16,worldnews,Brazil arrests two with suspected Hezbollah ties plotting attack,https://www.reuters.com/world/americas/brazil-arrests-two-with-suspected-hezbollah-ties-plotting-attack-sources-2023-11-08/,0.96,969,0,969
17,worldnews,/r/WorldNews Live Thread for 2023 Israel-Hamas Crisis (Thread 38),https://www.reddit.com/live/1bsso361afr0r,0.85,595,0,595
18,worldnews,IDF: Troops destroyed 130 Hamas tunnel shafts in Gaza since start of ground op,https://www.timesofisrael.com/idf-troops-destroyed-130-hamas-tunnel-shafts-in-gaza-since-start-of-ground-op/,0.88,532,0,532
19,worldnews,Hezbollah's anti-ship missiles bolster its threat to US navy,https://www.reuters.com/world/middle-east/hezbollahs-anti-ship-missiles-bolster-its-threat-us-navy-2023-11-08/,0.88,497,0,497
20,worldnews,"Himmler ordered mass execution of prisoners in only Nazi camp on British soil, documents reveal",https://www.theguardian.com/world/2023/nov/04/himmler-execution-prisoners-britain-nazi-concentration-camp,0.94,376,0,376
21,worldnews,Belgium wants sanctions against Israel for Gaza bombings - deputy PM,https://www.reuters.com/world/belgium-wants-sanctions-against-israel-gaza-bombings-deputy-pm-2023-11-08/,0.7,330,0,330
22,worldnews,"Hamas operative boasts he ‘can leave with any ambulance,’",https://www.timesofisrael.com/hamas-operative-boasts-he-can-leave-with-any-ambulance-in-call-overheard-by-idf/,0.79,309,0,309
23,worldnews,Pro-Bibi Newspaper Changes Tune and Calls for His Resignation After War Ends,https://www.haaretz.com/israel-news/2023-11-07/ty-article/pro-bibi-newspaper-changes-tune-and-calls-for-his-resignation-after-war-ends/0000018b-a96a-dc41-af9f-eb6a2a5a0000,0.91,267,0,267
24,worldnews,"/r/WorldNews Live Thread: Russian Invasion of Ukraine Day 624, Part 1 (Thread #770)",https://www.reddit.com/live/18hnzysb1elcs,0.97,246,0,246
25,worldnews,Italy to send hospital ship to be stationed off Gaza coast,https://www.timesofisrael.com/liveblog_entry/italy-sending-a-hospital-ship-to-be-stationed-off-gaza-coast/,0.94,214,0,214
26,worldnews,"US Reaper drone shot down near Yemen by Iran-backed Houthi rebels, official says",https://www.cnn.com/2023/11/08/politics/us-drone-shot-down-near-yemen-houthi/index.html,0.92,167,0,167
