,subreddit,title,url,upvote_ratio,ups,downs,score
0,worldnews,Trump administration secretly met with Canadian Alberta separatists,https://unn.ua/en/news/trump-administration-secretly-met-with-alberta-separatists-media-revealed-details,0.96,28038,0,28038
1,worldnews,"Canada Signs Auto Deal With South Korea, Moving Further From the U.S.",https://www.nytimes.com/2026/01/29/world/canada/canada-south-korea-auto-deal-tariffs.html,0.97,21276,0,21276
2,worldnews,New Zealand declines invite to join Board of Peace,https://www.reuters.com/world/asia-pacific/new-zealand-declines-invite-join-board-peace-2026-01-29/,0.97,20527,0,20527
3,worldnews,B.C. premier says Alberta separatists seeking assistance from U.S. is 'treason'  | CBC News,https://www.cbc.ca/news/politics/eby-alberta-separatism-9.7066320,0.97,19698,0,19698
4,worldnews,Removal of flags for fallen Danish soldiers at U.S. Embassy sparks backlash,https://www.washingtonpost.com/world/2026/01/28/us-embassy-danish-flags-afghanistan-war/,0.97,13922,0,13922
5,worldnews,"Estonia warns Russian veterans could flood Europe after Ukraine war, urges EU entry ban",https://kyivindependent.com/estonia-pushes-eu-wide-entry-ban-for-russian-ex-soldiers-who-fought-in-ukraine/,0.98,7936,0,7936
6,worldnews,"Trump threatens Canada with 50% tariff on aircraft sold in US, expanding trade war",https://apnews.com/article/trump-tariffs-canada-aircraft-carney-d8692117bfcf11cf948f834534e7eb88,0.96,5557,0,5557
7,worldnews,"'Respect Canadian sovereignty', Carney tells US officials after they meet Alberta separatists",https://www.bbc.com/news/articles/cr57j780pgmo?xtor=AL-71-%5Bpartner%5D-%5Bbbc.news.twitter%5D-%5Bheadline%5D-%5Bnews%5D-%5Bbizdev%5D-%5Bisapi%5D&amp;at_format=link&amp;at_bbc_team=editorial,0.98,5338,0,5338
8,worldnews,"Kremlin Demands Zelenskyy-Putin Talks Only in Moscow, Rejects Alternative Peace Talk Venues",https://united24media.com/latest-news/kremlin-demands-zelenskyy-putin-talks-only-in-moscow-rejects-alternative-peace-talk-venues-15466,0.95,4054,0,4054
9,worldnews,"The EU is weighing a proposal to bar Russian soldiers who fought in Ukraine from entering the bloc, amid fears that battle‑hardened veterans could pose long‑term security risks to Europe.",https://tvpworld.com/91315432/estonia-pushes-euwide-entry-ban-on-russian-soldiers-who-fought-in-ukraine-,0.98,3622,0,3622
10,worldnews,Russia Forced to Sell Oil to India at $22 a Barrel as Buyers Balk at Sanctions,https://united24media.com/latest-news/russia-forced-to-sell-oil-to-india-at-22-a-barrel-as-buyers-balk-at-sanctions-15454,0.97,3013,0,3013
11,worldnews,Woman faints after being caned 140 times under Indonesian province’s sharia law,https://www.theguardian.com/world/2026/jan/30/indonesia-sharia-law-woman-caned-140-times-faints,0.95,2898,0,2898
12,worldnews,"These Trinidadian fishermen were killed in a U.S. boat strike. Now their families are suing | Chad Joseph, 26, and Rishi Samaroo, 41, were just catching a ride home from working in Venezuela, families say",https://www.cbc.ca/radio/asithappens/us-boat-strikes-lawsuit-9.7065587,0.96,2700,0,2700
13,worldnews,Carney says he expects Trump to ‘respect Canadian sovereignty’ after Alberta separatists meet with US officials,https://edition.cnn.com/2026/01/29/americas/canada-carney-trump-alberta-separatists-latam-intl,0.97,2661,0,2661
14,worldnews,"US Military ""Abducts"" Two People From Scotland - First Minister of Scotland calls for expulsion of US from Prestwick",https://www.pressandjournal.co.uk/fp/politics/6944194/us-oil-tanker-moray-firth-scottish-parliament/,0.85,2619,0,2619
15,worldnews,Trump claims Putin promised to stop bombing Ukraine's cities due to extreme cold,https://www.axios.com/2026/01/29/russia-stop-bombing-kyiv-ukraine-trump-putin,0.93,2198,0,2198
16,worldnews,Greece records second-lowest unemployment rate in 22 years,https://www.ekathimerini.com/economy/1293751/greece-records-second-lowest-unemployment-rate-in-22-years/,0.98,1845,0,1845
17,worldnews,"Trump targets Canadian aircraft in latest tariff threat, says he'll 'decertify' Bombardier jets | CBC News",https://www.cbc.ca/news/politics/trump-tariffs-decertify-canadian-planes-9.7067498,0.94,1457,0,1457
18,worldnews,"EU has blacklisted Russia for risk of money laundering, ""This will slow down and increase the costs of transactions with Russian banks” Kallas says",https://www.reuters.com/business/eu-has-blacklisted-russia-risk-money-laundering-kallas-says-2026-01-29/,0.98,1286,0,1286
19,worldnews,Ai Weiwei says West lacks moral authority to criticise Beijing on rights,https://www.reuters.com/world/china/ai-weiwei-says-west-lacks-moral-authority-criticise-beijing-rights-2026-01-29/,0.86,1269,0,1269
20,worldnews,Trump says he’s decertifying Canada-made aircraft and threatens 50% tariffs,https://www.cnn.com/2026/01/29/business/trump-canada-aircraft-tariff,0.94,1029,0,1029
21,worldnews,US steel production exceeds Japan's for first time in 26 years,https://asia.nikkei.com/business/materials/us-steel-production-exceeds-japan-s-for-first-time-in-26-years,0.89,605,0,605
22,worldnews,"Moscow Airport Sells for Half Off, a Sign of Russia’s Global Isolation",https://www.nytimes.com/2026/01/29/world/europe/moscow-domodedovo-airport-sale.html,0.97,427,0,427
23,worldnews,Rubio Says Venezuela Will Submit Monthly Budget to White House,https://www.nytimes.com/2026/01/28/us/politics/rubio-hearing-venezuela.html,0.9,327,0,327
24,worldnews,"/r/WorldNews Live Thread: Russian Invasion of Ukraine Day 1436, Part 1 (Thread #1583)",https://www.reddit.com/live/18hnzysb1elcs,0.97,93,0,93
