,subreddit,title,url,upvote_ratio,ups,downs,score
0,worldnews,"Russia must pay at least 500 billion euros in compensation to Ukraine, Germany's Merz says",https://kyivindependent.com/russia-must-pay-ukraine-500-billion-euros-in-damages-germanys-merz-says-06-2025/,0.95,23654,0,23654
1,worldnews,Trump says he struck deal to send US weapons to Ukraine through NATO,https://www.cnn.com/2025/07/10/politics/us-weapons-ukraine-nato-deal-trump,0.94,15980,0,15980
2,worldnews,"President Volodymyr Zelenskyy ""We have received political signals at the highest level – good signals – including from the United States, from our European friends. According to all reports, aid shipments have been restored.""",https://kyivindependent.com/aid-shipments-have-been-restored-zelensky-says-amid-halt-of-us-weapons-deliveries/,0.97,10492,0,10492
3,worldnews,Ukraine Spy Chief Says 40% of Russian Ammunition Is North Korean,https://www.bloomberg.com/news/articles/2025-07-11/ukraine-spy-chief-says-40-of-russian-ammunition-is-north-korean,0.98,9656,0,9656
4,worldnews,"Trump Plans ‘Major’ Russia Statement Monday, Criticizes Putin",https://www.bloomberg.com/news/articles/2025-07-11/trump-plans-major-russia-statement-monday-criticizes-putin?embedded-checkout=true,0.94,6549,0,6549
5,worldnews,US aware of reported death of American after beating by Israeli settlers,https://www.reuters.com/world/middle-east/us-aware-reported-death-american-after-beating-by-israeli-settlers-2025-07-12/,0.94,5364,0,5364
6,worldnews,"Ukraine to receive US Patriot air defence systems, says Trump",https://bbc.com/news/articles/crl04200dp4o,0.98,4145,0,4145
7,worldnews,Elite Russian Marine Unit Commander Reportedly Killed in Ukrainian Missile Strike,https://www.themoscowtimes.com/2025/07/11/elite-russian-marine-unit-commander-reportedly-killed-in-ukrainian-missile-strike-a89781,0.98,4079,0,4079
8,worldnews,EU transfers $1.2 billion to Ukraine using profits from frozen Russian assets,https://kyivindependent.com/eu-transfers-1-2-billion-to-ukraine-using-profits-from-frozen-russian-assets-06-2025/,0.99,3712,0,3712
9,worldnews,"Engine fuel supply was cut just before Air India jet crash, preliminary report says",https://www.cnn.com/2025/07/11/india/air-india-crash-report-intl-latam,0.97,3406,0,3406
10,worldnews,France launches criminal investigation into Musk’s X over algorithm manipulation,https://www.politico.eu/article/france-opens-criminal-probe-into-x-for-algorithm-manipulation/,0.98,3224,0,3224
11,worldnews,"Engine fuel switches cut off before Air India crash that killed 260, preliminary report finds | Air India Ahmedabad plane crash",https://www.theguardian.com/world/2025/jul/11/engine-fuel-switches-cut-off-before-air-india-crash-that-killed-260-report-finds,0.97,2100,0,2100
12,worldnews,"Drone attack on Russia: explosions heard in Tula and near Moscow, home to drone factory – videos",https://www.pravda.com.ua/eng/news/2025/07/11/7521224/,0.98,1825,0,1825
13,worldnews,Ukraine suffers most civilian casualties in 3 years as Russia ramps up aerial attacks,https://www.nbcnews.com/world/russia/ukraine-suffers-civilian-casualties-3-years-russia-ramps-aerial-attack-rcna218088,0.97,1687,0,1687
14,worldnews,"Ukrainian MiG-29 Strikes Russian Military Crossing in Zaporizhzhia With JDAM-ER Bombs, Video",https://united24media.com/latest-news/ukrainian-mig-29-strikes-russian-military-crossing-in-zaporizhzhia-with-jdam-er-bombs-video-9825,0.98,1442,0,1442
15,worldnews,Canada aims for new U.S. trade deal by Aug. 1 as Trump threatens 35% tariffs: Carney,https://www.ctvnews.ca/politics/article/canada-aims-for-new-us-trade-deal-by-aug-1-as-trump-threatens-35-tariffs-carney/,0.94,1145,0,1145
16,worldnews,"NATO needs more long-range missiles to deter Russia, US general says",https://www.reuters.com/business/aerospace-defense/nato-needs-more-long-range-missiles-deter-russia-us-general-says-2025-07-11/,0.97,807,0,807
17,worldnews,"Russia Sees France as Its Main Enemy in Europe, French General Says",https://www.nytimes.com/2025/07/11/europe-france-general-russia-enemy.html,0.93,667,0,667
18,worldnews,At least 23 dead after airstrike on Buddhist monastery in Myanmar,https://www.pbs.org/newshour/world/at-least-23-dead-after-airstrike-on-buddhist-monastery-in-myanmar,0.97,556,0,556
19,worldnews,"Russian attack on Kharkiv damages maternity hospital, sending patients fleeing",https://www.reuters.com/world/europe/russian-attack-kharkiv-damages-maternity-hospital-sending-patients-fleeing-2025-07-11/,0.95,476,0,476
20,worldnews,"Ukraine and EU launch €100 million military innovation partnership, officials in Rome say",https://www.euronews.com/my-europe/2025/07/11/ukraine-and-eu-launch-100-million-military-innovation-partnership-officials-in-rome-say,0.96,228,0,228
21,worldnews,Vaccine roll outs cut deaths and infections by 60% says study,https://www.bbc.com/news/articles/ce9x4yd27mro,0.95,180,0,180
22,worldnews,"France is Russia's 'main enemy' in Europe, French army head says",https://www.france24.com/en/europe/20250711-france-is-russia-s-main-enemy-in-europe-says-head-of-french-army,0.89,148,0,148
23,worldnews,Ukrainians live through record strikes as Russia ramps up new drone tactics,https://www.abc.net.au/news/2025-07-12/russia-record-drone-missile-strikes-ukraine-war-tactics-/105520412,0.94,147,0,147
24,worldnews,"/r/WorldNews Live Thread: Russian Invasion of Ukraine Day 1234, Part 1 (Thread #1381)",https://www.reddit.com/live/18hnzysb1elcs,0.96,136,0,136
25,worldnews,"G7, Israel envoys personally invited to attend Nagasaki bomb ceremony",https://english.kyodonews.net/articles/-/57147,0.82,105,0,105
