,subreddit,title,url,upvote_ratio,ups,downs,score
0,worldnews,Trump threatens to cut off aid to Ukraine 'prior to taking the White House as president-elect',https://kyivindependent.com/trump-threatens-to-cut-off-aid-to-ukraine-prior-to-taking-white-house-as-president-elect/,0.9,20871,0,20871
1,worldnews,Flesh-Eating Bacteria That Can Kill in Two Days Spreads in Japan,https://www.bloomberg.com/news/articles/2024-06-15/flesh-eating-bacteria-that-can-kill-in-two-days-spreads-in-japan,0.93,18823,0,18823
2,worldnews,NATO approves plan to expand support for Ukraine after lifting Orbán’s veto – media,https://www.pravda.com.ua/eng/news/2024/06/13/7460627/,0.97,6278,0,6278
3,worldnews,Trudeau says Russia needs to be accountable for ‘genocide’ of taking Ukrainian kids,https://www.theglobeandmail.com/canada/article-trudeau-says-russia-needs-to-be-accountable-for-genocide-of-taking/,0.95,5371,0,5371
4,worldnews,US and South Korea sound warning amid reports Putin is headed to North Korea,https://www.theguardian.com/world/article/2024/jun/14/vladimir-putin-north-korea-visit-us-south-korea-ukraine-war-weapons,0.97,4958,0,4958
5,worldnews,"Israel will not commit to end war before release of hostages, official says",https://www.ynetnews.com/article/bku5kdhsa,0.92,4362,0,4362
6,worldnews,"‘Without nuclear, it will be almost impossible to decarbonize by 2050’, UN atomic energy chief",https://news.un.org/en/interview/2024/06/1151006,0.95,4258,0,4258
7,worldnews,Azov says it has driven Russian forces out of some positions in Serebryansky forest,https://euromaidanpress.com/2024/06/15/azov-says-it-has-driven-russian-forces-out-of-some-positions-in-serebryansky-forest/,0.96,3887,0,3887
8,worldnews,Jens Stoltenberg: Nato in talks to put nuclear weapons on standby,https://www.telegraph.co.uk/world-news/2024/06/16/nato-jens-stoltenberg-nuclear-weapons-deployt-russia-china/,0.96,3321,0,3321
9,worldnews,Peace talks tomorrow if Russia leaves Ukraine - Zelensky,https://www.bbc.com/news/articles/cxrr1kyp04eo,0.96,2197,0,2197
10,worldnews,Chinese journalist who promoted #MeToo movement sentenced to 5 years in prison,https://www.asahi.com/ajw/articles/15307015,0.95,1855,0,1855
11,worldnews,80 countries at Swiss conference agree Ukraine's territorial integrity must be basis of any peace,https://apnews.com/article/ukraine-russia-switzerland-war-conference-burgenstock-568cafee5fbe9c3b19b79b041583a5d6,0.97,1558,0,1558
12,worldnews,Trudeau says Russia needs to be accountable for 'genocide' of taking Ukrainian kids,https://vancouver.citynews.ca/2024/06/16/trudeau-to-hold-news-conference-this-morning-at-ukraine-peace-summit-in-switzerland/,0.94,1489,0,1489
13,worldnews,U.S. Navy rescues crew of Greek ship attacked by Houthis in Red Sea - I24NEWS,https://www.i24news.tv/en/news/middle-east/artc-u-s-navy-rescues-crew-of-greek-ship-attacked-by-houthis-in-red-sea,0.97,1336,0,1336
14,worldnews,Russia’s BRICS partners refuse to sign Ukraine peace summit declaration,https://novayagazeta.eu/articles/2024/06/16/russias-brics-partners-refuse-to-sign-ukraine-peace-summit-declaration-en-news,0.94,1275,0,1275
15,worldnews,LGBT soldiers in Ukraine hope service is changing attitudes as they rally for rights,https://abcnews.go.com/International/wireStory/lgbt-soldiers-ukraine-hope-service-changing-attitudes-rally-111162893,0.85,998,0,998
16,worldnews,New poll reveals inconvenient truth: Palestinians like and support Hamas,https://www.jpost.com/israel-hamas-war/article-806498,0.83,895,0,895
17,worldnews,‘We Need to Unite’: Protests Against the Far Right Are Held Across France,https://www.nytimes.com/2024/06/15/world/europe/france-protests-far-right.html?campaign_id=9&amp;emc=edit_nn_20240616&amp;instance_id=126373&amp;nl=the-morning&amp;regi_id=53831380&amp;segment_id=169712&amp;te=1&amp;user_id=fe5d662adf685ae9dedd7464c832fcdf,0.89,796,0,796
18,worldnews,Rishi Sunak Says He Is The 'Original Brexiteer' And Strikes Back At Nigel Farage Criticism,https://www.huffingtonpost.co.uk/entry/rishi-sunak-claims-to-be-original-brexiteer_uk_666efb6ee4b08b681d812e88,0.89,467,0,467
19,worldnews,Hagari addresses Israel: 'Hezbollah bringing us to brink of escalation',https://jpost.com/breaking-news/article-806511,0.87,401,0,401
20,worldnews,Iran Among Top Hackers in 300 Million Daily Cyberattacks on Microsoft Users,https://www.iranintl.com/en/202406143360,0.96,356,0,356
21,worldnews,"Narendra Modi's Indian government and its allies accused of spying, silencing Sikh critics and pushing its far-right ideology in Australia",https://www.abc.net.au/news/2024-06-17/modis-indian-government-accused-of-spying-silencing-critics/103974414,0.86,320,0,320
22,worldnews,"/r/WorldNews Live Thread: Russian Invasion of Ukraine Day 845, Part 1 (Thread #991)",https://www.reddit.com/live/18hnzysb1elcs,0.96,244,0,244
23,worldnews,Fire used as 'weapon of war' in Sudan as entire towns and villages burned to the ground,https://www.nbcnews.com/news/world/sudan-war-leaves-towns-villages-burned-down-rcna156920,0.93,145,0,145
24,worldnews,/r/WorldNews Live Thread for Israel-Hamas War (Thread #54),https://www.reddit.com/live/1bsso361afr0r,0.74,116,0,116
25,worldnews,'Main damage is to our image:' Israeli defense industry reels from French expo ban,https://www.ynetnews.com/article/r1w4i2nrc,0.82,112,0,112
26,worldnews,"Greek coastguard threw migrants overboard to their deaths, witnesses say",https://www.bbc.com/news/articles/c0vv717yvpeo,0.76,91,0,91
