,subreddit,title,url,upvote_ratio,ups,downs,score
0,worldnews,"Russia is providing Iran intelligence to target U.S. forces, officials say",https://www.washingtonpost.com/national-security/2026/03/06/russia-iran-intelligence-us-targets/,0.93,50838,0,50838
1,worldnews,"More Patriot missiles used in Middle East in 3 days than in Ukraine since 2022, Zelensky says",https://kyivindependent.com/over-800-patriot-missiles-used-in-middle-east-in-3-days-more-than-ukraine-since-2022-zelensky-says/,0.97,19390,0,19390
2,worldnews,Trump says there will be no deal with Iran except 'unconditional surrender',https://www.reuters.com/world/us/trump-says-there-will-be-no-deal-with-iran-except-unconditional-surrender-2026-03-06/,0.95,9858,0,9858
3,worldnews,Hungary confirms it is holding seven Ukrainian bank workers and $80m,https://www.bbc.com/news/articles/cd03rj7n0nro,0.97,9023,0,9023
4,worldnews,Iran's Guards challenges Trump to have US Navy escort oil tankers in Strait of Hormuz,https://www.reuters.com/world/middle-east/irans-guards-challenges-trump-have-us-navy-escort-oil-tankers-strait-hormuz-2026-03-06/,0.96,8709,0,8709
5,worldnews,Trump hints U.S. will turn to Cuba after Iran: ‘Just a question of time’,https://www.cnbc.com/2026/03/05/trump-cuba-iran-regime-change.html,0.96,6812,0,6812
6,worldnews,"India allows Iranian warship to dock at Kochi, crew housed at naval facilities",https://www.hindustantimes.com/india-news/india-allows-iranian-warship-to-dock-at-kochi-crew-housed-at-naval-facilities-101772816133475.html,0.97,5409,0,5409
7,worldnews,Ukraine Urges Citizens to Avoid Travel to Hungary After Abduction of Seven Ukrainians and Fund Seizure,https://united24media.com/latest-news/ukraine-urges-citizens-to-avoid-travel-to-hungary-after-abduction-of-seven-ukrainians-and-fund-seizure-16566,0.98,5174,0,5174
8,worldnews,"America Will Need 'Boots on Ground' in Iran for Trump to Pick Next Leader, Says UK",https://www.standard.co.uk/news/politics/us-deploy-troops-iran-donald-trump-choose-new-supreme-leader-b1273737.html,0.95,5128,0,5128
9,worldnews,Trump tells CNN he’s not worried whether Iran becomes a democratic state,https://edition.cnn.com/2026/03/06/politics/trump-interview-iran-cuba-dana-bash,0.96,4869,0,4869
10,worldnews,Indonesia suspends participation in Board of Peace following attack on Iran,https://www.middleeastmonitor.com/20260306-indonesia-suspends-participation-in-board-of-peace-following-attack-on-iran/,0.97,4334,0,4334
11,worldnews,US approves emergency arms sale to Israel worth about $150 million,https://www.ynetnews.com/article/1km45pccq,0.93,4096,0,4096
12,worldnews,Mexico Introduces Legislation to Federally Ban Octopus Farming,https://perishablenews.com/seafood/mexico-introduces-legislation-to-federally-ban-octopus-farming/,0.98,3461,0,3461
13,worldnews,Azerbaijan thwarts Iranian terror plot in Baku,https://news.az/news/azerbaijan-exposes-irans-terror-plans-in-baku,0.92,2350,0,2350
14,worldnews,"Russia has provided Iran with information that can help Tehran strike US military, AP sources say",https://apnews.com/article/trump-iran-russia-intelligence-35afae34198408d670941f971d383378,0.97,2239,0,2239
15,worldnews,"Russia Massing Troops on NATO Borders for Potential Conflict Within Six Years, Lithuania Warns",https://united24media.com/latest-news/russia-massing-troops-on-nato-borders-for-potential-conflict-within-six-years-lithuania-warns-16590,0.94,1392,0,1392
16,worldnews,Trump admin announces $20 billion reinsurance program for oil tankers during Iran war,https://www.cnbc.com/2026/03/06/trump-reinsurance-oil-iran-war.html,0.94,1219,0,1219
17,worldnews,"Before it was sunk by US, Iranian ship IRIS Dena was offered shelter by India",https://indianexpress.com/article/india/before-it-was-sunk-by-us-iranian-ship-was-offered-shelter-by-india-10568915/lite/,0.92,1049,0,1049
18,worldnews,Carney says Andrew Mountbatten-Windsor should be removed from line of succession,https://www.cbc.ca/news/politics/carney-mountbatten-windsor-9.7118464,0.96,1014,0,1014
19,worldnews,"US could lift sanctions on more Russian oil, says Bessent",https://www.reuters.com/business/energy/us-could-lift-sanctions-more-russian-oil-says-bessent-2026-03-06/,0.91,734,0,734
20,worldnews,Ukraine's General Staff confirms damage to two Russian frigates in Novorossiysk,https://www.pravda.com.ua/eng/news/2026/03/06/8024279/,0.96,722,0,722
21,worldnews,Iran security forces issue shoot-to-kill orders amid growing unrest,https://www.euronews.com/2026/03/06/iran-security-forces-issue-shoot-to-kill-orders-escalating-crackdown-amid-growing-unrest,0.92,446,0,446
22,worldnews,"Iran's UN envoy says 1,332 Iranian civilians killed in war",https://www.reuters.com/world/middle-east/irans-un-envoy-says-1332-iranian-civilians-killed-war-2026-03-06/,0.79,258,0,258
23,worldnews,/r/WorldNews Discussion Thread: US and Israel launch attack on Iran; Iran retaliates (Thread #6),https://www.reddit.com/r/worldnews/comments/1rmf1ro/rworldnews_discussion_thread_us_and_israel_launch/,0.9,168,0,168
24,worldnews,"/r/WorldNews Live Thread: Russian Invasion of Ukraine Day 1472, Part 1 (Thread #1619)",https://www.reddit.com/r/worldnews/comments/1rmztc2/rworldnews_live_thread_russian_invasion_of/,0.96,95,0,95
