,subreddit,title,url,upvote_ratio,ups,downs,score
0,worldnews,Greenland Leader Tells People to Prepare for Possible Invasion,https://www.bloomberg.com/news/articles/2026-01-20/greenland-leader-tells-people-to-prepare-for-possible-invasion,0.95,43846,0,43846
1,worldnews,"Macron on Trump leaking their private messages: ""I stand by my words""",https://www.pravda.com.ua/eng/news/2026/01/20/8017098/,0.97,32196,0,32196
2,worldnews,"'The old order is not coming back,' Canadian PM Carney says in provocative speech at Davos",https://www.cbc.ca/news/politics/carney-davos-speech-9.7052725,0.96,31588,0,31588
3,worldnews,NATO curbs intelligence sharing with US over Greenland dispute,https://newsukraine.rbc.ua/news/nato-curbs-intelligence-sharing-with-us-over-1768903485.html,0.98,25457,0,25457
4,worldnews,"Danish pension fund to sell $100 million in Treasuries, citing 'poor' U.S. government finances",https://www.cnbc.com/2026/01/20/akademikerpension-us-treasury-greenland-trump.html,0.97,24443,0,24443
5,worldnews,EU chief warns there's no going back after Trump's Greenland threats,https://www.axios.com/2026/01/20/trump-greenland-davos-von-der-leyen,0.98,12209,0,12209
6,worldnews,Canada is positioning itself on Greenland knowing it could be next,https://edition.cnn.com/2026/01/20/americas/canada-greenland-trump-analysis-latam-intl,0.96,8684,0,8684
7,worldnews,"Canada’s Military Has Modeled Hypothetical US Invasion, Reports Say",https://www.bloomberg.com/news/articles/2026-01-20/canada-s-military-has-modeled-hypothetical-us-invasion-reports-say,0.96,8140,0,8140
8,worldnews,Sweden deploys Gripen to Iceland for NATO air policing,https://www.aerotime.aero/articles/sweden-gripen-nato-iceland-air-policing?utm_source=facebook&amp;utm_medium=social&amp;utm_campaign=organic,0.98,6103,0,6103
9,worldnews,"US talk on Greenland 'incomprehensible' and 'hostile', Belgian FM says",https://www.euronews.com/my-europe/2026/01/20/us-attitude-on-greenland-incomprehensible-and-unnecessarily-hostile-belgian-fm-tells-euron,0.98,5133,0,5133
10,worldnews,Trump on Greenland: we'll work out something to make US and NATO 'very happy',https://www.reuters.com/world/trump-greenland-well-work-out-something-make-us-nato-very-happy-2026-01-20/,0.94,4891,0,4891
11,worldnews,Europe to suspend approval of US tariffs deal,https://www.bbc.com/news/articles/c4gwp2me3gzo,0.98,4433,0,4433
12,worldnews,"Norway won't take part in Trump's ""Board of Peace"", deputy foreign minister tells Aftenposten",https://www.reuters.com/world/europe/norway-wont-take-part-trumps-board-peace-deputy-foreign-minister-tells-2026-01-20/,0.99,3704,0,3704
13,worldnews,Trump says Iran would be wiped off Earth if something happens to him,https://thehill.com/homenews/administration/5697870-trump-iran-assassination-threats/,0.94,3533,0,3533
14,worldnews,European leaders have vowed to hit back at the US if Donald Trump goes ahead with his threat to impose a 10% tariff to force the sale of Greenland. Denmark's prime minister said sovereignty was not up for grabs.,https://www.euronews.com/my-europe/2026/01/20/trump-doubles-down-on-greenland-annexation-as-europe-struggles-to-coordinate-a-response,0.98,3104,0,3104
15,worldnews,Pentagon moves to cut U.S. participation in some NATO advisory groups,https://www.washingtonpost.com/national-security/2026/01/20/trump-nato-advisory-groups/,0.96,2404,0,2404
16,worldnews,"Treasuries, Stocks Sell Off as Greenland and Japan Shatter Calm",https://www.bloomberg.com/news/articles/2026-01-20/wall-street-s-calm-shattered-by-greenland-and-japan-shocks?srnd=homepage-americas,0.97,2086,0,2086
17,worldnews,"Trump doubles down on Greenland threats, saying there is 'no going back'",https://www.bbc.com/news/articles/cvgr19m642zo,0.96,1969,0,1969
18,worldnews,President Trump told to 'f--- off' by Danish lawmaker; over Greenland,https://www.foxnews.com/world/trump-told-f-k-off-danish-lawmaker-european-parliament-greenland-debate,0.94,1779,0,1779
19,worldnews,"Wall Street posts biggest daily drop in three months, Trump Greenland tariff threat triggers wide selloff",https://www.reuters.com/business/sp-nasdaq-futures-slide-one-month-lows-greenland-concerns-2026-01-20/,0.98,1288,0,1288
20,worldnews,"Trump shares altered map of U.S. flag covering Canada, Greenland and Venezuela",https://www.ctvnews.ca/canada/article/trump-shares-altered-map-of-us-flag-covering-canada-greenland-and-venezuela/,0.92,1175,0,1175
21,worldnews,Europe to suspend approval of US trade deal as markets fall,https://www.bbc.com/news/articles/c4gwp2me3gzo?at_medium=RSS&amp;at_campaign=rss,0.98,826,0,826
22,worldnews,"Greenland should be prepared for 'everything,' prime minister says, not ruling out U.S. military action",https://www.cnbc.com/2026/01/21/greenland-us-trump-military-takeover-nato.html,0.97,690,0,690
23,worldnews,"'President Trump is trying to replace the UN', says Belgian FM",https://www.euronews.com/my-europe/2026/01/20/president-trump-is-trying-to-replace-the-un-says-belgian-fm,0.97,557,0,557
24,worldnews,"/r/WorldNews Live Thread: Russian Invasion of Ukraine Day 1427, Part 1 (Thread #1574)",https://www.reddit.com/live/18hnzysb1elcs,0.94,94,0,94
