,subreddit,title,url,upvote_ratio,ups,downs,score
0,worldnews,UK Government considers removing Andrew from royal line of succession,https://www.bbc.co.uk/news/articles/c1kgv837wvdo,0.97,15840,0,15840
1,worldnews,Zelensky says Ukraine Has Liberated 300 Square Kilometers in Southern Counteroffensive,https://www.kyivpost.com/post/70472,0.98,4766,0,4766
2,worldnews,"Israeli settlers kill 19-year-old Palestinian American, officials and witnesses say",https://apnews.com/article/israel-west-bank-gaza-war-palestinians-ec2736c95acf273a9fb1f2d541f46bb5,0.83,4058,0,4058
3,worldnews,"Poland pulls out of treaty banning antipersonnel mines, says it will use them to defend against Russia",https://www.nbcnews.com/world/europe/poland-treaty-antipersonnel-mines-russia-ottawa-convention-ukraine-war-rcna259868,0.98,3421,0,3421
4,worldnews,Pentagon aggressively lobbies EU against Buy European weapons push,https://www.politico.eu/article/washington-lobbies-eu-against-buy-european-push-for-weapons-donald-trump/,0.96,2898,0,2898
5,worldnews,UK Posts Biggest Ever Budget Surplus as Tax Revenue Surges,https://www.bloomberg.com/news/articles/2026-02-20/uk-posts-biggest-ever-budget-surplus-as-tax-revenue-surges,0.95,1778,0,1778
6,worldnews,'Happy liberation day': British Columbia Premier David Eby reacts to U.S. ruling against Trump's tariffs,https://www.cbc.ca/news/canada/british-columbia/bc-premier-eby-trump-tariff-ruling-9.7099563,0.96,1620,0,1620
7,worldnews,Hungary blocks €90bn loan for Ukraine – FTA,https://www.pravda.com.ua/eng/news/2026/02/20/8021993/,0.94,1272,0,1272
8,worldnews,"Drone hits Russian ballistic missile factory over 1,300 km from Ukraine's border, officials, media report",https://kyivindependent.com/drone-strikes-russian-ballistic-missile-factory-over-1-300-km-from-ukraines-border/,0.98,1265,0,1265
9,worldnews,North Aral Sea regains a third of its water thanks to restoration efforts spearheaded by Kazakhstan,https://www.euronews.com/green/2026/02/19/north-aral-sea-regains-a-third-of-its-water-thanks-to-restoration-efforts-spearheaded-by-k,0.98,1233,0,1233
10,worldnews,Russia Arrests Head of Demographic Institute as Fertility Rate Plunges to Record Low,https://united24media.com/latest-news/russia-arrests-head-of-demographic-institute-as-fertility-rate-plunges-to-record-low-16121,0.96,984,0,984
11,worldnews,"Ukraine liberates 300 square kilometers in southern counteroffensive, Zelensky tells AFP",https://kyivindependent.com/ukraine-liberates-300-square-kilometers-in-southern-counteroffensive-zelensky-tells-afp/,0.97,914,0,914
12,worldnews,Ukrainian officials reject latest Donbas proposal from US,https://kyivindependent.com/joint-rule-with-russia-in-donbas/,0.97,881,0,881
13,worldnews,NASA targets March 6 date to send humans back around the Moon,https://www.bbc.com/news/articles/c86y1g6wde3o,0.94,757,0,757
14,worldnews,"Brazil's Lula says Maduro should be tried in Venezuela, not abroad",https://www.reuters.com/business/media-telecom/brazils-lula-says-maduro-should-be-tried-venezuela-not-abroad-2026-02-20/,0.91,591,0,591
15,worldnews,US ambassador Huckabee says Israel has 'biblical Right' to land from Euphrates to Nile,https://www.thenationalnews.com/news/us/2026/02/20/mike-huckabee-tucker-carlson-israel/,0.79,521,0,521
16,worldnews,PayPal Data Breach Exposes SSNs and Business PII of Customers for Over Six Months,https://cybersecuritynews.com/paypal-data-breach-expose-customer-data/,0.96,431,0,431
17,worldnews,EU Lawmakers to Reassess US Trade Deal After Supreme Court Tariff Ruling,https://www.bloomberg.com/news/articles/2026-02-20/eu-lawmakers-call-meeting-on-us-trade-deal-after-tariff-ruling?embedded-checkout=true,0.92,246,0,246
18,worldnews,Ukraine Offers Japan Battle-Tested Sea Drone and Interceptor Tech That Drove Russia’s Fleet From Black Sea,https://united24media.com/latest-news/ukraine-offers-japan-battle-tested-sea-drone-and-interceptor-tech-that-drove-russias-fleet-from-black-sea-16105,0.95,243,0,243
19,worldnews,US and Iran slide towards conflict as military buildup eclipses talks,https://www.reuters.com/world/middle-east/us-iran-slide-towards-conflict-military-buildup-eclipses-talks-2026-02-20/,0.9,177,0,177
20,worldnews,"China cannot profit from low tariffs and shield own market, EU trade chief says",https://www.reuters.com/world/china/china-cannot-profit-low-tariffs-shield-own-market-eu-trade-chief-says-2026-02-20/,0.87,152,0,152
21,worldnews,North Korean POW in Ukraine: 'There is nothing I can do if they don't take me' - The Korea Times,https://www.koreatimes.co.kr/foreignaffairs/northkorea/20260206/north-korean-pow-in-ukraine-there-is-nothing-i-can-do-if-they-dont-take-me,0.92,112,0,112
22,worldnews,"/r/WorldNews Live Thread: Russian Invasion of Ukraine Day 1458, Part 1 (Thread #1605)",https://www.reddit.com/live/18hnzysb1elcs,0.95,89,0,89
23,worldnews,"Israeli strikes in Lebanon kill at least 10, including senior Hezbollah official",https://www.reuters.com/world/middle-east/least-6-killed-21-wounded-israeli-strikes-eastern-lebanon-security-sources-say-2026-02-20/,0.82,50,0,50
24,worldnews,Trump talks peace in the Middle East as he readies war on Iran,https://www.washingtonpost.com/national-security/2026/02/20/trum-war-iran-peace-middle-east/,0.85,35,0,35
