,subreddit,title,url,upvote_ratio,ups,downs,score
0,worldnews,WH says Iran is preparing imminent ballistic missile attack against Israel,https://www.cnn.com/2024/10/01/politics/iran-missile-attack-israel/index.html,0.92,25768,0,25768
1,worldnews,"Biden directs US military to help Israel shoot down Iranian missiles, officials say",https://abcnews.go.com/Politics/biden-us-prepared-israel-defend-iranian-attack/story?id=114393069,0.88,20967,0,20967
2,worldnews,‘Everything is dead’: Ukraine rushes to stem ecocide after river poisoning,https://www.theguardian.com/world/2024/oct/01/ukraine-seim-river-poisoning-chernihiv-ecocide-,0.96,18909,0,18909
3,worldnews,IDF says Iranian attack has been launched as sirens sound across Israel,https://www.timesofisrael.com/idf-says-iranian-attack-has-been-launched-as-sirens-sound-across-israel/,0.92,15280,0,15280
4,worldnews,102 missiles fired from Iran towards Israel,https://www.jpost.com/breaking-news/article-822841,0.94,13830,0,13830
5,worldnews,'Declaration of War': Israeli Leaders React to Massive Iranian Assault,https://m.jpost.com/middle-east/iran-news/article-822870,0.94,7939,0,7939
6,worldnews,Only Casualty of Mass Iranian Missile Attack Is Palestinian Man in Jericho: Reports,https://www.algemeiner.com/2024/10/01/only-casualty-of-mass-iranian-missile-attack-is-palestinian-man-in-jericho-reports/,0.93,7322,0,7322
7,worldnews,"IDF: Hezbollah was ready to invade en masse after Oct. 7, we covertly raided 1,000 sites",https://www.timesofisrael.com/idf-hezbollah-was-ready-to-invade-en-masse-after-oct-7-we-covertly-raided-1000-sites/,0.9,5768,0,5768
8,worldnews,Claudia Sheinbaum is sworn in as Mexico’s first female president,https://www.washingtonpost.com/world/2024/09/30/claudia-sheinbaum-inauguration-president-mexico/,0.97,5560,0,5560
9,worldnews,"Missile fired by Iran at Israel crashes on street in Jordan, leaving locals terrified",https://www.lbc.co.uk/news/jordan-missile-fired-iran-crashes-street/,0.95,5134,0,5134
10,worldnews,FT: Biden considers advancing Ukraine’s NATO membership before he leaves office,https://novayagazeta.eu/articles/2024/10/01/ft-biden-considers-advancing-ukraines-nato-membership-before-he-leaves-office-en-news,0.97,4528,0,4528
11,worldnews,Israel warns of 'serious consequences' after Iran fires 200 missiles,https://www.hindustantimes.com/world-news/iran-israel-attack-israel-warns-of-serious-consequences-after-iran-fires-200-missiles-101727805728932.html,0.95,4026,0,4026
12,worldnews,Shooting attack in Tel Aviv causes several casualities,https://www.reuters.com/world/middle-east/shooting-attack-tel-aviv-with-number-casualties-police-say-2024-10-01/,0.95,2959,0,2959
13,worldnews,"Gunmen kill 6, including local chief of paramilitary Revolutionary Guard, in Iran",https://www.timesofisrael.com/gunmen-kill-6-including-local-chief-of-paramilitary-revolutionary-guard-in-iran/?fbclid=IwY2xjawFpAJlleHRuA2FlbQIxMQABHZ8WRQ_Af4e-dZSTsdCz8xQhNkwQeDuyoex4HxaO7X_1CoET7lJwdiceYQ_aem_afXJMq_aGLYrFbR__OlJBg,0.96,2297,0,2297
14,worldnews,US officials quietly backed Israel’s military push against Hezbollah,https://www.politico.com/news/2024/09/30/us-israel-military-hezbollah-00181797,0.91,2041,0,2041
15,worldnews,Netanyahu's popularity surges in polls after Nasrallah's Assassination,https://www.reuters.com/world/middle-east/netanyahu-boosted-israel-regains-confidence-with-nasrallah-hit-2024-09-30/,0.86,1917,0,1917
16,worldnews,"South Korea unveils its most powerful missile, which could reach North Korea's underground bunkers",https://www.yahoo.com/news/south-korea-unveils-most-powerful-035827823.html,0.97,1417,0,1417
17,worldnews,Celebrations erupt on the streets of Iran as IRGC hails missile attack against Israel,https://www.timesofisrael.com/celebrations-erupt-on-the-streets-of-iran-as-irgc-hails-missile-attack-against-israel/,0.85,1217,0,1217
18,worldnews,Ukraine investigating alleged shooting of 16 POWs by Russia,"https://www.reuters.com/world/europe/ukraine-investigating-alleged-shooting-16-pows-by-russia-2024-10-01/#:~:text=Ukrainian%20prosecutors%20have%20previously%20accused,invasion%20began%20in%20February%202022",0.97,1022,0,1022
19,worldnews,"The mayor of Paris has hit the city’s motorists with a double whammy of a ring road speed limit cut to 50kph and a tripling of parking fees for heavy vehicles, such as SUVs",https://www.telegraph.co.uk/world-news/2024/10/01/parisians-speed-cut-tripled-parking-socialist-mayor/,0.94,923,0,923
20,worldnews,Botanists identify 33 global ‘dark spots’ with thousands of unknown plants,https://www.theguardian.com/environment/2024/oct/01/kew-botanic-gardens-study-33-dark-spots-plant-species-identification-unknown-biodiversity-,0.97,897,0,897
21,worldnews,New Nato chief says nuclear threat from Russia not imminent - BBC News,https://www.bbc.com/news/articles/cp9580kgp09o.amp,0.96,806,0,806
22,worldnews,Iran says attack on Israel is over as fears grow of wider conflict,https://www.reuters.com/world/middle-east/iran-says-it-has-finished-attack-israel-amid-fears-spreading-conflict-2024-10-02/,0.91,622,0,622
23,worldnews,Iran fires at least 180 missiles into Israel as regionwide conflict grows,https://apnews.com/article/israel-lebanon-hezbollah-gaza-news-10-01-2024-eb175dff6e46906caea8b9e43dfbd3da,0.93,370,0,370
24,worldnews,UK forces involved in response to Iran attacks on Israel,https://www.bbc.com/news/articles/cx2krlgekpxo,0.88,307,0,307
25,worldnews,"/r/WorldNews Live Thread: Russian Invasion of Ukraine Day 951, Part 1 (Thread #1098)",https://www.reddit.com/live/18hnzysb1elcs,0.96,232,0,232
26,worldnews,/r/WorldNews Live Thread: Israel at War (Thread #70),https://www.reddit.com/live/1bsso361afr0r,0.85,66,0,66
