,subreddit,title,url,upvote_ratio,ups,downs,score
0,worldnews,Mexico suggests it would impose its own tariffs to retaliate against any Trump tariffs,https://apnews.com/article/mexico-tariffs-trump-retaliate-sheinbaum-fac0b0c6ee8c425a928418de7332b74a,0.91,36214,0,36214
1,worldnews,"Trump pledges 25% tariffs on Canada and Mexico, deeper tariffs on China",https://www.reuters.com/world/us/trump-promises-25-tariff-products-mexico-canada-2024-11-25/,0.92,24708,0,24708
2,worldnews,Zelensky on record drone attack: This is possible only because Russia is circumventing sanctions,https://www.ukrinform.net/rubric-ato/3931454-zelensky-on-record-drone-attack-this-is-possible-only-because-russia-is-circumventing-sanctions.html,0.97,10080,0,10080
3,worldnews,NATO can provide Ukraine with missiles with a range of up to 5500 km,https://unn.ua/en/news/nato-can-provide-ukraine-with-missiles-with-a-range-of-up-to-5500-km-what-is-known,0.95,9518,0,9518
4,worldnews,TikTok CEO summoned to European Parliament over role in shock Romania election,https://www.politico.eu/article/elections-tiktok-ceo-eu-parliament-romania-election-fake-accounts-pro-russia-calin-georgescu-nato-shock-victory/,0.96,8811,0,8811
5,worldnews,"Biden says Israel, Lebanon agree to ceasefire designed to be permanent end to fighting",https://abcnews.go.com/Politics/biden-israel-lebanon-agree-ceasefire-designed-permanent-end/story?utm_source=facebook&amp;utm_medium=social&amp;utm_campaign=dhfacebook&amp;utm_content=app.dashhudson.com/abcnews/library/media/476727849&amp;id=116249143,0.97,6342,0,6342
6,worldnews,Russia aims to build military strength for new aggression in 5 years – Bundeswehr General,https://www.eurointegration.com.ua/eng/news/2024/11/26/7199215/,0.97,4871,0,4871
7,worldnews,Russian deserter reveals war secrets of guarding nuclear base,https://www.bbc.com/news/articles/c9dl2pv0yj0o,0.95,4652,0,4652
8,worldnews,"UN advisor fired over refusal to label Gaza war as genocide, WSJ argues",https://www.israelhayom.com/2024/11/26/un-advisor-fired-over-refusal-to-label-gaza-war-as-genocide-wsj-argues/,0.88,4081,0,4081
9,worldnews,Russian police reportedly raid Moscow Conservatory dorm and issue military summonses to students,https://meduza.io/en/news/2024/11/25/russian-police-reportedly-raid-moscow-conservatory-dorm-and-issue-military-summons-to-students,0.97,3757,0,3757
10,worldnews,Dozens of recordings reveal high-ranking Brazilian officers pressured Bolsonaro to stage a coup,https://apnews.com/article/audios-bolsonaro-brazil-coup-military-6b0dfcf0d14bae79e572b361c2782cd0?utm_source=copy&amp;utm_medium=share,0.98,2677,0,2677
11,worldnews,"Russia condemns ""irresponsible"" talk of nuclear weapons for Ukraine",https://www.reuters.com/world/europe/kremlin-says-discussion-west-about-giving-ukraine-nuclear-weapons-is-2024-11-26/,0.91,1848,0,1848
12,worldnews,New NATO chief Rutte says alliance ‘needs to go further’ in support for Ukraine,https://apnews.com/article/greece-ukraine-nato-european-union-defense-trump-5de895348c14f45b766c0e220c04b637,0.97,1765,0,1765
13,worldnews,Ruble devaluation triggers fruit export cancellations to Russia amid soaring inflation,https://www.freshplaza.com/north-america/article/9682087/ruble-devaluation-triggers-fruit-export-cancellations-to-russia-amid-soaring-inflation/,0.97,1636,0,1636
14,worldnews,Scholz admits conversations with Putin were never pleasant,https://www.pravda.com.ua/eng/news/2024/11/26/7486373/,0.95,1155,0,1155
15,worldnews,"Ukraine pushes back Russian troops from Kupiansk, military says",https://kyivindependent.com/ukraine-push-back-russian-troops-from-kupiansk-military-says/,0.97,1113,0,1113
16,worldnews,"Amazon workers in more than 20 countries set to protest during Black Friday and Cyber Monday, organizers say",https://www.nbcnews.com/business/business-news/amazon-workers-20-countries-set-protest-black-friday-cyber-monday-orga-rcna181840,0.97,1031,0,1031
17,worldnews,Majority of social media influencers share information without verifying its accuracy: UN report,https://thehill.com/policy/technology/5011204-majority-of-social-media-influencers-share-information-without-verifying-its-accuracy/,0.95,952,0,952
18,worldnews,Australia's House of Representatives passes bill that would ban young children from social media,https://apnews.com/article/australia-social-media-young-children-bf0ca2aedaf61b71fe335421240e94c4,0.96,883,0,883
19,worldnews,"Putin ally claims Russia's new nuclear missile ""impossible to shoot down""",https://www.newsweek.com/putin-ally-new-russian-missile-impossible-defend-1990975,0.81,668,0,668
20,worldnews,Germany to allocate additional €65 million for the restoration of Ukraine's energy infrastructure,https://www.pravda.com.ua/eng/news/2024/11/26/7486413/,0.97,664,0,664
21,worldnews,Notre Dame Cathedral is almost ready to reopen nearly 6 years after fire,https://www.npr.org/2024/11/25/nx-s1-5205050/notre-dame-cathedral-is-almost-ready-to-reopen-nearly-6-years-after-fire,0.96,614,0,614
22,worldnews,Israel committed in writing to US: No forced displacement of Palestinians from northern Gaza,https://www.jpost.com/middle-east/article-830040,0.84,370,0,370
23,worldnews,Norway may increase aid to Ukraine to $2.7 billion in 2025,https://kyivindependent.com/norway-may-increase-aid-to-ukraine-to-2-7-billion-in-2025/,0.96,209,0,209
24,worldnews,"/r/WorldNews Live Thread: Russian Invasion of Ukraine Day 1007, Part 1 (Thread #1154)",https://www.reddit.com/live/18hnzysb1elcs,0.97,151,0,151
25,worldnews,/r/WorldNews Live Thread: Israel at War (Thread #78),https://www.reddit.com/live/1bsso361afr0r,0.79,110,0,110
26,worldnews,'The laser era': Israeli military to acquire personal laser defense systems for troops,https://www.ynetnews.com/article/hjru1smmyx,0.93,105,0,105
