,subreddit,title,url,upvote_ratio,ups,downs,score
0,worldnews,The US House of Representatives has approved sending $60.8bn (£49bn) in foreign aid to Ukraine.,https://news.sky.com/story/crucial-608bn-ukraine-aid-package-approved-by-us-house-of-representatives-after-months-of-deadlock-13119287,0.89,36030,0,36030
1,worldnews,IDF kills Islamic Jihad commander in West Bank,https://m.jpost.com/breaking-news/article-797946,0.88,7118,0,7118
2,worldnews,"US to withdraw military personnel from Niger, source says",https://www.reuters.com/world/us-withdraw-military-personnel-niger-source-says-2024-04-19/,0.96,6787,0,6787
3,worldnews,Chad’s government threatens to kick out US troops as Russia expands influence in Africa,https://edition.cnn.com/2024/04/18/politics/chad-us-troops-threat/index.html,0.96,4614,0,4614
4,worldnews,Russian troops arrive in Niger as military agreement begins,https://www.bbc.com/news/world-africa-68796359,0.95,3184,0,3184
5,worldnews,Iran Might Receive Its First Su-35 Flanker Fighters From Russia Next Week,https://www.forbes.com/sites/pauliddon/2024/04/20/iran-might-receive-its-first-su-35-flanker-fighters-from-russia-next-week/,0.95,2983,0,2983
6,worldnews,Russia's Smolensk governor says Ukrainian drone sets fuel depot ablaze,https://www.jpost.com/breaking-news/article-797989,0.96,2958,0,2958
7,worldnews,"Entire IRGC command wing in Syria was eliminated in strike, Bloomberg reveals",https://www.jpost.com/middle-east/bloomberg-reveals-that-the-entire-irgc-command-wing-in-syria-was-assassinated-798031,0.95,2905,0,2905
8,worldnews,"Appeasing Iran has failed, says exiled crown prince",https://www.telegraph.co.uk/world-news/2024/04/20/iran-prince-diplomacy-appeasement-failing-tougher-west-lead/,0.9,2416,0,2416
9,worldnews,Military court convicts U.S. sailor of attempted espionage,https://www.npr.org/2024/04/20/1246108780/navy-classified-information-sailor-convicted-espionage,0.98,2099,0,2099
10,worldnews,Chad Asks United States to Withdraw Troops From Key Outpost Ahead of Election,https://www.bloomberg.com/news/articles/2024-04-19/chad-asks-us-troops-to-cease-operations-at-strategic-army-base,0.95,2070,0,2070
11,worldnews,"The United States agreed Friday to withdraw its more than 1,000 troops from Niger, officials said, upending its posture in West Africa where the country was home to a major drone base.",https://www.france24.com/en/africa/20240420-us-agrees-to-withdraw-troops-from-key-drone-base-in-niger,0.96,2043,0,2043
12,worldnews,Met Police apologises twice after using phrase 'openly Jewish' as campaigner accuses force of 'victim-blaming' | UK News,https://news.sky.com/story/met-police-apologises-for-using-phrase-openly-jewish-as-antisemitism-campaigner-accuses-force-of-victim-blaming-13118714,0.91,1873,0,1873
13,worldnews,Hamas leaders said looking at leaving Qatar amid growing pressure in hostage talks,https://www.timesofisrael.com/hamas-leaders-said-looking-at-leaving-qatar-amid-growing-pressure-in-hostage-talks/,0.95,1712,0,1712
14,worldnews,"Russia recruiting female convicts into the military report says, as the role of women in the Ukraine war expands",https://www.businessinsider.com/russia-recruiting-female-convicts-military-report-2024-4,0.96,1580,0,1580
15,worldnews,U.S. expected to sanction IDF unit for human rights violations in West Bank,https://www.axios.com/2024/04/20/us-israel-sanctions-idf-west-bank,0.85,902,0,902
16,worldnews,Top Russian Hypersonic Scientist Sentenced to 7 Years for Treason,https://www.themoscowtimes.com/2024/04/18/top-russian-hypersonic-scientist-sentenced-to-7-years-for-treason-a84881,0.96,872,0,872
17,worldnews,/r/WorldNews Live Thread: Iran attacks Israel (Thread 4),https://www.reddit.com/live/1bsso361afr0r,0.86,743,0,743
18,worldnews,Mexico: Two more mayoral candidates killed ahead of election,https://www.dw.com/en/mexico-2-more-mayoral-candidates-killed-ahead-of-election/a-68877373,0.98,684,0,684
19,worldnews,"As Russia presses forward, Ukraine pleads with Canada for armour, air defence",https://www.cbc.ca/news/politics/oleksandra-ustinova-ukraine-russia-freeland-budget-1.7179373,0.94,679,0,679
20,worldnews,Kolkata in heatwave grip as temp vaults past 40°C,https://timesofindia.indiatimes.com/city/kolkata/kolkata-in-heatwave-grip-as-temp-vaults-past-40c/articleshow/109452095.cms,0.93,662,0,662
21,worldnews,Russian bought $88m of gold from dealer in Changi to launder funds for Ukraine invasion,https://www.straitstimes.com/singapore/russian-bought-88-million-of-gold-in-changi-to-launder-funds-for-invasion-of-ukraine,0.95,521,0,521
22,worldnews,Netanyahu slams reported US decision to sanction IDF unit: ‘The height of absurdity’,https://www.timesofisrael.com/netanyahu-slams-reported-us-decision-to-sanction-idf-unit-the-height-of-absurdity/,0.8,515,0,515
23,worldnews,"Hamas' Haniyeh, Erdogan meet in Istanbul to discuss relocation to Turkey",https://www.ynetnews.com/article/bym4k3z11r,0.92,307,0,307
24,worldnews,"/r/WorldNews Live Thread: Russian Invasion of Ukraine Day 788, Part 1 (Thread #934)",https://www.reddit.com/live/18hnzysb1elcs,0.97,237,0,237
25,worldnews,IDF strikes in Lebanon kill at least 3 Hezbollah gunmen; missile hits Metula home,https://www.timesofisrael.com/idf-strikes-in-lebanon-kill-at-least-3-hezbollah-gunmen-missile-hits-metula-home/,0.88,199,0,199
26,worldnews,U.K. police apologize after threatening to arrest ’openly Jewish’ man,https://nationalpost.com/news/world/u-k-police-apologize-after-threatening-to-arrest-openly-jewish-man,0.88,99,0,99
