,subreddit,title,url,upvote_ratio,ups,downs,score
0,worldnews,X axes European Commission’s ad account after €120M EU fine,https://www.politico.eu/article/x-axes-european-commissions-ad-account-after-e120m-eu-fine/,0.95,10564,0,10564
1,worldnews,Russian troops caught in kill zone as Ukraine reclaims Ivanivka in daring counterattack,https://euromaidanpress.com/2025/12/07/frontline-report-2025-12-07/,0.97,9563,0,9563
2,worldnews,Kremlin says new US security strategy accords largely with Russia's view,https://www.reuters.com/world/china/kremlin-says-new-us-security-strategy-accords-largely-with-russias-view-2025-12-07/,0.95,8932,0,8932
3,worldnews,Italy's Meloni pledges emergency aid to Ukraine in call with Zelenskiy,https://www.reuters.com/world/italys-meloni-pledges-emergency-aid-ukraine-call-with-zelenskiy-2025-12-07/,0.98,4468,0,4468
4,worldnews,Germany scrambles to unlock €165bn in frozen Russian assets for Ukraine,https://euromaidanpress.com/2025/12/06/frozen-russian-assets-ukraine-loan-merz-belgium/,0.96,4369,0,4369
5,worldnews,Thailand launches airstrikes on Cambodia as Trump’s peace agreement hangs in balance,https://www.cnn.com/2025/12/07/asia/thailand-cambodia-border-clashes-december-intl-hnk,0.97,4109,0,4109
6,worldnews,"New US security strategy aligns with Russia's vision, Moscow says",https://www.bbc.co.uk/news/articles/cpvd01g2kwwo,0.95,2908,0,2908
7,worldnews,"Hamas chief rejects key points of Trump peace plan, calls for Israel's destruction",https://www.jns.org/hamas-chief-rejects-key-points-of-trump-peace-plan-calls-for-israels-destruction/,0.89,2412,0,2412
8,worldnews,Russian Shadow Fleet Tanker Stuck off Bulgaria After Tugboat Abandons Tow,https://united24media.com/latest-news/russian-shadow-fleet-tanker-stuck-off-bulgaria-after-tugboat-abandons-tow-14074,0.98,2221,0,2221
9,worldnews,Trump’s son suggests president may walk away from Ukraine,https://www.politico.com/news/2025/12/07/donald-trump-jr-ukraine-qatar-00679809,0.9,1933,0,1933
10,worldnews,Pentagon announces it has killed four men in another boat strike in Pacific,https://www.theguardian.com/us-news/2025/dec/04/pentagon-boat-strike-pacific,0.95,1694,0,1694
11,worldnews,"Canada has legal duty to provide safe water, housing to remote First Nations, federal judge rules",https://www.cbc.ca/news/canada/manitoba/st-theresa-point-shamattawa-sandy-lake-first-nation-class-action-ruling-9.7005716,0.88,1419,0,1419
12,worldnews,Deadly attack on kindergarten reported in Sudan,https://www.bbc.com/news/articles/cpd61d0jl6no,0.96,1304,0,1304
13,worldnews,"Water leak in the Louvre damages hundreds of works, museum says",https://www.theguardian.com/world/2025/dec/07/water-leak-in-the-louvre-damages-hundreds-of-works-museum-says,0.97,1293,0,1293
14,worldnews,Trump says he’s disappointed because Zelenskyy reportedly hasn’t read US peace plan,https://newsukraine.rbc.ua/news/trump-says-he-s-disappointed-because-zelenskyy-1765157733.html,0.91,1174,0,1174
15,worldnews,Victoria passes controversial laws allowing life sentences for offenders as young as 14,https://tanea.com.au/en/victoria-passes-controversial-laws-allowing-life-sentences-for-offenders-as-young-as-14/,0.93,856,0,856
16,worldnews,Norway tightens ties to EU,https://www.newsinenglish.no/2025/12/07/norway-tightens-ties-to-eu/,0.97,681,0,681
17,worldnews,Trump says Zelenskyy ‘isn’t ready’ yet to accept US-authored proposal to end Russia-Ukraine war,https://apnews.com/article/ukraine-russia-war-kellogg-trump-zelenskyy-cf7422dc54d0f2415d164824c9d389a3,0.86,623,0,623
18,worldnews,Russian strike hits medicines warehouse of major Ukrainian pharmaceutical distributor,https://www.pravda.com.ua/eng/news/2025/12/07/8010807/,0.95,383,0,383
19,worldnews,Militants from Russia's African Corps committing atrocities in Mali,https://www.pravda.com.ua/eng/news/2025/12/07/8010804/,0.97,363,0,363
20,worldnews,"Chinese carrier conducting intense air operations near Japan, Tokyo says",https://www.reuters.com/world/china/chinese-carrier-conducting-intense-air-operations-near-japan-tokyo-says-2025-12-08/,0.93,313,0,313
21,worldnews,"Japan's low-crime image cracking as car thefts, home intrusions rise",https://english.kyodonews.net/articles/-/65815?words=japan+low+crime,0.88,238,0,238
22,worldnews,South Korea’s Hyundai feeds rapid naval upgrades in the Philippines,https://www.defensenews.com/global/asia-pacific/2025/12/05/south-koreas-hyundai-feeds-rapid-naval-upgrades-in-the-philippines/,0.97,215,0,215
23,worldnews,US lawmakers urge release of video of double-tap boat strike in Caribbean,https://www.aljazeera.com/news/2025/12/8/us-lawmakers-urge-release-of-video-of-double-tap-boat-strike-in-caribbean,0.95,178,0,178
24,worldnews,"RSF kills 116 people in Sudan’s Kalogi, including 46 children",https://www.aljazeera.com/news/2025/12/5/rsf-kills-dozens-mostly-children-in-war-torn-sudans-kalogi-saf-sources,0.94,115,0,115
