,subreddit,title,url,upvote_ratio,ups,downs,score
0,worldnews,"""I'm Not Ruling Anything Out"" - Macron Says Troops for Ukraine Possible if Russia Breaks Front Lines",https://www.kyivpost.com/post/32010,0.94,14629,0,14629
1,worldnews,"Russian army loses over 20,000 soldiers just in East in April - Ukraine's Forces",https://newsukraine.rbc.ua/news/russian-army-lost-over-20-000-soldiers-just-1714591651.html,0.93,12745,0,12745
2,worldnews,"Russian troops enter base housing US military in Niger, US official says",https://www.reuters.com/world/africa/russian-troops-enter-base-housing-us-military-niger-us-official-says-2024-05-02/,0.96,11022,0,11022
3,worldnews,"US official urges China, Russia to declare only humans, not AI, control nuclear weapons",https://www.reuters.com/world/us-official-urges-china-russia-declare-only-humans-not-ai-control-nuclear-2024-05-02/,0.97,4511,0,4511
4,worldnews,Orangutan seen treating wound with medicinal herb in first for wild animals,https://www.theguardian.com/science/article/2024/may/02/orangutan-seen-treating-wound-with-medicinal-herb-in-first-for-wild-animals-max-planck-institute-sumatra,0.98,4208,0,4208
5,worldnews,Turkey Halts All Trade With Israel: Officials,https://www.bloomberg.com/news/articles/2024-05-02/turkey-halts-all-trade-with-israel-officials,0.92,3899,0,3899
6,worldnews,Hybrid war: NATO sounds alarm over 'hostile' Russian activity across Europe,https://www.euronews.com/2024/05/02/nato-sounds-alarm-over-russian-hybrid-activity-across-europe,0.97,3826,0,3826
7,worldnews,Macron’s conditions to deploy troops in Ukraine: Russia’s breakthrough and Ukraine’s request,https://euromaidanpress.com/2024/05/02/macrons-conditions-to-deploy-troops-in-ukraine-russias-breakthrough-and-ukraines-request/,0.97,3759,0,3759
8,worldnews,American oil tycoon accused of trying to conspire with OPEC to inflate prices,https://www.cnn.com/2024/05/02/energy/oil-ceo-opec-scott-sheffield/index.html,0.97,3743,0,3743
9,worldnews,China’s newest aircraft carrier heads to sea for first time,https://www.cnn.com/2024/05/01/china/china-navy-newest-aircraft-carrier-fujian-sea-trial-intl-hnk-ml/index.html,0.94,2221,0,2221
10,worldnews,Anger as controversial MP George Galloway says gay relationships aren't 'normal',https://www.thepinknews.com/2024/05/02/george-galloway/,0.9,2186,0,2186
11,worldnews,Ukraine has received Western weapons with permission to hit Russia. An interview with Latvia's Foreign Minister,https://www.eurointegration.com.ua/eng/interview/2024/05/2/7185053/,0.96,2096,0,2096
12,worldnews,"Researchers discovered 27 original volumes containing the lost works of Jacob and Wilhelm Grimm in the library of the Adam Mickiewicz University in Poznań. The volumes contain a large number of footnotes by the authors, making them an even more important find.",https://english.nv.ua/life/27-unique-volumes-of-grimm-brothers-fairy-tales-were-found-in-poland-50415035.html,0.98,1746,0,1746
13,worldnews,"Russia is shipping oil to North Korea above UN mandated levels, US official says",https://www.reuters.com/business/energy/russia-is-shipping-oil-north-korea-above-un-mandated-levels-us-official-2024-05-02/,0.95,1515,0,1515
14,worldnews,Iran says journalists charged after BBC report on protester death,https://www.bbc.com/news/articles/cnd6k8ggzn2o,0.95,1386,0,1386
15,worldnews,"Summer heat hits Asia early, killing dozens as one expert calls it the ""most extreme event"" in climate history",https://www.cbsnews.com/news/heat-wave-asia-2024-deaths-india-severe-weather-climate-change/?ftag=CNM-05-10abh9g,0.93,1073,0,1073
16,worldnews,David Cameron commits £3bn a year in aid to Ukraine ‘for as long as necessary’,https://www.theguardian.com/politics/article/2024/may/02/david-cameron-commits-3bn-a-year-in-aid-to-ukraine-for-as-long-as-necessary,0.95,1060,0,1060
17,worldnews,Hundreds of Russian Troops Gathered. Then Four ATACMS Rockets Struck,https://www.forbes.com/sites/davidaxe/2024/05/02/hundreds-of-russian-troops-gathered-out-in-the-open-they-didnt-know-the-ukrainians-had-aimed-four-atacms-rockets-at-them/?sh=fc9bdab1a2e4,0.94,618,0,618
18,worldnews,HRW: Russian troops executed at least 15 surrendering Ukrainian soldiers since December,https://gwaramedia.com/en/hrw-russian-troops-executed-at-least-15-surrendering-ukrainian-soldiers-since-december/,0.94,561,0,561
19,worldnews,Gazprom plunges to first annual loss in 20 years as trade with Europe hit,https://www.cnbc.com/2024/05/02/gazprom-plunges-to-first-annual-loss-in-20-years-as-trade-with-europe-hit-.html,0.95,428,0,428
20,worldnews,Russian governors report power outages after night drone attack - Euromaidan Press,https://euromaidanpress.com/2024/05/02/russian-governors-report-power-outages-reported-after-night-drone-attack/,0.95,422,0,422
21,worldnews,Sex work decriminalised in Queensland after decades of campaigning,https://www.theguardian.com/australia-news/article/2024/may/02/queensland-sex-work-decriminalised-law-passes,0.93,380,0,380
22,worldnews,Hundreds of Russian Troops Gathered Out In The Open. They Didn’t Know The Ukrainians Had Aimed Four ATACMS Rockets At Them.,https://www.forbes.com/sites/davidaxe/2024/05/02/hundreds-of-russian-troops-gathered-out-in-the-open-they-didnt-know-the-ukrainians-had-aimed-four-atacms-rockets-at-them/?sh=4286e4e11a2e,0.9,251,0,251
23,worldnews,"/r/WorldNews Live Thread: Russian Invasion of Ukraine Day 800, Part 1 (Thread #946)",https://www.reddit.com/live/18hnzysb1elcs,0.98,234,0,234
24,worldnews,Welsh Senedd members consider criminalising lying by politicians,https://www.theguardian.com/politics/2024/apr/30/welsh-senedd-members-consider-criminalising-lying-by-politicians,0.93,225,0,225
25,worldnews,/r/WorldNews Live Thread: Iran attacks Israel (Thread 5),https://www.reddit.com/live/1bsso361afr0r,0.81,225,0,225
26,worldnews,Microsoft bans US police departments from using enterprise AI tool for facial recognition | TechCrunch,https://techcrunch.com/2024/05/02/microsoft-bans-u-s-police-departments-from-using-enterprise-ai-tool/,0.91,100,0,100
