,subreddit,title,url,upvote_ratio,ups,downs,score
0,worldnews,"Iran’s president offers resignation, citing total takeover by IRGC commanders",https://www.iranintl.com/en/202605312204?source=share-link,0.94,27594,0,27594
1,worldnews,‘Disturbing Graves’: Vietnam Moves the Dead to Make Way for Trump’s $1.5B Golf Course,https://sundayguardianlive.com/world/disturbing-graves-vietnam-moves-the-dead-to-make-way-for-trumps-15b-golf-course-198482/,0.95,18340,0,18340
2,worldnews,"Russia Can No Longer Take More Land Than Ukraine Liberates, Zelenskyy Says",https://united24media.com/war-in-ukraine/russia-can-no-longer-take-more-land-than-ukraine-liberates-zelenskyy-says-19353,0.96,17791,0,17791
3,worldnews,"US to pull jets, destroyers and submarines from NATO as part of European drawdown",https://www.politico.eu/article/us-to-pull-jets-destroyers-and-submarines-from-nato-in-a-broader-european-fallback/,0.96,9304,0,9304
4,worldnews,"At Least 5 People Dead, 3 Missing After WWII-Era Bomb Explodes in Indonesia",https://people.com/at-least-5-people-dead-3-missing-after-wwii-era-bomb-explodes-in-indonesia-11987556,0.97,4805,0,4805
5,worldnews,France requests emergency UN meeting amid Israeli advance in Lebanon,https://www.rfi.fr/en/international/20260531-france-requests-emergency-un-meeting-amid-israeli-advance-in-lebanon,0.93,4684,0,4684
6,worldnews,"Sweden’s PM jokes about Canada joining the EU, says it’s a ‘very welcoming club’",https://www.ctvnews.ca/politics/article/swedens-pm-jokes-about-canada-joining-the-eu-says-its-a-very-welcoming-club/,0.97,3135,0,3135
7,worldnews,Polish President Calls for Revoking Zelensky’s Order of the White Eagle,https://www.kyivpost.com/post/77119,0.88,2949,0,2949
8,worldnews,Australia's far-right party leads in national poll for first time,https://www.reuters.com/world/asia-pacific/australias-far-right-party-leads-national-poll-first-time-2026-06-01/?utm_medium=Social&amp;utm_source=twitter,0.91,1813,0,1813
9,worldnews,Israeli army captures strategic castle in Lebanon in deepest incursion into the country in 26 years,https://apnews.com/article/lebanon-israel-capture-castle-beaufort-206c3d6c4dc9a139007f043556a0019b,0.87,950,0,950
10,worldnews,Romanian president asks Russia to ensure Romanians are not harmed when it attacks Ukrainian cities,https://www.pravda.com.ua/eng/news/2026/05/31/8037195/,0.95,742,0,742
11,worldnews,UK blocks visits by left-wing US commentators Cenk Uygur and Hasan Piker,https://www.yahoo.com/news/articles/uk-blocks-visits-left-wing-102315349.html?ncid=redditnewsus,0.84,447,0,447
12,worldnews,Ukraine hits Russian energy targets and denies striking Kremlin-occupied nuclear plant,https://www.nbcnews.com/world/ukraine/ukraine-hits-russian-energy-targets-denies-striking-kremlin-occupied-n-rcna347739,0.95,355,0,355
13,worldnews,EU weighs excluding military-age Ukrainian men from extended protection scheme,https://www.euractiv.com/news/exclusive-eu-weighs-excluding-military-age-ukrainian-men-from-extended-protection-scheme,0.9,355,0,355
14,worldnews,"3,400 deaths in a day: India's extreme heat days are deadlier than we imagined",https://www.indiatoday.in/science/story/india-heatwave-deaths-study-extreme-heat-public-health-emergency-climate-change-2920200-2026-06-01,0.94,325,0,325
15,worldnews,"/r/WorldNews Live Thread: Russian Invasion of Ukraine Day 1558, Part 1 (Thread #1705)",https://www.reddit.com/live/18hnzysb1elcs,0.97,315,0,315
16,worldnews,France seized sanctioned Russian oil tanker with UK help,https://www.bbc.com/news/articles/cn8pwgej1gxo?amp;at_campaign=rss,0.98,312,0,312
17,worldnews,"Unexploded Russian-made cluster munition bomblets, as well as damage consistent with bomblet impacts, have been found in a village in northern Mali – despite the West African country being a state party to the Convention on Cluster Munitions which prohibits their use.",https://www.bellingcat.com/news/africa/2026/05/26/banned-russian-submunitions-found-after-malis-military-announces-airstrikes/,0.96,263,0,263
18,worldnews,/r/WorldNews Discussion Thread: US and Israel launch attack on Iran; Iran retaliates (Thread #18),https://www.reddit.com/r/worldnews/comments/1tlutp0/rworldnews_discussion_thread_us_and_israel_launch/,0.85,208,0,208
19,worldnews,Iran and US report new wave of air strikes in Gulf,https://www.bbc.com/news/articles/crlpy8n7pr6o,0.95,208,0,208
20,worldnews,"Hungary to Amend Constitution to Oust President, Magyar Says",https://www.bloomberg.com/news/articles/2026-06-01/hungary-to-amend-constitution-to-oust-president-magyar-says,0.94,205,0,205
21,worldnews,"Hungary to launch legal proceedings to oust president if he refuses to resign, says PM",https://tvpworld.com/93579001/hungarys-magyar-seeks-legal-procedure-to-remove-president-from-office,0.95,153,0,153
22,worldnews,France's Macron says French Navy boarded Russia-linked oil tanker,https://www.reuters.com/world/frances-macron-says-french-navy-boarded-russia-linked-oil-tanker-2026-06-01/,0.97,135,0,135
23,worldnews,Japan deploys personnel to NATO Security Assistance and Training for Ukraine,https://www.nato.int/en/news-and-events/articles/news/2026/05/29/japan-deploys-personnel-to-nato-security-assistance-and-training-for-ukraine,0.94,111,0,111
24,worldnews,France seizes another sanctioned tanker carrying Russian oil,https://www.cnn.com/2026/06/01/europe/france-russian-tanker-intl?utm_medium=social&amp;utm_campaign=missions&amp;utm_source=reddit,0.99,105,0,105
