,subreddit,title,url,upvote_ratio,ups,downs,score
0,worldnews,"Europe must resist pressure to become ‘America’s followers,’ says Macron",https://www.politico.eu/article/emmanuel-macron-china-america-pressure-interview/,0.77,39563,0,39563
1,worldnews,Russia loses election to three UN bodies over Ukraine,https://apnews.com/article/russia-ukraine-un-lost-elections-95b7078b7e0b86ea1d2cc17726a6db3b,0.93,30343,0,30343
2,worldnews,"Twitter is now recommending Russian War Criminals accounts to users after restricting them last year, tests suggest",https://news.yahoo.com/elon-musks-twitter-now-recommending-100000106.html,0.93,19953,0,19953
3,worldnews,"CIA director says US felt ""blindsided"" by Saudi Arabia reconciliation with Iran",https://www.middleeastmonitor.com/20230409-cia-director-says-us-felt-blindsided-by-saudi-arabia-reconciliation-with-iran/,0.95,15244,0,15244
4,worldnews,"India releases tiger census data: 3,167 tigers in 2022, up from 2,967 in 2018",https://indianexpress.com/article/india/tiger-census-data-2023-pm-modi-project-tiger-8546410/,0.97,10537,0,10537
5,worldnews,NATO announces date of largest air force exercise in history,https://tvpworld.com/69061521/nato-announces-date-of-largest-air-force-exercise-in-history,0.97,8816,0,8816
6,worldnews,Schoolgirl poisonings continue across Iran,https://www.dawn.com/news/1746713/schoolgirl-poisonings-continue-across-iran,0.97,4448,0,4448
7,worldnews,"Russia nearly shot down British spy plane near Ukraine, leaked document says",https://www.washingtonpost.com/national-security/2023/04/09/leaked-documents-surveillance-plane-rivet-joint/,0.95,3832,0,3832
8,worldnews,Twitter: BBC objects to government funded media label,https://www.bbc.co.uk/news/entertainment-arts-65226481,0.95,3199,0,3199
9,worldnews,China simulates striking Taiwan on second day of drills,https://www.reuters.com/world/us-says-it-is-monitoring-chinas-drills-around-taiwan-closely-2023-04-08/,0.95,2691,0,2691
10,worldnews,Russia and Iran conspire to weaken US dollar in joint meeting,https://m.jpost.com/international/article-738794,0.93,2472,0,2472
11,worldnews,Somalia Bans Guns From Streets of Mogadishu,https://www.voanews.com/a/somalia-bans-guns-from-streets-of-mogadishu/7041505.html,0.96,1536,0,1536
12,worldnews,Pope Asks God To Help 'Beloved Ukrainian People' In Easter Sunday Mass,https://www.rferl.org/a/ukraine-pope-francis-easter-message-russians/32356005.html,0.93,1535,0,1535
13,worldnews,Malaysia says it will protect its rights in South China Sea,https://www.reuters.com/world/asia-pacific/malaysia-says-it-will-protect-its-rights-south-china-sea-2023-04-08/,0.96,1477,0,1477
14,worldnews,Latest in Ukraine: UK Says Russia Attempting to Normalize Illegal Annexation of Areas in Ukraine,https://www.voanews.com/a/latest-in-ukraine-uk-says-russia-attempting-to-normalize-illegal-annexation-of-areas-in-ukraine/7042660.html,0.94,1342,0,1342
15,worldnews,UN human rights official says Israel 'can't claim' self-defense after deadly terror,https://www.timesofisrael.com/un-human-rights-official-says-israel-cant-claim-self-defense-after-deadly-terror/,0.89,941,0,941
16,worldnews,Uzbekistan: domestic violence is now a criminal offense,https://www.pressenza.com/2023/04/uzbekistan-domestic-violence-is-now-a-criminal-offense/,0.98,937,0,937
17,worldnews,Thousands join Israeli judicial protests in shadow of attacks,https://www.reuters.com/world/middle-east/israeli-judicial-protests-continue-shadow-attacks-2023-04-08/,0.93,923,0,923
18,worldnews,"Hezbollah, Hamas heads meet, promise further 'resistance' against Israel",https://m.jpost.com/arab-israeli-conflict/article-738793,0.91,747,0,747
19,worldnews,(LEAD) S. Korea to hold necessary discussions with U.S. after CIA eavesdropping report | Yonhap News Agency,https://m-en.yna.co.kr/view/AEN20230409003151315?input=tw,0.93,577,0,577
20,worldnews,"Amid Ukraine war, India’s oil imports from Russia now double of traditional top supplier Iraq",https://www.firstpost.com/world/amid-ukraine-war-indias-oil-imports-from-russia-now-double-of-traditional-top-supplier-iraq-12431302.html,0.93,536,0,536
21,worldnews,Missing American Man Found Dead in Clandestine Mexican Burial Pit,https://www.nbcsandiego.com/news/national-international/missing-american-man-found-dead-in-clandestine-burial-pit-on-mexicos-baja-california-peninsula/3203695/,0.95,319,0,319
22,worldnews,"/r/WorldNews Live Thread: Russian Invasion of Ukraine Day 411, Part 1 (Thread #552)",https://www.reddit.com/live/18hnzysb1elcs,0.98,287,0,287
23,worldnews,Gantz says 3 mayors he had met with were excluded from Netanyahu security call,https://www.timesofisrael.com/gantz-says-3-mayors-he-had-met-with-were-excluded-from-netanyahu-security-call/,0.88,223,0,223
24,worldnews,Intelligence leak exposes U.S. spying on adversaries and allies,https://www.washingtonpost.com/national-security/2023/04/08/intelligence-leak-documents-ukraine-pentagon/,0.84,178,0,178
25,worldnews,Syria: Nine Truffle hunters killed by IS land mine. The workers were killed when their vehicle hit a land mine. It's the latest in a spate of attacks on truffle hunters in Syria,https://www.dw.com/en/syria-truffle-foragers-killed-by-is-land-mine/a-65269160,0.93,86,0,86
