,subreddit,title,url,upvote_ratio,ups,downs,score
0,worldnews,"Mark Carney elected Liberal leader, to soon replace Justin Trudeau as PM",https://www.ctvnews.ca/politics/liberal-leadership/article/breaking-mark-carney-elected-liberal-leader-to-soon-replace-justin-trudeau-as-pm/,0.95,31833,0,31833
1,worldnews,Australia considering joining 'coalition of the willing' for Ukraine amid talks with Starmer,https://kyivindependent.com/australia-considering-joining-coalition-of-the-willing-for-ukraine-following-talks-with-starmer/,0.97,25987,0,25987
2,worldnews,"‘Canada will never ever be part of America,’ says Mark Carney after winning PM race",https://www.hindustantimes.com/world-news/canada-will-never-ever-be-part-of-america-says-mark-carney-after-winning-pm-race-101741562712975.html,0.96,25379,0,25379
3,worldnews,"US blacklists Switzerland for ""unfair trade""",https://www.swissinfo.ch/eng/multinational-companies/usa-puts-switzerland-on-list-of-countries-with-unfair-trade-practices/88983677?utm_source=multiple&amp;utm_medium=website&amp;utm_campaign=news_en&amp;utm_content=o&amp;utm_term=wpblock_highlighted-compact-news-carousel,0.96,15871,0,15871
4,worldnews,“You will not avoid war.” Kyiv furious as Germany suggests Ukraine should fight Russia until 2030 to shield Europe,https://euromaidanpress.com/2025/03/09/you-will-not-avoid-war-kyiv-furious-as-germany-suggests-ukraine-should-fight-russia-until-2030-to-shield-europe/,0.8,10659,0,10659
5,worldnews,Israel cuts off electricity to Gaza,https://www.jfeed.com/news-israel/ssv2jp,0.92,9504,0,9504
6,worldnews,"‘Sorry, I’m Not In A Suit’: Ahead Of Crucial Talks, Zelenskyy Makes Light Of White House Drama",https://www.news18.com/world/sorry-im-not-in-a-suit-ahead-of-crucial-talks-zelenskyy-makes-light-of-white-house-drama-9255379.html,0.98,8795,0,8795
7,worldnews,"Tesla Sales Fall Off A Cliff Globally, Including Germany, Australia, And China",https://www.carscoops.com/2025/03/tesla-sales-falling-off-a-cliff-globally-including-germany-australia-and-china/,0.98,7003,0,7003
8,worldnews,Carney Says Canada’s Tariffs to Stay Until US Shows ‘Respect’,https://www.bloomberg.com/news/articles/2025-03-09/carney-says-canada-s-tariffs-to-stay-until-us-shows-respect,0.98,6886,0,6886
9,worldnews,"US Ends Support for Ukrainian F-16s, But French Mirages Will Be Salvation – Forbes",https://ukrainetoday.org/us-ends-support-for-ukrainian-f-16s-but-french-mirages-will-be-salvation-forbes/,0.98,6761,0,6761
10,worldnews,France to use interest from frozen Russian assets to finance arms for Ukraine,https://www.politico.eu/article/france-to-use-interest-from-russian-assets-to-finance-arms-for-ukraine/,0.99,6001,0,6001
11,worldnews,"Elon Musk suggests the US should leave NATO, saying it 'doesn't make sense' for the US to pay for Europe's defense",https://www.businessinsider.com/elon-musk-suggests-the-us-should-leave-nato-2025-3,0.91,5510,0,5510
12,worldnews,"After Poland spat, Musk vows Ukraine can keep Starlink",https://www.yahoo.com/news/poland-spat-musk-vows-ukraine-183236547.html,0.97,4790,0,4790
13,worldnews,Poland says it may need alternative to Musk's Starlink in Ukraine,https://www.reuters.com/world/europe/poland-says-it-may-need-alternative-musks-starlink-ukraine-2025-03-09/,0.99,4584,0,4584
14,worldnews,"As Trump blames Canada, smuggled guns from the U.S. claim Canadian lives",https://nationalpost.com/news/smuggled-u-s-guns-in-canada,0.97,4082,0,4082
15,worldnews,"Trump: Ukraine ""may not survive""",https://www.yahoo.com/news/trump-ukraine-may-not-survive-173018416.html,0.9,2043,0,2043
16,worldnews,US added to international watchlist for rapid decline in civic freedoms | US news,https://www.theguardian.com/us-news/2025/mar/09/watchlist-decline-civic-freedoms-civicus,0.97,1886,0,1886
17,worldnews,China slams Trump’s return to the ‘law of the jungle’,https://edition.cnn.com/2025/03/07/china/china-wang-yi-press-conference-trump-intl-hnk/index.html,0.95,1834,0,1834
18,worldnews,Romanian Far-Right Frontrunner Barred From May Presidential Vote,https://www.bloomberg.com/news/articles/2025-03-09/romanian-far-right-frontrunner-barred-from-may-presidential-vote,0.98,1712,0,1712
19,worldnews,"Japan vows to work with Canada under its next PM for peace, G7 unity",https://english.kyodonews.net/news/2025/03/2a171bb54b03-japan-vows-to-work-with-canada-under-its-next-pm-for-peace-g7-unity.html,0.99,1515,0,1515
20,worldnews,Far-right frontrunner Călin Georgescu blocked from Romanian presidential race,https://www.politico.eu/article/far-right-frontrunner-calin-georgescu-blocked-from-romanian-presidential-race/,0.96,920,0,920
21,worldnews,"Trump says US has ""just about"" ended pause on Ukraine intel sharing",https://www.reuters.com/world/us/trump-says-he-expects-good-results-ukraine-talks-2025-03-09/,0.94,900,0,900
22,worldnews,Germany to reach out to France and UK over sharing of nuclear weapons,https://www.theguardian.com/world/2025/mar/09/germany-to-reach-out-to-france-and-uk-over-sharing-of-nuclear-weapons,0.98,747,0,747
23,worldnews,RCMP rescue parents and their 2 toddlers found 'frozen' after crossing U.S. border into Canada,https://www.cbc.ca/news/canada/montreal/quebec-usa-border-interception-rcmp-1.7477972,0.92,469,0,469
24,worldnews,"Ukraine signs memorandum with IRIS-T manufacturer, supply will triple",https://www.pravda.com.ua/eng/news/2025/03/9/7502024/,0.98,264,0,264
25,worldnews,"/r/WorldNews Live Thread: Russian Invasion of Ukraine Day 1110, Part 1 (Thread #1257)",https://www.reddit.com/live/18hnzysb1elcs,0.97,106,0,106
