,subreddit,title,url,upvote_ratio,ups,downs,score
0,worldnews,Zelenskyy: Ukraine now has cards and everyone understands it,https://www.pravda.com.ua/eng/news/2026/03/11/8024901/,0.93,32088,0,32088
1,worldnews,"Zelenskyy to Trump: Put more pressure on Putin, ‘not on me’",https://www.politico.eu/article/volodymyr-zelenskyy-interview-pressure-vladimir-putin/,0.97,13565,0,13565
2,worldnews,Iran says it's ready for a long war that would 'destroy' global economy,https://www.lemonde.fr/en/middle-east-crisis/article/2026/03/11/iran-says-its-ready-for-a-long-war-that-would-destroy-global-economy_6751340_368.html,0.96,12789,0,12789
3,worldnews,Iran sends millions of oil barrels to China through Strait of Hormuz even as war chokes the waterway,https://www.cnbc.com/amp/2026/03/11/iran-ships-oil-china-strait-hormuz-closure-.html,0.97,9943,0,9943
4,worldnews,Britain is ejecting hereditary nobles from Parliament after 700 years,https://apnews.com/article/uk-house-of-lords-hereditary-peers-expelled-535df8781dd01e8970acda1dca99d3d4,0.98,9281,0,9281
5,worldnews,"Iran appears to have conducted a significant cyberattack against a U.S. company, a first since the war started",https://www.nbcnews.com/world/iran/iran-appears-conducted-significant-cyberattack-us-company-first-war-st-rcna263084,0.97,6856,0,6856
6,worldnews,Kremlin says Britain was involved in Ukraine's missile strike on Russia,https://www.reuters.com/world/europe/kremlin-says-britain-was-involved-ukraines-missile-strike-russia-2026-03-11/,0.97,5734,0,5734
7,worldnews,Outrage in Gaza as Hamas kills civilians in crackdown on critics,https://www.ynetnews.com/article/h111esik9wg,0.86,4942,0,4942
8,worldnews,"Iran says oil will reach $200 a barrel, warns of 'continuous strikes'",https://www.reuters.com/business/energy/iran-says-oil-will-reach-200-barrel-warns-continuous-strikes-2026-03-11/,0.94,4826,0,4826
9,worldnews,"Iran demands guarantee of no future US, Israel attacks to sign ceasefire",https://www.jpost.com/middle-east/iran-news/article-889644,0.95,4750,0,4750
10,worldnews,"Trump tells Axios there's ""practically nothing left"" to target in Iran",https://www.axios.com/2026/03/11/trump-iran-war-end-withdrawal,0.95,3749,0,3749
11,worldnews,CNN: Russia gives Iran specific advice on using UAVs to strike US forces,https://news.liga.net/en/world/news/cnn-russia-gives-iran-specific-advice-on-using-uavs-to-strike-us-forces,0.97,2737,0,2737
12,worldnews,"US responsible for deadly missile strike on Iran school, preliminary inquiry says",https://www.theguardian.com/world/2026/mar/11/iran-war-missile-strike-elementary-school?utm_source=chatgpt.com,0.94,2550,0,2550
13,worldnews,"Iran has laid about a dozen mines in Strait of Hormuz, sources say",https://www.reuters.com/business/energy/iran-has-laid-about-dozen-mines-strait-hormuz-sources-say-2026-03-11/,0.96,1517,0,1517
14,worldnews,"Iran allows Indian tankers to pass through Strait of Hormuz; US, Israel, Europe face restrictions",https://www.news18.com/world/iran-allows-2-indian-tankers-pass-through-strait-of-hormuz-amid-rising-west-asia-conflict-ws-l-9955939.html,0.97,1273,0,1273
15,worldnews,"UN panel accuses Trump of ""racist hate speech""",https://www.axios.com/2026/03/12/trump-united-nations-racism-panel-human-rights,0.94,1136,0,1136
16,worldnews,Trump ditched plans to avoid civilian casualties before Iran strikes: report,https://www.independent.co.uk/news/world/americas/us-politics/trump-iran-strike-hegseth-civilian-deaths-b2936723.html,0.96,1005,0,1005
17,worldnews,Italy’s Meloni criticises US war on Iran as part of dangerous trend,https://www.reuters.com/world/middle-east/italys-meloni-criticises-us-war-iran-part-dangerous-trend-2026-03-11/,0.95,1003,0,1003
18,worldnews,Iran Warns US Tech Firms Could Become Targets as War Expands,https://www.wired.com/story/iran-warns-us-tech-firms-could-become-targets-as-war-expands/,0.95,999,0,999
19,worldnews,"US intelligence says Iran government is not at risk of collapse, say sources",https://www.reuters.com/business/media-telecom/us-intelligence-says-iran-government-is-not-risk-collapse-say-sources-2026-03-11/,0.95,824,0,824
20,worldnews,Hasty redeployment of US missiles from South Korea to Middle East leaves Seoul rattled,https://www.theguardian.com/world/2026/mar/11/redeployment-us-missiles-thaad-south-korea-middle-east-seoul-iran,0.95,663,0,663
21,worldnews,Trump and Iran signal no quick end to war as tankers burn in Iraqi waters,https://www.reuters.com/world/middle-east/trump-iran-signal-no-quick-end-war-tankers-burn-iraqi-waters-2026-03-12/,0.94,348,0,348
22,worldnews,Spain permanently withdraws ambassador as rift with Israel deepens,https://www.reuters.com/world/middle-east/spain-removes-ambassador-israel-2026-03-11/,0.87,302,0,302
23,worldnews,/r/WorldNews Discussion Thread: US and Israel launch attack on Iran; Iran retaliates (Thread #7),https://www.reddit.com/r/worldnews/comments/1rovoj2/rworldnews_discussion_thread_us_and_israel_launch/,0.89,245,0,245
24,worldnews,"/r/WorldNews Live Thread: Russian Invasion of Ukraine Day 1477, Part 1 (Thread #1624)",https://www.reddit.com/r/worldnews/comments/1rrgkwd/rworldnews_live_thread_russian_invasion_of/,0.95,119,0,119
