,subreddit,title,url,upvote_ratio,ups,downs,score
0,worldnews,Russia decides not to broadcast the Olympics for the first time in 40 years,https://novayagazeta.eu/articles/2024/07/14/russia-decides-not-to-broadcast-the-olympics-for-the-first-time-in-40-years-en-news,0.95,15175,0,15175
1,worldnews,A German Muslim woman has been barred from working as a lay judge because she wears a headscarf which was alleged to be in violation of the requirement of neutrality. The matter is now before the constitutional court,https://www.dw.com/en/german-lay-judge-challenges-a-headscarf-ban-in-court/a-69648119,0.9,11741,0,11741
2,worldnews,Scotland's former first minister Humza Yousaf faces probe after quarter-million donation to Gaza,https://www.jpost.com/international/article-810318,0.87,7529,0,7529
3,worldnews,"Ukraine has right to strike military targets within Russian territory, Stoltenberg says",https://kyivindependent.com/ukraine-has-right-to-strike-military-targets-within-russian-territory-stoltenberg-says/?utm_source=flipboard&amp;utm_content=topic%2Fukrainecrisis,0.96,6433,0,6433
4,worldnews,"Tax the super-rich, ex-leaders tell G20",https://www.reuters.com/world/tax-super-rich-ex-leaders-tell-g20-2024-07-11/,0.95,5391,0,5391
5,worldnews,Russia reaches out to Pentagon for call after NATO summit,https://thehill.com/policy/defense/4769153-austin-speaks-russia-nato/,0.96,4604,0,4604
6,worldnews,Russian Artist Jailed 9 Years for Donating ‘$30 to Ukraine Army’,https://www.themoscowtimes.com/2024/07/12/russian-artist-jailed-9-years-for-donating-30-to-ukraine-army-reports-a85701,0.96,3567,0,3567
7,worldnews,South Korea to mass produce lasers that can take out drones at $1.50 a hit,https://edition.cnn.com/2024/07/11/asia/south-korea-antidrone-lasers-intl-hnk-ml/index.html,0.97,3531,0,3531
8,worldnews,"39 tanks, HIMARS and ammunition: Germany covertly hands over huge shipment of weapons to Ukraine",https://euromaidanpress.com/2024/07/14/39-tanks-himars-and-ammunition-germany-covertly-hands-over-huge-shipment-of-weapons-to-ukraine/,0.97,3281,0,3281
9,worldnews,Canada takes step to acquire up to 12 submarines to guard Arctic,https://ca.news.yahoo.com/canada-takes-step-acquire-12-214217556.html,0.96,2889,0,2889
10,worldnews,Treason and espionage cases are rising in Russia since the war in Ukraine began,https://apnews.com/article/russia-putin-crackdown-treason-espionage-gershkovich-ee99b15588fc0c3b20ed0e381afe3de3,0.96,1894,0,1894
11,worldnews,Tehran slams Argentina's ‘Iranophobic’ statements as Milei doubles down,https://www.iranintl.com/en/202407135617,0.89,1551,0,1551
12,worldnews,"Russia accused Australia of inciting ""anti-Russian paranoia"" for charging a Russian-born couple with espionage",https://www.reuters.com/world/moscow-condemns-australia-paranoia-espionage-arrests-russia-born-couple-2024-07-13/,0.92,1443,0,1443
13,worldnews,Kenyan police find more female body parts at Nairobi garbage dump,https://www.theguardian.com/world/article/2024/jul/13/kenya-police-find-more-female-body-parts-at-nairobi-garbage-dump,0.97,1301,0,1301
14,worldnews,Made In India Shoes For Russian Soldiers: Bihar Shoe Manufacturing Unit Grabs Eyeballs,https://www.etvbharat.com/en/!state/made-in-india-shoes-for-russian-soldiers-bihar-shoe-manufacturing-unit-grabs-eyeballs-enn24070902722,0.88,1059,0,1059
15,worldnews,IDF says senior Hamas commander Rafa Salama killed in Israeli air strike ,https://www.bbc.com/news/articles/cyx50e65wk6o,0.89,951,0,951
16,worldnews,Australian soldier charged with spying for Russia,https://www.bbc.com/news/articles/c51yl3pvl1xo,0.94,829,0,829
17,worldnews,"China, Russia start joint naval drills, days after NATO allies called Beijing a Ukraine war enabler",https://apnews.com/article/china-russia-joint-naval-drills-nato-ukraine-08590a566d76ae1ddc47dde7cea8ad1a,0.95,739,0,739
18,worldnews,"Canada to formally apologize to 9 Dakota, Lakota Nations for historic designation as refugees | CBC News",https://www.cbc.ca/news/canada/manitoba/manitoba-sask-apology-dakota-lakota-1.7263101,0.86,407,0,407
19,worldnews,Austria appoints commission to try to ditch Russian gas contract,https://www.reuters.com/business/energy/austria-appoints-commission-try-ditch-russian-gas-contract-2024-07-09/,0.96,403,0,403
20,worldnews,New UK gov't approves 3 huge solar farms &amp; wants to expand rooftop installs,https://electrek.co/2024/07/14/new-uk-govt-approves-3-huge-solar-farms-wants-to-expand-rooftop-installs/,0.96,312,0,312
21,worldnews,Stoltenberg on Poland potentially shooting down missiles over Ukraine: NATO will not be involved in the conflict,https://www.pravda.com.ua/eng/news/2024/07/14/7465666/,0.9,230,0,230
22,worldnews,"/r/WorldNews Live Thread: Russian Invasion of Ukraine Day 872, Part 1 (Thread #1019)",https://www.reddit.com/live/18hnzysb1elcs,0.96,224,0,224
23,worldnews,Latvia constitutional court upholds law converting Russian language schools to Latvian,https://www.jurist.org/news/2024/07/latvia-constitutional-court-upholds-law-converting-russian-language-schools-to-latvian/,0.93,181,0,181
24,worldnews,Whooping cough: Nine infant deaths reported in England as cases keep rising ,https://www.bbc.com/news/articles/cye0w4j384ro.amp,0.94,178,0,178
25,worldnews,Japan sets policy against fully autonomous lethal weapons,https://english.kyodonews.net/news/2024/07/927383440e76-japan-sets-policy-against-fully-autonomous-lethal-weapons.html,0.94,92,0,92
26,worldnews,/r/WorldNews Live Thread for Israel-Hamas War (Thread #58),https://www.reddit.com/live/1bsso361afr0r,0.67,69,0,69
