,subreddit,title,url,upvote_ratio,ups,downs,score
0,worldnews,"World has 6 months to avert major food crisis, says UN as Hormuz struggle drags on",https://www.politico.eu/article/un-6-month-window-to-avert-food-price-crisis-from-hormuz-closure/,0.95,11887,0,11887
1,worldnews,"Ukraine’s capital Kyiv hit by massive missile, drone attack",https://www.reuters.com/world/europe/ukraines-capital-kyiv-hit-by-massive-missile-drone-attack-2026-05-23/,0.97,9401,0,9401
2,worldnews,Eighteen suspected Ebola patients escape after treatment tent is set on fire for a second time in Congo,https://www.pbs.org/newshour/world/eighteen-suspected-ebola-patients-escape-after-treatment-tent-is-set-on-fire-for-a-second-time-in-congo,0.98,9389,0,9389
3,worldnews,Iran says Trump’s Hormuz reopening claim ‘far from reality’,https://gulfnews.com/world/mena/iran-says-trumps-hormuz-reopening-claim-far-from-reality-1.500551409-1.500551409,0.97,6844,0,6844
4,worldnews,Ukraine Strikes Russian Warship Admiral Essen for Fourth Time,https://united24media.com/war-in-ukraine/you-wont-hide-ukraine-strikes-russian-warship-admiral-essen-for-fourth-time-19110,0.98,6042,0,6042
5,worldnews,Israeli minister Ben-Gvir banned from access to French territory,https://www.reuters.com/world/middle-east/israeli-minister-ben-gvir-banned-access-french-territory-2026-05-23/,0.96,5596,0,5596
6,worldnews,"Zelenskyy: Russians likely preparing Oreshnik missile strike, particularly on Kyiv",https://www.pravda.com.ua/eng/news/2026/05/23/8036107/,0.97,5269,0,5269
7,worldnews,"UAE joins Saudi Arabia, Qatar in urging Trump not to restart Iran war",https://www.straitstimes.com/world/middle-east/uae-joins-saudi-arabia-qatar-in-urging-trump-not-to-restart-iran-war,0.96,4357,0,4357
8,worldnews,"Zelenskyy tells EU leaders ""associate membership"" proposal is unfair",https://www.pravda.com.ua/eng/news/2026/05/23/8036063/,0.93,3211,0,3211
9,worldnews,Clashes in Spain: Gaza flotilla activists beaten by police at Bilbao airport,https://www.ynetnews.com/article/00e5bg3ww,0.88,2653,0,2653
10,worldnews,Suspected Ebola cases triple in a week as WHO warns of rapid spread in DRC,https://www.theguardian.com/global-development/2026/may/22/suspected-ebola-cases-triple-in-a-week-as-who-warns-of-rapid-spread-in-drc,0.97,2354,0,2354
11,worldnews,"Sweden backs Ukraine’s path to NATO, defense minister says",https://www.politico.eu/article/sweden-defense-minister-backs-ukraine-nato-membership/,0.98,2261,0,2261
12,worldnews,Ukraine says it hit Russia's Sheskharis oil terminal on Black Sea,https://www.reuters.com/world/europe/ukraine-says-it-hit-russias-sheskharis-oil-terminal-black-sea-2026-05-23/,0.98,1626,0,1626
13,worldnews,"Zelenskyy responds to Merz: Ukraine has been defending Europe fully, not with half measures and has to have right to vote in EU",https://euromaidanpress.com/2026/05/24/zelenskyy-responds-to-merz-ukraine-has-been-defending-europe-fully-not-with-half-measures-and-has-to-have-right-to-vote-in-eu/,0.92,938,0,938
14,worldnews,UK faces 'economic catastrophe' unless it adapts to young people 'rewired by smartphones',https://news.sky.com/story/uk-faces-economic-catastrophe-unless-it-adapts-to-young-people-rewired-by-smartphones-13547229,0.87,835,0,835
15,worldnews,"U.S. and Iran are closing in on a 60-day ceasefire extension with nuclear framework, FT reports",https://www.cnbc.com/2026/05/23/us-iran-war-talks.html,0.89,766,0,766
16,worldnews,Germany's far-right AfD vows to 'make history',https://www.dw.com/en/germany-far-right-afd-saxony-anhalt-elections-ulrich-siegmund-right-wing-extremism/a-77252189,0.87,615,0,615
17,worldnews,‘Canada is handing people over to ICE’: refugees rejected at border face US detention,https://www.theguardian.com/world/2026/may/23/canadians-refugees-rejected-face-ice-detention,0.72,489,0,489
18,worldnews,Iran’s internet blackout enters 13th week,https://caliber.az/en/post/netblocks-iran-s-internet-blackout-enters-13th-week,0.92,489,0,489
19,worldnews,Russia launches heavy missile strikes on Kyiv after Ukraine drone attack,https://www.cbsnews.com/news/russia-launches-heavy-kyiv-missile-strikes-ukraine-drone-attack/,0.83,330,0,330
20,worldnews,Venezuela’s Machado vows another run for presidency and eyes a return from exile by end of 2026,https://apnews.com/article/panama-venezuela-opposition-machado-nobel-4f3c9306b348040f63a43c82272f141b?utm_source=reddit&amp;utm_medium=share,0.86,273,0,273
21,worldnews,"/r/WorldNews Live Thread: Russian Invasion of Ukraine Day 1550, Part 1 (Thread #1697)",https://www.reddit.com/live/18hnzysb1elcs,0.94,199,0,199
22,worldnews,‘Massive’ Russian missile barrage hits Kyiv after Putin orders retaliation for deadly Ukrainian attack,https://edition.cnn.com/2026/05/23/europe/putin-ukraine-strike-starobilsk-intl,0.79,105,0,105
23,worldnews,Dozens of people feared trapped after building collapse in the Philippines,https://www.abc.net.au/news/2026-05-24/dozens-feared-trapped-in-philippines-building-collapse/106715858,0.93,104,0,104
24,worldnews,/r/WorldNews Discussion Thread: US and Israel launch attack on Iran; Iran retaliates (Thread #18),https://www.reddit.com/r/worldnews/comments/1tlutp0/rworldnews_discussion_thread_us_and_israel_launch/,0.78,83,0,83
