,subreddit,title,url,upvote_ratio,ups,downs,score
0,worldnews,Belgium freezes Russian assets worth EUR 58 billion,https://news.yahoo.com/belgium-freezes-russian-assets-worth-095100114.html,0.93,50153,0,50153
1,worldnews,"Ukraine says if Russia tries to invade from Belarus again, this time, it's ready - with ""presents""",https://www.cbsnews.com/news/ukraine-news-russia-war-belarus-invasion-preparation/,0.9,38487,0,38487
2,worldnews,Russia reports fighting on its territory for the first time,https://www.lemonde.fr/en/international/article/2023/03/03/russia-reports-fighting-on-its-territory-for-the-first-time_6018036_4.html,0.95,11616,0,11616
3,worldnews,Ukrainians say they were pressured to register babies as Russian during occupation,https://www.jpost.com/international/article-733291,0.96,5301,0,5301
4,worldnews,Ukrainian commander says there are more Russians attacking the city of Bakhmut than there is ammo to kill them,https://www.businessinsider.com/ukraine-commander-calls-bakhmut-critical-more-russians-attacking-than-ammo-2023-3?amp,0.97,3814,0,3814
5,worldnews,Belarus court sentences Nobel Peace Prize winner to 10 years in prison -TASS,https://www.reuters.com/world/europe/belarus-court-sentences-nobel-peace-prize-winner-10-years-prison-tass-2023-03-03/,0.97,3423,0,3423
6,worldnews,EU tells Italy to recoup unpaid property tax from Church,https://www.ansa.it/english/news/vatican/2023/03/03/eu-tells-italy-to-recoup-unpaid-property-tax-from-church_f1fb65e6-8976-4e10-ad58-21f7d7586242.html,0.97,3229,0,3229
7,worldnews,Attorney General Merrick Garland makes unannounced trip to Ukraine,https://www.cnn.com/2023/03/03/politics/merrick-garland-ukraine,0.95,3011,0,3011
8,worldnews,"Russia Must Be Punished For Ukraine War, Quad Says After Delhi Meet",https://www.ndtv.com/world-news/russia-must-be-punished-for-ukraine-war-quad-says-after-delhi-meet-3830670,0.95,2149,0,2149
9,worldnews,"Russia will be out of 'military tools' by spring, Ukraine's top military spy says",https://www.usatoday.com/story/news/world/2023/03/02/war-top-ukraine-spy-says-russia-out-of-military-tools/11310628002/,0.94,1860,0,1860
10,worldnews,Putin Orders New Rules for Defense Firms in Case of Martial Law,https://news.yahoo.com/putin-orders-rules-defense-firms-121705365.html,0.95,1680,0,1680
11,worldnews,US sending bridge-launchers to Ukraine for spring fight,https://apnews.com/article/ukraine-weapons-russia-biden-war-0e52e87ade3d2300da8be14a3ebcc9ff,0.96,1185,0,1185
12,worldnews,U.S. intel on China considering lethal aid for Putin's war was gleaned from Russian officials,https://www.nbcnews.com/politics/us-intel-china-considering-lethal-aid-putins-war-was-gleaned-russian-o-rcna72994,0.95,1088,0,1088
13,worldnews,Russian oligarch warns his country could be broke by 2024,https://www.yahoo.com/news/russian-oligarch-warns-country-could-223600780.html,0.94,730,0,730
14,worldnews,"India is smashing records once again as it accelerates its purchases of Russian oil for a third straight month, reaching 1.9 million barrels per day in February",https://www.telegraphindia.com/india/indias-purchases-of-russian-oil-set-new-records-yet-again/cid/1920176,0.9,707,0,707
15,worldnews,India joins Quad to slam Russia on nuclear-threat in Ukraine,https://www.deccanherald.com/national/india-joins-quad-to-slam-russia-on-nuclear-threat-in-ukraine-1196775.html,0.91,612,0,612
16,worldnews,Oligarch’s lawyers say UK caused serious hardship by freezing assets,https://www.theguardian.com/business/2023/mar/03/oligarchs-lawyers-uk-caused-serious-hardship-freezing-assets-eugene-shvidler,0.93,546,0,546
17,worldnews,Newly discovered chemicals are so deadly to fungi they are named after Keanu Reeves,https://www.cnn.com/2023/03/03/world/keanumycin-fungus-killer-discovery-scn/index.html,0.89,482,0,482
18,worldnews,"Two dead, dozens of police held hostage in Colombia in protest against oil company",https://www.reuters.com/world/americas/two-dead-dozens-police-held-hostage-colombia-protest-against-oil-company-2023-03-02/,0.97,459,0,459
19,worldnews,"I'm Bel Trew, The Independent's International Correspondent, and I've been in Ukraine since the outbreak of the war. AMA!",https://www.reddit.com/r/worldnews/comments/11gwfl1/im_bel_trew_the_independents_international/,0.89,321,0,321
20,worldnews,"/r/WorldNews Live Thread: Russian Invasion of Ukraine Day 374, Part 1 (Thread #515)",https://www.reddit.com/live/18hnzysb1elcs,0.96,223,0,223
21,worldnews,Iran president blames foreign enemies for wave of schoolgirl poisonings,https://www.dawn.com/news/1740171,0.91,205,0,205
22,worldnews,"Biden, Scholz pledge to punish Russia over Ukraine war",https://www.aljazeera.com/news/2023/3/4/biden-scholz-pledge-to-punish-russia-for-ukraine-war,0.93,176,0,176
23,worldnews,"China uses trade as weapon, wants world to be dependent on it: Tony Abbott",https://www.business-standard.com/article/international/china-uses-trade-as-weapon-wants-world-to-be-dependent-on-it-tony-abbott-123030400037_1.html,0.83,163,0,163
24,worldnews,"Australia’s ‘quiet diplomacy’ approach to human rights in India has failed, advocates say | Australian foreign policy",https://www.theguardian.com/world/2023/mar/03/australias-quiet-diplomacy-approach-to-human-rights-in-india-has-failed-advocates-say,0.88,84,0,84
25,worldnews,Russian Foreign Minister ridiculed in India,https://news.yahoo.com/russian-foreign-minister-ridiculed-india-165315447.html,0.92,83,0,83
26,worldnews,"Russia could run out of money next year, says oligarch Oleg Deripaska",https://www.theguardian.com/world/2023/mar/02/russia-run-out-of-money-oleg-deripaska,0.88,77,0,77
