,subreddit,title,url,upvote_ratio,ups,downs,score
0,worldnews,France seeks to ban social media for children under 15,https://www.lemonde.fr/en/france/article/2025/12/31/france-seeks-to-ban-social-media-for-children-under-15_6748972_7.html,0.97,22492,0,22492
1,worldnews,Finland detains ship after critical undersea cable damaged,https://edition.cnn.com/2025/12/31/europe/finland-estonia-undersea-cable-ship-detained-intl,0.98,14894,0,14894
2,worldnews,"Xi Jinping vows to reunify China and Taiwan in New Year’s Eve speech - Reunification ‘is unstoppable’, says Chinese president",https://www.theguardian.com/world/2025/dec/31/xi-jinping-vows-reunification-china-taiwan-new-years-eve-speech,0.94,13156,0,13156
3,worldnews,Chechen leader Kadryov urgently hospitalised in Moscow,https://www.pravda.com.ua/eng/news/2025/12/31/8014171/,0.97,11392,0,11392
4,worldnews,AI-generated videos showing young and attractive women promote Poland's EU exit,https://www.euronews.com/2025/12/30/ai-generated-videos-showing-young-and-attractive-women-promote-polands-eu-exit,0.95,9330,0,9330
5,worldnews,[Ireland throughout 2025] No gun killings in the country for first time in nearly 60 years,https://m.independent.ie/irish-news/courts/no-gun-killings-in-the-country-for-first-time-in-nearly-60-years-as-30-people-die-in-suspicious-circumstances-in-2025/a1769030315.html,0.98,4645,0,4645
6,worldnews,"Iranian protests expand beyond the economy as students demand freedom, end to regime rule",https://abcnews.go.com/amp/International/iranian-protests-expand-economy-students-demand-freedom-end/story?id=128780906,0.98,4308,0,4308
7,worldnews,17 tons of fuel stolen from frontline unit: Ukraine arrests commander and subordinate for wartime embezzlement,https://euromaidanpress.com/2025/12/30/17-tons-of-fuel-stolen-from-frontline-unit-ukraine-arrests-commander-and-subordinate-for-wartime-embezzlement/,0.98,4150,0,4150
8,worldnews,"CIA assesses Ukraine was not targeting a Putin residence in drone attack, contrary to Kremlin claim, sources say",https://www.ctvnews.ca/world/article/cia-assesses-ukraine-was-not-targeting-a-putin-residence-in-drone-attack-contrary-to-kremlin-claim-sources-say/,0.98,3425,0,3425
9,worldnews,Billionaires added record $2.2tn in wealth in 2025,https://www.theguardian.com/news/2025/dec/31/billionaires-added-record-wealth-2025,0.95,2909,0,2909
10,worldnews,Zelenskiy says he won’t sign weak deal that will only prolong war,https://www.reuters.com/world/zelenskiy-says-he-wont-sign-weak-deal-that-will-only-prolong-war-2025-12-31/,0.98,2661,0,2661
11,worldnews,"In Russia, plans to cut mobile internet on New Year’s Eve draw fury",https://www.washingtonpost.com/world/2025/12/31/russia-mobile-internet-blackout-moscow/,0.96,2555,0,2555
12,worldnews,Nepal Is Throwing Out Its Decade-Old Scheme to Clean Mount Everest,https://gizmodo.com/nepal-is-throwing-out-its-decade-long-scheme-to-clean-mount-everest-2000704407,0.96,2530,0,2530
13,worldnews,Finland seizes ship sailing from Russia after suspected cable sabotage in Baltic Sea,https://www.reuters.com/world/finland-suspects-ship-causing-undersea-cable-damage-president-says-2025-12-31/,0.99,2167,0,2167
14,worldnews,"Russia opposes referendum because it can’t call Ukrainian people “illegitimate,” Zelenskyy says",https://euromaidanpress.com/2025/12/31/russia-opposes-referendum-ukrainian-people-illegitimate-zelenskyy/,0.96,1574,0,1574
15,worldnews,Venezuela Detains U.S. Citizens Amid Trump Administration’s Growing Pressure,https://www.nytimes.com/2025/12/31/world/americas/venezuela-detained-americans.html,0.97,974,0,974
16,worldnews,Trump Shares Editorial Critical of Putin After Setback in Talks,https://www.bloomberg.com/news/articles/2025-12-31/trump-shares-editorial-critical-of-putin-after-setback-in-talks,0.94,674,0,674
17,worldnews,Mass protests sweep Somalia after Israel recognizes breakaway Somaliland,https://www.rfi.fr/en/africa/20251231-mass-protests-sweep-somalia-after-israel-recognises-breakaway-somaliland,0.9,480,0,480
18,worldnews,Oil prices log steepest annual drop since 2020,https://www.reuters.com/business/energy/oil-slips-brent-heads-longest-stretch-annual-losses-2025-2025-12-31/,0.96,437,0,437
19,worldnews,"For Ukrainians, a nuclear missile museum is a bitter reminder of what the country gave up",https://www.npr.org/2025/12/28/g-s1-103485/ukraine-museum-strategic-missile-forces-budapest-agreement,0.93,387,0,387
20,worldnews,Taiwan vows to defend sovereignty after China’s military drill,https://www.reuters.com/world/china/taiwan-vows-defend-sovereignty-after-chinas-military-drill-2026-01-01/,0.94,251,0,251
21,worldnews,Russians welcome New Year under drone strikes: oil depots on fire in Kaluga Oblast and Krasnodar Krai,https://www.pravda.com.ua/eng/news/2026/01/01/8014210/,0.98,191,0,191
22,worldnews,"Currency Crisis in Iran: New Central Bank Head Named After Rial Plunges to 1,450,000 per Dollar, Sparking Nationwide Unrest",https://www.euronews.com/2025/12/31/iran-appoints-new-central-bank-governor-after-protests-as-currency-hits-record-low,0.97,150,0,150
23,worldnews,EU's top diplomat rejects Russian claims of Ukrainian attack on government sites,https://www.bbc.com/news/articles/c0q4e4e4ldyo,0.94,142,0,142
24,worldnews,"/r/WorldNews Live Thread: Russian Invasion of Ukraine Day 1407, Part 1 (Thread #1554)",https://www.reddit.com/live/18hnzysb1elcs,0.96,78,0,78
