,subreddit,title,url,upvote_ratio,ups,downs,score
0,worldnews,Russia Complains of Ukraine Military's 'Aggressive Behavior',https://www.newsweek.com/russia-complains-ukraine-military-aggressive-behavior-sergey-vershinin-turkey-1766296,0.89,57548,0,57548
1,worldnews,"Nearly half of COVID patients worldwide still have symptoms after 4 months, according to a giant new study",https://finance.yahoo.com/news/nearly-half-covid-patients-worldwide-202324231.html,0.92,22594,0,22594
2,worldnews,Putin cancels annual press conference for the first time in 10 years,https://www.pravda.com.ua/eng/news/2022/12/12/7380383/,0.97,18654,0,18654
3,worldnews,"Trust between the West and Russia has been destroyed, NATO chief says",https://www.cnbc.com/2022/12/12/trust-between-the-west-and-russia-has-been-destroyed-nato-chief-says.html,0.97,9899,0,9899
4,worldnews,Iran Hangs Man In Public In Second Execution Linked To Protests,https://www.rferl.org/a/iran-second-execution-protests/32172423.html,0.97,7585,0,7585
5,worldnews,Second Journalist Dies While Covering Qatar World Cup,https://www.thedailybeast.com/second-journalist-dies-while-covering-qatar-world-cup-after-grant-wahl?ref=wrap,0.94,6343,0,6343
6,worldnews,Nestle to launch new Ukraine facility in rare war-time investment,https://www.reuters.com/business/retail-consumer/nestle-launch-new-ukraine-facility-rare-war-time-investment-2022-12-12/,0.9,6154,0,6154
7,worldnews,Bolsonaro supporters try to invade police HQ as post-election tensions spark,https://www.reuters.com/world/americas/supporters-brazils-bolsonaro-try-invade-federal-police-headquarters-2022-12-13/,0.96,3578,0,3578
8,worldnews,Ukraine War Will End Once Putin Dies: Zelensky,https://www.ibtimes.com/ukraine-war-will-end-once-putin-dies-zelensky-3646420,0.94,3245,0,3245
9,worldnews,Freed Russian arms dealer Bout joins Kremlin-loyal ultranationalist party,https://www.reuters.com/world/europe/freed-russian-arms-dealer-bout-joins-kremlin-loyal-ultranationalist-party-2022-12-12/,0.93,2797,0,2797
10,worldnews,US banks named as being among least ethical UK operators,https://www.theguardian.com/money/2022/dec/12/us-banks-named-as-being-among-least-ethical-uk-operators,0.95,1475,0,1475
11,worldnews,Police raid more EU Parliament offices in corruption probe,https://apnews.com/article/politics-qatar-persian-gulf-tensions-ursula-von-der-leyen-europe-1414e2c776c7b7f9a5672cd8181aba8e,0.97,957,0,957
12,worldnews,"Six people killed at Queensland property, including two police officers ambushed by shooters | Australian police and policing",https://www.theguardian.com/australia-news/2022/dec/12/fears-for-police-officers-involved-in-shooting-incident-in-regional-queensland,0.95,776,0,776
13,worldnews,Russia Could Resume Trade With Germany If Putin Ends War: German Chancellor,https://www.ndtv.com/world-news/russia-could-resume-trade-with-germany-if-vladimir-putin-ends-ukraine-war-german-chancellor-olaf-scholz-3601426,0.94,714,0,714
14,worldnews,China slams U.S. sanctions over alleged rights abuses in Tibet,https://www.reuters.com/world/china/china-slams-us-sanctions-over-alleged-rights-abuses-tibet-2022-12-12/,0.87,676,0,676
15,worldnews,"Israeli military admits shooting 16-year-old Palestinian girl, calls it ‘unintentional’",https://www.cnn.com/2022/12/12/middleeast/palestinian-girl-killed-idf-raid-intl/index.html,0.87,665,0,665
16,worldnews,US sends first shipment of power equipment in aid to Ukraine,https://www.jpost.com/breaking-news/article-724720,0.95,558,0,558
17,worldnews,Jacinda Ardern caught on hot mic calling minor opposition party leader an ‘arrogant prick’ | New Zealand PM apologised for comment made live on parliament television during question time,https://www.theguardian.com/world/2022/dec/13/jacinda-arden-caught-on-hot-mic-calling-minor-opposition-party-leader-an-arrogant-prick,0.95,465,0,465
18,worldnews,"Reichsbürger: Conspirators planned new army for coup | Germany's Bundestag held sessions to debate investigation into a coup, planned by far-right extremists. Prosecutors said the suspects planned to set up 280 armed units across Germany to facilitate the plot.",https://www.dw.com/en/reichsb%C3%BCrger-conspirators-planned-new-army-for-coup/a-64066794,0.93,414,0,414
19,worldnews,Nurses will strike this week in UK after talks with health secretary stall,https://www.theguardian.com/society/2022/dec/12/uk-ministers-accused-of-making-false-claims-on-efforts-to-avert-nurses-strike,0.95,273,0,273
20,worldnews,"/r/WorldNews Live Thread: Russian Invasion of Ukraine Day 293, Part 1 (Thread #434)",https://www.reddit.com/live/18hnzysb1elcs,0.97,270,0,270
21,worldnews,"Far-right French politician rips sending Ukraine weapons: ""Total madness""",https://www.newsweek.com/far-right-french-politician-rips-sending-ukraine-weapons-total-madness-1766236,0.67,247,0,247
22,worldnews,New Zealand passes world-first tobacco law to ban smoking by 2025 | The country is believed to be the first to implement an annually rising legal smoking age to outlaw the habit for the next generation,https://www.theguardian.com/world/2022/dec/13/new-zealand-passes-world-first-tobacco-law-to-ban-smoking-by-2025,0.96,218,0,218
23,worldnews,"EU slaps sanctions on Iranian officials over protest crackdown, Russia drone sales",https://www.timesofisrael.com/eu-slaps-sanctions-on-iranian-officials-over-protest-crackdown-russia-drone-sales/,0.95,198,0,198
24,worldnews,U.S. sends first shipment of power gear to aid Ukraine,https://www.reuters.com/world/us-sends-first-shipment-power-gear-aid-ukraine-2022-12-13/,0.93,159,0,159
25,worldnews,Dog therapy for kids facing the trauma of the war in Ukraine,https://apnews.com/article/russia-ukraine-health-government-children-85b03030e7be58abc80bf501f3d8bf48,0.91,98,0,98
26,worldnews,Iran soccer player sentenced to death by hanging: Former Iranian soccer player Amir Nasr-Azadani sentenced to death by his country’s regime for campaigning for women’s rights.,https://en.as.com/soccer/iran-soccer-player-sentenced-to-death-by-hanging-n/,0.98,67,0,67
