,subreddit,title,url,upvote_ratio,ups,downs,score
0,worldnews,"Russia Deploys Silok Jammers To Ground Ukraine’s Drones. Ukraine Hunts Down The Siloks With, You Guessed It, Drones.",https://www.forbes.com/sites/davidaxe/2024/01/21/russia-deploys-silok-jammers-to-ground-ukraines-drones-ukraine-hunts-down-the-siloks-with-you-guessed-it-drones/?sh=37e6572a5acf,0.96,7077,0,7077
1,worldnews,"US, Egypt, Qatar said pushing plan to end war, free hostages, form Palestinian state",https://www.timesofisrael.com/us-egypt-qatar-said-pushing-plan-to-end-war-free-hostages-form-palestinian-state/,0.93,5041,0,5041
2,worldnews,Russia will consider property confiscations for those convicted of discrediting the army,https://ktla.com/news/nationworld/ap-international/ap-russia-will-consider-property-confiscations-for-those-convicted-of-discrediting-the-army/,0.95,3735,0,3735
3,worldnews,"Zelenskyy downplays need to conscript 500,000 reservists but says mobilization law still critical",https://news.yahoo.com/zelenskyy-downplays-conscript-500-000-130000800.html,0.95,3477,0,3477
4,worldnews,Russian seaport terminal on fire,https://kyivindependent.com/media-russian-seaport-terminal-on-fire/,0.97,3026,0,3026
5,worldnews,"Zelenskyy: We need to think how to hold elections but currently, law forbids it",https://www.pravda.com.ua/eng/news/2024/01/21/7438259/,0.95,2845,0,2845
6,worldnews,For releasing hostages: Hamas wants guarantees it stays standing,https://www.ynetnews.com/article/hklmpntfa,0.9,2695,0,2695
7,worldnews,Netanyahu: Israel rejects Hamas's terms of surrender,https://www.jns.org/netanyahu-i-reject-hamass-terms-of-surrender/,0.86,2611,0,2611
8,worldnews,"Greenland losing 30m tonnes of ice an hour, study reveals",https://www.theguardian.com/environment/2024/jan/17/greenland-losing-30m-tonnes-of-ice-an-hour-study-reveals,0.92,2151,0,2151
9,worldnews,"Two US Navy SEALs missing off the coast of Somalia are dead, officials say | CNN Politics",https://www.cnn.com/2024/01/21/politics/navy-seals-dead-somalia/index.html,0.97,1805,0,1805
10,worldnews,EU's top diplomat: Palestinian state may need to be imposed on Israel from outside,https://www.timesofisrael.com/us-says-no-way-to-ensure-israels-long-term-security-without-a-palestinian-state/,0.82,1307,0,1307
11,worldnews,Shapps 'disappointed' by Netanyahu opposition to Palestinian state,https://www.bbc.com/news/uk-politics-68046625,0.84,1203,0,1203
12,worldnews,Six people missing after private jet crashes in Afghanistan,https://www.theguardian.com/world/2024/jan/21/private-jet-crash-afghanistan-thailand-russia,0.94,974,0,974
13,worldnews,Crackdown On Hijab Intensifies In Iran,https://www.iranintl.com/en/202401212102,0.92,816,0,816
14,worldnews,Russia suspends operations at fuel export terminal after suspected Ukrainian drone attack,https://www.reuters.com/world/fire-erupts-russias-novatek-baltic-sea-terminal-after-explosions-heard-2024-01-21/,0.96,775,0,775
15,worldnews,Netanyahu: We reject ‘outright’ Hamas demands for hostage deal,https://m.jpost.com/israel-hamas-war/article-783098,0.86,670,0,670
16,worldnews,China defies sanctions to make Russia its biggest oil supplier in 2023,https://www.cnbc.com/2024/01/21/china-defies-sanctions-to-make-russia-its-biggest-oil-supplier-in-2023.html,0.91,515,0,515
17,worldnews,"S. Korea sees N.K.'s claimed test of underwater nuclear attack drone as 'exaggerated, fabricated'",https://en.yna.co.kr/view/AEN20240121003800315?section=nk/nk,0.96,504,0,504
18,worldnews,Tobacco use declining despite industry interference: WHO,https://news.un.org/en/story/2024/01/1145552,0.94,494,0,494
19,worldnews,/r/WorldNews Live Thread for 2023 Israel-Hamas Crisis (Thread 45),https://www.reddit.com/live/1bsso361afr0r,0.84,481,0,481
20,worldnews,Putin attack on NATO ‘possible’ in 5-8 years: German defense chief,https://thehill.com/policy/international/4418042-putin-attack-nato-possible-german-defense-chief/,0.92,474,0,474
21,worldnews,EU Presidency Warns Democracy Will Be Put to the Test in US Elections in November,https://www.usnews.com/news/us/articles/2024-01-16/eu-presidency-warns-democracy-will-be-put-to-the-test-in-us-elections-in-november,0.88,404,0,404
22,worldnews,At least 27 people are reported killed in an attack on Donetsk in Russian-occupied Ukraine,https://apnews.com/article/russia-ukraine-war-0725abea3e507a8112931660617a745c,0.88,377,0,377
23,worldnews,EU countries start discussing 13th package of sanctions against Russia,https://ukranews.com/en/news/979161-eu-countries-start-discussing-13th-package-of-sanctions-against-russia,0.95,228,0,228
24,worldnews,"/r/WorldNews Live Thread: Russian Invasion of Ukraine Day 698, Part 1 (Thread #844)",https://www.reddit.com/live/18hnzysb1elcs,0.95,213,0,213
25,worldnews,'Say you're sorry': Russia's trend for humiliating videos,https://www.bbc.co.uk/news/world-europe-68016310,0.89,201,0,201
26,worldnews,"Red Sea shipping attacks pressure China's exporters as delays, costs mount",https://www.reuters.com/world/red-sea-crisis-pressures-chinas-exporters-shipping-delays-costs-mount-2024-01-19/,0.93,139,0,139
