,subreddit,title,url,upvote_ratio,ups,downs,score
0,worldnews,Zelenskyy says Russia wired a hydroelectric dam to explode and flood 80 towns in region it may have to abandon,https://www.businessinsider.com/russia-mined-a-ukrainian-dam-planned-false-flag-attack-zelenskyy-2022-10,0.92,49988,0,49988
1,worldnews,"Calls for Liz Truss not to take yearly £115,000 as ex-prime minister",https://www.bbc.co.uk/news/uk-politics-63340998,0.91,45649,0,45649
2,worldnews,Canada bans new handgun sales in latest gun control action,https://www.reuters.com/world/americas/canada-bans-new-handgun-sales-imports-latest-gun-action-2022-10-21/,0.79,38168,0,38168
3,worldnews,The U.S. Army's 101st Airborne is practicing for war with Russia just miles from Ukraine's border,https://www.cbsnews.com/news/ukraine-news-russia-us-army-101st-airborne-nato-war-games-romania/,0.86,16229,0,16229
4,worldnews,"Boris Johnson, Rishi Sunak lead race to become Britain's next prime minister",https://www.reuters.com/world/uk/boris-johnson-rishi-sunak-lead-race-become-britains-next-prime-minister-2022-10-21/,0.96,8039,0,8039
5,worldnews,Philippines to buy military helicopters from US instead of Russia,https://www3.nhk.or.jp/nhkworld/en/news/20221021_39/,0.98,7378,0,7378
6,worldnews,St Petersburg court finds Finland guilty of 'genocide' during 1940s Leningrad siege,https://yle.fi/news/3-12664441,0.91,6687,0,6687
7,worldnews,"Kremlin: No ""specific"" plans to stop Putin's draft as it nears 300K goal",https://www.newsweek.com/kremlin-no-specific-plans-stop-putins-draft-it-nears-300k-goal-1753895,0.97,4956,0,4956
8,worldnews,Australia drops recognition of Jerusalem as Israel's capital : NPR,https://www.npr.org/2022/10/18/1129609399/australia-will-end-recognition-of-jerusalem-as-israel-capital,0.92,3660,0,3660
9,worldnews,Russia Rages After Son of Putin Official Is Nabbed on U.S. Charges,https://www.yahoo.com/news/russia-rages-son-putin-official-194129795.html,0.97,2376,0,2376
10,worldnews,The Dutch Parliament endorses the establishment of the Hague Tribunal for Russian war crimes,https://www.ukrainianworldcongress.org/the-dutch-parliament-endorses-the-establishment-of-the-hague-tribunal-for-russian-war-crimes/,0.97,2251,0,2251
11,worldnews,Russia opens vast morgue in Mariupol due to extreme mortality rate,https://english.nv.ua/nation/russia-opens-massive-morgue-in-mariupol-due-to-extreme-mortality-rate-ukraine-news-50278232.html,0.97,2208,0,2208
12,worldnews,"Canada vows to hold Iran, Russia accountable for murders of Ukrainians",https://www.ukrinform.net/rubric-ato/3598486-canada-vows-to-hold-iran-russia-accountable-for-murders-of-ukrainians.html,0.96,2185,0,2185
13,worldnews,We’re Washington Post reporters who found that hundreds of veterans have taken lucrative foreign jobs that U.S. officials approved – but fought to keep secret. Ask us anything.,https://www.reddit.com/r/worldnews/comments/y9wads/were_washington_post_reporters_who_found_that/,0.94,1797,0,1797
14,worldnews,European Union gives greenlight to provide Ukraine with $18 billion in financial support over the next year,https://www.foxnews.com/us/european-union-gives-greenlight-provide-ukraine-18-billion-financial-support-next-year,0.93,1679,0,1679
15,worldnews,Afghanistan: Taliban ban women from many university subjects,https://www.bbc.co.uk/news/world-asia-63219895,0.95,1573,0,1573
16,worldnews,Russia to launch Moskvich car production at former Renault plant in December,https://www.reuters.com/business/autos-transportation/russia-launch-moskvich-car-production-former-renault-plant-december-2022-10-20/,0.94,1467,0,1467
17,worldnews,Russian mothers are turning deadbeat fathers over to Putin's military draft: 'My ex-husband died as a person a long time ago',https://www.businessinsider.com/russian-mothers-turning-deadbeat-fathers-putins-military-draft-2022-10,0.95,1396,0,1396
18,worldnews,"Strikes, protests in Europe over cost of living and pay",https://www.reuters.com/world/europe/strikes-protests-europe-over-cost-living-pay-2022-10-20/,0.96,1293,0,1293
19,worldnews,Syria reports Israeli airstrikes on suburbs of Damascus,https://abcnews.go.com/International/wireStory/syria-reports-israeli-airstrikes-suburbs-damascus-91885225,0.94,1101,0,1101
20,worldnews,Rishi Sunak leads PM race as Boris Johnson flies back to London,https://www.bbc.co.uk/news/uk-politics-63353097,0.94,1023,0,1023
21,worldnews,The U.S. Army's 101st Airborne is practicing for war with Russia just miles from Ukraine's border,https://www.cbsnews.com/amp/news/ukraine-news-russia-us-army-101st-airborne-nato-war-games-romania/,0.89,802,0,802
22,worldnews,"'This is war': Newly released court documents show police concerns over Feb. 2022 trucker blockade in Alberta, Canada",https://www.ctvnews.ca/mobile/canada/this-is-war-newly-released-court-documents-show-police-concerns-over-coutts-alta-protest-1.6118074,0.91,635,0,635
23,worldnews,Germany receives first hydrogen shipment from UAE | The first official delivery of hydrogen from the United Arab Emirates has arrived in Hamburg. Germany hopes the fuel will help replace coal and natural gas in energy-intensive industries.,https://www.dw.com/en/germany-receives-first-hydrogen-shipment-from-uae/a-63524001,0.92,346,0,346
24,worldnews,Iranian teachers call for nationwide ​​strike in protest over deaths and ​​detention of students,https://www.cnn.com/2022/10/21/middleeast/iran-teachers-nationwide-strike-students-intl/index.html,0.97,327,0,327
25,worldnews,"/r/WorldNews Live Thread: Russian Invasion of Ukraine Day 241, Part 1 (Thread #382)",https://www.reddit.com/live/18hnzysb1elcs,0.97,302,0,302
26,worldnews,Russia Rages After Son of Putin Official Is Nabbed on U.S. Charges,https://www.yahoo.com/news/russia-rages-son-putin-official-194129795.html?guccounter=1&amp;guce_referrer=aHR0cHM6Ly93d3cuZ29kbGlrZXByb2R1Y3Rpb25zLmNvbS8&amp;guce_referrer_sig=AQAAAGQv0FVxivlA7qgmCcnRG4RuSnls6B0ul6Ye4LdMHmHc9fotVqyyBrpNb7_r_q3GG5Ymih_Xf7_0Q6gTtoBnicpp8eX_lV2l1D5QIL9acTJ4m092pdR8s0rlzFNSVYxwDBaumTIGsZv8KQGg23vrISDcwiqGghT0Y4x_41NPulBe,0.92,257,0,257
