,subreddit,title,url,upvote_ratio,ups,downs,score
0,worldnews,Temperatures reach 46C in Spain as Europe heatwave continues,https://www.bbc.com/news/articles/c9dgqnndx9xo,0.97,9752,0,9752
1,worldnews,"Trump backs 500% tariff bill targeting Russian oil buyers, Senator Graham says",https://newsukraine.rbc.ua/news/trump-backs-500-tariff-bill-targeting-russian-1751210048.html,0.95,8933,0,8933
2,worldnews,Russia hits Ukraine with biggest attack of the war; F-16 pilot is killed,https://www.politico.eu/article/russia-ukraine-biggest-attack-war-f16-pilot-kill/,0.97,7635,0,7635
3,worldnews,Israel and Syria will sign a peace agreement before the end of 2025,https://www.i24news.tv/en/news/israel/diplomacy/artc-scoop-israel-and-syria-will-sign-a-peace-agreement-before-the-end-of-2025,0.95,4898,0,4898
4,worldnews,NATO Scrambles Fighter Jets After Russia's Largest Air Assault on Ukraine,https://www.newsweek.com/nato-scrambles-fighter-jets-ukraine-russia-largest-air-assault-drones-missiles-2092159,0.97,3422,0,3422
5,worldnews,Earth is trapping much more heat than climate models forecast – and the rate has doubled in 20 years,https://theconversation.com/earth-is-trapping-much-more-heat-than-climate-models-forecast-and-the-rate-has-doubled-in-20-years-258822,0.96,3364,0,3364
6,worldnews,Pro-Palestinian group target former hostage Noa Argamani in Canada,https://www.jpost.com/international/article-859303,0.85,2952,0,2952
7,worldnews,Putin's 2004 words on NATO enlargement expose Kremlin's lies on Ukraine war,https://newsukraine.rbc.ua/news/putin-s-2004-words-on-nato-enlargement-expose-1751211823.html,0.97,1737,0,1737
8,worldnews,France implements smoking ban at beaches and parks in step towards ‘tobacco-free generation’,https://www.theguardian.com/world/2025/jun/29/france-implements-smoking-ban-at-beaches-and-parks-in-step-towards-tobacco-free-generation,0.97,1578,0,1578
9,worldnews,"Canada, Europeans and Brazil, not US, issue statement backing LGBT rights",https://www.reuters.com/world/americas/canada-europeans-brazil-not-us-issue-statement-backing-lgbt-rights-2025-06-29/,0.93,1534,0,1534
10,worldnews,"Iran’s nuclear enrichment ‘will never stop’, nation’s UN ambassador says",https://www.theguardian.com/world/2025/jun/29/iran-nuclear-enrichment-un-ambassador,0.95,1506,0,1506
11,worldnews,Zelenskyy on Ottawa Convention withdrawal: signal to all partners along Russia's borders,https://www.pravda.com.ua/eng/news/2025/06/29/7519348/,0.97,1425,0,1425
12,worldnews,Canada rescinds digital services tax to advance broader trade negotiations with the United States,https://www.canada.ca/en/department-finance/news/2025/06/canada-rescinds-digital-services-tax-to-advance-broader-trade-negotiations-with-the-united-states.html,0.94,1275,0,1275
13,worldnews,Intercepted call of Iranian officials downplays damage of U.S. attack,https://www.washingtonpost.com/national-security/2025/06/29/trump-iran-nuclear-damage-intercepted-call/,0.91,855,0,855
14,worldnews,One of Hong Kong's last major pro-democracy parties disbands,https://www.bbc.com/news/articles/cz7l08dzvljo,0.96,717,0,717
15,worldnews,"Russia Launches ""Biggest"" Aerial Attack On Ukraine Since War Began: 477 Drones, 60 Missiles",https://www.ndtv.com/world-news/russia-launches-biggest-aerial-attack-on-ukraine-since-war-began-477-drones-60-missiles-8790659,0.98,646,0,646
16,worldnews,Brazil’s president is losing clout abroad and unpopular at home,https://www.economist.com/the-americas/2025/06/29/brazils-president-is-losing-clout-abroad-and-unpopular-at-home,0.85,455,0,455
17,worldnews,Chile's Left Wing Chooses Communist Jeannette Jara to Challenge Right-Wing Momentum in Presidential Election,https://elpais.com/chile/2025-06-29/la-izquierda-chilena-elige-a-la-comunista-jeannette-jara-para-disputar-en-noviembre-la-presidencial-a-una-derecha-que-avanza-imparable.html,0.91,348,0,348
18,worldnews,Thousands set up street blockades in Serbia after arrests of anti-government protesters,https://www.ctvnews.ca/world/article/dozens-of-anti-government-protesters-detained-during-clashes-with-riot-police-in-serbia/,0.97,298,0,298
19,worldnews,Canada rescinds digital services tax in a bid to advance trade talks with US,https://www.reuters.com/world/americas/canada-rescinds-digital-services-tax-bid-advance-trade-talks-with-us-2025-06-30/,0.9,265,0,265
20,worldnews,"Thousands of protesters blocked major roads in Belgrade and other Serbian cities on Sunday, as demonstrations calling for snap elections continued into a second night following Saturday's huge rally in the capital",https://www.rfi.fr/en/international-news/20250629-serbian-leader-digs-in-slams-early-elections-rally-1,0.96,249,0,249
21,worldnews,"""Make Them Regret"": Iran's Top Cleric Issues Fatwa Against Trump, Netanyahu",https://www.ndtv.com/world-news/irans-top-cleric-issues-fatwa-against-donald-trump-benjamin-netanyahu-make-them-regret-8795361/amp/1,0.94,181,0,181
22,worldnews,Albanese says US tariffs on Australia ‘should be zero’ as leaders prepare for end of Trump’s 90-day pause,https://www.theguardian.com/australia-news/2025/jun/30/anthony-albanese-us-trump-tariffs-australia,0.97,181,0,181
23,worldnews,"/r/WorldNews Live Thread: Russian Invasion of Ukraine Day 1222, Part 1 (Thread #1369)",https://www.reddit.com/live/18hnzysb1elcs,0.96,175,0,175
24,worldnews,Zelenskyy: Ukraine to fully align with EU sanctions against Iran,https://www.pravda.com.ua/eng/news/2025/06/29/7519349/,0.95,163,0,163
25,worldnews,‘Post-apocalyptic’: medical staff struggle as gangs fight over aid supplies in Gaza,https://www.theguardian.com/world/2025/jun/29/medical-staff-struggle-gangs-fight-aid-supplies-gaza,0.81,124,0,124
