,subreddit,title,url,upvote_ratio,ups,downs,score
0,worldnews,Xi Jinping says China supports Palestine with 1967 borders,https://www.trtworld.com/middle-east/xi-jinping-says-china-supports-palestine-with-1967-borders-63395,0.83,35844,0,35844
1,worldnews,Saudi foreign minister: All bets off if Iran gets nuclear weapon,https://www.reuters.com/world/middle-east/saudi-foreign-minister-all-bets-off-if-iran-gets-nuclear-weapon-2022-12-11/,0.94,9126,0,9126
2,worldnews,More than $3 billion in a NATO fund may be sent to Ukraine,https://finance.yahoo.com/news/more-3-billion-nato-fund-093000543.html,0.95,3628,0,3628
3,worldnews,Ukraine reporting explosion at Wagner Group HQ in Kadiivka,https://www.pravda.com.ua/eng/news/2022/12/11/7380278/,0.97,3294,0,3294
4,worldnews,NASA's Artemis I Mission Successfully Returns from the Moon,https://www.scientificamerican.com/article/nasas-artemis-i-mission-successfully-returns-from-the-moon/,0.98,3103,0,3103
5,worldnews,Ukrainian HIMARS Destroy Barracks in Russian-Occupied Melitopol—Reports,https://www.newsweek.com/ukrainian-himars-destroy-barracks-russian-occupied-melitopol-reports-1766193,0.97,2830,0,2830
6,worldnews,Erdogan threatens Greece with missile strike,https://www.ekathimerini.com/news/1200033/erdogan-threatens-grece-with-missile-strike/,0.94,2768,0,2768
7,worldnews,Kremlin says Minsk deals failure led to Russia's Ukraine offensive,https://www.reuters.com/world/europe/kremlin-says-minsk-deals-failure-led-russias-ukraine-offensive-2022-12-11/,0.91,2409,0,2409
8,worldnews,“We’re Coming for You”: Italy’s Neofascists Target Journalists as They Assume Power,https://theintercept.com/2022/12/07/italy-giorgia-meloni-journalists/,0.93,2309,0,2309
9,worldnews,Serbs in Kosovo clash with police as ethnic tensions flare,https://www.reuters.com/world/europe/serbs-kosovo-block-roads-clash-with-police-ethnic-tensions-worsen-2022-12-11/,0.96,1405,0,1405
10,worldnews,Biodiversity: Ocean 'dead zones' are proliferating due to global warming,https://www.france24.com/en/environment/20221208-biodiversity-ocean-dead-zones-are-proliferating,0.95,1388,0,1388
11,worldnews,"With vote ahead, Polish leader turns up anti-German rhetoric",https://apnews.com/article/russia-ukraine-poland-germany-berlin-62bf9f2c89fbf3e48c231ec3be8bcd1c,0.93,722,0,722
12,worldnews,"In phone call, Erdogan tells Putin to clear Kurdish forces from northern Syria",https://www.timesofisrael.com/in-phone-call-erdogan-tells-putin-to-clear-kurdish-forces-from-northern-syria/,0.95,711,0,711
13,worldnews,A trash heap 62 meters high shows the scale of India's climate challenge | CNN,https://www.cnn.com/2022/12/10/india/india-bhalswa-landfill-pollution-climate-intl-hnk-dst/index.html,0.93,688,0,688
14,worldnews,"Dozens of Maasai youths in Kenya have taken part in the fifth edition of the “Maasai Olympics”, a sporting event promoted by conservationists as an alternative to lion killing as a rite of passage for young warriors",https://www.aljazeera.com/news/2022/12/11/at-kenyas-maasai-olympics-warriors-swap-lion-hunts-for-sports,0.96,629,0,629
15,worldnews,Germany struggles to get China parts to replenish ammo stockpile,https://asia.nikkei.com/Politics/Ukraine-war/Germany-struggles-to-get-China-parts-to-replenish-ammo-stockpile,0.92,614,0,614
16,worldnews,Satellite Image Shows Saudi Arabia's 'The Line' Being Built,https://gizmodo.com/saudi-arabia-line-city-satellite-image-built-1849875521,0.95,481,0,481
17,worldnews,Japan's wholesale inflation near steady at 9.3% as commodity prices ease,https://www.reuters.com/markets/asia/japans-wholesale-inflation-near-steady-93-commodity-prices-ease-2022-12-12/,0.98,472,0,472
18,worldnews,"With executions imminent, watchdogs say world giving Iran ‘green light to carnage’",https://www.timesofisrael.com/with-executions-imminent-watchdogs-say-world-giving-iran-green-light-to-carnage/,0.94,425,0,425
19,worldnews,Zelensky thanks Biden for ‘unprecedented’ support in latest call,https://thehill.com/policy/international/3771195-zelensky-thanks-biden-for-unprecedented-support-in-latest-call/,0.94,411,0,411
20,worldnews,"Nearly half of COVID patients worldwide still have symptoms after 4 months, according to a giant new study",https://finance.yahoo.com/news/nearly-half-covid-patients-worldwide-202324231.html,0.9,320,0,320
21,worldnews,"Industrial robots in China push people out of jobs, slash wages",https://www.theregister.com/2022/12/06/robots_china_employment/,0.91,291,0,291
22,worldnews,"/r/WorldNews Live Thread: Russian Invasion of Ukraine Day 292, Part 1 (Thread #433)",https://www.reddit.com/live/18hnzysb1elcs,0.96,246,0,246
23,worldnews,"More than 11,000 children are known to have been killed or maimed in Yemen's civil war since it escalated nearly eight years ago, the United Nations said Monday.",https://www.france24.com/en/middle-east/20221212-un-report-more-than-11-000-children-killed-or-maimed-in-yemen-civil-war,0.96,229,0,229
24,worldnews,Russian Operatives Beat Prisoners Who Refuse To Join War In Ukraine: Report,https://www.ibtimes.com/russian-operatives-beat-prisoners-who-refuse-join-war-ukraine-report-3645992,0.95,184,0,184
25,worldnews,Italy shooting: Three women shot dead in Rome cafe - BBC News,https://www.bbc.com/news/world-europe-63939426,0.97,179,0,179
26,worldnews,"Tomorrow (December 12), r/worldnews will have a Reddit Talk with Richard Wike, from Pew Research Center, to talk about Social Media and Democracy! 11:00 PT, 14:00 ET, 19:00 UT, 20:00 CET",https://i.redd.it/pyssytdoxb5a1.png,0.77,76,0,76
