,subreddit,title,url,upvote_ratio,ups,downs,score
0,worldnews,‘Yevgeny Prigozhin will never be discussed again’: Russian media to erase all traces of mutinous warlord,https://www.theguardian.com/world/2023/jul/01/yevgeny-prigozhin-russian-media-erase-warlord-wagner-moscow,0.95,23529,0,23529
1,worldnews,Russians cremate their dead without keeping record to not pay compensation – General Staff,https://www.pravda.com.ua/eng/news/2023/07/1/7409444/,0.95,17139,0,17139
2,worldnews,"Orca Rams Into Yacht Near Scotland, Suggesting the Behavior May Be Spreading",https://www.smithsonianmag.com/smart-news/orca-rams-into-yacht-near-scotland-behavior-may-be-spreading-180982429/,0.97,12008,0,12008
3,worldnews,Ukraine says no negotiations unless Russia retreats from Crimea,https://www.yahoo.com/news/ukraine-says-no-negotiations-unless-161237024.html,0.97,5144,0,5144
4,worldnews,First baby beaver born in 400 years in Staffordshire UK,https://www.bbc.com/news/uk-england-stoke-staffordshire-66050881?at_medium=social&amp;at_campaign=Social_Flow&amp;at_format=link&amp;at_link_type=web_link&amp;at_link_id=AEA844A4-1673-11EE-B6DE-C1D1ECABB293&amp;at_ptr_name=facebook_page&amp;at_link_origin=BBC_Midlands&amp;at_bbc_team=editorial&amp;at_campaign_type=owned&amp;fbclid=IwAR1RpLfw6aX12Xc5MEO3WmpAsrq7w16bdZKzjXEiLqpY0fh_TYEH91goRQE,0.97,4119,0,4119
5,worldnews,French Police Union Calls Rioters 'Vermin',https://www.barrons.com/news/french-police-union-calls-rioters-vermin-f10740ea,0.95,3370,0,3370
6,worldnews,Russia Is Making Abducted Ukrainian Children Impossible to Find,https://www.theatlantic.com/international/archive/2023/07/russia-kidnapping-abducting-ukrainian-children/674535/,0.97,3362,0,3362
7,worldnews,Shell still trading Russian gas despite pledge to stop,https://www.bbc.com/news/business-66021325?at_medium=RSS&amp;at_campaign=KARANGA,0.97,3236,0,3236
8,worldnews,France shooting: Macron accuses rioters of exploiting teen killed by police,https://www.bbc.com/news/world-europe-66069080,0.96,2867,0,2867
9,worldnews,"Ukraine counter-offensive will be long and bloody, says US Gen Mark Milley",https://www.bbc.com/news/world-europe-66075786?at_medium=RSS&amp;at_campaign=KARANGA,0.97,2559,0,2559
10,worldnews,"Wagner mercenary group leader Yevgeny Prigozhin has closed down his St. Petersburg-based media holding. The Patriot media group, which Prigozhin founded in 2019, encompasses the Internet Research Agency, widely known as a ""troll factory""",https://www.themoscowtimes.com/2023/06/30/exiled-wagner-boss-shutters-patriot-media-group-reports-a81707,0.97,2363,0,2363
11,worldnews,CIA says Russia is a recruiting opportunity as disaffection with war rises,https://www.reuters.com/world/cia-says-russia-is-recruiting-opportunity-disaffection-with-war-rises-2023-07-01/,0.97,2242,0,2242
12,worldnews,"Japan says Russian warships spotted near Taiwan, Okinawa islands",https://www.reuters.com/world/asia-pacific/japan-says-russian-warships-spotted-near-taiwan-okinawa-islands-2023-07-01/,0.96,1977,0,1977
13,worldnews,"More than 7,000 B.C. port workers now on strike",https://globalnews.ca/news/9805765/bc-port-strike-saturday-update/,0.97,1912,0,1912
14,worldnews,Rare octopus nurseries discovered deep in the Pacific Ocean,https://www.axios.com/2023/07/01/deep-sea-octopus-nursery-discovery,0.98,1419,0,1419
15,worldnews,"Russians carried out unsuccessful offensive operations on 3 fronts, more than 30 combat clashes occurred",https://news.yahoo.com/russians-carried-unsuccessful-offensive-operations-155954779.html,0.97,1158,0,1158
16,worldnews,"Zelenskyy: We need a signal that Ukraine will become a NATO member after war, that is what an invitation is for",https://www.pravda.com.ua/eng/news/2023/07/1/7409435/,0.93,1129,0,1129
17,worldnews,Dutch King Willem-Alexander apologises for country's role in slavery,https://www.bbc.com/news/world-europe-66076562,0.9,935,0,935
18,worldnews,MDMA: Australia begins world-first psychedelic therapy,https://www.bbc.com/news/world-australia-66049989,0.95,746,0,746
19,worldnews,"21,000 Wagner mercenaries killed in Ukraine and ‘world wants to kill’ Putin, Zelensky says",https://edition.cnn.com/2023/07/01/world/wagner-losses-ukraine-zelensky-prigozhin-intl-hnk/index.html,0.95,655,0,655
20,worldnews,Shell still trading Russian gas despite pledge to stop,https://www.bbc.co.uk/news/business-66021325,0.95,550,0,550
21,worldnews,Ukraine war corrosive for Vladimir Putin - CIA boss,https://www.bbc.com/news/world-europe-66076564?at_medium=RSS&amp;at_campaign=KARANGA,0.94,434,0,434
22,worldnews,Just Stop Oil protesters have disrupted London’s Pride march in protest over the event accepting sponsorship money from “high-polluting industries”,https://www.theguardian.com/environment/2023/jul/01/just-stop-oil-protesters-disrupt-london-pride-over-polluting-sponsors,0.92,311,0,311
23,worldnews,"/r/WorldNews Live Thread: Russian Invasion of Ukraine Day 494, Part 1 (Thread #640)",https://www.reddit.com/live/18hnzysb1elcs,0.96,291,0,291
24,worldnews,Poland admits over 30.000 Ukraine refugees daily,"https://www.polskieradio.pl/395/7784/artykul/3200173,poland-admits-over-30000-ukraine-refugees-daily",0.94,259,0,259
25,worldnews,Russia lists Moscow chief rabbi as foreign agent,https://www.ynetnews.com/article/rjk11sbadh,0.93,236,0,236
