,subreddit,title,url,upvote_ratio,ups,downs,score
0,worldnews,Trump orders cutoff of 'all' US trade with Spain,https://tvpworld.com/94233896/nato-ankara-summit-trump-orders-cutoff-of-us-trade-with-spain,0.93,26991,0,26991
1,worldnews,'Make them yourself': Trump gives Zelensky green light to produce Patriot missiles,https://kyivindependent.com/make-them-yourself-trump-gives-zelensky-green-light-to-produce-patriot-missiles/,0.97,17860,0,17860
2,worldnews,"Denmark ready to defend 'every inch of NATO', including Danish kingdom, PM says",https://www.reuters.com/world/europe/denmark-ready-defend-every-inch-nato-including-danish-kingdom-pm-says-2026-07-08/,0.98,13501,0,13501
3,worldnews,Trump tells world that Iran ‘scum’ want to assassinate him: ‘I’m the No. 1 target’,https://www.independent.co.uk/news/world/americas/us-politics/trump-iran-assassination-threat-b3011422.html,0.96,13012,0,13012
4,worldnews,Russian Lawmaker Says Half of Ukraine’s Population Must Be Killed to ‘Eliminate Nazism’,https://www.kyivpost.com/post/79834,0.96,6894,0,6894
5,worldnews,Greenlanders reject renewed US push for control of island,https://www.france24.com/en/greenlanders-reject-trump-s-renewed-push-for-control-of-island,0.97,4376,0,4376
6,worldnews,Russia Bans Diesel Exports After Ukraine’s Refinery Attacks,https://www.bloomberg.com/news/articles/2026-07-08/russia-bans-diesel-exports-after-ukraine-s-refinery-attacks,0.98,3005,0,3005
7,worldnews,Russia has found way to jam Starlink and take down Ukraine’s drones,https://euromaidanpress.com/2026/07/08/russia-has-found-way-to-jam-starlink-and-take-down-ukraines-drones/,0.93,2901,0,2901
8,worldnews,Russia Is Hiding Fuel for Crimea in Water and Milk Tankers,https://united24media.com/war-in-ukraine/russia-is-hiding-fuel-for-crimea-in-water-and-milk-tankers-ukrainian-drones-still-find-it-20577,0.97,2519,0,2519
9,worldnews,US military is conducting fresh strikes on Iran,https://www.reuters.com/world/middle-east/us-military-is-conducting-fresh-strikes-iran-2026-07-08/,0.95,1729,0,1729
10,worldnews,CTV News in Türkiye: Erdogan gave pistols as gifts to NATO leaders. Carney turned his over to the RCMP,https://www.ctvnews.ca/politics/article/ctv-news-in-turkiye-carneys-nato-gun-gift-turned-over-to-rcmp/,0.95,1304,0,1304
11,worldnews,"Erdogan gave pistols to NATO leaders, Starmer says",https://www.yahoo.com/news/politics/articles/erdogan-gave-pistols-nato-leaders-202012458.html,0.95,1188,0,1188
12,worldnews,Tehran retaliates in Kuwait and Bahrain after second day of US strikes,https://www.reuters.com/world/iran-war-live-tehran-retaliates-kuwait-bahrain-after-second-day-us-strikes-2026-07-09/,0.96,1138,0,1138
13,worldnews,International timekeepers to vote on changing the leap second to a leap hour,https://www.scientificamerican.com/article/international-timekeepers-to-vote-on-changing-the-leap-second-to-a-leap-hour/,0.95,1009,0,1009
14,worldnews,"Oil prices rise, and stocks drop worldwide after Trump says ceasefire with Iran is 'over'",https://apnews.com/article/stocks-rates-oil-iran-ai-671d9c94b302f7db533f46baa18387d3,0.95,955,0,955
15,worldnews,Ukraine hits 21 Russian ships within 72 hours,https://www.seatrade-maritime.com/security/ukraine-hits-21-russian-ships-within-72-hours,0.99,867,0,867
16,worldnews,Railway bridge attacked in northwestern Iran,https://www.ynetnews.com/article/v9dkc0gfc,0.87,500,0,500
17,worldnews,Ukraine’s drone playbook is wreaking havoc in Russia,https://www.cnbc.com/2026/07/09/ukraine-drone-strikes-russia-nato.html,0.95,228,0,228
18,worldnews,"/r/WorldNews Live Thread: Russian Invasion of Ukraine Day 1596, Part 1 (Thread #1743)",https://www.reddit.com/live/18hnzysb1elcs,0.97,214,0,214
19,worldnews,Trump says US will give Ukraine license to produce Patriot defense systems,https://apnews.com/article/nato-trump-iran-ukraine-turkey-d393e8ef6103e32c984c4337a82930b1?utm_source=copy&amp;utm_medium=share,0.94,208,0,208
20,worldnews,Chinese academics claim Philippines' northern Batanes islands belong to China through Taiwan,https://globalnation.inquirer.net/330272/chinese-academics-claim-batanes-belongs-to-china-through-taiwan?fbclid=IwVERDUAS8MlpleHRuA2FlbQIxMABzcnRjBmFwcF9pZAwzNTA2ODU1MzE3MjgAAR5A-Payw3PZhxwYJCi4Su_Sva2F_ka9tCRpCcFsFpDmg0M1JyRCrkpBgPlVBQ_aem_KoRMGQ7epnCabD4-F5pWAw,0.87,174,0,174
21,worldnews,/r/WorldNews Discussion Thread: US and Israel launch attack on Iran; Iran retaliates (Thread #20),https://www.reddit.com/r/worldnews/comments/1ukwdx5/rworldnews_discussion_thread_us_and_israel_launch/,0.9,167,0,167
22,worldnews,Crimea Fuel Crisis Deepens as Ukraine Hits Russian Supply Lines,https://www.kyivpost.com/post/79876,0.97,167,0,167
23,worldnews,White House preparing for prolonged Iran conflict over Hormuz - report,https://www.jpost.com/middle-east/iran-news/article-901955,0.91,144,0,144
24,worldnews,"US commanders bypassed warnings about outdated intelligence ahead of strike that hit school in Iran, sources say",https://edition.cnn.com/2026/07/07/politics/us-commanders-intelligence-iran-school,0.9,119,0,119
