,subreddit,title,url,upvote_ratio,ups,downs,score
0,worldnews,"Prince Andrew to give up all his titles and honours, including Duke of York",https://news.sky.com/story/prince-andrew-to-give-up-all-his-titles-and-honours-including-duke-of-york-13451850,0.96,33846,0,33846
1,worldnews,Mark Carney says Benjamin Netanyahu would be arrested if he came to Canada,https://cultmtl.com/2025/10/mark-carney-says-benjamin-netanyahu-would-be-arrested-if-he-came-to-canada/,0.95,13805,0,13805
2,worldnews,Landmark global shipping deal abandoned under US threats,https://www.bbc.com/news/articles/c3vnl0yxg53o,0.97,10989,0,10989
3,worldnews,Russia’s Su-30SM Fighter Reportedly Destroyed by Own Air Defenses Over Crimea,https://united24media.com/latest-news/russias-su-30sm-fighter-reportedly-destroyed-by-own-air-defenses-over-crimea-12580,0.98,9272,0,9272
4,worldnews,"Trump confirms Xi meeting, retreats on 100% tariffs: ‘not sustainable’",https://www.scmp.com/news/world/united-states-canada/article/3329466/trump-confirms-xi-jinping-meeting-calls-100-china-tariffs-not-sustainable?module=top_story&amp;pgtype=homepage,0.98,8233,0,8233
5,worldnews,"U.S. Military Killed Venezuelan Fisherman in Suspected Drug Boat Attack, Family Says",https://www.nytimes.com/2025/10/16/world/americas/trinidad-us-military-venezuela-boats.html,0.97,7246,0,7246
6,worldnews,91% of Australians support Trans Rights,https://lens.monash.edu/@politics-society/2025/10/17/1387926/the-power-of-allies-in-safeguarding-the-rights-of-trans-people-in-australia,0.88,5948,0,5948
7,worldnews,King Charles to become first British monarch to pray publicly with Pope in 500 years,https://news.sky.com/story/king-charles-to-become-first-british-monarch-to-pray-publicly-with-pope-in-500-years-13451602,0.94,5621,0,5621
8,worldnews,Zelenskyy ready to meet Putin anywhere except Russia and Belarus,https://www.pravda.com.ua/eng/news/2025/10/17/8003140/,0.98,4217,0,4217
9,worldnews,Trump Says Putin Should Be Allowed To Keep The Land He Has Seized In Ukraine,https://www.huffpost.com/entry/trump-zelenskyy-tomahawks_n_68f25d88e4b078755768316b,0.92,2763,0,2763
10,worldnews,"Face to Face With Zelensky, Trump Waffles on Missile Sale",https://time.com/7326698/trump-zelensky-ukraine-tomahawk-missiles/,0.96,2205,0,2205
11,worldnews,Ukrainian forces destroy Russian rocket artillery unit 50 km from front line in Kherson Oblast,https://www.pravda.com.ua/eng/news/2025/10/17/8003169,0.98,2107,0,2107
12,worldnews,Venezuela Mobilizes Troops and Militias as U.S. Military Looms Offshore,https://www.wsj.com/world/americas/venezuela-military-movement-militia-c59ca9ef?st=ukDaFT&amp;mod=wsjreddit,0.97,1866,0,1866
13,worldnews,Kremlin envoy proposes a 'Putin-Trump tunnel' to link Russia and US,https://www.reuters.com/world/kremlin-envoy-proposes-putin-trump-tunnel-link-russia-us-2025-10-17/,0.93,1798,0,1798
14,worldnews,"Red Cross retrieves body of dead hostage in Gaza, Israel says",https://www.bbc.co.uk/news/articles/c5yp3eq9knvo,0.91,1322,0,1322
15,worldnews,"BBC Gaza documentary a 'serious' breach of rules, Ofcom says",https://www.bbc.com/news/articles/c629j5m2n01o,0.85,1257,0,1257
16,worldnews,Italy Plans to Raise Flat Tax for Wealthy New Residents by 50%,https://www.bloomberg.com/news/articles/2025-10-17/italy-plans-to-raise-flat-tax-for-wealthy-new-residents-by-50,0.98,1191,0,1191
17,worldnews,Zelenskyy offers Trump drones in exchange for Tomahawk missiles,https://www.pravda.com.ua/eng/news/2025/10/17/8003239,0.96,938,0,938
18,worldnews,Poland passes bill to ban fur farming by 2033,https://tvpworld.com/89524106/polish-parliament-votes-to-end-fur-farming-industry-faces-phase-out-by-2033,0.97,723,0,723
19,worldnews,"Hamas aims to keep grip on Gaza security and can't commit to disarm, senior official says",https://www.reuters.com/world/middle-east/hamas-aims-keep-grip-gaza-security-cant-commit-disarm-senior-official-says-2025-10-17/,0.9,655,0,655
20,worldnews,Explosion and Major Fire Reported at Avangard Defense Plant in Russia’s Bashkortostan,https://united24media.com/latest-news/explosion-and-major-fire-reported-at-avangard-defense-plant-in-russias-bashkortostan-12600,0.98,574,0,574
21,worldnews,Ed Miliband says it is ‘possible’ that UK government should leave X,https://www.theguardian.com/politics/2025/sep/28/ed-miliband-says-it-is-possible-that-uk-government-should-leave-x,0.94,196,0,196
22,worldnews,"/r/WorldNews Live Thread: Russian Invasion of Ukraine Day 1332, Part 1 (Thread #1479)",https://www.reddit.com/live/18hnzysb1elcs,0.97,109,0,109
23,worldnews,Trump tariffs bring India’s massive garment industry to its knees,https://www.washingtonpost.com/world/2025/10/17/india-trump-tariffs-modi-manufacturing/,0.72,67,0,67
24,worldnews,Ex-hostage says Ben Gvir’s comments on prisoners led captors to beat them unconscious,https://www.timesofisrael.com/ex-hostage-says-ben-gvirs-comments-on-prisoners-led-captors-to-beat-them-unconscious/,0.84,61,0,61
