,subreddit,title,url,upvote_ratio,ups,downs,score
0,worldnews,"Donald Trump Says He Wants 'Ownership' of Greenland Because It's 'Psychologically Important for Me': “Maybe another president would feel differently, but so far I’ve been right about everything”",https://people.com/donald-trump-wants-ownership-greenland-psychologically-important-11883940,0.92,40971,0,40971
1,worldnews,Trump cancel meetings with Iranian officials and tells protesters 'help is on its way',https://abcnews.go.com/US/wireStory/trump-cancel-meetings-iranian-officials-tells-protesters-129165750,0.94,23574,0,23574
2,worldnews,"Report: Iran protests death toll hits 12,000 in systematic massacre",https://www.israelhayom.com/2026/01/13/iran-protests-massacre-report-12000-dead/,0.9,22568,0,22568
3,worldnews,US official says Greenland action could come within 'weeks or months',https://www.usatoday.com/story/news/world/2026/01/13/us-greenland-trump-action-news/88145613007/,0.93,22003,0,22003
4,worldnews,"Germany warns Trump: International law applies to everyone, including US",https://www.jpost.com/international/article-882963,0.96,21382,0,21382
5,worldnews,Greenland's PM has a blunt message for Trump: We choose Denmark over the U.S.,https://www.cnbc.com/amp/2026/01/13/greenland-denmark-trump-nielsen-frederiksen.html,0.98,15472,0,15472
6,worldnews,US faces war crime allegation for ‘disguising’ aircraft in drug boat attack,https://www.aljazeera.com/news/2026/1/13/us-faces-war-crime-allegation-for-disguising-aircraft-in-drug-boat-attack,0.95,13159,0,13159
7,worldnews,Germany Calls for European Brigade to be Stationed in Greenland,https://militarnyi.com/en/news/germany-calls-for-european-brigade-to-be-stationed-in-greenland/,0.97,9995,0,9995
8,worldnews,Trump 'inclined' to keep ExxonMobil out of Venezuela after CEO response at White House meeting,https://apnews.com/article/venezuela-us-oil-trump-exxon-137a77039675e6483a75673f02138d0f,0.97,7417,0,7417
9,worldnews,China urges Canada to break from US influence as PM Carney visits Beijing,https://apnews.com/article/china-canada-carney-trump-strategic-autonomy-66f1277efa034750f0fd817b3a69bebb,0.96,6292,0,6292
10,worldnews,Senior Russian official says Greenland could vote to join Russia if Trump does not hurry,https://www.reuters.com/world/senior-russian-official-says-greenland-could-vote-join-russia-if-trump-does-not-2026-01-13/,0.92,5928,0,5928
11,worldnews,Iranian man to be executed on wednesday will have 10 minutes to say goodbye to his family,https://www.nzherald.co.nz/world/iranian-man-erfan-soltani-will-have-10-minutes-to-say-goodbye-to-his-family-before-being-executed-tomorrow/Z2RGO43JIJCRZM3AN57FRMOEQ4/,0.97,2299,0,2299
12,worldnews,"Russia's own air defense missile hits apartment building in Rostov-on-Don, fire seen at nearby factory, media reports",https://kyivindependent.com/russian-air-defense-missile-hits-apartment-building-in-rostov-on-don-media-reports/,0.99,1907,0,1907
13,worldnews,South Korea prosecutor seeks death penalty for ex-president Yoon over martial law,https://www.reuters.com/world/asia-pacific/south-korea-prosecutor-seeks-death-penalty-ex-president-yoon-over-martial-law-2026-01-13/,0.98,1715,0,1715
14,worldnews,Access to Elon Musk’s Starlink internet service is now free in Iran as regime continues brutal crackdown on protests,https://www.cnn.com/2026/01/13/politics/starlink-access-iran-protests?utm_medium=social&amp;utm_campaign=missions&amp;utm_source=reddit,0.92,1590,0,1590
15,worldnews,Hundreds of gunshot eye injuries found in one Iranian hospital amid brutal crackdown on protests,https://www.theguardian.com/global-development/2026/jan/13/hundreds-of-gunshot-eye-injuries-found-in-one-iranian-hospital-amid-brutal-crackdown-on-protests,0.97,1545,0,1545
16,worldnews,"Denmark, Greenland leaders stand united against Trump’s Greenland takeover call ahead of key meeting",https://apnews.com/article/greenland-denmark-trump-vance-meeting-6a9ab923e04411cf518ec3e0f6a67e38,0.97,1260,0,1260
17,worldnews,Trump's envoy secretly met Iran's exiled crown prince,https://www.axios.com/2026/01/13/pahlavi-witkoff-iran-protest-meeting-trump,0.94,1188,0,1188
18,worldnews,China's trade ends 2025 with record $1.2 trillion surplus despite Trump tariff jolt,https://www.reuters.com/world/china/chinas-trade-ends-2025-with-record-trillion-dollar-surplus-despite-trump-tariffs-2026-01-14/,0.96,853,0,853
19,worldnews,Trump warns US will ‘take very strong action’ if Iran starts executing arrested protesters,https://www.theguardian.com/world/2026/jan/14/iran-protests-erfan-soltani-donald-trump-warning-executions-hangings,0.93,554,0,554
20,worldnews,US approves sale of Nvidia's advanced H200 chips to China,https://www.bbc.co.uk/news/articles/cg4erx1n04lo,0.93,550,0,550
21,worldnews,Royal Canadian Mounted Police report says Bishnoi gang ‘acting on behalf of’ Indian government,https://globalnews.ca/news/11609940/rcmp-report-bishnoi-gang-acting-on-behalf-of-indian-government/,0.95,540,0,540
22,worldnews,"Taiwan, US launch joint production of 155mm artillery shells amid blockade fears",https://www.scmp.com/news/china/military/article/3339770/taiwan-and-us-launch-joint-production-155mm-artillery-shells-amid-blockade-fears?module=perpetual_scroll_0&amp;pgtype=article,0.96,519,0,519
23,worldnews,"/r/WorldNews Live Thread: Russian Invasion of Ukraine Day 1420, Part 1 (Thread #1567)",https://www.reddit.com/live/18hnzysb1elcs,0.95,107,0,107
24,worldnews,"'Energy workers have done the nearly impossible' —Power reconnected in Kryvyi Rih after Russian drone strikes left 45,000 subscribers without electricity",https://kyivindependent.com/russian-drone-strike-leaves-45-000-subscribers-without-power-in-kryvyi-rih/,0.99,82,0,82
