,subreddit,title,url,upvote_ratio,ups,downs,score
0,worldnews,"Ukraine hits 4 Russian airbases overnight in largest such attack, source says",https://kyivindependent.com/ukraine-hit-4-russian-airbases/,0.96,24163,0,24163
1,worldnews,Ukrainians distribute humanitarian aid to civilians in Russia's Kursk Oblast,https://www.pravda.com.ua/eng/news/2024/08/14/7470410/,0.95,15105,0,15105
2,worldnews,Ukraine appears to have just launched its largest attack on Russia's airbases as its invading forces push deeper into Kursk,https://www.yahoo.com/news/ukraine-appears-just-launched-largest-203015053.html,0.96,14347,0,14347
3,worldnews,"A Russian lawmaker says the military knew Ukraine was planning to hit Kursk, but everyone was told 'not to panic' because 'those above know better'",https://www.yahoo.com/news/russian-lawmaker-says-military-knew-053535592.html,0.96,12893,0,12893
4,worldnews,WATCH: Hamas launched rockets from humanitarian area in Khan Yunis while wearing civilian clothes,https://www.jpost.com/israel-hamas-war/article-814639,0.79,10912,0,10912
5,worldnews,Liz Truss leaves stage over ‘I crashed the economy’ lettuce banner | Liz Truss,https://www.theguardian.com/politics/article/2024/aug/14/liz-truss-leaves-stage-over-i-crashed-the-economy-lettuce-banner,0.96,6407,0,6407
6,worldnews,The Rape and Murder of a Medic Leads to Nationwide Physician Strike Across India,https://time.com/7010419/india-rape-murder-medic-physician-strike/,0.97,6023,0,6023
7,worldnews,"Biden calls Ukraine incursion ""a real dilemma for Putin""",https://www.reuters.com/world/europe/biden-calls-ukraine-incursion-a-real-dilemma-putin-2024-08-13/,0.97,5207,0,5207
8,worldnews,"Creation of civil administration in Russia's Kursk Oblast not ruled out, Zelensky says",https://kyivindependent.com/creation-of-civil-administration-in-russias-kursk-oblast-not-ruled-out-zelensky-says/,0.98,4148,0,4148
9,worldnews,Second Russian region declares state of emergency after Ukraine attack,https://www.bbc.co.uk/news/articles/c17gqq0djdgo,0.98,4086,0,4086
10,worldnews,US soldier pleads guilty to selling secrets to China,https://www.bbc.com/news/articles/c79w810e38no.amp,0.97,3517,0,3517
11,worldnews,WHO declares mpox outbreak a global health emergency,https://www.msn.com/en-us/health/other/who-declares-mpox-outbreak-a-global-health-emergency/ar-AA1oNMyK,0.94,3094,0,3094
12,worldnews,Poland buys 96 Apache helicopters from U.S.,https://www.reuters.com/world/poland-buys-96-apache-helicopters-us-2024-08-13/,0.98,2387,0,2387
13,worldnews,Google says it observed Iran trying to hack the Trump and Biden-Harris campaigns,https://www.nbcnews.com/tech/security/google-says-observed-iran-trying-hack-trump-biden-harris-campaigns-rcna166645,0.96,2050,0,2050
14,worldnews,WHO declares Mpox global health emergency,https://bbc.com/news/articles/cvg35w27gzno,0.92,1752,0,1752
15,worldnews,"Iranian Banks Hit By Major Cyber Attack, Reportedly One Of Largest In Histo - i24NEWS",https://www.i24news.tv/en/news/middle-east/iran-eastern-states/artc-iranian-banks-hit-by-major-cyber-attack-reportedly-one-of-largest-in-history,0.96,1587,0,1587
16,worldnews,"Massive cyberattack rocks Central Bank of Iran, computer system paralyzed - report",https://www.jpost.com/breaking-news/article-814715,0.96,1165,0,1165
17,worldnews,"Over 100 Russian troops captured in Kursk Oblast in less than a day, Syrskyi says",https://kyivindependent.com/ukraine-war-latest-over-100-russian-troops-in-kursk-oblast-in-less-than-a-day-syrskyi-says/,0.97,968,0,968
18,worldnews,Rosenberg: Ukraine's advance undermines Putin's image as 'Mr Security',https://www.bbc.com/news/articles/credw5q0705o,0.97,713,0,713
19,worldnews,50 Christians massacred in Nigeria. ,https://truthnigeria.com/2024/08/jihadist-militia-murder-congregation-of-believers-stuff-local-wells-with-corpses/,0.91,682,0,682
20,worldnews,Zelensky Explores Military Administration for Newly Captured Areas Near Kursk as Ukrainian Forces Gain Ground,https://m.novinite.com/view_news.php?id=227753,0.96,417,0,417
21,worldnews,"/r/WorldNews Live Thread: Russian Invasion of Ukraine Day 903, Part 1 (Thread #1050)",https://www.reddit.com/live/18hnzysb1elcs,0.99,342,0,342
22,worldnews,Ukraine offers to evacuate Russian civilians from Kursk Oblast,https://english.nv.ua/nation/ukraine-offers-to-evacuate-russian-civilians-from-kursk-oblast-50443059.html,0.98,284,0,284
23,worldnews,Argentina Inflation Slows to Lowest Level Since 2022 Under Milei,https://www.bloomberg.com/news/articles/2024-08-14/argentina-inflation-slows-to-lowest-level-since-2022-under-milei?srnd=homepage-canada,0.87,279,0,279
24,worldnews,Report: IDF using Gazans to check areas that may be booby-trapped before troops enter,https://www.timesofisrael.com/report-idf-using-gazans-to-check-areas-that-may-be-booby-trapped-before-troops-enter/,0.66,160,0,160
25,worldnews,/r/WorldNews Live Thread for Israel-Hamas War (Thread #62),https://www.reddit.com/live/1bsso361afr0r,0.79,152,0,152
26,worldnews,"Personal Data of 3 Billion People Stolen in Hack, Suit Says",https://news.bloomberglaw.com/privacy-and-data-security/background-check-data-of-3-billion-stolen-in-breach-suit-says,0.95,71,0,71
