,subreddit,title,url,upvote_ratio,ups,downs,score
0,worldnews,"Hacked Data Reveals Mexican Gov’t Sold Arms to Drug Cartels, Spied on Reporters",https://www.democracynow.org/2022/10/12/headlines/guacamaya_leak_reveals_mexican_govt_sold_arms_to_drug_cartels_spied_on_reporters,0.95,56518,0,56518
1,worldnews,"Putin offers Europe gas through Nord Stream 2, Germany declines",https://www.dw.com/en/putin-offers-europe-gas-through-nord-stream-2-germany-declines/a-63416138,0.95,22687,0,22687
2,worldnews,More than 50 countries answer Ukraine's request for air defence equipment,https://www.sbs.com.au/news/article/more-than-50-countries-answer-ukraines-request-for-air-defence-equipment/zebmt237t,0.96,20067,0,20067
3,worldnews,Cracks appear among Iran elite as senior figure calls for hijab policing rethink,https://www.theguardian.com/world/2022/oct/12/iran-hijab-law-protest-ali-larijani,0.98,15111,0,15111
4,worldnews,United Nations condemns Russia's move to annex parts of Ukraine,https://www.reuters.com/world/united-nations-condemns-russias-move-annex-parts-ukraine-2022-10-12/,0.96,14440,0,14440
5,worldnews,Putin says Nord Stream sabotage is 'act of international terrorism',https://www.reuters.com/world/europe/putin-says-nord-stream-sabotage-is-act-international-terrorism-2022-10-12/,0.93,12914,0,12914
6,worldnews,Zelenskyy vows to make battlefield 'more painful' for Russian forces after another day of deadly rocket strikes on Ukraine,https://news.sky.com/story/zelenskyy-vows-to-make-battlefield-more-painful-for-russian-forces-as-rockets-rain-down-on-ukraine-12717743,0.97,11791,0,11791
7,worldnews,Iran says average age of arrested protesters is 15,https://www.al-monitor.com/originals/2022/10/iran-says-average-age-arrested-protesters-15,0.98,8626,0,8626
8,worldnews,Moldova is considering the possibility of announcing a partial mobilization,http://frontnews.eu/en/news/details/43650,0.94,6661,0,6661
9,worldnews,Protests reach 19 cities in Iran despite internet disruption,https://apnews.com/article/b84859076acd4c5ebfadea40d5580a12,0.98,5748,0,5748
10,worldnews,Global wildlife populations have sunk 69% since 1970 - WWF report,https://www.reuters.com/business/environment/global-wildlife-populations-have-sunk-69-since-1970-wwf-report-2022-10-12/,0.97,4938,0,4938
11,worldnews,"Haavisto: Finland would receive support from Nato partners in case of direct threat, even before full membership",https://yle.fi/news/3-12656524,0.98,3551,0,3551
12,worldnews,Iranian official admits that student protesters are being taken to psychiatric institutions,https://www.cnn.com/2022/10/12/middleeast/iran-schoolgirls-protests-institutions-intl/index.html,0.98,2929,0,2929
13,worldnews,"""Russia is a terrorist state."" Hundreds gathered in front of Russian embassy in Warsaw",https://tvn24.pl/tvn24-news-in-english/protestors-in-warsaw-accuse-russia-of-terrorism-after-missile-strikes-6156854,0.97,2479,0,2479
14,worldnews,France to deliver anti-air systems to Ukraine in coming weeks - Macron,https://www.reuters.com/world/europe/france-deliver-anti-air-systems-ukraine-coming-weeks-macron-2022-10-12/,0.97,2251,0,2251
15,worldnews,"World will likely continue facing a ‘tyrannical Russia’, Freeland warns",https://globalnews.ca/news/9192449/russia-threat-putin-ukraine-war-chrystia-freeland/,0.95,1686,0,1686
16,worldnews,"Ukrainian President Zelenskiy appeals to international donors to increase their financial support, says Ukraine needs about $55 billion to cover next year's estimated budget deficit and start to rebuild critical infrastructure",https://www.reuters.com/world/europe/ukraine-needs-3-4-bln-external-financing-per-month-next-year-imf-chief-2022-10-12/,0.93,955,0,955
17,worldnews,Britain to donate air defence missiles to Ukraine,https://www.reuters.com/world/uk/britain-donate-air-defence-missiles-ukraine-2022-10-12/,0.96,936,0,936
18,worldnews,Ukraine: UN General Assembly demands Russia reverse course on ‘attempted illegal annexation’,https://news.un.org/en/story/2022/10/1129492,0.96,721,0,721
19,worldnews,Canada to provide over $47M in new military aid to Ukraine,https://globalnews.ca/news/9193844/canada-ukraine-military-aid/,0.93,628,0,628
20,worldnews,Saudi Arabia Insists Trying To Ensure Stability Of Oil Markets And Not Siding With Russia,https://www.eurasiareview.com/13102022-saudi-arabia-insists-trying-to-ensure-stability-of-oil-markets-and-not-siding-with-russia/,0.89,518,0,518
21,worldnews,"France will deliver radar and air defence systems to Ukraine in the coming weeks to help the country protect itself from Russian drone and missile attacks, French President Emmanuel Macron said on Wednesday, adding that the war had entered ""an unprecedented stage""",https://www.france24.com/en/europe/20221012-france-to-supply-air-defence-systems-to-ukraine-after-wave-of-russian-strikes,0.96,512,0,512
22,worldnews,Leaked report shows Ontario hospital wait times increased about 54 per cent in a year,https://toronto.ctvnews.ca/leaked-report-shows-ontario-hospital-wait-times-increased-about-54-per-cent-in-a-year-1.6106256,0.92,403,0,403
23,worldnews,"/r/WorldNews Live Thread: Russian Invasion of Ukraine Day 232, Part 1 (Thread #373)",https://www.reddit.com/live/18hnzysb1elcs,0.96,401,0,401
24,worldnews,Taliban official assassinated in Afghanistan's Faryab province,https://www.aninews.in/news/world/asia/taliban-official-assassinated-in-afghanistans-faryab-province20221009151547/,0.97,314,0,314
25,worldnews,PayPal Terminates Account of Hong Kong Pro-Democracy Party Citing “Excessive Risks”,https://dailysceptic.org/2022/10/12/paypal-terminates-account-of-hong-kong-pro-democracy-party-citing-excessive-risks/,0.9,232,0,232
26,worldnews,Because of possible escalation: Musk probably blocks Starlink for Ukraine in Crimea,https://techaint.com/2022/10/13/because-of-possible-escalation-musk-probably-blocks-starlink-for-ukraine-in-crimea/,0.81,154,0,154
