,subreddit,title,url,upvote_ratio,ups,downs,score
0,worldnews,Russia to treat all ships traveling to Ukrainian ports as carriers of military cargo,https://english.alarabiya.net/News/world/2023/07/19/Russia-to-treat-all-ships-traveling-to-Ukrainian-ports-as-carriers-of-military-cargo,0.95,14232,0,14232
1,worldnews,"60,000 tonnes of agricultural products destroyed by Russian missiles were to be sent to China – Zelenskyy",https://www.pravda.com.ua/eng/news/2023/07/19/7412066/,0.96,8937,0,8937
2,worldnews,"US soldier got in fights, damaged police car before dash to North Korea",https://www.jpost.com/international/article-750598,0.97,8323,0,8323
3,worldnews,"Ukraine takes down massive bot farm, seizes 150,000 SIM cards",https://www.bleepingcomputer.com/news/security/ukraine-takes-down-massive-bot-farm-seizes-150-000-sim-cards/,0.98,5522,0,5522
4,worldnews,"Russian Agents, Who Were Going to Blow up Trains with Aid for Ukraine, Exposed in Poland",https://www.eurointegration.com.ua/eng/news/2023/07/19/7166067/,0.97,4977,0,4977
5,worldnews,"Fire destroys Russian ammo depot in Crimea, as Moscow launches ‘massive attack’ on Odesa",https://www.politico.eu/article/fire-destroys-russian-ammo-depot-in-crimea-as-moscow-launches-massive-attack-on-odesa-russia-ukraine-war/?utm_source=RSS_Feed&amp;utm_medium=RSS&amp;utm_campaign=RSS_Syndication,0.97,4763,0,4763
6,worldnews,Italy investigates Placebo singer for calling far-right PM ‘racist’ and ‘fascist’,https://www.theguardian.com/music/2023/jul/18/italy-investigates-brian-molko-placebo-singer-calls-giorgia-meloni-racist-fascist,0.95,4711,0,4711
7,worldnews,Russians prepare false flag “assault” on ZNPP – Defence Intelligence,https://www.pravda.com.ua/eng/news/2023/07/19/7412033/,0.95,4509,0,4509
8,worldnews,Kyiv Says 60K Tons of Grain Destroyed in Odesa Attack,https://www.themoscowtimes.com/2023/07/19/kyiv-says-60k-tons-of-grain-destroyed-in-odesa-attack-a81894,0.97,4412,0,4412
9,worldnews,"NASAMS, shells and equipment: US announces US$1.3 billion in new military aid to Ukraine",https://www.pravda.com.ua/eng/news/2023/07/19/7412067/,0.95,4168,0,4168
10,worldnews,US prepares sanctions against Kyrgyzstan for helping Russia circumvent sanctions – WP,https://www.pravda.com.ua/eng/news/2023/07/19/7411964/,0.97,3781,0,3781
11,worldnews,Russia announces President Vladimir Putin will not attend a BRICS nations summit in South Africa,https://www.euronews.com/2023/07/19/russia-announces-president-vladimir-putin-will-not-attend-a-brics-nations-summit-in-south-,0.97,2723,0,2723
12,worldnews,"Russia now 'totally unsafe' for foreign firms, EU warns",https://euobserver.com/ukraine/157283,0.97,2581,0,2581
13,worldnews,"Putin cut deal with Wagner 'to save his skin,' MI6 chief says in rare speech",https://www.cnn.com/2023/07/19/europe/mi6-putin-wagner-rare-speech-intl/index.html,0.97,2096,0,2096
14,worldnews,Russia's Prigozhin says his mercenaries will not fight in Ukraine for now,https://www.jpost.com/breaking-news/article-751643,0.97,1914,0,1914
15,worldnews,"Russia received millions of dollars worth of equipment from US companies to keep its oil trade afloat after the invasion of Ukraine, report says",https://markets.businessinsider.com/news/commodities/russia-oil-economy-trade-us-equipment-western-sanctions-putin-moscow-2023-7,0.95,1617,0,1617
16,worldnews,Finland to revoke license of Russian consulate,https://www.reuters.com/world/europe/finland-revoke-license-russian-consulate-2023-07-19/,0.97,1523,0,1523
17,worldnews,Zelensky: Grain corridor won’t be safe if UN limits itself to statements,https://www.ukrinform.net/rubric-polytics/3737935-zelensky-grain-corridor-wont-be-safe-if-un-limits-itself-to-statements.html,0.96,1426,0,1426
18,worldnews,Ukraine says it took out 2 Russian T-72 tanks using a US-supplied Bradley IFV,https://www.businessinsider.com/ukraine-says-destroyed-2-russian-t72-tanks-us-bradley-ifv-2023-7,0.96,1352,0,1352
19,worldnews,"Swedish embassy in Baghdad stormed, set alight",https://www.reuters.com/world/swedish-embassy-baghdad-stormed-set-alight-source-witness-2023-07-19/,0.98,1256,0,1256
20,worldnews,Active Shooting in New Zealand's Largest City Centre,https://www.nzherald.co.nz/nz/police-responding-to-unfolding-incident-in-britomart-auckland/VU72UD5WX5GZJB4T6VX4AOKHEY/,0.93,414,0,414
21,worldnews,New Zealand police respond to ‘serious incident’ in Auckland,https://www.cnn.com/2023/07/19/asia/new-zealand-auckland-incident-intl/index.html,0.93,362,0,362
22,worldnews,Four simultaneous heat domes break major records across the globe,https://www.theweathernetwork.com/en/news/weather/severe/four-simultaneous-heat-domes-break-major-records-across-the-globe,0.94,303,0,303
23,worldnews,"/r/WorldNews Live Thread: Russian Invasion of Ukraine Day 512, Part 1 (Thread #658)",https://www.reddit.com/live/18hnzysb1elcs,0.99,283,0,283
24,worldnews,"Russia may attack civilian ships in Black Sea, US officials warns",https://amp.theguardian.com/world/2023/jul/20/russia-may-attack-civilian-ships-in-black-sea-and-blame-ukraine-us-warns,0.95,222,0,222
25,worldnews,Something in space has been lighting up every 20 minutes since 1988,https://arstechnica.com/science/2023/07/new-slow-repeating-radio-source-we-have-no-idea-what-it-is/,0.93,121,0,121
