,subreddit,title,url,upvote_ratio,ups,downs,score
0,worldnews,"World risks 'collective suicide', UN chief warns climate summit | The UN's chief warned Monday that nations must cooperate or face ""collective suicide"" in the fight against climate change. ""It is either a Climate Solidarity Pact or a Collective Suicide Pact,"" he added",https://phys.org/news/2022-11-world-suicide-chief-climate-summit.html,0.94,13986,0,13986
1,worldnews,‘Racism’: Qataris decry French cartoon of national football team,https://www.aljazeera.com/news/2022/11/8/islamophobia-qataris-decry-french-cartoon-of-football-team,0.91,9737,0,9737
2,worldnews,"Iranian Protester Handed Death Sentence, Judiciary Source Says",https://iranwire.com/en/politics/109553-iranian-protester-handed-death-sentence/,0.97,6207,0,6207
3,worldnews,Zelenskyy will take part in G20 summit,https://www.pravda.com.ua/eng/news/2022/11/8/7375439/,0.95,5371,0,5371
4,worldnews,US warns Australia against joining treaty banning nuclear weapons,https://www.theguardian.com/world/2022/nov/09/us-warns-australia-against-joining-treaty-banning-nuclear-weapons,0.95,4715,0,4715
5,worldnews,"Russia flew €140m in cash and captured Western weapons to Iran in return for deadly drones, source claims",https://news.sky.com/story/russia-gave-8364140m-and-captured-western-weapons-to-iran-in-return-for-deadly-drones-source-claims-12741742,0.97,4084,0,4084
6,worldnews,Zelensky Says Ukraine-Russia War Can End Under These Five Conditions,https://www.newsweek.com/ukraine-russia-war-conflict-end-volodymyr-zelensky-peace-talks-five-conditions-1757893,0.95,4027,0,4027
7,worldnews,"Oil, Steel Industry Workers Join Strikes In Iran",https://www.iranintl.com/en/202211082635,0.98,3450,0,3450
8,worldnews,"Police have searched two branches of Swiss bank UBS in Germany in connection with alleged money laundering by a Russian businessman, according to German officials and media.",https://www.swissinfo.ch/eng/business/ubs-raided-in-money-laundering-probe-of-russian/48040190,0.97,2994,0,2994
9,worldnews,U.S. Representative to UN: We will hold Russia accountable for war crimes,https://www.ukrinform.net/rubric-ato/3610406-us-representative-to-un-we-will-hold-russia-accountable-for-war-crimes.html,0.96,2123,0,2123
10,worldnews,"The UN's chief called Tuesday for an end to a ""toxic cover-up"" by companies as a sweeping report said they cannot claim to be net zero if they invest in new fossil fuels, cause deforestation or offset emissions instead of reducing them",https://www.france24.com/en/live-news/20221108-toxic-cover-up-un-draws-red-line-around-net-zero-greenwashing,0.96,1594,0,1594
11,worldnews,UK police have arrested journalists covering demonstrations by environmental group Just Stop Oil despite being told they are members of the press,https://morningstaronline.co.uk/article/b/journalists-among-those-arrested-just-stop-oil-protest,0.93,1339,0,1339
12,worldnews,India to continue buying oil from Russia as ties deepen,https://www.aljazeera.com/news/2022/11/8/india-to-continue-buying-oil-from-russia-as-ties-deepen,0.91,1214,0,1214
13,worldnews,"Russia flew €140m in cash and captured Western weapons to Iran in return for deadly drones, source claims",https://news.sky.com/story/russia-gave-eur140m-and-captured-western-weapons-to-iran-in-return-for-deadly-drones-source-claims-12741742,0.94,1116,0,1116
14,worldnews,Iran's defiant protesters face mounted police as death toll from crackdown tops 300,https://www.cbsnews.com/news/iran-news-protests-lastest-death-toll-sentences-arrests-mahsa-amini/,0.97,1085,0,1085
15,worldnews,N. Korea denies US claims it sent artillery shells to Russia,https://apnews.com/article/europe-united-states-south-korea-moscow-north-e9b82adb07b67f64b83853e6a8108ecc,0.96,947,0,947
16,worldnews,Russian war destroyed 2M hectares of forests in Ukraine in less than six months - Zelensky,https://www.ukrinform.net/rubric-ato/3610390-russian-war-destroyed-2m-hectares-of-forests-in-ukraine-in-less-than-six-months-zelensky.html,0.95,876,0,876
17,worldnews,US and Russia agree to hold talks on nuclear treaty for first time since Ukraine war began,https://edition.cnn.com/2022/11/08/politics/us-russia-nuclear-treaty-talks/index.html,0.94,665,0,665
18,worldnews,India praises ‘strong and steady’ relationship with Russia as foreign ministers meet in Moscow,https://www.scmp.com/news/world/article/3198945/india-praises-strong-and-steady-relationship-russia-foreign-ministers-meet-moscow?module=more_top_stories_asia&amp;pgtype=homepage,0.89,461,0,461
19,worldnews,Polarizing 'Vancouver Is Dying' documentary amasses 2 million views,https://bc.ctvnews.ca/polarizing-vancouver-is-dying-documentary-amasses-2-million-views-1.6140324,0.78,455,0,455
20,worldnews,"Knowledge Of Kazakh Language, History, Laws To Be Mandatory For Those Seeking Citizenship",https://www.rferl.org/a/kazakhstan-citizenship-russia-ukraine-war/32121109.html,0.94,414,0,414
21,worldnews,California Powerball player to claim record $2 billion jackpot,https://www.reuters.com/world/us/drawing-record-19-bln-us-powerball-jackpot-delayed-2022-11-08/?utm_campaign=fullarticle&amp;utm_medium=referral&amp;utm_source=inshorts,0.92,392,0,392
22,worldnews,Bolsonaro’s sons request Italian citizenship,https://thehill.com/policy/international/3725784-bolsonaros-sons-request-italian-citizenship/,0.91,339,0,339
23,worldnews,"/r/WorldNews Live Thread: Russian Invasion of Ukraine Day 259, Part 1 (Thread #400)",https://www.reddit.com/live/18hnzysb1elcs,0.97,321,0,321
24,worldnews,Putin's Military Suffers Over 700 Deaths in One Day of War: Ukraine,https://www.newsweek.com/vladimir-putin-russian-military-suffers-700-deaths-one-day-ukraine-says-1758082,0.93,169,0,169
25,worldnews,"8-year old boy bites venomous cobra twice after getting attacked, kills it: report",https://people.com/human-interest/8-year-old-boy-bites-venomous-cobra-twice-after-getting-attacked-kills-it-report/,0.89,140,0,140
26,worldnews,"EU's Executive Vice-President: Regulation of social media 🎙 Reddit Talk, Monday 14 November 2022, 08h00 UTC",https://i.redd.it/qlc02uisaqy91.png,0.74,133,0,133
