,subreddit,title,url,upvote_ratio,ups,downs,score
0,worldnews,Fugitive former Polish Justice Minister Zbigniew Ziobro is now in the United States courtesy of a visa from President Donald Trump after fleeing Hungary,https://www.politico.eu/article/ex-poland-justice-minister-ziobro-flees-us-hungary-orban-magyar-tusk-trump/,0.97,16424,0,16424
1,worldnews,Putin Warns Armenia It Could Face “Ukraine Scenario” Over EU Ambitions,https://united24media.com/world/putin-warns-armenia-it-could-face-ukraine-scenario-over-eu-ambitions-18637,0.97,10786,0,10786
2,worldnews,Vatican recognises the 'pain' experienced by LGBTQ+ Catholics in landmark report,https://www.attitude.co.uk/news/vatican-recognises-pain-lgbtq-catholics-landmark-report-521845/?fbclid=PARlRTSARuFexleHRuA2FlbQIxMQBzcnRjBmFwcF9pZA8xMjQwMjQ1NzQyODc0MTQAAaerXRNoRJ4-0onF_HuFf2B93mHXuMAkro33TuAvb-xzucth_xlLXg_9flduaw_aem_JDXwtn8kuPJDL4_PFM2nig,0.95,9091,0,9091
3,worldnews,"Russia breaks 3-day ceasefire as strikes kill 1, injure 19 across Ukraine",https://kyivindependent.com/russia-breaks-3-day-ceasefire-as-strikes-kill-1-injure-19-across-ukraine/,0.97,6377,0,6377
4,worldnews,Iran responds to US ceasefire proposal but Trump rejects it as 'unacceptable',https://apnews.com/article/iran-us-war-attack-may-10-2026-f8812db41837336d816efaea7bc1c44a?utm_source=onesignal&amp;utm_medium=push&amp;utm_campaign=2026-05-10-Breaking+News,0.96,4484,0,4484
5,worldnews,Russian frigate spotted in UK waters as Putin brazenly steps up his 'grey war',https://inews.co.uk/news/russian-frigate-spotted-uk-waters-putin-grey-war-4409627,0.96,3632,0,3632
6,worldnews,Trump calls Iran’s response to U.S. peace proposal ‘totally unacceptable’,https://www.nbcnews.com/world/iran/iran-responded-us-proposal-peace-talks-state-media-reports-rcna344404,0.93,2879,0,2879
7,worldnews,IDF chief warns lawmakers that army 'will fall apart' without additional soldiers,https://www.ynetnews.com/article/rjre64rrwx,0.92,2487,0,2487
8,worldnews,Netanyahu: Iran war ‘not over’ until enriched uranium is removed | Watch,https://www.ynetnews.com/article/hycu17a0bl,0.91,2163,0,2163
9,worldnews,"Donald Trump warns Iran will 'be laughing no longer', condemns regime's behavior | The Jerusalem Post",https://www.jpost.com/middle-east/iran-news/article-895731,0.81,744,0,744
10,worldnews,EU’s Kallas rejects Gerhard Schröder as Russia-Ukraine negotiator,https://www.politico.eu/article/kaja-kallas-rejects-gerhard-schroder-as-russia-ukraine-negotiator/,0.96,678,0,678
11,worldnews,"Trump's visit to China will focus on Iran issue, demand more pressure on Tehran, US officials say",https://www.jpost.com/middle-east/iran-news/article-895738,0.91,520,0,520
12,worldnews,Ukraine expects American guarantees for prisoner exchange with Russia,https://english.nv.ua/russian-war/zelenskyy-says-1-000-for-1-000-prisoner-exchange-is-being-prepared-50606726.html,0.91,354,0,354
13,worldnews,Japan's Ibaraki launches reward program for tips on illegal foreign workers,https://english.kyodonews.net/articles/-/75681,0.93,258,0,258
14,worldnews,"/r/WorldNews Live Thread: Russian Invasion of Ukraine Day 1537, Part 1 (Thread #1684)",https://www.reddit.com/live/18hnzysb1elcs,0.96,222,0,222
15,worldnews,/r/WorldNews Discussion Thread: US and Israel launch attack on Iran; Iran retaliates (Thread #17),https://www.reddit.com/r/worldnews/comments/1t1399d/rworldnews_discussion_thread_us_and_israel_launch/,0.88,207,0,207
16,worldnews,Japan and Philippines agree to weapons pact talks as China’s ‘coercive activities’ cause alarm,https://apnews.com/article/japan-philippines-defense-koizumi-marcos-balikatan-3c337bba04f0079278eff1436f177ad5,0.91,192,0,192
17,worldnews,"EU to approve sanctions on Israeli settlers, says Kallas",https://www.politico.eu/article/eu-expected-to-approve-sanctions-on-israeli-settlers-says-kaja-kallas/,0.94,176,0,176
18,worldnews,North Korea earned half of its GDP from supporting Russia's war against Ukraine,https://www.pravda.com.ua/eng/news/2026/05/11/8034153/,0.99,166,0,166
19,worldnews,South Korea Exploring Using Hyundai Robots as Army Numbers Fall,https://www.bloomberg.com/news/articles/2026-05-11/south-korea-exploring-using-hyundai-robots-as-army-numbers-fall,0.93,163,0,163
20,worldnews,"Iran war: PM Modi urges Indians to work from home, limit foreign travel",https://www.bbc.com/news/articles/c8r8e2ne1v6o,0.91,143,0,143
21,worldnews,Nuclear reactor in central Japan halted after steam leak near turbine,https://japantoday.com/category/national/nuclear-reactor-in-central-japan-halted-after-steam-leak-near-turbine,0.8,130,0,130
22,worldnews,Spain calls for an EU army,https://www.politico.eu/newsletter/brussels-playbook/spain-calls-for-an-eu-army/,0.95,119,0,119
23,worldnews,Israeli settlers force Palestinian family to exhume and rebury their father,https://www.npr.org/2026/05/10/nx-s1-5817496/israeli-settlers-palestinian-exhume-grave-west-bank-jenin,0.68,114,0,114
24,worldnews,"Trump to Visit China From May 13-15, First Time Since 2017",https://www.timesnownews.com/world/us/us-news/trump-to-visit-china-from-may-13-15-first-time-since-2017-article-154290791,0.92,45,0,45
