,subreddit,title,url,upvote_ratio,ups,downs,score
0,worldnews,Putin Warns West Current World Order Is Over and New Era Is Coming,https://www.newsweek.com/russia-putin-moscow-west-economics-world-order-1726686,0.83,54095,0,54095
1,worldnews,"Trudeau: Conservatives' unwillingness to prioritize climate change policy ""boggles my mind""",https://cultmtl.com/2022/07/justin-trudeau-conservatives-think-you-can-have-a-plan-for-the-economy-without-a-plan-for-the-environment-canada/,0.8,39090,0,39090
2,worldnews,"Boris Johnson signs off with ‘Hasta la vista, baby’ as he exits parliament",https://nypost.com/2022/07/21/boris-johnson-signs-off-with-hasta-la-vista-baby-as-he-exits-parliament/,0.91,32824,0,32824
3,worldnews,Teenage Girls Serving in British Army Report Record Levels of Sexual Assault,https://www.vice.com/en/article/xgydwj/british-army-sexual-assault,0.95,9037,0,9037
4,worldnews,Reports of nearly 40% rise in bankruptcies of Russian citizens in first half of 2022,https://egyptindependent.com/reports-of-nearly-40-rise-in-bankruptcy-in-first-half-of-2022/,0.97,4525,0,4525
5,worldnews,Artifacts seized from US billionaire Michael Steinhardt among 142 looted items returned to Italy - CNN,https://www.cnn.com/style/article/us-returns-looted-artifacts-italy/index.html,0.98,3530,0,3530
6,worldnews,Beloved monarch butterflies now listed as endangered,https://apnews.com/article/science-north-america-insects-butterflies-climate-and-environment-c5e406e2f01c731167393296c19c302b,0.97,3029,0,3029
7,worldnews,Chechen leader awaits Putin's order to tear West 'to pieces' - Observer,https://weldbham.com/chechen-leader-awaits-putins-order-to-tear-west-to-pieces-observer/,0.86,2678,0,2678
8,worldnews,"Vatican slams German reformers, warns of potential for schism | In February, they called on the Catholic Church to allow priests to marry, women to become deacons, and same-sex couples to receive the Church's blessing.",https://www.dw.com/en/vatican-slams-german-reformers-warns-of-potential-for-schism/a-62559108,0.95,2573,0,2573
9,worldnews,"There are 40 percent more tigers in the wild than previously thought, but with a maximum of 5,578 on the prowl, they remain an endangered species, conservationists said Thursday",https://www.france24.com/en/live-news/20220721-wild-tiger-numbers-higher-than-previously-thought,0.98,2415,0,2415
10,worldnews,Moscow says US must respect Russian law in Griner case,https://sports.yahoo.com/moscow-says-us-must-respect-114844309.html,0.91,2130,0,2130
11,worldnews,Russia officially calls for Jewish Agency operations to be 'dissolved' - state media,https://www.timesofisrael.com/russia-officially-calls-for-jewish-agency-operations-to-be-dissolved-state-media/,0.96,1923,0,1923
12,worldnews,Ukraine Says Russia Storing Weapons at Occupied Nuclear Plant,https://www.themoscowtimes.com/2022/07/21/ukraine-says-russia-storing-weapons-at-occupied-nuclear-plant-a78371,0.95,1566,0,1566
13,worldnews,Russia's failing to destroy any U.S. HIMARS systems: Pentagon,https://www.newsweek.com/pentagon-says-russia-has-not-destroyed-us-himars-systems-ukraine-1726945,0.96,1205,0,1205
14,worldnews,A captive-born jaguar released into Argentina's Ibera National Park last year has given birth to two cubs -- the first to be born wild in the protected wetland in 70 years,https://www.france24.com/en/live-news/20220721-first-wild-jaguars-in-70-years-born-in-argentina-national-park,0.97,930,0,930
15,worldnews,"Russia 'looting' steel bound for Europe and UK, says Metinvest boss",https://www.bbc.com/news/business-62252704,0.95,717,0,717
16,worldnews,Nuclear Power Plants Are Struggling to Stay Cool,https://www.wired.com/story/nuclear-power-plants-struggling-to-stay-cool/,0.89,713,0,713
17,worldnews,Moscow Wants North Korean Labourers Sent To Donbas In Exchange For Machinery And Wheat,https://www.donkeyjunk.com/post/moscow-wants-north-korean-labours-sending-to-donbas-in-exchange-for-machinery-and-wheat,0.8,677,0,677
18,worldnews,Norway becomes 10th European state to reject Israel's blacklisting of Palestinian NGOs,https://www.haaretz.com/israel-news/2022-07-21/ty-article/.premium/norway-becomes-10th-european-state-to-reject-israels-blacklisting-of-palestinian-ngos/00000182-2137-d76f-a9ae-27bf592f0000,0.9,591,0,591
19,worldnews,Zelenskiy says Ukraine can inflict major damage to Russian forces,https://www.msn.com/en-us/news/world/zelenskiy-says-ukraine-can-inflict-major-damage-to-russian-forces/ar-AAZQ1yU?ocid=EMMX&amp;cvid=67a9d63ae4234e54b47eeef21008ba12,0.92,422,0,422
20,worldnews,India : Supreme Court Allows Unmarried Woman To End Pregnancy At 24 Weeks,https://www.ndtv.com/india-news/supreme-court-expands-medical-termination-of-pregnancy-act-to-include-unmarried-woman-allows-to-abort-24-weeks-fetus-3180933,0.94,365,0,365
21,worldnews,A U.K. meteorologist warned of deadly heat. He was told to cheer up.,https://www.washingtonpost.com/nation/2022/07/21/heat-wave-britain-news-segment/,0.93,361,0,361
22,worldnews,Women have right to safe abortion: Supreme Court - The Hindu,https://www.thehindu.com/news/national/refusing-safe-abortion-to-unmarried-woman-violation-of-her-personal-autonomy-sc/article65668003.ece?homepage=true,0.89,332,0,332
23,worldnews,"/r/WorldNews Live Thread: Russian Invasion of Ukraine Day 149, Part 1 (Thread #289)",https://www.reddit.com/live/18hnzysb1elcs,0.96,267,0,267
24,worldnews,"Over 1,000 killed in Spain's heatwave; temperature tops 40 deg C",https://www.business-standard.com/article/international/over-1-000-killed-in-spain-s-heatwave-temperature-tops-40-deg-c-122072200117_1.html?utm_source=SEO&amp;utm_medium=Shub,0.95,190,0,190
25,worldnews,Russia Sends Army Recruits to Fight in Ukraine After Just Days of Training,https://www.themoscowtimes.com/2022/07/20/russia-sends-army-recruits-to-fight-in-ukraine-after-just-days-of-training-a78314,0.97,182,0,182
