,subreddit,title,url,upvote_ratio,ups,downs,score
0,worldnews,The Republic of Niger Announces Mobilization to “Prepare for War with France”,https://militarnyi.com/en/news/the-republic-of-niger-announces-mobilization-to-prepare-for-war-with-france/,0.97,15110,0,15110
1,worldnews,"Alexei Navalny died after being poisoned with dart frog toxin, UK and allies say",https://news.sky.com/story/navalny-died-after-being-poisoned-with-dart-frog-toxin-13507402,0.97,14771,0,14771
2,worldnews,"Zelenskiy says US too often asks Ukraine, not Russia, for concessions",https://www.reuters.com/business/aerospace-defense/zelenskiy-says-us-too-often-asks-ukraine-not-russia-concessions-2026-02-14/,0.98,10336,0,10336
3,worldnews,"Air India flight 171 crash: Pilot deliberately cut fuel switch, report reveals",https://www.khaleejtimes.com/world/asia/air-india-flight-171-crash-pilot-deliberately-cut-fuel-switch-report-says,0.96,6083,0,6083
4,worldnews,“We are f—”: 10 Ukrainians with drones wipe out two NATO battalions in war game,https://euromaidanpress.com/2026/02/13/nato-exercise-reveals-alliance-cant-survive-ukraine-style-drone-warfare/,0.95,3697,0,3697
5,worldnews,Orban says EU bigger threat to Hungary than Russia,https://www.dw.com/en/orban-says-eu-bigger-threat-to-hungary-than-russia/a-75974022?maca=en-rss-en-all-1573-rdf,0.94,3574,0,3574
6,worldnews,"Using Starlink ruse, Ukrainian cyber forces trick Russian soldiers into revealing positions, donating to armed forces",https://kyivindependent.com/using-starlink-ruse-ukrainian-cyber-forces-trick-russian-soldiers-into-revealing-positions-donating-to-armed-forces/,0.98,3326,0,3326
7,worldnews,Doctors Without Borders suspends activities at Gaza hospital due to presence of gunmen,https://www.timesofisrael.com/doctors-without-borders-suspends-activities-at-gaza-hospital-due-to-presence-of-gunmen/,0.93,2155,0,2155
8,worldnews,"Ukraine destroys half of Russia's 'key' Pantsir air defense systems, security service says",https://kyivindependent.com/ukraine-destroys-half-of-russias-key-pantsir-air-defense-systems-security-service-says/,0.98,2129,0,2129
9,worldnews,Ukrainian forces destroyed half of Russia's Pantsir missile systems in 2025 – Ukraine's Security Service,https://www.pravda.com.ua/eng/news/2026/02/14/8021036/,0.96,2072,0,2072
10,worldnews,Macron urges calm after far-right activist fatally beaten,https://www.lemonde.fr/en/france/article/2026/02/15/macron-urges-calm-after-far-right-activist-fatally-beaten_6750495_7.html,0.93,1623,0,1623
11,worldnews,"North York demonstration draws 350,000 in support of anti-government protesters in Iran: Toronto police",https://www.cbc.ca/news/canada/toronto/iran-support-rally-toronto-february-14-2026-9.7090479,0.94,1523,0,1523
12,worldnews,Zelenskyy blasts Orbán: Grows his belly instead of his army,https://newsukraine.rbc.ua/news/zelenskyy-blasts-orb-n-grows-his-belly-instead-1771073043.html,0.97,1307,0,1307
13,worldnews,Hungarian opposition leader says sex-tape is ‘Russian-style’ smear operation,https://tvpworld.com/91558279/pter-magyar-denies-wrongdoing-ahead-of-blackmail-video,0.98,1126,0,1126
14,worldnews,More than 60 children infected in north London measles outbreak,https://www.theguardian.com/society/2026/feb/14/more-than-60-children-infected-in-north-london-measles-outbreak?CMP=Share_AndroidApp_Other,0.97,915,0,915
15,worldnews,"200,000 people protest against Iran regime as world leaders gather nearby",https://news.sky.com/story/200-000-people-protest-against-iran-regime-as-world-leaders-gather-nearby-13507668,0.93,833,0,833
16,worldnews,"About 200,000 people joined a demonstration against the Iranian government in Munich on Saturday, police say",https://www.rfi.fr/en/international-news/20260214-about-200-000-join-iran-demonstration-in-munich-police,0.93,789,0,789
17,worldnews,Iran’s crown prince says survival of Tehran government 'sends a clear signal to every bully',https://apnews.com/article/iran-munich-protests-reza-pahlavi-53d2448dd26d28a1206ecefdfde168f2,0.89,631,0,631
18,worldnews,Son of Iran’s Last Shah Urges US Military Intervention in Iran,https://www.reuters.com/world/middle-east/son-irans-last-shah-urges-us-military-intervention-iran-2026-02-14/,0.82,552,0,552
19,worldnews,"Record 1,000 UK taxpayers under 30 earned more than £1m last year",https://www.theguardian.com/money/2026/feb/14/record-1000-uk-taxpayers-under-30-earned-more-than-1m-last-year,0.85,461,0,461
20,worldnews,France: Navalny poisoning shows Putin ready to use nerve agents on own people,https://www.reuters.com/world/france-navalny-poisoning-shows-putin-ready-use-nerve-agents-own-people-2026-02-14/,0.96,441,0,441
21,worldnews,Canada has officially joined the EU's loans-for-weapons program,https://www.cbc.ca/news/politics/canada-eu-safe-agreement-defence-loans-weapons-9.7090635,0.96,268,0,268
22,worldnews,Indonesia Seals Tiffany Stores on Suspicion of Illegal Imports,https://www.businessoffashion.com/news/luxury/indonesia-seals-tiffany-stores-on-suspicion-of-illegal-imports/,0.9,160,0,160
23,worldnews,China to implement zero tariffs on imports from 53 African countries,https://www.reuters.com/world/asia-pacific/china-implement-zero-tariffs-imports-53-african-countries-2026-02-14/,0.94,132,0,132
24,worldnews,"/r/WorldNews Live Thread: Russian Invasion of Ukraine Day 1452, Part 1 (Thread #1599)",https://www.reddit.com/live/18hnzysb1elcs,0.96,96,0,96
