,subreddit,title,url,upvote_ratio,ups,downs,score
0,worldnews,"“We simply don’t have any left”: Germany has run out of air defense missiles for Ukraine, foreign minister says",https://euromaidanpress.com/2026/02/17/germany-has-run-out-of-air-defense-missiles-for-ukraine/,0.95,30733,0,30733
1,worldnews,Major European allies decline to join first meeting of Trump’s Board of Peace,https://www.theguardian.com/us-news/2026/feb/18/trump-board-of-peace-first-meeting,0.97,17981,0,17981
2,worldnews,Kremlin threatens to deploy navy if Europe seizes more Russian shadow fleet vessels,https://kyivindependent.com/kremlin-threatens-to-deploy-navy-if-europe-seizes-more-russian-vessels/,0.96,16328,0,16328
3,worldnews,Trump ally calls Danish PM ‘little lady’ in foul-mouthed Greenland rant,https://www.yahoo.com/news/articles/trump-ally-calls-danish-pm-115744553.html,0.96,4259,0,4259
4,worldnews,Macron Blasts Social Media’s Free Speech Defense as ‘Bullshit’,https://www.bloomberg.com/news/articles/2026-02-18/macron-blasts-social-media-s-free-speech-defense-as-bullshit,0.96,3600,0,3600
5,worldnews,"Amazon deforestation on pace to be the lowest on record, says Brazil",https://news.mongabay.com/2026/02/amazon-deforestation-on-pace-to-be-the-lowest-on-record-says-brazil/,0.98,2815,0,2815
6,worldnews,Israel on high alert as officials assess imminent US strike on Iran; security cabinet meeting postponed,https://www.ynetnews.com/article/hjxujdm00zg#google_vignette,0.94,1741,0,1741
7,worldnews,"Ukrainian forces advance in Dnipropetrovsk region, war monitor reports",https://gwaramedia.com/en/ukrainian-forces-advance-in-dnipropetrovsk-region-war-monitor-reports/?utm_source=Reddit,0.97,1391,0,1391
8,worldnews,Trump has discussed timeline for Iran strikes — including as soon as this weekend — but no decision yet,https://www.cbsnews.com/news/trump-possible-timeline-iran-strikes/,0.95,1318,0,1318
9,worldnews,"Ukraine in exchange for money: US-Russia deal revenues could reach only $340 billion, far short of claimed $12 trillion",https://euromaidanpress.com/2026/02/18/ukraine-in-exchange-for-money-us-russia-deal-revenues-could-reach-only-340-billion-far-short-of-claimed-12-trillion/,0.97,1233,0,1233
10,worldnews,Canada to add three new permanent residency streams to Express Entry immigration program,https://www.thestar.com/news/canada/canada-expanding-express-entry-immigration/article_0791fdfb-3691-43af-b009-1e02adf1e572.html,0.93,1053,0,1053
11,worldnews,Ukraine imposes sanctions against Belarus' Lukashenko for aiding Russia's war,https://www.reuters.com/business/aerospace-defense/ukraine-imposes-sanctions-against-belarus-lukashenko-aiding-russias-war-2026-02-18/,0.97,1046,0,1046
12,worldnews,'It's overwhelming': Plastic from 1960s Canada washes up on Orkney's Sanday,https://www.bbc.com/news/articles/c2k8g4p44l0o,0.96,1026,0,1026
13,worldnews,"Zelensky says Ukraine won’t withdraw from Donbas, 'won’t lose dignity' as peace talks stall on territory",https://kyivindependent.com/zelensky-says-ukraine-wont-withdraw-from-donbas-wont-lose-dignity-as-peace-talks-stall-on-territory/,0.97,947,0,947
14,worldnews,[Canada] Conservative MP Matt Jeneroux joins Liberal caucus: Carney,https://www.cbc.ca/news/politics/jeneroux-joins-liberals-9.7095322,0.94,899,0,899
15,worldnews,"Russia Removes Key Economic Data From Public Access, Ukraine Intelligence Says",https://united24media.com/latest-news/russia-removes-key-economic-data-from-public-access-ukraine-intelligence-says-16035,0.96,642,0,642
16,worldnews,US plans online portal to bypass content bans in Europe and elsewhere,https://www.reuters.com/world/us-plans-online-portal-bypass-content-bans-europe-elsewhere-2026-02-18/,0.94,605,0,605
17,worldnews,Russian Mi-28s And Su-35s Won’t Revitalize Iran’s Dilapidated Military,https://www.forbes.com/sites/pauliddon/2026/02/18/russian-mi-28s-and-su-35s-wont-revitalize-irans-dilapidated-military/,0.94,193,0,193
18,worldnews,Former South Korean President Yoon Sentenced to Life in Prison for Coup Attempt,https://www.bloomberg.com/news/articles/2026-02-19/ousted-korean-president-yoon-sentenced-to-life-over-martial-law?embedded-checkout=true,0.99,132,0,132
19,worldnews,‘It’s a catastrophe’: Wellington rages as millions of litres of raw sewage pour into ocean | New Zealand,https://www.theguardian.com/world/2026/feb/19/wellington-raw-sewage-leak-spill-water-new-zealand,0.97,131,0,131
20,worldnews,Iran security official appears to fire on crowd at cemetery,https://www.bbc.com/news/articles/cly8q62qe71o,0.93,122,0,122
21,worldnews,"/r/WorldNews Live Thread: Russian Invasion of Ukraine Day 1456, Part 1 (Thread #1603)",https://www.reddit.com/live/18hnzysb1elcs,0.93,118,0,118
22,worldnews,US to withdraw troops from Syria amid Iran tensions,https://www.bbc.com/news/articles/c875pey8vy2o,0.9,100,0,100
23,worldnews,Hungary will suspend diesel shipments to Ukraine over interruption to Russian oil supply,https://apnews.com/article/hungary-ukraine-diesel-shipments-russia-pipeline-dispute-7f075973bd1fea8de33b72a5823e8774,0.87,98,0,98
24,worldnews,Yoon Suk Yeol sentenced to life in prison for leading insurrection in South Korea | Yoon Suk Yeol,https://www.theguardian.com/world/2026/feb/19/yoon-suk-yeol-sentenced-to-life-in-prison-for-leading-insurrection-in-south-korea,0.97,28,0,28
