,subreddit,title,url,upvote_ratio,ups,downs,score
0,worldnews,Russia offers political asylum to Elon Musk over Trump feud,https://www.newsweek.com/russia-offers-political-asylum-elon-musk-over-trump-feud-2081887,0.92,67410,0,67410
1,worldnews,"Russian weapons plant hit by drones in Tambov Oblast, media reports attacks across country",https://kyivindependent.com/russian-weapons-plant-hit-by-drones-in-tambov-oblast-media-reports/,0.98,13850,0,13850
2,worldnews,Germany's Merz says some US lawmakers have 'no idea' of scale of Russia's rearmament,https://www.straitstimes.com/world/europe/germanys-merz-says-some-us-lawmakers-have-no-idea-of-scale-of-russias-rearmament,0.98,12737,0,12737
3,worldnews,Russia bombards Kyiv after Putin vows revenge for Operation Spiderweb,https://www.theguardian.com/world/2025/jun/06/russia-mounts-deadly-barrage-of-kyiv-after-vowing-revenge-for-ukraine-attack-on-bomber-fleet,0.96,8113,0,8113
4,worldnews,"Drones Hit Russian Airbases, Oil Depot, and Missile Plant as Moscow Strikes Ukraine",https://www.kyivpost.com/post/54074,0.97,7704,0,7704
5,worldnews,Russia killed at least 125 journalists during full-scale invasion of Ukraine,https://gwaramedia.com/en/russia-killed-at-least-125-journalists-during-full-scale-invasion-of-ukraine/,0.97,5515,0,5515
6,worldnews,"Russia's Wagner mercenary group says it is leaving Mali after ""mission accomplished""",https://www.reuters.com/world/africa/russias-wagner-mercenary-group-says-it-is-leaving-mali-after-mission-2025-06-06/?taid=68430bd8a203130001b4e770,0.97,4574,0,4574
7,worldnews,Ukraine to Receive More IRIS-T Missile Systems From Germany,https://thedefensepost.com/2025/06/05/ukraine-missile-systems-germany/,0.99,3549,0,3549
8,worldnews,‘It was our hope spot’: scientists heartbroken as pristine coral gardens hit by Western Australia’s worst bleaching event | Climate crisis,https://www.theguardian.com/environment/2025/jun/07/wa-coral-unprecedented-bleaching-event-ningaloo-reef,0.98,2778,0,2778
9,worldnews,"4 IDF soldiers killed, 5 wounded after booby-trapped south Gaza building collapses",https://www.timesofisrael.com/4-idf-soldiers-killed-5-wounded-after-booby-trapped-south-gaza-building-collapses/,0.79,1992,0,1992
10,worldnews,Iran orders material from China that can make some 800 ballistic missiles.,https://www.timesofisrael.com/iran-orders-material-from-china-that-can-make-some-800-ballistic-missiles-report/,0.95,1825,0,1825
11,worldnews,India vows to keep up development in Kashmir after tourist attack,https://www.reuters.com/world/asia-pacific/india-vows-keep-up-development-kashmir-after-tourist-attack-2025-06-06/,0.93,1630,0,1630
12,worldnews,"Trump offers Germany US gas deals, but no promises on Ukraine aid or Russia sanctions",https://kyivindependent.com/trump-offers-germany-us-gas-deals-but-no-promises-on-ukraine-aid-or-russia-sanctions/,0.95,1419,0,1419
13,worldnews,Canada: premature baby with measles dies amid outbreak in Ontario,https://www.theguardian.com/world/2025/jun/05/canada-premature-infant-measles-death,0.97,1137,0,1137
14,worldnews,Canada's Liberals to fast-track major projects in new bill with 'goal' of two-year approval,https://nationalpost.com/news/politics/liberal-government-trade-barriers-fast-track-major-projects-in-new-bill?utm_source=reddit&amp;utm_medium=organic&amp;utm_campaign=NP_social,0.96,1100,0,1100
15,worldnews,Carney and Li agree to regularize communication between Canada and China,https://www.thecanadianpressnews.ca/national/carney-and-li-agree-to-regularize-communication-between-canada-and-china/article_6de4ef00-fbd4-5511-a48d-087dd11c02c2.html,0.95,1020,0,1020
16,worldnews,"Three killed, 49 wounded in intense Russian air attacks on Ukraine",https://www.reuters.com/world/europe/russian-drones-attack-kyiv-witnesses-report-explosions-fire-2025-06-05/,0.96,1000,0,1000
17,worldnews,"A Maltese court convicted two men of supplying explosives used to assassinate an investigative journalist. Daphne Caruana Galizia, who reported on government corruption, was killed with a car bomb.",https://www.dw.com/en/malta-two-convicted-in-2017-murder-of-journalist/a-72823586,0.97,768,0,768
18,worldnews,"Russia responds to Trump-Musk feud with jokes, jibes and job offers",https://www.reuters.com/business/media-telecom/russia-responds-trump-musk-feud-with-jokes-jibes-job-offers-2025-06-06/,0.95,694,0,694
19,worldnews,"Israel: Bennett's New Party Leads in Polls, Netanyahu's Coalition Collapses",https://www.agenzianova.com/en/news/israel-bennett%27s-new-party-leads-in-polls-netanyahu%27s-coalition-collapses/,0.96,297,0,297
20,worldnews,"Europe can sustain Ukraine's war effort without US, German general says",https://www.reuters.com/business/aerospace-defense/europe-can-sustain-ukraines-war-effort-without-us-german-general-says-2025-06-06/,0.97,261,0,261
21,worldnews,Nvidia's research boss claims the company's Chinese AI researchers are now writing programs for Huawei instead and is blaming the US chip exports,https://www.pcgamer.com/hardware/processors/nvidias-research-boss-claims-the-companys-chinese-ai-researchers-are-now-writing-programs-for-huawei-instead-and-is-blaming-the-us-chip-exports/,0.92,165,0,165
22,worldnews,South Korea's president Lee invited to attend G7 summit,https://m.koreaherald.com/article/10503940,0.95,155,0,155
23,worldnews,"/r/WorldNews Live Thread: Russian Invasion of Ukraine Day 1199, Part 1 (Thread #1346)",https://www.reddit.com/live/18hnzysb1elcs,0.96,149,0,149
24,worldnews,Vladimir Putin’s sickening statistic: 1m Russian casualties in Ukraine,https://www.economist.com/international/2025/06/02/vladimir-putins-sickening-statistic-1m-russian-casualties-in-ukraine,0.92,65,0,65
25,worldnews,Biggest drone strike yet on Ukraine's second city,https://www.bbc.com/news/articles/cwyjd1z8yg5o,0.93,65,0,65
