,subreddit,title,url,upvote_ratio,ups,downs,score
0,worldnews,Pope Leo calls for Venezuela to remain an independent country,https://www.reuters.com/world/americas/pope-leo-calls-venezuela-remain-an-independent-country-2026-01-04/,0.95,22295,0,22295
1,worldnews,Danish PM tells Trump to stop 'threats' against Greenland,https://www.bbc.com/news/articles/c4g0zg974v1o?at_medium=RSS&amp;at_campaign=rss,0.97,20071,0,20071
2,worldnews,"Donald Trump: “We do need Greenland, absolutely” | Polar Journal",https://polarjournal.net/donald-trump-we-absolutely-need-greenland/,0.93,18150,0,18150
3,worldnews,Canadian officials say US health institutions no longer dependable for accurate information,https://www.theguardian.com/world/2026/jan/04/canada-us-health-institutions-information,0.97,10759,0,10759
4,worldnews,China says it cannot accept countries acting as world judge after US captures Maduro,https://www.reuters.com/world/china/china-says-it-cannot-accept-countries-acting-world-judge-after-us-captures-2026-01-05/,0.95,8469,0,8469
5,worldnews,Trump Threatens Venezuela’s New Leader With a Fate Worse Than Maduro’s,https://www.theatlantic.com/national-security/2026/01/trump-venezuela-maduro-delcy-rodriguez/685497/,0.95,5649,0,5649
6,worldnews,Khamenei plans to flee to Russia if protests not crushed,https://www.iranintl.com/en/202601048903,0.96,4862,0,4862
7,worldnews,"Trump threatens military operation against Colombia, after Venezuela raid",https://www.reuters.com/world/americas/trump-says-new-military-operation-focused-colombia-sounds-good-him-2026-01-05/,0.97,4400,0,4400
8,worldnews,Venezuela moves to cut oil output due to US export embargo,https://www.reuters.com/business/energy/venezuelas-pdvsa-asks-some-joint-ventures-cut-back-oil-output-sources-say-2026-01-04/,0.97,3484,0,3484
9,worldnews,Venezuela's military recognizes Vice President Delcy Rodriguez as acting leader after Maduro's capture,https://www.cbsnews.com/news/venezuela-military-delcy-rodriguez-acting-leader-nicolas-maduro/,0.97,3215,0,3215
10,worldnews,Cuba says 32 Cubans killed during US raids on Venezuela | News,https://www.aljazeera.com/news/2026/1/5/cuba-says-32-cubans-killed-during-us-raids-on-venezuela,0.95,2728,0,2728
11,worldnews,Venezuela's interim government says it is united behind Maduro after his U.S. capture,https://www.reuters.com/world/us/venezuelas-maduro-custody-trump-says-us-will-run-country-2026-01-04/,0.96,2475,0,2475
12,worldnews,Greece's Civil Aviation Authority says mysterious massive jamming on all frequencies is responsible for delays and cancellations of flights across the country.,https://www.cnn.gr/ellada/story/512958/ypa-gia-fir-athinon-maziki-paremvoli-sxedon-se-oles-tis-syxnotites,0.98,2432,0,2432
13,worldnews,Trump says that Ukraine didn't target Putin residence in a drone strike as Kremlin claims,https://apnews.com/article/trump-putin-house-drone-attack-ukraine-7245d5585a4aaf30f3b2b6e9a7c3d89a,0.97,2058,0,2058
14,worldnews,Vessel Coming From Russia Dragged Anchor Before Subsea Cable Damaged — Finnish Police - The Moscow Times,https://www.themoscowtimes.com/2026/01/04/vessel-coming-from-russia-dragged-anchor-before-subsea-cable-damaged-finnish-police-a91603,0.98,1937,0,1937
15,worldnews,Death toll rises in Iran as anti-government protests spread,https://www.abc.net.au/news/2026-01-05/iran-protests-spread-death-toll-rises/106198320,0.97,1247,0,1247
16,worldnews,"Russian missile parts factory in flames after Ukrainian drone attack, media report",https://kyivindependent.com/russian-missile-factory-in-flames-after-ukrainian-drone-attack-media-report/,0.98,1196,0,1196
17,worldnews,Latvian police board vessel after Baltic Sea telecom cable breach,https://www.reuters.com/business/media-telecom/latvia-pm-says-baltic-sea-optical-cable-has-been-damaged-2026-01-04/,0.98,1017,0,1017
18,worldnews,"Donald Trump Cryptic Statement on Greenland After Venezuela Operation, Says 'Ask Me 20 Days...'",https://www.timesnownews.com/world/us/us-news/donald-trump-cryptic-statement-on-greenland-after-venezuela-operation-absolute-resolve-says-ask-me-20-days-later-brings-russia-china-angle-article-153396758,0.94,995,0,995
19,worldnews,Trump says second Venezuela strike possible if government does not cooperate,https://www.reuters.com/world/us/venezuelas-maduro-custody-trump-says-us-will-run-country-2026-01-04/?utm_source=braze&amp;utm_medium=notifications&amp;utm_campaign=2025_engagement,0.95,649,0,649
20,worldnews,Russia files diplomatic request asking US to stop pursuing oil tanker originally bound for Venezuela | CNN Politics,https://www.cnn.com/2026/01/02/politics/bella-1-russia-diplomatic-request-oil-tanker,0.95,641,0,641
21,worldnews,Trump's Maduro raid could set precedent for authoritarian powers across globe,https://www.bbc.com/news/articles/c5y45nyz124o,0.84,625,0,625
22,worldnews,Trump says Iran will 'get hit very hard' if protesters killed,https://economictimes.com/news/international/world-news/trump-says-iran-will-get-hit-very-hard-if-protesters-killed/articleshow/126342640.cms,0.9,569,0,569
23,worldnews,/r/WorldNews Live Thread: Multiple Explosions in Venezuela’s Capital Caracas (Thread #2),https://www.reddit.com/live/1gb1jdg62n0id/,0.92,369,0,369
24,worldnews,"/r/WorldNews Live Thread: Russian Invasion of Ukraine Day 1411, Part 1 (Thread #1558)",https://www.reddit.com/live/18hnzysb1elcs,0.96,121,0,121
