,subreddit,title,url,upvote_ratio,ups,downs,score
0,worldnews,"U.S. Navy P-8 Flies Over Taiwan Strait, Causing China to Scramble",https://news.usni.org/2023/04/28/u-s-navy-p-8-flies-over-taiwan-strait-causing-china-to-scramble,0.94,15369,0,15369
1,worldnews,Nurses across England strike in biggest walkout so far,https://www.bbc.co.uk/news/health-65443943,0.98,10065,0,10065
2,worldnews,"BBC confirms identities of 21,700 Russian soldiers killed in Ukraine in 14 months of the war",https://kyivindependent.com/bbc-confirms-identities-of-17-000-russian-soldiers-killed-in-ukraine-in-13-months-of-the-war-2/,0.97,6491,0,6491
3,worldnews,Russian-speaking residents in Riga call on Putin “not to protect” them after Russian State Duma statement,https://www.pravda.com.ua/eng/news/2023/04/30/7400059/,0.97,5219,0,5219
4,worldnews,Chile’s Leftist President Moves To Nationalize Reserves Of Clean Energy ‘White Gold’,https://www.huffpost.com/entry/chile-lithium-gabriel-boric_n_644bf6bae4b011a819c76d03,0.96,4612,0,4612
5,worldnews,UK sees record sickness and zero productivity growth in 2022,https://www.reuters.com/world/uk/uk-sees-record-sickness-zero-productivity-growth-2022-2023-04-26/,0.97,3651,0,3651
6,worldnews,Chinese authorities were preparing Sunday to release a man who disappeared three years ago after publicizing videos of overcrowded hospitals and bodies during the original COVID-19 outbreak,https://apnews.com/article/china-covid-citizen-journalist-b540f6458bc782b916dcd3aaa3571c12,0.96,2948,0,2948
7,worldnews,Budapest to Zelenskyy: Hungarian people paid high price for this war already,https://www.pravda.com.ua/eng/news/2023/04/30/7400081/,0.91,2818,0,2818
8,worldnews,"Brazil's Lula: The UN was so strong enough to create Israel, but now can't create a Palestinian state",https://www.middleeastmonitor.com/20230428-brazils-president-the-un-was-so-strong-enough-to-create-israel-but-now-cant-create-a-palestinian-state/,0.9,2645,0,2645
9,worldnews,ISIS leader Abu Hussein al-Qurashi killed in Syria,https://bnonews.com/index.php/2023/04/isis-leader-abu-hussein-al-qurashi-killed-in-syria/,0.98,2275,0,2275
10,worldnews,"A powerhouse US doctor slain in Sudan, 'killed for nothing'",https://apnews.com/article/sudan-war-americans-doctor-dcf5d2aeb3e70cd37fbce9013a52a0a6,0.96,2168,0,2168
11,worldnews,Pope says Vatican involved in secret Ukraine peace mission,https://www.reuters.com/world/europe/pope-says-vatican-involved-ukraine-peace-mission-2023-04-30/,0.93,2125,0,2125
12,worldnews,Paraguay: Pro-Taiwan candidate wins presidential election,https://www.dw.com/en/paraguay-pro-taiwan-candidate-wins-presidential-election/a-65474462,0.93,965,0,965
13,worldnews,Air defence systems repelling Russian missile attacks in Kyiv region - officials,https://www.reuters.com/world/europe/air-defence-systems-repelling-russian-missile-attacks-kyiv-region-officials-2023-05-01/,0.98,924,0,924
14,worldnews,Russia’s occupation ‘governor’ of Kherson region manages to register company in UK despite sanctions,https://novayagazeta.eu/articles/2023/04/27/russias-occupation-governor-of-kherson-region-manages-to-register-company-in-uk-despite-sanctions-en-news,0.95,880,0,880
15,worldnews,Russian occupiers in Luhansk Oblast limit numbers at funeral processions and insist that mobilised soldiers be cremated,https://www.pravda.com.ua/eng/news/2023/04/30/7400083/,0.93,749,0,749
16,worldnews,Brazil to step up removal of indigenous land invaders after Yanomami killing,https://www.reuters.com/world/americas/brazil-step-up-removal-indigenous-land-invaders-after-yanomami-killing-2023-04-30/,0.95,706,0,706
17,worldnews,"Mexico bus plunges off cliff, at least 18 die",https://www.reuters.com/world/americas/mexico-bus-plunges-off-cliff-least-18-die-2023-05-01/,0.95,700,0,700
18,worldnews,Turkey claims ISIS leader killed,https://www.smh.com.au/world/turkey-claims-isis-leader-killed-20230501-p5d4gw.html?,0.92,640,0,640
19,worldnews,Poland Streamlines Process to Export Drones to Ukraine,https://www.kyivpost.com/post/16436,0.94,514,0,514
20,worldnews,"/r/WorldNews Live Thread: Russian Invasion of Ukraine Day 432, Part 1 (Thread #573)",https://www.reddit.com/live/18hnzysb1elcs,0.97,390,0,390
21,worldnews,"Russia, Belarus, China intelligence bodies' recruitment attempts detected in Lithuania",https://www.baltictimes.com/russia__belarus__china_intel_bodies__recruitment_attempts_detected_in_lithuania_in_2022/,0.93,332,0,332
22,worldnews,"Islamic State leader Abu Hussein al-Qurashi killed by Turkish spy agency, Recep Tayyip Erdogan says",https://www.abc.net.au/news/2023-05-01/suspected-islamic-state-group-chief-killed-in-syria-erdogan/102285428,0.93,229,0,229
23,worldnews,"Brits need to accept they are now poorer, Bank of England chief economist says",https://www.cnbc.com/2023/04/26/bank-of-englands-huw-pill-says-brits-need-to-accept-were-all-worse-off-.html,0.86,176,0,176
24,worldnews,Ukraine updates: Air defenses fend off attack near Kyiv,https://p.dw.com/p/4QjpP?maca=en-reddit-sharing,0.97,134,0,134
25,worldnews,"Taiwan, U.S. companies sign MOU on drone development",https://focustaiwan.tw/business/202304300012,0.92,127,0,127
