,subreddit,title,url,upvote_ratio,ups,downs,score
0,worldnews,"YouTube wipes out thousands of propaganda channels linked to China, Russia",https://www.cnbc.com/2025/07/21/youtube-channels-propaganda-china-russia.html,0.94,43702,0,43702
1,worldnews,"US to withdraw from UN scientific and cultural agency UNESCO again, White House says",https://edition.cnn.com/2025/07/22/politics/unesco-un-us-withdrawal,0.96,12908,0,12908
2,worldnews,'Japanese first': Voters back Trump-inspired party to 'Make Japan Great Again' wins big in key elections,https://timesofindia.indiatimes.com/world/rest-of-world/japanese-first-voters-back-trump-inspired-party-to-make-japan-great-again-wins-big-in-key-elections/articleshow/122807502.cms,0.94,12419,0,12419
3,worldnews,Russia plans to spend over a trillion dollars on rearmament by 2036,https://unn.ua/en/news/russia-plans-to-spend-over-a-trillion-dollars-on-rearmament-by-2036-budanov,0.96,7339,0,7339
4,worldnews,US NATO ambassador warns China over 'subsidizing' Russia's war in Ukraine,https://kyivindependent.com/us-envoy-warns-china-over-subsidizing-russias-war-in-ukraine-calls-it-strategic-miscalculation/,0.97,4195,0,4195
5,worldnews,Brazil's Supreme Court justice threatens to arrest Jair Bolsonaro - BBC News,https://www.bbc.com/news/articles/ce83lle56mno.amp,0.98,3611,0,3611
6,worldnews,"Hamas welcomes joint statement by 25 countries, urges practical steps to end Gaza war",https://www.saba.ye/en/news3520475.htm,0.84,3176,0,3176
7,worldnews,China launches nationwide Internet ID system to track all online activity,https://www.washingtonpost.com/world/2025/07/15/china-digital-id-internet-surveillance,0.96,2854,0,2854
8,worldnews,"Lithuania purchases over 2,500 drones for Ukraine’s Armed Forces – photos",https://www.pravda.com.ua/eng/news/2025/07/22/7522873/,0.98,2762,0,2762
9,worldnews,British institutions to be banned from paying ransoms to Russian hackers,https://www.politico.eu/article/britain-ban-pay-ransom-russia-hacker/,0.98,2252,0,2252
10,worldnews,Trump says Philippines will pay 19% tariff while US pays no tariffs under deal with leader Marcos,https://www.stripes.com/theaters/us/2025-07-22/trump-philippine-leader-marcos-tariffs-china-white-house-18516969.html,0.92,1900,0,1900
11,worldnews,Briton found guilty of volunteering to spy for Russia,https://news.sky.com/story/briton-found-guilty-of-volunteering-to-spy-for-russia-13399976,0.97,1591,0,1591
12,worldnews,"Israel denies Gaza famine claims, says aid is entering Strip but not being distributed",https://www.timesofisrael.com/israel-denies-gaza-famine-claims-says-aid-is-entering-strip-but-not-being-distributed/,0.86,1515,0,1515
13,worldnews,New Russian Drone Made Completely Of Chinese Components: Ukrainian Intelligence,https://www.twz.com/news-features/new-russian-drone-made-completely-of-chinese-components-ukrainian-intelligence,0.97,1405,0,1405
14,worldnews,'They shot patients in beds' – BBC hears claims of massacre at Suweida hospital - BBC News,https://www.bbc.co.uk/news/articles/cly84jn000do,0.95,1392,0,1392
15,worldnews,Malaria ‘back with a vengeance’ in Zimbabwe as number of deaths from the disease triple,https://www.theguardian.com/global-development/2025/jul/19/health-malaria-mosquito-deaths-zimbabwe-trump-usaid-cuts-disease-control,0.96,1205,0,1205
16,worldnews,Arrests in China after more than 230 kindergarten children poisoned by lead paint in food | China,https://www.theguardian.com/world/2025/jul/22/arrests-in-china-after-more-than-230-kindergarten-children-poisoned-by-lead-paint-in-food-ntwnfb,0.98,1189,0,1189
17,worldnews,Interpol takes Canadian anti-whaling campaigner Paul Watson off its most-wanted list,https://www.ctvnews.ca/sci-tech/article/interpol-takes-canadian-anti-whaling-campaigner-paul-watson-off-its-most-wanted-list/,0.96,1066,0,1066
18,worldnews,President Trump announces a tariff trade deal with the Philippines after meeting with President Marcos today,https://amp.cnn.com/cnn/2025/07/22/business/trump-philippines-trade-deal,0.87,770,0,770
19,worldnews,'He sees Trump as emotional and susceptible to influence' — Putin not worried about 50-day ceasefire deadline,https://kyivindependent.com/he-sees-trump-as-emotional-and-susceptible-to-influence-putin-not-worried-about-50-day-ceasefire-deadline-guardian-reports/,0.98,614,0,614
20,worldnews,Zelensky signs law destroying independence of Ukraine's key anti-corruption bodies,https://kyivindependent.com/bill-subordinating-top-anti-corruption-agencies-to-prosecutor-generals-office/,0.76,610,0,610
21,worldnews,"Gaza hospital boss says 21 children died of malnutrition, starvation over last 3 days",https://www.cbsnews.com/news/gaza-starvation-malnutrition-deaths-israel-hamas-war-palestinians/,0.71,528,0,528
22,worldnews,US and Japan agree on trade deal to reduce tariffs to 15%,https://asia.nikkei.com/Economy/Trade-war/Trump-tariffs/US-and-Japan-agree-on-trade-deal-to-reduce-tariffs-to-15,0.92,506,0,506
23,worldnews,British man guilty of trying to spy for Russia,https://www.bbc.com/news/articles/clyn0ygwd7jo,0.95,431,0,431
24,worldnews,S. Korea sees 14-year high rate of growth in births for May as births continue to rise for 11 months straight,https://en.yna.co.kr/view/AEN20250723005100320,0.95,253,0,253
25,worldnews,"/r/WorldNews Live Thread: Russian Invasion of Ukraine Day 1245, Part 1 (Thread #1392)",https://www.reddit.com/live/18hnzysb1elcs,0.97,136,0,136
