,subreddit,title,url,upvote_ratio,ups,downs,score
0,worldnews,Trump cancels sanctions against countries buying Russian oil,https://unn.ua/en/news/trump-cancels-sanctions-against-countries-buying-russian-oil,0.96,25485,0,25485
1,worldnews,"Iran is ready for a long war with the US and only economic pain will end it, senior official tells CNN",https://www.cnn.com/2026/03/09/middleeast/iran-long-war-kamal-kharazi-interview-intl,0.95,15495,0,15495
2,worldnews,Trump tells CBS that Iran 'war is very complete',https://www.cnbc.com/2026/03/09/trump-iran-war-end.html?__source=androidappshare,0.95,14936,0,14936
3,worldnews,U.S. Military Refuses to Endorse Trump Claim That Iran Bombed Girls’ School,https://theintercept.com/2026/03/09/iran-trump-hegseth-bomb-girls-school/,0.98,12039,0,12039
4,worldnews,"Russia is sharing intelligence with Iran about U.S. military targets, marking first sign Moscow is getting involved in the war",https://fortune.com/2026/03/08/russia-intelligence-iran-us-military-aircraft-warships-trump-hegseth/,0.97,10859,0,10859
5,worldnews,"U.S. military tested device that may be tied to Havana Syndrome on rats, sheep, confidential sources say",https://www.cbsnews.com/news/us-military-tested-device-that-may-be-tied-to-havana-syndrome-60-minutes-transcript/,0.96,9201,0,9201
6,worldnews,Iran signals Hormuz safe passage to countries expelling U.S. and Israeli diplomats,https://investinglive.com/commodities/iran-signals-hormuz-safe-passage-to-countries-expelling-us-and-israeli-diplomats-20260309/,0.97,8101,0,8101
7,worldnews,"Iran's IRGC Responds To Trump, Says It Will Be The One Who Will 'Determine The End Of War'",https://www.news18.com/amp/world/irans-irgc-responds-to-trump-says-it-will-be-the-one-who-will-determine-the-end-of-war-9951631.html,0.96,5996,0,5996
8,worldnews,"Five Iranian women's soccer players to seek asylum in Australia after leaving team's handlers, multiple sources say",https://www.abc.net.au/news/2026-03-10/iranian-womens-football-escape-asylum/106434542,0.97,5988,0,5988
9,worldnews,"France to deploy almost dozen warships, mulls Hormuz mission, Macron says",https://www.reuters.com/world/europe/france-will-send-two-warships-red-sea-macron-says-2026-03-09/,0.97,4612,0,4612
10,worldnews,U.S. Warns That Iran May Be Activating 'Sleeper Assets' Who Could Plot to Harm Americans,https://people.com/us-warns-that-iran-may-be-activating-sleeper-assets-who-could-plot-to-harm-americans-11922580,0.93,4231,0,4231
11,worldnews,"US Tomahawk struck Iranian base next to school destroyed in deadly attack, video appears to confirm",https://www.cnn.com/2026/03/09/middleeast/iran-minab-school-airstrike-new-footage-intl?utm_medium=social&amp;utm_campaign=missions&amp;utm_source=reddit,0.92,3200,0,3200
12,worldnews,The Netherlands’ intelligence agencies have confirmed that Russian state hackers are attempting to access chat apps Signal and WhatsApp accounts worldwide,https://nltimes.nl/2026/03/09/intelligence-confirms-russian-state-hackers-targeting-dutch-signal-whatsapp-accounts,0.98,2908,0,2908
13,worldnews,Sheinbaum tells Trump: stop illegal arms trade from the US to Mexico,https://www.theguardian.com/world/2026/mar/09/mexican-cartels-guns-come-from-us-sheinbaum-trump,0.96,2624,0,2624
14,worldnews,"Iranian drone that struck British air base contained Russian technology, Times reports",https://kyivindependent.com/iranian-drone-that-struck-british-airbase-contained-russian-technology-times-reports/,0.97,1929,0,1929
15,worldnews,"Canada ‘will not be participating’ in Iran war, defence minister says",https://globalnews.ca/news/11722309/canada-iran-military-participation-mcguinty/,0.95,1716,0,1716
16,worldnews,Prewar US intel assessment found intervention in Iran wasn't likely to change leadership,https://apnews.com/article/iran-intelligence-assessment-trump-ad20c1f1168d4318af516d7b19d372e7,0.95,891,0,891
17,worldnews,Iranian ambassador says Iran 'not at war' with UK as he blames US and Israel as the 'root causes of this crisis',https://www.lbc.co.uk/article/iran-war-uk-conflict-latest-5HjdW7D_2/,0.91,822,0,822
18,worldnews,U.S. poised to lift sanctions on Russian oil,https://english.nv.ua/nation/u-s-poised-to-lift-russia-oil-sanctions-50590311.html,0.96,718,0,718
19,worldnews,Trump says he discussed Ukraine and Iran conflicts with Putin,https://www.reuters.com/world/europe/trump-says-he-discussed-ukraine-iran-conflicts-with-putin-2026-03-09/,0.92,540,0,540
20,worldnews,"Lebanon Asks U.S. For Direct Peace Talks With Israel To End Fighting: “[U.S. Ambassador] Barrack’s response was blunt: ‘Stop with the bullsh*t’ on disarming Hezbollah, or there's nothing to discuss.”",https://www.axios.com/2026/03/09/lebanon-israel-hezbollah-peace-talks,0.92,363,0,363
21,worldnews,Greek Oil Tanker Laden with Saudi Oil Sails through Strait of Hormuz,https://www.marinelink.com/news/greek-vessel-laden-saudi-oil-sails-536727,0.95,289,0,289
22,worldnews,Trump warns Iran of response '20 times harder' if Strait of Hormuz blocked,https://www.aa.com.tr/en/americas/trump-warns-iran-of-response-20-times-harder-if-strait-of-hormuz-blocked/3857420,0.91,224,0,224
23,worldnews,/r/WorldNews Discussion Thread: US and Israel launch attack on Iran; Iran retaliates (Thread #7),https://www.reddit.com/r/worldnews/comments/1rovoj2/rworldnews_discussion_thread_us_and_israel_launch/,0.87,154,0,154
24,worldnews,"/r/WorldNews Live Thread: Russian Invasion of Ukraine Day 1475, Part 1 (Thread #1622)",https://www.reddit.com/r/worldnews/comments/1rpn0b7/rworldnews_live_thread_russian_invasion_of/,0.97,114,0,114
