,subreddit,title,url,upvote_ratio,ups,downs,score
0,worldnews,Zelenskiy Warns 'War' Coming To Russia After Drone Attack Closes Moscow's Vnukovo Airport,https://www.rferl.org/a/ukraine-moscow-vnukovo-drones/32526183.html,0.94,18873,0,18873
1,worldnews,"Joining China's Belt and Road was an 'atrocious' decision, Italian minister says",https://www.reuters.com/world/joining-chinas-belt-road-was-an-atrocious-decision-italy-minister-2023-07-30/,0.93,9983,0,9983
2,worldnews,Ukrainian Tank Losses Diminish As Polish Technicians Save More And More Damaged Leopard 2s,https://www.forbes.com/sites/davidaxe/2023/07/29/ukrainian-tank-losses-diminish-as-polish-technicians-save-more-and-more-damaged-leopard-2s/,0.97,7570,0,7570
3,worldnews,Ukraine shows off a sea drone that can wipe out Russian ships and is 'faster than anything in the Black Sea',https://www.businessinsider.com/ukraine-unveiled-new-sea-drone-black-sea-wipe-out-russia-2023-7?amp,0.96,4792,0,4792
4,worldnews,"China accuses U.S. of turning Taiwan into ""powder keg"" after White House announces new military aid package",https://www.cbsnews.com/news/china-taiwan-us-military-aid-powder-keg/,0.95,4032,0,4032
5,worldnews,"Kim Jong Un has plastered his walls with bizarre, giant portraits of Putin, images from North Korean state media reveal",https://www.businessinsider.nl/kim-jong-un-has-plastered-his-walls-with-bizarre-giant-portraits-of-putin-images-from-north-korean-state-media-reveal/,0.96,3356,0,3356
6,worldnews,"Sudden explosion of dangerous fungus Candida auris may be because of climate change, scientists say",https://www.cbsnews.com/news/candida-auris-climate-change-fungal-infection-rare/,0.94,3087,0,3087
7,worldnews,"Scientists discover antibodies capable of stopping several coronaviruses, potentially preventing future outbreaks",https://www.ctvnews.ca/sci-tech/scientists-discover-antibodies-capable-of-stopping-several-coronaviruses-potentially-preventing-future-outbreaks-1.6499952,0.98,2911,0,2911
8,worldnews,"Medvedev threatened the world with nuclear weapons if ""Russian"" territory taken",https://en.axar.az/news/world/769884.html,0.9,2824,0,2824
9,worldnews,Japan grants long-term visas to Russians opposed to Ukraine war,https://www.japantimes.co.jp/news/2023/07/30/japan/japan-visas-russians-opposed-ukraine-war/,0.95,2473,0,2473
10,worldnews,African leaders leave Russia summit without grain deal or a path to end the war in Ukraine,https://apnews.com/article/russia-africa-summit-ukraine-grain-war-125d5a6d5052f4221c46be52c1618cf7,0.96,2471,0,2471
11,worldnews,French embassy in Niger attacked as protesters with Russian flags march,https://www.business-standard.com/amp/world-news/french-embassy-in-niger-attacked-as-protesters-with-russian-flags-march-123073000475_1.html,0.97,2288,0,2288
12,worldnews,Ukraine Using Captured North Korean Ammunition Near Bakhmut,https://www.kyivpost.com/post/19989,0.97,1243,0,1243
13,worldnews,Pro-coup protesters in Niger shout 'long live Putin' as new leaders face calls to cede power,https://edition.cnn.com/2023/07/30/africa/niger-french-embassy-protests-intl/index.html,0.96,1022,0,1022
14,worldnews,Russia Edges Closer to Abortion Ban in Quest to Preserve ‘Traditional Values’,https://www.themoscowtimes.com/2023/07/27/russia-edges-closer-to-abortion-ban-in-quest-to-preserve-traditional-values-a81977,0.93,862,0,862
15,worldnews,Niger Loses Aid as Western Countries Condemn Coup,https://www.voanews.com/a/niger-loses-aid-as-western-countries-condemn-coup/7203344.html,0.97,835,0,835
16,worldnews,"Authorities from Afghanistan's vice ministry created a bonfire of confiscated musical instruments and equipment in Herat province, deeming music immoral",https://www.france24.com/en/live-news/20230730-taliban-create-bonfire-of-immoral-music-equipment,0.93,708,0,708
17,worldnews,"NASA, Brazil to expand partnership to monitor Amazon deforestation",https://brazilreports.com/nasa-brazil-to-expand-partnership-to-monitor-amazon-deforestation/5124/,0.98,633,0,633
18,worldnews,"Uyghurs in Turkey protest Chinese foreign minister’s visit, citing ongoing persecution in Xinjiang",https://www.turkishminute.com/2023/07/27/uyghur-turkey-protest-chinese-foreign-minister-visit-citing-ongoing-persecution-in-xinjiang/,0.92,400,0,400
19,worldnews,"/r/WorldNews Live Thread: Russian Invasion of Ukraine Day 523, Part 1 (Thread #669)",https://www.reddit.com/live/18hnzysb1elcs,0.96,369,0,369
20,worldnews,Zelenskiy expects Russia to resume attacks on Ukraine's power grid,https://www.reuters.com/world/europe/zelenskiy-expects-russia-resume-attacks-ukraines-power-grid-2023-07-30/,0.93,338,0,338
21,worldnews,"Denmark will seek to make it illegal to desecrate the Quran or other religious holy books in front of foreign embassies, foreign minister Lars Løkke Rasmussen says in interview",https://abcnews.go.com/International/wireStory/denmark-seeks-legally-prevent-burnings-quran-religious-scriptures-101853923,0.85,277,0,277
22,worldnews,Canada says it is disappointed by US decision to maintain lumber duties,https://www.reuters.com/markets/commodities/canada-says-it-is-disappointed-by-us-decision-maintain-lumber-duties-2023-07-27/,0.92,252,0,252
23,worldnews,Netherlands starts towing burning EV-laden freight ship away from environmentally sensitive islands,https://www.dw.com/en/netherlands-starts-towing-burning-ev-laden-freight-ship/a-66391309,0.94,207,0,207
24,worldnews,UBS drops Credit Suisse’s Russian clients,https://www.swissinfo.ch/eng/business/ubs-drops-credit-suisse-s-russian-clients/48699962,0.93,97,0,97
25,worldnews,Russian propaganda is making its way into popular kids' games like Roblox. One Russian official even hosted a concert in Minecraft.,https://www.businessinsider.com/roblox-minecraft-being-used-to-spread-russian-propoganda-2023-7,0.93,90,0,90
