,subreddit,title,url,upvote_ratio,ups,downs,score
0,worldnews,"After Trump tariffs, Trudeau reveals $155B counter-tariffs on U.S. - National | Globalnews.ca",https://globalnews.ca/news/10992959/donald-trump-tariffs-canada-feb-1/,0.95,34632,0,34632
1,worldnews,"Canada poised to fight back against Trump tariffs, rethink U.S. reliance",https://financialpost.com/news/canada-retaliate-trump-tariffs-us-reliance,0.94,26167,0,26167
2,worldnews,"Trump signs order authorizing tariffs on goods from Canada, Mexico and China",https://www.theguardian.com/us-news/2025/feb/01/trump-tariffs-canada-mexico-china,0.95,13573,0,13573
3,worldnews,‘There will be many casualties’: Panama girds for war as Rubio opens talks,https://www.politico.com/news/2025/02/01/panama-trump-confrontation-war-00201759,0.94,12867,0,12867
4,worldnews,Mexican president orders retaliatory tariffs against U.S.,https://www.reuters.com/world/americas/mexican-president-orders-retaliatory-tariffs-against-us-2025-02-02/,0.98,10337,0,10337
5,worldnews,"Poland scrambles jets, puts air defense on high alert during Russian missile attack on Ukraine",https://kyivindependent.com/poland-scrambles-jets-alerts-air-defense-during-russian-missile-attack/,0.97,8115,0,8115
6,worldnews,Nova Scotia Liquor Corporation will be directed to remove all U.S. alcohol from store shelves effective this Tuesday,https://www.cbc.ca/amp/1.7448333,0.99,7654,0,7654
7,worldnews,"Mexico Readying Retaliatory Tariffs, Potentially Targeting U.S. Agriculture",https://farmpolicynews.illinois.edu/2025/01/mexico-readying-retaliatory-tariffs-potentially-targeting-us-ag/,0.98,6972,0,6972
8,worldnews,Trudeau hits back at the U.S. with big tariffs after Trump launches a trade war,https://www.cbc.ca/news/politics/trump-tariffs-canada-february-1-1.7447829,0.97,4347,0,4347
9,worldnews,"B.C. premier announces countermeasures against U.S. tariffs, including ban on 'red-state' liquor",https://www.cbc.ca/news/canada/british-columbia/bc-premier-david-eby-us-tariffs-1.7448307,0.98,4170,0,4170
10,worldnews,AP Interview: Zelenskyy says excluding Ukraine from US-Russia talks about war is 'very dangerous',https://apnews.com/article/russia-ukraine-war-trump-talks-ceasefire-00af5f61f1faf41e78a3b4e072c21a14,0.98,4166,0,4166
11,worldnews,"U.S. wants Ukraine to hold elections following a ceasefire, says Trump envoy",https://www.reuters.com/world/us-wants-ukraine-hold-elections-following-ceasefire-says-trump-envoy-2025-02-01/,0.92,4051,0,4051
12,worldnews,"Denmark helps Ukraine boost artillery production 25-fold, Defense News reports",https://euromaidanpress.com/2025/01/31/denmark-helps-ukraine-boost-artillery-production-25-fold-defense-news-reports/,0.98,3796,0,3796
13,worldnews,Carney vows Canada will ‘stand up to bully’ as Trump imposes trade tariffs,https://www.theguardian.com/world/2025/feb/01/carney-vows-canada-will-stand-up-to-bully-as-trump-imposes-trade-tariffs,0.97,3474,0,3474
14,worldnews,"EU to make Temu, Shein and Amazon liable for 'unsafe' goods, FT reports",https://www.channelnewsasia.com/business/eu-make-temu-shein-and-amazon-liable-unsafe-goods-ft-reports-4910656,0.98,2551,0,2551
15,worldnews,Energy industry on both sides of border pushes back on tariffs: ‘Too many jobs on the line’,https://globalnews.ca/news/10977062/canada-american-oil-industry-tariffs/,0.97,2490,0,2490
16,worldnews,Canada retaliates against Trump’s tariffs with 25 per cent tariffs on billions of U.S. goods,https://www.ctvnews.ca/politics/article/canada-retaliating-for-trumps-tariffs-with-25-per-cent-tariffs-on-billions-of-us-goods-justin-trudeau/,0.97,1998,0,1998
17,worldnews,Argentines hold anti-fascist pride march at home and abroad - Buenos Aires Herald,https://buenosairesherald.com/human-rights/argentines-hold-anti-fascist-pride-march-at-home-and-abroad,0.95,1371,0,1371
18,worldnews,U.S. alcohol producers brace for sales bans in Canada if Trump launches tariffs,https://www.theglobeandmail.com/business/article-us-alcohol-producers-brace-for-sales-bans-in-canada-if-trump-launches/,0.98,1367,0,1367
19,worldnews,Canada announces 25 per cent retaliatory tariffs on U.S. goods starting Tuesday,https://edmonton.citynews.ca/2025/02/01/trudeau-announces-25-per-cent-retailiatory-tariffs-on-u-s-goods-starting-tuesday/,0.96,1067,0,1067
20,worldnews,Health Programs Shutter Around the World After Trump Pauses Foreign Aid,https://www.nytimes.com/2025/02/01/health/trump-aid-malaria-tuberculosis-hiv.html,0.94,843,0,843
21,worldnews,China hits back at US tariffs with vow to take case to the WTO,https://amp.scmp.com/news/china/diplomacy/article/3297052/china-hits-back-us-tariffs-vow-take-case-wto,0.96,625,0,625
22,worldnews,"Russians strike nursing home in Sudzha, trapping 95 people under rubble – Ukrainian military commandant's office",https://www.pravda.com.ua/eng/news/2025/02/1/7496337/,0.93,481,0,481
23,worldnews,"Trump announces significant new tariffs on Mexico, Canada and China, sparking retaliatory actions",https://edition.cnn.com/2025/02/01/politics/mexico-canada-china-tariffs-trump?Date=20250202&amp;Profile=CNN&amp;utm_content=1738468885&amp;utm_medium=social&amp;utm_source=twitter,0.94,341,0,341
24,worldnews,Read the transcript of Trudeau’s response to U.S. tariffs on Canada.,https://globalnews.ca/news/10993376/trudeau-trump-tariffs-us-canada/,0.91,159,0,159
25,worldnews,"/r/WorldNews Live Thread: Russian Invasion of Ukraine Day 1074, Part 1 (Thread #1221)",https://www.reddit.com/live/18hnzysb1elcs,0.96,93,0,93
