,subreddit,title,url,upvote_ratio,ups,downs,score
0,worldnews,"Russia loses more than 70,000 soldiers in 2 months",https://www.vanguardngr.com/2024/07/russia-loses-more-than-70000-soldiers-in-2-months/,0.94,13746,0,13746
1,worldnews,"Move by some NATO members to let Kyiv strike Russia with their arms is a dangerous escalation, Kremlin says",https://www.reuters.com/world/move-by-some-nato-members-let-kyiv-strike-russia-with-their-arms-is-dangerous-2024-07-12/,0.89,11773,0,11773
2,worldnews,German shock at reported Russian assassination plot,https://www.bbc.com/news/articles/c1wej84e9l7o.amp,0.98,4087,0,4087
3,worldnews,"‘Tomorrow, I kill you:’ Rescued hostage details psychological abuse during eight months of Hamas captivity",https://www.cnn.com/2024/07/11/middleeast/israel-hostage-andrey-kozlov-gaza-hamas-intl/index.html,0.86,4074,0,4074
4,worldnews,Biden: Israel and Hamas have agreed to ceasefire framework,https://www.jpost.com/breaking-news/article-810103,0.94,3957,0,3957
5,worldnews,XL bullies: Republic of Ireland to restrict ownership of dog breed,https://www.bbc.com/news/articles/cgxqn2q2kzeo,0.95,3626,0,3626
6,worldnews,"IDF finds Hamas, PIJ war rooms, drones, explosives, in Gaza City UNRWA HQ",https://www.jpost.com/breaking-news/article-810080,0.85,2901,0,2901
7,worldnews,"Biden: Arab forces would keep peace in Gaza, not the IDF",https://m.jpost.com/israel-news/article-810056,0.92,2711,0,2711
8,worldnews,Poland considers downing Russian missiles over Ukraine,https://www.bbc.com/news/articles/cn09234xxn1o,0.97,2064,0,2064
9,worldnews,"China carries out ‘target practice’ on mock US fighter jets
",https://www.telegraph.co.uk/world-news/2024/07/12/china-carry-out-target-practise-on-mock-us-fighter-jets/,0.9,2043,0,2043
10,worldnews,Germany says it won't be cowed by Russia after reported plot to kill Rheinmetall CEO,https://www.reuters.com/world/europe/germany-says-it-wont-be-cowed-by-russia-after-reported-plot-kill-rheinmetall-ceo-2024-07-12/,0.98,1921,0,1921
11,worldnews,Australian soldier and husband accused of spying for Russia,https://news.sky.com/story/australian-soldier-and-husband-accused-of-spying-for-russia-13176895,0.96,1854,0,1854
12,worldnews,Many in Gaza City Ignore Israeli Military’s Calls to Evacuate,https://www.nytimes.com/2024/07/11/world/middleeast/gaza-city-evacuation-israel-military.html,0.86,1488,0,1488
13,worldnews,Biden: There’s a lot I wish I’d been able to convince the Israelis to do,https://www.timesofisrael.com/biden-theres-a-lot-i-wish-id-been-able-to-convince-the-israelis-to-do/,0.88,1117,0,1117
14,worldnews,"US to send Tomahawks, hypersonics, other long-range fires to Germany",https://www.defensenews.com/land/2024/07/10/us-to-send-tomahawks-hypersonics-other-long-range-fires-to-germany/,0.96,917,0,917
15,worldnews,"‘After PM Modi went back, I am being asked to go to frontline’: Punjab man in Russian army",https://indianexpress.com/article/cities/chandigarh/pm-modi-back-frontline-punjab-manrussian-army-9449039/,0.97,883,0,883
16,worldnews,Finland's parliament passes controversial border law changes by 167 votes to 31,https://yle.fi/a/74-20099486,0.9,814,0,814
17,worldnews,Netherlands Supreme Court rules that same-sex marriage is now permitted in Aruba and Curaçao,https://nltimes.nl/2024/07/12/supreme-court-rules-sex-marriage-now-permitted-aruba-curacao,0.94,777,0,777
18,worldnews,Russian Missile Strike Targets Likely F-16 Airfield in Starokostyantyniv,https://www.kyivpost.com/post/35727,0.96,654,0,654
19,worldnews,"Blue checks on X are bad now, EU says",https://mashable.com/article/twitter-x-blue-checks-bad-eu,0.85,569,0,569
20,worldnews,"Ukraine will likely have to wait a year before it's able to launch another counteroffensive, NATO official says",https://www.businessinsider.com/ukraine-wont-be-able-launch-new-offensive-year-nato-official-2024-7?utm_source=reddit.com,0.92,498,0,498
21,worldnews,Argentina officially designates Hamas as a terrorist organization,https://www.jpost.com/breaking-news/article-810125,0.89,351,0,351
22,worldnews,"IDF, Shin Bet eliminate Hamas's Shijaiyah Battalion's Deputy Commander",https://www.ynetnews.com/article/ryna66rpr,0.87,297,0,297
23,worldnews,/r/WorldNews Live Thread for Israel-Hamas War (Thread #57),https://www.reddit.com/live/1bsso361afr0r,0.76,162,0,162
24,worldnews,"Indian refiners likely saved at least $10.5 billion by buying discounted Russian oil, data suggests",https://indianexpress.com/article/business/indian-refiners-likely-saved-at-least-10-5-billion-by-buying-discounted-russian-oil-data-suggests-9445660/,0.89,161,0,161
25,worldnews,"/r/WorldNews Live Thread: Russian Invasion of Ukraine Day 870, Part 1 (Thread #1017)",https://www.reddit.com/live/18hnzysb1elcs,0.97,160,0,160
26,worldnews,Ukraine dismisses Russian suggestion it plans attacks on own power dams,https://www.reuters.com/world/europe/ukraine-dismisses-russian-suggestion-it-plans-attacks-own-power-dams-2024-07-12/,0.92,70,0,70
