,subreddit,title,url,upvote_ratio,ups,downs,score
0,worldnews,"Pope Leo Continues Anti-AI Crusade, Says Tech Weakens Human 'Creativity and Judgment'",https://www.thewrap.com/culture-lifestyle/culture/pope-leo-ai-dangers-tweets/,0.96,16040,0,16040
1,worldnews,"Putin threatens Armenia with ""Ukrainian scenario"" over its EU integration aims",https://www.pravda.com.ua/eng/news/2026/05/30/8037015/,0.96,9718,0,9718
2,worldnews,Americans Injured in Iranian Missile Strike on Kuwaiti Air Base,https://www.bloomberg.com/news/articles/2026-05-30/americans-injured-in-iranian-missile-strike-on-kuwaiti-air-base?taid=6a1a6c184b8aea00017f96af&amp;utm_campaign=trueanthem&amp;utm_content=business&amp;utm_medium=social&amp;utm_source=twitter,0.96,9581,0,9581
3,worldnews,Moscow Threatens Elon Musk’s SpaceX With Nuclear Retaliation Over Ukraine Starlink Use,https://united24media.com/world/moscow-threatens-elon-musks-spacex-with-nuclear-retaliation-over-ukraine-starlink-use-19205,0.96,9225,0,9225
4,worldnews,Israeli Settler Council Issues Unprecedented Admission of Ritualistic Child Sexual Abuse After Broadcaster Exposes Cover-Up,https://www.ibtimes.co.uk/gush-etzion-council-admits-ritualistic-child-abuse-1799642,0.92,5215,0,5215
5,worldnews,Iran sentences another athlete to death over January protests,https://www.iranintl.com/en/202605308188,0.94,4940,0,4940
6,worldnews,"Cancer jab can eradicate entire tumours in patients, trial shows",https://www.theguardian.com/science/2026/may/30/cancer-jab-can-eradicate-entire-tumours-in-patients-trial-shows,0.97,3899,0,3899
7,worldnews,"World economy at risk as conflict drains oil inventories, warn global bodies",https://www.tradearabia.com/News/463070/World-economy-at-risk-as-conflict-drains-oil-inventories%2C-warn-global-bodies,0.96,2648,0,2648
8,worldnews,Hegseth says US will ‘find a way’ to help Ukraine after Zelensky's plea for air defense missiles,https://kyivindependent.com/hegseth-letter/,0.95,2353,0,2353
9,worldnews,"US planning faster troop withdrawal from Europe, newspaper says",https://www.reuters.com/world/us-planning-faster-troop-withdrawal-europe-newspaper-says-2026-05-30/,0.94,1256,0,1256
10,worldnews,Zelenskyy on Putin's threats against Armenia: Europe cannot afford to lose a single country,https://www.pravda.com.ua/eng/news/2026/05/30/8037093/,0.96,1134,0,1134
11,worldnews,Ukraine and Canada to launch joint drone production for the Armed Forces,https://newsukraine.rbc.ua/news/ukraine-and-canada-to-launch-joint-drone-1780122564.html,0.98,1112,0,1112
12,worldnews,"Ukraine built its first guided bomb in 17 months, and the 250-kg warhead could reduce its dependence on Western weapons",https://okdiario.com/techy/en/ukraine-built-its-first-guided-bomb-in-17-months-and-the-250-kg-warhead-could-reduce-its-dependence-on-western-weapons/4711/,0.97,1068,0,1068
13,worldnews,Iran official says Trump is stalling talks with ‘excessive demands’ as wait for breakthrough continues,https://www.nbcnews.com/world/iran/wait-iran-deal-continues-trump-final-determination-rcna347659,0.93,904,0,904
14,worldnews,"Pentagon chief sounds 'alarm' over China's buildup, urges allies to boost defence spending",https://www.reuters.com/world/china/pentagon-chief-urges-allies-boost-defence-spending-amid-alarm-over-chinas-2026-05-30/,0.88,727,0,727
15,worldnews,Vietnam breaks ground on first high-speed rail line,https://www.railjournal.com/passenger/high-speed/vietnam-breaks-ground-on-first-high-speed-line/,0.96,520,0,520
16,worldnews,"Ebola spread in DR Congo 'deeply alarming', MSF warns",https://www.bbc.com/news/articles/c99ldxykz4zo,0.95,281,0,281
17,worldnews,"Gaza-bound aid convoy dissolves in Libya after activists arrested at Sirte crossing, ten in custody",https://www.jpost.com/international/article-897810,0.86,255,0,255
18,worldnews,"/r/WorldNews Live Thread: Russian Invasion of Ukraine Day 1557, Part 1 (Thread #1704)",https://www.reddit.com/live/18hnzysb1elcs,0.96,201,0,201
19,worldnews,/r/WorldNews Discussion Thread: US and Israel launch attack on Iran; Iran retaliates (Thread #18),https://www.reddit.com/r/worldnews/comments/1tlutp0/rworldnews_discussion_thread_us_and_israel_launch/,0.84,189,0,189
20,worldnews,"Ukraine drones strike Russian oil facility, as Kyiv and Moscow trade blows",https://www.aljazeera.com/news/2026/5/30/ukraine-drones-strike-russian-oil-facility-as-kyiv-and-moscow-trade-blows,0.93,178,0,178
21,worldnews,Eastern Flank Alert: Tusk Demands Stronger NATO Response to Rising Russian Border Provocations,https://www.kyivpost.com/post/77203,0.94,154,0,154
22,worldnews,Australia to buy three second-hand United States submarines under AUKUS shake-up,https://www.abc.net.au/news/2026-05-31/australia-to-buy-second-hand-united-states-submarines-aukus/106742496,0.95,145,0,145
23,worldnews,"As Iran's internet comes online after months-long blackout, first posts send anti-regime videos viral",https://www.abc.net.au/news/2026-05-31/iran-internet-blackout-january-protests-new-videos/106665102,0.84,108,0,108
24,worldnews,Malaysia rebukes Norway over cancelled missile deal; calls out global ‘hypocrisy’ on war crimes,https://www.straitstimes.com/asia/se-asia/malaysia-rebukes-norway-over-cancelled-missile-deal-calls-out-global-hypocrisy-on-war-crimes,0.84,102,0,102
