,subreddit,title,url,upvote_ratio,ups,downs,score
0,worldnews,French police kill man trying to 'burn synagogue',https://www.bbc.co.uk/news/articles/cp3g8kl8dd5o,0.92,11184,0,11184
1,worldnews,US military says first aid shipment has been driven across a newly built US pier into the Gaza Strip,https://apnews.com/article/israel-hamas-war-gaza-aid-us-pier-05-17-2024-336c810724d107a41bb6628c721aea7c,0.94,8971,0,8971
2,worldnews,Israeli forces uncover multiple hostage bodies in Gaza tunnels,https://www.jpost.com/israel-hamas-war/article-801561,0.85,6571,0,6571
3,worldnews,Ukrainian military's Starlink terminals went down at beginning of Russian offensive in Kharkiv Oblast,https://www.pravda.com.ua/eng/news/2024/05/17/7456272/,0.96,5844,0,5844
4,worldnews,Zelensky: No reports of artillery shortages for first time in full-scale war,https://kyivindependent.com/zelensky-progress-made-on-artillery-shortage/,0.97,5734,0,5734
5,worldnews,A young child in Ontario has died of measles,https://www.thestar.com/news/canada/a-young-child-in-ontario-has-died-of-measles/article_3f5e6e14-13d1-11ef-bef6-2b5f14b1ee24.html,0.95,4918,0,4918
6,worldnews,Putin and Xi pledge a new era and condemn the United States,https://www.reuters.com/world/putin-visit-chinas-xi-deepen-strategic-partnership-2024-05-15/,0.93,4284,0,4284
7,worldnews,"Ukraine appears to have launched its biggest drone attack ever, with reports of explosions at two major Russian ports",https://www.businessinsider.com/ukraine-launched-largest-drone-attack-ever-russia-ports-uavs-report-2024-5,0.97,2977,0,2977
8,worldnews,"Ukrainian strike on Crimea airbase destroys three Russian warplanes, satellite firm says",https://www.reuters.com/world/europe/ukrainian-strike-crimea-airbase-destroys-three-russian-warplanes-satellite-firm-2024-05-17/,0.97,2313,0,2313
9,worldnews,"Israel confirms 2 Thai nationals were killed on Oct. 7, bodies being held by Hamas",https://www.timesofisrael.com/israel-confirms-2-thai-nationals-were-killed-on-oct-7-bodies-being-held-by-hamas/,0.91,1963,0,1963
10,worldnews,"French Tiktok ban makes VPN usage soar in New Caledonia, Proton confirms a 2500% spike in VPN sign-ups since May 15",https://www.techradar.com/vpn/french-tiktok-ban-makes-vpn-usage-soar-in-new-caledonia,0.95,1710,0,1710
11,worldnews,"Turkey simply relabels Russian oil products and exports them to Europe, research indicates",https://www.intellinews.com/turkey-simply-relabels-russian-oil-products-and-exports-them-to-europe-research-indicates-325794/,0.97,1608,0,1608
12,worldnews,"‘Iran staging itself to reach nuclear goal in 1 or 2 weeks,’ experts say",https://www.ynetnews.com/article/hygtd2nx0,0.91,1525,0,1525
13,worldnews,"Justin Trudeau warns Canadians to listen to their top spy: “I would absolutely not recommend someone have TikTok” - David Vigneault, director of the Canadian Security Intelligence Service alleges the app collects users’ personal data, which is available to the authoritarian regime that governs China",https://www.thestar.com/politics/justin-trudeau-warns-canadians-to-listen-to-our-top-spy-i-would-absolutely-not-recommend/article_601baf56-146f-11ef-881b-139eab7e21af.html,0.94,1369,0,1369
14,worldnews,"David McBride, an Australian whistleblower got sentenced to nearly 6 years in jail for sharing classified documents that revealed alleged war crimes committed by Australian soldiers in Afganistan.",https://www.abc.net.au/news/2024-05-14/military-whistleblower-david-mcbride-sentenced-classified-info/103843314,0.96,1357,0,1357
15,worldnews,"Give Ukraine long-range missiles to hit Russian targets, German minister says",https://www.politico.eu/article/ukraine-germany-long-range-missiles-russia-war-annalena-baerbock/?utm_source=RSS_Feed&amp;utm_medium=RSS&amp;utm_campaign=RSS_Syndication,0.95,1047,0,1047
16,worldnews,"After 7 months since Oct. 7, UN Security Council holds first meeting entirely dedicated to Israeli hostages in Gaza",https://allisrael.com/after-7-months-since-oct-7un-security-council-holds-first-meeting-entirely-dedicated-to-israeli-hostages-in-gaza,0.89,1018,0,1018
17,worldnews,Justice Department says Boeing violated deal that avoided prosecution after 737 Max crashes,https://apnews.com//article/boeing-justice-department-737-max-82145b25ed988cd8cae0bce3de79ce9d,0.98,806,0,806
18,worldnews,Sycamore Gap tree case moved to crown court as two men accused of felling famous landmark,https://news.sky.com/story/sycamore-gap-tree-case-moved-to-crown-court-as-two-men-accused-of-felling-famous-landmark-13136609,0.97,610,0,610
19,worldnews,160 Lawyers Write to US Leaders Alleging Iran Bribed South Africa,https://iranwire.com/en/news/129348-160-lawyers-write-to-us-leaders-alleging-iran-bribed-south-africa/,0.87,606,0,606
20,worldnews,Israeli tourist in Belgium brutally attacked for peeling off anti-Israeli sticker,https://www.timesofisrael.com/israeli-tourist-in-belgium-brutally-attacked-for-peeling-off-anti-israeli-sticker/,0.83,550,0,550
21,worldnews,'I Feel Suffocated': Iran Intensifies Crackdown on Women,https://iranwire.com/en/women/129304-i-feel-suffocated-iran-intensifies-crackdown-on-women/,0.9,271,0,271
22,worldnews,/r/WorldNews Live Thread for Israel-Hamas War (Thread #49),https://www.reddit.com/live/1bsso361afr0r,0.78,233,0,233
23,worldnews,Tokyo battles surge of destructive raccoons that went from pet to pest,https://www.theguardian.com/world/article/2024/may/17/tokyo-japan-raccoons-numbers-increase,0.93,187,0,187
24,worldnews,Vladimir Putin and Xi Jinping: No longer a partnership of equals,https://www.bbc.com/news/articles/c2lekp48n78o,0.89,172,0,172
25,worldnews,Montreal police remove pro-Israel protesters from McGill University campus,https://montrealgazette.com/news/local-news/montreal-police-remove-pro-israel-protesters-from-mcgill-university-campus,0.83,164,0,164
26,worldnews,"/r/WorldNews Live Thread: Russian Invasion of Ukraine Day 815, Part 1 (Thread #961)",https://www.reddit.com/live/18hnzysb1elcs,0.94,162,0,162
