,subreddit,title,url,upvote_ratio,ups,downs,score
0,worldnews,Zelensky says Trump should reveal plan on ending Russia's war,https://kyivindependent.com/zelensky-18/,0.91,27703,0,27703
1,worldnews,"China Can End Russia’s War in Ukraine With One Phone Call, Finland Says",https://www.bloomberg.com/news/articles/2024-07-02/russia-ukraine-china-can-end-war-with-a-phone-call-finland-s-stubb-says,0.93,11156,0,11156
2,worldnews,Ukraine says it is unwilling to compromise in response to claims by Trump,https://tvpworld.com/79105464/ukraine-says-it-is-unwilling-to-compromise-in-response-to-claims-by-trump,0.94,10799,0,10799
3,worldnews,Italy seizes Chinese military drones heading to Libya,https://www.yahoo.com/news/italy-seizes-chinese-military-drones-194325430.html?guccounter=1&amp;guce_referrer=aHR0cHM6Ly93d3cuZ29vZ2xlLmNvbS8&amp;guce_referrer_sig=AQAAAL8Fzt0Bq9DlX3P5SbA1nvS7zdrGZSlWitTRm0XGbmY4wlGtzwKGn3ts7wnlx2dH6h_LQ3ykMroSC2ECKRhxkbDOmBI4lwFoQD0JdEjvjao_T6x0RCw4jK4zDEUUVr4UNj3p8qV9pDo0AF3QTnUQ0yp5IhAsCvzV0A0EyKvJJACP,0.98,5260,0,5260
4,worldnews,Belarus is building up its military on Ukraine's border and bragging about the 'high combat readiness' of its troops,https://www.businessinsider.com/belarus-says-boosting-military-on-ukraine-border-calls-it-enemy-2024-7,0.97,5175,0,5175
5,worldnews,"Some Israeli hostages have attempted suicide, Islamic Jihad armed wing says",https://www.straitstimes.com/world/some-israeli-hostages-have-attempted-suicide-islamic-jihad-armed-wing-says,0.91,3187,0,3187
6,worldnews,Russia cheers Marine Le Pen’s National Rally in French election,https://www.politico.eu/article/russia-marine-le-pen-national-rally-french-election-2024-ukraine-sanctions-war/?utm_medium=social&amp;utm_source=Twitter,0.93,2881,0,2881
7,worldnews,UN probe if envoy funded by Hamas supporters,https://www.ynetnews.com/article/rjh5aufp0,0.88,2327,0,2327
8,worldnews,AI-Driven Fake News Network from Russia Impersonates US Local Media to Influence Elections,https://www.bbc.com/news/articles/c72ver6172do.amp,0.96,2229,0,2229
9,worldnews,Japan declares victory in effort to end government use of floppy disks,https://www.reuters.com/world/asia-pacific/japan-declares-victory-effort-end-government-use-floppy-disks-2024-07-03/,0.98,2203,0,2203
10,worldnews,"At least 900 terrorists killed in Rafah ground operation, IDF chief says - I24NEWS",https://www.i24news.tv/en/news/israel-at-war/artc-at-least-900-terrorists-killed-in-rafah-ground-operation-idf-chief-says,0.84,2063,0,2063
11,worldnews,"Gaza-based CNN freelance journalist worked with, supported Hamas, watchdog report finds",https://m.jpost.com/israel-hamas-war/article-808696,0.86,1585,0,1585
12,worldnews,Singapore prepared to recognise a Palestinian state with an effective govt that accepts Israel's right to exist.,https://www.channelnewsasia.com/singapore/palestine-israel-singapore-prepared-principle-recognise-state-reject-terrorism-4450696,0.94,1440,0,1440
13,worldnews,Israel turbocharges West Bank settlement expansion with largest land grab in decades,https://www.thestar.com/news/world/middle-east/israel-turbocharges-west-bank-settlement-expansion-with-largest-land-grab-in-decades/article_c294a669-0d50-59c7-880c-eb4f2ee0c248.html?source=newsletter,0.82,1280,0,1280
14,worldnews,Germany will never support ceasefire that entails Ukraine's surrender – Scholz,https://www.pravda.com.ua/eng/news/2024/07/3/7463913/,0.97,1099,0,1099
15,worldnews,Two of the German military’s new spy satellites appear to have failed in orbit,https://arstechnica.com/space/2024/07/two-of-the-german-militarys-new-spy-satellites-appear-to-have-failed-in-orbit/,0.96,982,0,982
16,worldnews,"Israeli strike kills senior Hezbollah commander in south Lebanon, prompting retaliatory rocket fire",https://www.abc.net.au/news/2024-07-04/israeli-strike-kills-senior-hezbollah-commander-in-south-lebanon/104056102,0.94,773,0,773
17,worldnews,China is building a mammoth 8 GW solar farm - enough to power around 6 million households,https://electrek.co/2024/07/02/china-is-building-a-mammoth-8-gw-solar-farm/,0.9,678,0,678
18,worldnews,AI means Google's greenhouse gas emissions up 48% in 5 years,https://www.bbc.com/news/articles/c51yvz51k2xo,0.95,456,0,456
19,worldnews,"Chinese spy bases in Cuba are multiplying, including one near a US naval base.",https://armyrecognition.com/news/army-news/army-news-2024/alarm-bells-ring-as-china-multiplies-spy-bay-close-to-guantanamo-bay-in-cuba,0.96,328,0,328
20,worldnews,Morocco's legal cannabis industry projected to be worth $420-$630 million per year,https://www.cannabisindustrydata.com/moroccos-legal-cannabis-industry-projected-to-be-worth-420-630-million-per-year/,0.95,297,0,297
21,worldnews,"Britain will not rejoin EU in my lifetime, says Starmer",https://www.theguardian.com/politics/article/2024/jul/03/britain-will-not-rejoin-eu-in-my-lifetime-says-starmer,0.87,272,0,272
22,worldnews,"Iran election turnout 'lower than expected,' Khamenei says",https://www.ynetnews.com/article/ryapqofv0,0.92,254,0,254
23,worldnews,"/r/WorldNews Live Thread: Russian Invasion of Ukraine Day 861, Part 1 (Thread #1008)",https://www.reddit.com/live/18hnzysb1elcs,0.97,223,0,223
24,worldnews,"Israel and Hamas appear on brink of framework agreement for ceasefire and hostage deal, Israeli source says",https://www.cnn.com/2024/07/03/middleeast/israel-hamas-ceasefire-hostage-talks-intl-latam/index.html,0.88,211,0,211
25,worldnews,/r/WorldNews Live Thread for Israel-Hamas War (Thread #56),https://www.reddit.com/live/1bsso361afr0r,0.78,160,0,160
26,worldnews,"Elderly busker, jailed after playing protest anthem ‘Glory to Hong Kong,’ faces fresh charges",https://hongkongfp.com/2024/07/03/elderly-busker-jailed-after-playing-protest-anthem-glory-to-hong-kong-faces-fresh-charges/,0.92,150,0,150
