,subreddit,title,url,upvote_ratio,ups,downs,score
0,worldnews,Russia Announces ‘Tactical’ Withdrawal From Ukraine’s Robotyne,https://www.themoscowtimes.com/2023/09/06/russia-announces-tactical-withdrawal-from-ukraines-robotyne-a82369,0.95,19903,0,19903
1,worldnews,Mexico’s Supreme Court decriminalizes abortion nationwide,https://apnews.com/article/mexico-abortion-decriminalize-d87f6edbdf68c2e6c8f5700b3afd15de,0.95,14351,0,14351
2,worldnews,"Earth just had its hottest summer on record, U.N. says, warning ""climate breakdown has begun""",https://www.cbsnews.com/news/hottest-summer-on-record-2023-un-says-climate-change-global-warming-data/,0.93,13449,0,13449
3,worldnews,Romania confirms Russian drone debris fell on its territory,https://www.politico.eu/article/romania-confirms-russia-drone-debris-fell-on-its-territory-ukraine-war/,0.98,5650,0,5650
4,worldnews,Russia hits Kostiantynivka killing at least 16 people,https://www.pravda.com.ua/eng/news/2023/09/6/7418688/,0.97,3974,0,3974
5,worldnews,Unprecedented: Armenia says it will stage joint military exercise with US next week,https://www.reuters.com/world/armenia-us-hold-joint-military-drills-sept-11-20-2023-09-06/,0.98,3853,0,3853
6,worldnews,Finnish parliament drops Pepsi as fallout continues from its addition to international sponsors of war list,https://english.nv.ua/nation/finland-s-parliament-stops-selling-pepsi-over-company-s-failure-to-exit-war-sponsoring-russia-50351665.html,0.97,3603,0,3603
7,worldnews,"The Hungarian version of Elle magazine has put a pair of gay dads and their child on its front cover, in a defiant move amid the country’s worsening anti-LGBTQ+ equality record.",https://www.thepinknews.com/2023/09/06/elle-hungary-gay-dads-anti-lgbtq-laws/,0.94,3304,0,3304
8,worldnews,"US State Secretary arrives in Kyiv for two-day visit, with US$1 billion package – Reuters",https://www.pravda.com.ua/eng/news/2023/09/6/7418656/,0.96,2397,0,2397
9,worldnews,Five killed as elevator at Bali resort plunges down ravine | Bali | The Guardian,https://www.theguardian.com/world/2023/sep/06/bali-resort-elevator-crash-deaths,0.97,2261,0,2261
10,worldnews,Russia voices concern as Armenia prepares to exercise with US troops,https://www.aljazeera.com/news/2023/9/6/russia-voices-concern-as-armenia-prepares-to-exercise-with-us-troops,0.96,1344,0,1344
11,worldnews,Scotland is planning a transition to a 4-day workweek for civil servants and wants the private sector to follow suit,https://fortune.com/2023/09/04/scotland-4-day-work-week-pilot-civil-servants/amp/,0.97,1103,0,1103
12,worldnews,Jenni Hermoso files criminal complaint against Luis Rubiales over kiss,https://www.theguardian.com/world/2023/sep/06/jenni-hermoso-files-criminal-complaint-against-luis-rubiales-over-kiss,0.95,1057,0,1057
13,worldnews,Africa proposes global taxes to fight climate change - BBC News,https://www.bbc.com/news/world-africa-66733557.amp,0.92,953,0,953
14,worldnews,"Schoolchildren in Russia will learn to handle rifles, operate UAVs – UK intel",https://www.ukrinform.net/rubric-ato/3757642-schoolchildren-in-russia-will-learn-to-handle-rifles-operate-uavs-uk-intel.html,0.94,837,0,837
15,worldnews,"Abbas: Ashkenazi Jews 'are not Semites,' Hitler killed them for their 'social role'",https://www.timesofisrael.com/abbas-ashkenazi-jews-are-not-semites-hitler-killed-them-for-their-social-role/,0.91,814,0,814
16,worldnews,"Russian missile strikes eastern Ukraine market, killing 16, in one of the worst attacks in months",https://www.cnn.com/2023/09/06/europe/russian-missile-donetsk-market-intl/index.html,0.96,706,0,706
17,worldnews,"Carbon markets are 'bogus solutions' as rich world keeps polluting, African Climate Summit is told",https://phys.org/news/2023-09-carbon-bogus-solutions-rich-world.html,0.94,638,0,638
18,worldnews,China bans use of iPhones for government officials | CNN Business,https://www.cnn.com/2023/09/06/tech/china-government-official-iphone-ban/index.html,0.93,635,0,635
19,worldnews,"13-year-old taking selfies at Israeli park stumbles on 1,700-year-old artifact",https://www.bellinghamherald.com/news/nation-world/world/article279017994.html,0.9,377,0,377
20,worldnews,"/r/WorldNews Live Thread: Russian Invasion of Ukraine Day 561, Part 1 (Thread #707)",https://www.reddit.com/live/18hnzysb1elcs,0.97,276,0,276
21,worldnews,"Israel imposing apartheid on Palestinians, says former Mossad chief",https://www.theguardian.com/world/2023/sep/06/israel-imposing-apartheid-on-palestinians-says-former-mossad-chief,0.82,274,0,274
22,worldnews,Charges brought against Greek ferry crew over death of passenger pushed into sea.,https://www.theguardian.com/world/2023/sep/06/greek-captain-three-crew-members-face-homicide-charges-passenger-death,0.94,183,0,183
23,worldnews,"Uganda makes first arrest for ‘aggravated homosexuality,’ a crime punishable by death under new anti-LGBTQ+ law",https://english.elpais.com/international/2023-09-05/uganda-makes-first-arrest-for-aggravated-homosexuality-a-crime-punishable-by-death-under-new-anti-lgbtq-law.html,0.91,142,0,142
24,worldnews,"After a frontline breakthrough, Ukraine appears optimistic it can further breach Russian defenses | CNN",https://edition.cnn.com/2023/09/06/europe/ukraine-counteroffensive-south-russian-defenses-intl/index.html,0.94,117,0,117
25,worldnews,Mexico set for first female president in 2024 election.,https://www.theguardian.com/world/2023/sep/07/mexico-2024-election-claudia-sheinbaum-female-president-xochitl-galvez,0.91,106,0,106
