,subreddit,title,url,upvote_ratio,ups,downs,score
0,worldnews,Iran executes karate champion and volunteer children's coach amid crackdown on protests | CNN,https://edition.cnn.com/2023/01/07/middleeast/iran-protesters-executed-intl-hnk/index.html,0.94,56695,0,56695
1,worldnews,Extradition of 'El Chapo' son to the US halted after 29 killed in arrest operation,https://edition.cnn.com/2023/01/06/americas/el-chapo-son-arrest-mexico-prison-intl/index.html,0.94,46530,0,46530
2,worldnews,Norway Replaces Russia As Germany’s Top Gas Supplier,https://oilprice.com/Latest-Energy-News/World-News/Norway-Replaces-Russia-As-Germanys-Top-Gas-Supplier.html,0.96,42121,0,42121
3,worldnews,Zelensky strips 13 pro-Russia priests of citizenship - media,https://www.ukrinform.net/rubric-society/3648267-zelensky-strips-13-prorussia-priests-of-citizenship-media.html,0.95,13301,0,13301
4,worldnews,"Border guards stop Russia’s attack near Bakhmut, eliminate commander",https://www.ukrinform.net/rubric-ato/3648217-border-guards-stop-russias-attack-near-bakhmut-eliminate-commander.html,0.97,10203,0,10203
5,worldnews,"One of ""the world's most wanted"" human traffickers caught, Interpol says",https://www.cbsnews.com/news/one-of-the-worlds-most-wanted-human-traffickers-caught-sudan-interpol-says/#app,0.98,8492,0,8492
6,worldnews,Germany says EU decisions should not be blocked by individual countries,https://www.reuters.com/world/europe/germany-says-eu-decisions-should-not-be-blocked-by-individual-countries-2023-01-04/?utm_source=reddit.com,0.96,5773,0,5773
7,worldnews,"In Luhansk region, partisans destroy railway line Russians use to deliver military equipment",https://www.ukrinform.net/rubric-ato/3648311-in-luhansk-region-partisans-destroyed-railway-line-russians-use-to-deliver-military-equipment.html,0.98,4055,0,4055
8,worldnews,Belarus has no future as independent country - Kyiv Defense Commander,https://www.ukrinform.net/rubric-ato/3648287-belarus-has-no-future-as-independent-country-kyiv-defense-commander.html,0.97,3829,0,3829
9,worldnews,Russians take 300 children from Donetsk and Luhansk regions to Moscow,https://www.ukrinform.net/rubric-ato/3648174-russians-take-300-children-from-donetsk-and-luhansk-regions-to-moscow.html,0.96,3177,0,3177
10,worldnews,Brazilian Amazon deforestation up 150% in Bolsonaro's last month,https://phys.org/news/2023-01-brazilian-amazon-deforestation-bolsonaro-month.html,0.96,2559,0,2559
11,worldnews,"Jack Ma will relinquish ownership of China’s Ant Group, the company claims",https://www.naijpress.com/jack-ma-will-relinquish-wp-admin-admin-ajax-phpship-of-chinas-ant-group-the-company-claims/,0.96,2213,0,2213
12,worldnews,Global food prices in 2022 hit a record high amid drought and war,https://www.npr.org/2023/01/07/1147660525/global-food-prices-2022-record-high,0.96,1568,0,1568
13,worldnews,Russia launches strikes in Ukraine in violation of self-declared ceasefire,https://www.theguardian.com/world/2023/jan/07/russia-launches-strikes-in-ukraine-in-violation-of-self-declared-ceasefire?CMP=Share_iOSApp_Other,0.95,1473,0,1473
14,worldnews,Zelenskyy Hails US Military Aid To Ukraine As Cease-Fire Said To Falte,https://www.huffpost.com/entry/zelenskyy-hails-us-military-aid-to-ukraine-as-cease-fire-said-to-falter_n_63b9b14fe4b0b2e150680ad3,0.94,1384,0,1384
15,worldnews,‘A Wonderful Christmas Present’: Zelenskyy Praises US Military Package,https://www.eurasiareview.com/08012023-a-wonderful-christmas-present-zelenskyy-praises-us-military-package/,0.94,1012,0,1012
16,worldnews,Poland signs deal to buy 2nd batch of U.S. Abrams tanks,https://abcnews.go.com/amp/International/wireStory/poland-signs-deal-buy-2nd-batch-us-abrams-96177548,0.96,870,0,870
17,worldnews,Russia insists it is observing Ukraine ceasefire despite Kyiv attacks,https://www.hindustantimes.com/world-news/russia-insists-it-is-observing-ukraine-ceasefire-despite-kyiv-attacks-101673102718269-amp.html,0.9,732,0,732
18,worldnews,"U.S. stresses need for ""independent institutions"" as Israel seeks to weaken judiciary",https://www.axios.com/2023/01/07/us-stresses-need-for-independent-institutions-as-israel-seeks-to-weaken-judiciary,0.91,707,0,707
19,worldnews,"Thousands of Israelis protested on Saturday against Prime Minister Benjamin Netanyahu's new government, regarded as the most right-wing in Israeli history. Protesters brandished signs with slogans including ""Democracy in danger"" and ""Together against fascism and apartheid""",https://www.france24.com/en/live-news/20230107-israelis-protest-new-netanyahu-government,0.91,575,0,575
20,worldnews,Palestinians accuse Israel of training spy cows - report,https://m.jpost.com/middle-east/article-726825,0.86,457,0,457
21,worldnews,Iran condemned for executing two men over alleged crimes during protests,https://www.theguardian.com/world/2023/jan/07/iran-executes-two-men-over-alleged-crimes-during-protests-judiciary-says,0.94,400,0,400
22,worldnews,"Police open more than 57,300 criminal proceedings over Russian crimes in Ukraine",https://www.ukrinform.net/rubric-crime/3648378-police-open-more-than-57300-criminal-proceedings-over-russian-crimes-in-ukraine.html,0.93,324,0,324
23,worldnews,"Tesla slashes prices in China, other Asian markets as sales stumble",https://www.reuters.com/technology/tesla-cuts-prices-model-3-model-y-china-2023-01-06/,0.91,240,0,240
24,worldnews,"/r/WorldNews Live Thread: Russian Invasion of Ukraine Day 319, Part 1 (Thread #460)",https://www.reddit.com/live/18hnzysb1elcs,0.95,207,0,207
25,worldnews,Russia’s unusual laser devices fall into Ukrainian hands -,https://ukrainetoday.org/2023/01/07/russias-unusual-laser-devices-fall-into-ukrainian-hands/,0.96,161,0,161
