,subreddit,title,url,upvote_ratio,ups,downs,score
0,worldnews,"25 to 32 drones attack Moscow: 2 buildings damaged, people evacuated",https://www.pravda.com.ua/eng/news/2023/05/30/7404446/,0.91,42200,0,42200
1,worldnews,Ukraine has right to defend itself beyond its borders – UK Foreign Secretary,https://www.pravda.com.ua/eng/news/2023/05/30/7404539/,0.9,31889,0,31889
2,worldnews,US bombers fly over Bosnia in sign of support amid continued secessionist threats,https://news.yahoo.com/us-bombers-fly-over-bosnia-170522912.html,0.95,15486,0,15486
3,worldnews,Japanese court rules against same-sex marriage ban in major win for LGBTQ+ equality,https://www.thepinknews.com/2023/05/30/japan-same-sex-marriage-ban-court-ruling/,0.94,9828,0,9828
4,worldnews,Georgian Prime Minister claims that Russia unleashed war because of Ukraine's desire to join NATO,https://www.pravda.com.ua/eng/news/2023/05/30/7404473/,0.95,6615,0,6615
5,worldnews,"Wagner's chief says his army isn't strong enough to topple Putin, responding to rumors he is planning a coup: report",https://www.businessinsider.com/putin-coup-wagner-chief-yevgeny-prigozhin-denies-rumors-russian-president-2023-5,0.97,6234,0,6234
6,worldnews,Ukrainian woman detained in Moscow for attempting to bring deported children back to Ukraine – Russian media,https://www.pravda.com.ua/eng/news/2023/05/30/7404472/,0.97,5029,0,5029
7,worldnews,"Russian energy giant Gazprom's private security force was deployed to fight in Ukraine, report says",https://markets.businessinsider.com/news/commodities/russia-energy-gazprom-security-force-mobilization-ukraine-war-vladimir-putin-2023-5,0.98,3790,0,3790
8,worldnews,"Uganda condemned by Joe Biden, UK government and world leaders over lethal anti-gay law",https://www.thepinknews.com/2023/05/30/uganda-anti-homosexuality-act-law-condemned-joe-biden/,0.95,2359,0,2359
9,worldnews,"WHO records 1,000 attacks on Ukraine's health system during war",https://www.euronews.com/2023/05/30/world-health-organisation-records-1000-attacks-on-ukraines-health-system-during-war,0.96,1870,0,1870
10,worldnews,"Mexico failed to uphold international treaty protecting vaquita porpoise, U.S. says: Maybe just 10 are left that haven't been caught in nets targeting totoaba for the Chinese black market",https://news.mongabay.com/2023/05/u-s-says-mexico-failed-to-uphold-international-treaty-protecting-vaquita-porpoise/,0.96,1805,0,1805
11,worldnews,North Korea says spy satellite launch crashed into sea,https://www.bbc.com/news/world-asia-65761995,0.97,1570,0,1570
12,worldnews,Wagner’s chief Prigozhin blames Russian Ministry of Defense incompetence for Moscow drone attack,https://news.yahoo.com/wagner-prigozhin-blames-russian-mod-214400429.html,0.97,1442,0,1442
13,worldnews,NATO to deploy 700 more troops to Kosovo: Stoltenberg,https://tvpworld.com/70209317/nato-to-deploy-700-more-troops-to-kosovo-stoltenberg,0.96,1113,0,1113
14,worldnews,Poland sanctions 365 Belarusians and bans Belarusian and Russian trucks,https://notesfrompoland.com/2023/05/30/poland-sanctions-365-belarusian-officials-and-bans-belarusian-and-russian-trucks/,0.96,786,0,786
15,worldnews,Iran begins trial of female journalist who covered Mahsa Amini’s death,https://www.theguardian.com/world/2023/may/30/iran-begins-trial-female-journalist-niloofar-hamedi-mahsa-amini-death,0.95,760,0,760
16,worldnews,Nearly every region in Peru is facing an outbreak of dengue,https://perureports.com/perus-dengue-outbreak-where-are-the-regions-most-affected/10143/,0.96,586,0,586
17,worldnews,"Russian Wagner Group is using American social media platforms like Facebook and Twitter to recruit new members around the world, according to new report",https://www.businessinsider.com/wagner-group-using-facebook-twitter-to-recruit-new-members-report-2023-5,0.95,571,0,571
18,worldnews,North Korea says its attempt to launch 1st spy satellite ends in failure,https://apnews.com/article/north-korea-launch-military-spy-satellite-db6ce3f08e1ec8e23674aef519d04403,0.95,439,0,439
19,worldnews,"/r/WorldNews Live Thread: Russian Invasion of Ukraine Day 462, Part 1 (Thread #603)",https://www.reddit.com/live/18hnzysb1elcs,0.97,429,0,429
20,worldnews,Russian lawmakers introduce draft bill to ban gender-affirming surgery,https://apnews.com/article/65faa0fe898e3e1996d806ba68df4d8c,0.88,267,0,267
21,worldnews,Chinese fighter jet harassed U.S. Air Force spy plane over South China Sea,https://www.cbsnews.com/news/chinese-fighter-jet-harasses-u-s-air-force-spy-plane-over-south-china-sea/,0.87,204,0,204
22,worldnews,Taiwan receives first batch of FIM-92 Stinger air defense missiles from the US as part of $500 million military aid package,https://www.thedefensepost.com/2023/05/30/taiwan-stinger-missiles-us/,0.94,182,0,182
23,worldnews,Zelenskyy invites British defence company to manufacture weapons in Ukraine,https://www.pravda.com.ua/eng/news/2023/05/30/7404575/,0.92,140,0,140
24,worldnews,Denmark to triple defense budget over next decade to reach NATO goal of 2% GDP spending on military,https://www.thedefensepost.com/2023/05/30/denmark-triple-defense-budget/,0.95,118,0,118
25,worldnews,Germany cracks down on far right with raids as hate crimes rise,https://www.nbcnews.com/news/world/germany-far-right-hate-crimes-extremist-rcna86173,0.93,100,0,100
