,subreddit,title,url,upvote_ratio,ups,downs,score
0,worldnews,Russian conscript tortured and killed for refusing to fight in Ukraine,https://novayagazeta.eu/articles/2024/12/07/russian-conscript-tortured-and-killed-for-refusing-to-fight-in-ukraine-en-news,0.95,9095,0,9095
1,worldnews,"Assad regime in Syria may fall in days, US increasingly believes | CNN Politics",https://www.cnn.com/2024/12/07/politics/assad-regime-syrian-civil-war?cid=ios_app,0.97,8856,0,8856
2,worldnews,"Russia's Lavrov says Moscow, Tehran and Ankara want immediate end to fighting in Syria",https://www.middleeastmonitor.com/20241207-russias-lavrov-says-moscow-tehran-and-ankara-want-immediate-end-to-fighting-in-syria/,0.94,8838,0,8838
3,worldnews,Syrian rebels appear to have entered Damascus as Assad regime’s defenses crumble,https://amp.cnn.com/cnn/2024/12/07/middleeast/syria-rebels-homs-damascus-assad-intl,0.97,6982,0,6982
4,worldnews,South Korea president set to survive impeachment after governing lawmakers boycott vote | CNN,https://edition.cnn.com/2024/12/06/asia/south-koreas-president-yoon-sun-yeol-intl-hnk/index.html,0.98,5181,0,5181
5,worldnews,Syrian Government Denies Assad Has Fled as Rebels Advance,https://www.newsweek.com/syria-latest-update-assad-fled-country-rebels-advance-1997129,0.98,4466,0,4466
6,worldnews,"Syrian President Bashar al-Assad has left Damascus to an unknown destination, say two senior army officers",https://www.reuters.com/world/middle-east/syrian-president-bashar-al-assad-has-left-damascus-an-unknown-destination-say-2024-12-08/,0.98,3831,0,3831
7,worldnews,Paraguay expels Chinese diplomat for urging lawmakers to sever ties to Taiwan,https://www.yahoo.com/news/paraguay-expels-chinese-diplomat-urging-093000596.html?guccounter=1,0.98,3614,0,3614
8,worldnews,"Syrian army quits Homs, cutting Assad off from coast",https://www.reuters.com/world/middle-east/syrian-rebels-seize-fourth-city-close-homs-threat-assads-rule-2024-12-07/?p,0.98,3418,0,3418
9,worldnews,US announces nearly $1 billion in military aid for Ukraine,https://www.voanews.com/a/us-announces-nearly-1-billion-in-military-aid-for-ukraine-/7891108.html,0.95,2961,0,2961
10,worldnews,South Korea’s president avoids impeachment after martial law misstep,https://www.washingtonpost.com/world/2024/12/07/south-korea-president-impeachment-martial-law/,0.97,2635,0,2635
11,worldnews,Syrian government appears to have fallen in stunning end to 50-year rule of Assad family,https://apnews.com/article/syria-assad-sweida-daraa-homs-hts-qatar-7f65823bbf0a7bd331109e8dff419430,0.99,2463,0,2463
12,worldnews,Rebel forces just 20 km away from Syrian capital city of Damascus: Report,https://www.firstpost.com/world/rebel-forces-just-20-km-away-from-syrian-capital-city-of-damascus-report-13842566.html,0.98,2393,0,2393
13,worldnews,Ukraine confirms second Danish delivery of F-16s as Zelenskyy seeks support in Paris,https://apnews.com/article/russia-ukraine-war-f16-denmark-86c2d6631869cc8f5217482e22bf52d8,0.97,2361,0,2361
14,worldnews,"Syrian President Bashar Al-Assad's Plane Shot Down, Say Unconfirmed Reports
",https://www.freepressjournal.in/world/syrian-president-bashar-al-assads-plane-shot-down-say-unconfirmed-reports,0.97,2305,0,2305
15,worldnews,Syrian rebels say they control the south and are approaching and encircling Damascus,https://www.middleeasteye.net/news/syrian-rebels-control-south-approaching-damascus,0.98,1744,0,1744
16,worldnews,"'To the displaced, a free Syria awaits you': Rebels declare end of Assad regime",https://www.jpost.com/breaking-news/article-832420?utm_source=ActiveCampaign&amp;utm_medium=email&amp;utm_content=Syrian%20army%20announces%20fall%20of%20Assad%20regime&amp;utm_campaign=ASSAD%20REGIME%20FALLS&amp;vgo_ee=1FaGrV5ctLaGZ8pJw5jXDq%2BH8OwPHOVhr9fHavHYduTb8OJbew%3D%3D%3A3X%2FIx0eYZCsoQb4FuVpBLD76DDo649Pi,0.98,1672,0,1672
17,worldnews,"Zelensky praises productive meeting held with Trump, Macron, stresses peace through strength",https://kyivindependent.com/zelensky-praises-productive-meeting-held-with-trump-macron-stresses-peace-through-strength/,0.95,1616,0,1616
18,worldnews,"Iran, backing Russia, claims Ukraine supplies weapons to Syrian rebels",https://www.pravda.com.ua/eng/news/2024/12/6/7488010/,0.93,1014,0,1014
19,worldnews,Denmark delivers second batch of F-16 fighter jets to Ukraine,https://kyivindependent.com/denmark-delivers-second-batch-of-f-16-fighter-jets-to-ukraine-zelensky-announces/,0.98,978,0,978
20,worldnews,US to probe Spanish port for reportedly refusing shipments of arms to Israel,https://m.jpost.com/breaking-news/article-832310,0.89,839,0,839
21,worldnews,Syrian rebels claim they have captured the capital Damascus,https://www.nbcnews.com/news/world/syrian-rebels-claim-captured-capital-damascus-rcna183263,0.99,819,0,819
22,worldnews,A major cocaine transit country is halting U.S. anti-drug cooperation ,https://www.washingtonpost.com/world/2024/12/06/united-states-paraguay-drug-trafficking-cooperation/?utm_campaign=wp_main&amp;utm_medium=social&amp;utm_source=reddit.com,0.94,635,0,635
23,worldnews,Syria rebels take areas near Israel border; IDF warns them not to 'turn in our direction',https://www.timesofisrael.com/syria-rebels-take-areas-near-israel-border-idf-warns-them-not-to-turn-in-our-direction/,0.94,530,0,530
24,worldnews,Syrian prime minister says he is ready to hand over the government to the opposition in a peaceful transition,https://abcnews.go.com/International/wireStory/syrian-prime-minister-ready-hand-government-opposition-peaceful-116566429,0.97,472,0,472
25,worldnews,"/r/WorldNews Live Thread: Russian Invasion of Ukraine Day 1018, Part 1 (Thread #1165)",https://www.reddit.com/live/18hnzysb1elcs,0.96,154,0,154
26,worldnews,/r/WorldNews Live Thread: Israel at War (Thread #80),https://www.reddit.com/live/1bsso361afr0r,0.69,37,0,37
