,subreddit,title,url,upvote_ratio,ups,downs,score
0,worldnews,"July is world's hottest month, with spikes not seen in 125,000 years",https://www.axios.com/2023/07/20/world-heat-wave-records-us-europe-china,0.89,27712,0,27712
1,worldnews,"Ukrainian women are using dating profiles with AI images to trick horny Russian soldiers into giving away secrets, report says",https://www.businessinsider.com/ukrainian-women-use-dating-profiles-get-intel-from-russian-soldiers-2023-7,0.94,9254,0,9254
2,worldnews,Occupied Ukrainian Nuclear Power Plant staff refusing Russian orders to start up reactor,https://www.ukrinform.net/rubric-ato/3738403-znpp-staff-refusing-to-start-up-reactor-no-4-energoatom.html,0.97,7519,0,7519
3,worldnews,Ukraine to Treat Ships on Way to Russian Ports as Potential Carriers of Military Cargo,https://www.reuters.com/world/europe/ukraine-treat-ships-way-russian-ports-potential-carriers-military-cargo-2023-07-20/,0.97,4955,0,4955
4,worldnews,"Iraq prime minister expels Swedish ambassador, withdraws diplomat from Sweden as man desecrates Quran in Stockholm",https://abcnews.go.com/US/wireStory/iraq-prime-minister-expels-swedish-ambassador-withdraws-diplomat-101515911,0.96,4375,0,4375
5,worldnews,Clash occurs between Wagnerites and border guards in Belarus – National Resistance Center,https://www.pravda.com.ua/eng/news/2023/07/20/7412145/,0.97,4369,0,4369
6,worldnews,Kenya set to introduce vile anti-homosexuality law,https://www.thepinknews.com/2023/07/20/kenya-anti-homosexuality-law-africa/,0.9,4302,0,4302
7,worldnews,UK Defence Secretary says UK gave Ukraine 15 times more artillery shells than planned,https://www.pravda.com.ua/eng/news/2023/07/20/7412239/,0.97,3216,0,3216
8,worldnews,Russia targeting Ukrainian elderly and children in mass abduction ploy,https://www.telegraph.co.uk/world-news/2023/07/20/russia-war-crimes-abducting-ukraine-children-elderly/,0.95,3087,0,3087
9,worldnews,North Korea gives US cold shoulder on missing soldier,https://thehill.com/newsletters/defense-national-security/4109093-north-korea-gives-us-cold-shoulder-on-missing-soldier/,0.96,2140,0,2140
10,worldnews,North Korea Threatens Nuclear Response After US Sub Deployment,https://www.barrons.com/news/n-korea-says-us-sub-deployment-meets-threshold-for-nuclear-weapons-use-e4678290,0.94,2005,0,2005
11,worldnews,Ukraine: Ready to Retake Bakhmut,https://www.kyivpost.com/post/19665,0.95,1900,0,1900
12,worldnews,"Cluster bombs: Ukraine using munitions 'effectively', says US",https://www.bbc.com/news/world-europe-66262164,0.96,1497,0,1497
13,worldnews,Thousands died in the Philippines' 'war on drugs.' An international probe will now go ahead,https://apnews.com/article/philippines-icc-war-on-drugs-duterte-investigation-d636b2f9ef40e768008bc6ab74bbab3f,0.96,1198,0,1198
14,worldnews,"Russia yet to grant access to Zaporizhzhia nuclear reactor roofs, IAEA says",https://www.reuters.com/world/europe/russia-yet-grant-access-zaporizhzhia-nuclear-reactor-roofs-iaea-2023-07-20/,0.96,1062,0,1062
15,worldnews,Chinese professor says youth jobless rate might have hit 46.5%,https://www.channelnewsasia.com/asia/china-jobless-youth-professor-rate-465-3642026,0.96,641,0,641
16,worldnews,Long-lost Greenland ice core suggests potential for disastrous sea level rise,https://www.cnn.com/2023/07/20/world/greenland-ice-sheet-melt-sea-level-rise-climate/index.html,0.94,612,0,612
17,worldnews,New U.S. sanctions aim to choke off Russia’s access to battlefield supplies and revenue,https://www.pbs.org/newshour/politics/new-u-s-sanctions-aim-to-choke-off-russias-access-to-battlefield-supplies-and-revenue,0.95,575,0,575
18,worldnews,"U.S. Sanctions More Than 120 Russian, Kyrgyz Firms",https://www.themoscowtimes.com/2023/07/20/us-sanctions-more-than-120-russian-kyrgyz-firms-a81915,0.95,520,0,520
19,worldnews,Russia bombards Odesa and other southern Ukraine port cities for third night since end of grain deal,https://www.courant.com/2023/07/20/russia-bombards-odesa-and-other-southern-ukraine-port-cities-for-third-night-since-end-of-grain-deal/,0.96,497,0,497
20,worldnews,"Video of Sexual Assault Goes Viral in India, Renewing Attention on Ethnic Conflict",https://www.nytimes.com/2023/07/20/world/asia/india-manipur-video-woman.html?smid=nytcore-ios-share&amp;referringSource=articleShare,0.94,389,0,389
21,worldnews,Russian tour operators beg Crimea vacationers not to cancel trips following bridge attack |,https://www.cnn.com/travel/article/russia-crimea-bridge-tour-vacationers-intl/index.html,0.93,309,0,309
22,worldnews,27 Hacked-Up Bodies Found By Volunteers In Mexican Border City,https://www.nbcnews.com/news/world/mexico-hacked-bodies-graves-reynosa-mcallen-texas-cartels-rcna95330,0.96,275,0,275
23,worldnews,"/r/WorldNews Live Thread: Russian Invasion of Ukraine Day 513, Part 1 (Thread #659)",https://www.reddit.com/live/18hnzysb1elcs,0.98,253,0,253
24,worldnews,Shock in India: Women were paraded naked and sexually assaulted; Prime Minister Modi - 'Shame on the country',https://www.ynetnews.com/article/b17zitlqh,0.92,115,0,115
25,worldnews,Amsterdam bans cruise ships to limit visitors and curb pollution,https://www.bbc.co.uk/news/world-europe-66264226,0.94,95,0,95
