,subreddit,title,url,upvote_ratio,ups,downs,score
0,worldnews,"French PM asks whether 'Putin's troops are already in our country,' pointing at Le Pen",https://www.lemonde.fr/en/international/article/2024/02/28/french-pm-wonders-whether-putin-s-troops-are-already-in-our-country-pointing-at-le-pen_6567595_4.html,0.94,15913,0,15913
1,worldnews,Ghana passes bill making identifying as LGBTQ+ illegal,https://www.bbc.co.uk/news/world-africa-68353437,0.93,14946,0,14946
2,worldnews,"Hamas Rejects Cease-Fire Proposal, Dashing Biden’s Hopes of Near Term Deal",https://www.nytimes.com/2024/02/27/world/middleeast/biden-israel-hamas-cease-fire.html,0.87,13126,0,13126
3,worldnews,‘Kremlin Leaks’: Files detail Putin’s €1 billion propaganda effort ahead of presidential vote,https://www.france24.com/en/europe/20240227-kremlin-leaks-files-detail-putin-s-%E2%82%AC1-billion-propaganda-effort-ahead-of-presidential-vote,0.96,12605,0,12605
4,worldnews,The party’s over for Russians in Sri Lanka after ‘whites only’ event fuels outrage,https://www.yahoo.com/news/party-over-russians-sri-lanka-110640404.html,0.96,6677,0,6677
5,worldnews,Belarusian dissidents confirm plan to execute coup against Belarus leader Alexander Lukashenko,https://www.politico.eu/article/belarus-dissidents-bypol-group-prepare-coup-alexander-lukashenko/,0.98,4361,0,4361
6,worldnews,Hamas chief Haniyeh calls on Arabs to storm al-Aqsa on Ramadan,https://www.jpost.com/israel-hamas-war/article-789389,0.92,4235,0,4235
7,worldnews,Speakers of 23 parliaments issue open letter to Mike Johnson in Ukraine aid support,https://newsukraine.rbc.ua/news/speakers-of-23-parliaments-issue-open-letter-1709121571.html,0.97,4220,0,4220
8,worldnews,Chad coup attempt underway; military heads towards the presidential headquarters,https://www.agenzianova.com/en/news/chad-coup-attempt-underway-the-military-heads-towards-the-presidential-headquarters-video/,0.98,4002,0,4002
9,worldnews,French Senate votes to make abortion a constitutional 'freedom',https://www.lemonde.fr/en/france/article/2024/02/28/french-senat-votes-to-make-abortion-a-constitutional-freedom_6569515_7.html,0.97,3660,0,3660
10,worldnews,UN secretary general warns world is becoming ‘less safe by the day’,https://www.lbc.co.uk/world-news/ee9b7cf84e594d1e97a9c979ffca1a0f/,0.93,3514,0,3514
11,worldnews,"North Korean factories making arms for Russia are ‘operating at full capacity,’ South Korea says | CNN",https://edition.cnn.com/2024/02/28/asia/north-korea-munitions-factories-shipments-russia-ukraine-intl-hnk/index.html,0.97,3365,0,3365
12,worldnews,"With or without US support, 'we cannot let Russia win,' says Ursula von der Leyen",https://www.euronews.com/my-europe/2024/02/28/with-or-without-us-support-we-cannot-let-russia-win-says-ursula-von-der-leyen,0.97,2925,0,2925
13,worldnews,Germany reconsiders nuclear deterrent after Trump's warning about Putin attacks,https://www.telegraph.co.uk/world-news/2024/02/28/germany-reconsiders-using-nuclear-weapons/,0.96,2771,0,2771
14,worldnews,US sanctions to damage India’s oil supply from Russia,https://www.offshore-technology.com/news/us-sanctions-to-damage-indias-oil-supply-from-russia/,0.95,1859,0,1859
15,worldnews,"Red Sea: the German frigate ""Hessen"" opens fire on an allied drone without managing to shoot it down",https://www.agenzianova.com/en/news/red-sea-the-german-frigate-hessen-opens-fire-on-an-allied-drone/,0.95,1786,0,1786
16,worldnews,Belgium buys 200 million euros’ worth of ammunition for Ukraine,"https://www.vrt.be/vrtnws/en/2024/02/28/belgium-buys-200-million-euros-worth-of-ammunition-for-ukraine/#:~:text=Belgium%20is%20investing%20200%20million,March%2C%20Mr%20De%20Croo%20said.",0.97,1644,0,1644
17,worldnews,China urges largest nuclear states to negotiate a 'no-first-use' treaty,https://www.reuters.com/world/china-urges-un-define-roadmap-exempt-non-nuclear-states-nuclear-threat-state-2024-02-28/,0.95,1154,0,1154
18,worldnews,Ukraine’s 3rd Assault Brigade knocks Russians out of Krasnohorivka in Donetsk Oblast,https://www.pravda.com.ua/eng/news/2024/02/28/7444210/,0.97,772,0,772
19,worldnews,U.S. weighs airdropping aid into Gaza as land deliveries slow,https://www.axios.com/2024/02/28/biden-airdrop-aid-gaza-israel,0.88,570,0,570
20,worldnews,"Lithuania to require 18,000 Belarusians to indicate view on Russian invasion of Ukraine",https://kyivindependent.com/lithuania-to-screen-18-000-belarusians-on-views-invasion/,0.93,468,0,468
21,worldnews,/r/WorldNews Live Thread for Israel-Hamas War (Thread 46),https://www.reddit.com/live/1bsso361afr0r,0.84,433,0,433
22,worldnews,Lithuanian Foreign Minister considers Macron's idea of Western troops in Ukraine worthy of attention,https://www.pravda.com.ua/eng/news/2024/02/28/7444102/,0.95,341,0,341
23,worldnews,'Lebanon will be next': Iran greenlights Hezbollah attack on Israel - report,https://jpost.com/middle-east/article-789447,0.91,326,0,326
24,worldnews,Ukraine war: Ukraine reports jump in number of downed Russian planes,https://www.bbc.com/news/world-europe-68423990,0.94,268,0,268
25,worldnews,Indonesia proposes bill to force LGBTQ people into 'rehabilitation',https://www.aol.com/indonesia-proposes-bill-force-lgbtq-185554105.html,0.91,256,0,256
26,worldnews,"/r/WorldNews Live Thread: Russian Invasion of Ukraine Day 736, Part 1 (Thread #882)",https://www.reddit.com/live/18hnzysb1elcs,0.97,188,0,188
