,subreddit,title,url,upvote_ratio,ups,downs,score
0,worldnews,"Russian strikes hit Ukraine, most of Kyiv without water",https://apnews.com/article/russia-ukraine-kyiv-black-sea-europe-kharkiv-870091b0922a131aefb2692bb88f5c6d,0.94,33902,0,33902
1,worldnews,Pro-Bolsonaro truckers block several highways in Brazil to protest Lula’s victory,https://www.msn.com/en-ca/news/world/pro-bolsonaro-truckers-block-several-highways-in-brazil-to-protest-lula-s-victory/ar-AA13AiV4?li=AAggFp4,0.92,28566,0,28566
2,worldnews,Italian doctors and nurses who refused to get vaccinated against COVID-19 can now return to work,https://www.sbs.com.au/news/article/italian-doctors-and-nurses-who-refused-to-get-vaccinated-against-covid-19-can-now-return-to-work/db5ai9ame,0.9,13822,0,13822
3,worldnews,"Shanghai Disney shuts over Covid, visitors unable to leave",https://www.cnbc.com/2022/10/31/shanghai-disney-shuts-over-covid-visitors-unable-to-leave.html,0.97,12667,0,12667
4,worldnews,UN: No ships in Black Sea corridor on night Russia says it was attacked,https://www.jpost.com/breaking-news/article-721110,0.97,10998,0,10998
5,worldnews,Another Iranian teen girl beaten to death by police for tearing Khomeini's photo,https://m.jpost.com/middle-east/iran-news/article-721095/amp,0.98,8620,0,8620
6,worldnews,Moldova condemns Russian strikes after missile debris lands in its territory.,https://www.nytimes.com/2022/10/31/world/europe/moldova-russia-missile-debris-war.html,0.97,5799,0,5799
7,worldnews,"Nothing will change on climate until death toll rises in west, says Gabonese minister | Cop27",https://www.theguardian.com/environment/2022/oct/31/nothing-will-change-on-climate-until-death-toll-rises-in-west-says-gabonese-minister-aoe,0.95,5158,0,5158
8,worldnews,Russia says movement of ships in Black Sea corridor is 'unacceptable',https://www.reuters.com/world/europe/russia-says-movement-ships-black-sea-corridor-is-unacceptable-2022-10-31/,0.95,4560,0,4560
9,worldnews,Brazil's Bolsonaro maintains silence after Lula's election victory,https://www.reuters.com/world/americas/lula-wins-brazilian-election-bolsonaro-has-not-conceded-2022-10-31/,0.97,2938,0,2938
10,worldnews,US military now doing onsite weapons inspections in Ukraine,https://apnews.com/article/russia-ukraine-kyiv-europe-government-and-politics-weapons-inspections-4adab5d918690a569e396ce385c34348,0.97,2618,0,2618
11,worldnews,Trucker blockades in Brazil increase in wake of Bolsonaro election defeat,https://www.reuters.com/world/americas/brazils-famato-says-does-not-support-protestor-roadblocks-could-disrupt-2022-10-31/,0.94,2283,0,2283
12,worldnews,U.S. does not and will not recognize N. Korea as nuclear state: State Dept.,https://en.yna.co.kr/view/AEN20221101000200325,0.96,2110,0,2110
13,worldnews,Chinese Tech Giant Huawei is planning to Leave Russia,https://www.novinite.com/articles/217315/Chinese+Tech+Giant+Huawei+is+planning+to+Leave+Russia,0.97,1760,0,1760
14,worldnews,Putin: attacks on Ukraine infrastructure 'not all we could have done',https://www.reuters.com/world/europe/putin-attacks-ukraine-infrastructure-not-all-we-could-have-done-2022-10-31/,0.93,1352,0,1352
15,worldnews,"North Korea demands the U.S., South Korea halt joint military drills",https://www.reuters.com/world/north-korea-calls-united-states-south-korea-stop-joint-military-exercises-2022-10-31/,0.92,1335,0,1335
16,worldnews,Russia suspends 'partial mobilization' of citizens for Ukraine war,https://edition.cnn.com/2022/10/31/europe/russian-mobilization-suspended-intl/index.html,0.96,1330,0,1330
17,worldnews,"Iran plans public trials for 1,000 protesters in Tehran",https://apnews.com/article/a94127a0527cd7c25adcad1e879afb42,0.95,1155,0,1155
18,worldnews,"Ukraine Army Trolls Russia With Ouija Boards To 'Stay Connected' To 71,800 Dead Soldiers",https://www.ibtimes.com/ukraine-army-trolls-russia-ouija-boards-stay-connected-71800-dead-soldiers-3630407,0.95,928,0,928
19,worldnews,"Squatters take over Russian tycoon's home, set up camp",https://www.newsweek.com/squatters-take-over-russian-tycoon-home-set-camp-1755880,0.97,853,0,853
20,worldnews,Report suggests 20 per cent of Canadians skipping meals to cut down on food costs,https://www.ctvnews.ca/canada/survey-suggests-20-per-cent-of-canadians-skipping-meals-to-cut-down-on-food-costs-1.6131851,0.96,715,0,715
21,worldnews,Russian soldiers in Kharkiv region couldn’t immediately launch drones during Ukrainian counter-offensive because of a software installation,https://www.businessinsider.com/russian-soldiers-in-kharkiv-couldnt-launch-drones-because-software-reuters-2022-10?international=true&amp;r=US&amp;IR=T,0.95,470,0,470
22,worldnews,Canada among 50 countries urging China to release detained Uyghurs - National | Globalnews.ca,https://globalnews.ca/news/9240695/canada-50-countries-china-release-uyghurs/,0.95,465,0,465
23,worldnews,Kyiv Mayor Vitali Klitschko: 'Please stay with Ukraine',https://www.dw.com/en/please-stay-with-ukraine-says-kyiv-mayor-vitali-klitschko/a-63609789,0.97,382,0,382
24,worldnews,Russian soldier wrote journal entry imagining being on vacation with family in summer of 2023 because Russia's occupation of Kharkiv was going so poorly,https://www.businessinsider.com/russian-soldier-wrote-diary-entry-imaginary-vacation-during-kharkiv-defeat-2022-10,0.93,347,0,347
25,worldnews,"/r/WorldNews Live Thread: Russian Invasion of Ukraine Day 251, Part 1 (Thread #392)",https://www.reddit.com/live/18hnzysb1elcs,0.97,300,0,300
26,worldnews,Putin Says 'Necessary Conditions' May Arise for Ukraine Negotiation,https://www.newsweek.com/putin-says-necessary-conditions-may-arise-ukraine-negotiation-1755911,0.92,241,0,241
