,subreddit,title,url,upvote_ratio,ups,downs,score
0,worldnews,Trump strongly opposes US missile strikes deep into Russia,https://www.pravda.com.ua/eng/news/2024/12/12/7488837/,0.88,17622,0,17622
1,worldnews,Ukraine targets North Korean troops with psychological warfare,https://www.newsweek.com/ukraine-news-targets-north-korean-troops-psychological-warfare-russia-better-life-1999578,0.95,13728,0,13728
2,worldnews,Russian missile designer eliminated by Ukrainian Intelligence,https://newsukraine.rbc.ua/news/russian-official-responsible-for-missile-1734001513.html,0.96,11499,0,11499
3,worldnews,Ontario premier says US energy exports will be cut off if Trump imposes sweeping tariffs on Canada,https://apnews.com/article/canada-interest-rate-cut-trump-tariffs-c0ef920ffb02ea0531c93516abad64e0,0.96,10870,0,10870
4,worldnews,Spain sceptical about Trump's intention to ''end war in Ukraine in 24 hours'',https://www.pravda.com.ua/eng/news/2024/12/12/7488780/,0.94,8999,0,8999
5,worldnews,"NATO must shift to wartime mindset, secretary general warns | World News | Sky News",https://news.sky.com/story/nato-must-shift-to-wartime-mindset-secretary-general-warns-13272162,0.96,5760,0,5760
6,worldnews,Vladimir Putin abandons Arctic gas production as sanctions bite,https://www.telegraph.co.uk/business/2024/12/12/putin-abandons-arctic-gas-production-as-sanctions-bite/,0.98,4312,0,4312
7,worldnews,‘Unprecedented risk’ to life on Earth: Scientists call for halt on ‘mirror life’ microbe research | Science,https://www.theguardian.com/science/2024/dec/12/unprecedented-risk-to-life-on-earth-scientists-call-for-halt-on-mirror-life-microbe-research,0.96,4262,0,4262
8,worldnews,"Romania, Bulgaria become full members of Schengen zone",https://www.dw.com/en/romania-bulgaria-become-full-members-of-schengen-zone/a-71031199,0.98,4053,0,4053
9,worldnews,"'Every tool in our toolbox': Canada preparing retaliatory tariffs, threatening to cut off energy to U.S.",https://nationalpost.com/news/canada/canada-us-trump-tariffs,0.96,2840,0,2840
10,worldnews,Satellite images reveal Russia has abandoned Syrian naval base,https://www.telegraph.co.uk/world-news/2024/12/12/syria-rebels-assad-russia-tartus-warships-planes-medvedev/,0.97,2150,0,2150
11,worldnews,Majority of Brexit voters ‘would accept free movement’ to access single market,https://www.theguardian.com/politics/2024/dec/12/majority-of-brexit-voters-would-accept-free-movement-to-access-single-market-uk-eu,0.93,2148,0,2148
12,worldnews,Russia has built only 7 out of 108 planned airliners since 2022,https://kyivindependent.com/russia-airliners-bbc/,0.98,1985,0,1985
13,worldnews,Ukraine’s Path Into NATO ‘Irreversible’: European Foreign Ministers,https://www.kyivpost.com/post/43775,0.97,1731,0,1731
14,worldnews,Children as young as 10 will face adult jail time in Australian state,https://www.bbc.com/news/articles/clyj6dd1zdro,0.93,1699,0,1699
15,worldnews,'We hope that at least he won't call Assad' — Zelensky slams Orban for phone call with Putin,https://kyivindependent.com/we-hope-orban-wont-at-least-call-al-assad-zelensky-on-orban-calling-putin-to-discuss-ukraine/,0.97,1227,0,1227
16,worldnews,IDF sees chance for strikes on Iran nuke sites after knocking out Syria air defenses,https://www.timesofisrael.com/iaf-says-preparing-for-strikes-on-iran-nuke-sites-after-knocking-out-syrias-air-defenses/,0.92,1176,0,1176
17,worldnews,NATO chief warns of Putin's long-term attack plan for Europe - a lot more than 2% military spending necessary.,https://apnews.com/article/nato-russia-ukraine-defense-spending-industry-8a84361c3827081da3f1308851cb19dd,0.97,1129,0,1129
18,worldnews,Israel urges action to protect Syria’s Kurds,https://www.voanews.com/a/israel-urges-action-to-protect-syria-s-kurds-/7897681.html,0.91,741,0,741
19,worldnews,Syria rebel leader vows to shut down notorious Assad prisons,https://www.bbc.com/news/articles/c047579lzklo.amp,0.97,570,0,570
20,worldnews,US announces new arms aid package for Ukraine worth $500 million,https://www.reuters.com/world/white-house-announces-new-arms-aid-package-ukraine-2024-12-12/,0.92,500,0,500
21,worldnews,"The ‘Blob,’ an unprecedented marine heat wave, killed 4 million seabirds",https://www.science.org/content/article/blob-heat-wave-killed-millions-seabirds-and-they-haven-t-bounced-back,0.95,433,0,433
22,worldnews,Fukuoka becomes 3rd high court in Japan to rule same-sex marriage ban unconstitutional,https://mainichi.jp/english/articles/20241213/p2g/00m/0na/029000c,0.96,379,0,379
23,worldnews,Lithuania to help Ukraine train military instructors next year,https://newsukraine.rbc.ua/news/lithuania-to-help-ukraine-train-military-1734045636.html,0.95,267,0,267
24,worldnews,Wikipedia suspends pro-Palestine editors coordinating efforts behind the scenes,https://www.jpost.com/business-and-innovation/article-833180,0.91,130,0,130
25,worldnews,"/r/WorldNews Live Thread: Russian Invasion of Ukraine Day 1023, Part 1 (Thread #1170)",https://www.reddit.com/live/18hnzysb1elcs,0.95,123,0,123
26,worldnews,/r/WorldNews Live Thread: Israel at War (Thread #80),https://www.reddit.com/live/1bsso361afr0r,0.78,118,0,118
