,subreddit,title,url,upvote_ratio,ups,downs,score
0,worldnews,Russian agents killed 3 men they said were saboteurs sent by Ukraine. A report says they were just gamers in costume.,https://www.businessinsider.com/men-russia-fsb-killed-ukraine-agents-were-just-gamers-report-2022-11?r=US&amp;IR=T,0.93,35099,0,35099
1,worldnews,NATO vows to aid Ukraine 'for as long as it takes',https://apnews.com/article/russia-ukraine-nato-europe-romania-jens-stoltenberg-2c7bdd0c43589c8d9453e0efc327b368,0.95,16197,0,16197
2,worldnews,German lawmakers want to declare 1930s Ukraine famine a genocide,https://uk.news.yahoo.com/german-foreign-minister-welcomes-efforts-114959221.html,0.94,7573,0,7573
3,worldnews,India’s Supreme Court considers legalization of same-sex marriage nationwide,https://www.msn.com/en-in/news/newsindia/indias-supreme-court-considers-legalization-of-same-sex-marriage-nationwide/ar-AA14xM4Q,0.96,6322,0,6322
4,worldnews,"The U.S. is banning the sale of communications equipment made by Chinese companies Huawei and ZTE and restricting the use of some China-made video surveillance systems, citing an “unacceptable risk” to national security",https://www.asahi.com/ajw/articles/14777817,0.97,5780,0,5780
5,worldnews,Zelenskyy urges West to limit price of Russian oil at US $30 per barrel,https://www.pravda.com.ua/eng/news/2022/11/25/7377954/,0.95,4248,0,4248
6,worldnews,Canada's Trudeau defends use of emergency powers in 'Freedom Convoy' protests,https://www.reuters.com/world/americas/trudeau-tells-hearing-police-failed-keep-freedom-convoy-protests-check-2022-11-25/,0.91,3634,0,3634
7,worldnews,Russian soldiers told to fight in Ukraine or ‘they might disappear',https://www.msn.com/en-gb/health/health-news/russian-soldiers-told-to-fight-in-ukraine-or-they-might-disappear/ar-AA14yFrk?li=AAnZ9Ug,0.96,2467,0,2467
8,worldnews,Dutch Parliament declares Russia state sponsor of terrorism,https://english.nv.ua/nation/dutch-parliament-declares-russia-state-sponsor-of-terrorism-50286671.html,0.97,2383,0,2383
9,worldnews,UK bans Chinese cameras from government buildings,https://www.politico.eu/article/uk-bans-chinese-cameras-from-government-buildings/,0.97,2369,0,2369
10,worldnews,"In Britain, nearly 200,000 workers are striking on Black Friday | CNN Business",https://www.cnn.com/2022/11/25/business/black-friday-strikes-britain/index.html?utm_content=2022-11-25T14%3A21%3A19&amp;utm_term=link&amp;utm_source=twCNN&amp;utm_medium=social,0.95,1661,0,1661
11,worldnews,"Universal flu vaccine may be available within two years, says scientist",https://www.theguardian.com/society/2022/nov/25/universal-flu-vaccine-may-be-available-within-two-years-says-scientist,0.95,1564,0,1564
12,worldnews,'Freedom Convoy 2.0' being planned for February 2023,https://ottawa.ctvnews.ca/mobile/freedom-convoy-2-0-being-planned-for-february-2023-1.6167154,0.87,1184,0,1184
13,worldnews,Angela Merkel says she lost influence over Putin as a lame duck leader | Angela Merkel,https://www.theguardian.com/world/2022/nov/25/angela-merkel-says-she-lost-influence-over-putin-as-a-lame-duck-leader,0.91,984,0,984
14,worldnews,U.S. prepared to authorize Chevron to boost Venezuela's oil output,https://www.reuters.com/business/energy/us-prepared-authorize-chevron-boost-venezuelas-oil-output-2022-11-23/,0.94,956,0,956
15,worldnews,Spain's new high-speed trains make it Europe's rail capital,https://www.cnn.com/travel/article/iryo-high-speed-train-spain/index.html,0.95,735,0,735
16,worldnews,"EU, South Korea Working to Supply Ukraine With Power",https://www.newsweek.com/eu-south-korea-working-supply-ukraine-power-1762439,0.94,676,0,676
17,worldnews,The Tokyo Metropolitan Government Labor Relations Commission ruled on Nov. 25 that Uber Eats delivery workers have the right to form a labor union and seek collective bargaining,https://www.asahi.com/ajw/articles/14777363,0.95,550,0,550
18,worldnews,"Vladimir Putin's Ally Subject Of Multi-Million Raid, Accused Of Supplying Illegal Aircrafts To Russian Military",https://www.msn.com/en-us/news/world/vladimir-putins-ally-subject-of-multi-million-raid-accused-of-supplying-illegal-aircrafts-to-russian-military/ar-AA14yuIH?li=BBnb7Kz,0.96,533,0,533
19,worldnews,China's widening COVID curbs trigger public pushback,https://www.reuters.com/world/china/china-reports-32943-new-covid-cases-nov-24-vs-31656-day-earlier-2022-11-25/,0.91,436,0,436
20,worldnews,"China's Xi, in message to North Korea's Kim, says willing to work together for regional, global stability -KCNA",https://www.reuters.com/world/asia-pacific/chinas-xi-message-north-koreas-kim-says-willing-work-together-regional-global-2022-11-25/,0.88,376,0,376
21,worldnews,Dozens of casualties as Iran forces fire on protesters,https://www.i24news.tv/en/news/middle-east/iran-eastern-states/1669389859-dozens-of-casualties-as-iran-forces-fire-on-protesters,0.95,354,0,354
22,worldnews,Two missiles fired at US coalition forces in Syria,https://www.jpost.com/breaking-news/article-723390,0.93,344,0,344
23,worldnews,"/r/WorldNews Live Thread: Russian Invasion of Ukraine Day 276, Part 1 (Thread #417)",https://www.reddit.com/live/18hnzysb1elcs,0.96,215,0,215
24,worldnews,Drugs: India police say rats ate 200kg of seized cannabis,https://www.bbc.co.uk/news/world-asia-india-63739836,0.81,187,0,187
25,worldnews,India must be cautious in dealing with US: Ex-Army chief Bikram Singh | India News - Times of India,https://m.timesofindia.com/india/india-must-be-cautious-in-dealing-with-us-ex-army-chief-bikram-singh/amp_articleshow/95748198.cms,0.8,152,0,152
