,subreddit,title,url,upvote_ratio,ups,downs,score
0,worldnews,European Commission to open investigation into Elon Musk’s X,https://www.euronews.com/next/2026/01/26/european-commission-to-open-investigation-into-elon-musks-x,0.97,31489,0,31489
1,worldnews,Volkswagen considers pulling out of US factory plans over tariffs,https://www.semafor.com/article/01/26/2026/volkswagen-considers-pulling-out-of-us-factory-plans-over-tariffs,0.98,21686,0,21686
2,worldnews,Venezuela’s acting president says she has had “enough” of US orders | CNN,https://edition.cnn.com/2026/01/26/americas/venezuela-delcy-rodriguez-enough-us-orders-trump-oil-hnk-intl,0.96,18498,0,18498
3,worldnews,Trump says US used secret weapon to disable Venezuelan equipment in Maduro raid,https://apnews.com/article/trump-venezuela-weapon-maduro-drug-strikes-c052fd24a350a04a458f501b4b536e62,0.94,16563,0,16563
4,worldnews,Israel recovers body of last hostage in Gaza,https://www.cnn.com/2026/01/26/middleeast/last-hostage-gaza-recovered-israel-intl?utm_medium=social&amp;utm_campaign=missions&amp;utm_source=reddit,0.84,9972,0,9972
5,worldnews,"US officially out of WHO, leaving hundreds of millions of dollars unpaid",https://arstechnica.com/health/2026/01/us-stiffs-who-hundreds-of-millions-as-it-officially-withdrawals/,0.97,8847,0,8847
6,worldnews,"UK loses measles elimination status, WHO confirms",https://www.manchestereveningnews.co.uk/news/uk-news/uk-loses-measles-elimination-status-33305345,0.98,4878,0,4878
7,worldnews,"After years of Russian denials, court accidentally admits Black Sea battleship was sunk by Ukraine | CNN",https://edition.cnn.com/2026/01/26/europe/russia-moskva-admits-backtracks-ukraine-intl,0.98,3581,0,3581
8,worldnews,German defence minister urges Trump to apologise for Afghanistan remarks,https://www.reuters.com/business/aerospace-defense/german-defence-minister-urges-trump-apologise-afghanistan-remarks-2026-01-26/,0.98,2834,0,2834
9,worldnews,"NORAD pact would change if Canada pulls back from F-35 order, warns U.S. ambassador",https://www.cbc.ca/news/politics/norad-canada-us-f35-9.7059800,0.94,2212,0,2212
10,worldnews,France tightens net on Russian ‘ghost fleet’ with second tanker intercepted,https://www.rfi.fr/en/france/20260125-france-tightens-net-on-russian-ghost-fleet-with-second-tanker-intercepted,0.99,2104,0,2104
11,worldnews,France honors fallen soldiers in Afghanistan after Trump's false claim about NATO troops,https://apnews.com/article/eu-trump-france-soldiers-nato-afghanistan-e7392e6caa2ad2939a410bedefe9d342,0.98,1903,0,1903
12,worldnews,Trump raises US tariffs on South Korea imports to 25%,https://www.bbc.com/news/articles/cwyw3ynwe37o,0.96,1903,0,1903
13,worldnews,"NATO-chief Rutte: ""Keep on dreaming"" if you think Europe could defend itself without US",https://www.rfi.fr/en/international-news/20260126-keep-dreaming-nato-chief-says-europe-can-t-defend-itself-without-us,0.83,1742,0,1742
14,worldnews,Czechs fundraise over $6 million to buy generators for freezing Ukraine,https://www.reuters.com/world/czechs-fundraise-over-6-mln-buy-generators-freezing-ukraine-2026-01-26/,0.99,1323,0,1323
15,worldnews,"Government sources: Italian Carabinieri in the West Bank forced to kneel, threatened with a machine gun, and interrogated",https://www.agenzianova.com/en/news/Government-sources%3A-Italian-Carabinieri-in-the-West-Bank-were-forced-to-kneel--threatened-with-a-machine-gun--and-interrogated./,0.88,839,0,839
16,worldnews,"Trump says tariffs on South Korean autos, pharma, to rise to 25% over trade deal approval delay",https://www.cnbc.com/amp/2026/01/26/trump-south-korea-tariffs-trade-autos-pharma.html,0.95,713,0,713
17,worldnews,"Activists say at least 6,126 people killed in Iran’s crackdown on nationwide protests",https://apnews.com/article/iran-protests-deaths-crackdown-aeaeb26493d25d86d5169f8ae455e405,0.95,550,0,550
18,worldnews,Iranian government braces for possible attack as US navy arrives in region,https://www.theguardian.com/world/2026/jan/26/iran-prepares-possible-attack-us-navy,0.96,490,0,490
19,worldnews,"Heatwave to send temps to 50C (122F) as bushfires rage in Victoria, Australia",https://www.news.com.au/technology/environment/heatwave-to-send-temps-to-50c-as-bushfires-rage-in-victoria/news-story/32b0a98933f7d248c4001cef03fd7c0e,0.96,366,0,366
20,worldnews,France's National Assembly approves banning under-15s from social media,https://www.ksl.com/article/51438551/frances-national-assembly-approves-banning-under-15s-from-social-media,0.98,284,0,284
21,worldnews,"Liberals say more than 22,000 government-banned guns declared in first week of 'buyback' launch",https://nationalpost.com/news/canada/liberals-say-more-than-22000-government-banned-guns-declared-in-first-week-of-buyback-launch,0.75,253,0,253
22,worldnews,"Japan-US alliance would crumble if Tokyo ignored Taiwan crisis, PM Takaichi says",https://www.reuters.com/world/china/japan-us-alliance-would-crumble-if-tokyo-ignored-taiwan-crisis-pm-takaichi-says-2026-01-27/,0.91,177,0,177
23,worldnews,South Korea says it hasn't received any official notification or explanation from Washington about Trump's tariff hike scheme,https://www.koreatimes.co.kr/foreignaffairs/20260127/korea-not-officially-notified-of-trumps-tariff-hike-scheme-cheong-wa-dae,0.98,147,0,147
24,worldnews,"/r/WorldNews Live Thread: Russian Invasion of Ukraine Day 1433, Part 1 (Thread #1580)",https://www.reddit.com/live/18hnzysb1elcs,0.96,95,0,95
