,subreddit,title,url,upvote_ratio,ups,downs,score
0,worldnews,Ukraine and 30 countries request emergency UN security council meeting following Russian assault,https://euromaidanpress.com/2023/12/29/ukraine-and-30-countries-request-emergency-un-security-council-meeting-following-russian-assault/,0.94,9252,0,9252
1,worldnews,Russia unleashes biggest air attack on Ukraine since start of full-scale invasion,https://www.cnn.com/2023/12/29/europe/ukraine-russia-airstrikes-intl-hnk/index.html,0.94,7045,0,7045
2,worldnews,Russia has deployed battalion of Ukrainian prisoners of war to frontlines,https://www.ukrinform.net/rubric-ato/3806689-russia-has-deployed-battalion-of-ukrainian-prisoners-of-war-to-frontline-isw.html,0.95,6611,0,6611
3,worldnews,"Brexit has completely failed for UK, say clear majority of Britons – poll",https://www.theguardian.com/politics/2023/dec/30/britons-brexit-bad-uk-poll-eu-finances-nhs,0.93,6315,0,6315
4,worldnews,"Strike on Belgorod that killed more than a dozen 'will not go unpunished', Russia says",https://www.france24.com/en/europe/20231230-strike-on-belgorod-that-killed-more-than-a-dozen-will-not-go-unpunished-russia-says,0.92,5505,0,5505
5,worldnews,Don't let Ukraine be destroyed: Biden hurries Congress on aid after furious Russian attack,https://www.pravda.com.ua/eng/news/2023/12/29/7435149/,0.95,5501,0,5501
6,worldnews,At least 14 dead and 100 injured in missile strike on Russian city of Belgorod,https://novayagazeta.eu/articles/2023/12/30/at-least-14-dead-and-45-injured-in-strike-on-russian-city-of-belgorod-en-news,0.95,2905,0,2905
7,worldnews,Zelensky: Russia will bear a fair responsibility for every strike against Ukraine,https://www.ukrinform.net/rubric-ato/3807100-zelensky-terrorist-state-will-answer-for-every-strike-against-ukraine.html,0.96,2373,0,2373
8,worldnews,"Russia is working to subvert French support for Ukraine, documents show",https://www.washingtonpost.com/world/2023/12/30/france-russia-interference-far-right/,0.95,2148,0,2148
9,worldnews,UN Rights Chief Urges Russia to Halt Ukraine Attacks,https://www.kyivpost.com/post/26113,0.95,1351,0,1351
10,worldnews,IDF launches massive assault on Hezbollah positions amid fire on North,https://m.jpost.com/breaking-news/article-780020,0.9,1326,0,1326
11,worldnews,Israel's Prime Minister Benjamin Netanyahu says military seeks full control of Gaza-Egypt border,https://www.abc.net.au/news/2023-12-31/gaza-israel-egypt-border-control/103275364?utm_source=abc_news_app&amp;utm_medium=content_shared&amp;utm_campaign=abc_news_app&amp;utm_content=other,0.91,1082,0,1082
12,worldnews,Anger in Poland after state TV execs’ salaries under previous government made public,https://notesfrompoland.com/2023/12/29/anger-in-poland-after-state-tv-execs-salaries-under-previous-government-made-public/,0.96,1001,0,1001
13,worldnews,Germany mulls reintroduction of compulsory military service,https://www.dw.com/en/germany-mulls-reintroduction-of-compulsory-military-service/a-67853437,0.96,966,0,966
14,worldnews,Kazakhstan removes Taliban from list of banned organizations,https://eurasianet.org/kazakhstan-removes-taliban-from-list-of-banned-organizations,0.93,918,0,918
15,worldnews,Russia requests UN Security Council meeting after deadly strikes,https://www.jpost.com/breaking-news/article-780129,0.87,832,0,832
16,worldnews,Maersk Ship Hit by Missile in the Red Sea,https://gcaptain.com/maersk-ship-hit-by-missile-in-the-red-sea/,0.98,827,0,827
17,worldnews,"No Sign Houthis Will Halt Red Sea Attacks, Says US",https://www.voanews.com/a/no-sign-houthis-will-halt-red-sea-attacks-says-us/7418725.html,0.96,727,0,727
18,worldnews,/r/WorldNews Live Thread for 2023 Israel-Hamas Crisis (Thread 44),https://www.reddit.com/live/1bsso361afr0r,0.86,549,0,549
19,worldnews,Supreme Court of British Columbia blocks new laws against public use of illegal drugs.,https://www.seattletimes.com/nation-world/court-in-canadian-province-blocks-new-laws-against-public-use-of-illegal-substances/,0.93,497,0,497
20,worldnews,Russia starts building naval base in occupied Abkhazia,https://www.pravda.com.ua/eng/news/2023/12/30/7435232/,0.94,476,0,476
21,worldnews,Thousands protest in Belgrade in biggest rally yet against alleged electoral fraud,https://www.france24.com/en/europe/20231230-thousands-protest-in-belgrade-in-biggest-rally-yet-against-alleged-electoral-fraud,0.96,431,0,431
22,worldnews,"Taiwan's sovereignty belongs to its people, presidential frontrunner says",https://www.reuters.com/world/asia-pacific/taiwans-sovereignty-belongs-its-people-presidential-frontrunner-says-2023-12-30/,0.94,356,0,356
23,worldnews,Swedish Scientists show that Electronic “soil” enhances crop growth,https://liu.se/en/news-item/elektronisk-jord-okar-tillvaxten-hos-grodor,0.92,213,0,213
24,worldnews,North Korea dismisses any reconciliation with the South,https://www.lemonde.fr/en/asia-and-pacific/article/2023/12/31/north-korea-dismisses-any-reconciliation-with-the-south_6389656_153.html,0.89,183,0,183
25,worldnews,"/r/WorldNews Live Thread: Russian Invasion of Ukraine Day 676, Part 1 (Thread #822)",https://www.reddit.com/live/18hnzysb1elcs,0.95,170,0,170
26,worldnews,Germany to continue supporting Ukraine – Federal Foreign Office,https://www.kyivpost.com/post/26133,0.92,64,0,64
