,subreddit,title,url,upvote_ratio,ups,downs,score
0,worldnews,Iran closes airspace with anticipated US attack 'imminent',https://www.jpost.com/middle-east/iran-news/article-883422,0.96,32373,0,32373
1,worldnews,Trump says anything less than having Greenland in the United States’ hands is ‘unacceptable’,https://apnews.com/article/greenland-united-states-denmark-trump-vance-rubio-meeting-cc278af4f3daf725029101966ba03568?utm_source=onesignal&amp;utm_medium=push&amp;utm_campaign=2026-01-14-Breaking+News,0.93,27485,0,27485
2,worldnews,"US military intervention in Iran may begin within 24 hours, European officials say",https://www.jpost.com/middle-east/article-883358,0.95,24668,0,24668
3,worldnews,Greenland: Macron warns of 'cascading consequences' if US seizes island,https://www.lemonde.fr/en/international/article/2026/01/14/greenland-macron-warns-of-cascading-consequences-if-us-seizes-the-island_6749419_4.html,0.96,24213,0,24213
4,worldnews,"Trump intent on conquering Greenland, Danish minister says as talks with US end",https://www.theguardian.com/world/2026/jan/14/greenland-us-trump-talks-denmark,0.96,22533,0,22533
5,worldnews,Germany joins European partners with troop deployment to Greenland,https://www.reuters.com/world/europe/germany-send-reconnaissance-troops-greenland-government-says-2026-01-14/,0.98,14578,0,14578
6,worldnews,Greenland and Denmark say Trump set on ‘conquering’ territory after meeting | Donald Trump News,https://www.aljazeera.com/news/2026/1/14/greenland-and-denmark-say-trump-set-on-conquering-territory-after-meeting?traffic_source=rss,0.97,11122,0,11122
7,worldnews,"Denmark to deploy more troops to Greenland, DR reports",https://cphpost.dk/2026-01-14/news/round-up/denmark-to-deploy-more-troops-to-greenland-dr-reports/,0.98,8856,0,8856
8,worldnews,Denmark says it has ‘fundamental differences’ with US over Greenland,https://tvpworld.com/91049717/denmark-we-have-fundamental-differences-with-us-over-greenland,0.98,7337,0,7337
9,worldnews,Denmark Beefs Up Military in Greenland As Trump Doubles Down,https://time.com/7346397/denmark-greenland-military-presence-nato-trump/?utm_source=reddit&amp;utm_medium=social&amp;utm_campaign=editorial,0.98,6036,0,6036
10,worldnews,France to open consulate in Greenland in February amid Trump threats,https://www.politico.eu/article/france-announces-opening-consulate-greenland-amid-donald-trump-threats/,0.99,5971,0,5971
11,worldnews,Denmark sends 'advance force' to Greenland to pave way for larger military presence amid US threats | LBC,https://www.lbc.co.uk/article/greenland-trump-invasion-denmark-military-5HjdQjb_2/,0.98,5174,0,5174
12,worldnews,"Tehran leaders wiring huge sums of money out of Iran, US Treasury says",https://www.iranintl.com/en/202601156396,0.98,2339,0,2339
13,worldnews,Trump claims killing of Iran protesters 'has stopped' even as Tehran signals executions ahead,https://apnews.com/article/trump-iran-protesters-executions-195edfa07111be782db71af07b538fdc,0.96,2335,0,2335
14,worldnews,Greenlands says it has a “fundamental disagreement” with USA after talks.,https://www.cbc.ca/news/world/white-house-meeting-denmark-greenland-9.7044695,0.97,2077,0,2077
15,worldnews,France to open consulate in Greenland in a ‘political signal’ amid Trump threats,https://www.france24.com/en/europe/20260114-france-to-open-consulate-in-greenland-in-a-political-signal-amid-trump-threats,0.97,1624,0,1624
16,worldnews,"Ties between US and Europe 'disintegrating,' Germany's Vice Chancellor Klingbeil warns",https://www.euronews.com/2026/01/14/ties-between-us-and-europe-disintegrating-germanys-vice-chancellor-klingbeil-warns,0.97,1550,0,1550
17,worldnews,Defence secretary rejects Trump's suggestion Nato should help US take Greenland | ITV News,https://www.itv.com/news/2026-01-14/defence-secretary-rejects-trumps-suggestion-nato-should-help-us-take-greenland,0.97,1348,0,1348
18,worldnews,Trump ‘ready to push the button’ on airstrikes in Iran as US personnel evacuate military base,https://uk.news.yahoo.com/trump-ready-push-button-airstrikes-182140698.html,0.95,942,0,942
19,worldnews,"UK shuts Tehran embassy, pulls staff citing worsening security situation",https://www.indiatoday.in/amp/world/story/iran-protests-uk-shuts-tehran-embassy-pulls-staff-citing-worsening-security-situation-2852145-2026-01-15,0.97,844,0,844
20,worldnews,US to suspend visa processing for 75 countries starting next week,https://abcnews.go.com/US/us-suspend-visa-processing-75-countries-starting-week/story?id=129210370,0.96,808,0,808
21,worldnews,Ukraine's new defense minister reveals scale of desertions as millions avoid the draft,https://apnews.com/article/russia-ukraine-war-troops-desertions-draft-dodging-32c3cfa8c1dbdee50a193149376ee64e,0.91,409,0,409
22,worldnews,Zelensky declares state of emergency in Ukraine's energy sector,https://www.bbc.com/news/articles/cq6vm677z76o,0.98,236,0,236
23,worldnews,‘Are they going to bring their violence here?’: Fear – but little preparation – as threat of invasion looms over Greenland | Greenland,https://www.theguardian.com/world/2026/jan/14/us-invasion-threat-greenland-trump-denmark,0.94,211,0,211
24,worldnews,"/r/WorldNews Live Thread: Russian Invasion of Ukraine Day 1421, Part 1 (Thread #1568)",https://www.reddit.com/live/18hnzysb1elcs,0.95,128,0,128
