,subreddit,title,url,upvote_ratio,ups,downs,score
0,worldnews,Iran warns Zelensky to stop saying it gives Russia drones: 'Patience not endless',https://www.timesofisrael.com/iran-warns-zelensky-to-stop-saying-it-gives-russia-drones-patience-not-endless/,0.91,42302,0,42302
1,worldnews,"Huge 2,000-year-old Mayan civilization discovered in northern Guatemala",https://phys.org/news/2022-12-huge-year-old-mayan-civilization-northern.html,0.98,13799,0,13799
2,worldnews,"Russian politician files legal challenge over Putin's reference to Ukraine ""war""",https://www.reuters.com/world/europe/russian-politician-files-legal-challenge-over-putins-reference-ukraine-war-2022-12-23/,0.97,13387,0,13387
3,worldnews,Russian diplomat says NATO instructors must leave Ukraine before talks can start,https://www.reuters.com/world/europe/russian-diplomat-says-nato-instructors-must-leave-ukraine-before-talks-can-start-2022-12-23/,0.94,8994,0,8994
4,worldnews,Zelenskyy: Trip to US Delivered ‘Good Results’,https://www.voanews.com/a/zelenskyy-trip-to-us-delivered-good-results-/6888511.html,0.96,5162,0,5162
5,worldnews,Kremlin believes that Russia “substantially demilitarised” Ukraine,https://www.pravda.com.ua/eng/news/2022/12/23/7382050/,0.93,4545,0,4545
6,worldnews,"Paris shooting: Three dead and several injured in attack targeting migrant center, Kurdish neighborhood",https://www.bbc.com/news/world-europe-64077668,0.96,4339,0,4339
7,worldnews,China’s foreign minister warns US not to cross its ‘red line’,https://www.aljazeera.com/news/2022/12/23/us-must-stop-unilateral-bullying-chinas-foreign-minister-says,0.92,4202,0,4202
8,worldnews,Turkey says Sweden 'not even halfway' to NATO candidacy,https://www.dw.com/en/turkey-says-sweden-not-even-halfway-to-nato-candidacy/a-64189424,0.93,3115,0,3115
9,worldnews,France fines Microsoft €60 million for imposing ad cookies on users,https://www.france24.com/en/technology/20221222-france-fines-microsoft-60-million-euros-over-imposing-ad-cookies-on-users,0.98,2896,0,2896
10,worldnews,QAnon members in Japan sentenced for breaking into Covid vaccination centers,https://www.cnn.com/2022/12/23/asia/japan-qanon-yamatoq-sentenced-intl-hnk,0.97,2606,0,2606
11,worldnews,"The UK is sending Ukraine a newer, longer-range missile that lets humans guide it all the way to the target",https://www.msn.com/en-us/news/world/the-uk-is-sending-ukraine-a-newer-longer-range-missile-that-lets-humans-guide-it-all-the-way-to-the-target/ar-AA15BkMh,0.97,2540,0,2540
12,worldnews,North Korea fires missile amid tension over Russia arms aid,https://www.reuters.com/world/asia-pacific/north-korea-fires-ballistic-missile-towards-sea-off-east-coast-yonhap-2022-12-23/,0.95,2437,0,2437
13,worldnews,Russia is jamming more GPS satellite signals around Moscow,https://www.newscientist.com/article/2353060-russia-is-jamming-more-gps-satellite-signals-around-moscow/,0.96,2120,0,2120
14,worldnews,World's Largest Outbreak: China Surge Infecting 37 Million People A Day,https://www.ndtv.com/world-news/worlds-largest-outbreak-china-surge-infecting-37-million-people-a-day-3632837,0.94,1896,0,1896
15,worldnews,‘Develop Batteries for Electric Vehicles Here’: Zimbabwe Bans Export of Raw Lithium,https://www.news18.com/news/world/develop-batteries-for-electric-vehicles-here-zimbabwe-bans-export-of-raw-lithium-6679645.html,0.97,1171,0,1171
16,worldnews,Chinese ambassador says Ukraine crisis has hurt relations with EU -report,https://www.reuters.com/world/chinese-ambassador-says-ukraine-crisis-has-hurt-relations-with-eu-report-2022-12-23/,0.93,1078,0,1078
17,worldnews,Germany formally suspends guarantees for business with Iran,https://apnews.com/a256fbffd152f407d2affd1d09377058,0.97,1065,0,1065
18,worldnews,"Apple's Australian workers go on Christmas strike demanding better wages, work terms",https://www.reuters.com/technology/apples-australian-workers-go-christmas-strike-demanding-better-wages-work-terms-2022-12-23/,0.95,770,0,770
19,worldnews,Germany suspends measures to promote business with Iran,https://www.reuters.com/world/germany-suspends-measures-promote-business-with-iran-2022-12-23/,0.94,412,0,412
20,worldnews,The medical institutions in the occupied territories are overfilled with wounded Russians – Deputy Defense Minister of Ukraine,https://www.pravda.com.ua/eng/news/2022/12/23/7382160/,0.96,268,0,268
21,worldnews,Russian and Chinese Armada Sails East China Sea Near Japan,https://www.coffeeordie.com/east-china-sea-armada,0.91,258,0,258
22,worldnews,"Mariupol theatre demolished 'to hide Russian crimes', aide says",https://www.bbc.com/news/world-europe-64075088,0.93,254,0,254
23,worldnews,"/r/WorldNews Live Thread: Russian Invasion of Ukraine Day 304, Part 1 (Thread #445)",https://www.reddit.com/live/18hnzysb1elcs,0.95,236,0,236
24,worldnews,Canada's Hudson Bay Polar Bear Population Plummets,https://www.voanews.com/a/6889916.html,0.93,234,0,234
25,worldnews,China's ByteDance admits to using TikTok data to track journalists,https://hongkongfp.com/2022/12/23/chinas-bytedance-admits-to-using-tiktok-data-to-track-journalists/,0.93,168,0,168
26,worldnews,Taliban minister defends closing universities to women as global backlash grows,https://www.theguardian.com/world/2022/dec/23/taliban-minister-defends-closing-universities-to-women-as-global-backlash-grows,0.95,146,0,146
