,subreddit,title,url,upvote_ratio,ups,downs,score
0,worldnews,"Residents near Gaza border beg for help: 'They are slaughtering us here, there is no army and no nothing'",https://www.ynetnews.com/article/rkagm000gp,0.87,28805,0,28805
1,worldnews,Israel will cut off its supply of electricity to Gaza: Energy minister,https://english.alarabiya.net/News/middle-east/2023/10/07/Israel-will-cut-off-its-supply-of-electricity-to-Gaza-Energy-minister,0.92,20077,0,20077
2,worldnews,"‘We are at war,’ Netanyahu says, after Hamas launches devastating surprise attack",https://www.timesofisrael.com/we-are-at-war-netanyahu-says-after-hamas-launches-devastating-surprise-attack/,0.91,14414,0,14414
3,worldnews,Pentagon says it will support Israel after Netanyahu declares war,https://thehill.com/policy/defense/4243366-pentagon-says-it-will-support-israel-after-leader-declares-war/?fbclid=IwAR04sP4t0KKU6K0RavzrOerPbTVV_ZPI_cZDKNDQU7xrWvbSODmpr6yyAqo,0.9,10599,0,10599
4,worldnews,An Israeli airstrike has flattened a high-rise building in central Gaza City after Hamas launched a surprise attack,https://abcnews.go.com/US/wireStory/israeli-airstrike-flattened-high-rise-building-central-gaza-103807208,0.94,8204,0,8204
5,worldnews,"At least 7 Nepali students studying at an Israel University have sustained injuries, 17 are held captive by Hamas forces",https://www.hindustantimes.com/world-news/israelpalestine-latest-caught-in-crossfire-7-nepalis-injured-17-held-captive-by-hamas-in-israel-101696683324167.html,0.96,5777,0,5777
6,worldnews,Hamas surprise attack a ‘historic failure’ for Israeli intelligence services,https://www.france24.com/en/middle-east/20231007-hamas-surprise-attack-a-historic-failure-for-israeli-intelligence-services,0.97,5663,0,5663
7,worldnews,Egypt warns of grave consequences from escalating Israeli-Palestinian fighting - Foreign Affairs - Egypt,https://english.ahram.org.eg/NewsContent/1/1234/509734/Egypt/Foreign-Affairs/Egypt-warns-of-grave-consequences-from-escalating-.aspx,0.96,5329,0,5329
8,worldnews,Ukraine Says Supports Israel's 'Right To Defend Itself And Its People',https://www.barrons.com/news/ukraine-says-supports-israel-s-right-to-defend-itself-and-its-people-e3de1ade?refsec=topics_afp-news,0.91,4793,0,4793
9,worldnews,"U.S. condemns Hamas ‘terrorism,’ attacks on Israeli civilians",https://www.politico.com/news/2023/10/07/hamas-terrorism-attacks-on-israeli-civilians-00120480,0.91,4298,0,4298
10,worldnews,"Head of Israeli council killed by Hamas while defending his community, as Palestinian fighters pour into southern Israel",https://www.businessinsider.com/israel-mayor-killed-defending-his-town-as-hamas-fighters-attack-from-gaza-2023-10,0.94,2900,0,2900
11,worldnews,"Texty: Russian museums refuse to return 110,000 Ukrainian looted treasures",https://euromaidanpress.com/2023/10/07/texty-russian-museums-refuse-to-return-110000-ukrainian-looted-treasures/,0.95,2376,0,2376
12,worldnews,EU condemns Hamas attack on Israel as ‘terrorism in its most despicable form’,https://www.politico.eu/article/israel-ursulva-von-der-leyen-hamas-palestina-condemns-terrorism/,0.93,1989,0,1989
13,worldnews,Israel asks civilians for help in identifying missing persons - approximately 750 Israelis are currently missing.,https://www.jpost.com/israel-news/article-763200,0.95,1847,0,1847
14,worldnews,Ukraine’s Zelensky calls for world solidarity with Israel,https://www.theglobeandmail.com/world/article-ukraines-zelensky-calls-for-world-solidarity-with-israel/,0.86,1242,0,1242
15,worldnews,U.S. will continue to foster stronger defence partnership with India: Pentagon,https://www.thehindu.com/news/international/us-will-continue-to-foster-stronger-defence-partnership-with-india-pentagon/article67387627.ece,0.92,1225,0,1225
16,worldnews,Hamas will 'bear the results' of its attack: Israel tells UN Security Council,https://www.hindustantimes.com/world-news/hamas-will-bear-the-results-of-its-attack-israel-to-un-security-council-101696701757884.html,0.94,1109,0,1109
17,worldnews,"Afghanistan earthquake: At least 120 killed and 1,000 injured in 6.3 quake.",https://www.bbc.com/news/world-asia-67039463,0.95,888,0,888
18,worldnews,"Kadyrov suggests postponing Russia presidential election, or excluding rivals to Putin",https://www.reuters.com/world/europe/putin-ally-suggests-postponing-march-presidential-election-or-excluding-rivals-2023-10-07/,0.94,763,0,763
19,worldnews,"Sudan war spreading as death toll tops 9,000",https://www.arabnews.com/node/2387131/middle-east,0.95,457,0,457
20,worldnews,Israel Attack: 30-Year-Old German Tattoo Artist's Body Paraded By Hamas Terrorists; Mother Makes Emotional Appeal In Heart-Wrenching Video,https://www.freepressjournal.in/world/israel-attack-30-year-old-german-tattoo-artists-body-paraded-by-hamas-terrorists-mother-makes-emotional-appeal-in-a-heart-wrenching-video,0.93,417,0,417
21,worldnews,"Desert horror: Music festival goers first took cover from rockets, then Gaza militants began firing on them",https://edition.cnn.com/2023/10/07/middleeast/israel-gaza-fighting-hamas-attack-music-festival-intl-hnk/index.html,0.94,378,0,378
22,worldnews,Kenya: Hundreds of believers protest LGBTQ association right,https://www.maravipost.com/kenya-hundreds-of-believers-protest-lgbtq-association-right/,0.89,345,0,345
23,worldnews,"/r/WorldNews Live Thread: Russian Invasion of Ukraine Day 592, Part 1 (Thread #738)",https://www.reddit.com/live/18hnzysb1elcs,0.96,330,0,330
24,worldnews,"Prime Minister Benjamin Netanyahu, Opposition Leader Yair Lapid and National Unity party leader Benny Gantz on Saturday discussed forming an emergency government following Hamas’s devastating surprise attack against Israel on Saturday",https://www.timesofisrael.com/lapid-urges-emergency-government-says-pm-cant-manage-war-with-extreme-cabinet/,0.9,300,0,300
25,worldnews,Israeli army radio reports mortar shells fired from Lebanon into Northern Israel,https://english.alarabiya.net/News/middle-east/2023/10/08/Israeli-army-radio-reports-mortar-shells-fired-from-Lebanon-into-Northern-Israel,0.95,293,0,293
26,worldnews,/r/WorldNews Live Thread for 2023 Israel-Hamas Crisis (Thread 2),https://www.reddit.com/live/1bsso361afr0r,0.96,164,0,164
