,subreddit,title,url,upvote_ratio,ups,downs,score
0,worldnews,Nato warns of all-out war with Russia in next 20 years,https://www.telegraph.co.uk/world-news/2024/01/18/nato-warns-of-war-with-russia-putin-next-20-years-ukraine/,0.88,16247,0,16247
1,worldnews,"Zelenskyy invites Trump to Ukraine again, calls his ''peace plan'' dangerous",https://www.pravda.com.ua/eng/news/2024/01/19/7438096/,0.92,9518,0,9518
2,worldnews,Ukrainian Intel Confirms It Struck Russian Oil Depot and Gunpowder Factory,https://www.kyivpost.com/post/26942,0.97,5098,0,5098
3,worldnews,Houthi official promises safe passage for Russian and Chinese ships,https://www.straitstimes.com/world/middle-east/houthi-official-promises-safe-passage-for-russian-chinese-ships,0.95,4868,0,4868
4,worldnews,Evidence points to systematic use of rape and sexual violence by Hamas in 7 October attacks,https://www.theguardian.com/world/2024/jan/18/evidence-points-to-systematic-use-of-rape-by-hamas-in-7-october-attacks,0.82,4697,0,4697
5,worldnews,"Putin Orders Hunt for Property of Russian Empire, Soviet Union",https://www.yahoo.com/news/putin-orders-hunt-property-russian-091640990.html,0.95,4107,0,4107
6,worldnews,US warns of Russian efforts to turn public opinion against Ukraine in upcoming European elections,https://kyivindependent.com/us-warns-of-russian-effort-to-turn-public-opinion-against-ukraine-in-upcoming-european-elections/,0.97,3547,0,3547
7,worldnews,"White House: Military cooperation between Russia, North Korea has potential to 'drastically' change security threat",https://kyivindependent.com/white-house-military-cooperation-between-russia-north-korea-has-potential-to-drastically-change-security-threat/,0.97,3363,0,3363
8,worldnews,Italian navy officer sentenced to 20 years for spying for Russia,https://www.ansa.it/english/news/2024/01/19/navy-officer-sentenced-to-20-years-for-spying-for-russia_18f8fc87-25b0-4d47-a2e4-bc97100f3072.html,0.98,2888,0,2888
9,worldnews,Cocaine found in toilets of four Swedish parties' parliamentary offices,https://www.thelocal.se/20240118/cocaine-found-in-toilets-of-four-swedish-parties-parliamentary-offices,0.96,2809,0,2809
10,worldnews,Brazil: Probe shows Bolsonaro faked his COVID vaccine record,https://www.dw.com/en/brazil-probe-shows-bolsonaro-faked-his-covid-vaccine-record/a-68029936,0.96,2020,0,2020
11,worldnews,"The French government will temporarily ban almost all commercial fishing in the Bay of Biscay to protect dolphins, much to the dismay of the industry",https://www.france24.com/en/environment/20240119-france-temporarily-bans-commercial-fishing-to-protect-dolphins,0.98,1987,0,1987
12,worldnews,"Ethnic killings in one Sudan city left up to 15,000 dead - UN report",https://www.reuters.com/world/africa/ethnic-killings-one-sudan-city-left-up-15000-dead-un-report-2024-01-19/,0.97,1473,0,1473
13,worldnews,"Large demonstration against right-wing extremism with 80,000 participants in Hamburg premature closed due to overcrowding.",https://www.dw.com/en/germany-scholz-welcomes-protests-against-deportation-plans/a-68038065,0.92,1170,0,1170
14,worldnews,Viktor Orbán: No Money in the World to Force us Accepting Migrants or LGBTQ Propaganda,https://hungarytoday.hu/viktor-orban-no-money-in-the-world-to-force-us-accepting-migrants-or-lgbtq-propaganda/,0.88,939,0,939
15,worldnews,EU's top diplomat: Palestinian state may need to be imposed on Israel from outside,https://www.timesofisrael.com/us-says-no-way-to-ensure-israels-long-term-security-without-a-palestinian-state/,0.81,915,0,915
16,worldnews,North Korea teens get 12 years' hard labour for watching K-pop,https://www.ctvnews.ca/world/north-korea-teens-get-12-years-hard-labour-for-watching-k-pop-1.6733216,0.93,857,0,857
17,worldnews,"Baltic countries to build defenses on Russian, Belarusian borders",https://kyivindependent.com/baltic-countries-to-build-defenses-on-russia-belarus-border/,0.97,771,0,771
18,worldnews,The winner of a prestigious Japanese literary award has confirmed AI helped write her book,https://edition.cnn.com/2024/01/19/style/rie-kudan-akutagawa-prize-chatgpt/index.html,0.93,663,0,663
19,worldnews,"‘It’s the work of that war criminal Putin’: Kharkiv reels under Russian missiles Kharkiv, only 25 miles from Russia, has been under constant attack since the start of the war in Ukraine. Now fragments of rockets from North Korea are being found among the debris",https://www.theguardian.com/world/2024/jan/19/kharkiv-reels-under-russian-missiles-ukraine,0.95,650,0,650
20,worldnews,"Japan, S. Korea, US vow deeper ties after N. Korea missile launch",https://mainichi.jp/english/articles/20240118/p2g/00m/0in/045000c,0.96,485,0,485
21,worldnews,/r/WorldNews Live Thread for 2023 Israel-Hamas Crisis (Thread 45),https://www.reddit.com/live/1bsso361afr0r,0.84,458,0,458
22,worldnews,Houthis embrace 'direct confrontation' with U.S. as Biden admits airstrikes aren't working,https://www.cnbc.com/2024/01/19/red-sea-attacks-biden-admits-airstrikes-on-houthis-arent-working.html,0.74,406,0,406
23,worldnews,Cyber Siege: Russian Intelligence Breaches Microsoft Executive Emails,https://livingswag.com/cyber-siege-russian-intelligence-breaches-microsoft-executive-emails/,0.91,220,0,220
24,worldnews,"/r/WorldNews Live Thread: Russian Invasion of Ukraine Day 696, Part 1 (Thread #842)",https://www.reddit.com/live/18hnzysb1elcs,0.96,176,0,176
25,worldnews,"Biden and Netanyahu have finally talked, but their visions still clash for ending Israel-Hamas war",https://apnews.com/article/96b178189e2124adfefd0971758b0491,0.86,134,0,134
26,worldnews,Medieval inscription discovered in desert ruins,https://www.medievalists.net/2024/01/medieval-inscription-discovered-in-desert-ruins/,0.95,111,0,111
