,subreddit,title,url,upvote_ratio,ups,downs,score
0,worldnews,Trump says he's postponing 'scheduled attack of Iran tomorrow' at Middle East leaders' request,https://www.cnbc.com/2026/05/18/trump-iran-attack-saudi-uae-qatar-deal.html,0.95,19909,0,19909
1,worldnews,Russia just hit commercial vessel of its closest war ally in Ukrainian waters with Shahed drone,https://euromaidanpress.com/2026/05/18/russia-just-hit-commercial-vessel-of-its-closest-war-ally-in-ukrainian-waters-with-shahed-drone/,0.96,8830,0,8830
2,worldnews,"Taiwan will not provoke conflict nor give up sovereignty, says president Lai Ching-te",https://www.bbc.com/news/articles/c7591gq10qko,0.98,7088,0,7088
3,worldnews,An asteroid discovered days ago will narrowly miss Earth,https://www.cnn.com/2026/05/18/science/asteroid-earth-close-pass?utm_medium=social&amp;utm_campaign=missions&amp;utm_source=reddit,0.95,6120,0,6120
4,worldnews,U.S. says it’s pausing long-standing military board with Canada,https://www.ctvnews.ca/politics/article/us-says-its-pausing-long-standing-military-board-with-canada/,0.96,5736,0,5736
5,worldnews,Russia Claims Ukraine Is Using AI Drones That Lock Onto Faces and Heat Signatures,https://united24media.com/war-in-ukraine/russia-claims-ukraine-is-using-ai-drones-that-lock-onto-faces-and-heat-signatures-18917,0.96,4346,0,4346
6,worldnews,Xi Jinping Told Donald Trump That Vladimir Putin Might Regret The Ukraine Invasion: Report,https://www.news18.com/amp/world/xi-jinping-told-donald-trump-that-vladimir-putin-might-regret-the-ukraine-invasion-report-ws-l-10099097.html,0.97,2744,0,2744
7,worldnews,A humanitarian aid ship from Mexico docks in Havana as US-Cuba tensions escalate,https://apnews.com/article/cuba-aid-ship-mexico-uruguay-havana-us-tensions-44f04d853c28504fa4bae040652d9803,0.97,2040,0,2040
8,worldnews,"Greenlanders are not ‘experimental subjects’, says minister as she decries US doctor’s visit | Greenland",https://www.theguardian.com/world/2026/may/18/greenland-us-doctor-visit-trump-envoy-deeply-problematic,0.95,1967,0,1967
9,worldnews,Cuba warns U.S. military action would cause 'bloodbath' after drone report,https://www.reuters.com/world/americas/cuba-warns-us-military-action-would-cause-bloodbath-after-drone-report-2026-05-18/,0.95,1628,0,1628
10,worldnews,"Putin faces 'very difficult choices' in Ukraine as sanctions bite, Estonia's spy chief says",https://www.reuters.com/business/aerospace-defense/putin-faces-very-difficult-choices-ukraine-sanctions-bite-estonias-spy-chief-2026-05-18/,0.97,1412,0,1412
11,worldnews,Marcos says Philippines would be involved in any Taiwan conflict,https://www.straitstimes.com/asia/se-asia/marcos-says-philippines-would-be-involved-in-any-taiwan-conflict,0.95,881,0,881
12,worldnews,Greenland says talks with US making progress but island is not for sale,https://www.reuters.com/world/europe/greenland-says-us-talks-make-progress-island-is-not-sale-2026-05-18/,0.94,539,0,539
13,worldnews,Russian President Vladimir Putin to visit Beijing for talks with China's Xi Jinping,https://abcnews.com/amp/International/russian-president-vladimir-putin-visit-beijing-talks-chinas/story?id=133079142,0.93,504,0,504
14,worldnews,"Xi Jinping told Trump that Putin may ""regret"" invasion of Ukraine",https://www.pravda.com.ua/eng/news/2026/05/19/8035332/,0.97,394,0,394
15,worldnews,"Greece to pay off €6.9 billion in June, ending its run as Eurozone's most indebted nation",https://www.iefimerida.gr/english/greece-pay-eu69-billion-june-ending-its-run-eurozones-most-indebted-nation,0.99,355,0,355
16,worldnews,"At least 118 dead in Ebola outbreak in DR Congo, official says",https://www.bbc.com/news/articles/cq6pz60p996o,0.96,293,0,293
17,worldnews,/r/WorldNews Discussion Thread: US and Israel launch attack on Iran; Iran retaliates (Thread #17),https://www.reddit.com/r/worldnews/comments/1t1399d/rworldnews_discussion_thread_us_and_israel_launch/,0.9,257,0,257
18,worldnews,"/r/WorldNews Live Thread: Russian Invasion of Ukraine Day 1545, Part 1 (Thread #1692)",https://www.reddit.com/live/18hnzysb1elcs,0.97,220,0,220
19,worldnews,Cuba warns of ‘bloodbath’ as US imposes new sanctions amid rising tensions,https://www.france24.com/en/americas/20260519-cuba-warns-of-bloodbath-as-us-imposes-new-sanctions-amid-rising-tensions,0.89,211,0,211
20,worldnews,"Kenya paralyzed by deadly protests, strikes due to fuel cost: The African country is among many dependent on fuel imports from the Gulf. Last week, authorities in the country hiked fuel prices by 23.5%",https://www.dw.com/en/kenya-fuel-protests-turn-deadly-amid-iran-war-disruptions/a-77202954,0.97,192,0,192
21,worldnews,Germany to deploy Patriot air defense unit to Türkiye under NATO mission,https://www.dailysabah.com/politics/diplomacy/germany-to-deploy-patriot-air-defense-unit-to-turkiye-under-nato-mission,0.94,166,0,166
22,worldnews,U.S. slaps duties on fresh Canadian mushrooms over subsidy claims,https://www.thestar.com/news/canada/us-slaps-duties-on-fresh-canadian-mushrooms-over-subsidy-claims/article_d449a870-ea72-50c9-adef-c74c71b2e2e3.html,0.9,89,0,89
23,worldnews,"Iran says peace proposal includes reparations for war damage, US troop withdrawal",https://www.reuters.com/world/asia-pacific/iran-says-peace-proposal-includes-reparations-war-damage-us-troop-withdrawal-2026-05-19/,0.88,86,0,86
24,worldnews,Sweden Selects France’s Naval Group for $5 Billion Frigate Deal,https://www.bloomberg.com/news/articles/2026-05-19/sweden-selects-france-s-naval-group-for-5-billion-frigate-deal,0.95,65,0,65
