,subreddit,title,url,upvote_ratio,ups,downs,score
0,worldnews,"
French far-right candidate to drop out after picture emerges of her wearing Nazi cap
",https://www.lemonde.fr/en/france/article/2024/07/02/french-elections-far-right-candidate-to-withdraw-after-nazi-cap-picture-emerges_6676421_7.html,0.91,30694,0,30694
1,worldnews,The planet’s vision is getting worse: 50% of the population will have myopia by 2050,https://english.elpais.com/health/2024-07-02/the-planets-vision-is-getting-worse-50-of-the-population-will-have-myopia-by-2050.html,0.97,8156,0,8156
2,worldnews,Top Iranian general: Next attack on Israel will lead to 'complete victory',https://www.jns.org/top-iranian-general-next-attack-on-israel-will-lead-to-complete-victory/,0.9,6309,0,6309
3,worldnews,Another One Of Russia’s Nuclear-Proof Transports Just Got Blown Up In Ukraine,https://www.forbes.com/sites/davidaxe/2024/06/30/another-one-of-russias-nuclear-proof-transports-just-got-blown-up-in-ukraine/,0.96,5997,0,5997
4,worldnews,Ukraine says it thwarted a plot to overthrow the government | CNN,https://www.cnn.com/2024/07/02/europe/ukraine-thwarts-coup-attempt-intl-hnk/index.html,0.97,4580,0,4580
5,worldnews,Greece introduces ‘growth-oriented’ six-day working week,https://www.theguardian.com/world/article/2024/jul/01/greece-introduces-growth-oriented-six-day-working-week,0.94,3502,0,3502
6,worldnews,New Gaza famine report reveals grim March predictions were vastly exaggerated,https://www.timesofisrael.com/new-gaza-famine-report-reveals-grim-march-predictions-were-vastly-exaggerated/,0.8,3441,0,3441
7,worldnews,"US set to announce over $2.3 bln arms package for Ukraine, Pentagon says",https://www.reuters.com/world/us-set-announce-over-23-bln-weapons-package-ukraine-pentagon-2024-07-02/,0.95,3394,0,3394
8,worldnews,China Is Making and Testing Lethal Attack Drones for Russia,https://www.bloomberg.com/news/articles/2024-07-02/china-is-building-and-testing-lethal-attack-drones-for-russia,0.95,3351,0,3351
9,worldnews,"At least 100 killed in crush at India religious event
",https://www.bbc.com/news/articles/cv2g7wgj83no,0.96,3271,0,3271
10,worldnews,"Zelensky dismissed Orban's ceasefire proposal, Kyiv says",https://kyivindependent.com/zelensky-dismisses-orbans-ceasefire-proposal/,0.96,3074,0,3074
11,worldnews,UN calls Russia to stop jamming GPS communications ,https://global.espreso.tv/world-news-un-demands-russia-to-stop-jamming-gps-communications,0.97,2425,0,2425
12,worldnews,Singapore prepared to recognise a Palestinian state with an effective govt that accepts Israel's right to exist,https://www.channelnewsasia.com/singapore/palestine-israel-singapore-prepared-principle-recognise-state-reject-terrorism-4450696,0.94,2274,0,2274
13,worldnews,French candidates bow out in concerted bid to block far-right ,https://www.reuters.com/world/uk/french-candidates-bow-out-concerted-bid-block-far-right-2024-07-02/,0.95,2222,0,2222
14,worldnews,Paris Grand Synagogue Rabbi: ‘There is no future for Jews in France’,https://m.jpost.com/diaspora/article-808521,0.9,2209,0,2209
15,worldnews,The government of Cuba declares itself in a ‘war-time economy’ ,https://english.elpais.com/international/2024-07-02/the-government-of-cuba-declares-itself-in-a-war-time-economy.html?prm=ep-app-cabecera,0.96,2176,0,2176
16,worldnews,UN opens investigation into allegations its Palestine monitor took funds from pro-Hamas lobby groups - UN Watch,https://unwatch.org/un-opens-investigation-into-official-accused-of-antisemitism-by-france-germany-us/,0.92,1884,0,1884
17,worldnews,UK leads NATO’s new ‘Allied Reaction Force’ to deter Russia,https://ukdefencejournal.org.uk/uk-leads-natos-new-allied-reaction-force-to-deter-russia/,0.96,1055,0,1055
18,worldnews,"In Mexico, 19 bodies found in truck as violence spreads in southern state",https://www.reuters.com/world/americas/mexico-19-bodies-found-after-alleged-shootout-between-gangs-2024-07-02/,0.95,702,0,702
19,worldnews,Russia lost about 60 vessels in southern Ukraine in a month - Ukrainian Navy,https://global.espreso.tv/russia-ukraine-war-russia-lost-about-60-vessels-in-southern-ukraine-in-a-month-ukrainian-navy,0.96,695,0,695
20,worldnews,Lebanese FM to Israel: We are interested in peace,https://www.jpost.com/middle-east/article-808731,0.92,449,0,449
21,worldnews,Google Search Ranks AI Spam Above Original Reporting in News Results,https://www.wired.com/story/google-search-ai-spam-original-reporting-news-results/,0.94,328,0,328
22,worldnews,Taiwan says China seizes fishing boat near Chinese coast,https://www.reuters.com/world/asia-pacific/taiwan-says-china-seizes-fishing-boat-near-chinese-coast-2024-07-02/,0.93,296,0,296
23,worldnews,"Ukraine receives nearly 6,000 solar panels to power hospitals",https://kyivindependent.com/ukraine-receives-nearly-6-000-solar-panels-to-power-hospitals/,0.97,253,0,253
24,worldnews,"/r/WorldNews Live Thread: Russian Invasion of Ukraine Day 860, Part 1 (Thread #1007)",https://www.reddit.com/live/18hnzysb1elcs,0.95,214,0,214
25,worldnews,/r/WorldNews Live Thread for Israel-Hamas War (Thread #56),https://www.reddit.com/live/1bsso361afr0r,0.77,147,0,147
26,worldnews,Bird flu hits McDonald's breakfasts in Australia,https://www.astroawani.com/berita-dunia/bird-flu-hits-mcdonalds-breakfasts-australia-477253,0.85,118,0,118
