,subreddit,title,url,upvote_ratio,ups,downs,score
0,worldnews,Qatar Bans Beer Sales at World Cup Stadiums,https://www.nytimes.com/2022/11/18/sports/soccer/world-cup-beer-qatar.html,0.9,77503,0,77503
1,worldnews,"5 NATO carrier strike groups, including the US Navy's newest supercarrier, are patrolling waters around Europe",https://www.businessinsider.com/nato-carrier-strike-groups-us-navy-supercarrier-patrolling-waters-europe-2022-11,0.92,51990,0,51990
2,worldnews,Protesters in Iran set fire to Khomeini's ancestral home,https://www.dw.com/en/protesters-in-iran-set-fire-to-khomeinis-ancestral-home/a-63811645,0.97,24155,0,24155
3,worldnews,China pushes back on FBI claims of Chinese 'police stations' in U.S.,https://www.reuters.com/world/china/china-pushes-back-fbi-claims-chinese-police-stations-us-2022-11-18/,0.96,9903,0,9903
4,worldnews,King Charles: Foie gras banned at royal residences - BBC News,https://www.bbc.com/news/uk-63676759,0.94,7979,0,7979
5,worldnews,Ireland asks members of Russian Embassy in Dublin to leave,https://www.bbc.com/news/articles/ce92y5dv518o?xtor=AL-72-%5Bpartner%5D-%5Bbbc.news.twitter%5D-%5Bheadline%5D-%5Bnews%5D-%5Bbizdev%5D-%5Bisapi%5D&amp;at_custom4=BA0C780E-6757-11ED-BE85-2BD44744363C&amp;at_custom1=%5Bpost+type%5D&amp;at_campaign=Social_Flow&amp;at_medium=social&amp;at_custom2=twitter&amp;at_custom3=%40BBCNews&amp;at_link_type=web_link&amp;at_link_id=AE8487A4-675E-11ED-980C-EB300EDC252D&amp;at_campaign_type=owned&amp;at_bbc_team=editorial&amp;at_link_origin=BBC+Lifestyle+%26+Health+News&amp;at_ptr_name=twitter&amp;at_format=link,0.98,6082,0,6082
6,worldnews,"Russia beat, starved, and electrocuted people from a captured Ukrainian nuclear power plant in a web of underground prisons, escaped workers say",https://www.businessinsider.com/russia-tortured-workers-at-zaporizhzhia-nuclear-power-plant-2022-11,0.97,5837,0,5837
7,worldnews,Biden administration says Saudi prince has immunity in Khashoggi killing lawsuit,https://www.reuters.com/legal/biden-admin-says-saudi-prince-has-immunity-khashoggi-killing-lawsuit-court-2022-11-18/?utm_medium=Social&amp;utm_source=twitter,0.93,5506,0,5506
8,worldnews,"Sweden finds explosive traces at Nord Stream blast site, confirms sabotage",https://www.washingtonpost.com/world/2022/11/18/nord-stream-sweden-explosives-sabotage/#,0.98,5107,0,5107
9,worldnews,Fans paid to attend World Cup by Qatar have daily allowance cancelled,https://www.theguardian.com/football/2022/nov/18/fans-paid-to-attend-world-cup-by-qatar-have-daily-allowance-cancelled,0.97,4834,0,4834
10,worldnews,Russia accuses Ukraine of executing more than 10 POWs,https://www.aljazeera.com/news/2022/11/18/russia-accuses-ukraine-of-executing-more-than-10-pows,0.85,3860,0,3860
11,worldnews,"Tuvalu starts to digitise their nation as rising seas threaten existence | Tuvalu said on Thursday that it plans to build a digital version of itself, replicating islands and landmarks and preserving its history and culture as rising sea levels threaten to submerge the tiny Pacific nation",https://www.channelnewsasia.com/sustainability/tuvalu-starts-digitise-their-nation-rising-seas-threaten-existence-3082891,0.97,3314,0,3314
12,worldnews,Zelenskyy rejects Russia’s desire for ‘short truce’ in Halifax address,https://www.politico.com/news/2022/11/18/zelenskyy-russias-short-truce-halifax-00069493,0.96,3138,0,3138
13,worldnews,Ukraine will produce heavy weapons and military equipment jointly with at least six NATO countries,https://www.pravda.com.ua/eng/news/2022/11/18/7377004/,0.97,1838,0,1838
14,worldnews,Kim Jong Un just revealed his daughter to the world in photos of North Korea's latest launch of a massive missile,https://www.businessinsider.com/kim-jong-un-reveals-daughter-in-photos-of-missile-launch-2022-11,0.94,1708,0,1708
15,worldnews,MOT: Finland seizes 3 Russian-owned private jets,https://yle.fi/a/3-12678735,0.96,1251,0,1251
16,worldnews,US and Russia to meet in Egypt to discuss key nuclear arms control agreement later this month | CNN Politics,https://www.cnn.com/2022/11/18/politics/new-start-talks-cairo-2022/index.html,0.95,1016,0,1016
17,worldnews,"The labor shortage could last for years, major employment firms predict. Here's why",https://fortune.com/2022/11/17/declining-birth-rate-labor-shortage-workforce-population-glassdoor-indeed-report/,0.9,706,0,706
18,worldnews,Russian dissident Alexey Navalny says he was moved into solitary cell to ‘shut me up’,https://edition.cnn.com/2022/11/18/europe/russia-alexey-cell-solitary-confinement-intl/index.html,0.96,583,0,583
19,worldnews,Zelenskiy: Ukrainian forces repel 100 attacks in Donetsk region,https://www.reuters.com/world/europe/zelenskiy-ukrainian-forces-repel-100-attacks-donetsk-region-2022-11-18/,0.94,542,0,542
20,worldnews,Vietnam jails dissident for eight years over Facebook posts,https://www.reuters.com/world/asia-pacific/vietnam-jails-dissident-eight-years-over-facebook-posts-2022-11-18/,0.93,480,0,480
21,worldnews,Russia's terrifying 'Satan 2' nuclear missile passes second test,https://www.lbc.co.uk/news/russias-terrifying-satan-2-nuclear-missile-passes-second-test/,0.77,446,0,446
22,worldnews,Russia Says Prisoner Swap Deal that Could Free Brittney Griner for Notorious Arms Dealer Viktor Bout are 'Strengthening',https://www.ibtimes.sg/russia-says-prisoner-swap-deal-that-could-free-brittney-griner-notorious-arms-dealer-viktor-bout-67787,0.86,429,0,429
23,worldnews,N Korea warns of ‘all-out’ nuclear response to US ‘aggression’,https://www.aljazeera.com/news/2022/11/19/north-korea-warns-of-all-out-nuclear-response-to-us-provocation,0.91,403,0,403
24,worldnews,"We're Victoria and Adam from Sky News UK's Forensics team. We use OSINT techniques to verify, investigate and explain global news stories to our audiences. We've had a busy year working on the Ukraine war and other big stories. AMA!",https://www.reddit.com/r/worldnews/comments/yxsucx/were_victoria_and_adam_from_sky_news_uks/,0.8,363,0,363
25,worldnews,Russia digging trenches near Crimea anticipating Ukrainian advance,https://www.msn.com/en-ae/news/world/russia-digging-trenches-near-crimea-anticipating-ukrainian-advance/ar-AA14gFGg,0.95,299,0,299
26,worldnews,"/r/WorldNews Live Thread: Russian Invasion of Ukraine Day 269, Part 1 (Thread #410)",https://www.reddit.com/live/18hnzysb1elcs,0.94,247,0,247
