,subreddit,title,url,upvote_ratio,ups,downs,score
0,worldnews,Venezuela's Maria Corina Machado wins 2025 Nobel Peace Prize,https://www.reuters.com/world/venezuelas-maria-corina-machado-wins-2025-nobel-peace-prize-2025-10-10/,0.93,37528,0,37528
1,worldnews,Trump suggests Spain should be 'thrown out' of NATO,https://www.euronews.com/2025/10/10/trump-suggests-spain-should-be-thrown-out-of-nato-over-defence-expenditure-disagreements,0.93,11222,0,11222
2,worldnews,"In shock move, French president reappoints prime minister who quit Monday",https://edition.cnn.com/2025/10/10/europe/france-lecornu-macron-political-turmoil-latam-intl,0.96,8030,0,8030
3,worldnews,Russia bombers hit training targets near NATO as Baltics prepare for attack,https://www.newsweek.com/russia-nato-baltic-states-bombers-attack-training-10861178?utm_source=reddit&amp;utm_campaign=reddit_influencers,0.92,7921,0,7921
4,worldnews,"Trump puts extra 100% tariff on China imports, adds export controls on 'critical software'",https://www.cnbc.com/2025/10/10/trump-trade-tariffs-china-software.html,0.96,4302,0,4302
5,worldnews,"Venezuela asks U.N. for emergency meeting over U.S. military actions, saying it expects ""armed attack"" soon",https://www.cbsnews.com/news/venezuela-un-emergency-session-us-military-actions-armed-attack/,0.97,4050,0,4050
6,worldnews,Ukraine Destroyed Yet Another Very Expensive Russian EW System,https://www.technology.org/2025/10/10/ukraine-destroyed-yet-another-very-expensive-russian-ew-system/,0.98,3084,0,3084
7,worldnews,"Carney announces long-awaited automatic tax filing, makes school food program permanent",https://www.cbc.ca/news/politics/carney-school-food-automatic-tax-canada-strong-pass-9.6934474,0.98,2754,0,2754
8,worldnews,“We know what to do”: Zelenskyy hints at response after Russian strikes plunge Kyiv into darkness,https://euromaidanpress.com/2025/10/10/zelenskyy-hints-at-response-after-russian-strikes-plunge-kyiv-into-darkness/,0.97,2592,0,2592
9,worldnews,"Trump seems to cancel Xi meeting amid rare-earth clash, threatens huge tariffs",https://www.scmp.com/news/china/diplomacy/article/3328601/trump-threatens-cancel-meeting-xi-amid-rare-earth-trade-clash,0.97,2344,0,2344
10,worldnews,Ukraine to Receive Skyranger Air-Defense Systems Funded With “Hundreds of Millions” of Seized Russian Assets,https://united24media.com/latest-news/ukraine-to-receive-skyranger-air-defense-systems-funded-with-hundreds-of-millions-of-seized-russian-assets-12370,0.98,1793,0,1793
11,worldnews,"US buys Argentinian pesos, finalises $20bn currency swap, says US Treasury",https://www.aljazeera.com/news/2025/10/9/us-buys-argentinian-pesos-finalises-20bn-currency-swap-says-us-treasury,0.96,1640,0,1640
12,worldnews,UN says has enough stocks to feed entire Gaza for 3 months,https://www.newarab.com/news/un-says-has-enough-stocks-feed-entire-gaza-3-months,0.91,1545,0,1545
13,worldnews,Venezuela's opposition leader Machado dedicates Nobel Peace Prize to Trump,https://www.reuters.com/world/nobel-peace-prize-winner-be-announced-year-overshadowed-by-trump-2025-10-10/,0.86,1205,0,1205
14,worldnews,Trump threatens 'massive' tariff hike on China over rare earths dispute,https://www.cnbc.com/2025/10/10/trump-china-tariffs-rare-earths.html,0.93,1102,0,1102
15,worldnews,Trump wants to impose additional 100 percent tariffs against China,https://www.srf.ch/news/international/usa/handelsstreit-usa-china-trump-will-zusaetzliche-100-prozent-zoelle-gegen-china-einfuehren,0.94,910,0,910
16,worldnews,"Brazil's soybean exports to hit record as US out of market, Chinese demand strong",https://www.reuters.com/sustainability/climate-energy/brazils-soybean-exports-hit-record-us-out-market-chinese-demand-strong-2025-10-08/,0.97,898,0,898
17,worldnews,Latvia Orders 841 Russians to Leave Over Language and Residency Law Violations,https://www.kyivpost.com/post/61872,0.97,894,0,894
18,worldnews,"Poland hit by unprecedented disinformation attack after drone incursion, experts say",https://tvpworld.com/89366467/coordinated-disinformation-wave-hit-poland-after-russias-drone-breach,0.97,669,0,669
19,worldnews,"Hamas will be disarmed, Netanyahu vows after ceasefire begins",https://www.theguardian.com/world/2025/oct/10/what-does-gaza-deal-hamas-mean-for-benjamin-netanyahu-future,0.83,456,0,456
20,worldnews,Trump announces extra 100% tariff on Chinese goods starting next month,https://www.cbsnews.com/news/trump-china-tariff-extra-100-november/,0.9,211,0,211
21,worldnews,UK ready to use frozen Russian assets to fund Ukraine war effort,https://www.bbc.com/news/articles/c62np269qv9o,0.96,189,0,189
22,worldnews,"/r/WorldNews Live Thread: Russian Invasion of Ukraine Day 1325, Part 1 (Thread #1472)",https://www.reddit.com/live/18hnzysb1elcs,0.95,96,0,96
23,worldnews,"Denmark to boost Arctic defence by $4.26 billion, buy 16 new F-35s",https://www.reuters.com/business/aerospace-defense/denmark-boost-arctic-defence-by-426-billion-greenland-government-says-2025-10-10/,0.92,90,0,90
24,worldnews,Police arrest owner of drug company linked to deaths of 21 children in India,https://www.cbsnews.com/news/owner-drug-company-deaths-children-cough-syrup-india-arrest/,0.93,86,0,86
