,subreddit,title,url,upvote_ratio,ups,downs,score
0,worldnews,Ukraine war: Burger King still open in Russia despite pledge to exit,https://www.bbc.com/news/business-66739104,0.92,20333,0,20333
1,worldnews,"India: Opposition Leader Mahua Moitra Dragged, Forcibly Lifted By Delhi Cops As She Shouts ‘How Can You Do This To An MP?'",https://www.freepressjournal.in/india/tmc-mps-abhishek-banerjee-mahua-moitra-detained-during-protest-at-delhis-krishi-bhawan-visuals-surface,0.93,10823,0,10823
2,worldnews,The Pentagon warns Congress it is running low on money to replace weapons sent to Ukraine,https://apnews.com/article/ukraine-russia-war-congress-funding-13727f76561a80d2f00267a13667c33a,0.94,4343,0,4343
3,worldnews,Philippines says three fishermen killed after boat rammed by ‘foreign’ vessel in South China Sea,https://www.cnn.com/2023/10/03/asia/philippines-south-china-sea-scarborough-shoal-fishermen-dead-intl-hnk/index.html,0.97,4163,0,4163
4,worldnews,"If Putin goes to Armenia he’d be arrested, as lawmakers back ICC entry",https://www.politico.eu/article/putin-arrest-armenia-ratifies-rome-statute-despite-pressure-russia-criminal-court/,0.98,3630,0,3630
5,worldnews,Russian Ruble Weakens Past 100 To The Dollar,https://www.rferl.org/a/russia-ruble-falls-100-dollar/32620564.html,0.97,3142,0,3142
6,worldnews,Armenia’s parliament defies Russia in vote to join international criminal court,https://www.theguardian.com/world/2023/oct/03/armenias-parliament-defies-russia-in-vote-to-join-international-criminal-court,0.97,2456,0,2456
7,worldnews,NYT: Russia Suspected of Testing Secret Nuclear-Powered Intercontinental Missile,https://www.kyivpost.com/post/22245,0.94,2450,0,2450
8,worldnews,"Gang removed hundreds of kidneys to sell to wealthy clients, Pakistan police say",https://www.cnn.com/2023/10/03/asia/pakistan-kidney-trafficking-ring-intl-hnk/index.html,0.97,2275,0,2275
9,worldnews,Russian textbook claims German unification was 'annexation',https://www.dw.com/en/reunification-russia-speaks-of-annexation-of-the-gdr/a-66986199,0.95,2234,0,2234
10,worldnews,Machinery from New York-based company used to build Russian weapons used in war on Ukraine,https://www.pbs.org/newshour/show/machinery-from-new-york-based-company-used-to-build-russian-weapons-used-in-war-on-ukraine,0.96,1975,0,1975
11,worldnews,Polish politician ‘marries’ partner in symbolic wedding to call for marriage equality,https://www.thepinknews.com/2023/10/03/poland-equal-marriage-robert-biedron-krzysztof-smiszek/,0.94,1369,0,1369
12,worldnews,Canada MPs elect first black House of Commons Speaker,https://www.bbc.com/news/world-us-canada-67000773,0.91,967,0,967
13,worldnews,Video of ultra-Orthodox Jews spitting by Christians in Jerusalem sparks outrage,https://www.theguardian.com/world/2023/oct/03/video-of-ultra-orthodox-jews-spitting-by-christians-in-jerusalem-sparks-outrage,0.9,957,0,957
14,worldnews,Ukraine war: Western allies say they are running out of ammunition,https://www.bbc.com/news/world-europe-66984944,0.88,949,0,949
15,worldnews,"Despite Warning Signals From Moscow, Armenian Lawmakers Ratify ICC's Rome Statute",https://www.rferl.org/a/armenia-russia-ratification-icc/32621093.html,0.98,912,0,912
16,worldnews,"Pakistan orders illegal immigrants, including 1.73 mln Afghans, to leave",https://www.reuters.com/world/asia-pacific/pakistan-orders-all-illegal-immigrants-leave-after-suicide-bombings-2023-10-03/,0.97,866,0,866
17,worldnews,US increases pressure on Ukraine to do more to counter corruption,https://www.cnn.com/2023/10/03/politics/us-ukraine-pressure-counter-corruption/index.html,0.95,651,0,651
18,worldnews,India Is Using Terrorism Laws to Target Journalists | Police seized laptops and phones from reporters working for the anti-establishment Newsclick website—the latest outlet to be raided during a crackdown on media in India - Wired,https://www.wired.com/story/india-is-using-terrorism-laws-to-target-journalists/,0.91,605,0,605
19,worldnews,Iceland to implement visitor tax,https://www.usatoday.com/story/travel/news/2023/10/02/iceland-implementing-visitor-tax/70965130007/,0.96,596,0,596
20,worldnews,"/r/WorldNews Live Thread: Russian Invasion of Ukraine Day 588, Part 1 (Thread #734)",https://www.reddit.com/live/18hnzysb1elcs,0.98,279,0,279
21,worldnews,Ukraine designates China’s biggest oil firms as ‘sponsors of war’ for Russian joint ventures,https://www.scmp.com/news/china/diplomacy/article/3236695/ukraine-designates-chinas-biggest-oil-firms-sponsors-war-russian-joint-ventures?module=lead_hero_story&amp;pgtype=homepage,0.91,252,0,252
22,worldnews,Kharkiv to build Ukraine’s first underground school to protect children,https://www.theguardian.com/world/2023/oct/03/russia-ukraine-war-underground-school-kharkiv,0.94,132,0,132
23,worldnews,"First Indigenous Premier Elected in Manitoba, Canada",https://newsinteractives.cbc.ca/elections/manitoba/2023/results/,0.93,112,0,112
24,worldnews,South Korean companies Kia and Hyundai Blame TikTok and Instagram For Their Cars Getting Stolen,https://www.vice.com/en/article/bvj5jv/kia-and-hyundai-blame-tiktok-and-instagram-for-their-cars-getting-stolen,0.85,100,0,100
25,worldnews,"Russia Plans To Block VPN In March 2024, Member Of Federation Council Says",https://www.rferl.org/a/russia-blocks-vpns-arch-2024-sheikin-meta/32621394.html,0.92,94,0,94
