,subreddit,title,url,upvote_ratio,ups,downs,score
0,worldnews,Ukraine confirms that the US is now protecting Putin’s oil and energy assets,https://kyivinsider.com/ukraine-confirms-us-is-now-protecting-putins-oil-assets/,0.93,47601,0,47601
1,worldnews,El Salvador President and Trump Ally Bukele Accused of Cutting Deals With MS-13 Gang Members Using U.S. Aid,https://www.latintimes.com/el-salvador-president-trump-ally-bukele-accused-cutting-deals-ms-13-gang-members-using-us-aid-584958,0.96,23982,0,23982
2,worldnews,"Russia to demand Ukraine destroy Western weapons to end war, senior Kremlin official says",https://kyivindependent.com/russia-demands-ukraine-destroy-western-weapons-to-end-war/,0.94,13711,0,13711
3,worldnews,Trump to depart the G7 early as conflict between Israel and Iran shows signs of intensifying,https://www.washingtonpost.com/world/2025/06/16/trump-g7-carney-canada-trade-iran/cce5e31c-4a66-11f0-8fff-262d6ec54ab9_story.html,0.97,9530,0,9530
4,worldnews,U.S. tells allies it won't join war unless Iran targets Americans,https://www.axios.com/2025/06/16/us-join-war-bomb-iran-target-americans,0.97,8861,0,8861
5,worldnews,China tells citizens in Israel to leave ‘as soon as possible’,https://www.freemalaysiatoday.com/category/world/2025/06/17/china-tells-citizens-in-israel-to-leave-as-soon-as-possible,0.97,8635,0,8635
6,worldnews,"Iran ready to abandon enrichment but needs a face-saving exit, Iranian diplomat says",https://iranwire.com/en/news/142210-exclusive-tehran-ready-to-abandon-enrichment-but-needs-a-face-saving-exit/,0.94,5823,0,5823
7,worldnews,Canadian Indigenous leader says he was ‘filled with rage’ before ‘intense’ conversation with Trump,https://apnews.com/article/trump-g7-first-nation-crowchild-rage-canada-a0af79321cd4b4f4b6d2a66319206137,0.93,4763,0,4763
8,worldnews,"Iran wants to kill Trump, plotted assassination: Netanyahu's explosive claim",https://www.indiatoday.in/world/story/iran-plotted-donald-trump-killing-marked-number-one-enemy-benjamin-netanyahu-2741283-2025-06-16?fbclid=IwY2xjawK9PmtleHRuA2FlbQIxMQABHloVf3a4SrgDCNo1jkaR3qk3iRsFHN3yVCKLO-OmGxqHVkTS0tdaRHsi78yF_aem_nb38428jEtfysREQf7PlbA,0.87,4385,0,4385
9,worldnews,"Iran asks Gulf states to mediate for ceasefire with Israel, sources say",https://www.reuters.com/world/middle-east/iran-asks-gulf-arab-states-have-trump-press-israel-immediate-ceasefire-sources-2025-06-16/,0.96,4306,0,4306
10,worldnews,Zelenskyy: Russia proposed exchanging POWs for deported Ukrainian children,https://www.pravda.com.ua/eng/news/2025/06/16/7517391/,0.98,4024,0,4024
11,worldnews,"Trump to leave G7 early, cancels Anthony Albanese meeting amid Israel-Iran conflict",https://www.smh.com.au/politics/federal/albanese-s-meeting-with-trump-meeting-cancelled-because-of-iran-israel-war-20250617-p5m7ym.html,0.97,3767,0,3767
12,worldnews,"U.S. citizen killed in Russian strikes on Kyiv, Ukrainian officials say",https://bnonews.com/index.php/2025/06/u-s-citizen-killed-in-russian-strikes-on-kyiv-ukrainian-officials-say/,0.98,2828,0,2828
13,worldnews,Iran says Israel’s attack on its state TV building is a war crime,https://www.theguardian.com/world/2025/jun/16/iran-israel-attack-state-television-irib,0.86,2438,0,2438
14,worldnews,Netanyahu tells ABC he's not ruling out taking out Iran's Supreme Leader Ali Khamenei,https://abcnews.go.com/Politics/netanyahu-tells-abc-ruling-taking-irans-supreme-leader/story?id=122868515,0.94,2051,0,2051
15,worldnews,Denmark fines Tesla over misleading marketing practices,https://www.thelocal.dk/20250616/denmark-fines-tesla-over-misleading-marketing-practices,0.97,1957,0,1957
16,worldnews,"US aircraft, warships headed to Middle East amid Israel-Iran conflict",https://thehill.com/policy/defense/5353854-us-aircraft-warships-headed-to-middle-east-amid-israel-iran-conflict/amp/,0.97,1358,0,1358
17,worldnews,"Europe largely fills the US aid withdrawal, lead by the Nordics and the UK",https://www.ifw-kiel.de/publications/news/ukraine-support-europe-largely-fills-the-us-aid-withdrawal-lead-byn-the-nordics-and-the-uk/,0.97,1075,0,1075
18,worldnews,"Iran’s Mossad paranoia grows, amid fears of Israeli spies wearing ‘masks, hats and sunglasses’",https://www.cnn.com/2025/06/16/middleeast/iran-mossad-paranoia-israel-spies-intl-latam,0.93,1058,0,1058
19,worldnews,Trump says 'it's possible' US gets involved in Israel-Iran conflict,https://abcnews.go.com/amp/Politics/trump-us-gets-involved-israel-iran-conflict/story?id=122865561,0.95,901,0,901
20,worldnews,"Iran-Israel ceasefire offer has been made, says Macron, as Trump exits G7 summit early",https://www.theguardian.com/world/2025/jun/17/donald-trump-g7-summit-iran-israel-ceasefire-offer,0.94,865,0,865
21,worldnews,Trump Says Russia Sanctions Would Cost US ‘A Lot of Money’,https://www.bloomberg.com/news/articles/2025-06-16/trump-says-russia-sanctions-would-cost-us-a-lot-of-money?,0.9,850,0,850
22,worldnews,Israel - Iran Conflict (Part III),https://www.reddit.com/live/1f6c5t0liqj9c/,0.91,582,0,582
23,worldnews,IDF: We eliminated Iran's new Chief of Staff overnight,https://www.ynetnews.com/article/19lloltju,0.93,572,0,572
24,worldnews,Trump Pushes G7 Expansion to Include Russia and China,https://www.newslooks.com/trump-pushes-g7-expansion-to-include-russia-and-china/,0.85,392,0,392
25,worldnews,Israel furious as France shuts weapons stands at Paris Airshow,https://www.reuters.com/business/aerospace-defense/organisers-shut-four-main-israeli-company-stands-paris-airshow-israel-says-2025-06-16/,0.9,366,0,366
26,worldnews,"/r/WorldNews Live Thread: Russian Invasion of Ukraine Day 1209, Part 1 (Thread #1356)",https://www.reddit.com/live/18hnzysb1elcs,0.98,194,0,194
