,subreddit,title,url,upvote_ratio,ups,downs,score
0,worldnews,Trump says he had 'very productive' call with Putin ahead of Zelensky meeting,https://www.reuters.com/world/us/trump-says-he-had-very-productive-call-with-putin-ahead-zelenskiy-meeting-2025-12-28/,0.91,10537,0,10537
1,worldnews,"Putin and Trump do not support European-Ukrainian temporary ceasefire idea, the Kremlin says",https://www.reuters.com/world/china/putin-trump-do-not-support-european-ukrainian-temporary-ceasefire-idea-kremlin-2025-12-28/,0.96,6419,0,6419
2,worldnews,"Iceland Joins Thailand, Philippines, Indonesia, Japan, Bhutan And Other Nations In Curbing Overtourism By Enforcing Strict Visitor Quotas, Fines, And Eco-Conscious Fees To Foster Sustainable Tourism Practices Across The Region",https://www.travelandtourworld.com/news/article/iceland-joins-thailand-philippines-indonesia-japan-bhutan-and-other-nations-in-curbing-overtourism-by-enforcing-strict-visitor-quotas-fines-and-eco-conscious-fees-to-foster-sustainable-tourism-p/,0.97,6141,0,6141
3,worldnews,"Saudi Arabia deports more than 13,000 illegal residents in one week",https://gulfnews.com/world/gulf/saudi-arabia-deports-more-than-13000-illegal-residents-in-one-week-1.500392278,0.95,5936,0,5936
4,worldnews,Israel deploys Iron Beam laser defense system nationwide,https://www.jpost.com/defense-and-tech/article-881595,0.91,3679,0,3679
5,worldnews,China launches large-scale military exercise around Taiwan,https://www.taiwannews.com.tw/news/6272943,0.97,2974,0,2974
6,worldnews,Russia vows to support China if Taiwan contingency flares up: Top diplomat,https://www.straitstimes.com/asia/east-asia/russia-vows-to-support-china-if-taiwan-contingency-flares-up-top-diplomat,0.95,1999,0,1999
7,worldnews,"'We have the makings of a deal,' Trump says after welcoming Zelenskyy",https://www.euronews.com/2025/12/28/a-lot-can-be-decided-before-the-new-year-zelenskyy-said-before-meeting-trump,0.89,1675,0,1675
8,worldnews,Taiwan welcomes Israel's decision to formally recognize Somaliland,https://focustaiwan.tw/politics/202512280007,0.91,1497,0,1497
9,worldnews,Ukraine and Russia announce temporary ceasefire on territory of Zaporizhzhia Nuclear Power Plant,https://www.pravda.com.ua/eng/news/2025/12/28/8013698/,0.97,1473,0,1473
10,worldnews,NATO secretary general says Trump is only one who can force Putin to make peace,https://www.pravda.com.ua/eng/news/2025/12/28/8013741/,0.89,1111,0,1111
11,worldnews,"Ukrainian experts join practising NATO Article 5 mechanisms for first time, Ukrainian General Staff reports",https://www.pravda.com.ua/eng/news/2025/12/28/8013736/,0.97,1041,0,1041
12,worldnews,UK and Germany sign $70 million joint deal for mobile artillery systems,https://www.reuters.com/business/aerospace-defense/uk-germany-sign-70-million-joint-deal-mobile-artillery-systems-2025-12-28/,0.97,909,0,909
13,worldnews,"In 2025, melting sea ice allowed a Canadian icebreaker to enter the world's last ice area | CBC News",https://www.cbc.ca/news/canada/north/canadian-icebreaker-last-sea-ice-tuvaijuittuq-9.7025887,0.94,798,0,798
14,worldnews,Taliban's cooperation allows Switzerland to deport Afghan criminals,https://www.swissinfo.ch/eng/various/switzerland-deports-another-afghan-back-home/90697555,0.96,711,0,711
15,worldnews,Putin says Russia will achieve its Ukraine aims by force if Kyiv doesn't want peace,https://www.cnbc.com/2025/12/28/putin-russia-will-achieve-ukraine-aims-by-force-if-kyiv-doesnt-want-peace.html,0.91,622,0,622
16,worldnews,"Maritime archaeologists in Denmark reveal the discovery of the world’s largest cog, a medieval cargo ship",https://www.vikingeskibsmuseet.dk/en/news/archaeologists-reveal-a-medieval-super-ship-its-the-worlds-largest-cog,0.97,376,0,376
17,worldnews,At least 13 dead in Mexico after train derails,https://www.reuters.com/world/americas/least-13-dead-after-train-derails-mexico-2025-12-29/,0.95,374,0,374
18,worldnews,Bangladesh's student-led party allies with Islamists ahead of election,https://www.reuters.com/world/asia-pacific/bangladeshs-student-led-party-allies-with-islamists-ahead-election-2025-12-28/,0.94,355,0,355
19,worldnews,Zelenskyy: Any Territorial Deal Must Be Decided by Ukrainians Themselves,https://united24media.com/latest-news/zelenskyy-any-territorial-deal-must-be-decided-by-ukrainians-themselves-14608,0.98,242,0,242
20,worldnews,China announces major military drills around Taiwan in ‘serious warning’ against any push for independence,https://www.cnn.com/2025/12/28/china/china-taiwan-military-drills-hnk-intl,0.93,184,0,184
21,worldnews,"'US-Ukraine security guarantees 100% agreed', Zelenskyy says after meeting with Trump",https://www.euronews.com/2025/12/28/us-ukraine-security-guarantees-100-agreed-zelenskyy-says-after-meeting-with-trump,0.95,164,0,164
22,worldnews,Brazil's ex-President Bolsonaro undergoes medical treatment for hiccups,https://www.bbc.com/news/articles/c3r7ge7937qo,0.9,148,0,148
23,worldnews,"/r/WorldNews Live Thread: Russian Invasion of Ukraine Day 1404, Part 1 (Thread #1551)",https://www.reddit.com/live/18hnzysb1elcs,0.99,140,0,140
24,worldnews,EU warns of possible action after the US bars 5 Europeans accused of censorship,https://apnews.com/article/europe-breton-tech-visa-ban-censorship-rubio-8608c3781b67958abb92e4781d73aed9,0.94,69,0,69
