,subreddit,title,url,upvote_ratio,ups,downs,score
0,worldnews,Putin Scrambles as Ukrainian Forces Near Russian Nuclear Plant,https://www.thedailybeast.com/putin-scrambles-as-ukraine-launches-stunning-incursion-into-russia,0.95,26240,0,26240
1,worldnews,Russians flee for Moscow amid Ukraine border attack: ‘it has to be stopped’,https://www.scmp.com/news/world/russia-central-asia/article/3273978/russians-flee-moscow-amid-ukraine-border-attack-it-has-be-stopped?module=top_story&amp;pgtype=homepage,0.93,26112,0,26112
2,worldnews,Ukrainian Incursion May Have Expanded to Two Russian Regions,https://www.kyivpost.com/post/37198,0.96,9316,0,9316
3,worldnews,Report: Jordan to allows Israel to use its airspace against Iran - i24NEWS,https://www.i24news.tv/en/news/middle-east/artc-report-jordan-to-allows-israel-to-use-its-airspace-against-iran,0.92,5940,0,5940
4,worldnews,Russia fighting intense battles against major Ukrainian incursion,https://www.reuters.com/world/europe/russia-imposes-security-regime-three-border-regions-after-major-ukrainian-attack-2024-08-10/,0.98,5544,0,5544
5,worldnews,"Finland drafting bill to prevent Russian citizens buying Finnish properties, Defence Minister say",https://yle.fi/a/74-20104223,0.98,5319,0,5319
6,worldnews,Frontline report: Official Russian statements hint at possible withdrawal from Vovchansk - Euromaidan Press,https://euromaidanpress.com/2024/08/10/frontline-report-official-russian-statements-hint-at-possible-withdrawal-from-vovchansk/,0.98,4390,0,4390
7,worldnews,White House “deeply concerned” about civilian casualties after the IDF said it had struck a command room that terror operatives set up at a Gaza City school where displaced Palestinian civilians were sheltering,https://www.timesofisrael.com/liveblog_entry/white-house-deeply-concerned-about-civilian-casualties-in-idf-strike-on-terror-operatives-at-gaza-school/,0.84,3184,0,3184
8,worldnews,"'Many' Russian soldiers captured in Kursk Oblast battles, Ukraine's state project claims",https://kyivindependent.com/many-russian-soldiers-allegedly-captured-in-kursk-oblast/,0.97,2942,0,2942
9,worldnews,"Iran attack on Israel could last 3-4 days, says Iranian official",https://m.jpost.com/breaking-news/article-814169,0.91,2638,0,2638
10,worldnews,Settlers hold gun to 3-year-old's head in attack on Arab-Israeli family in West Bank,https://www.jpost.com/israel-news/article-814118,0.8,2500,0,2500
11,worldnews,Signal has been blocked by Venezuela and Russia,https://www.theverge.com/2024/8/9/24217008/signal-blocked-venezuela-russia,0.97,2446,0,2446
12,worldnews,"Russia’s Medvedev Threatens with Tanks in Berlin, Despite Them Already Being Present in Germany",https://united24media.com/latest-news/russias-medvedev-threatens-with-tanks-in-berlin-despite-them-already-being-present-in-germany-1675,0.95,2158,0,2158
13,worldnews,"Amid global criticism, Israel names 19 it says it killed in terror HQ at Gaza school",https://www.timesofisrael.com/israel-slammed-globally-after-hamas-claims-at-least-90-dead-in-strike-on-gaza-school/,0.83,1815,0,1815
14,worldnews,Even Switzerland Is Discussing How to Tax the Super-Rich,https://www.bloomberg.com/news/articles/2024-08-07/switzerland-debates-higher-inheritance-tax-on-billionaires,0.95,1640,0,1640
15,worldnews,Ukraine's Zelenskiy suggests moves towards banning Orthodox church with Moscow ties,https://www.reuters.com/world/europe/ukraines-zelenskiy-suggests-moves-towards-banning-orthodox-church-with-moscow-2024-08-10/,0.97,1443,0,1443
16,worldnews,MFA: Israel can no longer trust Norway as a partner on the Palestinian issue ,https://www.jpost.com/breaking-news/article-814153,0.8,1115,0,1115
17,worldnews,UK agency urges social media companies to crack down on violent rhetoric,https://thehill.com/policy/technology/4818953-uk-social-media-elon-musk-x-misinformation/,0.89,752,0,752
18,worldnews,"Updated: 700 bombs destroyed in Ukrainian strike against Russia's Lipetsk airbase, source says",https://kyivindependent.com/military-airfield-energy-facility-damaged-in-reported-drone-strike-in-russias-lipetsk-oblast/,0.99,634,0,634
19,worldnews,Tensions rise as Russia deploys nuclear weapons in Kaliningrad,https://www.westernpost.ng/tensions-rise-as-russia-deploys-nuclear-weapons-in-kaliningrad/,0.76,577,0,577
20,worldnews,UK: 100 famine deaths per day in Sudan,https://sudanwarmonitor.com/p/uk-100-famine-deaths-per-day-in-sudan,0.96,494,0,494
21,worldnews,"/r/WorldNews Live Thread: Russian Invasion of Ukraine Day 899, Part 1 (Thread #1046)",https://www.reddit.com/live/18hnzysb1elcs,0.97,395,0,395
22,worldnews,"Ukraine pushing war into 'aggressor's territory,' Zelensky says",https://kyivindependent.com/ukraine-pushing-war-into-aggressors-territory-zelensky-says/,0.96,207,0,207
23,worldnews,"Belarus boosts troops at border, summons diplomat after accusing Ukraine of airspace violation",https://www.reuters.com/world/europe/belarus-boosts-troops-border-summons-diplomat-after-accusing-ukraine-airspace-2024-08-10/,0.89,131,0,131
24,worldnews,Venezuela's top court says opposition failed to submit proof in election dispute,https://www.reuters.com/world/americas/venezuelas-top-court-says-opposition-failed-submit-proof-election-dispute-2024-08-10/,0.9,128,0,128
25,worldnews,"Russian attack on Kyiv Oblast kills 2, including 4-year-old boy",https://kyivindependent.com/attacks-draft/,0.94,68,0,68
26,worldnews,/r/WorldNews Live Thread for Israel-Hamas War (Thread #62),https://www.reddit.com/live/1bsso361afr0r,0.71,49,0,49
