,subreddit,title,url,upvote_ratio,ups,downs,score
0,worldnews,Iran Officially Confirms Military Support From Russia And China In War Against the US,https://united24media.com/latest-news/iran-officially-confirms-military-support-from-russia-and-china-in-war-against-the-us-16882,0.95,41181,0,41181
1,worldnews,Taiwan reports large-scale Chinese military aircraft presence near island,https://www.politico.com/news/2026/03/15/taiwan-reports-large-scale-chinese-military-aircraft-presence-near-island-00829219,0.94,20386,0,20386
2,worldnews,Trump warns NATO faces a “bad future” if allies fail to help US in Iran,https://www.reuters.com/world/china/trump-warns-nato-faces-very-bad-future-if-allies-fail-help-us-iran-ft-reports-2026-03-16/,0.94,10579,0,10579
3,worldnews,Iran threatens to escalate war after Trump says ‘many countries’ will send warships to strait of Hormuz,https://www.theguardian.com/world/2026/mar/13/trump-military-kharg-island-iran-oil-export,0.97,5453,0,5453
4,worldnews,Putin Adviser Told Macron Envoys to “Go to Hell” Over Europe’s Seat at Ukraine Peace Talks,https://united24media.com/latest-news/putin-adviser-told-macron-envoys-to-go-to-hell-over-europes-seat-at-ukraine-peace-talks-16879,0.98,4875,0,4875
5,worldnews,"Trump demands others help secure Strait of Hormuz, Japan and Australia say no plans to send ships",https://www.reuters.com/business/energy/trump-demands-others-help-secure-strait-hormuz-japan-australia-say-no-plans-send-2026-03-16/?utm_medium=Social&amp;utm_source=twitter,0.98,4533,0,4533
6,worldnews,'Not very bright': US intel. shows Khamenei was unsure of his son replacing him as leader,https://www.jpost.com/middle-east/iran-news/article-890011,0.9,3956,0,3956
7,worldnews,"Zelenskiy says Ukraine wants money, technology in return for Middle East drone help",https://www.reuters.com/business/aerospace-defense/zelenskiy-says-ukraine-wants-money-technology-return-middle-east-drone-help-2026-03-15/,0.96,3767,0,3767
8,worldnews,Australia rejects role in Strait of Hormuz amid ship strikes,https://thenightly.com.au/world/middle-east/catherine-king-matt-thistlethwaite-australia-rejects-naval-role-in-strait-of-hormuz-amid-iran-tanker-threats-c-21955744,0.98,3172,0,3172
9,worldnews,"US officials predict quick end to Iran war, while Tehran says it can outlast foes",https://www.reuters.com/world/middle-east/trump-calls-allies-help-secure-strait-hormuz-iran-vows-step-up-retaliation-2026-03-15/,0.96,2158,0,2158
10,worldnews,"UK needs nuclear deterrent independent from US, Ed Davey to say",https://www.theguardian.com/politics/2026/mar/15/uk-needs-nuclear-deterrent-independent-from-us-ed-davey-to-say,0.97,1907,0,1907
11,worldnews,Orban’s Election Campaign Turns to Russia for Help in Final Stretch,https://www.bloomberg.com/news/articles/2026-03-14/orban-s-election-campaign-turns-to-russia-for-help-in-final-stretch,0.96,1540,0,1540
12,worldnews,Iran women’s football captain withdraws Australia asylum bid,https://www.news.com.au/sport/football/iran-womens-football-captain-withdraws-australia-asylum-bid/news-story/b2480ab702c46ef29542514f989fcedd,0.94,1443,0,1443
13,worldnews,"'We never asked for a ceasefire,' says Iran's foreign minister, as war keeps raging",https://www.npr.org/2026/03/15/nx-s1-5748472/us-military-six-killed-iran-war,0.97,1219,0,1219
14,worldnews,Japan Defense Minister Says No Plans to Send Ships to Hormuz,https://www.bloomberg.com/news/articles/2026-03-16/japan-defense-minister-says-no-plans-to-send-ships-to-hormuz,0.98,1107,0,1107
15,worldnews,Emirates suspends all flights from Dubai,https://www.timeoutdubai.com/news/emirates-suspends-dubai-flights-march-2026,0.98,1013,0,1013
16,worldnews,Iran says Israeli strikes on Tehran fuel depots constitute 'ecocide',https://www.bssnews.net/international/369240,0.86,970,0,970
17,worldnews,"Iran arrests 500 accused of giving information to enemies, police chief says",https://www.reuters.com/world/middle-east/iran-arrests-dozens-people-accused-being-informants-israel-2026-03-15/,0.92,789,0,789
18,worldnews,Top Trump adviser says Iran war price tag at $12bn so far,https://www.aljazeera.com/news/2026/3/15/top-trump-advisor-says-iran-war-price-tag-at-approximately-12bn-so-far,0.95,788,0,788
19,worldnews,Oil company shares soar to all-time highs as Middle East war turbocharges price per barrel,https://www.theguardian.com/business/2026/mar/15/oil-company-shares-soar-to-all-time-highs-as-middle-east-war-turbocharges-price-per-barrel,0.97,687,0,687
20,worldnews,Fire breaks out in vicinity of Dubai International Airport after drone attack,https://www.thehindu.com/news/international/fire-breaks-out-in-vicinity-of-dubai-international-airport-after-drone-attack/article70748464.ece,0.97,670,0,670
21,worldnews,/r/WorldNews Discussion Thread: US and Israel launch attack on Iran; Iran retaliates (Thread #8),https://www.reddit.com/r/worldnews/comments/1rrykbx/rworldnews_discussion_thread_us_and_israel_launch/,0.91,261,0,261
22,worldnews,"/r/WorldNews Live Thread: Russian Invasion of Ukraine Day 1481, Part 1 (Thread #1628)",https://www.reddit.com/live/18hnzysb1elcs,0.98,154,0,154
23,worldnews,Trump signals possible delay to Beijing summit as U.S. pressures China to help reopen Strait of Hormuz,https://www.cnbc.com/2026/03/16/trump-possible-delay-beijing-summit-china-iran-strait-of-hormuz-.html,0.92,147,0,147
24,worldnews,Iran says Russia and China providing ‘military cooperation’,https://www.politico.eu/article/iran-abbas-araghchi-says-russia-and-china-providing-military-cooperation/,0.96,138,0,138
