,subreddit,title,url,upvote_ratio,ups,downs,score
0,worldnews,"IDF rescues hostages Noa Argamani, Andrey Kozlov, Shlomi Ziv, and Almog Meir",https://www.jpost.com/breaking-news/article-805424,0.8,18957,0,18957
1,worldnews,Russia Declares US As Enemy State For First Time Amid Deteriorating Ties Over Ukraine,https://www.india.com/news/world/russia-declares-us-as-enemy-state-for-first-time-in-diplomatic-history-amid-deteriorating-ties-over-ukraine-6996573/,0.95,18247,0,18247
2,worldnews,'We will not surrender': Hamas leader Ismail Haniyeh fumes after Israel frees hostages,https://www.jpost.com/breaking-news/article-805433,0.87,8457,0,8457
3,worldnews,Norway wealth fund to vote against Musk's $56 billion Tesla pay package,https://www.reuters.com/technology/norway-wealth-fund-vote-against-musks-56-bln-tesla-pay-package-2024-06-08/,0.97,6651,0,6651
4,worldnews,Putin Is Running Out of Time to Achieve Breakthrough in Ukraine,https://www.bloomberg.com/news/articles/2024-06-08/putin-is-running-out-of-time-to-achieve-breakthrough-in-ukraine,0.94,5657,0,5657
5,worldnews,IDF successfully eliminates senior Hamas General Security Forces commander,https://www.jpost.com/breaking-news/article-805392,0.91,5115,0,5115
6,worldnews,"35 children among those killed in latest Sudan civil war carnage, U.N. says",https://www.cbsnews.com/amp/news/sudan-civil-war-army-alleges-rsf-massacre-in-wad-al-noora/,0.96,3950,0,3950
7,worldnews,Putin says he’s considering providing weapons to other nations for potential strikes on Western targets,https://www.yahoo.com/news/putin-says-considering-providing-weapons-152148997.html,0.92,3568,0,3568
8,worldnews,Hostages held alongside families in adjacent buildings | new details and first footage,https://www.ynetnews.com/article/bycfb11gbr#autoplay,0.92,3537,0,3537
9,worldnews,American unit assisted in hostage rescue operation - report,https://jpost.com/breaking-news/article-805434,0.92,2317,0,2317
10,worldnews,IDF publishes footage of rescued hostages being evacuated from Gaza via helicopter,https://m.jpost.com/breaking-news/article-805441,0.91,2300,0,2300
11,worldnews,UN confirms 11 staff detained by Houthis in Yemen,https://www.bbc.com/news/articles/cgxxlgevevwo,0.96,1902,0,1902
12,worldnews,Suspected Islamists kill at least 10 in attack on eastern Congo village,https://www.reuters.com/world/africa/suspected-islamists-kill-least-10-attack-eastern-congo-village-2024-06-08/,0.94,1773,0,1773
13,worldnews,Israel condemns UN move to blacklist IDF for harming children,https://www.bbc.com/news/articles/c8883ndp2lko,0.85,1245,0,1245
14,worldnews,"In abrupt crackdown, Yemen's Houthis seize UN staffers, aid workers",https://www.timesofisrael.com/in-abrupt-crackdown-yemens-houthis-seize-un-staffers-aid-workers/,0.95,1170,0,1170
15,worldnews,U.S. intelligence aided Israeli hostage rescue,https://www.washingtonpost.com/national-security/2024/06/08/us-intelligence-israeli-hostage-rescue-gaza/,0.92,1005,0,1005
16,worldnews,Japan to sign agreement with Ukraine for long-term support,https://english.kyodonews.net/news/2024/06/c4b85c34a3d7-japan-to-sign-agreement-with-ukraine-for-long-term-support.html,0.97,845,0,845
17,worldnews,Polish police at Belarus border ordered to carry guns amid “growing aggression” from migrants,https://notesfrompoland.com/2024/06/07/polish-police-at-belarus-border-ordered-to-carry-guns-amid-growing-aggression-from-migrants/,0.97,793,0,793
18,worldnews,"Ukraine has purchased a second air defense system from France
",https://odessa-journal.com/ukraine-has-purchased-a-second-air-defense-system-from-france,0.97,587,0,587
19,worldnews,Putin’s daughters make rare appearance at St. Petersburg economic forum,https://www.cnn.com/2024/06/08/world/putins-daughters-rare-appearance-st-petersburg-intl/index.html,0.9,582,0,582
20,worldnews,"Javan rhino poacher gets 12 years in record sentence for wildlife crime in Indonesia
",https://news.mongabay.com/2024/06/javan-rhino-poacher-gets-12-years-in-record-sentence-for-wildlife-crime-in-indonesia/,0.98,556,0,556
21,worldnews,U.S. says Congo hasn't given it access to Americans detained over alleged roles in coup attempt,https://apnews.com/article/congo-coup-attempt-americans-prisoners-177081dd1e130df07ca217fba8235b8d,0.95,397,0,397
22,worldnews,"Russian Airport Invests in Anti-Drone Defenses – 7,000 Kilometers from Ukraine",https://www.kyivpost.com/post/33971,0.93,345,0,345
23,worldnews,"Samsung Workers Strike, the First in the Company’s History",https://www.nytimes.com/2024/06/06/business/samsung-first-strike-chips.html?campaign_id=9&amp;emc=edit_nn_20240607&amp;instance_id=125647&amp;nl=the-morning&amp;regi_id=53831380&amp;segment_id=168967&amp;te=1&amp;user_id=fe5d662adf685ae9dedd7464c832fcdf,0.96,258,0,258
24,worldnews,"/r/WorldNews Live Thread: Russian Invasion of Ukraine Day 837, Part 1 (Thread #983)",https://www.reddit.com/live/18hnzysb1elcs,0.96,129,0,129
25,worldnews,'Only half Chinese': China refused to help secure release of Noa Argamani,https://www.ynetnews.com/article/bjx7jxgbc,0.79,46,0,46
26,worldnews,/r/WorldNews Live Thread for Israel-Hamas War (Thread #53),https://www.reddit.com/live/1bsso361afr0r,0.79,8,0,8
