,subreddit,title,url,upvote_ratio,ups,downs,score
0,worldnews,"US decides to rejoin UNESCO and pay back dues, to counter Chinese influence",https://apnews.com/article/unesco-us-rejoin-palestine-china-5b7849bd2cae966e4e9837380c0c094f,0.86,22925,0,22925
1,worldnews,Zelenskyy signs law recognising 8 May as Day of Remembrance and Victory over Nazism,https://www.pravda.com.ua/eng/news/2023/06/12/7406493/,0.85,18168,0,18168
2,worldnews,"Ukraine loses 16 US-made armored vehicles, group says, but Kyiv's forces still gain territory | CNN",https://www.cnn.com/2023/06/12/europe/ukraine-offensive-battlefield-losses-progress-intl-hnk-ml/index.html,0.9,10717,0,10717
3,worldnews,"Canada to help Ukraine with another $500M and weapons, Trudeau says - National",https://globalnews.ca/news/9760011/justin-trudeau-ukraine-surprise-visit-2023/,0.92,6543,0,6543
4,worldnews,Ex-Samsung exec charged with stealing trade secrets to create copycat chip factory in China,https://apnews.com/article/korea-samsung-china-copycat-semiconductor-bfdf3ad9f817f646d0d47294f62e334f,0.95,5673,0,5673
5,worldnews,Israel to provide clean water and food to Ukraine amid Kherson flooding,https://www.i24news.tv/en/news/international/ukraine-russia-war/1686569741-israel-to-provide-clean-water-and-food-to-ukraine-amid-kherson-flooding,0.91,5011,0,5011
6,worldnews,"US, Japan, Taiwan Agree to Share Real-Time Drone Intel",https://www.thedefensepost.com/2023/06/09/us-japan-taiwan-drone-intel/amp/,0.96,3900,0,3900
7,worldnews,Ukraine Accuses Russia Of Blowing Up Another Dam,https://www.thedrive.com/the-war-zone/ukraine-accuses-russia-of-blowing-up-another-dam,0.93,3574,0,3574
8,worldnews,"Nearly half the world's biggest companies have pledged to erase their carbon footprints by around mid-century, but only a handful have credible game plans for doing so, climate policy research groups said",https://www.france24.com/en/live-news/20230612-climate-corporate-net-zero-pledges-lack-credibility,0.94,3531,0,3531
9,worldnews,Scoop: Israel to announce plans for thousands of new settlement units in West Bank,https://www.axios.com/2023/06/12/israel-west-bank-settlement-units-announcement-netanyahu,0.89,3127,0,3127
10,worldnews,Billion-year-old rocks reveal traces of ancient life | CNN,https://edition.cnn.com/2023/06/12/world/organic-compounds-eukaryotes-ancient-rocks-discovery-scn/index.html,0.95,2966,0,2966
11,worldnews,White House: US shared concerns with Cuba about hosting China spy base,https://www.reuters.com/world/white-house-us-shared-concerns-with-cuba-about-hosting-china-spy-base-2023-06-12/,0.94,2048,0,2048
12,worldnews,Scouts: Millions paid out in child abuse settlements due to poor safeguarding,https://www.bbc.co.uk/news/uk-65881603,0.95,1905,0,1905
13,worldnews,Russell Brown steps down from Supreme Court after probe launched into misconduct claim,https://www.cbc.ca/news/politics/russell-brown-supreme-court-justice-resigns-1.6873402,0.94,1889,0,1889
14,worldnews,"Australia's Bushmasters to play 'huge role' in Ukrainian counteroffensive against Russia, troops say",https://www.abc.net.au/news/2023-06-13/bushmasters-changing-the-battlefield-in-ukraine/102471094,0.93,1763,0,1763
15,worldnews,"China aircraft monitored US, France, Japan, Canada navy drill in Pacific waters east of Taiwan",https://www.reuters.com/world/chinese-aircraft-monitored-us-france-canada-japan-naval-drill-global-times-2023-06-12/?taid=6486c737cf93b30001ec4358&amp;utm_campaign=trueAnthem:+Trending+Content&amp;utm_medium=trueAnthem&amp;utm_source=twitter,0.89,1455,0,1455
16,worldnews,Extremely dry spring leaves southern Albertan farmers on the road to ‘zero production’,https://globalnews.ca/news/9761043/dry-spring-southern-albertan-farmers-zero-production/,0.95,1341,0,1341
17,worldnews,Philippine senators say US should pay to use its military bases,https://asianews.network/us-should-pay-for-using-philippine-bases-senators/,0.92,1038,0,1038
18,worldnews,Pakistan paid in Chinese currency for discounted Russian oil- minister,https://www.reuters.com/markets/commodities/pakistans-russian-crude-shipment-paid-chinese-currency-minister-2023-06-12/,0.91,938,0,938
19,worldnews,"/r/WorldNews Live Thread: Russian Invasion of Ukraine Day 475, Part 1 (Thread #616)",https://www.reddit.com/live/18hnzysb1elcs,0.94,517,0,517
20,worldnews,Destruction of Kakhovka Hydroelectric Power Plant: Crimea will not receive water for at least a year,https://www.pravda.com.ua/eng/news/2023/06/12/7406561/,0.95,453,0,453
21,worldnews,State of emergency around fuel tanker crash site in Russia's Irkutsk region - governor,https://www.reuters.com/world/europe/state-emergency-around-fuel-tanker-crash-site-russias-irkutsk-region-governor-2023-06-13/,0.94,437,0,437
22,worldnews,India: Police book man for using muslim king's image as WhatsApp profile picture,https://m.timesofindia.com/city/navi-mumbai/aurangzeb-on-w/a-profile-pic-gets-maharashtra-man-detained/amp_articleshow/100921415.cms,0.84,418,0,418
23,worldnews,"India threatened to shut down Twitter and raid employees' homes, Jack Dorsey says",https://techcrunch.com/2023/06/12/india-twitter-jack-dorsey/,0.93,406,0,406
24,worldnews,Iceland becomes latest country to ban conversion therapy,https://www.washingtonblade.com/2023/06/12/iceland-becomes-latest-country-to-ban-conversion-therapy/,0.92,214,0,214
25,worldnews,China Tells Last Indian Journalist in Nation to Leave This Month,https://www.bloomberg.com/news/articles/2023-06-12/china-tells-last-indian-journalist-in-nation-to-leave-this-month,0.9,200,0,200
