,subreddit,title,url,upvote_ratio,ups,downs,score
0,worldnews,King Charles praises Nato and urges defence of Ukraine in key speech during Trump visit,https://www.theguardian.com/uk-news/2026/apr/28/king-charles-speech-congress,0.97,16853,0,16853
1,worldnews,UAE announces it will leave Opec,https://www.thenationalnews.com/business/2026/04/28/uae-announces-it-will-leave-opec/,0.97,15856,0,15856
2,worldnews,Greece to ban anonymity on social media,https://www.euractiv.com/news/greece-to-ban-anonymity-on-social-media/,0.96,13986,0,13986
3,worldnews,Kim Jong Un Confirms Soldier ‘Self-Blasting’ Policy in Ukraine,https://www.bloomberg.com/news/articles/2026-04-28/kim-jong-un-confirms-soldier-self-blasting-policy-in-ukraine,0.96,5717,0,5717
4,worldnews,"US ambassador to Ukraine to step down over differences with Trump, FT reports",https://www.reuters.com/world/europe/us-ambassador-ukraine-step-down-over-differences-with-trump-ft-reports-2026-04-28/,0.98,4605,0,4605
5,worldnews,"Australia moves to tax Meta, Google and TikTok to fund newsrooms",https://apnews.com/article/australia-tax-meta-google-tiktok-journalism-8022cacf561f2fc254999b04346eac87,0.98,4285,0,4285
6,worldnews,BP profits more than double as Iran war sends oil prices higher,https://bbc.com/news/articles/c2eveyvgn9no,0.98,3151,0,3151
7,worldnews,Ukraine hammers Russian Black Sea oil facilities,https://www.politico.eu/article/ukraine-bombs-russias-oil-export-hub-in-tuapse-on-the-black-sea-again/,0.98,2900,0,2900
8,worldnews,Ukraine says Israeli buying of 'stolen' grain from Russia not 'legitimate',https://www.reuters.com/world/europe/israels-purchase-stolen-ukrainian-grain-is-not-legitimate-zelenskiy-says-2026-04-28/,0.94,2810,0,2810
9,worldnews,UK ambassador said America’s only ‘special relationship’ is with Israel: Report,https://thehill.com/policy/international/5853042-uk-ambassador-special-relationship/,0.93,2379,0,2379
10,worldnews,"Hungary's Magyar proposes meeting Zelensky in Ukraine, seeks reset in ties",https://kyivindependent.com/magyar-wants-to-meet-zelensky-in-ukraine-discuss-hungarian-minority/,0.98,2182,0,2182
11,worldnews,"Ukraine says it shot down 33,000 Russian drones in March, a monthly record",https://apnews.com/article/russia-ukraine-war-drone-attacks-oil-06edbc9666fe0681fa0930affc475e9b,0.98,1738,0,1738
12,worldnews,Russian 'shadow fleet' undeterred by Starmer's threat as nearly 100 ships cross UK waters,https://www.reuters.com/world/uk/russian-shadow-fleet-undeterred-by-starmers-threat-nearly-100-ships-cross-uk-2026-04-28/,0.97,1392,0,1392
13,worldnews,EU says it has approached Israel over Russian grain boat that docked in Haifa,https://www.reuters.com/world/middle-east/eu-says-it-has-approached-israel-over-russian-grain-boat-that-docked-haifa-2026-04-28/,0.93,884,0,884
14,worldnews,"Canadian PM Carney Liberals launching new skilled training strategy, deficit projected at $65.3B",https://www.ctvnews.ca/politics/article/carney-liberals-launching-new-skilled-training-strategy-deficit-projected-at-653b/,0.9,592,0,592
15,worldnews,UK passes bill that will eventually ban cigarette purchases,https://www.thecanadianpressnews.ca/health/uk-passes-bill-that-will-eventually-ban-cigarette-purchases/article_ff106e1b-a341-5706-b020-20ed90c9e4a1.html,0.91,561,0,561
16,worldnews,"Chechen political figure says ‘honor killings’ are a private family matter, calls LGBTQ+ people ‘outcasts and perverts’",https://meduza.io/en/feature/2026/04/29/chechen-political-figure-says-honor-killings-are-a-private-family-matter-calls-lgbtq-people-outcasts-and-perverts,0.93,552,0,552
17,worldnews,"European airlines will fail if jet fuel costs stay high, Ryanair CEO says",https://www.politico.eu/article/ryanair-chief-warns-europe-airline-failures-jet-fuel-costs-spike/,0.92,491,0,491
18,worldnews,Ukraine Signs 10-Year Defense Export Deals With 3 Middle East Countries,https://www.kyivpost.com/post/74292,0.98,468,0,468
19,worldnews,/r/WorldNews Discussion Thread: US and Israel launch attack on Iran; Iran retaliates (Thread #16),https://www.reddit.com/r/worldnews/comments/1son2zz/rworldnews_discussion_thread_us_and_israel_launch/,0.95,260,0,260
20,worldnews,"Russia ships India’s fourth S-400 system, to be deployed by May end",https://www.hindustantimes.com/india-news/russia-ships-india-s-fourth-s-400-system-to-be-deployed-by-may-end-exclusive-101777358791952.html,0.89,184,0,184
21,worldnews,Ukraine accuses Israel of aiding Russian trade in stolen grain | CNN,https://www.cnn.com/2026/04/28/europe/ukraine-israel-russian-stolen-grain-latam-intl,0.88,165,0,165
22,worldnews,"/r/WorldNews Live Thread: Russian Invasion of Ukraine Day 1525, Part 1 (Thread #1672)",https://www.reddit.com/live/18hnzysb1elcs,0.96,160,0,160
23,worldnews,"Russia Cuts Tanks, Missiles From Putin’s WWII Parade in First Since 2007",https://www.bloomberg.com/news/articles/2026-04-29/russia-cuts-tanks-missiles-from-putin-s-wwii-victory-parade-in-first-since-2007,0.98,159,0,159
24,worldnews,First tankers clear Strait of Hormuz amid easing tensions,https://gulfnews.com/world/mena/oil-lifeline-first-tankers-slip-through-hormuz-strait-1.500522534,0.85,114,0,114
