,subreddit,title,url,upvote_ratio,ups,downs,score
0,worldnews,"Ottawa freezes Tesla’s $43-million rebate payments, bars it from future rebates because of tariffs",https://www.thestar.com/news/canada/ottawa-freezes-tesla-s-43-million-rebate-payments-bars-it-from-future-rebates-because-of/article_d93ae97a-944c-41c6-bae0-63e905050d87.html,0.96,36368,0,36368
1,worldnews,"The United States puts unacceptable pressure on Greenland, Denmark says",https://www.reuters.com/world/united-states-is-putting-unacceptable-pressure-greenland-danish-pm-says-2025-03-25/,0.95,29713,0,29713
2,worldnews,"Trump Unveils Black Sea Deal With Russia, Ukraine",https://www.newsweek.com/trump-unveils-black-sea-deal-russia-ukraine-2049953,0.93,22941,0,22941
3,worldnews,"Russia abducting Ukrainian kids to ‘turn them into Russians,’ says report",https://tvpworld.com/85797256/russia-abducting-ukrainian-children-to-forcibly-turn-them-into-russians-says-report,0.96,14258,0,14258
4,worldnews,"Netherlands tightens U.S. travel warning, especially for LGBTQ visitors",https://nltimes.nl/2025/03/25/netherlands-tightens-us-travel-warning-especially-lgbtq-visitors,0.96,12153,0,12153
5,worldnews,Ukraine has handed over a list of objects that cannot be struck - Zelensky,https://unn.ua/en/news/ukraine-has-handed-over-a-list-of-objects-that-cannot-be-struck-zelensky,0.98,9773,0,9773
6,worldnews,Canadian intelligence reports India backed Poilievre’s Conservative leadership bid,https://www.theglobeandmail.com/politics/article-india-alleged-foreign-interference-pierre-poilievre-conservative/,0.96,9013,0,9013
7,worldnews,"Russia ""managed to influence"" people in White House—Zelensky",https://www.newsweek.com/russia-managed-influence-people-white-housezelensky-2050205,0.98,8517,0,8517
8,worldnews,UK spies fears intelligence leaks after Trump team blunder: UK intelligence sources say higher restrictions are now likely to be placed on intelligence material sent to US counterparts as a growing distrust clouds the 'special relationship',https://inews.co.uk/news/uk-spies-intelligence-leaks-trump-blunder-3604544,0.99,7691,0,7691
9,worldnews,"‘A serious, serious issue’: Canada’s Carney jabs Trump admin after war plans leak fiasco",https://www.politico.eu/article/serious-issue-canada-mark-carney-jab-donald-trump-admin-after-war-plan-leak-fiasco/,0.99,6686,0,6686
10,worldnews,Hundreds of Gazans march in rare anti-Hamas protest,https://www.jpost.com/middle-east/article-847577,0.95,6485,0,6485
11,worldnews,Vance to accompany wife to Greenland amid backlash,https://thehill.com/homenews/administration/5213452-vance-travels-greenland,0.94,5955,0,5955
12,worldnews,"US war plans leak shows Five Eyes allies must ‘look out for ourselves’, says Mark Carney",https://www.theguardian.com/us-news/2025/mar/25/trump-signal-leak-reaction-canada-five-eyes,0.98,3850,0,3850
13,worldnews,Danish PM condemns Trump team over imminent Greenland visit,https://www.politico.eu/article/donald-trump-greenland-visit-mette-frederiksen-denmark-condemns/,0.97,3411,0,3411
14,worldnews,"Less than 1 in 5 favor US annexing Canada, Greenland: Survey",https://thehill.com/homenews/administration/5214199-less-than-1-in-5-favor-us-annexing-canada-greenland-survey/,0.96,3392,0,3392
15,worldnews,"Russian threat in Europe 'not theoretical,' says French foreign minister",https://www.lemonde.fr/en/international/article/2025/03/25/russian-threat-in-europe-not-theoretical-france-fm_6739509_4.html,0.98,2608,0,2608
16,worldnews,Carney says we must 'look out for ourselves' in wake of U.S. intelligence leak on Yemen strike,https://www.cbc.ca/news/politics/carney-intelligence-yemen-strike-1.7492736,0.98,2605,0,2605
17,worldnews,U.S. plan to restore Russian fertilizer market funds Ukrainian death: Premier Moe | Globalnews.ca,https://globalnews.ca/news/11097875/premier-moe-says-white-houses-plan-to-restore-russian-fertilizer-market-disturbing/,0.96,1498,0,1498
18,worldnews,Chinese EV giant BYD overtakes Tesla with annual sales topping $100 billion US,https://www.cbc.ca/news/business/byd-tesla-electric-vehicles-sales-1.7492504,0.97,1236,0,1236
19,worldnews,Trump has blown up the world order - and left Europe's leaders scrabbling,https://www.bbc.co.uk/news/articles/c2er9j83x0zo,0.87,491,0,491
20,worldnews,JD Vance will join wife on Greenland trip amid backlash,https://www.bbc.com/news/articles/cvgwjllld1ro,0.85,487,0,487
21,worldnews,"China wants more trade with Canada, envoy says amid U.S. tariffs - National | Globalnews.ca",https://globalnews.ca/news/11097549/china-wants-more-trade-with-canada-u-s-tariffs/,0.94,483,0,483
22,worldnews,Authoritarian leader of Belarus is sworn for a 7th term and tells his critics ‘you have no future’,https://thehill.com/homenews/ap/ap-international/ap-authoritarian-leader-of-belarus-is-sworn-for-a-7th-term-and-tells-his-critics-you-have-no-future/?tbref=hp,0.95,372,0,372
23,worldnews,India Is Said to Have Meddled in Canadian Party Election,https://www.nytimes.com/2025/03/25/world/asia/canada-election-india-china.html,0.93,126,0,126
24,worldnews,"Russia has ‘seized the upper hand’ in Ukraine war, intel community warns",https://www.politico.com/news/2025/03/25/russia-has-seized-the-upper-hand-in-ukraine-war-intel-community-warns-00247753,0.87,120,0,120
25,worldnews,"/r/WorldNews Live Thread: Russian Invasion of Ukraine Day 1126, Part 1 (Thread #1273)",https://www.reddit.com/live/18hnzysb1elcs,0.97,105,0,105
