,subreddit,title,url,upvote_ratio,ups,downs,score
0,worldnews,"Court orders X to reveal investors, links to Putin's allies found","https://essanews.com/court-orders-x-to-reveal-investors-links-to-putins-allies-found,7063945661912705a",0.88,55136,0,55136
1,worldnews,Morning attack on Ukraine cost Russia almost US$1.3 billion,https://www.pravda.com.ua/eng/news/2024/08/26/7472003/,0.96,14580,0,14580
2,worldnews,"Kyiv’s power grid hit by Russian missile attack, explosions across Ukraine",https://english.nv.ua/nation/mayor-klitschko-reported-power-outages-and-water-supply-disruptions-in-several-districts-of-kyiv-50445804.html,0.96,14106,0,14106
3,worldnews,Japan says Chinese military violated territorial airspace for first time,https://www.japantimes.co.jp/news/2024/08/26/japan/china-japan-airspace-violation/,0.97,11912,0,11912
4,worldnews,Ukraine Seeks UK Green Light to Strike Moscow and St. Petersburg Targets With Storm Shadow Missiles,https://www.kyivpost.com/post/37985,0.98,10592,0,10592
5,worldnews,Yahya Sinwar reportedly hiding in plain sight 'dressed as a woman',https://www.ynetnews.com/article/byd0y0fsa,0.91,7932,0,7932
6,worldnews,Telegram founder's arrest part of larger investigation into alleged child exploitation and drug trafficking 'complicity',https://www.nbcnews.com/tech/tech-news/pavel-durov-telegram-ceo-macron-france-arrest-musk-snowden-rcna168212,0.95,5446,0,5446
7,worldnews,Explosion rocks one of Russia's largest refineries: fire breaks out,https://www.pravda.com.ua/eng/news/2024/08/26/7471932/,0.99,5101,0,5101
8,worldnews,Russia's largest attack: Ukraine's defence forces destroy over 200 out ot 236 Russian missiles and drones,https://www.pravda.com.ua/eng/news/2024/08/26/7471996/,0.98,5026,0,5026
9,worldnews,Macklemore cancels Dubai show over alleged UAE role in Sudan war,https://www.bbc.com/news/articles/cgrj1gkw52lo#amp_tf=From%20%251%24s&amp;aoh=17246816253453&amp;referrer=https%3A%2F%2Fwww.google.com&amp;ampshare=https%3A%2F%2Fwww.bbc.com%2Fnews%2Farticles%2Fcgrj1gkw52lo,0.93,3951,0,3951
10,worldnews,Russia unleashes a massive drone and missile attack on Ukraine. At least 3 people are killed,https://apnews.com/article/russia-ukraine-war-26-august-2024-25296eee7c9c394d07d806f44a2ec09e,0.96,3193,0,3193
11,worldnews,Satellite images show Ukraine's expanding attacks inside Russia,https://www.nbcnews.com/news/world/satellite-images-show-ukraines-expanding-attacks-russia-rcna167725,0.97,2412,0,2412
12,worldnews,US voices 'deep concern' after reports Iranian police shot woman for breaking hijab law,https://www.voanews.com/a/us-voices-deep-concern-after-reports-iranian-police-shot-woman-for-breaking-hijab-law/7757704.html,0.95,1574,0,1574
13,worldnews,Macron on Telegram CEO’s arrest: French government was not involved,https://www.politico.eu/article/telegram-pavel-durov-arrest-france-emmanuel-macron/,0.94,1254,0,1254
14,worldnews,"Trudeau announces reduction in temporary foreign workers, suggests more immigration changes to come",https://www.cbc.ca/amp/1.7304819,0.95,1154,0,1154
15,worldnews,‘Putin doesn’t respect you': Zelensky flags India-Russia trade amid conflict | Ukrainian President Volodymyr Zelensky accused India of helping sustain Russia’s “war economy” through purchases of crude oil,https://www.hindustantimes.com/world-news/putin-doesn-t-respect-you-zelenskyy-flags-india-russia-trade-amid-conflict-pm-modi-visit-101724445416849.html,0.95,1134,0,1134
16,worldnews,Yemen weapons dealers selling machine guns on X,https://www.bbc.com/news/articles/c86l4pl6072o,0.93,942,0,942
17,worldnews,Cuba sees 14-hour-long daily blackouts as economic crisis continues to deepen,https://www.latintimes.com/cuba-sees-14-hour-long-daily-blackouts-economic-crisis-continues-deepen-558320,0.95,741,0,741
18,worldnews,At least 100 people killed in central Burkina Faso in latest jihadi attack,https://www.voanews.com/a/at-least-100-people-killed-in-central-burkina-faso-in-latest-jihadi-attack/7757509.html,0.95,587,0,587
19,worldnews,"Australia sees hottest winter temperature on record, a brutal 107 degrees",https://www.washingtonpost.com/weather/2024/08/26/australia-record-winter-heat/,0.88,569,0,569
20,worldnews,"/r/WorldNews Live Thread: Russian Invasion of Ukraine Day 915, Part 1 (Thread #1062)",https://www.reddit.com/live/18hnzysb1elcs,0.98,331,0,331
21,worldnews,Massive Russian strikes hit Ukraine for second day,https://www.bbc.com/news/articles/ckg1lpe26ylo,0.97,234,0,234
22,worldnews,Pakistan man is acquitted of spreading misinformation that set off U.K. riots,https://www.nbcnews.com/news/world/pakistan-man-acquitted-spreading-misinformation-uk-riots-rcna168347,0.9,121,0,121
23,worldnews,Australia Caps Foreign Student Intake in Bid to Curb Migration,https://www.bloomberg.com/news/articles/2024-08-27/australia-caps-foreign-student-intake-in-bid-to-curb-migration,0.95,115,0,115
24,worldnews,/r/WorldNews Live Thread for Israel-Hamas War (Thread #64),https://www.reddit.com/live/1bsso361afr0r,0.75,112,0,112
25,worldnews,Norway alerts on Russian Intelligence recruiting criminals for sabotage ,https://odessa-journal.com/in-norway-it-has-been-reported-that-russia-is-recruiting-local-criminals-for-sabotage-operations,0.98,87,0,87
26,worldnews,Ukraine touts threat of new long-range 'Palianytsia' weapon in war with Russia,https://www.cbc.ca/news/world/urkaine-palianytsia-long-range-weapon-1.7305701,0.96,85,0,85
