,subreddit,title,url,upvote_ratio,ups,downs,score
0,worldnews,"Ukrainian forces launched cross-border attack into Russia, Moscow says",https://www.euronews.com/my-europe/2024/08/07/ukrainian-forces-launched-cross-border-incursion-into-russia-moscow-claims,0.95,16635,0,16635
1,worldnews,Russia: State of emergency in Kursk amid incursion,https://www.dw.com/en/russia-state-of-emergency-in-kursk-amid-incursion/a-69873333,0.95,13706,0,13706
2,worldnews,Russian Railway Networks Facing 'Imminent Collapse': Report - Newsweek,https://www.newsweek.com/russian-railway-collapse-sanctions-ukraine-war-1935049,0.96,6307,0,6307
3,worldnews,Thousands Flee as Russia Battles Ukrainian Border Incursion for 2nd Day,https://www.kyivpost.com/post/37035,0.98,5305,0,5305
4,worldnews,Russia Says Ukraine Opening 'Second Front' in Africa,https://www.kyivpost.com/post/37022,0.96,5296,0,5296
5,worldnews,"Ukraine did not warn about actions in Russia’s Kursk Oblast, it doesn’t violate US policy – US Department of State",https://www.pravda.com.ua/eng/news/2024/08/7/7469405/,0.97,4264,0,4264
6,worldnews,‘Why Did Our State Allow This?’: Russians in Border Region Slam Officials’ Inaction as Ukrainian Forces Attack,https://www.themoscowtimes.com/2024/08/07/why-did-our-state-allow-this-russians-in-border-region-slam-officials-inaction-as-ukrainian-forces-attack-a85954,0.97,3476,0,3476
7,worldnews,Putin accuses Ukraine of 'provocation' amid alleged border incursion ,https://www.bbc.com/news/articles/cm2n9y4nm3lo,0.93,3035,0,3035
8,worldnews,"U.K., U.S. ambassadors to skip Nagasaki peace ceremony as the city did not invite Israel",https://www.asahi.com/ajw/articles/15379321,0.86,2939,0,2939
9,worldnews,Video of Iran's Morality Police Beating Teen Girls Sparks Outrage,https://iranwire.com/en/women/132601-video-of-irans-morality-police-beating-teen-girls-sparks-outrage/,0.96,2764,0,2764
10,worldnews,Egypt asks its airlines to avoid Tehran airspace for three hours on Thursday,https://www.jpost.com/middle-east/iran-news/article-813765,0.97,2351,0,2351
11,worldnews,"IDF destroys Hamas arms production plant, launchers found in humanitarian areas",https://www.timesofisrael.com/idf-destroys-hamas-arms-production-plant-launchers-found-in-humanitarian-areas/,0.88,2314,0,2314
12,worldnews,Iran may be reconsidering major strike on Israel after American show of force ,https://m.jpost.com/breaking-news/article-813665,0.92,2065,0,2065
13,worldnews,Images of Ukraine's new F-16s and their weapons hint at what the US-made fighter jets may start off doing against the Russians,https://www.yahoo.com/news/images-ukraines-f-16s-weapons-191343815.html,0.96,1725,0,1725
14,worldnews,Ukrainian troops seize Russian gas metering station as incursion into Kursk region continues,https://novayagazeta.eu/articles/2024/08/07/ukrainian-troops-seize-russian-gas-metering-station-as-incursion-into-kursk-region-continues-en-news,0.98,1525,0,1525
15,worldnews,Israel to US: Hezbollah attacks that hit civilians will face disproportionate retaliation,https://www.axios.com/2024/08/07/israel-hezbollah-attack-civilians-us,0.93,1292,0,1292
16,worldnews,"With an overwhelming 159-22 majority Bulgaria’s parliament unexpectedly outlaws ‘LGBT Propaganda’ in schools, following a proposal by the country's pro-Russian Vazrazhdane party",https://balkaninsight.com/2024/08/07/bulgarias-parliament-unexpectedly-outlaws-lgbt-propaganda-in-schools/,0.93,812,0,812
17,worldnews,Suspect who painted red hands on Paris Holocaust memorial denies racial motives,https://www.timesofisrael.com/suspect-who-painted-red-hands-on-paris-holocaust-memorial-denies-racial-motives/,0.91,734,0,734
18,worldnews,Iran’s president implores Khamenei to avoid war with Israel,https://www.iranintl.com/en/202408073123,0.93,660,0,660
19,worldnews,Beirut rattled by Israeli sonic booms before Hezbollah leader’s speech,https://tvpworld.com/79670121/beirut-rattled-by-israeli-sonic-booms-before-hezbollah-leaders-speech,0.93,555,0,555
20,worldnews,Hindus in Bangladesh Face Revenge Attacks After Prime Minister’s Exit,https://www.nytimes.com/2024/08/07/world/asia/bangladesh-politics-unrest.html,0.89,423,0,423
21,worldnews,"/r/WorldNews Live Thread: Russian Invasion of Ukraine Day 896, Part 1 (Thread #1043)",https://www.reddit.com/live/18hnzysb1elcs,0.98,345,0,345
22,worldnews,UK disorder: Thousands of counter-protesters rally after riots,https://www.bbc.co.uk/news/articles/czxlgwl28gyo,0.83,314,0,314
23,worldnews,"Iran warns airlines to avoid its airspace for 3 hours on Thursday over military drills, Egypt says",https://apnews.com/article/egypt-iran-airspace-warning-israel-0b22ce653552c8653b7b60e6e82f285f,0.93,271,0,271
24,worldnews,/r/WorldNews Live Thread for Israel-Hamas War (Thread #61),https://www.reddit.com/live/1bsso361afr0r,0.85,217,0,217
25,worldnews,US military admits ‘missteps’ for anti-vax propaganda,https://johnmenadue.com/missteps-admitted-but-no-apology-by-us-military-for-anti-vax-propaganda/,0.86,101,0,101
26,worldnews,State Of Emergency Declared In Russia's Kursk Region Amid Cross-Border Incursion,https://www.rferl.org/a/russia-ukraine-kursk-strikes-border/33068723.html,0.98,96,0,96
