,subreddit,title,url,upvote_ratio,ups,downs,score
0,worldnews,Hundreds call for Putin to be overthrown in St Petersburg gathering,https://www.dailymail.co.uk/news/article-15195147/Hundreds-call-Putin-overthrown-huge-gathering-St-Petersburg-rare-display-public-dissent-against-dictator-Ukraines-long-range-strikes-bring-war-home-Russians.html,0.93,60602,0,60602
1,worldnews,"Trump Gaza plan on verge of collapse, warns Saudi Arabia and UAE",https://www.israelhayom.com/2025/10/16/trump-gaza-plan-on-verge-of-collapse-warns-saudi-arabia-and-uae/,0.94,19321,0,19321
2,worldnews,Trump confirms CIA conducting covert operations inside Venezuela,https://www.abc.net.au/news/2025-10-16/trump-confirms-cia-conducting-covert-venezuela-operations/105899100?utm_source=abc_news_app&amp;utm_medium=content_shared&amp;utm_campaign=abc_news_app&amp;utm_content=link,0.97,9907,0,9907
3,worldnews,Putin's FSB accuses NATO ally of direct attacks on Russia,https://www.newsweek.com/putin-fsb-nato-russia-attacks-ukraine-war-uk-10887113,0.95,7901,0,7901
4,worldnews,18 year-old Russian singer detained by St. Petersburg police for performing anti-Putin song,https://kyivindependent.com/18-year-old-russian-singer-detained-by-st-petersburg-police-for-performing-anti-putin-song/,0.98,6394,0,6394
5,worldnews,Trump hesitant on providing Tomahawk missiles to Ukraine following call with Putin,https://kyivindependent.com/we-need-them-too-trump-hesitant-on-providing-tomahawk-missiles-to-ukraine-following-call-with-putin-ahead-of-talks-with-zelensky/,0.96,5880,0,5880
6,worldnews,Russia unleashes toxic ammonia cloud but fails to save trapped forces near Pokrovsk,https://euromaidanpress.com/2025/10/16/frontline-report-russia-unleashes-toxic-ammonia-cloud-but-fails-to-save-trapped-forces-near-pokrovsk/,0.97,4764,0,4764
7,worldnews,Zelensky urges Trump to end Ukraine war like in 'the Middle East',https://www.lemonde.fr/en/international/article/2025/10/11/zelensky-urges-trump-to-end-ukraine-war-like-in-the-middle-east_6746332_4.html,0.96,3140,0,3140
8,worldnews,EU unveils ‘defense readiness roadmap’ to prepare continent for possible Russia war,https://tvpworld.com/89500061/eu-unveils-plan-to-prepare-continent-for-possible-russia-war,0.98,3044,0,3044
9,worldnews,"US airstrike near Venezuela may have killed two Trinidad citizens, police say",https://www.theguardian.com/world/2025/oct/16/airstrike-venezuela-trinidad-us-death-investigation,0.95,2402,0,2402
10,worldnews,"U.S. Military Killed Venezuelan Fisherman in Suspected Drug Boat Attack, Family Says",https://www.nytimes.com/2025/10/16/world/americas/trinidad-us-military-venezuela-boats.html,0.96,1836,0,1836
11,worldnews,"Trump: If Hamas doesn’t stop killing Gazans, ‘we will have no choice but to go in and kill them’",https://www.timesofisrael.com/trump-if-hamas-doesnt-stop-killing-gazans-we-will-have-no-choice-but-to-go-in-and-kill-them/,0.94,1817,0,1817
12,worldnews,Frontline report: “Ukraine is growing stronger” – Kremlin propagandist’s stunning admission reveals shift in war,https://euromaidanpress.com/2025/10/16/frontline-report-2025-10-16,0.98,1568,0,1568
13,worldnews,Ukrainian intelligence names 139 vessels and 142 captains involved in transporting oil and stolen Ukrainian grain,https://www.pravda.com.ua/eng/news/2025/10/16/8002975/,0.98,1490,0,1490
14,worldnews,"Ex-US embassy guard in Norway convicted of spying for Russia, Iran",https://www.euractiv.com/news/ex-us-embassy-guard-in-norway-convicted-of-spying-for-russia-iran/,0.98,1447,0,1447
15,worldnews,Donald Trump to meet Vladimir Putin in Hungary over Ukraine war,https://thehill.com/homenews/administration/5558816-trump-putin-budapest-meeting/,0.93,1225,0,1225
16,worldnews,Ukrainian strikes have hurt Russia's economy more than sanctions – Ukraine's Intelligence chief,https://www.pravda.com.ua/eng/news/2025/10/16/8003063/,0.98,1027,0,1027
17,worldnews,"Global government debt on course to hit 100% of GDP by 2029, IMF warns",https://www.theguardian.com/business/2025/oct/15/global-government-debt-100-percent-of-gdp-by-2029-imf-uk,0.97,838,0,838
18,worldnews,China has found Trump's pain point - rare earths,https://www.bbc.com/news/articles/ckg1jr18z4ko,0.93,776,0,776
19,worldnews,"Argentines dump the peso, betting US rescue is doomed to fail",https://www.batimes.com.ar/news/economy/argentines-dump-the-peso-betting-us-rescue-is-doomed-to-fail.phtml,0.95,541,0,541
20,worldnews,Japan bear attacks hit record high with seven people killed this year,https://www.bbc.com/news/articles/cj41vn9q81ko,0.94,228,0,228
21,worldnews,Russia bombards Ukraine’s gas sites as Zelenskyy flies to US for Trump meeting,https://www.theguardian.com/world/2025/oct/16/russia-strikes-ukraine-gas-sites-zelenskyy-us-trump-meeting-cruise-missiles,0.97,150,0,150
22,worldnews,Ukraine Secures $1.1 Billion in Defense and Industry Aid From NATO Allies,https://united24media.com/latest-news/ukraine-secures-11-billion-in-defense-and-industry-aid-from-nato-allies-12572,0.95,142,0,142
23,worldnews,"/r/WorldNews Live Thread: Russian Invasion of Ukraine Day 1331, Part 1 (Thread #1478)",https://www.reddit.com/live/18hnzysb1elcs,0.96,112,0,112
24,worldnews,Chief of staff of Yemen Houthi rebel’s military dies from wounds suffered in Israeli airstrike,https://indianexpress.com/article/world/chief-of-staff-yemen-houthi-rebel-military-dies-wounds-israeli-airstrike-10311752/,0.89,93,0,93
