,subreddit,title,url,upvote_ratio,ups,downs,score
0,worldnews,Zelensky refuses to sign document on transfer of 50% of Ukrainian mineral resources to the US - WP | УНН,https://unn.ua/en/news/zelensky-refuses-to-sign-document-on-transfer-of-50percent-of-ukrainian-mineral-resources-to-the-us-wp,0.95,58134,0,58134
1,worldnews,Royal Society urged to expel Elon Musk as fellows sign open letter,https://www.theguardian.com/science/2025/feb/14/elon-musk-royal-society-open-letter-academics,0.95,32612,0,32612
2,worldnews,"Musk will face consequences for interfering in German election, says front-runner Merz",https://www.politico.eu/article/elon-musk-will-face-consequences-interfering-german-election-front-runner-friedrich-merz/,0.95,32378,0,32378
3,worldnews,Zelenskyy: Trump told me Putin wants to end the war. I told him Putin is a liar.,https://www.politico.eu/article/ukraine-war-volodymyr-zelenskyy-donald-trump-putin-liar-peace/,0.97,21737,0,21737
4,worldnews,"Putin 'preparing war against Nato countries next year', warns Zelensky - latest Ukraine developments",https://uk.news.yahoo.com/nato-war-putin-zelensky-ukraine-russia-124308240.html?guccounter=1,0.96,12266,0,12266
5,worldnews,USA’s threats to invade Canada violate international law: Canadian ambassador - National,https://globalnews.ca/news/11011723/donald-trump-canada-greenland-threats/amp/,0.96,10539,0,10539
6,worldnews,Berlin says Vance should not interfere in German politics,https://www.straitstimes.com/world/europe/berlin-says-vance-should-not-interfere-in-german-politics,0.98,9926,0,9926
7,worldnews,Hegseth to Europe: Don’t Look to America for Leadership,https://www.thebulwark.com/p/hegseth-to-europe-dont-look-to-america-for-leadership-ukraine-russia,0.95,6823,0,6823
8,worldnews,Astronauts give their own account- not abandoned by Biden administration,https://www.newsweek.com/astronauts-stuck-space-refute-trump-claim-iss-2031187,0.97,6554,0,6554
9,worldnews,Mexican president accuses U.S. of harbouring drug cartels - National | Globalnews.ca,https://globalnews.ca/news/11019350/mexico-us-drug-cartel-alliance-slander-harbouring-mexican-president-claudia-sheinbaum-trump/,0.97,6138,0,6138
10,worldnews,"Ukraine Could Replace US Troops in Europe, Says Ukrainian Prime Minister",https://www.kyivpost.com/post/47170,0.98,6061,0,6061
11,worldnews,"Ukraine on ‘irreversible path’ to Nato membership, Starmer tells Zelenskyy",https://www.theguardian.com/world/2025/feb/14/ukraine-on-irreversible-path-to-nato-membership-starmer-tells-zelenskyy,0.98,4890,0,4890
12,worldnews,Mexico threatens to escalate US gunmakers lawsuit with terror charges,https://www.theguardian.com/world/2025/feb/14/mexico-gunmakers-lawsuit-terror,0.96,3928,0,3928
13,worldnews,Zelenskyy: I told Trump that Putin is a liar,https://www.pravda.com.ua/eng/news/2025/02/14/7498367/,0.98,3248,0,3248
14,worldnews,"Ukraine has low chance of survival without US backing, Zelenskiy says on NBC",https://www.reuters.com/world/europe/ukraine-has-low-chance-survival-without-us-backing-zelenskiy-says-nbc-2025-02-14/,0.97,3210,0,3210
15,worldnews,"US citizen detained in Russia for drug possession, says state media",https://www.cnn.com/2025/02/14/europe/russia-us-citizen-detained-drug-intl-latam/index.html,0.94,2037,0,2037
16,worldnews,JD Vance breaks taboo by meeting with leader of Germany’s far-right party,https://www.theguardian.com/us-news/2025/feb/14/jd-vance-alice-weidel-meeting-germany-far-right,0.93,1526,0,1526
17,worldnews,Zelenskyy to Vance: Ukraine wants 'security guarantees' as Trump seeks to end Ukraine-Russia war,https://apnews.com/article/vance-rubio-munich-security-conference-ukraine-ab2d7379aaf6ca224cc51e1f9ade9edf,0.98,1220,0,1220
18,worldnews,Russian Drone Operators Set Up In A Village Near The Ukrainian Border. So The Ukrainian Air Force Bombed The Village,https://www.forbes.com/sites/davidaxe/2025/02/14/russian-drone-operators-set-up-in-a-village-near-the-ukrainian-border-so-the-ukrainian-air-force-bombed-the-village/,0.96,1006,0,1006
19,worldnews,Air Canada to Cut US-Bound Flights in March; WestJet Could Follow,https://openjaw.com/newsroom/airline/2025/02/14/air-canada-to-cut-us-bound-flights-in-march-westjet-could-follow/,0.95,996,0,996
20,worldnews,"Latvia moves to ban tourist trips to Russia, Belarus",https://www.politico.eu/article/latvia-wants-ban-tourist-trips-to-russia-and-belarus/,0.98,873,0,873
21,worldnews,Angle grinder used to cut telecommunications cable to Northern Norway military airbase,https://www.thebarentsobserver.com/security/angle-grinder-used-to-cut-telecommunications-cable-to-natos-northernmost-qra-base/424730,0.98,852,0,852
22,worldnews,Trump unsure why Modi and Musk met during the Indian PM’s U.S. visit,https://nationalpost.com/news/world/trump-musk-modi-us-visit,0.96,801,0,801
23,worldnews,Vance meets with leader of far-right German party,https://www.wjbf.com/hill-politics/vance-meets-with-leader-of-far-right-german-party/,0.92,655,0,655
24,worldnews,Trump officials pitch Zelenskyy on U.S. owning 50% of Ukraine's rare earth minerals,https://www.nbcnews.com/politics/national-security/trump-officials-us-owning-half-ukraine-rare-earth-minerals-rcna192325,0.86,265,0,265
