,subreddit,title,url,upvote_ratio,ups,downs,score
0,worldnews,Canada to announce $29.8B in tariffs on U.S.,https://www.ctvnews.ca/world/trumps-tariffs/article/canada-to-announce-298-billion-in-retaliatory-tariffs-on-us-official-tells-reuters/,0.93,51555,0,51555
1,worldnews,Canadian intelligence officials say Canada needs to be on the lookout for campaigns aimed at destabilizing the country - Musk’s social media platform X being a problem.,https://www.cbc.ca/news/politics/trump-annexation-destabilizing-canada-1.7479890,0.96,34541,0,34541
2,worldnews,Ukraine’s Best European Missile Just Shot Down Its First Russian Jet,https://www.forbes.com/sites/davidaxe/2025/03/11/ukraines-best-european-missile-just-shot-down-its-first-russian-jet/?ctpv=xlrecirc,0.96,32386,0,32386
3,worldnews,"Ukraine won't recognize occupied territories as Russian as part of any peace deal, Zelensky says",https://kyivindependent.com/ukraine-wont-recognize/,0.98,22587,0,22587
4,worldnews,EU lawmakers accuse US of ‘blackmailing’ Zelenskyy into ceasefire,https://www.politico.eu/article/european-parliament-donald-trump-volodymyr-zelenskyy-war-in-ukraine-ceasefire-russia/,0.98,12882,0,12882
5,worldnews,EU wields ‘sledgehammer’ against Trump tariffs - Brussels strikes back against the U.S. president’s 25 percent levies on steel and aluminum,https://www.politico.eu/article/eu-tariffs-donald-trump-diplomat-eu-war-defending-nation-bloc/,0.98,12055,0,12055
6,worldnews,Canada sounds alarm at G7: ‘Nobody is safe’ from Trump’s tactics,https://www.politico.com/news/2025/03/12/canada-g7-trump-warnings-00227122,0.98,9849,0,9849
7,worldnews,King Charles reaffirms commitment to Canada against backdrop of US trade war,https://news.sky.com/story/king-charles-reaffirms-commitment-to-canada-against-backdrop-of-us-trade-war-13327254,0.98,9675,0,9675
8,worldnews,U.S. Said to Tell Canada That It Will Enforce a Visitor Registration Law,https://www.nytimes.com/2025/03/11/us/politics/trump-canada-registration-immigration.html,0.96,9003,0,9003
9,worldnews,Zelenskyy expects ‘strong steps’ from US if Russia rejects ceasefire.,https://www.theguardian.com/world/2025/mar/12/russia-demands-details-from-before-commits-to-ukraine-ceasefire,0.99,8317,0,8317
10,worldnews,Rubio says G7 won't discuss US 'takeover' of Canada,https://www.reuters.com/world/americas/rubio-says-g7-wont-discuss-us-takeover-canada-2025-03-12/?utm_source=reddit.com,0.97,7007,0,7007
11,worldnews,Volkswagen open to building military equipment for German army,https://www.yahoo.com/news/volkswagen-open-building-military-equipment-160011493.html?guccounter=1&amp;guce_referrer=aHR0cHM6Ly93d3cuZ29vZ2xlLmRlLw&amp;guce_referrer_sig=AQAAANXnfWSLcJ0hgbT57i69jo6vNfQ_5Qma8GSDmeveYT49MhWCXF-b3lUJVvrEcO8elS_DXGs_Fpr3I_5JcK8BeKQfzc2oNTckvrbk2rZNJN3J5mQzdhdQe0jPCG7PT1flukZZKaxQHoU95DFmO3I_K2kY9It-fmtOzRNk2lBPNqw1,0.98,5277,0,5277
12,worldnews,"EU chief says member countries must use a new defense loan to buy European, not American",https://apnews.com/article/eu-defense-spending-us-ukraine-8cbd54ba81c086aa8e47ea3a0971febb,0.99,4625,0,4625
13,worldnews,'Just say thank you': Lutnick says Canada is acting like Ukraine in Trump negotiations,https://nationalpost.com/news/canada/doug-ford-donald-trump-howard-lutnick-united-states-tariffs?taid=67d22046df500b00014a37d0&amp;utm_campaign=trueanthem&amp;utm_medium=social&amp;utm_source=twitter,0.94,3379,0,3379
14,worldnews,Brussels is ‘honored’ Canadians want to join the EU — but says it won’t happen,https://www.politico.eu/article/canadians-want-join-european-union-will-never-happen-paula-pinho/,0.95,3312,0,3312
15,worldnews,Canada's incoming prime minister says he'll meet Trump if Canadian sovereignty is respected,https://apnews.com/article/canada-mark-carney-trump-prime-minister-tariffs-413e1d8ab73b059f6bf92aa79e40d5a2,0.98,3037,0,3037
16,worldnews,"British parliamentarian calls on the U.K. to rally around Canada, throws poutine party.",https://www.cbc.ca/news/world/uk-liberal-democrat-ed-davey-canada-support-1.7481537,0.98,2985,0,2985
17,worldnews,S. Korea Proposes K9 Howitzer as Alternative to US Artillery in Canada’s Modernization Plan,https://armyrecognition.com/news/army-news/2025/flash-news-south-korea-proposes-its-k9-howitzer-as-replacement-for-us-artillery-in-canadas-modernization-plan,0.99,2557,0,2557
18,worldnews,The CIA chief and his Russian counterpart are going to chat regularly now,https://www.businessinsider.com/cia-chief-regular-talks-russia-spy-agency-years-silence-2025-3?utm_source=reddit&amp;utm_medium=social&amp;utm_campaign=insider-worldnews-sub-post,0.97,1805,0,1805
19,worldnews,Trump tariff threats are pushing Canada's largest oil producer to break its dependence on the U.S.,https://www.cnbc.com/2025/03/12/trump-tariff-threats-are-pushing-canadas-largest-oil-producer-to-break-its-dependence-on-the-us-.html,0.98,1405,0,1405
20,worldnews,Canada to be EU’s 28th member? Nearly half of Canadians say yes - Euractiv,https://www.euractiv.com/section/politics/news/canada-to-be-eus-28th-member-nearly-half-of-canadians-say-yes/,0.91,1245,0,1245
21,worldnews,Trump appears to reverse course on Gaza Plan: 'No one is expelling Palestinians',https://www.ynetnews.com/article/bj00mc4j2kx,0.95,975,0,975
22,worldnews,Trump vows to respond to EU's threat of counter tariffs on US goods,https://www.business-standard.com/world-news/trump-vows-to-respond-to-eu-s-threat-of-counter-tariffs-on-us-goods-125031201406_1.html,0.93,934,0,934
23,worldnews,"Trump threatens further tariffs as EU, Canada retaliate for those already in place",https://www.japantimes.co.jp/business/2025/03/13/economy/trump-tariffs-eu-canada-retaliate/,0.96,911,0,911
24,worldnews,North Korea Puts Out 'First Nuclear War' Warning,https://www.newsweek.com/north-korea-puts-out-nuclear-war-warning-2043361,0.88,272,0,272
25,worldnews,"/r/WorldNews Live Thread: Russian Invasion of Ukraine Day 1113, Part 1 (Thread #1260)",https://www.reddit.com/live/18hnzysb1elcs,0.94,136,0,136
