,subreddit,title,url,upvote_ratio,ups,downs,score
0,worldnews,"“Stadium of death near Toretsk”: Russia lost 50,000 troops but failed to break Ukrainian defenses",https://euromaidanpress.com/2025/08/02/stadium-of-death-near-toretsk-russia-lost-50000-troops-but-failed-to-break-ukrainian-defenses,0.95,17522,0,17522
1,worldnews,Mass baby graves being excavated in Ireland decades after discovery at Catholic-run home,https://www.abc.net.au/news/2025-08-02/baby-grave-discovery-haunts-ireland-as-excavations-begin/105598736?utm_campaign=abc_news_web&amp;utm_content=link&amp;utm_medium=content_shared&amp;utm_source=abc_news_web,0.97,9828,0,9828
2,worldnews,Hamas says it won't disarm unless independent Palestinian state established,https://www.reuters.com/world/middle-east/hamas-says-it-wont-disarm-unless-independent-palestinian-state-established-2025-08-02/,0.9,6489,0,6489
3,worldnews,Hundreds in Tel Aviv demand end to Gaza war: ‘It’s a duty to refuse’ to serve there,https://www.timesofisrael.com/hundreds-in-tel-aviv-demand-end-to-gaza-war-its-a-duty-to-refuse/,0.88,4160,0,4160
4,worldnews,NATO unleashes new $10 billion “combat wallet” for Ukraine as Putin’s increses attacks on civilians,https://euromaidanpress.com/2025/08/02/nato-unleashes-new-10-billion-combat-wallet-for-ukraine-as-putins-increses-attacks-on-civilians/,0.98,4117,0,4117
5,worldnews,UN Data: Nearly 90 Percent of Gaza Aid ‘Intercepted’ Before Reaching Intended Recipients,https://www.algemeiner.com/2025/08/01/un-data-nearly-90-percent-gaza-aid-intercepted-before-reaching-intended-recipients/,0.92,3085,0,3085
6,worldnews,Nordic countries hit by ‘truly unprecedented’ heatwave,https://www.theguardian.com/environment/2025/aug/02/nordic-countries-hit-by-truly-unprecedented-heatwave,0.97,2972,0,2972
7,worldnews,Macron compares Israeli hostages in Gaza to Palestinians jailed in Israel,https://www.ynetnews.com/article/hkc3qqiwgl,0.81,2950,0,2950
8,worldnews,"Report: Trump admin determines UNRWA is 'irredeemably compromised,' must be dismantled",https://www.i24news.tv/en/news/middle-east/artc-report-trump-admin-determins-unrwa-is-irredeemably-compromised-must-be-dismantled,0.91,2827,0,2827
9,worldnews,Ukraine says it uncovers major drone procurement corruption scheme,https://www.reuters.com/business/aerospace-defense/ukraine-says-it-uncovers-major-drone-procurement-corruption-scheme-2025-08-02/?taid=688e398bde9537000176a26a&amp;utm_campaign=trueAnthem:+Trending+Content&amp;utm_medium=trueAnthem&amp;utm_source=twitter,0.98,2705,0,2705
10,worldnews,New footage of Evyatar David cleared for publication: Hamas forced him to dig his own grave,https://www.ynetnews.com/article/46pysy94m,0.84,2538,0,2538
11,worldnews,Prominent Indian ex-MP gets life sentence for rape,https://www.bbc.com/news/articles/c87edydwpv7o,0.96,2304,0,2304
12,worldnews,"Ukraine's military intelligence, partisans blow up bus carrying Chechen soldiers in occupied Melitopol",https://kyivindependent.com/ukraines-military-intelligence-partisans-blow-up-bus-carrying-chechen-soldiers-in-occupied-melitopol/,0.98,2188,0,2188
13,worldnews,Ukraine claims attacks on Russian drone storage airbase and military plant,https://www.euronews.com/my-europe/2025/08/02/ukraine-claims-attacks-on-russian-drone-storage-airbase-and-military-plant,0.98,2089,0,2089
14,worldnews,Skin and bones: Family releases image from video of hostage Evyatar David,https://www.ynetnews.com/article/k026q2pa9#autoplay,0.84,1814,0,1814
15,worldnews,"India Will Buy Russian Oil Despite Trump’s Threats, Officials Say",https://www.nytimes.com/2025/08/02/world/asia/india-russia-oil-trump-threats.html,0.94,1576,0,1576
16,worldnews,UN report finds United Nations reports are not widely read,https://www.reuters.com/world/un-report-finds-united-nations-reports-are-not-widely-read-2025-08-01/,0.96,1054,0,1054
17,worldnews,Tehran closes public restrooms as water crisis deepens,https://www.iranintl.com/en/202508012362,0.95,652,0,652
18,worldnews,Hamas deputy commander Salah al-Din Za'ara eliminated in Gaza strike,https://www.business-standard.com/amp/world-news/hamas-deputy-commander-salah-al-din-za-ara-eliminated-in-gaza-strike-125080300040_1.html,0.9,559,0,559
19,worldnews,"Canadian wildfire smoke chokes Midwest, sparks air quality concerns",https://www.business-standard.com/world-news/canadian-wildfire-smoke-chokes-midwest-sparks-air-quality-concerns-125080300028_1.html,0.93,555,0,555
20,worldnews,Indians in Ireland urged to take ‘reasonable precautions’ after growing number of racist attacks against foreigners,https://www.thehindu.com/news/international/indians-in-ireland-urged-to-take-reasonable-precautions-after-growing-number-of-racist-attacks-against-foreigners/article69887756.ece/amp/,0.84,365,0,365
21,worldnews,Britain’s MPs charge VPNs to expenses as minister urges caution,https://www.politico.eu/article/britain-mps-charge-vpns-expenses-minister-caution-tech-jonathan-reynolds-data/,0.95,296,0,296
22,worldnews,Hamas refuses to disarm until Palestinian state established,https://bbc.com/news/articles/ce35nx49reko,0.83,138,0,138
23,worldnews,"/r/WorldNews Live Thread: Russian Invasion of Ukraine Day 1256, Part 1 (Thread #1403)",https://www.reddit.com/live/18hnzysb1elcs,0.97,119,0,119
24,worldnews,"Gen. Clark outlines Kremlin’s triple war strategy: terror, land grab, NATO pressure.""Russia is trying to break the spirit of the Ukrainian people, shatter the resistance of the Defense Forces, and intimidate NATO into distancing itself from Ukraine.""",https://global.espreso.tv/military-news-gen-clark-outlines-kremlins-triple-war-strategy-terror-land-grab-nato-pressure,0.97,106,0,106
25,worldnews,Rescuers race to save Chile miners after collapse kills at least one,https://www.bbc.com/news/articles/crlzk4dnxe5o,0.92,92,0,92
