,subreddit,title,url,upvote_ratio,ups,downs,score
0,worldnews,Argentina officially designates Hamas as a terrorist organization,https://www.jpost.com/breaking-news/article-810125,0.87,13651,0,13651
1,worldnews,China rocked by cooking oil contamination scandal,https://www.bbc.com/news/articles/cml2kr9wkdzo,0.94,13643,0,13643
2,worldnews,‘People are furious’: Japan’s Okinawa roiled by silence on US base sex crimes,https://www.scmp.com/week-asia/politics/article/3269960/japans-okinawa-outrage-mounts-over-government-silence-sex-crimes-involving-us-troops,0.91,8178,0,8178
3,worldnews,Japan PM Kishida says we must stand firm against violence after Trump rally shooting,https://www.reuters.com/world/japan-pm-kishida-says-we-must-stand-firm-against-violence-after-trump-rally-2024-07-14/,0.92,5136,0,5136
4,worldnews,"Ukraine Can’t Wait Another 75 Years to Join NATO, Says Chief Diplomat",https://www.kyivpost.com/post/35779,0.95,4165,0,4165
5,worldnews,"North Korea denounces NATO, US as 'most serious threat' to global peace","https://www.thestandard.com.hk/breaking-news/section/6/218368/North-Korea-denounces-NATO,-US-as-'most-serious-threat'-to-global-peace",0.9,3335,0,3335
6,worldnews,A New Military Escalation: Iranian Ballistic Missiles to Russia,https://irannewswire.org/a-new-military-escalation-iranian-ballistic/,0.96,3216,0,3216
7,worldnews,Poland to increase defense spending to 5% of GDP,https://tvpworld.com/79282786/poland-to-increase-defense-spending-to-5-of-gdp-promises-fm,0.97,2850,0,2850
8,worldnews,Putin allows sacking MPs and senators for leaving Russia without permission,https://www.pravda.com.ua/eng/news/2024/07/13/7465510/,0.96,2814,0,2814
9,worldnews,Finland passes law to block migrants crossing from Russia,https://www.reuters.com/world/europe/finland-vote-turning-back-migrants-crossing-russia-2024-07-12/,0.97,2008,0,2008
10,worldnews,Canada Said to Have Mapped Out Secret Chinese Police Operations,https://www.bloomberg.com/news/articles/2024-07-13/canada-said-to-have-mapped-out-secret-chinese-police-operations?srnd=politics-vp,0.96,1825,0,1825
11,worldnews,Poland considers Kyiv's proposal to shoot down Russian missiles over Ukraine - Sikorski,https://global.espreso.tv/russia-ukraine-war-poland-considers-kyivs-proposal-to-shoot-down-russian-missiles-over-ukraine-sikorski,0.96,1718,0,1718
12,worldnews,A German Muslim woman has been barred from working as a lay judge because she wears a headscarf which was alleged to be in violation of the requirement of neutrality. The matter is now before the constitutional court,https://www.dw.com/en/german-lay-judge-challenges-a-headscarf-ban-in-court/a-69648119,0.9,1209,0,1209
13,worldnews,"Russia can counter US missile deployments in Europe, Kremlin says",https://www.reuters.com/world/europe/russia-can-counter-us-missile-deployments-europe-kremlin-says-2024-07-13/,0.87,1083,0,1083
14,worldnews,"Hamas hiding among civilians in Gaza to protect itself, ambush IDF troops, NYT reports",https://www.timesofisrael.com/hamas-hiding-among-civilians-in-gaza-to-protect-itself-ambush-idf-troops-report/,0.81,1058,0,1058
15,worldnews,Iranian president-elect ready to set relations with Europe ‘on the right path’,https://www.cnn.com/2024/07/13/middleeast/iranian-president-elect-relations-europe-intl?cid=ios_app,0.92,930,0,930
16,worldnews,Microbiologist wins case against university over harassment during COVID,https://www.nature.com/articles/d41586-024-02256-1,0.89,732,0,732
17,worldnews,Hungary blocking Poland’s EU funds for Ukraine military aid,https://notesfrompoland.com/2024/07/11/hungary-blocking-e2bn-of-polands-eu-funds-for-ukraine-military-aid/,0.94,694,0,694
18,worldnews,"Belarus's Lukashenko says border tension gone, extra troops go home",https://www.reuters.com/world/europe/belaruss-lukashenko-says-border-tension-gone-extra-troops-go-home-2024-07-13/,0.93,640,0,640
19,worldnews,The gods must be angry: Mexico 'cancels' statue of Greek god Poseidon after dispute with local deity,https://apnews.com/article/mexico-poseidon-chaac-dueling-gods-dispute-771a407d03de7ef8bb0abca46dadc809,0.9,487,0,487
20,worldnews,Palestinian president blames Hamas for continuing war in Gaza,https://www.reuters.com/world/middle-east/palestinian-president-blames-hamas-continuing-war-gaza-2024-07-13/,0.9,402,0,402
21,worldnews,Canada weighs trade crackdown on China over unfair practices &amp; security concerns,https://www.firstpost.com/world/canada-considers-trade-crackdown-on-china-unfair-trade-practices-security-risks-13792729.html,0.92,396,0,396
22,worldnews,Houthi-Controlled Port Receives Vessel from Occupied Crimea After UN Inspection Body Grants Clearance ,https://www.bellingcat.com/news/2024/07/12/houthi-controlled-port-receives-vessel-from-occupied-crimea-after-un-inspection-body-grants-clearance/,0.89,244,0,244
23,worldnews,"/r/WorldNews Live Thread: Russian Invasion of Ukraine Day 871, Part 1 (Thread #1018)",https://www.reddit.com/live/18hnzysb1elcs,0.94,211,0,211
24,worldnews,China says conducting joint military drills with Russia to address ‘maritime security threats’,https://hongkongfp.com/2024/07/13/china-says-conducting-joint-military-drills-with-russia-to-address-maritime-security-threats/,0.85,177,0,177
25,worldnews,Netanyahu says not certain that Hamas leader killed in strike,https://www.reuters.com/world/europe/israeli-pm-netanyahu-says-not-certain-that-hamas-leader-killed-strike-2024-07-13/,0.8,95,0,95
26,worldnews,/r/WorldNews Live Thread for Israel-Hamas War (Thread #58),https://www.reddit.com/live/1bsso361afr0r,0.69,50,0,50
