,subreddit,title,url,upvote_ratio,ups,downs,score
0,worldnews,"Islamic State calls on followers to attack Christians and Jews in US, Europe, Israel",https://www.ynetnews.com/article/s1md7wnyc,0.87,16304,0,16304
1,worldnews,Ukrainian Navy confirms Russia downed its own Su-27 aircraft over Crimea,https://kyivindependent.com/ukrainian-navy-jet/,0.96,13652,0,13652
2,worldnews,Russia veto brings end to U.N. panel monitoring North Korea sanctions,https://www.washingtonpost.com/world/2024/03/29/russia-veto-brings-end-un-panel-monitoring-north-korea-sanctions/,0.95,10493,0,10493
3,worldnews,"Russia’s security services knew of ISIS threat before concert attack, new evidence from investigative body suggests",https://uk.news.yahoo.com/russia-security-services-knew-isis-093158876.html,0.97,5951,0,5951
4,worldnews,"Russian network that 'paid European politicians' busted, authorities claim",https://www.bbc.com/news/world-europe-68685604,0.97,5626,0,5626
5,worldnews,"'If Russians Push to Kharkiv again, it will be fatal for them' -Ukraine's Army Chief",https://www.kyivpost.com/post/30286,0.95,5105,0,5105
6,worldnews,"Vladimir Putin orders creation of Russian game consoles, Steam-like cloud delivery, and OS",https://www.techspot.com/news/102440-putin-orders-creation-russian-game-consoles-cloud-delivery.html,0.95,3428,0,3428
7,worldnews,"After veto, Russia says big powers need to stop 'strangling' North Korea",https://www.reuters.com/world/after-veto-russia-says-big-powers-need-stop-strangling-north-korea-2024-03-29/,0.94,3292,0,3292
8,worldnews,"Senior Hezbollah official in charge of S. Lebanon rockets and missiles, killed in drone attack",https://www.ynetnews.com/article/skwptlnja#autoplay,0.96,3243,0,3243
9,worldnews,"A Russian journalist who covered Navalny’s trials is jailed in Moscow on ""charges of extremism""",https://apnews.com/article/russia-journalist-jailed-crackdown-navalny-1e0cfcefb8c0b0ced8ad368f0fe4709e,0.97,2371,0,2371
10,worldnews,"Russia launches barrage of 99 drones and missiles on Ukraine’s energy system, officials say",https://www.yahoo.com/news/russia-launches-barrage-99-drones-095808992.html,0.97,1910,0,1910
11,worldnews,Japan Finally Screens Oppenheimer - Unease in Japan,https://www.reuters.com/lifestyle/japan-finally-screens-oppenheimer-with-trigger-warnings-unease-hiroshima-2024-03-29/,0.89,1347,0,1347
12,worldnews,"Sexual violence ‘largely unpunished’ in Haiti, UN says | CNN",https://edition.cnn.com/2024/03/28/americas/sexual-violence-haiti-united-nations-intl-latam/index.html,0.95,1209,0,1209
13,worldnews,US says Palestinians are close to changing ‘pay for slay’ program,https://www.politico.com/news/2024/03/29/us-says-palestinians-are-close-to-changing-pay-for-slay-program-00149734,0.87,817,0,817
14,worldnews,Russia continues to suffer from friendly fire: report,https://tvpworld.com/76699114/russia-suffers-slew-of-incidents-involving-russian-planes-bombing-own-territory-report,0.95,751,0,751
15,worldnews,/r/WorldNews Live Thread for Israel-Hamas War (Thread 46),https://www.reddit.com/live/1bsso361afr0r,0.88,724,0,724
16,worldnews,Taiwan’s Top Diplomat Says U.S. Aid to Ukraine Is Critical for Deterring China,https://www.nytimes.com/2024/03/28/us/politics/taiwan-china-ukraine-aid.html,0.95,713,0,713
17,worldnews,"Europe in ‘pre-war era,’ warns Poland’s Prime Minister Tusk, citing Russia’s threat",https://www.cnn.com/2024/03/29/europe/poland-tusk-europe-pre-war-russia-ukraine-intl/index.html,0.96,680,0,680
18,worldnews,"WP: Zelensky defends Ukraine's strategy of targeting Russian oil refineries, emphasizes self-defense",https://kyivindependent.com/zelensky-defends-ukrainian-strategy-of-targeting-russian-oil-refineries-emphasizes-self-defense/,0.97,577,0,577
19,worldnews,"5 dead, 114 hospitalized from recalled Japanese health supplements",https://japantoday.com/category/national/5-dead-and-over-100-hospitalized-from-recalled-japanese-health-supplements,0.95,498,0,498
20,worldnews,Lukashenko torpedoes Putin's attempts to blame Moscow shooting on Ukraine,https://kyivindependent.com/belarus-weekly-lukashenko-torpedoes-putins-attempts-to-blame-moscow-shooting-on-ukraine/,0.97,410,0,410
21,worldnews,"Sudan needs 'immediate action' on hunger to avert widespread death, UN-backed report says",https://www.reuters.com/world/africa/sudan-needs-immediate-action-hunger-avert-widespread-death-un-backed-report-says-2024-03-29/,0.9,281,0,281
22,worldnews,"Pic of Hamas terrorists parading naked body of woman wins award, ignites anger",https://www.news9live.com/viral-news/pic-of-hamas-terrorists-parading-naked-body-of-woman-wins-award-ignites-anger-2482216,0.85,258,0,258
23,worldnews,Slovakia has just shut down its last coal power plant,https://www.euronews.com/green/2024/03/28/slovakia-plans-to-be-coal-free-by-2024-6-years-earlier-than-originally-planned,0.95,155,0,155
24,worldnews,France asks for foreign police and military help with massive Paris Olympics security challenge,https://www.9news.com.au/world/paris-olympics-2024-france-asks-for-foreign-police-and-military-help-with-massive-security-challenge/2f94cff7-85f8-4995-ba3f-cb03d206d090,0.93,150,0,150
25,worldnews,"/r/WorldNews Live Thread: Russian Invasion of Ukraine Day 766, Part 1 (Thread #912)",https://www.reddit.com/live/18hnzysb1elcs,0.96,146,0,146
26,worldnews,Indian Navy saves Pakistani crew from hijacked Iranian vessel,https://www.livemint.com/news/india/arabian-sea-operation-indian-navy-saves-pakistani-crew-from-hijacked-iranian-vessel-11711759041098.html,0.94,137,0,137
