,subreddit,title,url,upvote_ratio,ups,downs,score
0,worldnews,"Pentagon believes U.S. struck Iran girls elementary school, killing 150",https://www.nydailynews.com/2026/03/06/pentagon-believes-u-s-struck-iran-girls-elementary-school-killing-150/,0.92,38383,0,38383
1,worldnews,Trump tells CNN Cuba is soon going to fall: ‘I’m going to put Marco over there’,https://edition.cnn.com/2026/03/06/politics/trump-cuba-marco-rubio-fall,0.95,20830,0,20830
2,worldnews,Iran to suspend strikes on neighbours unless attacks come from them,https://www.reuters.com/world/middle-east/iran-suspend-strikes-neighbours-unless-attacks-come-them-2026-03-07/,0.96,7280,0,7280
3,worldnews,Iran denied US conditions to stop the war,https://www.bbc.com/news/articles/c5yq82k1wk8o,0.94,5893,0,5893
4,worldnews,Pentagon chief not concerned about Russia sharing intelligence with Iran for attacks on US troops,https://www.pravda.com.ua/eng/news/2026/03/07/8024303/,0.97,5849,0,5849
5,worldnews,Trump vows to hit ‘very hard’ after Iran’s president says he won’t surrender,https://www.politico.com/news/2026/03/07/trump-iran-threat-military-strike-surrender-00818032,0.96,4452,0,4452
6,worldnews,Iran says it struck UAE air base shortly after Iranian president's vow not to hit neighbors,https://www.cnbc.com/2026/03/07/not-slowing-down-one-week-on-us-israeli-strikes-on-iran-continue.html,0.94,3813,0,3813
7,worldnews,"History in making: a 35 year old ex-mayor of capital city Kathmandu, Nepal , a structural engineer, and a rapper  is on his way to become PM of Nepal in a landslide victory for his young party, RSP.",https://www.bbc.com/news/articles/cqxdlz3y95ro,0.97,3375,0,3375
8,worldnews,Israeli Air Force strikes oil facilities in Iran | The Jerusalem Post,https://www.jpost.com/israel-news/defense-news/article-889166,0.94,3257,0,3257
9,worldnews,Trump tells Britain he does not need its help to win Iran war,https://www.reuters.com/world/europe/trump-tells-britain-he-does-not-need-its-help-win-iran-war-2026-03-07/,0.95,3211,0,3211
10,worldnews,"Iran's Secretary of the Supreme National Council, Ali Larijani, issues open threat against Trump; ""He must pay the price""",https://www.iranintl.com/en/202603079244,0.96,2779,0,2779
11,worldnews,Israel Army Says Iran Using Cluster Munitions,https://english.aawsat.com/world/5248310-israel-army-says-iran-using-cluster-munitions,0.89,2052,0,2052
12,worldnews,White House halts security bulletin warning of Iran related threats,https://www.reuters.com/world/us/white-house-halts-security-bulletin-warning-iran-related-threats-2026-03-07/,0.98,1822,0,1822
13,worldnews,"Saudi has told Iran not to attack it, warns of possible retaliation",https://www.reuters.com/world/middle-east/saudi-has-told-iran-not-attack-it-warns-possible-retaliation-sources-say-2026-03-07/,0.97,1366,0,1366
14,worldnews,"Loud blast heard near US embassy in Oslo, Norway, police say",https://www.reuters.com/world/europe/loud-blast-heard-near-us-embassy-oslo-norway-police-say-2026-03-08/,0.93,693,0,693
15,worldnews,"Trump rejects settling war with Iran, raises notion of eliminating all its potential leaders",https://www.ksl.com/article/51458624/trump-says-iran-will-be-hit-very-hard-on-saturday,0.93,526,0,526
16,worldnews,Venezuela’s Machado Fights to Be Heard as Trump Embraces Rival,https://www.bloomberg.com/news/articles/2026-03-07/venezuela-s-machado-fights-to-be-heard-as-trump-embraces-rival,0.92,513,0,513
17,worldnews,"'No way' Iran’s footballers can return home, with calls to protect them in Australia - ABC News",https://www.abc.net.au/news/2026-03-07/iran-women-s-football-calls-for-protection-womens-asian-cup/106428380,0.91,482,0,482
18,worldnews,Trump says school strike 'done by Iran',https://www.rfi.fr/en/middle-east/20260307-trump-says-school-strike-done-by-iran,0.77,460,0,460
19,worldnews,Laden Iranian ships depart Chinese port tied to key military chemicals,https://www.washingtonpost.com/investigations/2026/03/07/laden-iranian-ships-depart-chinese-port-tied-key-military-chemicals/,0.92,240,0,240
20,worldnews,/r/WorldNews Discussion Thread: US and Israel launch attack on Iran; Iran retaliates (Thread #6),https://www.reddit.com/r/worldnews/comments/1rmf1ro/rworldnews_discussion_thread_us_and_israel_launch/,0.91,236,0,236
21,worldnews,Israel kills dozens in Lebanon after failed mission to find pilot’s remains,https://www.theguardian.com/world/2026/mar/07/israel-strikes-eastern-lebanon-killing-dozens-after-raid-to-recover-idf-pilots-remains-fails,0.69,197,0,197
22,worldnews,"After initially voicing support, Trump says he doesn't want Kurds to enter Iran war",https://www.timesofisrael.com/after-initially-voicing-support-trump-says-he-doesnt-want-kurds-to-enter-iran-war/,0.9,170,0,170
23,worldnews,U.S. weighs sending special forces to seize Iran's nuclear stockpile,https://www.axios.com/2026/03/08/iran-ground-troops-special-forces-nuclear,0.94,136,0,136
24,worldnews,"/r/WorldNews Live Thread: Russian Invasion of Ukraine Day 1473, Part 1 (Thread #1620)",https://www.reddit.com/r/worldnews/comments/1rnupfq/rworldnews_live_thread_russian_invasion_of/,0.97,120,0,120
