,subreddit,title,url,upvote_ratio,ups,downs,score
0,worldnews,Russia 'Cannot Accept' Trump's Ukraine Peace Plans,https://www.newsweek.com/russia-cannot-accept-trump-ukraine-peace-plans-2053585,0.94,45192,0,45192
1,worldnews,Germany launches permanent troop deployment on NATO’s eastern flank,https://www.politico.eu/article/germany-launch-permanent-troop-deployment-lithuania-nato-eastern-flank-russia-ukraine/,0.97,28527,0,28527
2,worldnews,"Leaders of Canada, Mexico discuss plan to fight trade actions by US",https://www.reuters.com/world/americas/leaders-canada-mexico-discuss-plan-fight-trade-actions-by-us-2025-04-01/,0.98,7394,0,7394
3,worldnews,Moldovan president criticizes Russia for ‘unacceptable interference’,https://tvpworld.com/85927196/moldovan-president-criticizes-russia-for-unacceptable-interference,0.99,5293,0,5293
4,worldnews,Finland plans to withdraw from Ottawa landmines treaty,https://www.reuters.com/world/europe/finland-plans-withdraw-landmines-treaty-prime-minister-says-2025-04-01/,0.98,5158,0,5158
5,worldnews,UK open to Canadian involvement in new fighter jet project,https://ukdefencejournal.org.uk/uk-open-to-canadian-involvement-in-new-fighter-jet-project/,0.98,5104,0,5104
6,worldnews,Hamas ‘quietly drops’ thousands of deaths from casualty figures,https://www.yahoo.com/news/hamas-quietly-drops-thousands-deaths-122557133.html,0.81,4665,0,4665
7,worldnews,"European Union 'ready to retaliate' to US Trump trade tariffs, says commission president",https://www.abc.net.au/news/2025-04-01/eu-ready-to-retaliate-to-trump-trade-tariffs/105124630,0.98,4583,0,4583
8,worldnews,Putin launches largest military draft in years despite ceasefire talks,https://www.newsweek.com/putin-largest-military-draft-despite-ceasefire-talks-2053658,0.97,4381,0,4381
9,worldnews,Mexico bans junk food sales in schools in an attempt to reduce child obesity,https://www.eleconomista.com.mx/politica/entra-vigor-prohibicion-venta-comida-chatarra-escuelas-20250328-752553.html,0.99,4219,0,4219
10,worldnews,"Lithuanian foreign minister: Russia offers three scenarios – war, threat or occupation",https://www.pravda.com.ua/eng/news/2025/04/1/7505509/,0.98,2736,0,2736
11,worldnews,Le Pen judge placed under police protection after receiving ‘personal threats’,https://www.politico.eu/article/marine-le-pen-police-judge-trial-elections-france-funds/,0.98,2080,0,2080
12,worldnews,"Russia dropped over 10,000 guided bombs on Ukraine in just three months",https://www.pravda.com.ua/eng/news/2025/04/1/7505538,0.96,1868,0,1868
13,worldnews,"Russia Dismisses Claims Of Blood-Coughing Mystery Virus, Cites Common Respiratory Infections",https://www.ndtv.com/world-news/russia-dismiss-claims-of-blood-coughing-mystery-virus-cite-common-respiratory-infections-8063530/amp/1,0.97,1692,0,1692
14,worldnews,"Finland to exit landmines treaty and hike defense spending given Russia threat, prime minister says",https://www.cnn.com/2025/04/01/europe/finland-landmines-treaty-orpo-intl/index.html,0.99,1518,0,1518
15,worldnews,Carney pauses campaign to return to Ottawa ahead of U.S. tariffs.,https://www.ctvnews.ca/federal-election-2025/article/carney-pauses-campaign-to-return-to-ottawa-ahead-of-us-tariffs-live-election-updates-here/,0.96,1215,0,1215
16,worldnews,Gulf states refuse to be launching pad for any US attacks against Iran,https://www.middleeasteye.net/news/gulf-states-refuse-launching-pad-for-us-attacks-iran,0.97,1125,0,1125
17,worldnews,Italy slams door on people hoping to claim citizenship through great-grandparents,https://www.cnn.com/2025/04/01/travel/italy-law-halts-citizenship-through-great-grandparents/index.html,0.96,1104,0,1104
18,worldnews,China’s military launches live-fire exercise in escalation of ongoing surprise drills near Taiwan,https://www.cnn.com/2025/04/01/china/china-taiwan-drills-live-fire-escalation-intl-hnk?cid=ios_app,0.97,1057,0,1057
19,worldnews,White House issues warning to China for war games near Taiwan,https://thehill.com/policy/defense/5226931-white-house-china-war-games-near-taiwan/,0.94,824,0,824
20,worldnews,"Russia's territorial gains in Ukraine drop to lowest level since June 2024, monitoring group says",https://kyivindependent.com/russias-territorial-gains-in-ukraine-drop-to-lowest-level-since-june-2024-monitoring-group-says/,0.97,574,0,574
21,worldnews,CTV Cancelled a Fact-Checking Segment in Response to Political Pressure From Pierre Poilievre's Conservatives,https://pressprogress.ca/ctv-cancelled-a-fact-checking-segment-in-response-to-political-pressure-from-pierre-poilievres-conservatives/,0.96,486,0,486
22,worldnews,"Ukraine's NATO membership not included, never was in minerals deal, Zelensky says",https://kyivindependent.com/minerals-deal-does-not-cover-ukraine-nato-membership-eu-membership-being-discussed-zelensky-says/,0.98,456,0,456
23,worldnews,Labor prepares to challenge Trump administration at World Trade Organization over tariffs,https://www.abc.net.au/news/2025-04-02/government-could-challenge-trump-at-world-trade-organisation-/105127142?utm_source=abc_news_app&amp;utm_medium=content_shared&amp;utm_campaign=abc_news_app&amp;utm_content=link,0.97,418,0,418
24,worldnews,‘Woke ideology’: Quebec professors denounce Poilievre’s pledge to end certain university research funding,https://www.montrealgazette.com/news/canada/canadian-politics/article850096.html,0.9,208,0,208
25,worldnews,"/r/WorldNews Live Thread: Russian Invasion of Ukraine Day 1133, Part 1 (Thread #1280)",https://www.reddit.com/live/18hnzysb1elcs,0.95,154,0,154
