,subreddit,title,url,upvote_ratio,ups,downs,score
0,worldnews,Trump Gave Europe Three Weeks to Sign Off on Ukraine 'Surrender': MEP,https://www.newsweek.com/trump-europe-troops-ukraine-peace-deal-2033823,0.9,37553,0,37553
1,worldnews,Ukrainian female POWs tortured and paraded naked through the snow by Russian troops,https://www.telegraph.co.uk/global-health/women-and-girls/ukrainian-female-pows-tortured-and-paraded-naked-by-russian/,0.94,37511,0,37511
2,worldnews,"A news conference between Zelenskyy and Donald Trump’s Ukraine envoy is cancelled at U.S. request, a Kyiv official says",https://www.yahoo.com/news/news-conference-between-zelenskyy-donald-145352510.html,0.96,24626,0,24626
3,worldnews,US Reportedly Halts Weapon Sales to Ukraine,https://www.kyivpost.com/post/47529,0.95,23790,0,23790
4,worldnews,Macron is considering increasing France's military spending from 2.1% to 5% of GDP,https://www.francetvinfo.fr/societe/armee-securite-defense/emmanuel-macron-envisage-d-augmenter-les-depenses-militaires-de-la-france-de-2-1-a-5-du-pib_7086573.html,0.98,19845,0,19845
5,worldnews,World leaders head to Ukraine as Trump cozies up to Putin,https://www.politico.eu/article/world-leaders-head-to-ukraine-as-trump-cozies-up-to-putin/,0.97,18899,0,18899
6,worldnews,"US opposes calling Russia aggressor in G7 statement marking 3rd year of full-scale war in Ukraine, FT says",https://www.pravda.com.ua/eng/news/2025/02/20/7499285/,0.97,9805,0,9805
7,worldnews,"‘Transatlantic relations are over’ as Trump sides with Putin, says top German MP",https://www.politico.eu/article/transatlantic-relations-over-donald-trump-sides-vladimir-putin-top-german-mp-michael-roth/,0.98,9209,0,9209
8,worldnews,New poll says 27% of Canadians view the United States as an enemy country,https://www.ctvnews.ca/canada/article/new-poll-says-27-of-canadians-view-the-united-states-as-an-enemy-country/,0.97,6971,0,6971
9,worldnews,Mexico to reform constitution in wake of US terrorism designations,https://www.yahoo.com/news/mexico-reform-constitution-wake-us-153923338.html,0.97,6895,0,6895
10,worldnews,Erdogan also supports our NATO membership: Ukrainian President Zelenskyy,https://www.turkiyetoday.com/world/erdogan-also-supports-our-nato-membership-ukrainian-president-zelenskyy-121855/,0.98,5862,0,5862
11,worldnews,"US refuses to co-sponsor UN resolution condemning Russia, resists labeling Moscow 'aggressor' in G7 statement, media report",https://kyivindependent.com/us-refuses-to-co-sponsor-un-resolution-condemning-russia-resists-g7s-language-on-moscow/,0.98,5744,0,5744
12,worldnews,Germany’s Left comes back from the dead,https://www.politico.eu/article/germany-left-party-die-linke-rising-young-voters-heidi-reichinnek/,0.96,4596,0,4596
13,worldnews,IDF confirms Bibas children murdered in Hamas captivity; third body not mother's,https://www.ynetnews.com/article/sksmuehcyl,0.88,4186,0,4186
14,worldnews,"Moscow demanded NATO withdrawal from eastern Europe during US-Russia talks, FT reports",https://kyivindependent.com/moscow-demands-nato-withdrawal-from-eastern-europe-in-us-russia-talks-ft-reports/,0.98,4026,0,4026
15,worldnews,Islamic militants behead 70 Christians in a Church in the Democratic Republic of Congo,https://www.newsweek.com/christians-beheaded-congo-drc-2033864,0.94,2807,0,2807
16,worldnews,‘Suspected terror attack’ in Israel as multiple buses explode in Tel Aviv,https://www.independent.co.uk/news/world/middle-east/israel-bus-explosion-terror-attack-b2701887.html,0.93,2682,0,2682
17,worldnews,Elon Musk recommends that the International Space Station be deorbited ASAP,https://arstechnica.com/space/2025/02/elon-musk-recommends-that-the-international-space-station-be-deorbited-asap/,0.91,2590,0,2590
18,worldnews,"In Saudi Arabia Trump talks with Russia were far beyond Ukraine, discussing NATO withdrawal from whole Eastern Europe. Romania, Poland, Lithuania all jumped into private negotiations with US to prevent that",https://www.romania-insider.com/romania-usa-nato-russia-february-2025,0.97,2483,0,2483
19,worldnews,War-Hardened Ukrainians Remain Defiant In Face of Trump’s Blows,https://www.bloomberg.com/news/articles/2025-02-20/war-hardened-ukrainians-remain-defiant-in-face-of-trump-s-blows,0.98,2429,0,2429
20,worldnews,"Trudeau after Canada win over U.S.: ""You can't take our country"" or ""our game""",https://www.axios.com/2025/02/21/canada-usa-hockey-4-nations-trump-photos,0.96,1576,0,1576
21,worldnews,"France's Macron Will Tell Trump He Cannot ""Be Weak"" With Putin",https://www.ndtv.com/world-news/frances-emmanuel-macron-says-will-tell-donald-trump-he-cannot-be-weak-with-vladimir-putin-7757554,0.97,1574,0,1574
22,worldnews,Greenlandic politician describes struggle to remember 'America has good people',https://www.npr.org/2025/02/20/nx-s1-5304030/greenlandic-politician-describes-struggle-to-remember-america-has-good-people,0.94,993,0,993
23,worldnews,"Russia offering US deal on natural resources, access to Arctic",https://kyivindependent.com/russia-offers-us-deal-on-its-natural-resources-access-to-arctic/,0.94,820,0,820
24,worldnews,Ukrainians rally around their president after Trump seeks to denigrate him,https://apnews.com/article/ukraine-russia-trump-zelenskyy-putin-c0790f9054c6c69d698ed9aa816158ac,0.98,378,0,378
25,worldnews,"/r/WorldNews Live Thread: Russian Invasion of Ukraine Day 1093, Part 1 (Thread #1240)",https://www.reddit.com/live/18hnzysb1elcs,0.98,141,0,141
