,subreddit,title,url,upvote_ratio,ups,downs,score
0,worldnews,Meta hit with record-breaking $1.3 billion fine over Facebook data transfers to the US,https://www.theverge.com/2023/5/22/23732461/meta-eu-privacy-fine-us-data-transfers-1-3-billion,0.95,52425,0,52425
1,worldnews,Anti-Putin militia claims to have overrun Russian border village,https://www.theguardian.com/world/2023/may/22/anti-kremlin-militia-freedom-of-russia-legion-overrun-russian-border-village-kozinka,0.92,41419,0,41419
2,worldnews,Mexico unveils new non-binary passport: ‘Diversity enriches and flourishes’,https://www.thepinknews.com/2023/05/21/mexico-gender-marker-passports/,0.87,9093,0,9093
3,worldnews,Russia says it battles saboteurs in cross-border raid from Ukraine,https://www.reuters.com/world/europe/ukraine-says-it-advances-bakhmuts-flanks-entrap-russians-2023-05-22/,0.97,6062,0,6062
4,worldnews,Scientists say they found a chapter of the Bible hidden under other text for more than a thousand years,https://www.businessinsider.com/scientists-find-bible-chapter-hidden-for-thousands-of-years-2023-5,0.93,5119,0,5119
5,worldnews,Russia transport nuclear weapons from storage facility in Belgorod Oblast – Intelligence,https://www.pravda.com.ua/eng/news/2023/05/22/7403366/,0.97,4574,0,4574
6,worldnews,Ukrainian pilots have started training with F-16s − Borrell,https://www.pravda.com.ua/eng/news/2023/05/22/7403262/,0.97,4358,0,4358
7,worldnews,Morocco Takes First Place at African Mathematics Olympiad,https://www.moroccoworldnews.com/2023/05/355565/morocco-takes-first-place-at-african-mathematics-olympiad,0.95,4264,0,4264
8,worldnews,NATO Parliamentary Assembly recognizes Russian crimes in Ukraine as genocide,https://kyivindependent.com/nato-parliamentary-assembly-recognizes-russian-crimes-in-ukraine-as-genocide/,0.97,3967,0,3967
9,worldnews,Russian Business Leaders Demand 6-day Work Week,https://www.politico.eu/article/back-to-the-soviet-future-russia-business-demand-6-day-work-week-to-cope-with-sanctions-war-ukraine/,0.96,3880,0,3880
10,worldnews,Finland terminates pipeline contract with Russian state-owned supplier,https://yle.fi/a/74-20032869,0.98,3447,0,3447
11,worldnews,Ireland to introduce world-first alcohol health labelling policy,https://www.theguardian.com/world/2023/may/22/ireland-to-introduce-world-first-alcohol-health-labelling-policy,0.97,3277,0,3277
12,worldnews,"Ukrainian nuclear plant is ""extremely vulnerable,"" U.N. official warns, after 7th power outage of war",https://www.cbsnews.com/news/ukraine-nuclear-plant-zaporizhzhia-power-outage-iaea-warning-extremely-vulnerable/,0.98,2868,0,2868
13,worldnews,An 'extremely rare' rainbow sea slug was spotted along the coast of England,https://www.npr.org/2023/05/18/1176753033/rainbow-sea-slug-england,0.97,2855,0,2855
14,worldnews,Wagner company tries to buy military equipment through Mali – US State Department,https://www.pravda.com.ua/eng/news/2023/05/22/7403391/,0.97,2708,0,2708
15,worldnews,Ukraine denies any involvement in armed action in Russian Belgorod,https://tvpworld.com/70027201/ukraine-denies-any-involvement-in-armed-action-in-russian-belgorod,0.97,2350,0,2350
16,worldnews,Millions in Mexico warned to prepare for evacuation as Popocatépetl volcano spews ash,https://edition.cnn.com/2023/05/22/americas/mexico-volcano-popocatepetl-latam-intl/index.html,0.97,1941,0,1941
17,worldnews,Pro-Ukrainian Russian partisans advance into Russia’s Belgorod region in surprise raid,https://www.yahoo.com/news/pro-ukrainian-russian-partisans-advance-into-russias-belgorod-region-in-surprise-raid-172049892.html,0.97,1273,0,1273
18,worldnews,Frantic Hunting Mission Erupts After Raid on Russian Town,https://news.yahoo.com/frantic-hunting-mission-erupts-raid-142214530.html,0.96,1005,0,1005
19,worldnews,"/r/WorldNews Live Thread: Russian Invasion of Ukraine Day 454, Part 1 (Thread #595)",https://www.reddit.com/live/18hnzysb1elcs,0.96,676,0,676
20,worldnews,"Mexico raises alert level as volcano ejects smoke, ash, lava",https://www.yahoo.com/news/mexico-raises-alert-level-volcano-223420069.html,0.96,631,0,631
21,worldnews,"Armenian Prime Minister Nikol Pashinyan said Monday that his country could withdraw from Moscow-led Collective Security Treaty Organization (CSTO), in a fresh show of discontent over the lack of support from its ally Russia",https://www.themoscowtimes.com/2023/05/22/armenia-might-quit-russia-led-military-bloc-pm-a81235,0.96,622,0,622
22,worldnews,A fifth of humans could be exposed to dangerous heat by end of century.,https://www.thenationalnews.com/world/2023/05/22/a-fifth-of-humans-could-be-exposed-to-dangerous-heat-by-end-of-century/,0.93,538,0,538
23,worldnews,"2,500-year-old Pre-Columbian sculpture returned to Mexico",https://www.artnews.com/art-news/news/pre-columbian-olmec-sculpture-returned-to-mexico-1234669329/,0.95,426,0,426
24,worldnews,"U.S., Papua New Guinea sign defense pact amid competition with China",https://english.kyodonews.net/news/2023/05/623c6ef952ea-us-papua-new-guinea-sign-defense-pact-amid-competition-with-china.html,0.95,405,0,405
25,worldnews,Junior doctors in England to strike for three days in June,https://www.bbc.co.uk/news/health-65673576,0.94,290,0,290
