,subreddit,title,url,upvote_ratio,ups,downs,score
0,worldnews,Russian council faces dissolution after call for Putin's removal,https://www.reuters.com/world/europe/russian-council-faces-dissolution-after-call-putins-removal-2022-09-13/,0.92,68519,0,68519
1,worldnews,"Europe is paying the price for its naivety about Russia, says Finnish PM",https://www.brusselstimes.com/289058/europe-is-paying-the-price-for-its-naivety-about-russia-finnish-p-m-says,0.95,16208,0,16208
2,worldnews,Putin calls for calm as Azerbaijan and Armenia clash in worst fighting since 2020,https://www.reuters.com/world/armenian-russian-defence-ministers-discuss-nagorno-karabakh-after-flare-up-2022-09-13/,0.95,13268,0,13268
3,worldnews,Bodies of more civilians murdered by the Russians found in liberated Kharkiv oblast village,https://khpg.org/en/1608811151,0.98,8784,0,8784
4,worldnews,Ukraine reclaims control of entire Kharkiv region and towns seized at onset of Russian invasion,https://www.theguardian.com/world/2022/sep/13/ukraine-reclaim-control-of-kharkiv-and-towns-seized-at-onset-of-russian-invasion,0.98,7246,0,7246
5,worldnews,Georgia proposes to hold a referendum and ask if Georgians want war with Russia,https://odessa-journal.com/georgia-proposes-to-hold-a-referendum-and-ask-if-georgians-want-war-with-russia/,0.97,7071,0,7071
6,worldnews,Ukraine Arrests Russian Teachers in Regained Areas,https://www.themoscowtimes.com/2022/09/13/ukraine-arrests-russian-teachers-in-regained-areas-a78771,0.96,6322,0,6322
7,worldnews,"In call with Putin, Scholz demands 'complete withdrawal' from Ukraine - Insider Paper",https://insiderpaper.com/in-call-with-putin-scholz-demands-complete-withdrawal-from-ukraine/,0.98,4276,0,4276
8,worldnews,Ukrainian army shoots down first Russian-purchased Iranian drone – StratCom of Ukrainian Armed Forces,https://www.pravda.com.ua/eng/news/2022/09/13/7367248/,0.98,3691,0,3691
9,worldnews,China Accuses the NSA of Hacking a Top University to Steal Data,https://gizmodo.com/china-nsa-northwestern-polytechnical-university-hack-1849530364,0.92,1854,0,1854
10,worldnews,Grain corridor: 130 ships with almost 3M tonnes of grain have already left Ukrainian ports,https://www.ukrinform.net/rubric-economy/3570819-grain-corridor-130-ships-with-almost-3m-tonnes-of-grain-have-already-left-ukrainian-ports.html,0.98,1600,0,1600
11,worldnews,Investors with $39 trillion urge governments to plan fossil fuel phase out,https://www.reuters.com/business/sustainable-business/investors-with-39-tln-urge-govts-plan-fossil-fuel-phase-out-2022-09-13/,0.94,1420,0,1420
12,worldnews,Russian bonds are back on the market for a week as sanctions are temporarily lifted,https://www.msn.com/en-in/money/markets/russian-bonds-are-back-on-the-market-for-a-week-as-sanctions-are-temporarily-lifted-and-investors-have-already-put-in-bids-for-over-dollar1-billion-in-debt/ar-AA11Mu87,0.92,1188,0,1188
13,worldnews,UN chief says 'fossil fuel free-for-all' must end as report warns world heading in 'wrong direction',https://edition.cnn.com/2022/09/13/world/climate-wmo-report-un-intl/index.html,0.94,1056,0,1056
14,worldnews,"Germany is reportedly working on a new trade policy to reduce dependence on China, as economy minister says the country can't allow itself to be 'blackmailed'",https://markets.businessinsider.com/news/stocks/germany-trade-china-trade-unfair-practices-dependence-russia-energy-crisis-2022-9?utm_source=feedly&amp;utm_medium=webfeeds,0.96,931,0,931
15,worldnews,"‘We were afraid things would be bad, but never this’: A year after the fall of Kabul, Afghans face many crises",https://www.msn.com/en-gb/news/world/we-were-afraid-things-would-be-bad-but-never-this-a-year-after-the-fall-of-kabul-afghans-face-many-crises/ar-AA10EKfd,0.95,887,0,887
16,worldnews,"Iran is not ‘a willing partner’ on reviving nuclear deal, U.S. says",https://www.reuters.com/world/middle-east/iran-is-not-a-willing-partner-reviving-nuclear-deal-us-says-2022-09-13/,0.95,837,0,837
17,worldnews,Rapid loss of territory in Ukraine reveals spent Russian military,https://www.msn.com/en-us/news/world/rapid-loss-of-territory-in-ukraine-reveals-spent-russian-military/ar-AA11MSJa,0.97,614,0,614
18,worldnews,"Putin and Xi to discuss Ukraine and Taiwan, Kremlin says",https://www.reuters.com/world/putin-xi-discuss-ukraine-taiwan-kremlin-says-2022-09-13/,0.94,585,0,585
19,worldnews,"/r/WorldNews Live Thread: Russian Invasion of Ukraine Day 203, Part 1 (Thread #343)",https://www.reddit.com/live/18hnzysb1elcs,0.97,482,0,482
20,worldnews,India upset at US F-16 support to Pak as reward for ammo supply to Ukraine,https://www.hindustantimes.com/world-news/india-upset-at-us-f-16-support-to-pak-as-reward-for-ammo-supply-to-ukraine-101663125081392-amp.html,0.82,396,0,396
21,worldnews,Russian council faces dissolution after call for Putin's removal,https://news.yahoo.com/russian-council-faces-dissolution-call-173859031.html,0.95,346,0,346
22,worldnews,Canada's Trudeau announces C$4.5 bln inflation relief package for low earners,https://www.reuters.com/world/americas/canadas-trudeau-announces-c45-bln-inflation-relief-package-low-earners-2022-09-13/,0.92,303,0,303
23,worldnews,Azerbaijan Says Will Increase Gas Exports To Europe This Year By 30 Percent,https://www.rferl.org/a/azerbaijan-increase-eu-gas-exports/32029812.html,0.94,274,0,274
24,worldnews,'Every stinking time': King Charles frustrated as leaking pen stains his hand during signing ceremony,https://www.sbs.com.au/news/article/every-stinking-time-king-charles-frustrated-as-leaking-pen-stains-his-hand-during-signing-ceremony/2rd1lxs2a,0.75,127,0,127
25,worldnews,"God does not back war, pope says in apparent criticism of Russian patriarch",https://www.reuters.com/world/asia-pacific/god-does-not-back-war-pope-says-apparent-criticism-russian-patriarch-2022-09-14/,0.95,102,0,102
26,worldnews,r/Worldnews Washington D.C. In-Person Meet-Up,https://www.reddit.com/r/worldnews/comments/xafpi7/rworldnews_washington_dc_inperson_meetup/,0.42,0,0,0
