,subreddit,title,url,upvote_ratio,ups,downs,score
0,worldnews,"Moscow explosion kills 2 Russian police officers tied to Ukrainian POW abuse, intelligence source says",https://kyivindependent.com/2-russian-police-officers-involved-in-ukrainian-pow-torture-killed-in-moscow-explosion-sources-say/,0.97,15335,0,15335
1,worldnews,Denmark responds to Trump naming Greenland envoy: ‘Completely unacceptable’,https://thehill.com/policy/international/5661680-denmark-response-trump-greenland-envoy/,0.97,11166,0,11166
2,worldnews,"Pope: Russia's refusal to observe Christmas ceasefire causes me ""much sadness""",https://www.pravda.com.ua/eng/news/2025/12/24/8013200/,0.96,9796,0,9796
3,worldnews,Zelenskyy says Ukraine will not abandon its bid to join NATO,https://english.nv.ua/russian-war/zelenskyy-says-ukraine-will-not-abandon-nato-membership-goal-50570989.html,0.97,9785,0,9785
4,worldnews,Zelensky Proposes Demilitarized Zone in Eastern Ukraine as Way to Peace,https://www.wsj.com/world/europe/zelensky-proposes-demilitarized-zone-in-eastern-ukraine-as-way-to-peace-532a36e9?st=PXoJE8&amp;mod=wsjreddit,0.97,5177,0,5177
5,worldnews,"Three killed in Moscow car explosion, say Russian authorities",https://www.theguardian.com/world/2025/dec/24/three-killed-in-moscow-car-explosion-say-russian-authorities,0.98,3596,0,3596
6,worldnews,"Reuters Exclusive: US Coast Guard lacks forces to seize Venezuela-linked tanker for now, sources say",https://www.reuters.com/world/americas/us-eyes-additional-coast-guard-assets-seize-fleeing-tanker-sources-say-2025-12-24/,0.97,3298,0,3298
7,worldnews,"China may be assisting Russia with satellite imagery. Chinese satellite images coincided with strikes on specific Ukrainian energy facilities, according to Ukrainian President and Head of the Center for Countering Disinformation",https://newsukraine.rbc.ua/news/chinese-satellite-imagery-coincided-with-1766588780.html,0.97,2921,0,2921
8,worldnews,Great Barrier Reef’s Hamilton Island to be bought by US private equity firm in reported $1.2bn sale,https://www.theguardian.com/australia-news/2025/dec/24/hamilton-island-great-barrier-reef-sold-blackstone,0.96,2707,0,2707
9,worldnews,"14 Countries, including France, Britain, Canada and Japan, Condemn Israel's Expansion Of West Bank Settlements",https://www.ctvnews.ca/world/israel-hamas-war/article/14-countries-condemn-israels-expansion-of-west-bank-settlements-statement/,0.91,2612,0,2612
10,worldnews,Venezuela warns US ‘aggression’ is first stage amid ‘continental ambitions’,https://www.aljazeera.com/amp/news/2025/12/24/venezuela-warns-us-aggression-is-first-stage-amid-continental-ambitions,0.94,2133,0,2133
11,worldnews,"Ukraine on track to receive total of 3 million FPV drones in 2025, defense minister says",https://kyivindependent.com/ukraine-on-track-to-receive-total-of-3-million-fpv-drones-in-2025/,0.98,1821,0,1821
12,worldnews,Zelensky Unveils Revised 20-Point Peace Plan,https://www.kyivpost.com/post/66845,0.95,1776,0,1776
13,worldnews,General Staff: Ukrainian forces damaged synthetic rubber enterprise in Russia,https://gwaramedia.com/en/general-staff-ukrainian-forces-damaged-synthetic-rubber-enterprise-in-russia/,0.98,1582,0,1582
14,worldnews,Huge 100-tonne fatberg found in London sewers,https://www.bbc.com/news/articles/cj9ydve2kz7o,0.95,1536,0,1536
15,worldnews,White House orders military to focus on 'quarantine' of Venezuela oil,https://www.reuters.com/world/americas/white-house-orders-us-forces-focus-quarantine-venezuela-2025-12-24/,0.95,1093,0,1093
16,worldnews,Public assemblies banned for 14 days across Sydney as police enforce new powers under protest laws,https://www.abc.net.au/news/2025-12-25/public-assemblies-banned-14-days-in-sydney-under-new-protest-law/106178406,0.94,742,0,742
17,worldnews,Multiple nations issue travel advisory as New Delhi suffers from suffocating smog: 'Extremely high levels',https://www.yahoo.com/news/articles/multiple-nations-issue-travel-advisory-004500117.html,0.94,522,0,522
18,worldnews,Algeria's parliament approves law declaring France's colonisation a crime,https://www.bbc.com/news/articles/c14vdpyj1vjo,0.87,514,0,514
19,worldnews,"Police arrest man accused of celebrating Bondi Beach shooting, discover ammunition cache",https://www.nbcnews.com/world/australia/police-arrest-man-celebrating-bondi-beach-shooting-rcna250788,0.95,504,0,504
20,worldnews,Former Netanyahu aide reveals call: ‘He knew everything and stood behind the leak’,https://www.ynetnews.com/article/h1quvnuqwx,0.92,451,0,451
21,worldnews,Korea's childbirths rise for 16th consecutive month in October: data,https://www.koreatimes.co.kr/southkorea/society/20251224/koreas-childbirths-rise-for-16th-consecutive-month-in-october-data,0.94,386,0,386
22,worldnews,"UK, Canada and Germany condemn Israel for 19 new West Bank settlements",https://www.theguardian.com/world/2025/dec/24/israel-condemned-approval-19-settlements-occupied-west-bank,0.79,254,0,254
23,worldnews,"/r/WorldNews Live Thread: Russian Invasion of Ukraine Day 1400, Part 1 (Thread #1547)",https://www.reddit.com/live/18hnzysb1elcs,0.97,156,0,156
24,worldnews,Zelensky moves towards demilitarised zones in latest peace plan for Ukraine - BBC News,https://www.bbc.co.uk/news/articles/c9d9wg2pwl1o.amp,0.93,138,0,138
