,subreddit,title,url,upvote_ratio,ups,downs,score
0,worldnews,Japan says Biden's description of nation as xenophobic is 'unfortunate',https://www.japantimes.co.jp/news/2024/05/04/japan/politics/tokyo-biden-xenophobia-response/#Echobox=1714800468,0.89,22942,0,22942
1,worldnews,Conservatives crushed by ‘worst local election result’ in years,https://www.theguardian.com/politics/article/2024/may/03/tories-face-worst-local-election-results-40-years-sunak-sunak,0.92,9607,0,9607
2,worldnews,Russia leaves thousands of planes without GPS in northern Europe,https://english.elpais.com/international/2024-05-03/russia-leaves-thousands-of-planes-without-gps-in-northern-europe.html,0.97,6214,0,6214
3,worldnews,"Armed Gazan gangs, some thought tied to Hamas, steal $70 million from Bank of Palestine",https://www.timesofisrael.com/armed-gazan-gangs-some-thought-tied-to-hamas-steal-70-million-from-bank-of-palestine/,0.89,4769,0,4769
4,worldnews,Russia puts Zelensky on wanted list ,https://novayagazeta.eu/articles/2024/05/04/russia-puts-zelensky-on-wanted-list-en-news,0.95,4241,0,4241
5,worldnews,Kremlin says Ukraine targeting forces in Crimea with U.S.-made mobile missiles - UPI.com,https://www.upi.com/Top_News/World-News/2024/05/04/world-Ukraine-ATACMS-missiles-Russia-Crimea/8501714834424/,0.97,4040,0,4040
6,worldnews,"Reportedly, Kaspersky’s AI Used in Russian Military Drones",https://thetechbasic.com/2024/05/04/reportedly-kasperskys-ai-used-in-russian-military-drones/,0.96,3951,0,3951
7,worldnews,Cuba sentences 22yo mother to 15 years in prison for publishing video of police violence during 2022 protests,https://english.elpais.com/international/2024-05-02/cuba-sentences-22-year-old-mother-to-15-years-in-prison-for-publishing-videos-of-protests.html,0.95,2831,0,2831
8,worldnews,"Qatar anticipating US request to expel Hamas leaders, is open to doing so — source",https://www.timesofisrael.com/qatar-anticipating-us-request-to-expel-hamas-leaders-is-open-to-doing-so-source/,0.96,2638,0,2638
9,worldnews,Police remove pro-Palestine protesters from Paris university,https://www.euronews.com/2024/05/04/french-police-remove-pro-palestine-protesters-from-paris-university-building,0.92,2375,0,2375
10,worldnews,Saudi authorities forbid speaking out against normalization with Israel,https://www.ynetnews.com/article/hyx00tuxgc,0.93,1789,0,1789
11,worldnews,Hamburg: Hundreds protest against 'caliphate' rally. The latest rally was organized by secular Islamic groups,https://www.dw.com/en/hamburg-hundreds-protest-against-caliphate-rally/a-68998121,0.93,1321,0,1321
12,worldnews,"IDF, Shin Bet eliminate senior PIJ terrorist who led October 7 attack",https://www.ynetnews.com/article/skmrqgnmc,0.87,862,0,862
13,worldnews,Israeli forces kill Hamas gunmen in overnight raid near West Bank&amp;#x27;s Tulkarm,https://www.reuters.com/world/middle-east/israeli-forces-kill-three-palestinians-overnight-raid-near-west-banks-tulkarm-2024-05-04/,0.88,823,0,823
14,worldnews,Boeing to launch astronauts into space aboard new capsule,https://globalnews.ca/news/10469575/boeing-space-capsule-astronauts-nasa/,0.91,790,0,790
15,worldnews,Palestinians in the Israeli-occupied West Bank say armed Jewish settlers are increasingly seizing their lands by bringing livestock to so-called shepherding outposts and refusing to leave,https://www.france24.com/en/live-news/20240504-guns-and-sheep-settlers-use-shepherding-outposts-to-seize-west-bank-land,0.75,763,0,763
16,worldnews,Georgia rocked by protests as government pushes Putin-style ‘foreign agent’ bill,https://www.cnn.com/2024/05/03/europe/georgia-russia-foreign-agent-europe-intl/index.html,0.95,762,0,762
17,worldnews,Israel insists: End to the war not part of hostage deal as Hamas is set to accept,https://allisrael.com/israel-insists-end-to-the-war-not-part-of-hostage-deal-as-hamas-is-set-to-accept,0.86,648,0,648
18,worldnews,Russia puts Ukrainian President Zelenskyy on its wanted list,https://apnews.com/article/e9714751f2481575aaf8935b132e0f31,0.88,444,0,444
19,worldnews,"'Canada is a rule-of-law country,' Trudeau says of charges in B.C. Sikh activist's killing",https://www.cbc.ca/news/politics/india-wait-canada-details-nijjar-killing-1.7194360,0.86,336,0,336
20,worldnews,G-7 Eyes Plan on US-Led $50 Billion Aid Package for Ukraine,https://www.bloomberg.com/news/articles/2024-05-03/g-7-eyes-plan-on-us-led-50-billion-aid-package-for-ukraine,0.92,326,0,326
21,worldnews,Brazil: Landslides and flooding kill 60 in Rio Grande do Sul. Worst disaster in the history of the state,https://www.bbc.com/news/articles/c0w03627kq4o,0.95,288,0,288
22,worldnews,/r/WorldNews Live Thread: Iran attacks Israel (Thread 5),https://www.reddit.com/live/1bsso361afr0r,0.82,238,0,238
23,worldnews,‘Inside an oven’: sweltering heat ravages crops and takes lives in south-east Asia,https://www.theguardian.com/environment/article/2024/may/04/inside-an-oven-how-life-in-south-east-asia-is-a-struggle-amid-sweltering-heat,0.89,164,0,164
24,worldnews,"/r/WorldNews Live Thread: Russian Invasion of Ukraine Day 802, Part 1 (Thread #948)",https://www.reddit.com/live/18hnzysb1elcs,0.93,142,0,142
25,worldnews,Saudi court ‘secretly’ hands 11-year sentence to women's rights activist,https://www.france24.com/en/middle-east/20240503-saudi-court-secretly-hands-11-year-sentence-to-women-s-rights-activist,0.92,98,0,98
26,worldnews,Bundeswehr's classified meetings found online,https://www.dw.com/en/bundeswehrs-classified-meetings-found-online/a-68999642,0.98,70,0,70
