,subreddit,title,url,upvote_ratio,ups,downs,score
0,worldnews,Rishi Sunak to be next Prime Minister after winning leadership contest,https://news.stv.tv/politics/rishi-sunak-set-to-be-next-uk-prime-minister-after-winning-leadership-contest?utm_source=app,0.89,40109,0,40109
1,worldnews,Garland announces charges against 13 alleged Chinese spies,https://www.nbcnews.com/politics/national-security/garland-hold-news-conference-significant-national-security-cases-rcna53702,0.95,31601,0,31601
2,worldnews,"Russian forces ""preparing to work under radioactive contamination"" - Moscow",https://www.reuters.com/world/russia-says-its-forces-are-preparing-work-under-radioactive-contamination-2022-10-24/,0.94,19809,0,19809
3,worldnews,Russia says the West has 'essentially stolen' its foreign currency and gold reserves as the EU eyes asset transfer to Ukraine,https://markets.businessinsider.com/news/currencies/russia-accuses-us-of-stealing-cash-gold-reserves-sanctions-ukraine-2022-10,0.95,19671,0,19671
4,worldnews,Mobilised Russians to wear Iranian-made bulletproof vests and helmets,https://www.pravda.com.ua/eng/news/2022/10/24/7373283/,0.97,5579,0,5579
5,worldnews,'You can't wait 16 hours': Quebec doctor says patient died after lengthy ER wait,https://montreal.ctvnews.ca/you-can-t-wait-16-hours-quebec-doctor-says-patient-died-after-lengthy-er-wait-1.6122220,0.95,5234,0,5234
6,worldnews,Over 200 Protesters Have Been Killed in Iran,https://www.thecut.com/2022/10/women-across-iran-are-protesting-the-morality-police.html,0.97,4178,0,4178
7,worldnews,Iran will not remain indifferent if proven Russia using its drones in Ukraine - official,https://www.reuters.com/world/iran-says-it-will-not-remain-indifferent-if-proven-russia-uses-its-drones-2022-10-24/?utm_source=reddit.com,0.96,2712,0,2712
8,worldnews,Musk businesses suspected of being indirectly involved in military operations against Taiwan,https://www.taiwannews.com.tw/en/news/4696114,0.81,2171,0,2171
9,worldnews,"Assault On Schoogirls Sparks Neighborhood Protest In Tehran, Iran",https://www.iranintl.com/en/202210249508,0.98,2124,0,2124
10,worldnews,Hungarians Take To The Streets Amid Growing Economic Turmoil,https://www.rferl.org/a/hungary-budapest-protests-economy-teachers-inflation/32098041.html,0.97,1773,0,1773
11,worldnews,Railway tracks leading to Belarus blown up in Russia’s Bryansk Oblast,https://www.pravda.com.ua/eng/news/2022/10/24/7373339/,0.98,1378,0,1378
12,worldnews,Ukraine 'Is Breaking' the Russian Army as War Reaches 8 Months: Zelensky,https://www.newsweek.com/ukraine-breaking-russian-army-war-reaches-8-months-zelensky-1754389,0.95,737,0,737
13,worldnews,Ukraine should be EU member - Scholz,https://www.ukrinform.net/rubric-polytics/3600007-ukraine-should-be-eu-member-scholz.html,0.93,721,0,721
14,worldnews,Air strike during Myanmar concert kills at least 50,https://www.reuters.com/world/asia-pacific/air-strike-during-myanmar-concert-kills-least-30-media-opposition-2022-10-24/,0.96,693,0,693
15,worldnews,National leaders gather in Berlin for Ukraine ‘Marshall Plan’,https://www.euronews.com/2022/10/25/national-leaders-gather-in-berlin-for-ukraine-marshall-plan,0.97,664,0,664
16,worldnews,Ukraine Claims Russia Uses Iranian 'Kamikaze' Drones to Save Money,https://www.newsweek.com/ukraine-claims-russia-uses-cheap-iranian-kamikaze-drones-save-money-shahed-136-1754364,0.94,486,0,486
17,worldnews,"Record-breaking chip can transmit entire internet's traffic per second. A new photonic chip design has achieved a world record data transmission speed of 1.84 petabits per second, almost twice the global internet traffic per second.",https://newatlas.com/telecommunications/optical-chip-fastest-data-transmission-record-entire-internet-traffic/,0.94,441,0,441
18,worldnews,"“Dostoevsky’s demon made me do it,” says Russian propagandist who called for Ukrainian children to be killed",https://www.pravda.com.ua/eng/news/2022/10/24/7373331/,0.91,437,0,437
19,worldnews,"/r/WorldNews Live Thread: Russian Invasion of Ukraine Day 244, Part 1 (Thread #385)",https://www.reddit.com/live/18hnzysb1elcs,0.97,408,0,408
20,worldnews,"Ally of Brazil’s Bolsonaro refuses arrest, attacks police with gun and grenades",https://www.rawstory.com/ally-of-brazils-bolsonaro-refuses-arrest-police-with-gun-and-grenades/,0.94,322,0,322
21,worldnews,Rotax Engine Found In Iranian Mohajer-6 Drone Downed Over Ukraine,https://www.thedrive.com/the-war-zone/rotax-engine-found-in-iranian-mohajer-6-drone-downed-over-ukraine,0.95,236,0,236
22,worldnews,Immune system-evading hybrid virus observed for first time,https://www.theguardian.com/science/2022/oct/24/immune-system-evading-hybrid-virus-observed-for-first-time-rsv-and-influenza,0.94,216,0,216
23,worldnews,China's richest people lost about $13 billion in just one day due to a market sell-off after President Xi Jinping secured a third term,https://www.businessinsider.com/china-richest-people-lost-13-billion-market-selloff-xi-congress-2022-10?r=US&amp;IR=T,0.97,207,0,207
24,worldnews,Ukraine to Orban: Without sanctions pressure and EU help Russian tanks will reach Budapest,https://www.ukrinform.net/rubric-polytics/3600260-ukraine-to-orban-without-sanctions-pressure-and-eu-help-russian-tanks-will-reach-budapest.html,0.91,196,0,196
25,worldnews,"King Charles To Meet With New UK PM Rishi Sunak, First Non-White Prime Minister",https://www.ibtimes.com/king-charles-meet-new-uk-pm-rishi-sunak-first-non-white-prime-minister-3627681,0.83,157,0,157
