,subreddit,title,url,upvote_ratio,ups,downs,score
0,worldnews,Japan redefines rape and raises age of consent in landmark move,https://www.bbc.co.uk/news/world-asia-65887198,0.92,45512,0,45512
1,worldnews,"Uruguay will melt down a bronze eagle found on a sunken World War II-era Nazi destroyer off its coast 13 years ago, and recast it as a dove of peace, the South American country's president said Friday",https://www.france24.com/en/live-news/20230616-uruguay-to-melt-nazi-bronze-eagle-recast-it-as-peace-dove,0.94,20242,0,20242
2,worldnews,Cash-strapped Taliban selling tickets to ruins of Buddhas it blew up,https://nationalpost.com/news/world/cash-strapped-taliban-selling-tickets-to-ruins-of-buddhas-it-blew-up,0.97,6929,0,6929
3,worldnews,Russia accuses Australia of 'Russophobic hysteria' for blocking second embassy on security grounds,https://abcnews.go.com/International/wireStory/russia-accuses-australia-russophobic-hysteria-blocking-embassy-security-100134424,0.95,6059,0,6059
4,worldnews,Canada Population Expected to hit 40 million today,https://www.cbc.ca/news/politics/canada-population-40-million-1.6878211,0.94,5982,0,5982
5,worldnews,Canada just seized one of Russia's dwindling supply of massive heavy-lift cargo planes,https://www.businessinsider.com/canada-seized-one-of-russias-few-remaining-an124-cargo-planes-2023-6,0.97,5825,0,5825
6,worldnews,Russia May Attack Third-Country Airfields If Ukrainian F-16 Are Based On Them - Putin,https://ukranews.com/en/news/939302-russia-may-attack-third-country-airfields-if-ukrainian-f-16-are-based-on-them-putin,0.94,4833,0,4833
7,worldnews,Climate change: UN to unmask fossil fuel lobbyists at climate talks,https://www.bbc.com/news/science-environment-65917660,0.96,3967,0,3967
8,worldnews,Explosions rock Kyiv as African peace mission visits Ukraine,https://www.reuters.com/world/south-african-president-arrives-ukraine-peace-mission-2023-06-16/,0.97,3934,0,3934
9,worldnews,Ukraine: Russia Is Throwing Cash at Troops to Destroy U.S. Vehicles in Ukraine,https://www.thedailybeast.com/russia-is-throwing-cash-at-troops-to-destroy-us-vehicles-in-ukraine,0.95,2778,0,2778
10,worldnews,South African president's security team held on plane in Warsaw since Thursday due to carrying weapons without permits,https://ewn.co.za/2023/06/16/after-21-hours-at-warsaw-airport-ramaphosa-s-security-detail-cleared-to-leave,0.97,2739,0,2739
11,worldnews,"Ukraine's chief rabbi responded to Putin, who called Zelensky ""a disgrace to the Jewish people. """,https://the-news.com.ua/en/single/golovnii-rabin-ukrayini-vidpoviv-putinu-iakii-nazvav-zelens-kogo-gan-boiu-ievreis-kogo,0.94,1831,0,1831
12,worldnews,"If we see F-16 over Ukraine, we will think it carries nuclear weapons - Russian Foreign Ministry",https://the-news.com.ua/en/single/iakshcho-mi-pobachimo-nad-ukrayinoiu-f-16-to-budemo-dumati-shcho,0.92,1824,0,1824
13,worldnews,Putin says Russia positions nuclear bombs in Belarus as warning to West,https://www.reuters.com/world/europe/putin-says-russia-positions-nuclear-bombs-belarus-warning-west-2023-06-16/,0.93,1739,0,1739
14,worldnews,"NATO moves to protect undersea pipelines, cables as concern mounts over Russian sabotage threat",https://apnews.com/article/nato-russia-sabotage-pipelines-cables-infrastructure-507929033b05b5651475c8738179ba5c,0.97,1450,0,1450
15,worldnews,US beats China to build new military bases in Papua New Guinea | Agreement of 15-year pact could grant American forces vital staging grounds in the event of a conflict in the Taiwan Strait,https://www.telegraph.co.uk/world-news/2023/06/15/america-build-new-military-bases-papua-new-guinea/,0.96,1293,0,1293
16,worldnews,The African delegation stated russian shelling of Kyiv was “disinformation and untruth”,https://ukrainefrontlines.com/news/ukraine/the-african-delegation-stated-russian-shelling-of-kyiv-was-disinformation-and-untruth/,0.93,1207,0,1207
17,worldnews,Hugo Boss made millions in Russia after the invasion of Ukraine,https://b4ukraine.org/whats-new/hugo-boss-made-millions-in-russia,0.95,1171,0,1171
18,worldnews,"‘Almost still shines’: 3,000-year-old sword unearthed in Germany",https://www.theguardian.com/world/2023/jun/16/till-shines-3300-year-old-sword-found-in-germany-bronze-age-grave-bavaria?CMP=Share_AndroidApp_Other,0.96,1153,0,1153
19,worldnews,World breaks average temperature record for early June,https://www.dawn.com/news/1760021/world-breaks-average-temperature-record-for-early-june,0.94,1125,0,1125
20,worldnews,Boris Johnson breaks ministerial code with new Mail job,https://www.bbc.co.uk/news/uk-politics-65930008,0.94,987,0,987
21,worldnews,"NATO may remove some hurdles on Ukraine's path to membership, Germany says",https://www.reuters.com/world/nato-may-remove-some-hurdles-ukraines-path-membership-germany-2023-06-16/,0.94,859,0,859
22,worldnews,"Canada to add 15 Leopard tanks, 130 troops to NATO battlegroup in Latvia |",https://globalnews.ca/news/9773472/canada-latvia-nato-tanks-troops/,0.94,704,0,704
23,worldnews,Ukraine tells African mission no peace talks till Russian withdrawal,https://tvpworld.com/70610748/ukraine-tells-african-mission-no-peace-talks-till-russian-withdrawal,0.96,592,0,592
24,worldnews,Six hypersonic missiles downed over Kyiv in fresh blow to Putin,https://www.yahoo.com/lifestyle/ukraine-russia-news-live-kyiv-025512740.html,0.98,552,0,552
25,worldnews,"/r/WorldNews Live Thread: Russian Invasion of Ukraine Day 479, Part 1 (Thread #620)",https://www.reddit.com/live/18hnzysb1elcs,0.99,322,0,322
