,subreddit,title,url,upvote_ratio,ups,downs,score
0,worldnews,Zimbabwe orders cull of 200 elephants amid food shortages from drought,https://www.theguardian.com/world/2024/sep/14/zimbabwe-orders-cull-of-200-elephants-amid-food-shortages-from-drought,0.92,16178,0,16178
1,worldnews,Zelenskyy reproaches Ukraine's allies: so far only Belarus shoots down Russian Shaheds,https://www.pravda.com.ua/eng/news/2024/09/13/7474919/,0.94,13770,0,13770
2,worldnews,Kremlin Revives Soviet-Style Youth Indoctrination as It Eyes ‘Forever War’ With Ukraine and the West,https://www.themoscowtimes.com/2024/09/13/kremlin-revives-soviet-style-youth-indoctrination-as-it-eyes-forever-war-with-ukraine-and-the-west-a86367,0.95,13042,0,13042
3,worldnews,Women in Iran are going without hijabs as the 2nd anniversary of Mahsa Amini's death approaches,https://apnews.com/article/iran-hijab-protests-mahsa-amini-anniversary-59641e9254eea45c069b54d590c7e818,0.98,8487,0,8487
4,worldnews,Ukrainians in Kursk Hit Back at Russian Counterattack,https://www.kyivpost.com/post/38991,0.98,4244,0,4244
5,worldnews,Finland has announced a new aid package for Ukraine worth 118 million euros ,https://odessa-journal.com/finland-has-announced-a-new-aid-package-for-ukraine-worth-118-million-euros,0.98,3534,0,3534
6,worldnews,Polish FM says Ukraine has right to use Western weapons to prevent war crimes,"https://www.polskieradio.pl/395/9766/Artykul/3424445,polish-fm-says-ukraine%C2%A0has-right-to-use-western-weapons-to-prevent-war-crimes",0.97,2915,0,2915
7,worldnews,"U.S., Britain alarmed Russia 'shared nuclear secrets' with Iran - report - i24NEWS",https://www.i24news.tv/en/news/international/artc-u-s-britain-alarmed-russia-shared-nuclear-secrets-with-iran-report,0.97,2899,0,2899
8,worldnews,North Korean missiles rain down on Ukraine despite sanctions,https://www.japantimes.co.jp/news/2024/09/12/world/north-korea-missiles-ukraine/,0.97,2693,0,2693
9,worldnews,4 ISIS leaders killed in raid that left 7 US service members injured ,https://abcnews.go.com/International/4-isis-leaders-killed-raid-left-7-us/story?id=113680017,0.96,2602,0,2602
10,worldnews,NATO could have done more to avert Ukraine war: Stoltenberg,https://www.politico.eu/article/nato-russia-ukraine-war-jens-stoltenberg/,0.92,2553,0,2553
11,worldnews,Russia's Medvedev Threatens Nuke Strike Would Turn Kyiv Into 'Gray Spot' On The Map,https://www.rferl.org/a/russia-ukraine-west-nuclear/33119997.html,0.9,2368,0,2368
12,worldnews,"Venezuela says it has seized 400 US rifles and arrested foreigners, Americans among them, over alleged plot to destabilize country",https://www.cnn.com/2024/09/14/americas/venezuela-arrests-americans-seizes-rifles-intl-latam?cid=ios_app,0.94,1908,0,1908
13,worldnews,NATO Committee Chairman Says Ukraine Has Sound Military Reason To Strike Deeper Into Russia,https://www.rferl.org/a/nato-bauer-rehka-military-committee-conference-prague/33120174.html,0.98,1301,0,1301
14,worldnews,There are now more electric cars than gas cars on Norway's roads,https://electrek.co/2024/09/14/there-are-now-more-electric-cars-than-gas-cars-on-norways-roads/,0.96,1127,0,1127
15,worldnews,Major Russian disinfo site featuring anti-Trudeau articles prompts calls for new focus at public inquiry,https://www.cbc.ca/lite/story/1.7323128,0.94,1009,0,1009
16,worldnews,"Canada and Japan aiming to rapidly expand defense ties - “We believe that, if there are disagreements, either in the South China Sea or in the Taiwan Strait, rule of law must prevail“ says Defense Minister Bill Blair",https://www.japantimes.co.jp/news/2024/09/13/japan/japan-canada-defense-cooperation/,0.96,818,0,818
17,worldnews,North Korean ammunition supplies to Russia are critical for Ukraine – Defence Intelligence chief,https://www.pravda.com.ua/eng/news/2024/09/14/7475117/,0.98,569,0,569
18,worldnews,"Biden To Use Rest Of Term Putting Ukraine In 'Best Position,' Adviser Says",https://www.rferl.org/a/ukraine-russia-biden-election-sullivan/33120190.html,0.96,467,0,467
19,worldnews,"North Korean Aid To Russia Poses Biggest Threat To Ukraine, Intelligence Chief Says",https://www.rferl.org/a/ukraine-russia-north-korea-budanov-ammunition/33120176.html,0.96,456,0,456
20,worldnews,Ukraine's spy chief says North Korean military aid to Russia presents major battlefield problem,https://www.reuters.com/world/ukraines-spy-chief-says-n-korean-military-aid-russia-presents-major-battlefield-2024-09-14/,0.95,280,0,280
21,worldnews,"Wikipedia bans user for ‘alleged trolling, doxxing and intimidation’ of Hong Kong journalists",https://www.scmp.com/news/hong-kong/society/article/3278559/wikipedia-bans-user-alleged-trolling-doxxing-and-intimidation-hong-kong-journalists,0.91,187,0,187
22,worldnews,"/r/WorldNews Live Thread: Russian Invasion of Ukraine Day 934, Part 1 (Thread #1081)",https://www.reddit.com/live/18hnzysb1elcs,0.97,171,0,171
23,worldnews,Global rallies planned to mark two years since Mahsa Amini's killing,https://www.iranintl.com/en/202409134316,0.94,139,0,139
24,worldnews,"Sirens sounded in central Israel, rocket falls in open area",https://m.jpost.com/breaking-news/article-820120,0.86,132,0,132
25,worldnews,Sweden &amp; Finland Approve Ukraine to strike Russia with their weapons,https://news.misinformarmenia.com/article-nato-sweden.html,0.92,96,0,96
26,worldnews,/r/WorldNews Live Thread for Israel-Hamas War (Thread #67),https://www.reddit.com/live/1bsso361afr0r,0.66,21,0,21
