,subreddit,title,url,upvote_ratio,ups,downs,score
0,worldnews,Reuters deletes video of Xi and Putin talking about longevity after Chinese TV demand,https://www.pravda.com.ua/eng/news/2025/09/6/7529643/,0.96,29799,0,29799
1,worldnews,US President denies knowledge of SEAL massacre in North Korea.,https://abcnews.go.com/Politics/trump-reported-violent-failed-seal-team-6-mission/story?id=125300720,0.96,21767,0,21767
2,worldnews,'Very unfair': Trump lashes out at EU for imposing $3.5bn fine on Google; threatens retaliatory tariffs,https://timesofindia.indiatimes.com/business/international-business/very-unfair-trump-lashes-out-at-eu-for-imposing-3-5bn-fine-on-google-threatens-retaliatory-tariffs/articleshow/123726255.cms,0.94,19167,0,19167
3,worldnews,Seoul holds emergency meeting after citizens detained in US Hyundai raid,https://bbc.com/news/articles/c5yvjnp295xo,0.98,8494,0,8494
4,worldnews,Trump responds to report on failed SEAL Team 6 North Korea mission,https://www.newsweek.com/seal-team-6-north-korea-mission-donald-trump-response-2125444,0.96,6556,0,6556
5,worldnews,Ukrainian Strikes on Russian Refineries Causing Crisis for Putin,https://www.kyivpost.com/post/59516,0.98,5839,0,5839
6,worldnews,Flight attendants overwhelmingly vote against Air Canada wage offer,https://www.cbc.ca/news/canada/air-canada-wage-offer-flight-attendant-vote-against-1.7627196,0.97,3289,0,3289
7,worldnews,"India ‘needs to defend its interests’, no pressure from Kyiv over Russian oil purchase—Ukraine envoy",https://theprint.in/diplomacy/india-needs-to-defend-its-interests-no-pressure-from-kyiv-over-russian-oil-purchase-ukraine-envoy/2728159/,0.95,3126,0,3126
8,worldnews,"Trump says he'd 'love' to host Putin, Xi at next year's G20 summit in US",https://kyivindependent.com/trump-says-hed-love-to-host-putin-xi-at-next-years-g20-summit-in-us,0.93,2654,0,2654
9,worldnews,Russian units exposed for using chemical weapons against Ukrainian forces,https://newsukraine.rbc.ua/news/russian-units-exposed-for-using-chemical-1757182642.html,0.98,2586,0,2586
10,worldnews,Terrorist who boasted of murdering ten Israelis on Oct. 7 killed in IDF strike,https://www.jpost.com/israel-news/article-866559,0.81,2438,0,2438
11,worldnews,Russia has announced the start of construction of fortifications on the border with Finland,https://militarnyi.com/en/news/russia-will-build-fortifications-on-the-border-with-finland/,0.96,2253,0,2253
12,worldnews,Public banned from Commons chamber after hidden phone found,https://www.bbc.com/news/articles/ckgzmzkw24wo,0.96,1504,0,1504
13,worldnews,"Coast Guard seizes 40,000 pounds of cocaine in Pacific, releases pictures of operations and burning vessel",https://www.cbsnews.com/news/coast-guard-seizes-cocaine-picture-burning-vessel/,0.95,982,0,982
14,worldnews,Israel backs off talk of annexing West Bank after UAE warning,https://www.washingtonpost.com/world/2025/09/06/israel-annex-west-bank-emirates-warning/?utm_campaign=wp_main&amp;utm_medium=social&amp;utm_source=reddit.com,0.9,960,0,960
15,worldnews,"'Trump's legacy crumbles', Israelis call on U.S. President to end Gaza war",https://www.reuters.com/world/middle-east/trumps-legacy-crumbles-israelis-call-us-president-end-gaza-war-2025-09-06/,0.88,949,0,949
16,worldnews,Leaked records trace path from overseas Neo-Nazi groups to Australia's emboldened far-right,https://www.abc.net.au/news/2025-09-07/overseas-neo-nazi-groups-shaping-australian-far-right/105741342,0.95,857,0,857
17,worldnews,Zelenskyy rejects Putin's proposal to meet in Moscow and offers to talk in Kyiv,https://www.euronews.com/2025/09/06/zelensky-putin-may-come-to-kiev,0.97,664,0,664
18,worldnews,More than 425 arrested as protesters defy ban on Palestine Action in London,https://www.theguardian.com/world/2025/sep/06/police-make-arrests-at-london-palestine-action-ban-protest,0.9,525,0,525
19,worldnews,"Nearly 60% of Ukrainian forces' weapons domestically produced, Zelensky says",https://kyivindependent.com/nearly-60-of-ukrainian-forces-weapons-domestically-produced-zelensky-says/,0.97,476,0,476
20,worldnews,China criticises Australian and Canadian warships transiting Taiwan Strait,https://www.9news.com.au/world/china-criticises-canadian-and-australian-warships-transiting-taiwan-strait/74dd14b3-3766-4a44-a2d4-698b9c4d4d83,0.9,282,0,282
21,worldnews,Trump signs order offering some tariff exemptions to countries with US trade deals,https://www.reuters.com/business/trump-signs-order-offering-some-tariff-exemptions-countries-with-us-trade-deals-2025-09-05/,0.85,148,0,148
22,worldnews,Infant among three killed in Russian attack that sets ablaze seat of Ukraine government,https://www.reuters.com/world/europe/infant-among-three-killed-russian-attack-that-sets-ablaze-seat-ukraine-2025-09-07/,0.92,137,0,137
23,worldnews,"Canada's unemployment rate climbed to 7.1 per cent in August as economy lost 66,000 jobs",https://www.bnnbloomberg.ca/business/economics/2025/09/05/statistics-canada-to-release-august-labour-force-survey-today,0.86,125,0,125
24,worldnews,South Korea says US release of video showing workers arrest was regrettable,https://www.reuters.com/sustainability/society-equity/south-korea-says-us-release-video-showing-workers-arrest-was-regrettable-2025-09-06/?,0.94,99,0,99
25,worldnews,"/r/WorldNews Live Thread: Russian Invasion of Ukraine Day 1291, Part 1 (Thread #1438)",https://www.reddit.com/live/18hnzysb1elcs,0.95,97,0,97
