,subreddit,title,url,upvote_ratio,ups,downs,score
0,worldnews,Candace Owens: Australia’s high court backs government decision to deny visa to US rightwinger,https://www.theguardian.com/australia-news/2025/oct/15/candace-owens-australia-visa-high-court-backs-government-decision-deny,0.96,24978,0,24978
1,worldnews,Russia Seeks Urgent Protection for Helicopters After $16M KA-52 Lost to $500 Drone,https://united24media.com/latest-news/russia-seeks-urgent-protection-for-helicopters-after-16m-ka-52-lost-to-500-drone-12514,0.96,18492,0,18492
2,worldnews,"Hamas said to kill over 30 Gazans, publicly execute 7, as it reasserts its grip on Strip",https://www.timesofisrael.com/hamas-said-to-kill-over-30-gazans-as-group-moves-to-reassert-its-grip-on-strip/,0.85,10470,0,10470
3,worldnews,Hundreds call for Putin to be overthrown in St Petersburg gathering,https://www.dailymail.co.uk/news/article-15195147/Hundreds-call-Putin-overthrown-huge-gathering-St-Petersburg-rare-display-public-dissent-against-dictator-Ukraines-long-range-strikes-bring-war-home-Russians.html,0.98,7612,0,7612
4,worldnews,Trump confirms he authorised CIA action inside Venezuela,https://www.bbc.com/news/articles/c0ex1jq9pdvo,0.96,6750,0,6750
5,worldnews,Islamic militia calling itself 'The People's Army' in Gaza issues threat to Hamas sparking concerns of civil war,https://www.skynews.com.au/world-news/global-affairs/islamic-militia-calling-itself-the-peoples-army-in-gaza-issues-threat-to-hamas-sparking-concerns-of-civil-war/news-story/9fe364da3b05aeb180d98de7f3a7a294,0.95,5083,0,5083
6,worldnews,Russian State Media Accidentally Reveals Secret Drone-Hunting Airfield Near Ukrainian Front,https://united24media.com/latest-news/russian-state-media-accidentally-reveals-secret-drone-hunting-airfield-near-ukrainian-front-12536,0.98,5025,0,5025
7,worldnews,American B-52 bombers in the air near Venezuela,https://ukdefencejournal.org.uk/american-b-52-bombers-in-the-air-near-venezuela/,0.96,4604,0,4604
8,worldnews,Hamas says it has handed over all Israeli hostage remains it could recover,https://www.cbsnews.com/news/hamas-says-handed-over-all-israeli-hostage-remains-it-could-recover/,0.93,4140,0,4140
9,worldnews,"Palestinian bodies returned by Israel show signs of torture and execution, say doctors",https://www.theguardian.com/world/2025/oct/15/palestinian-bodies-returned-by-israel-show-signs-of-torture-and-execution-say-doctors,0.79,3985,0,3985
10,worldnews,Norway wants to allocate about €6bn for military support to Ukraine,https://www.pravda.com.ua/eng/news/2025/10/15/8002844,0.98,3760,0,3760
11,worldnews,US defense manufacturer reveals new Tomahawk launcher — just what Ukraine would need to hit Russia,https://kyivindependent.com/american-defence-manufacturer-presented-new-tomahawk-launcher/,0.97,3454,0,3454
12,worldnews,"1,076 Cubans identified fighting for Russia, Ukraine says, 96 dead or disappeared",https://kyivindependent.com/exclusive-1-076-cubans-identified-fighting-for-russia-ukraine-says-96-dead-or-disappeared/,0.97,2478,0,2478
13,worldnews,Canada threatens Stellantis with legal action over plan to shift output to US,https://www.reuters.com/business/stellantis-plan-shift-output-us-sparks-canadian-concern-2025-10-15/,0.97,1609,0,1609
14,worldnews,Over Half of NATO Pledged to Buy US Weapons for Ukraine: Rutte,https://www.kyivpost.com/post/62152,0.98,1549,0,1549
15,worldnews,"Over 50 killed in fresh clashes along Pak-Afghan border; civilians, troops dead",https://www.hindustantimes.com/world-news/fresh-clash-erupts-on-pakistan-afghanistan-border-6-pak-paramilitary-troops-killed-report-101760512526743.html,0.96,1003,0,1003
16,worldnews,Turkish government drafts anti-LGBTQ+ laws threatening prison for trans people and same-sex couples,https://www.attitude.co.uk/news/turkish-government-drafts-anti-lgbtq-laws-prison-499950/,0.96,832,0,832
17,worldnews,"Germany Pledges $2.3 Billion in New Defense Aid to Ukraine, Including Patriots and IRIS-T",https://united24media.com/latest-news/germany-pledges-23-billion-in-new-defense-aid-to-ukraine-including-patriots-and-iris-t-12531,0.98,739,0,739
18,worldnews,"China Wants Foreign Scientists. The Public Says No, Thanks. Since Beijing announced a new visa to attract young science and technology graduates, a backlash has erupted online, forcing the government to respond.",https://www.nytimes.com/2025/10/14/world/asia/china-stem-visa-racist-backlash.html,0.93,561,0,561
19,worldnews,"Drones reportedly target Russian oil refinery in Ufa, more than 1,300 kilometers from Ukraine",https://kyivindependent.com/drones-reportedly-target-russian-oil-refinery-in-ufa-1-400-kilometers-from-front-line/,0.97,554,0,554
20,worldnews,NATO ministers acknowledge Ukraine should have a place in the Alliance,https://www.pravda.com.ua/eng/news/2025/10/15/8002900,0.96,518,0,518
21,worldnews,Young Taiwanese aren't so anti-China. That's a problem for the island's government,https://www.cbc.ca/news/world/taiwan-generational-divide-9.6937542,0.79,508,0,508
22,worldnews,"/r/WorldNews Live Thread: Russian Invasion of Ukraine Day 1330, Part 1 (Thread #1477)",https://www.reddit.com/live/18hnzysb1elcs,0.96,130,0,130
23,worldnews,"EU, Spain reject Trump’s US tariff threats over NATO spending",https://www.aljazeera.com/amp/news/2025/10/15/eu-spain-reject-trumps-us-tariff-threats-over-nato-spending,0.92,125,0,125
24,worldnews,Turkey deports peaceful Christians under guise of ‘national security’ claims watchdog,https://www.foxnews.com/world/turkey-deports-peaceful-christians-under-guise-national-security-claims-watchdog,0.89,116,0,116
