,subreddit,title,url,upvote_ratio,ups,downs,score
0,worldnews,Russian troops have turned to Wikipedia to find instructions on handling weapons and used 1960s-era maps in the country's invasion of Ukraine: NYT,https://www.businessinsider.com/russian-troops-ukraine-use-wikipedia-weapons-instructions-obsolete-maps-putin-2022-12,0.91,42818,0,42818
1,worldnews,A million Russians call surrender hotline as death toll nears 100K,https://www.newsweek.com/million-russians-call-surrender-hotline-death-toll-nears-100k-intel-1767956,0.92,22160,0,22160
2,worldnews,"Spanish lawmakers advance 'menstrual leave' legislation, a first for a European country",https://www.france24.com/en/europe/20221216-spanish-lawmakers-advance-menstrual-leave-legislation-a-first-for-a-european-country,0.89,17412,0,17412
3,worldnews,Russia Rejects Talks After Suggesting NATO Nations Are 'Legitimate' Targets,https://www.newsweek.com/russia-rejects-talks-after-suggesting-nato-nations-are-legitimate-targets-1767931,0.93,9558,0,9558
4,worldnews,Ukraine says power restored to almost 6 million people in last 24 hours,https://www.jpost.com/breaking-news/article-725148,0.98,8529,0,8529
5,worldnews,Poles executed for hiding Jews are declared martyrs by pope,https://abcnews.go.com/International/wireStory/poles-executed-hiding-jews-declared-martyrs-pope-95469888,0.97,6542,0,6542
6,worldnews,Steven Spielberg regrets decimation of shark population after Jaws,https://www.bbc.com/news/entertainment-arts-64011888,0.95,5439,0,5439
7,worldnews,Deal reached for new non-Russian power source for Europe,https://apnews.com/article/russia-ukraine-europe-business-hungary-european-union-7f1d0b67596722fab7d6b0c0a3a3d40e,0.98,3797,0,3797
8,worldnews,Iran arrests a top actress who expressed solidarity with a man executed over protests,https://www.npr.org/2022/12/17/1143842432/iran-arrests-actress-taraneh-alidoosti-protests,0.97,3290,0,3290
9,worldnews,Mexican army says Jalisco drug cartel kidnapped colonel,https://apnews.com/article/mexico-caribbean-laredo-79f08d41c1c4a05189dc32b1ec5036c5,0.98,2402,0,2402
10,worldnews,The world is burning more coal than ever before -- and the consequences for climate are dire,https://edition.cnn.com/2022/12/16/world/coal-use-record-high-climate-intl/index.html,0.93,2019,0,2019
11,worldnews,Russia Can Finally See That Putin’s ‘Days Are Numbered’,https://www.yahoo.com/news/russia-finally-see-putin-days-010335807.html,0.95,1617,0,1617
12,worldnews,Poland's highest ranking police officer has confirmed to local media that he accidentally set off a grenade launcher given to him as a gift by Ukraine.,https://www.bbc.com/news/world-europe-64010682,0.97,1333,0,1333
13,worldnews,2022 is deadliest year on record for Mexican journalists,https://apnews.com/article/mexico-caribbean-558cc55bc786e01a62f90d1a26b70936,0.97,1025,0,1025
14,worldnews,N. Korea fires ballistic missile into waters off east coast,https://apnews.com/article/south-korea-north-796cb15ed49ef31d0872e6e0f3b1a855,0.93,932,0,932
15,worldnews,"21,000 Ukrainians find jobs in Lithuania since war started",https://www.delfi.lt/en/expats-in-lt/21-000-ukrainians-find-jobs-in-lithuania-since-war-started.d?id=92022907,0.96,913,0,913
16,worldnews,Iranian actor Taraneh Alidoosti arrested after criticism of death penalty | Iran,https://www.theguardian.com/world/2022/dec/17/iranian-actor-taraneh-alidoosti-arrested-after-criticism-of-death-penalty,0.96,834,0,834
17,worldnews,China closes two 'secret police stations' in Czech capital Prague,https://www.euronews.com/2022/12/08/china-closes-two-secret-police-stations-in-prague-says-czech-foreign-minister,0.94,765,0,765
18,worldnews,Germany opens first LNG terminal as it curbs reliance on Russian gas,https://www.laprensalatina.com/germany-opens-first-lng-terminal-as-it-curbs-reliance-on-russian-gas/,0.95,715,0,715
19,worldnews,Russian Official Allegedly Opened Mail Bomb Thinking Son’s Head Was Inside,https://www.thedailybeast.com/russian-official-dmitry-syty-opened-mail-bomb-thinking-sons-head-was-inside-says-wagner-group-boss?ref=wrap,0.96,623,0,623
20,worldnews,"Killed Tehran Doctor: Family Pressured To Appear On TV, Lie About Cause Of Death (Iran)",https://iranwire.com/en/politics/111441-killed-tehran-doctor-family-pressured-to-appear-on-tv-lie-about-cause-of-death/,0.95,437,0,437
21,worldnews,Zelenskyy: Ukraine Needs Reliable Air Defense System,https://www.eurasiareview.com/18122022-zelenskyy-ukraine-needs-reliable-air-defense-system/,0.92,375,0,375
22,worldnews,"Moldova moves closer to breaking dependence on Russian gas, deputy PM says",https://www.reuters.com/business/energy/moldova-moves-closer-breaking-dependence-russian-gas-deputy-pm-says-2022-12-17/,0.95,358,0,358
23,worldnews,Moldova suspends six channels over Ukraine 'disinformation',https://www.dw.com/en/moldova-suspends-six-channels-over-ukraine-disinformation/a-64137437,0.95,329,0,329
24,worldnews,A mobile maternity unit is delivering babies and critical health services for women and girls amid the war in Ukraine,https://www.unfpa.org/news/mobile-maternity-unit-delivers-babies-and-critical-health-services-amid-war-ukraine,0.95,248,0,248
25,worldnews,Iranians hit the streets in restive southeast as protests enter 4th month,https://www.timesofisrael.com/iranians-hit-the-streets-in-restive-southeast-as-protests-enter-4th-month/,0.96,220,0,220
26,worldnews,"/r/WorldNews Live Thread: Russian Invasion of Ukraine Day 298, Part 1 (Thread #439)",https://www.reddit.com/live/18hnzysb1elcs,0.97,217,0,217
