,subreddit,title,url,upvote_ratio,ups,downs,score
0,worldnews,China lashes out at JD Vance for calling Chinese people ‘peasants’,https://edition.cnn.com/2025/04/08/china/china-slams-vance-peasants-remarks-intl-hnk/index.html?utm_medium=social&amp;utm_source=blueskyCNN&amp;utm_content=2025-04-08T09%3A43%3A00,0.93,51833,0,51833
1,worldnews,Tariff tensions escalate as White House hits China with 104% hike,https://www.thestreet.com/crypto/policy/tariff-tensions-escalate-as-white-house-hits-china-with-104-hike,0.95,43791,0,43791
2,worldnews,"Trump's 104% tariffs on China to take effect at midnight, quashing earlier market gains | CBC News",https://www.cbc.ca/news/world/trump-tariffs-china-1.7505028,0.97,17428,0,17428
3,worldnews,Brussels police arrest US State Secretary Rubio's bodyguard,https://www.brusselstimes.com/brussels/1526014/brussels-police-arrest-us-state-secretary-rubios-bodyguard-tbtb,0.98,12850,0,12850
4,worldnews,South Korea fires warning shots after North Korean soldiers cross border,https://www.newsweek.com/south-korea-fires-warning-shots-after-north-korean-soldiers-cross-border-2056710,0.99,9155,0,9155
5,worldnews,Trump says EU must buy $350B of US energy to get tariff relief,https://www.politico.eu/article/donald-trump-says-eu-must-buy-350b-of-us-energy-to-get-tariff-relief/,0.95,9108,0,9108
6,worldnews,"EU slaps tariffs on US trucks, cigarettes and ice cream to target Trump’s red states",https://www.politico.eu/article/eu-tariffs-trade-war-donald-trump-republican-states/?utm_source=RSS_Feed&amp;utm_medium=RSS&amp;utm_campaign=RSS_Syndication,0.97,8204,0,8204
7,worldnews,"Treasury Secretary Bessent says China’s escalation was ‘big mistake,’ country playing with ‘losing hand’",https://www.cnbc.com/2025/04/08/treasury-secretary-bessent-says-chinas-escalation-was-big-mistake-country-playing-with-losing-hand.html,0.96,8037,0,8037
8,worldnews,Australia and Canada Poised to Join British-led Sixth-Gen Jet Fighter Program,https://nationalinterest.org/blog/buzz/australia-and-canada-poised-to-join-british-led-sixth-gen-jet-fighter-program,0.98,5305,0,5305
9,worldnews,Mexico warns against potential U.S. drone strikes on cartels,https://www.latimes.com/world-nation/story/2025-04-08/mexico-warns-against-potential-u-s-drone-strikes-on-cartels,0.97,5236,0,5236
10,worldnews,"Two Chinese soldiers captured during fighting in eastern Ukraine, Zelenskyy says | World News | Sky News",https://news.sky.com/story/two-chinese-soldiers-captured-during-fighting-in-eastern-ukraine-zelenskyy-says-13344417,0.96,4714,0,4714
11,worldnews,"Canada to impose tariffs of up to 25% on vehicles imported from U.S. Wednesday, escalating trade war",https://www.theglobeandmail.com/politics/article-canada-to-impose-25-per-cent-tariffs-on-us-made-vehicles-wednesday/?utm_source=dlvr.it&amp;utm_medium=bluesky,0.96,4362,0,4362
12,worldnews,"“They’re bombing like crazy right now,” Trump criticises Russian shelling of Ukraine",https://euromaidanpress.com/2025/04/08/theyre-bombing-like-crazy-right-now-trump-criticises-russian-shelling-of-ukraine/,0.97,4230,0,4230
13,worldnews,Trump administration says it cut funding to some life-saving UN food programs by mistake,https://apnews.com/article/usaid-funding-cuts-state-department-534c378188562ebcd1295a9a0202a627,0.97,2880,0,2880
14,worldnews,"The United States may withdraw up to 10,000 troops from Poland and Romania, which were stationed there following Russia’s full-scale invasion of Ukraine",https://www.lrt.lt/en/news-in-english/19/2531896/us-may-pull-thousands-of-troops-from-eastern-europe-media,0.97,2364,0,2364
15,worldnews,"Trump’s massive ‘reciprocal’ tariffs are now in place, upending global trade",https://www.cnn.com/2025/04/09/business/recession-effects-trump-reciprocal-tariffs-hnk-intl?cid=ios_app,0.98,1962,0,1962
16,worldnews,"Whitehouse signals major tariff on pharma imports, Indian drugmakers could face impact",https://m.economictimes.com/news/international/global-trends/trump-says-us-will-soon-announce-tariffs-on-pharmaceutical-imports/articleshow/120110100.cms,0.97,1799,0,1799
17,worldnews,EU seeks China’s help to contain Trump’s trade war,https://www.politico.eu/article/eu-pencils-in-china-summit-for-july/,0.95,1305,0,1305
18,worldnews,"'India, China should stand together against US tariff abuse,' says Chinese Embassy",https://www.moneycontrol.com/news/business/india-china-should-stand-together-against-us-tariff-abuse-says-chinese-embassy-12989034.html,0.92,921,0,921
19,worldnews,Trump doesn't give Israel a break on tariffs despite Netanyahu visit,https://www.axios.com/2025/04/07/trump-netanyahu-visit-tariff-deal,0.97,892,0,892
20,worldnews,"Drone Strike at Russia’s Shaikovka Airbase Leaves Kh-22/32 Missile Stockpile in Ruins, Satellite Photos Confirm",https://united24media.com/latest-news/drone-strike-at-russias-shaikovka-airbase-leaves-kh-2232-missile-stockpile-in-ruins-satellite-photos-confirm-7414,0.98,829,0,829
21,worldnews,WHO Director Issues Warning on 'Next Pandemic',https://www.newsweek.com/who-director-2056861,0.85,486,0,486
22,worldnews,Estonia’s parliament is preparing legislation that would authorize the country’s Defense Forces to use military force against commercial vessels suspected of attempting to damage undersea cables or other critical infrastructure,https://united24media.com/latest-news/estonia-mulls-law-allowing-military-to-sink-suspicious-ships-threatening-undersea-infrastructure-7416,0.98,440,0,440
23,worldnews,China fires back after Pete Hegseth calls country a threat to Panama canal,https://www.theguardian.com/us-news/2025/apr/08/pete-hegseth-china-panama-canal,0.96,318,0,318
24,worldnews,"/r/WorldNews Live Thread: Russian Invasion of Ukraine Day 1140, Part 1 (Thread #1287)",https://www.reddit.com/live/18hnzysb1elcs,0.95,123,0,123
25,worldnews,Spain Is Pushing for EU Pivot to China to Counter Trump Tariffs,https://financialpost.com/pmn/business-pmn/spain-is-pushing-for-eu-pivot-to-china-to-counter-trump-tariffs,0.95,113,0,113
