,subreddit,title,url,upvote_ratio,ups,downs,score
0,worldnews,Germany's election winner Merz: Europe Must Reach Defence 'Independence' Of US,https://www.barrons.com/news/europe-must-reach-independence-of-us-on-defence-germany-s-merz-1fc2babb,0.97,24716,0,24716
1,worldnews,UK to announce new sanctions on Russia,https://www.dw.com/en/uk-to-announce-new-sanctions-on-russia/a-71717317,0.97,24174,0,24174
2,worldnews,"As Trump complains about Canada, data shows most crime guns seized in GTA come from U.S.",https://www.cbc.ca/news/canada/toronto/american-guns-gta-police-data-1.7466092,0.96,13251,0,13251
3,worldnews,German election: Exit polls say CDU/CSU leads with 29%,https://www.dw.com/en/german-election-exit-polls-say-cdu-csu-leads-with-29/live-71700729,0.96,13003,0,13003
4,worldnews,"US Congress sounds the alarm over China's proposed 600,000 square-foot 'mega-embassy' in London in rare intervention",https://www.dailymail.co.uk/news/article-14418889/US-Congress-sounds-alarm-Chinas-proposed-600-000-square-foot-mega-embassy-London-rare-intervention.html,0.96,11194,0,11194
5,worldnews,Zelenskyy says he’s willing to give up presidency for peace in Ukraine or NATO membership,https://www.nbcnews.com/news/amp/rcna193364,0.97,8398,0,8398
6,worldnews,"EU considers confiscating part of Russia’s frozen $280 billion, Bloomberg reports",https://kyivindependent.com/eu-considers-confiscating-part-of-russias-frozen-280-billion-bloomberg-reports/,0.99,8117,0,8117
7,worldnews,Swiss army open to peacekeeping role on the Ukrainian-Russian border,https://www.swissinfo.ch/eng/foreign-affairs/army-chief-thomas-s%c3%bcssli-switzerland-could-provide-200-soldiers/88915841?utm_source=multiple&amp;utm_medium=website&amp;utm_campaign=news_en&amp;utm_content=o&amp;utm_term=wpblock_highlighted-compact-news-carousel,0.98,5286,0,5286
8,worldnews,Ukrainian president says Trudeau is expected to visit Ukraine on Monday,https://www.cbc.ca/news/politics/ukrainian-president-says-trudeau-is-expected-to-visit-ukraine-on-monday-1.7466370,0.98,5261,0,5261
9,worldnews,Starmer says UK won’t cave to 'threats and tyranny' as PM warns bad Ukraine deal would be a 'disaster for everyone',https://www.lbc.co.uk/politics/uk-politics/starmer-ukraine-bad-peace-deal-would-be-a-disaster-for-everyone/,0.98,5095,0,5095
10,worldnews,"Ukraine is too powerful to be sold out, Polish official says",https://www.politico.com/news/2025/02/23/ukraine-sold-out-polish-official-00205630,0.98,4835,0,4835
11,worldnews,Germany's Conservatives Win Election: TV Exit Polls,https://www.barrons.com/news/germany-s-conservatives-win-election-tv-exit-polls-ab3ef237,0.96,4776,0,4776
12,worldnews,Ukraine's military spy chief says N. Korea provides 50% of Russia's ammunition,https://www.reuters.com/world/ukraines-military-spy-chief-says-n-korea-provides-50-russias-ammunition-2025-02-23/,0.98,3881,0,3881
13,worldnews,Russia launches largest drone attack since start of full-scale invasion,https://kyivindependent.com/russia-launches-largest-drone-attack-since-start-of-full-scale-invasion/,0.97,3189,0,3189
14,worldnews,Japan's emperor marks 65th birthday with a call to keep telling the tragedy of WWII,https://abcnews.go.com/International/wireStory/japans-emperor-marks-65th-birthday-call-telling-tragedy-119090766,0.98,2960,0,2960
15,worldnews,Terrorist behind deadly bombing falls to his death a week after release under Gaza deal,https://www.timesofisrael.com/terrorist-behind-deadly-bombing-falls-to-his-death-a-week-after-release-under-gaza-deal/,0.93,2355,0,2355
16,worldnews,Britain to ban more individuals with Kremlin links in show of support for Ukraine,https://www.reuters.com/world/europe/britain-ban-more-individuals-with-kremlin-links-show-support-ukraine-2025-02-24/,0.99,2120,0,2120
17,worldnews,German election victor Merz plans pivot from US as coalition talks loom,https://www.reuters.com/world/europe/gloomy-germans-vote-election-which-conservatives-are-set-win-2025-02-22/,0.98,1408,0,1408
18,worldnews,France’s nuclear-powered aircraft carrier and accompanying warships are holding combat drills with Philippine forces in the disputed South China Sea,https://www.taipeitimes.com/News/front/archives/2025/02/24/2003832395,0.99,1266,0,1266
19,worldnews,Merz claims victory for German conservatives and the far right heads for strongest postwar result,https://apnews.com/article/germany-election-merz-scholz-far-right-afd-ebf16ed38e0beaff7fed9a6d29b32a24,0.94,808,0,808
20,worldnews,"EU plans extraordinary summit on EU defence, Ukraine on March 6",https://www.reuters.com/world/europe/eu-leaders-meet-extraordinary-summit-ukraine-eu-defence-march-6-2025-02-23/,0.98,788,0,788
21,worldnews,"Ukraine showdown looms in UN, US urges 'no' vote on Europe's bid for action",https://www.reuters.com/world/ahead-un-showdown-ukraine-us-urges-countries-vote-no-rival-european-bid-action-2025-02-24/,0.94,524,0,524
22,worldnews,"Three years on, Ukraine's extinction nightmare has returned",https://www.bbc.com/news/articles/cx2xngznyego.amp,0.94,457,0,457
23,worldnews,"Israel sends tanks into West Bank for first time in decades, says fleeing Palestinians can’t return",https://www.nbcnews.com/news/world/israel-sends-tanks-west-bank-rcna193384,0.87,261,0,261
24,worldnews,"Thousands rally across Europe, Canada ahead of 3rd anniversary of Russia’s full-scale invasion",https://kyivindependent.com/thousands-rally-across-europe-canada-ahead-of-3rd-anniversary-of-russias-full-scale-invasion/,0.97,222,0,222
25,worldnews,"/r/WorldNews Live Thread: Russian Invasion of Ukraine Day 1096, Part 1 (Thread #1243)",https://www.reddit.com/live/18hnzysb1elcs,0.94,136,0,136
