,subreddit,title,url,upvote_ratio,ups,downs,score
0,worldnews,Zelenskyy refuses to cede land to Russia as he rallies European support,https://apnews.com/article/russia-ukraine-war-zelenskyy-trump-putin-cf17d925e21e6d6329fadff7e3efbb90,0.96,21211,0,21211
1,worldnews,Trump threatens new tariffs unless Mexico hands over more water,https://www.rawstory.com/trump-tariffs-2674380755/,0.93,16892,0,16892
2,worldnews,Russians Planned Explosions on Planes Flying to the USA from Europe,https://militarnyi.com/en/news/russians-planned-explosions-on-planes-flying-to-the-usa-from-europe/,0.96,16319,0,16319
3,worldnews,Trump hints at walking away from Ukraine and calls Europe ‘weak’ and ‘decaying’,https://www.theguardian.com/us-news/2025/dec/09/trump-hints-walking-away-ukraine-calls-europe-weak-decaying,0.94,9013,0,9013
4,worldnews,Zelenskyy asks US and Europe to ensure security for Ukraine for elections that could be held within 90 days,https://euromaidanpress.com/2025/12/09/zelenskyy-says-hes-ready-to-hold-elections-within-90-days-if-us-and-europe-ensure-security-for-ukraine-during-this-period/,0.97,6934,0,6934
5,worldnews,Millions of children and teens lose access to accounts as Australia’s world-first social media ban begins,https://www.theguardian.com/australia-news/2025/dec/09/australia-under-16-social-media-ban-begins-apps-listed,0.97,4963,0,4963
6,worldnews,UK rejects Trump’s claim that European leaders ‘talk too much’ about Ukraine,https://www.politico.eu/article/uk-rejects-donald-trump-claim-european-leaders-talk-too-much-ukraine/,0.98,4677,0,4677
7,worldnews,EU says it will ‘make sure’ Elon Musk’s X pays €120M fine,https://www.politico.eu/article/eu-commissions-will-make-sure-x-musk-pay-120m-fine-transparency-rule/,0.97,4489,0,4489
8,worldnews,"In defiant flyover, U.S. F-18 fighter jets enter Venezuelan airspace for 40 minutes",https://www.miamiherald.com/news/nation-world/world/americas/venezuela/article313550838.html,0.93,4454,0,4454
9,worldnews,An-22 Military Transport Plane Crashes in Russia After Repairs,https://militarnyi.com/en/news/an-22-military-transport-plane-crashes-in-russia-after-repairs/,0.97,2625,0,2625
10,worldnews,Britain is close to losing its dominance in Atlantic to Russia – Navy chief,https://newsukraine.rbc.ua/news/britain-is-close-to-losing-its-dominance-1765256155.html,0.92,2498,0,2498
11,worldnews,Mexican president says Mexico will send more water to US but not immediately,https://apnews.com/article/mexico-us-rio-grande-water-farmers-986fee61f17d5c975a5927f651b808fa,0.95,2497,0,2497
12,worldnews,"Report: Hamas hid baby formula in Gaza to deepen hunger, then blamed Israel",https://www.ynetnews.com/article/hykhdi8zwl,0.72,2475,0,2475
13,worldnews,"As Germany appeals to China for peace, Zelenskyy says Beijing has no interest in ending Russia’s war against Ukraine",https://euromaidanpress.com/2025/12/09/as-germany-appeals-to-china-for-peace-zelenskyy-says-beijing-has-no-interest-in-ending-russias-war-against-ukraine/,0.96,2031,0,2031
14,worldnews,Canada Ambassador to U.S. Kirsten Hillman resigns,https://www.ctvnews.ca/politics/article/canadas-ambassador-to-us-kirsten-hillman-will-resign-in-new-year/,0.95,1864,0,1864
15,worldnews,Zelenskyy responds to Trump’s demand for elections: Always ready,https://newsukraine.rbc.ua/news/zelenskyy-responds-to-trump-s-demand-for-1765300289.html,0.96,1585,0,1585
16,worldnews,Trump thrashes European leaders in wide-ranging interview: ‘I think they’re weak’,https://www.politico.com/news/2025/12/09/trump-dasha-burns-interview-europe-immigration-ukraine-00682016?utm_content=topic/politics&amp;utm_source=flipboard,0.88,1102,0,1102
17,worldnews,"Peace deal, security guarantees, reconstruction — Zelensky unveils 3-track plan as talks intensify",https://kyivindependent.com/zelensky-unveils-3-track-plan-as-talks-intensify/,0.97,922,0,922
18,worldnews,Zelenskyy says Ukraine will present revised peace plan to U.S. Wednesday,https://www.cbc.ca/news/world/ukraine-zelenskyy-italy-peace-plan-9.7008356,0.96,805,0,805
19,worldnews,Russian bombers join Chinese air patrol near Japan as Tokyo-Beijing tie strains,https://www.reuters.com/business/aerospace-defense/russian-bombers-join-chinese-air-patrol-near-japan-tokyo-beijing-tie-strains-2025-12-10/,0.94,455,0,455
20,worldnews,Trump gives Nvidia the OK to sell advanced AI chips to China - BBC News,https://www.bbc.com/news/articles/ckg9q635q6po,0.9,415,0,415
21,worldnews,"Children Flood Putin With Complaints About Roblox Ban, Kremlin Says",https://www.themoscowtimes.com/2025/12/09/children-flood-putin-with-complaints-about-roblox-ban-kremlin-says-a91379,0.92,221,0,221
22,worldnews,Taiwanese lose status after obtaining single-use Chinese passport,https://www.taipeitimes.com/News/taiwan/archives/2025/12/08/2003848535,0.93,130,0,130
23,worldnews,"/r/WorldNews Live Thread: Russian Invasion of Ukraine Day 1385, Part 1 (Thread #1532)",https://www.reddit.com/live/18hnzysb1elcs,0.96,122,0,122
24,worldnews,"More than 9,000 children in Gaza hospitalised for acute malnutrition in October, UN says",https://www.theguardian.com/world/2025/dec/09/children-gaza-hospitalised-acute-malnutrition-un-says,0.7,83,0,83
