,subreddit,title,url,upvote_ratio,ups,downs,score
0,worldnews,Putin's youngest daughter 'living in Paris under a pseudonym',https://www.telegraph.co.uk/world-news/2024/11/28/putin-youngest-daughter-paris-pseudonym-luiza-rozova/,0.93,28398,0,28398
1,worldnews,Ukraine flag appears on big screen during Putin visit to Kazakhstan,https://www.reuters.com/world/ukraine-flag-appears-big-screen-during-putin-visit-kazakhstan-2024-11-28/,0.96,19127,0,19127
2,worldnews,Trump Mocked After Mexico's President Blows Up His Brag About Their Call,https://www.huffpost.com/entry/trump-mexico-reactions_n_67483821e4b03b6cea3b8621,0.88,10617,0,10617
3,worldnews,N. Korea conceals combat deaths of troops fighting in Russia,https://www.dailynk.com/english/north-korea-conceals-combat-deaths-troops-fighting-russia/,0.96,10400,0,10400
4,worldnews,Ukraine Rejects Calls to Lower Conscription Age to 18 – ‘Delays in weapon deliveries from allies meant Kyiv “lacks weapons to equip already mobilized soldiers.’,https://www.kyivpost.com/post/42963,0.97,6779,0,6779
5,worldnews,A Russian Recruit Has A One-Month Life Expectancy After Signing Up For The War In Ukraine,https://www.forbes.com/sites/davidaxe/2024/11/27/a-russian-recruit-has-a-one-month-life-expectancy-after-signing-up-for-the-war-in-ukraine/,0.97,6725,0,6725
6,worldnews,Putin says Russia would use all weapons at its disposal if Ukraine got nuclear weapons,https://www.reuters.com/world/europe/putin-says-russia-would-use-all-weapons-its-disposal-if-ukraine-got-nuclear-2024-11-28/,0.94,6398,0,6398
7,worldnews,Ukraine destroys Russian $5 million radar system in Crimea,https://kyivindependent.com/ukraines-military-intelligence-says-it-destroyed-russian-5-million-radar-system/,0.98,5891,0,5891
8,worldnews,Conservative US influencer Candace Owens is barred from New Zealand weeks after a ban from Australia,https://apnews.com/article/candace-owens-zealand-australia-visa-eedd9b2f77a289b44a517719008f9730?taid=67481041045d5a0001c351d9,0.96,5483,0,5483
9,worldnews,Mexico's president says its 'position is not to close borders' in response to Trump's claim,https://www.forbes.com/sites/siladityaray/2024/11/28/mexican-president-clarifies-stance-after-trump-says-she-agreed-to-effectively-close-southern-border/,0.95,4793,0,4793
10,worldnews,"Pentagon unlikely to use all of the billions Congress authorized it to spend on Ukraine weapons before Biden leaves office, officials say",https://www.yahoo.com/news/pentagon-unlikely-billions-congress-authorized-214801968.html,0.97,3925,0,3925
11,worldnews,Putin's forces under attack in Syria as rebels charge on Aleppo,https://www.newsweek.com/putins-forces-under-attack-syria-rebels-charge-aleppo-1992918,0.98,2817,0,2817
12,worldnews,"Russia tries to stem panic over the plummeting ruble, as the central bank is forced to intervene",https://www.cnbc.com/2024/11/28/russia-tries-to-stem-panic-over-plummeting-ruble-central-bank-steps-in.html,0.97,2476,0,2476
13,worldnews,Chinese Ship Surrounded Over Alleged Undersea Internet Cable Sabotage,https://www.pcmag.com/news/chinese-ship-surrounded-over-alleged-undersea-internet-cable-sabotage,0.98,2051,0,2051
14,worldnews,Putin threatens to hit Kyiv with Oreshnik missiles and praises Trump,https://www.theguardian.com/world/2024/nov/28/putin-threatens-kyiv-oreshnik-missiles-praises-trump,0.91,1908,0,1908
15,worldnews,Putin Threatens to Target Kyiv’s ‘Decision-Making Centers’ with ‘Oreshnik’ Missile,https://www.kyivpost.com/post/42991,0.91,934,0,934
16,worldnews,Conservative US influencer Candace Owens is barred from New Zealand weeks after a ban from Australia,https://apnews.com/article/candace-owens-zealand-australia-visa-eedd9b2f77a289b44a517719008f9730,0.92,803,0,803
17,worldnews,Australia passes first-ever social media ban for people under 16,https://thehill.com/policy/technology/5014275-australia-social-media-ban-youth/,0.94,702,0,702
18,worldnews,Russian troops operated torture chamber for Ukrainians in Belarus in 2022,https://kyivindependent.com/russian-troops-operated-torture-chamber-for-ukrainians-in-belarus-in-2022-media-reports/,0.95,684,0,684
19,worldnews,Russian spying ring ‘planned honeytrap to bait journalists’,https://www.thetimes.com/uk/crime/article/bulgarian-men-guilty-spying-russia-q86k02rnv,0.97,649,0,649
20,worldnews,Thousands rally in Amsterdam against antisemitism amid rising attacks in the Netherlands,https://www.jpost.com/diaspora/antisemitism/article-831246,0.89,546,0,546
21,worldnews,Russian lawyer sentenced to 7 years in prison for publicly speaking out against Russia-Ukraine war,https://kyivindependent.com/russian-lawyer-sentenced-to-7-years-in-prison-for-publicly-speaking-out-against-ukraine-war/,0.97,369,0,369
22,worldnews,"‘Narco sub’ bound for Australia seized in massive international operation that netted 1,400 metric tons of drugs",https://www.cnn.com/2024/11/28/americas/narco-sub-australia-colombia-intl-hnk/index.html?utm_medium=social&amp;utm_source=reddit,0.98,357,0,357
23,worldnews,These Fossil Teeth From an 11-Year-Old Reveal Clues to Why Humans Developed an Unusually Long Childhood,https://www.smithsonianmag.com/smart-news/these-fossil-teeth-from-an-11-year-old-reveal-clues-to-why-humans-developed-an-unusually-long-childhood-180985475/,0.94,201,0,201
24,worldnews,"/r/WorldNews Live Thread: Russian Invasion of Ukraine Day 1009, Part 1 (Thread #1156)",https://www.reddit.com/live/18hnzysb1elcs,0.98,160,0,160
25,worldnews,/r/WorldNews Live Thread: Israel at War (Thread #78),https://www.reddit.com/live/1bsso361afr0r,0.82,136,0,136
26,worldnews,Sweden asks China to co-operate with severed cable investigation,https://www.bbc.com/news/articles/c748210k82wo,0.94,122,0,122
