,subreddit,title,url,upvote_ratio,ups,downs,score
0,worldnews,White House official: 8 US telecom providers hacked by Chinese,https://www.cnn.com/2024/12/04/politics/us-telecom-providers-chinese-hack/index.html,0.96,20877,0,20877
1,worldnews,"North Korean troops so 'poorly trained' that Putin army yet to throw them into battle, say western officials",https://www.standard.co.uk/news/politics/north-korean-troops-russia-ukraine-vladimir-putin-war-b1198384.html,0.94,18470,0,18470
2,worldnews,North Korean Troops in russia Are Starving in Kursk Region,https://en.defence-ua.com/news/north_korean_troops_in_russia_are_starving_in_kursk_region-12747.html,0.94,16298,0,16298
3,worldnews,Blinken confirms Ukraine to receive $50 billion transfer from frozen Russian assets,https://kyivindependent.com/blinken-confirms-ukraine-to-receive-50-billion-transfer-from-frozen-russian-assets/,0.97,11668,0,11668
4,worldnews,Syrian Rebels take Hama,https://www.cnn.com/2024/12/05/middleeast/syria-rebels-hama-government-intl/index.html,0.95,9187,0,9187
5,worldnews,Congo government says it's 'on alert' over mystery flu-like disease that killed dozens,https://www.ctvnews.ca/health/congo-government-says-it-s-on-alert-over-mystery-flu-like-disease-that-killed-dozens-1.7134550,0.98,6536,0,6536
6,worldnews,Tokyo gov't employees to get 4-day workweek option from April 2025,https://mainichi.jp/english/articles/20241204/p2a/00m/0na/004000c,0.99,5947,0,5947
7,worldnews,"Ukrainian Forces Liberate Novy Komar in Donetsk Region, Inflict Heavy Losses on Russians",https://www.kyivpost.com/post/43365,0.97,4462,0,4462
8,worldnews,"Emmanuel Macron rejects calls to stand down, will name new French PM within days",https://www.bbc.co.uk/news/articles/cdd60rzl702o.amp,0.97,2219,0,2219
9,worldnews,Trudeau government adds hundreds more assault-style weapons to its gun ban,https://www.thestar.com/politics/federal/trudeau-government-adds-hundreds-more-assault-style-weapons-to-its-gun-ban/article_35b2a7b6-b338-11ef-af5e-af637fe16710.html,0.89,2148,0,2148
10,worldnews,Canada man jumps on polar bear to defend wife from attack,https://www.bbc.com/news/articles/cewx20xrgj5o,0.96,2102,0,2102
11,worldnews,Far-right Russian militia leader goes on trial for war crimes in Ukraine | Yle News ,https://yle.fi/a/74-20129519,0.97,1771,0,1771
12,worldnews,Zelenskyy on Budapest Memorandum: Not a single day did this document work,https://www.pravda.com.ua/eng/news/2024/12/5/7487886/,0.96,1652,0,1652
13,worldnews,Russia's Advanced Podlet-1K Radar Captured By Anti-Assad Forces In Syria,https://www.twz.com/land/russias-advanced-podlet-1k-radar-captured-by-anti-assad-forces-in-syria,0.97,1613,0,1613
14,worldnews,Congo 'on alert' over mystery flu-like disease that killed dozens,https://www.ctvnews.ca/health/congo-on-alert-over-mystery-flu-like-disease-that-killed-dozens-1.7134550,0.95,1210,0,1210
15,worldnews,Senior Biden aide commits to giving Ukraine avalanche of military assistance,https://www.theguardian.com/us-news/2024/dec/05/biden-administration-ukraine-military-assistance-russia-sanctions?CMP=Share_AndroidApp_Other,0.95,1159,0,1159
16,worldnews,Paraguay kicks out a visiting Chinese envoy for urging its lawmakers to turn their backs on Taiwan,https://apnews.com/article/paraguay-china-diplomatic-ties-taiwan-trade-784b083353b331bf9274a4666066beb4,0.97,1008,0,1008
17,worldnews,Ukraine rejects calls by Washington to lower draft age to 18,https://tvpworld.com/83847989/kyiv-rejects-us-calls-to-lower-military-draft-age,0.93,963,0,963
18,worldnews,Worshippers flee as synagogue in Australia is set on fire in targeted attack.,https://www.bbc.com/news/articles/c5ydr228jyko,0.94,936,0,936
19,worldnews,"30 years ago today, Ukraine traded nuclear arms for security assurances, a decision that still haunts Kyiv today",https://kyivindependent.com/30-years-ago-ukraine-traded-nuclear-arms-for-security-assurances-a-decision-that-haunts-kyiv-today/,0.97,830,0,830
20,worldnews,Romania election: Frontrunner Calin Georgescu vows to end Ukraine aid,https://www.bbc.com/news/articles/cvg6l06ldpqo,0.93,756,0,756
21,worldnews,Polish FM walks out of OSCE meeting in protest at presence of Russia’s Lavrov,https://tvpworld.com/83837869/polish-fm-walks-out-of-osce-meeting-to-protest-lavrovs-presence,0.98,713,0,713
22,worldnews,SpaceX faces opposition to Starlink expansion from Ukrainian group concerned about Musk ties to Russia,https://www.cnbc.com/2024/12/05/spacex-faces-opposition-to-starlink-expansion-from-ukrainian-group.html,0.95,345,0,345
23,worldnews,"Melbourne, Australia, synagogue set ablaze, forcing congregants to flee",https://www.jta.org/2024/12/05/global/synagogue-in-melbourne-set-ablaze-forcing-congregants-to-flee,0.88,242,0,242
24,worldnews,(South Korea) Army special warfare commander says he defied order to drag out lawmakers,https://en.yna.co.kr/view/AEN20241206005700315?section=national/politics,0.98,239,0,239
25,worldnews,"/r/WorldNews Live Thread: Russian Invasion of Ukraine Day 1016, Part 1 (Thread #1163)",https://www.reddit.com/live/18hnzysb1elcs,0.97,139,0,139
26,worldnews,/r/WorldNews Live Thread: Israel at War (Thread #79),https://www.reddit.com/live/1bsso361afr0r,0.77,112,0,112
