,subreddit,title,url,upvote_ratio,ups,downs,score
0,worldnews,"Trump threatens Russia with sanctions, tariffs if Putin doesn't end Ukraine war",https://www.cnbc.com/2025/01/22/trump-threatens-russia-with-sanctions-tariffs-if-putin-doesnt-end-ukraine-war.html,0.92,38218,0,38218
1,worldnews,"‘Mr. Trump, f— off’: Danish politician lashes out over Greenland proposal",https://globalnews.ca/news/10971681/greenland-donald-trump-f-off-danish-anders-vistisen/,0.91,30192,0,30192
2,worldnews,"Tech billionaires want to ‘overthrow democracy’ with social media, Spain PM Sánchez says",https://www.politico.eu/article/spain-pedro-sanchez-big-tech-billionaires-democracy-social-media/,0.95,20551,0,20551
3,worldnews,Trump tasks US envoy Kellogg with ending war in Ukraine within 100 days – WSJ,https://newsukraine.rbc.ua/news/trump-tasks-us-envoy-kellogg-with-ending-1737535073.html,0.95,17434,0,17434
4,worldnews,'This may be my last message': Uyghurs stage hunger strike over China deportation,https://www.telegraph.co.uk/world-news/2025/01/22/last-message-uyghurs-stage-hunger-strike-china-deportation/,0.94,15458,0,15458
5,worldnews,Zelenskiy Tells Trump Ukraine Needs US Troops to Secure Peace,https://www.bloomberg.com/news/articles/2025-01-22/trump-news-zelenskiy-says-ukraine-needs-us-troops-to-secure-peace,0.94,10825,0,10825
6,worldnews,German parliament to debate ban on far-right AfD next week,https://www.yahoo.com/news/german-parliament-debate-ban-far-191131433.html,0.95,9922,0,9922
7,worldnews,Amazon is ceasing operations in Quebec,https://www.ctvnews.ca/montreal/article/amazon-is-ceasing-operations-in-quebec/,0.97,8595,0,8595
8,worldnews,Ukraine will never recognise occupied territories as part of Russia – Zelenskyy,https://www.pravda.com.ua/eng/news/2025/01/22/7494710/,0.98,8428,0,8428
9,worldnews,EU tells Trump’s America: We have other options,https://www.politico.eu/article/eu-donald-trump-america-we-have-other-options-ursula-von-der-leyen/,0.96,7254,0,7254
10,worldnews,Trump expected to redesignate Yemen’s Houthis as terror organization,https://english.alarabiya.net/News/middle-east/2025/01/23/trump-expected-to-redesignate-yemen-s-houthis-as-terror-organization-officials,0.97,6860,0,6860
11,worldnews,Ireland on alert as Trump pulls US out of global tax deal,https://www.irishtimes.com/business/2025/01/22/ireland-on-alert-as-trump-pulls-us-out-of-global-tax-deal/,0.97,5705,0,5705
12,worldnews,"Once guns fall silent in Ukraine, Russia will begin military revival – British general",https://www.pravda.com.ua/eng/news/2025/01/22/7494752/,0.98,5647,0,5647
13,worldnews,Mexican President Reacts to Trump's Gulf of America Plan: 'For the Entire World It Is Still the Gulf of Mexico',https://people.com/mexican-president-reacts-to-trump-gulf-of-america-plan-8777772,0.95,5416,0,5416
14,worldnews,Japan’s loneliness epidemic is so bad that elderly women are committing crimes to find friends and health care in prison,https://www.yahoo.com/news/japan-loneliness-epidemic-bad-elderly-011500952.html,0.98,3938,0,3938
15,worldnews,Elon Musk controversial salute image beamed on Tesla factory in Berlin,https://www.newsweek.com/elon-musk-controversial-salute-image-beamed-tesla-factory-berlin-2019279,0.95,2562,0,2562
16,worldnews,Trump Tells Putin to Make Ukraine Deal 'Now' or Face Tougher Sanctions,https://www.themoscowtimes.com/2025/01/22/trump-tells-putin-to-make-ukraine-deal-now-or-face-tougher-sanctions-a87707,0.95,2296,0,2296
17,worldnews,Panama protests ‘threat’ of force as Trump pushed to reclaim canal,https://thehill.com/homenews/5101038-panama-canal-trump-un/,0.95,2294,0,2294
18,worldnews,Milei blames Musk Nazi salute scandal on ‘international wokism’,https://buenosairesherald.com/politics/milei-blames-musk-nazi-salute-scandal-on-international-wokism,0.86,2216,0,2216
19,worldnews,Danish politician tells Trump Greenland not for sale: ‘F‑‑‑ off’,https://thehill.com/policy/international/5100318-trump-greenland-denmark-european-parliament/,0.94,2193,0,2193
20,worldnews,UK warns Putin after Russian spy ship returns to British waters,https://www.bbc.com/news/articles/cqjv7qgpw28o?xtor=AL-71-%5Bpartner%5D-%5Bbbc.news.twitter%5D-%5Bheadline%5D-%5Bnews%5D-%5Bbizdev%5D-%5Bisapi%5D&amp;at_ptr_name=twitter&amp;at_link_id=BF93EAF6-D8C9-11EF-8D85-BF3B70CEE4D1&amp;at_campaign=Social_Flow&amp;at_campaign_type=owned&amp;at_format=link&amp;at_medium=social&amp;at_link_type=web_link&amp;at_bbc_team=editorial&amp;at_link_origin=BBCWorld,0.98,2183,0,2183
21,worldnews,"Iran has about 200 kg of uranium enriched to near bomb-grade, Grossi says",https://www.jpost.com/breaking-news/article-838724,0.94,2078,0,2078
22,worldnews,Ukrainian Special Ops Crush DPRK Troop Offensive in 8-Hour Standoff,https://www.kyivpost.com/post/45867,0.96,1166,0,1166
23,worldnews,Canada says it can help the US achieve its 'golden age',https://www.bbc.com/news/articles/c87dpv95lr8o.amp,0.9,645,0,645
24,worldnews,"Russian military deploys injured troops in ""crutch battalions,"" highlighting manpower crisis - Euromaidan Press",https://euromaidanpress.com/2025/01/22/russian-military-deploys-injured-troops-in-crutch-battalions-highlighting-manpower-crisis/,0.96,326,0,326
25,worldnews,"/r/WorldNews Live Thread: Russian Invasion of Ukraine Day 1064, Part 1 (Thread #1211)",https://www.reddit.com/live/18hnzysb1elcs,0.93,129,0,129
