,subreddit,title,url,upvote_ratio,ups,downs,score
0,worldnews,Putin Decides He Can Step Up Attacks on Kyiv and Trump Won’t Act,https://www.bloomberg.com/news/articles/2025-09-20/putin-decides-russia-can-step-up-ukraine-attacks-and-trump-won-t-act,0.95,25286,0,25286
1,worldnews,Another Russian CEO found dead in mysterious circumstances,https://tvpworld.com/89031886/russian-businessman-alexander-tyunin-found-dead-next-to-rifle-and-suicide-note,0.97,20449,0,20449
2,worldnews,Zelenskyy: Seized maps show that Russians deceive their own command,https://www.pravda.com.ua/eng/news/2025/09/20/7531711/,0.97,16297,0,16297
3,worldnews,"Ukraine strikes oil refineries in Russia's Saratov and Samara oblasts, military confirms",https://kyivindependent.com/ukraine-reportedly-strike-oil-refinery-in-russia-saratov-oblast-explosions-reported-deep-inside-russia/,0.98,5076,0,5076
4,worldnews,India says Trump’s H1-B visa fee hike could ‘disrupt families’,https://www.aljazeera.com/news/2025/9/20/h-1b-visa-fee-timeline-imposed-by-us-concerning-says-india-trade-body,0.9,4713,0,4713
5,worldnews,Reuters: Pentagon warns European diplomats of aid cuts to Baltic states,https://news.liga.net/en/politics/news/reuters-pentagon-warns-european-diplomats-of-aid-cuts-to-baltic-states,0.97,3872,0,3872
6,worldnews,Zelenskyy rules out Korean-type or any other similar model to end war,https://www.pravda.com.ua/eng/news/2025/09/20/7531704,0.96,3496,0,3496
7,worldnews,Over 1.5 tons of cocaine found on ship from Ecuador to Russia,https://report.az/en/region/over-1-5-tons-of-cocaine-found-on-ship-from-ecuador-to-russia,0.97,3398,0,3398
8,worldnews,"'This is Russia’s war, Russia should pay' — UK examining new ways to use Moscow's frozen assets",https://kyivindependent.com/this-is-russias-war-russia-should-pay-uk-examining-new-ways-to-use-moscows-frozen-assets/,0.98,3263,0,3263
9,worldnews,Zelenskyy accuses allies of ‘wasting time’ as he prepares for Trump meeting,https://www.theguardian.com/world/2025/sep/20/zelenskyy-accuses-allies-of-wasting-time-as-he-prepares-for-trump-meeting,0.97,3031,0,3031
10,worldnews,Trump warns Venezuela to take back prisoners or face 'incalculable' price,https://www.reuters.com/world/americas/trump-warns-venezuela-take-back-prisoners-or-face-incalculable-price-2025-09-20/,0.94,2683,0,2683
11,worldnews,Starmer to announce formal recognition of Palestine as a state,https://news.sky.com/story/starmer-to-announce-formal-recognition-of-palestine-as-a-state-13433557,0.86,2307,0,2307
12,worldnews,"NATO 'must respond accordingly, including militarily' to Russian provocations, Czech president says",https://kyivindependent.com/nato-must-respond-accordingly-to-russian-provocations-czech-president-says/,0.98,1720,0,1720
13,worldnews,Donald Trump warns Taliban over Bagram air base control | The Jerusalem Post,https://www.jpost.com/middle-east/article-868176,0.93,1670,0,1670
14,worldnews,Zelenskyy announces decision to establish assault forces,https://www.pravda.com.ua/eng/news/2025/09/20/7531703/,0.98,1503,0,1503
15,worldnews,Lithuania Calls for NATO to “Mean Business” After Russian Jets Breach Airspace,https://united24media.com/latest-news/lithuania-calls-for-nato-to-mean-business-after-russian-jets-breach-airspace-11813,0.98,1394,0,1394
16,worldnews,The U.S. Is Quietly Pausing Some Arms Sales to Europe,https://www.theatlantic.com/national-security/archive/2025/09/arms-sale-europe-trump-colby-ukraine/684274/,0.94,1267,0,1267
17,worldnews,"Canadian politicians, experts push back against U.S. ambassador's anti-Americanism concerns | CBC News",https://www.cbc.ca/news/politics/us-ambassador-anti-americanism-pushback-canada-1.7639396,0.96,1126,0,1126
18,worldnews,"Russia supplies weapons to italian Mafia, according to the Italian publication Linkiesta",https://militarnyi.com/en/news/russia-supplies-weapons-to-italian-mafia-linkiesta/,0.97,903,0,903
19,worldnews,India warns new US H-1B visa fee will have 'humanitarian consequences',https://www.bbc.com/news/articles/clyll7dlg7lo,0.81,778,0,778
20,worldnews,Senior Taliban spymaster threatens suicide bombings after Trump’s Bagram remarks,https://www.afintl.com/en/202509200435,0.94,637,0,637
21,worldnews,UK fighter jets begin NATO air defence mission over Poland,https://www.reuters.com/business/aerospace-defense/uk-fighter-jets-begin-nato-air-defence-mission-over-poland-2025-09-20/,0.97,389,0,389
22,worldnews,Marchers gather in worldwide protest of financial institutions 'profiting off the climate crisis',https://apnews.com/article/new-york-climate-week-protests-activists-3a66ffffcd47c02f3e6bd96596759d3e,0.94,266,0,266
23,worldnews,US military strike off the coast of Venezuela disrupts life in impoverished fishing communities,https://apnews.com/article/venezuela-maduro-strike-caribbean-drug-trafficking-trump-1061debe2f983ef7bc9666d3f002b3a0,0.82,171,0,171
24,worldnews,"/r/WorldNews Live Thread: Russian Invasion of Ukraine Day 1305, Part 1 (Thread #1452)",https://www.reddit.com/live/18hnzysb1elcs,0.99,140,0,140
25,worldnews,"Ukraine Preparing to Launch Stormtrooper Units Within Days, Zelenskyy Says",https://united24media.com/latest-news/ukraine-preparing-to-launch-stormtrooper-units-within-days-zelenskyy-says-11809,0.9,49,0,49
