,subreddit,title,url,upvote_ratio,ups,downs,score
0,worldnews,"US buys 81 Soviet-era combat aircraft from Russia's ally for less than $20,000 each, report says",https://www.businessinsider.com/us-buys-81-soviet-fighter-jets-from-russian-ally-20k-2024-4,0.95,19519,0,19519
1,worldnews,"The decipherment of an ancient scroll carbonized by the eruption of Mount Vesuvius has revealed where the Greek philosopher Plato is buried, Italian researchers say",https://www.livescience.com/archaeology/romans/platos-burial-place-finally-revealed-after-ai-deciphers-ancient-scroll-carbonized-in-mount-vesuvius-eruption,0.97,11540,0,11540
2,worldnews,"Istanbul Mayor to CNN: 'Hamas is a terrorist organization, carried out terror'",https://m.jpost.com/breaking-news/article-798988,0.92,5534,0,5534
3,worldnews,Outrage as London police cover Holocaust memorial for fear of vandalism by antisemitic mob,https://www.ynetnews.com/article/b1bqfno11r,0.84,5509,0,5509
4,worldnews,"Another U.S. precision-guided weapon falls prey to Russian electronic warfare, U.S. says ",https://www.defenseone.com/threats/2024/04/another-us-precision-guided-weapon-falls-prey-russian-electronic-warfare-us-says/396141/,0.94,3121,0,3121
5,worldnews,Rwanda plan: Irish government wants to send asylum seekers back to UK,https://www.bbc.co.uk/news/uk-politics-68914399,0.95,2510,0,2510
6,worldnews,Diplomatic row erupts as Britain rejects any bid by Ireland to return asylum seekers to UK,https://au.lifestyle.yahoo.com/diplomatic-row-erupts-britain-rejects-211345304.html,0.97,2505,0,2505
7,worldnews,AP and Reuters journalists arrested in Russia,https://www.pravda.com.ua/eng/news/2024/04/28/7453356/,0.96,1996,0,1996
8,worldnews,"Israel has agreed to listen to US concerns before any Rafah move, says White House",https://www.reuters.com/world/middle-east/israel-has-agreed-listen-us-concerns-before-any-rafah-move-says-white-house-2024-04-28/,0.93,1478,0,1478
9,worldnews,Forbes journalist placed under house arrest for allegedly spreading fake news about Russian army,https://edition.cnn.com/2024/04/27/europe/forbes-journalist-house-arrest-russia-fake-news-intl/index.html,0.95,1374,0,1374
10,worldnews,Kremlin Disputes Report Putin Didn’t Order Navalny’s Death,https://www.thedailybeast.com/kremlin-disputes-report-vladimir-putin-didnt-order-alexei-navalnys-death,0.94,1355,0,1355
11,worldnews,Vancouver protesters praise terrorist groups and chant 'Long live October 7',https://www.jpost.com/israel-hamas-war/article-799041,0.79,1179,0,1179
12,worldnews,"/r/WorldNews Live Thread: Russian Invasion of Ukraine Day 795, Part 1 (Thread #941)",https://www.reddit.com/live/18hnzysb1elcs,0.95,1077,0,1077
13,worldnews,"Schools closed, warnings issued as Asia swelters in extreme heatwave: A wave of exceptionally hot weather has blasted the region over the past week, sending the mercury as high as 45 degrees Celsius (113 degrees Fahrenheit) and forcing thousands of schools to tell students to stay home",https://www.france24.com/en/live-news/20240428-schools-closed-warnings-issued-as-asia-swelters-in-extreme-heatwave,0.96,903,0,903
14,worldnews,France charges ex-wife of top IS group official with crimes against humanity,https://www.france24.com/en/europe/20240428-france-charges-ex-wife-of-top-is-group-official-with-crimes-against-humanity,0.96,799,0,799
15,worldnews,Tens of thousands of Georgians rally in Tbilisi against the Russian Law.,https://civil.ge/archives/601911,0.97,781,0,781
16,worldnews,"German AfD wants to dismantle EU, turn into confederation of nations – Euractiv",https://www.euractiv.com/section/elections/news/german-afd-wants-to-dismantle-eu-turn-into-confederation-of-nations/,0.88,756,0,756
17,worldnews,Slovak citizens raise $4 million for Czech ammunition initiative after government refuses to contribute,https://kyivindependent.com/slovak-citizens-raise-4-million-for-czech-ammunition-initiative-after-government-refuses-to-contribute/,0.96,609,0,609
18,worldnews,Five settlers arrested over deadly reprisals following teen's murder in West Bank,https://www.timesofisrael.com/five-settlers-arrested-over-deadly-reprisals-following-teens-murder-in-west-bank/,0.89,519,0,519
19,worldnews,Biden to Confer With Netanyahu on a Possible Cease-Fire and Hostage Deal,https://www.nytimes.com/2024/04/28/us/politics/biden-netanyahu-israel-cease-fire.html?unlocked_article_code=1.n00.UKfl.rsi1280E2ffY&amp;smid=url-share,0.88,432,0,432
20,worldnews,Russia arrests more journalists on ‘extremism’ charges,https://thehill.com/policy/international/4627953-russia-arrests-more-journalists-on-extremism-charges/,0.94,286,0,286
21,worldnews,"Some in State Department don’t believe Israel is using US weapons in accordance with international law, source says",https://www.cnn.com/2024/04/28/politics/state-department-israel-gaza-international-law-us-weapons/index.html,0.74,276,0,276
22,worldnews,China firms go 'underground' on Russia payments as banks pull back,https://www.reuters.com/business/finance/china-firms-go-underground-russia-payments-banks-pull-back-2024-04-28/,0.95,174,0,174
23,worldnews,/r/WorldNews Live Thread: Iran attacks Israel (Thread 5),https://www.reddit.com/live/1bsso361afr0r,0.77,167,0,167
24,worldnews,'So hot you can't breathe': Extreme heat hits the Philippines,https://www.japantimes.co.jp/news/2024/04/24/asia-pacific/philippines-extreme-heat/,0.96,132,0,132
25,worldnews,"Japan's ruling party loses all 3 seats in special vote, seen as punishment for corruption scandal",https://abcnews.go.com/International/wireStory/japans-ruling-party-loses-3-seats-special-vote-109728275,0.97,124,0,124
26,worldnews,Israeli Officials Believe I.C.C. Is Preparing Arrest Warrants Over War,https://www.nytimes.com/2024/04/28/world/middleeast/icc-arrest-warrants-israel-hamas.html,0.8,94,0,94
