,subreddit,title,url,upvote_ratio,ups,downs,score
0,worldnews,"'Deal not final': Trump changes tune on Iran, threatens to ‘drop bombs’, go back to shooting again",https://www.hindustantimes.com/world-news/trump-changes-tune-iran-deal-not-final-dropping-bombs-shooting-tehran-doesnt-behave-war-g7-meet-france-101781696130479.html,0.96,18639,0,18639
1,worldnews,"Melbourne woman Zeinab Ahmad, accused of owning a Yazidi slave, refused bail",https://www.abc.net.au/news/2026-06-17/zeinab-ahmad-denied-bail-on-slavery-charges/106800836,0.96,10483,0,10483
2,worldnews,"'I'm the boss', Trump says at G7, as he warms to Ukraine's war aims",https://www.reuters.com/world/china/g7-leaders-tackle-reliance-china-critical-minerals-2026-06-17/,0.94,9242,0,9242
3,worldnews,"Russia’s War Toll Hits Up to 1.4 Million Casualties, NATO Says",https://united24media.com/war-in-ukraine/russias-war-toll-hits-up-to-14-million-casualties-nato-says-19934,0.97,6750,0,6750
4,worldnews,"Bus with Belarus children hit by a drone in Russia, Moscow claims it was attacked by Ukraine",https://www.euronews.com/my-europe/2026/06/17/bus-carrying-belarus-children-hit-by-a-drone-in-russia-moscow-claims,0.95,5772,0,5772
5,worldnews,"Ukrainian drones strike Moscow oil refinery, city in thick smoke",https://www.pravda.com.ua/eng/news/2026/06/18/8039880/,0.98,5226,0,5226
6,worldnews,Finland tears up nuclear weapons ban in NATO shift,https://www.politico.eu/article/finland-lifts-nuclear-weapons-ban-nato-security-shift/,0.98,3808,0,3808
7,worldnews,‘It is time to end this war’: Zelensky Says Russia Must Take Diplomatic Steps After Moscow Strike,https://www.kyivpost.com/post/78427,0.98,3127,0,3127
8,worldnews,G7 backs Canada as major global energy supplier to lessen reliance on Strait of Hormuz | CBC News,https://www.cbc.ca/news/politics/canada-energy-supplier-strait-hormuz-9.7238708,0.98,2953,0,2953
9,worldnews,"U.S. and Iran sign deal ahead of schedule, sources say",https://www.axios.com/2026/06/17/iran-deal-signing-text-release,0.95,2952,0,2952
10,worldnews,"Zelenskyy on Moscow in flames: ""justified response"" to Russian attacks",https://www.pravda.com.ua/eng/news/2026/06/18/8039905/,0.98,2335,0,2335
11,worldnews,Netherlands announces €500 million military aid package for Ukraine,https://nltimes.nl/2026/06/17/netherlands-announces-eu500-million-military-aid-package-ukraine,0.98,2317,0,2317
12,worldnews,Trump says US would do better without USMCA trade agreement,https://www.reuters.com/world/americas/trump-says-us-would-do-better-without-usmca-trade-agreement-2026-06-17/,0.94,1883,0,1883
13,worldnews,"Canada should 'indefinitely' exclude people with mental illness from assisted dying, report says",https://www.bbc.com/news/articles/crelwx1ye1do,0.87,1614,0,1614
14,worldnews,"Simpler, older version of Stonehenge found three miles from famous site",https://www.bbc.com/news/articles/clyxw8550y8o,0.97,1398,0,1398
15,worldnews,"Iran to reopen Strait of Hormuz, can sell oil again, according to U.S. officials | CBC News",https://www.cbc.ca/news/world/iran-us-war-memorandum-details-9.7238245,0.94,1291,0,1291
16,worldnews,Settlers set fire to two West Bank mosques overnight,https://www.timesofisrael.com/settlers-set-fire-to-two-west-bank-mosques-overnight/,0.8,1018,0,1018
17,worldnews,"Trump thanks China's Xi, Russia's Putin for being 'neutral' in Iran war",https://www.reuters.com/world/china/trump-thanks-chinas-xi-russias-putin-being-neutral-iran-war-2026-06-17/,0.92,750,0,750
18,worldnews,Politicians in Europe call on Albania to stop construction project linked to Jared Kushner,https://thenationaldesk.com/news/americas-news-now/politicians-in-europe-call-on-albania-to-stop-construction-project-linked-to-jared-kushner-ivanka-trump-flamingo-environment,0.98,481,0,481
19,worldnews,"/r/WorldNews Live Thread: Russian Invasion of Ukraine Day 1575, Part 1 (Thread #1722)",https://www.reddit.com/live/18hnzysb1elcs,0.97,239,0,239
20,worldnews,"Risk of dying from cervical cancer before 30 'close to zero' after HPV vaccine rollout - Children vaccinated at age 12–13 against HPV (human papillomavirus) have close to zero risk of dying from cervical cancer before the age of 30, landmark new research reveals.",https://www.bbc.com/news/articles/c621z28z138o,0.97,222,0,222
21,worldnews,/r/WorldNews Discussion Thread: US and Israel launch attack on Iran; Iran retaliates (Thread #19),https://www.reddit.com/r/worldnews/comments/1u39jcq/rworldnews_discussion_thread_us_and_israel_launch/,0.88,182,0,182
22,worldnews,5 IDF soldiers wounded by Hezbollah in South Lebanon yesterday,https://www.jpost.com/middle-east/article-899721,0.79,175,0,175
23,worldnews,"Trump, Pezeshkian sign deal to end Iran war, reopen Hormuz",https://www.dw.com/en/iran-war-deal-trump-pezeshkian/live-77596195?maca=en-rss-en-all-1573-rdf,0.86,174,0,174
24,worldnews,Moscow region governor says 16 people were injured in big Ukrainian drone attack,https://www.reuters.com/world/europe/moscow-region-governor-says-16-people-were-injured-big-ukrainian-drone-attack-2026-06-18/,0.93,99,0,99
