,subreddit,title,url,upvote_ratio,ups,downs,score
0,worldnews,"US threatens to shut off Starlink if Ukraine won't sign minerals deal, sources tell Reuters",https://kyivindependent.com/us-threatens-to-shut-off-starlink-if-ukraine-wont-sign-minerals-deal-sources-tell-reuters/,0.9,49145,0,49145
1,worldnews,‘It’s blackmail’: Ukrainians react to Trump demand for $500bn share of minerals,https://www.theguardian.com/world/2025/feb/22/its-blackmail-ukrainians-react-to-trump-demand-for-500bn-share-of-minerals,0.96,24599,0,24599
2,worldnews,Trump admits Russia attacked Ukraine,https://kyivindependent.com/trump-admits-russia-attacked-ukraine/,0.95,24018,0,24018
3,worldnews,Nearly 50 percent of Britons favor supporting Ukraine over US,https://www.ukrainianworldcongress.org/nearly-50-percent-of-britons-favor-supporting-ukraine-over-us/,0.98,13405,0,13405
4,worldnews,Macron’s message to Trump: ‘You can’t be weak in the face of Putin’,https://apnews.com/article/trump-macron-ukraine-china-ec6310fca8b9a20650bbb196d48d43f9,0.97,13203,0,13203
5,worldnews,Poland to continue to pay for Ukraine’s satellite internet,https://tvpworld.com/85232322/poland-pledges-to-continue-to-pay-for-ukraines-satellite-internet-says-minister,0.99,12899,0,12899
6,worldnews,Elon Musk Boosts Germany’s Far-Right AfD Party Again Ahead Of Sunday’s Election,https://www.forbes.com/sites/conormurray/2025/02/22/elon-musk-boosts-germanys-far-right-afd-party-again-ahead-of-sundays-election/,0.95,12850,0,12850
7,worldnews,"Zelenskyy not ready to sign 'problematic' Ukraine minerals deal with US, source says",https://news.sky.com/story/trump-says-a-key-deal-on-ukrainian-minerals-is-close-zelenskyy-disagrees-13314377,0.98,9863,0,9863
8,worldnews,"Trump ""not well informed"" about Ukraine war, Dutch Defense Min. says",https://nltimes.nl/2025/02/21/trump-well-informed-ukraine-war-dutch-defense-min-says,0.98,9112,0,9112
9,worldnews,US envoy says America is 'with' Ukraine - in contrast to Trump's remarks,https://news.sky.com/story/us-envoy-says-america-is-with-ukraine-in-contrast-to-trumps-remarks-13314434,0.97,6182,0,6182
10,worldnews,"I'll back Ukraine in talks with Trump, Starmer says",https://www.bbc.com/news/articles/c8rklvrnl7ro,0.98,5213,0,5213
11,worldnews,New Proposal for Ukraine’s Minerals Is Nearly Identical to Rejected Version,https://www.nytimes.com/2025/02/22/world/europe/ukraine-trump-minerals.html,0.97,4715,0,4715
12,worldnews,'Europe did more than the US' — EU defense commissioner pushes back against Trump accusations,https://kyivindependent.com/we-are-now-producing-more-than-americans-eu-defense-commissioner-on-europes-arms-rebirth/,0.96,4095,0,4095
13,worldnews,US Pushes Allies to Block Ukrainian UN Text That Condemns Russia,https://www.bloomberg.com/news/articles/2025-02-22/us-pushes-allies-to-block-ukrainian-un-text-that-condemns-russia?utm_source=website&amp;utm_medium=share&amp;utm_campaign=copy,0.96,3378,0,3378
14,worldnews,"Pope Francis Is In Critical Condition, Report Says",https://www.forbes.com/sites/conormurray/2025/02/22/pope-francis-is-in-critical-condition-report-says/,0.95,2346,0,2346
15,worldnews,"Russia is ‘recycling’ wounded troops, sending some to the frontline on crutches",https://www.cnn.com/2025/02/22/europe/russia-wounded-troops-frontline-latam-intl/index.html,0.97,2170,0,2170
16,worldnews,"NATO to reportedly extend jet fuel pipeline to Czechia, Poland in case of war with Russia",https://kyivindependent.com/nato-to-reportedly-extend-jet-fuel-pipeline-to-czechia-and-poland/,0.98,2144,0,2144
17,worldnews,"Meta, X approved ads containing violent anti-Muslim, antisemitic hate speech ahead of German election, study finds",https://techcrunch.com/2025/02/21/meta-x-approved-ads-containing-violent-anti-muslim-antisemitic-hate-speech-ahead-of-german-election-study-finds/,0.94,1987,0,1987
18,worldnews,Ukraine Opposes US Demand For $500 Billion Fund in Minerals Deal,https://www.bloomberg.com/news/articles/2025-02-22/ukraine-opposes-us-demand-for-500-billion-fund-in-minerals-deal?srnd=homepage-europe,0.98,1767,0,1767
19,worldnews,"Draft US-Ukraine rare earth minerals deal not one President Zelensky would accept, source says",https://www.cnn.com/2025/02/22/europe/rare-earth-minerals-us-ukraine-intl/index.html,0.97,1207,0,1207
20,worldnews,Ukrainian General Staff confirms strike on oil pumping station in Russia's Krasnodar territory,https://www.ukrinform.net/rubric-ato/3963123-ukrainian-general-staff-confirms-strike-on-oil-pumping-station-in-russias-krasnodar-territory.html,0.99,1081,0,1081
21,worldnews,Ukraine expects new F-16s this year - Zelenskyy,https://newsukraine.rbc.ua/news/ukraine-expects-new-f-16-this-year-zelenskyy-1740235252.html,0.97,948,0,948
22,worldnews,Elon Musk blames ''Zelenskyy's Defence Ministry official'' for crimes committed by associate of former president Yanukovych who ran from Ukraine in 2017,https://www.pravda.com.ua/eng/news/2025/02/22/7499636/,0.92,669,0,669
23,worldnews,Ukraine Is Daring Russia To Open Fire On Swarms Of New Trembita Drones. Many Of The Drones Will Be Decoys.,https://www.forbes.com/sites/davidaxe/2025/02/21/ukraine-is-daring-russia-to-open-fire-on-swarms-of-new-trembita-drones-many-of-the-drones-will-be-decoys/,0.97,449,0,449
24,worldnews,"Trudeau, Trump talk Ukraine as allies fear U.S. withdrawal from war effort",https://globalnews.ca/news/11030852/trudeau-trump-talk-ukraine/,0.93,375,0,375
25,worldnews,"/r/WorldNews Live Thread: Russian Invasion of Ukraine Day 1095, Part 1 (Thread #1242)",https://www.reddit.com/live/18hnzysb1elcs,0.97,112,0,112
