,subreddit,title,url,upvote_ratio,ups,downs,score
0,worldnews,China calls bluff on 245% US tariff: 'Meaningless',https://www.newsweek.com/china-responds-us-tariffs-245-percent-trump-trade-war-2060875,0.94,46313,0,46313
1,worldnews,The Economist: Trump administration ''fed up'' with Europe's efforts to strengthen Ukraine,https://www.pravda.com.ua/eng/news/2025/04/16/7507847/,0.95,24842,0,24842
2,worldnews,Zelensky says US envoy Witkoff is spreading 'Russian narratives',https://www.bbc.com/news/articles/c4g7wdw9jvno?xtor=AL-71-%5Bpartner%5D-%5Bbbc.news.twitter%5D-%5Bheadline%5D-%5Bnews%5D-%5Bbizdev%5D-%5Bisapi%5D&amp;at_link_origin=BBCWorld&amp;at_medium=social&amp;at_link_type=web_link&amp;at_ptr_name=twitter&amp;at_campaign=Social_Flow&amp;at_bbc_team=editorial&amp;at_link_id=4A0D504C-1BC2-11F0-AD0A-DD45595878B7&amp;at_format=link&amp;at_campaign_type=owned,0.96,23706,0,23706
3,worldnews,"‘Extreme’ US-China decoupling could cost US$2.5 trillion, Goldman warns",https://www.scmp.com/business/china-business/article/3306443/us-china-decoupling-could-cost-us25-trillion-extreme-goldman-warns?utm_source=semafor,0.97,19936,0,19936
4,worldnews,Ukraine has evidence of China supplying Russia with weapons: Zelensky,https://www.scmp.com/news/world/russia-central-asia/article/3306986/ukraine-has-evidence-china-supplying-russia-weapons-zelensky-says,0.97,7034,0,7034
5,worldnews,Canadians cancel U.S. business trips amid tariff anger and border fear,https://toronto.citynews.ca/2025/04/17/canadians-cancel-u-s-business-trips-en-masse-amid-tariff-anger-and-border-fear/,0.97,6731,0,6731
6,worldnews,Germany will not invite Russia and Belarus to second world war commemoration,https://www.theguardian.com/world/2025/apr/17/germany-will-not-invite-russia-and-belarus-to-second-world-war-commemoration,0.99,5988,0,5988
7,worldnews,‘No quick wins’: China has the world’s first operational thorium nuclear reactor,https://amp.scmp.com/news/china/science/article/3306933/no-quick-wins-china-has-worlds-first-operational-thorium-nuclear-reactor,0.97,5933,0,5933
8,worldnews,Vladimir Putin lauds Elon Musk as rare pioneer,https://www.politico.eu/article/vladimir-putin-lauds-elon-musk-as-rare-pioneer/,0.94,4545,0,4545
9,worldnews,"Russia has violated ‘energy ceasefire’ more than 30 times, Ukraine says",https://kyivindependent.com/russia-has-violated-energy-ceasefire-more-than-30-times-ukraine-says/,0.98,4196,0,4196
10,worldnews,Trump says U.S. to sign rare earths minerals deal with Ukraine next week,https://www.npr.org/2025/04/17/nx-s1-5366821/trump-italy-meloni,0.91,3838,0,3838
11,worldnews,Nearly 300 apply as French university offers US academics ‘scientific asylum’,https://www.theguardian.com/education/2025/apr/17/nearly-300-applications-to-french-university-offer-to-take-in-us-academics,0.98,3618,0,3618
12,worldnews,Trump administration announces fees on Chinese ships docking at U.S. ports,https://www.cnbc.com/2025/04/17/trump-administration-announces-fees-on-chinese-ships-docking-at-us-ports.html,0.97,3561,0,3561
13,worldnews,Trial of 45 doctors for spreading anti-vaccine claims during Covid pandemic starts in Poland,https://notesfrompoland.com/2025/04/17/trial-of-45-doctors-for-spreading-anti-vaccine-claims-during-covid-pandemic-starts-in-poland/,0.98,2996,0,2996
14,worldnews,US did not support UN resolution mentioning aggression in Ukraine,https://newsukraine.rbc.ua/news/us-did-not-support-un-resolution-mentioning-1744897629.html,0.97,2546,0,2546
15,worldnews,Putin Ally Says Any European Peacekeepers in Ukraine Will Return in Coffins,https://www.newsweek.com/putin-medvedev-nato-peacekeepers-ukraine-2060940,0.94,2022,0,2022
16,worldnews,Brazil prohibits hormone therapy for transgender minors,https://www.batimes.com.ar/news/latin-america/brazil-prohibits-hormone-therapy-for-transgender-minors.phtml,0.92,1963,0,1963
17,worldnews,"Looser food standards off the menu in any US-UK trade deal | Britain will not relax its food safety standards as part of any deal to secure lower tariffs on its exports to the United States, UK says",https://www.reuters.com/world/uk/looser-food-standards-off-menu-any-us-uk-trade-deal-uk-says-2025-04-13/,0.98,943,0,943
18,worldnews,"Ukraine repels Russian offensive near Pokrovsk, killing 200 Russian soldiers, Zelensky says",https://kyivindependent.com/ukraine-repels-russian-offensive-near-pokrovsk-killing-200-russian-soldiers-zelensky-says/,0.98,935,0,935
19,worldnews,"Ukraine war briefing: China arming Russia and building weapons on its soil, says Zelenskyy",https://www.theguardian.com/world/2025/apr/18/ukraine-war-briefing-china-arming-russia-and-building-weapons-on-its-soil-says-zelenskyy,0.94,571,0,571
20,worldnews,"1,900-year-old Roman papyrus details elaborate tax evasion scheme, research suggests | CBC Radio",https://www.cbc.ca/radio/asithappens/papyrus-rome-tax-fraud-1.7510739?__vfz=medium%3Dsharebar,0.97,514,0,514
21,worldnews,Steve Witkoff: Zelensky says Trump envoy spreading 'Russian narratives',https://www.bbc.com/news/articles/c4g7wdw9jvno,0.98,456,0,456
22,worldnews,"Hamas in financial crisis, unable to pay terrorists after Israel cuts Gaza aid - report",https://www.jpost.com/israel-news/article-850425,0.73,450,0,450
23,worldnews,Hyundai Putting 'Tens of Thousands' of Advanced Robots to Work,https://www.newsweek.com/hyundai-motor-group-boston-dynamics-robots-manufacturing-2060286,0.96,388,0,388
24,worldnews,Palestinian Photojournalist &amp; Protagonist Of Cannes-Selected Doc Killed In Israeli Gaza Strike,https://deadline.com/2025/04/gaza-photojournalist-cannes-doc-killed-israeli-strike-1236370699/,0.71,234,0,234
25,worldnews,"/r/WorldNews Live Thread: Russian Invasion of Ukraine Day 1149, Part 1 (Thread #1296)",https://www.reddit.com/live/18hnzysb1elcs,0.93,114,0,114
