,subreddit,title,url,upvote_ratio,ups,downs,score
0,worldnews,Zelenskyy: We’re very close to point when Russia can be forced to end this war,https://www.pravda.com.ua/eng/news/2025/06/8/7516208/,0.95,37981,0,37981
1,worldnews,Elon Musk's father to attend pro-Kremlin event in Russia hosted by far-right ideologue,https://kyivindependent.com/elon-musks-father-attends-pro-kremlin-event-in-russia-hosted-by-far-right-ideologue/,0.94,32970,0,32970
2,worldnews,"Zelenskyy: US has sent 20,000 missiles bound for Ukraine to Middle East instead",https://www.pravda.com.ua/eng/news/2025/06/8/7516207/,0.95,26403,0,26403
3,worldnews,Israel orders military to stop Greta Thunberg’s boat reaching Gaza,https://www.telegraph.co.uk/world-news/2025/06/08/israel-orders-army-stop-greta-thunbergs-boat-reaching-gaza/,0.89,15722,0,15722
4,worldnews,Zelenskyy says US has not answered Ukraine’s request to buy air defense,https://euromaidanpress.com/2025/06/08/zelenskyy-says-us-has-not-answered-ukraines-request-to-buy-air-defense/,0.98,9155,0,9155
5,worldnews,Pope Leo criticises ‘exclusionary mindset’ of nationalist political movements,https://www.theguardian.com/world/2025/jun/08/pope-leo-criticises-exclusionary-mindset-of-nationalist-political-movements,0.97,7746,0,7746
6,worldnews,"Ukraine drones attack on Moscow forces airport closure, Russia says",https://www.yahoo.com/news/ukraine-drones-attack-moscow-forces-043628684.html,0.98,5971,0,5971
7,worldnews,"Ukraine Says It Has Stepped Up Its Drone Game, Again",https://www.nytimes.com/2025/06/08/world/europe/ukraine-russia-drones-weapons.html,0.98,4301,0,4301
8,worldnews,Finnish PM criticizes reported attempts by Trump to weaken Russia sanctions bill,https://kyivindependent.com/finnish-pm-criticizes-reported-attempts-by-trump-to-weaken-russia-sanctions-bill/,0.98,3517,0,3517
9,worldnews,Sweden telecom sabotage: Sweden probes massive sabotage after 30 telecom masts attacked in what officials call a coordinated strike,https://m.economictimes.com/news/international/uk/sweden-probes-massive-sabotage-after-30-telecom-masts-attacked-in-what-officials-call-a-coordinated-strike/articleshow/121695420.cms,0.98,2878,0,2878
10,worldnews,Putin Warned of Dual Threat to Russian Economy: 'Countdown to a Crisis',https://www.newsweek.com/putin-warned-dual-threat-russian-economy-countdown-crisis-2082449,0.98,2796,0,2796
11,worldnews,IDF destroys Hamas compound under Khan Yunis hospital,https://www.jpost.com/israel-news/defense-news/article-856992,0.73,1862,0,1862
12,worldnews,"Israeli Navy commandos intercept ‘Gaza flotilla’ vessel, redirect it to Ashdod port",https://www.ynetnews.com/article/rkx3juqxxe#autoplay,0.88,1432,0,1432
13,worldnews,Iran obtains ‘vast quantity’ of secret Israeli military plans,https://www.telegraph.co.uk/world-news/2025/06/08/iran-uncovers-secret-israeli-nuclear-defence-plans/,0.92,1312,0,1312
14,worldnews,Swiss government forbids use of donkeys to protect against wolf attacks,https://www.swissinfo.ch/eng/swiss-politics/no-donkeys-in-the-jura-to-protect-flocks-from-the-wolf/89481328,0.95,1198,0,1198
15,worldnews,"Ukraine denies Russian troop presence in Dnipropetrovsk Oblast amid offensive, describes situation as 'tense'",https://kyivindependent.com/ukrainian-military-says-tense-situation-as-russia-continues-push-toward-dnipropetrovsk-oblast/,0.97,850,0,850
16,worldnews,Israel says it has found body of Hamas military leader Mohammed Sinwar,https://www.bbc.com/news/articles/c62veqrq3yzo,0.87,667,0,667
17,worldnews,India launches pre-feasibility study to divert Chenab water currently flowing in Pakistan,https://www.newindianexpress.com/nation/2025/Jun/07/india-launches-pre-feasibility-study-to-divert-chenab-water,0.89,471,0,471
18,worldnews,"Report of explosion, injury at U.S. Kadena Air Base in Japan's Okinawa",https://www.reuters.com/world/report-explosion-injury-us-kadena-air-base-japans-okinawa-2025-06-09/,0.96,434,0,434
19,worldnews,Carney lays out Canada's G7 summit priorities while managing a complicated guest list,https://www.cbc.ca/news/politics/careny-g7-summit-priorities-1.7555663,0.94,403,0,403
20,worldnews,Canada wildfires smoke turns UK skies orange,https://www.bbc.com/weather/articles/c4g2k9lzjeko,0.95,379,0,379
21,worldnews,Renault may set up drone production in Ukraine – Bloomberg,https://www.pravda.com.ua/eng/news/2025/06/9/7516243/,0.97,273,0,273
22,worldnews,"Iran carried out implosion tests for nuclear weapons development, IAEA reports",https://www.jpost.com/middle-east/iran-news/article-857003,0.83,233,0,233
23,worldnews,"/r/WorldNews Live Thread: Russian Invasion of Ukraine Day 1201, Part 1 (Thread #1348)",https://www.reddit.com/live/18hnzysb1elcs,0.99,152,0,152
24,worldnews,"Hamas documents reportedly show deep ties, coordination between Qatar, terror group",https://www.timesofisrael.com/hamas-documents-reportedly-show-deep-ties-coordination-between-qatar-terror-group/,0.85,134,0,134
25,worldnews,"Russia hired African farmers to make shampoo, then sent them to war",https://www.telegraph.co.uk/world-news/2025/06/09/russia-sent-african-shampoo-makers-die-ukraine-front-line/,0.96,65,0,65
