,subreddit,title,url,upvote_ratio,ups,downs,score
0,worldnews,Kenya's tea pickers are destroying the machines replacing them,https://www.semafor.com/article/06/13/2023/kenya-tea-pickers-destroy-machines,0.91,27958,0,27958
1,worldnews,Russia lost so much money due to the Ukraine war that it now aims to raise $4 billion by slapping a windfall tax on its oligarchs,https://www.businessinsider.com/russia-ukraine-war-oligarchs-raise-billions-by-slapping-windfall-tax-2023-6,0.9,27845,0,27845
2,worldnews,"Russia says relations with Canada close to ""being severed"" as Ottawa seizes cargo plane",https://www.cbc.ca/news/politics/russia-canada-relations-seized-plane-1.6876794,0.93,20085,0,20085
3,worldnews,Chechen boss Kadyrov begs for info on brother-in-law missing in Ukraine,https://www.politico.eu/article/chechen-leader-missing-brother-ukrainian-strike/,0.94,7033,0,7033
4,worldnews,Turkey's Erdogan says no Nato membership for Sweden at Vilnius summit,https://www.middleeasteye.net/news/turkey-sweden-erdogan-nato-no-membership-vilnius-summit,0.93,6249,0,6249
5,worldnews,Abortion rights protests planned across Poland after death of pregnant woman,https://apnews.com/article/poland-abortion-death-sepsis-protests-8b6a8b9451cb7cdfb0325a5c0a67c1d3,0.95,4009,0,4009
6,worldnews,Russia's Medvedev says Moscow now has free hand to destroy enemies' undersea communications cables.,https://www.reuters.com/world/europe/russias-medvedev-says-moscow-now-has-free-hand-destroy-enemies-undersea-2023-06-14/,0.94,3830,0,3830
7,worldnews,Influx of Russians prompts Argentina to set restrictions on immigration,https://tvpworld.com/70555761/influx-of-russians-prompts-argentina-to-set-restrictions-on-immigration,0.97,3530,0,3530
8,worldnews,EU suggests breaking up Google’s ad business in preliminary antitrust ruling - The Verge,https://www.theverge.com/2023/6/14/23759094/european-commission-google-antitrust-advertising-market-antitrust,0.97,3364,0,3364
9,worldnews,Synthetic human embryos created in groundbreaking advance,https://www.theguardian.com/science/2023/jun/14/synthetic-human-embryos-created-in-groundbreaking-advance?CMP=Share_iOSApp_Other,0.95,3285,0,3285
10,worldnews,"Brazil develops the first vaccine against schistosomiasis, the disease of swollen bellies: The researchers are waiting for the WHO to approve the treatment, which is the first in the world to protect against a worm that infects 200 million people a year",https://english.elpais.com/society/2023-06-14/brazil-develops-the-first-vaccine-against-schistosomiasis-the-disease-of-swollen-bellies.html,0.97,3008,0,3008
11,worldnews,Russia to be blocked from building new embassy in Australia adjacent to Parliament House,https://www.abc.net.au/news/2023-06-15/government-to-terminate-lease-for-new-russian-embassy/102482098,0.97,1655,0,1655
12,worldnews,Ukrainians expected to finish Abrams tank training by end of summer,https://www.cbsnews.com/news/ukraine-abrams-tank-training-germany-lloyd-austin/,0.96,1564,0,1564
13,worldnews,Researchers from Osaka University developed worms coated in hydrogel sheaths that transport valuable cargo capable of killing cancer cells.,https://knovhov.com/worms-capable-of-killing-cancer-cells/,0.97,1312,0,1312
14,worldnews,Ukraine urges G7 to clamp down after western parts found in Russian missiles,https://www.theguardian.com/world/2023/jun/14/ukraine-urges-g7-to-clamp-down-after-western-parts-found-in-russian-missiles,0.95,1096,0,1096
15,worldnews,North Korea: Residents tell BBC of neighbours starving to death,https://www.bbc.co.uk/news/world-asia-65881803,0.95,1087,0,1087
16,worldnews,Clooney Foundation sues Venezuela over alleged human rights abuses,https://www.reuters.com/world/americas/clooney-foundation-sues-venezuela-over-alleged-human-rights-abuses-2023-06-14/,0.91,666,0,666
17,worldnews,Russia cuts off radiation sensor access at ZNPP to Ukraine,https://english.nv.ua/nation/russia-cuts-off-radiation-level-data-to-ukraine-news-50331945.html,0.96,647,0,647
18,worldnews,China’s Xi Jinping backs ‘just cause’ of Palestinian statehood,https://www.aljazeera.com/news/2023/6/14/chinas-xi-jinping-backs-just-cause-of-palestinian-statehood,0.87,643,0,643
19,worldnews,"/r/WorldNews Live Thread: Russian Invasion of Ukraine Day 477, Part 1 (Thread #618)",https://www.reddit.com/live/18hnzysb1elcs,0.97,454,0,454
20,worldnews,US to address killing of American citizen ‘directly’ with Israel after Isreali military announced that it will not pursue criminal charges in the case,https://www.aljazeera.com/news/2023/6/14/us-to-address-killing-of-american-citizen-directly-with-israel,0.9,402,0,402
21,worldnews,New details emerge after 152 koalas killed on private property: 'Unacceptable',https://au.news.yahoo.com/new-details-emerge-after-152-koalas-killed-on-private-property-unacceptable-034938806.html,0.94,290,0,290
22,worldnews,Australian Federal government to terminate lease for new Russian embassy,https://www.abc.net.au/news/2023-06-15/federal-government-to-terminate-lease-for-new-russian-embassy/102482176,0.91,254,0,254
23,worldnews,New Zealand officially in recession as GDP falls for second quarter,https://www.rnz.co.nz/news/business/492013/new-zealand-officially-in-recession-as-gdp-falls-for-second-quarter,0.92,218,0,218
24,worldnews,‘Threat to our national security’: Government to terminate lease for new Russian embassy,https://www.smh.com.au/politics/federal/threat-to-our-national-security-government-terminates-lease-for-new-russian-embassy-20230615-p5dgp0.html,0.92,147,0,147
25,worldnews,European Parliament recognized the demolition of the Kakhovska dam as a Russian war crime,https://news.yahoo.com/european-parliament-recognized-demolition-kakhovska-203100356.html,0.9,48,0,48
