,subreddit,title,url,upvote_ratio,ups,downs,score
0,worldnews,Senior Hamas commander killed in Al Shifa raid ,https://www.ynetnews.com/article/hyt6rtr0p,0.88,15177,0,15177
1,worldnews,"In a global first, Gambia could reverse its ban on female genital cutting",https://apnews.com/article/gambia-female-genital-cutting-7ab84af16d6b986025dd344d615bfe19,0.94,12881,0,12881
2,worldnews,Not a single Ukrainian soldier saw Red Cross representatives while in Russian captivity,https://www.pravda.com.ua/eng/news/2024/03/18/7447024/,0.97,8078,0,8078
3,worldnews,Ukraine says Putin's buffer zone comment is clear sign of looming escalation,https://www.reuters.com/world/europe/ukraine-says-putins-buffer-zone-comment-is-clear-sign-looming-escalation-2024-03-18/,0.96,7069,0,7069
4,worldnews,"Putin “afraid” of war with NATO, Estonian PM says",https://euromaidanpress.com/2024/03/17/putin-afraid-of-war-with-nato-estonian-pm-says/,0.95,5659,0,5659
5,worldnews,Russian District Scrambles to Correct Putin's Surprise Election Defeat,https://www.newsweek.com/russia-putin-2024-election-results-votes-siberia-1880193,0.98,5543,0,5543
6,worldnews,Young Samsung workers flock to labor union in protest of 'disappointing' salary,https://koreajoongangdaily.joins.com/news/2024-03-14/business/industry/Young-Samsung-workers-flock-to-labor-union-in-protest-of-disappointing-salary/2001570,0.98,3378,0,3378
7,worldnews,Taliban fighters attack Pakistani army in several points after Pakistani air strike inside Afghanistan,https://tolonews.com/afghanistan-187881,0.97,2862,0,2862
8,worldnews,Car industry insists 2000% increase in sales to Azerbaijan has nothing to do with Russia,https://news.sky.com/story/car-industry-insists-2000-increase-in-sales-to-azerbaijan-has-nothing-to-with-russia-13097685,0.97,2081,0,2081
9,worldnews,"Cubans stage rare protests demanding electricity, food",https://www.lemonde.fr/en/international/article/2024/03/18/cubans-stage-rare-protests-demanding-electricity-food_6630722_4.html,0.96,2009,0,2009
10,worldnews,Canadian commander of volunteer fighter group dies in Ukraine,https://www.ctvnews.ca/canada/canadian-commander-of-volunteer-fighter-group-dies-in-ukraine-1.6812388,0.97,2006,0,2006
11,worldnews,EU gives final approval to $5.5 billion for military aid to Ukraine,https://kyivindependent.com/eu-gives-final-approval-to-5-5-billion-for-military-aid-to-ukraine-in-2024/,0.97,1815,0,1815
12,worldnews,Russia-Ukraine war: West slams Putin’s sham election as he threatens NATO with ‘World War 3’,https://www.yahoo.com/news/russia-ukraine-war-live-putin-092003533.html,0.95,1684,0,1684
13,worldnews,'Only God can change this place': Haitians see no end to spiralling violence,https://www.bbc.com/news/world-latin-america-68602114,0.97,1257,0,1257
14,worldnews,"'You need a Rafah strategy that works,' Biden tells Netanyahu in stern call",https://m.jpost.com/breaking-news/article-792576,0.87,943,0,943
15,worldnews,Sputnik editor admits his mission was to destabilise Lithuania,https://www.lrt.lt/en/news-in-english/19/2226517/sputnik-editor-admits-his-mission-was-to-destabilise-lithuania,0.95,902,0,902
16,worldnews,Erdogan: All Cyprus could have been ours,https://www.ekathimerini.com/news/1234350/erdogan-all-cyprus-could-have-been-ours/,0.9,770,0,770
17,worldnews,/r/WorldNews Live Thread for Israel-Hamas War (Thread 46),https://www.reddit.com/live/1bsso361afr0r,0.87,632,0,632
18,worldnews,Record Heat Index Of 62.3C Scorches Rio De Janeiro,https://www.barrons.com/news/record-heat-index-of-62-3c-scorches-rio-de-janeiro-b0d7be32,0.93,598,0,598
19,worldnews,"No evidence of Havana syndrome brain injury, US studies find",https://www.reuters.com/world/us/us-study-finds-no-evidence-havana-syndrome-brain-injury-2024-03-18/,0.92,565,0,565
20,worldnews,"As Putin claims victory in sham Russian election, Yulia Navalnaya steps in as his chief opponent",https://www.theglobeandmail.com/world/article-as-putin-claims-victory-in-sham-russian-election-yulia-navalnaya-steps/,0.95,458,0,458
21,worldnews,Capture of Gorkovsky village in Belgorod Oblast by pro-Ukrainian Russian volunteers - video,https://au.news.yahoo.com/capture-gorkovsky-village-belgorod-oblast-124200793.html,0.93,368,0,368
22,worldnews,Putin Pals Celebrate Re-Election With Photos of Mass Hanging,https://www.thedailybeast.com/putins-friends-celebrate-re-election-with-photos-of-mass-hanging,0.9,358,0,358
23,worldnews,Bank of Ethiopia glitch lets customers withdraw millions,https://www.bbc.com/news/world-68599027,0.96,289,0,289
24,worldnews,"/r/WorldNews Live Thread: Russian Invasion of Ukraine Day 755, Part 1 (Thread #901)",https://www.reddit.com/live/18hnzysb1elcs,0.97,220,0,220
25,worldnews,More Indian workers head to Israel as relations between the two countries strengthen,https://www.jpost.com/israel-news/article-792499,0.85,156,0,156
26,worldnews,Record heat index of 62.3C scorches Rio de Janeiro,https://globalnation.inquirer.net/228619/record-heat-index-of-62-3c-scorches-rio-de-janeiro,0.89,136,0,136
