,subreddit,title,url,upvote_ratio,ups,downs,score
0,worldnews,"Russians hit multi-storey residential building in Dnipro city, destroy building section, people are under rubble",https://www.pravda.com.ua/eng/news/2023/01/14/7384858/,0.92,43945,0,43945
1,worldnews,"China's cumulative COVID cases hit 900m, over 60% of population: estimate from Peking University",https://asia.nikkei.com/Spotlight/Coronavirus/China-s-cumulative-COVID-cases-hit-900m-over-60-of-population-estimate,0.94,27575,0,27575
2,worldnews,"UK to transfer over 12 Challenger 2 tanks to Ukraine, first 4 immediately",https://www.pravda.com.ua/eng/news/2023/01/14/7384830/,0.96,8414,0,8414
3,worldnews,"More than 80,000 people turn out for Tel Aviv protest against Netanyahu government",https://edition.cnn.com/2023/01/14/world/tel-aviv-protest-netanyahu/index.html,0.97,5733,0,5733
4,worldnews,Former Bolsonaro minister arrested over January 8 assault: Brazil media,https://kalkinemedia.com/br/news/politics/former-bolsonaro-minister-arrested-over-january-8-assault-brazil-media,0.97,4183,0,4183
5,worldnews,Russian ex-President Medvedev says Japanese PM should disembowel himself,https://www.jpost.com/international/article-728518,0.92,2963,0,2963
6,worldnews,Tens of thousands of Israelis gathered in central Tel Aviv on Saturday night to protest plans by Prime Minister Benjamin Netanyahu's new government to overhaul the legal system and weaken the Supreme Court — a step that critics say will destroy the country's democratic system of checks and balances,https://www.france24.com/en/middle-east/20230114-thousands-in-israel-protest-legal-changes-planned-by-netanyahu-government,0.96,2878,0,2878
7,worldnews,"Turkey pushes back vote on Sweden and Finland’s Nato accession | Ratification will have to wait at least until after elections in May or June, says senior official",https://www.theguardian.com/world/2023/jan/14/turkey-pushes-back-vote-on-sweden-and-finlands-nato-accession,0.95,2833,0,2833
8,worldnews,Jair Bolsonaro to be investigated as part of inquiry into far-right Brazil riot,https://www.theguardian.com/world/2023/jan/14/jair-bolsonaro-to-be-investigated-as-part-of-inquiry-into-far-right-brazil-riot,0.96,2426,0,2426
9,worldnews,"Ukraine forces retain control of Soledar despite Russian claims, governor says",https://www.reuters.com/world/europe/ukraine-forces-retain-control-soledar-despite-russian-claims-governor-says-2023-01-14/,0.96,1988,0,1988
10,worldnews,Moldovan Prime Minister: there is no justification for Russia’s missile attacks,https://www.pravda.com.ua/eng/news/2023/01/14/7384888/,0.96,1944,0,1944
11,worldnews,Zelenskyy wants to personally visit UN on anniversary of invasion – Foreign Ministry,https://www.pravda.com.ua/eng/news/2023/01/14/7384847/,0.95,1553,0,1553
12,worldnews,"Russia reiterates its readiness to negotiate at UN, but with conditions",https://www.pravda.com.ua/eng/news/2023/01/14/7384833/,0.87,1008,0,1008
13,worldnews,South Korea's plan to compensate citizens once enslaved by Japan sparks fierce criticism,https://www.abc.net.au/news/2023-01-12/south-korea-japan-forced-labour-compensation/101850780,0.95,692,0,692
14,worldnews,"Missile attack on Ukraine: two thermal power plants damaged, one stops producing electricity",https://www.pravda.com.ua/eng/news/2023/01/14/7384875/,0.95,688,0,688
15,worldnews,Hungary not to allow NATO weapons through its territory to protect Hungarians in Zakarpattia – PM’s Chancellery,https://en.interfax.com.ua/news/general/884438.html,0.91,609,0,609
16,worldnews,Scholz: Germany 'getting through winter' without crisis,https://www.dw.com/en/scholz-germany-getting-through-winter-without-crisis/a-64395764,0.94,432,0,432
17,worldnews,Second German LNG terminal goes into operation,https://www.deutschland.de/en/news/second-german-lng-terminal-goes-into-operation,0.95,421,0,421
18,worldnews,Russians demolished Dnipro highrise with Kh-22 missile that Ukraine can't shoot down,https://euromaidanpress.com/2023/01/15/russians-demolished-dnipro-highrise-with-kh-22-missile-that-ukraine-cant-shoot-down/,0.93,371,0,371
19,worldnews,Switzerland’s largest ‘open air’ solar farm planned at Bern Airport,https://www.swissinfo.ch/eng/business/switzerland-s-largest--open-air--solar-farm-planned-at-bern-airport/48202614,0.95,362,0,362
20,worldnews,Russia fires new waves of missiles at Ukraine and hits energy infrastructure,https://www.bbc.com/news/world-europe-64278733,0.95,295,0,295
21,worldnews,'A callous and cowardly act': UK Prime Minister condemns Iran's execution of British-Iranian man,https://www.abc.net.au/news/2023-01-15/iran-executes-british-iranian-accused-of-spying/101856400,0.95,285,0,285
22,worldnews,"/r/WorldNews Live Thread: Russian Invasion of Ukraine Day 326, Part 1 (Thread #467)",https://www.reddit.com/live/18hnzysb1elcs,0.95,216,0,216
23,worldnews,Protected areas in Britain fail to stop loss of insects and spiders: Invertebrate monitoring data from 1990 to 2018 show that protected areas in Britain are losing species at the same rate as unprotected areas,https://www.newscientist.com/article/2354724-protected-areas-in-britain-fail-to-stop-loss-of-insects-and-spiders/,0.96,201,0,201
24,worldnews,"Brazil’s military blocked arrests of Bolsonaro rioters, officials say",https://www.washingtonpost.com/world/2023/01/14/brazil-riot-investigation-military-collusion/,0.94,176,0,176
25,worldnews,Air Force commander: Ukraine has no weapons against missile Russians fired at house in Dnipro,https://www.ukrinform.net/rubric-ato/3652800-air-force-commander-ukraine-has-no-weapons-against-missile-russians-fired-at-house-in-dnipro.html,0.97,82,0,82
