,subreddit,title,url,upvote_ratio,ups,downs,score
0,worldnews,Morocco will be first African country to provide military aid to Ukraine - media,https://www.ukrinform.net/rubric-ato/3631510-morocco-will-be-first-african-country-to-provide-military-aid-to-ukraine-media.html,0.9,58013,0,58013
1,worldnews,Freed Russian arms dealer Viktor Bout says he 'wholeheartedly' supports Ukraine war and would volunteer if he could | CNN,https://edition.cnn.com/2022/12/10/europe/viktor-bout-supports-ukraine-war-intl/index.html,0.88,29591,0,29591
2,worldnews,"U.S. accuses Russia of providing weapons, fighter jets to Iran",https://www.cbsnews.com/news/us-accuses-russia-providing-weapons-fighter-jets-to-iran/,0.96,5556,0,5556
3,worldnews,"Ukrainian police records 47,000 war crimes committed by Russian occupiers since 24 February",https://www.pravda.com.ua/eng/news/2022/12/10/7380195/,0.96,5303,0,5303
4,worldnews,Report: Israel warns will bomb Beirut airport if it's used for Iran weapon shipments,https://www.timesofisrael.com/report-israel-warns-will-bomb-beirut-airport-if-its-used-for-iran-weapon-shipments/,0.96,3721,0,3721
5,worldnews,NASA chief says U.S. will beat China in race to the moon,https://asia.nikkei.com/Editor-s-Picks/Interview/NASA-chief-says-U.S.-will-beat-China-in-race-to-the-moon,0.92,3418,0,3418
6,worldnews,EU takes first step to circumvent Hungary’s veto of 18 billion aid to Ukraine in 2023,https://www.msn.com/en-gb/money/other/eu-takes-first-step-to-circumvent-hungarys-veto-of-18-billion-aid-to-ukraine-in-2023/ar-AA1580Vr,0.97,3343,0,3343
7,worldnews,Russian Nobel Peace laureate slams Putin’s ‘insane and criminal war’ on Ukraine,https://www.cnn.com/2022/12/10/europe/russian-nobel-peace-laureate-slams-putin-war-intl/index.html,0.96,2810,0,2810
8,worldnews,"Rage Over Iran Execution Escalating, Further Protests Planned",https://www.iranintl.com/en/202212106859,0.98,2716,0,2716
9,worldnews,Russia wants Finland to punish flag burners,https://yle.fi/a/74-20008147,0.92,2364,0,2364
10,worldnews,"Serbia to ask NATO to deploy Serb military, police in Kosovo - Vucic",https://www.reuters.com/world/europe/serbia-ask-nato-deploy-serb-military-police-kosovo-vucic-2022-12-10/,0.95,1656,0,1656
11,worldnews,Backfired: Putin’s Prison Recruits Spiral Out of Russia’s Control,https://news.yahoo.com/backfired-putin-prison-recruits-spiral-181323730.html,0.96,1382,0,1382
12,worldnews,"Serbia asks to send forces into Kosovo, warns ‘fight is yet to come",https://www.jpost.com/international/article-724548,0.94,1352,0,1352
13,worldnews,EU Council decides on 18 billion package for Ukraine despite Hungary’s veto,https://www.pravda.com.ua/eng/news/2022/12/10/7380213/,0.96,1138,0,1138
14,worldnews,German trains to offer coffee in porcelain cups to cut waste,https://www.theguardian.com/world/2022/dec/06/german-trains-to-offer-coffee-in-porcelain-or-glass-cups-to-cut-waste-deutsche-bahn,0.96,1037,0,1037
15,worldnews,"In acceptance speech, Russian Nobel Peace Prize co-laureate condemns Ukraine war",https://www.npr.org/2022/12/10/1142087351/russia-nobel-peace-prize-memorial-war-ukraine,0.96,974,0,974
16,worldnews,Boris Johnson: Give Ukraine long-range weapons to end war,https://www.msn.com/en-gb/news/world/boris-johnson-give-ukraine-long-range-weapons-to-end-war/ar-AA157eQs,0.92,895,0,895
17,worldnews,28 Iranians Sentenced To Death Over Nationwide Protests,https://iranwire.com/en/politics/111118-28-iranians-sentenced-to-death-over-nationwide-protests/,0.96,870,0,870
18,worldnews,Report: Israel warns will bomb Beirut airport if it’s used for Iran weapon shipments,https://www.timesofisrael.com/report-israel-warns-will-bomb-beirut-airport-if-its-used-for-iran-weapon-shipments/,0.95,691,0,691
19,worldnews,NATO chief fears Ukraine war could become a wider conflict,https://apnews.com/article/russia-ukraine-jens-stoltenberg-government-f01121d32693881920b1fe5e8c75b22d,0.93,647,0,647
20,worldnews,Russian Officer Who Fled To Kazakhstan To Avoid Mobilization To Ukraine War Faces Deportation,https://www.rferl.org/a/russian-officer-kazakhstan-deportation-ukraine-mobilization/32169381.html,0.96,645,0,645
21,worldnews,"Russian Official Demands Germany, France Pay Ukraine Region Putin Annexed",https://www.newsweek.com/russian-official-demands-germany-france-pay-ukraine-region-putin-annexed-1766177,0.89,490,0,490
22,worldnews,"In liberated Kherson, Jewish leaders are being accused of collaboration with Russia",https://www.timesofisrael.com/in-liberated-kherson-jewish-leaders-are-being-accused-of-collaboration-with-russia/,0.8,251,0,251
23,worldnews,"/r/WorldNews Live Thread: Russian Invasion of Ukraine Day 291, Part 1 (Thread #432)",https://www.reddit.com/live/18hnzysb1elcs,0.95,231,0,231
24,worldnews,"Ukraine attacks occupied Melitopol, Russian side says two killed",https://www.reuters.com/world/europe/ukraine-attacks-occupied-melitopol-russian-side-says-two-killed-2022-12-11/,0.96,178,0,178
25,worldnews,Possible Ukrainian Himars strike hits Russian-occupied Melitopol,https://www.theguardian.com/world/2022/dec/11/ukrainian-himars-missiles-hit-russian-occupied-melitopol,0.96,125,0,125
