,subreddit,title,url,upvote_ratio,ups,downs,score
0,worldnews,"Ireland wants expansion of the definition of genocide under the Geneva Convention, says Taoiseach",https://www.independent.ie/irish-news/ireland-wants-expansion-of-the-definition-of-genocide-under-the-geneva-convention-says-taoiseach/a1112529887.html,0.88,22096,0,22096
1,worldnews,US says it will start revoking visas for Chinese students,https://www.reuters.com/world/us/rubio-says-us-will-start-revoking-visas-chinese-students-2025-05-28/,0.96,14691,0,14691
2,worldnews,"North Korea supplied Russia with 9 million shells and 100 ballistic missiles – international report, photos",https://www.pravda.com.ua/eng/news/2025/05/29/7514667,0.97,11861,0,11861
3,worldnews,Russia loses US$450bn in energy revenue due to sanctions,https://www.pravda.com.ua/eng/news/2025/05/29/7514648/,0.98,9264,0,9264
4,worldnews,Four Pakistanis arrested as Nigerian army accuses foreign mercenaries of training Boko Haram,https://www.thecable.ng/four-pakistanis-arrested-as-army-links-foreign-mercenaries-to-training-of-boko-haram-iswap-fighters/,0.95,7397,0,7397
5,worldnews,Trump's allies demand tougher sanctions on Russia,https://www.pravda.com.ua/eng/news/2025/05/29/7514655/,0.98,4908,0,4908
6,worldnews,"France to ban smoking on beaches, parks and near schools",https://www.bbc.com/news/articles/c7873veygv2o,0.97,4551,0,4551
7,worldnews,Prime Minister Carney ‘welcomes’ U.S. court ruling striking down tariffs,https://www.ctvnews.ca/business/article/trumps-sweeping-tariff-agenda-in-turmoil-following-us-federal-court-decision/,0.97,4349,0,4349
8,worldnews,Canadian province of Manitoba declares a state of emergency over wildfires as thousands flee,https://www.cnn.com/2025/05/29/americas/canada-manitoba-fires-emergency-latam-intl,0.98,3202,0,3202
9,worldnews,Senior Canadian diplomat compares Trump's Golden Dome missile program to a 'protection racket',https://apnews.com/article/canada-diplomat-trump-golden-dome-missile-program-a1f4b1412531413dbae669ddbab49b85,0.98,2396,0,2396
10,worldnews,Brazil sues Chinese electric carmaker BYD over ‘slave-like’ conditions of workers,https://www.independent.co.uk/asia/china/byd-china-ev-sued-brazil-slavery-labour-b2759157.html,0.95,1701,0,1701
11,worldnews,"Jordanian envoy, who has said Israel at war with 'people of Gaza,' elected to UN high court",https://www.jns.org/jordanian-envoy-who-has-said-israel-at-war-with-people-of-gaza-elected-to-un-high-court/,0.86,1371,0,1371
12,worldnews,‘Stab in the Back’: Russian Spy Agency Accuses Serbia of Supplying Arms to Ukraine,https://www.themoscowtimes.com/2025/05/29/stab-in-the-back-russian-spy-agency-accuses-serbia-of-supplying-arms-to-ukraine-a89272,0.97,1059,0,1059
13,worldnews,Zelenskyy: Russians have not shared their ''memorandum'' with partners – another deception,https://www.pravda.com.ua/eng/news/2025/05/29/7514697/,0.96,949,0,949
14,worldnews,Greece and Orthodoxy Shocked by Egypt’s Decision to Seize the Ancient Sinai Monastery,https://greekreporter.com/2025/05/29/egypt-shocking-decision-ancient-st-catherine-monastery-faces-closure-seizure/,0.95,859,0,859
15,worldnews,Hamas demands changes to Witkoff's new Gaza ceasefire proposal,https://m.jpost.com/breaking-news/article-855946,0.84,793,0,793
16,worldnews,"In riposte to Vance, Germany's Merz says Europe stands for freedom",https://www.reuters.com/business/media-telecom/riposte-vance-germanys-merz-says-europe-stands-freedom-2025-05-29/,0.94,743,0,743
17,worldnews,"3,000-year-old Mayan city discovered in northern Guatemala",https://www.france24.com/en/americas/20250529-3-000-year-old-mayan-city-discovered-in-northern-guatemala,0.97,594,0,594
18,worldnews,Hamas official says it rejects new US Gaza ceasefire plan backed by Israel,https://www.bbc.com/news/articles/c0qg5yzqle9o,0.87,557,0,557
19,worldnews,"Get ready for several years of killer heat, top weather forecasters warn",https://apnews.com/article/climate-change-deadly-record-heat-wildfires-hurricanes-535b4df63b476d0f36ec553a1a78669d,0.93,537,0,537
20,worldnews,"EU must assert independence with arms spending and Ukraine accession, says von der Leyen",https://www.politico.eu/article/building-independent-europe-defense-spending-ukraine-accession-ursula-von-der-leyen/,0.95,374,0,374
21,worldnews,"Pakistan PM Shehbaz Sharif Admits Indian BrahMos Missile Strikes Caught Military Off Guard, Foiled Retaliation Plans",https://m.economictimes.com/news/defence/shehbaz-sharif-admits-pakistan-caught-unawares-by-brahmos/articleshow/121497528.cms,0.85,276,0,276
22,worldnews,"Benjamin Netanyahu accepts US' latest Gaza ceasefire proposal, Israeli media say",https://www.euronews.com/2025/05/29/benjamin-netanyahu-accepts-us-latest-gaza-ceasefire-proposal-israeli-media-say,0.85,268,0,268
23,worldnews,Iran truckers defy crackdown as nationwide strike expands to 140 cities,https://www.iranintl.com/en/202505294501,0.95,158,0,158
24,worldnews,Putin meets widow of former Japanese Prime Minister Abe in Moscow,https://www3.nhk.or.jp/nhkworld/en/news/20250530_05/,0.85,140,0,140
25,worldnews,"/r/WorldNews Live Thread: Russian Invasion of Ukraine Day 1191, Part 1 (Thread #1338)",https://www.reddit.com/live/18hnzysb1elcs,0.92,103,0,103
