,subreddit,title,url,upvote_ratio,ups,downs,score
0,worldnews,"Salwan Momika, Man Who Burnt Quran In 2023 Sparking international Protests Shot Dead In Sweden",https://www.ndtv.com/world-news/salwan-momika-man-who-burnt-quran-in-2023-sparking-huge-protests-shot-dead-in-sweden-7593887/amp/1,0.92,28354,0,28354
1,worldnews,Panama's president says there will be no negotiation about ownership of canal,https://apnews.com/article/panama-canal-us-rubio-mulino-a3b1ccdf2fe1b0e957b44f1cf7a9fcfe,0.95,28071,0,28071
2,worldnews,"Trump warns Canada, Mexico tariffs are coming on Saturday",https://thehill.com/business/5117233-trump-mexico-canada-tariffs-threat/,0.93,22631,0,22631
3,worldnews,Sweden donates $1.2 billion aid package to Ukraine,https://www.reuters.com/world/europe/sweden-donates-12-billion-aid-package-ukraine-2025-01-30/,0.98,12327,0,12327
4,worldnews,Ukrainian Drones Flew 500 Miles &amp; Damaged 5% Of Russia’s Oil Refining,https://www.forbes.com/sites/davidaxe/2025/01/29/ukrainian-drones-flew-500-miles-and-in-a-single-strike-damaged-5-of-russias-oil-refining-capacity/,0.98,10763,0,10763
5,worldnews,Far-right Romanian presidential candidate wants Ukraine to be divided and part of it taken over by Romania,https://www.pravda.com.ua/eng/news/2025/01/30/7495925/,0.95,6734,0,6734
6,worldnews,Taiwan to hold emergency discussions after Trump pledges tariffs on chips - Focus Taiwan,https://focustaiwan.tw/business/202501290004,0.97,5316,0,5316
7,worldnews,A New Ukrainian Drone May Have Blown Up A Major Russian Oil Pipeline,https://www.forbes.com/sites/davidaxe/2025/01/30/a-new-kind-of-ukrainian-drone-may-have-blown-up-a-major-russian-oil-pipeline/,0.98,4460,0,4460
8,worldnews,"Russia's Soviet-era military stockpile running low, faces equipment shortages, media reports",https://kyivindependent.com/russia-facing-equipment-shortages-media-reported/,0.98,4218,0,4218
9,worldnews,"'Stupid, illogical' — Zelensky blasts Ukraine for relinquishing nuclear arms without strong security guarantees",https://kyivindependent.com/stupid-illogical-zelensky-blasts-ukraine-relinquishing-nuclear-arms-without-strong-security-guarantees/,0.97,3915,0,3915
10,worldnews,EU proposes ban on video game sales to Russia in new sanctions,https://www.reuters.com/world/europe/eu-proposes-ban-video-game-sales-russia-new-sanctions-2025-01-29/,0.96,3771,0,3771
11,worldnews,Chinese banks again block payments to Russia following tougher US sanctions,https://www.pravda.com.ua/eng/news/2025/01/30/7496044/,0.98,3583,0,3583
12,worldnews,IDF reveals it killed Hamas terrorist seen dragging Naama Levy to captivity on Oct. 7,https://www.timesofisrael.com/idf-reveals-it-killed-hamas-terrorist-seen-dragging-naama-levy-to-captivity-on-oct-7/,0.92,3389,0,3389
13,worldnews,Germany's Budget Committee approves additional €3 billion in military assistance for Ukraine – Reuters,https://www.pravda.com.ua/eng/news/2025/01/30/7495912/,0.98,3286,0,3286
14,worldnews,Trudeau vows 'strong response' from Canada to Trump tariffs,https://www.aa.com.tr/en/americas/trudeau-vows-strong-response-from-canada-to-trump-tariffs/3466307,0.95,2998,0,2998
15,worldnews,Nurse dies as Uganda confirms new Ebola outbreak,https://www.bbc.co.uk/news/articles/cz6p8j17ynlo,0.97,1975,0,1975
16,worldnews,'I did not expect to be a slave': Amnesty International report exposes abuse of migrant workers,https://www.cbc.ca/news/investigates/amnesty-international-temporary-foriegn-worker-program-1.7444881,0.95,1207,0,1207
17,worldnews,Israel delays prisoner release after chaotic hostage handover,https://www.reuters.com/world/middle-east/palestinian-militants-arrive-gaza-site-before-hostage-handover-militant-sources-2025-01-30/,0.91,1120,0,1120
18,worldnews,German climate change researcher fired for refusing air travel wins compensation from court,https://news.mongabay.com/short-article/2025/01/climate-researcher-fired-for-refusing-air-travel-wins-compensation/,0.96,1029,0,1029
19,worldnews,"Trump insists Egypt, Jordan will take Gazans",https://www.ynetnews.com/article/r100plft00ke,0.91,795,0,795
20,worldnews,'No control': Sweden grapples with bomb violence wave,https://www.euractiv.com/section/politics/news/no-control-sweden-grapples-with-bomb-violence-wave/,0.92,739,0,739
21,worldnews,Hamas' armed wing announces killing of its terrorist leader Mohammed Deif,https://www.jpost.com/breaking-news/article-840011,0.91,563,0,563
22,worldnews,North Korean Troops in Russia Taken off Front Lines,https://www.nytimes.com/2025/01/30/world/europe/north-korea-troops-ukraine-russia.html,0.95,427,0,427
23,worldnews,"Microplastics in placentas linked to premature births, study suggests",https://www.theguardian.com/environment/2025/jan/30/microplastics-placentas-link-premature-births-study,0.97,356,0,356
24,worldnews,"/r/WorldNews Live Thread: Russian Invasion of Ukraine Day 1072, Part 1 (Thread #1219)",https://www.reddit.com/live/18hnzysb1elcs,0.96,125,0,125
25,worldnews,New Zealand's Mount Taranaki gets same legal rights as a person,https://www.bbc.com/news/articles/czep8gg5lx4o,0.89,111,0,111
