,subreddit,title,url,upvote_ratio,ups,downs,score
0,worldnews,Zelenskyy: Russia took satellite images of US air base in Saudi Arabia three times before Iranian strike,https://www.pravda.com.ua/eng/news/2026/03/29/8027701/,0.95,24470,0,24470
1,worldnews,"Iran ready to face US ground invasion, top lawmaker says | Caliber.Az",https://caliber.az/en/post/iran-ready-to-face-us-ground-invasion-top-lawmaker-says,0.95,13547,0,13547
2,worldnews,Zelenskyy says 10 drone factories have been built worldwide behind Ukraine’s back | Ukrainska Pravda,https://www.pravda.com.ua/eng/news/2026/03/28/8027604/,0.96,13445,0,13445
3,worldnews,"Trump reportedly warns to 'take the oil in Iran' as Tehran targets water, power plants in Kuwait",https://www.cnbc.com/2026/03/30/trump-iran-oil-middle-east-war-israel-us-kuwait-attack-.html,0.97,7339,0,7339
4,worldnews,"US-Israeli plan for Kurdish invasion of Iran reportedly collapsed amid leaks, distrust",https://www.timesofisrael.com/us-israeli-plan-for-kurdish-invasion-of-iran-reportedly-collapsed-amid-leaks-distrust/,0.98,6447,0,6447
5,worldnews,"European allies say Russia is helping Iran more than the U.S. has acknowledged, sources say",https://www.cbsnews.com/news/russia-iran-war-european-allies-intelligence-help/,0.98,5669,0,5669
6,worldnews,"U.S. to Allow Russian Oil Tanker to Reach Cuba, Breaking Blockade",https://www.nytimes.com/2026/03/29/world/americas/cuba-russian-oil-tanlker.html,0.97,5493,0,5493
7,worldnews,Booby-Trapped Insoles Allegedly Reached Russian Troops,https://www.forbes.com/sites/davidkirichenko/2026/03/28/booby-trapped-insoles-allegedly-reached-russian-troops/,0.98,4972,0,4972
8,worldnews,Iranian attacks across Gulf continue as major industrial sites hit,https://www.bbc.com/news/articles/cp86yrq5jy7o,0.97,2933,0,2933
9,worldnews,North Korea conducts test for missile it claims can target US mainland,https://thehill.com/policy/international/5806816-north-korea-missile-test/,0.96,2774,0,2774
10,worldnews,"Iran warns U.S. troops will be ""set on fire"" if Americans launch ground operation - CBS News",https://www.cbsnews.com/news/iran-warns-us-against-ground-operation/,0.95,2684,0,2684
11,worldnews,Türkiye signals military action if Kurdish groups join attacks on Iran,https://caliber.az/en/post/turkiye-signals-military-action-if-kurdish-groups-join-attacks-on-iran,0.95,2529,0,2529
12,worldnews,"In first, Japan to send ‘combat’ troops to major military drills in Philippines",https://www.japantimes.co.jp/news/2026/03/29/japan/politics/japan-sdf-philippines-balikatan/,0.98,2382,0,2382
13,worldnews,Iran warns US over ground attack as regional powers meet in Pakistan,https://www.reuters.com/world/asia-pacific/yemens-houthis-enter-iran-war-with-attacks-israel-while-us-marines-arrive-region-2026-03-28/,0.96,1697,0,1697
14,worldnews,Starmer warns against 'false comfort' as he says Iran war will 'not have a quick or easy end',https://www.lbc.co.uk/article/keir-starmer-iran-war-isreal-trump-5HjdWm7_2/,0.96,1598,0,1598
15,worldnews,Report: severe divisions emerge in Iran leadership as war strains economy,https://www.ynetnews.com/article/bjqqu4ui11e,0.83,1466,0,1466
16,worldnews,Oil tops $116 a barrel as Iran accuses US of preparing invasion,https://www.aljazeera.com/economy/2026/3/30/oil-rises-above-116-a-barrel-as-iran-accuses-us-of-preparing-invasion,0.98,1305,0,1305
17,worldnews,Donald Trump claims Iran 'agreeing' with US on 15-point piece plan | The Jerusalem Post,https://www.jpost.com/international/article-891583,0.84,1121,0,1121
18,worldnews,"Israeli military suspends battalion involved in assaulting, detaining CNN crew in West Bank",https://www.cnn.com/2026/03/29/middleeast/idf-suspends-battalion-assaulting-cnn-crew-in-west-bank-intl,0.89,885,0,885
19,worldnews,"Indian worker killed in Iranian attack on Kuwait power, desalination plant",https://www.reuters.com/world/india/indian-worker-killed-iranian-attack-kuwait-power-desalination-plant-2026-03-29/,0.92,722,0,722
20,worldnews,Iranian ambassador refuses to leave Lebanon after being declared persona non grata,https://www.jpost.com/middle-east/article-891552,0.92,620,0,620
21,worldnews,"Tanker carrying Russian oil enters Cuba's exclusive economic zone, ship data says",https://www.reuters.com/business/energy/tanker-carrying-russian-oil-enters-cubas-exclusive-economic-zone-ship-data-says-2026-03-29/,0.98,564,0,564
22,worldnews,"Trump says he has ""no problem"" with Russian tanker bringing oil to Cuba despite blockade",https://www.cbsnews.com/amp/news/cuba-blockade-russian-tanker-trump-no-problem/,0.97,515,0,515
23,worldnews,/r/WorldNews Discussion Thread: US and Israel launch attack on Iran; Iran retaliates (Thread #11),https://www.reddit.com/r/worldnews/comments/1s402bg/rworldnews_discussion_thread_us_and_israel_launch/,0.93,203,0,203
24,worldnews,"/r/WorldNews Live Thread: Russian Invasion of Ukraine Day 1495, Part 1 (Thread #1642)",https://www.reddit.com/live/18hnzysb1elcs,0.96,145,0,145
