,subreddit,title,url,upvote_ratio,ups,downs,score
0,worldnews,Houthis mistakenly target tanker carrying Russian oil - Ambrey report,https://www.reuters.com/world/middle-east/houthis-mistakenly-target-tanker-carrying-russian-oil-ambrey-report-2024-01-12/,0.95,10109,0,10109
1,worldnews,Large protests break out in Yemen after U.S.-British attacks,https://www.reuters.com/world/middle-east/large-protests-break-out-yemen-after-us-british-attacks-2024-01-12/,0.9,8039,0,8039
2,worldnews,Russia condemns US for 'irresponsible' strikes on Yemen and requests security council meeting,https://www.reuters.com/world/russia-requests-un-security-council-meeting-after-us-britain-strike-yemen-2024-01-12/?utm_source=reddit.com,0.87,5643,0,5643
3,worldnews,Israel rejects genocide accusations at World Court,https://www.reuters.com/world/middle-east/israel-counter-genocide-accusations-world-court-2024-01-12/,0.83,3540,0,3540
4,worldnews,Russian election candidate calls Ukraine war a ‘big mistake’ by Putin,https://www.nbcnews.com/news/world/russian-election-candidate-calls-ukraine-war-big-mistake-putin-rcna133609,0.97,3496,0,3496
5,worldnews,Germany Comes to Israel's Defense at Genocide Trial,https://themessenger.com/news/germany-opposes-genocide-trial-against-israel,0.86,3381,0,3381
6,worldnews,"US and UK Carry Out Air Strikes in Yemen, Houthis Vow Revenge",https://www.vice.com/en/article/4a3pjn/houthis-revenge-us-uk-airstrikes-yemen-gaza-conflict,0.96,3204,0,3204
7,worldnews,"The US and UK at last answered Houthi attacks with a carrier strike group, fighter jets, and a submarine packed with Tomahawk cruise missiles",https://www.businessinsider.com/us-uk-ships-aircraft-that-struck-back-at-houthi-military-2024-1,0.94,3035,0,3035
8,worldnews,Germany Rejects UN 'Genocide' Charge Against Israel,https://www.barrons.com/news/germany-rejects-un-genocide-charge-against-israel-6af01195,0.88,2832,0,2832
9,worldnews,Russia's Medvedev says any UK troop deployment to Ukraine would be a declaration of war,https://www.reuters.com/world/europe/russias-medvedev-says-any-uk-troop-deployment-ukraine-would-be-declaration-war-2024-01-12/,0.91,2800,0,2800
10,worldnews,"Airbus lands record orders in 2023, beats Boeing on deliveries",https://edition.cnn.com/2024/01/11/business/airbus-record-annual-jet-orders/index.html,0.97,2307,0,2307
11,worldnews,US carries out new strike in Yemen after Biden vows to keep pressure on,https://www.reuters.com/world/middle-east/biden-warns-more-strikes-yemens-houthis-if-red-sea-attacks-persist-2024-01-13/,0.96,2059,0,2059
12,worldnews,Canada doesn't support premise of South Africa's case against Israel,https://www.ctvnews.ca/politics/canada-doesn-t-support-premise-of-south-africa-s-case-against-israel-1.6723350,0.84,1637,0,1637
13,worldnews,'Europe bought Russian oil via India at record rates in 2023 despite Ukraine war' - Times of India,https://m.timesofindia.com/world/europe/europe-bought-russian-oil-via-india-at-record-rates-in-2023-despite-ukraine-war/articleshow/106777423.cms,0.94,1613,0,1613
14,worldnews,"Strikes on Yemen had good effects, will continue to monitor -Pentagon",https://www.reuters.com/world/middle-east/strikes-yemen-had-good-effects-will-continue-monitor-pentagon-2024-01-12/,0.93,1431,0,1431
15,worldnews,Mass protests in Slovakia against pro-Russian government’s proposed legal changes,https://news.yahoo.com/mass-protests-slovakia-against-pro-095200726.html,0.97,1327,0,1327
16,worldnews,Ukraine and UK sign security treaty that will be valid until joining NATO,https://www.pravda.com.ua/eng/news/2024/01/12/7436957/,0.96,1105,0,1105
17,worldnews,Julian Assange's lawyer warns his life is 'at risk' if final UK appeal against extradition to US fails,https://www.abc.net.au/news/2024-01-10/assange-lawyer-says-us-extradition-suicide-risk-if-appeal-fails/103300784,0.87,1050,0,1050
18,worldnews,Another Vicious Murderer Pardoned by Putin Killed in Ukraine – to Relief of Victims’ Families,https://www.kyivpost.com/post/26671,0.96,994,0,994
19,worldnews,Danish police say 7 arrested in December over foiled terror plot 'linked to Hamas',https://www.timesofisrael.com/danish-police-say-7-arrested-in-december-over-foiled-terror-plot-linked-to-hamas/,0.93,796,0,796
20,worldnews,"US 'disappointed' by Hungary's Ukraine policy, urges ratification of Sweden's NATO bid",https://www.reuters.com/world/us-disappointed-by-hungarys-ukraine-policy-urges-ratification-swedens-nato-bid-2024-01-11/,0.96,730,0,730
21,worldnews,Cape Verde has become the third country in Africa to eliminate malaria in a victory for public health authorities who followed through an extensive plan to tackle the mosquito-borne disease,https://www.dw.com/en/africa-who-declares-cape-verde-free-of-malaria/a-67964211,0.97,700,0,700
22,worldnews,"Argentina’s annual inflation soars to 211.4%, the highest in the world",https://english.elpais.com/economy-and-business/2024-01-11/argentinas-annual-inflation-soars-to-2114-the-highest-in-32-years.html,0.94,654,0,654
23,worldnews,"Nearly 10,000 COVID deaths reported last month as JN.1 variant spread at holiday gatherings, WHO says",https://www.cbsnews.com/news/nearly-10000-died-covid-19-variant-holiday-gatherings/,0.85,316,0,316
24,worldnews,A refugee bear from a bombed-out Ukraine zoo finds a new home in Scotland,https://apnews.com/article/bear-rescue-ukraine-zoo-scotland-d0a3be03869ce72e7362749722856387,0.95,242,0,242
25,worldnews,"/r/WorldNews Live Thread: Russian Invasion of Ukraine Day 689, Part 1 (Thread #835)",https://www.reddit.com/live/18hnzysb1elcs,0.95,19,0,19
