,subreddit,title,url,upvote_ratio,ups,downs,score
0,worldnews,Biden administration says it is 'not encouraging Ukraine to strike beyond its borders' following deadly explosions at Russian bases,https://www.businessinsider.com/us-not-encouraging-ukraine-strike-russia-following-deadly-base-attacks-2022-12,0.92,26962,0,26962
1,worldnews,Putin Signs Law Banning Expressions of L.G.B.T.Q. Identity in Russia,https://www.nytimes.com/2022/12/05/world/europe/russia-ban-lgbtq-propaganda.html,0.93,25356,0,25356
2,worldnews,Ukraine appears to show ability to strike far inside Russia,https://www.reuters.com/world/europe/ukraine-appears-show-ability-strike-far-inside-russia-2022-12-06/,0.97,5052,0,5052
3,worldnews,"Publishing Is Not a Crime: NYT, The Guardian &amp; More Urge Biden Admin to Drop Charges Against Assange",https://www.democracynow.org/2022/12/6/julian_assange_espionage_act_charges,0.86,4403,0,4403
4,worldnews,US Envoy: Iran Should Not Be Member of UN Commission on Women,https://www.voanews.com/a/us-envoy-iran-should-not-be-member-of-un-commission-on-women/6862763.html,0.98,4263,0,4263
5,worldnews,Latvia cancels license of Russian independent television station TV Rain,https://www.reuters.com/business/media-telecom/latvia-cancels-license-russian-independent-television-station-tv-rain-2022-12-06/,0.97,3652,0,3652
6,worldnews,"Iran's Khamenei calls for ""revolutionary reconstruction of the country's cultural system""",https://www.reuters.com/world/middle-east/khamenei-calls-overhaul-irans-cultural-system-2022-12-06/,0.95,3056,0,3056
7,worldnews,Court sentences Vice-President Cristina Fernández de Kirchner to six years in prison for corruption,https://batimes.com.ar/news/argentina/argentina-vice-president-cristina-fernandez-de-kirchner-court-trial-vialidad-verdict.phtml,0.97,2357,0,2357
8,worldnews,"The European Union has agreed to a new provisional deal to make it illegal for companies to trade some products, such as palm oil, soy, and coffee, if they were grown on land cleared for agricultural use after 2020",https://www.dw.com/en/eu-draft-law-limits-imports-linked-to-deforestation/a-64004092,0.97,1917,0,1917
9,worldnews,"UN Secretary-General Antonio Guterres on Tuesday slammed multinational corporations for turning the world's ecosystems into ""playthings of profit."" ""With our bottomless appetite for unchecked and unequal economic growth, humanity has become a weapon of mass extinction""",https://www.france24.com/en/live-news/20221206-humanity-has-become-a-weapon-of-mass-extinction-warns-un-chief,0.95,1463,0,1463
10,worldnews,US not preventing Ukraine from developing long-range strike capabilities- Pentagon,https://www.jpost.com/breaking-news/article-724226,0.95,1069,0,1069
11,worldnews,"An Iranian patrol vessel tried to blind the bridges of US Navy ships sailing through the Strait of Hormuz, US military says",https://www.businessinsider.com/iranian-vessel-tried-blinding-bridges-us-navy-ships-centcom-says-2022-12,0.94,809,0,809
12,worldnews,Russia: we can agree with U.S. on need for peace in Ukraine but no talks for now,https://www.reuters.com/world/russia-we-can-agree-with-us-need-peace-ukraine-no-talks-now-2022-12-06/,0.91,719,0,719
13,worldnews,Judge dismisses Khashoggi lawsuit against Saudi prince; Biden granted him immunity,https://www.reuters.com/legal/judge-dismisses-khashoggi-lawsuit-against-saudi-prince-biden-granted-him-2022-12-07/,0.82,514,0,514
14,worldnews,"Colombian Senate Approves Marijuana Legalization Bill, Bringing Country Closer To Ending Prohibition -- The bill, which has also already received initial approval in the country’s Chamber of Representatives, was approved in a 56-3 vote.",https://www.marijuanamoment.net/colombian-senate-approves-marijuana-legalization-bill-bringing-country-closer-to-ending-prohibition/,0.95,460,0,460
15,worldnews,Aeroflot tells passengers to read a book or take a nap after sanctions end in-flight entertainment on some services,https://www.businessinsider.com/aeroflot-tells-passengers-to-nap-sanctions-end-in-flight-entertainment-2022-12,0.92,406,0,406
16,worldnews,"Poland reverses course, accepts German air defense system",https://abcnews.go.com/International/wireStory/poland-accept-german-patriot-air-defense-system-94594208,0.96,375,0,375
17,worldnews,"China medical expert says COVID has mutated, should be renamed - state media",https://www.reuters.com/world/china/china-medical-expert-says-covid-has-mutated-should-be-renamed-state-media-2022-12-07/,0.88,354,0,354
18,worldnews,"/r/WorldNews Live Thread: Russian Invasion of Ukraine Day 287, Part 1 (Thread #428)",https://www.reddit.com/live/18hnzysb1elcs,0.96,290,0,290
19,worldnews,"Iranian student protestors poisoned ahead of mass protests, student union claims",https://www.jpost.com/middle-east/iran-news/article-724228,0.95,257,0,257
20,worldnews,Russia Has Enough Missiles For Few More Large-Scale Attacks On Ukraine: Intelligence Chief,https://www.ibtimes.com/russia-has-enough-missiles-few-more-large-scale-attacks-ukraine-intelligence-chief-3644203,0.94,169,0,169
21,worldnews,Japanese fighter jets land in Philippines for 1st time since WWII,https://japantoday.com/category/national/japanese-fighter-jets-land-in-philippines-for-1st-time-since-wwii,0.94,166,0,166
22,worldnews,"1,200 Iranian students ‘poisoned’ on eve of mass protests",https://www.arabnews.com/node/2211576/amp,0.94,161,0,161
23,worldnews,Chinese FM spokesperson says Japan’s ballooning defense budget is dangerous and is leading to serious concerns among neighbors,https://www.globaltimes.cn/page/202212/1281279.shtml,0.85,150,0,150
24,worldnews,Al Jazeera submits case of slain journalist Shireen Abu Akleh to the International Criminal Court,https://www.sbs.com.au/news/article/al-jazeera-takes-case-of-slain-journalist-shireen-abu-akleh-to-international-criminal-court/gq6g080iq,0.84,140,0,140
25,worldnews,Australia's first complete plesiosaur fossil discovered in outback Queensland,https://www.abc.net.au/news/2022-12-07/fossil-discovery-queensland-museum-townsville-plesiosaur/101735306,0.95,124,0,124
26,worldnews,The Collapse of Insects,https://www.reuters.com/graphics/GLOBAL-ENVIRONMENT/INSECT-APOCALYPSE/egpbykdxjvq/index.html,0.93,105,0,105
