,subreddit,title,url,upvote_ratio,ups,downs,score
0,worldnews,Trump cancels strikes against Iran planned for Thursday evening,https://www.reuters.com/world/middle-east/trump-cancels-strikes-against-iran-planned-thursday-evening-2026-06-11/,0.95,14953,0,14953
1,worldnews,Swiss canton bans headscarves for female teachers,https://www.swissinfo.ch/eng/various/st-gallen-cantonal-council-decides-to-ban-headscarves-for-female-teachers/91560143?utm_source=multiple&amp;utm_medium=website&amp;utm_campaign=news_en&amp;utm_content=o&amp;utm_term=wpblock_highlighted-compact-news-carousel,0.94,8310,0,8310
2,worldnews,Crimea Isolated From Mainland Ukraine After Precision Drone Strikes Disable Strategic Bridges,https://united24media.com/war-in-ukraine/crimea-isolated-from-mainland-ukraine-after-precision-drone-strikes-disable-strategic-bridges-19728,0.98,7367,0,7367
3,worldnews,Quebec becomes 1st Canadian province to ban energy drinks for youth,https://www.cbc.ca/news/canada/montreal/quebec-legislature-new-bills-9.7231667,0.98,6876,0,6876
4,worldnews,"Korea slashes jet fuel exports to U.S. amid Iran war uncertainties, redirects flows to Japan on higher margins",https://www.koreajoongangdaily.com/business/korea-slashes-jet-fuel-exports-to-us-amid-iran-war-uncertainties-redirects-flows-to-japan-on-higher-margins/12699208,0.98,4695,0,4695
5,worldnews,Canadian drone maker that made deal with Ukraine unbothered by threats from Russia | CBC News,https://www.cbc.ca/news/canada/hamilton/hamilton-company-sentinel-russia-canada-ukraine-deal-9.7231718,0.97,2800,0,2800
6,worldnews,Former South Korean president Yoon given 30 years over Pyongyang drone plot,https://www.scmp.com/news/asia/east-asia/article/3356833/south-korean-court-sentences-ex-president-yoon-30-years-over-pyongyang-drone-plot?utm_source=Reddit&amp;utm_medium=Social,0.98,2546,0,2546
7,worldnews,Ukrainian troops are crippling Russia's supply bridges by slamming drones repeatedly into the asphalt,https://www.businessinsider.com/ukraine-mid-range-drone-crimea-bridge-slam-asphalt-strike-2026-6,0.97,2362,0,2362
8,worldnews,El Niño forms in Pacific as experts say it will likely turbocharge extreme weather,https://www.theguardian.com/us-news/2026/jun/11/el-nino-forms-historic-strength,0.97,2087,0,2087
9,worldnews,Ukraine's drone commander wants to cut Crimea off from Russia,https://www.reuters.com/world/europe/ukraines-drone-commander-wants-cut-crimea-off-russia-2026-06-11/,0.97,1970,0,1970
10,worldnews,"US plans to deport Iranians to Central African Republic, sources say",https://www.reuters.com/world/africa/us-plans-deport-iranians-central-african-republic-sources-say-2026-06-11/,0.96,1897,0,1897
11,worldnews,"Russia has increased military buildup near NATO border, investigation reveals",https://kyivindependent.com/russia-has-increased-military-buildup-near-nato-border-investigation-reveals/,0.96,1849,0,1849
12,worldnews,Revealed: Green party proposes circumcision ban,https://spectator.com/article/revealed-green-party-proposes-circumcision-ban/,0.87,1444,0,1444
13,worldnews,Niger criminalises same-sex relations with jail terms,https://www.rfi.fr/en/international-news/20260611-niger-criminalises-same-sex-relations-with-jail-terms,0.93,1001,0,1001
14,worldnews,SpaceX’s IPO Raises $75 Billion in Biggest Debut of All Time,https://www.bloomberg.com/news/articles/2026-06-11/elon-musk-s-spacex-set-to-make-history-with-record-breaking-ipo,0.88,985,0,985
15,worldnews,Iran says no final decision made on deal that Trump hopes could be signed soon,https://www.reuters.com/world/middle-east/us-iran-trade-attacks-second-day-undermining-shaky-ceasefire-2026-06-11/,0.94,539,0,539
16,worldnews,Majority of Ukrainians say US is pressuring Ukraine for concessions to Russia,https://www.eurointegration.com.ua/eng/news/2026/06/12/7239534/,0.95,438,0,438
17,worldnews,231 Drones on Russia Day: Ukraine Hits Major Oil Refineries and Chemical Plants Across Russia,https://www.kyivpost.com/post/78014,0.97,244,0,244
18,worldnews,"/r/WorldNews Live Thread: Russian Invasion of Ukraine Day 1569, Part 1 (Thread #1716)",https://www.reddit.com/live/18hnzysb1elcs,0.95,236,0,236
19,worldnews,Pope casts flowers in sea in tribute to drowned migrants during Canary Islands visit,https://www.france24.com/en/europe/20260611-pope-condemns-indifference-towards-migrants-on-canaries-trip,0.84,197,0,197
20,worldnews,Israel deports French journalist over coverage critical of its policies in Gaza and the West Bank,https://apnews.com/article/israel-france-journalist-alice-froussard-38fd2e5515477f367c355751143e1b69,0.7,193,0,193
21,worldnews,"Proposed Iran-U.S. deal would reopen Hormuz strait and lift oil sanctions, Iran state media says",https://www.cnbc.com/2026/06/12/iran-us-peace-memo-strait-hormuz-oil-sanctions.html,0.87,193,0,193
22,worldnews,"In a first, India deploys 12 nuclear warheads: Report",https://gulfnews.com/world/asia/india/india-deploys-12-nuclear-warheads-for-first-time-sipri-1.500568503,0.77,90,0,90
23,worldnews,Snowden Used in FSB Campaign Against Western Runet Infrastructure and Apple Smartphones,https://united24media.com/investigations/snowden-used-in-fsb-campaign-against-western-runet-infrastructure-and-apple-smartphones-19680,0.88,68,0,68
24,worldnews,/r/WorldNews Discussion Thread: US and Israel launch attack on Iran; Iran retaliates (Thread #19),https://www.reddit.com/r/worldnews/comments/1u39jcq/rworldnews_discussion_thread_us_and_israel_launch/,0.77,66,0,66
