,subreddit,title,url,upvote_ratio,ups,downs,score
0,worldnews,'I won't humiliate myself': Brazil's president sees no point in tariff talks with Trump,https://www.reuters.com/world/americas/i-wont-humiliate-myself-brazils-president-sees-no-point-tariff-talks-with-trump-2025-08-06/,0.96,28437,0,28437
1,worldnews,Moldova Just Jailed Its Putin-Aligned Governor. Here’s What She Did,https://united24media.com/world/moldova-just-jailed-its-putin-aligned-governor-heres-what-she-did-10484,0.95,19178,0,19178
2,worldnews,Trump raises India tariffs to 50% over Russian oil purchases,https://www.cnbc.com/2025/08/06/trump-trade-india-tariffs-russia.html,0.96,11449,0,11449
3,worldnews,US House Speaker 'calls West Bank rightful property of Jewish people' during visit,https://www.thenationalnews.com/news/us/2025/08/04/mike-johnson-visits-israeli-settlement/,0.93,6456,0,6456
4,worldnews,"Ukraine destroys Russian radar hub in Black Sea raid, opening new front in coastal war",https://euromaidanpress.com/2025/08/06/frontline-report-ukraine-destroys-russian-radar-hub-in-black-sea-raid-opening-new-front-in-coastal-war,0.98,4993,0,4993
5,worldnews,Indian PM modi to meet China's Xi and Russia's Putin,https://www.ndtv.com/world-news/pm-modi-to-visit-china-his-first-since-galwan-clash-for-key-regional-summit-sco-9031214,0.95,3620,0,3620
6,worldnews,Trump threatens EU with 35% tariffs if $600bn investment pledge unfulfilled,https://www.euronews.com/my-europe/2025/08/05/trump-threatens-eu-with-35-tariffs-if-600bn-investment-pledge-unfulfilled,0.95,3563,0,3563
7,worldnews,Iran hangs nuclear scientist for alleged espionage for Israel’s Mossad,https://www.iranintl.com/en/202508061542,0.97,3403,0,3403
8,worldnews,"Spain rules out buying F-35, choosing between Eurofighter or FCAS",https://www.reuters.com/business/aerospace-defense/spain-rules-out-buying-f-35-choosing-between-eurofighter-or-fcas-2025-08-06/,0.97,2766,0,2766
9,worldnews,Trump doesn't oppose Netanyahu plan for full Gaza occupation: U.S. officials,https://www.axios.com/2025/08/06/trump-netanyahu-plan-occupy-gaza-strip-israel?utm_campaign=editorial&amp;utm_source=x&amp;utm_medium=organic_social,0.95,2587,0,2587
10,worldnews,Carney says he'll talk to POTUS 'when it makes sense' after 35 per cent tariff lands,https://www.ctvnews.ca/politics/article/carney-says-hell-talk-to-trump-when-it-makes-sense-after-35-per-cent-tariff-lands/,0.96,1515,0,1515
11,worldnews,"Putin doubts potency of Trump's ultimatum to end the war, sources say",https://www.reuters.com/world/europe/putin-doubts-potency-trumps-ultimatum-end-war-sources-say-2025-08-05/,0.96,1281,0,1281
12,worldnews,"India calls additional US tariff ‘unfair, unjustified and unreasonable’, says will take actions to protect national interests",https://indianexpress.com/article/india/trump-50-tariff-india-response-unfair-national-interest-10174000/,0.92,1232,0,1232
13,worldnews,'No other choice' — Syrskyi says Ukraine must mobilize to counter growing Russian forces,https://kyivindependent.com/no-other-choice-syrskyi-says-ukraine-must-mobilize-to-counter-growing-russian-forces/,0.96,1228,0,1228
14,worldnews,Brazil’s Key MAGA Ally Linked to Massive Fraud Scheme Involving Jailed Chinese Billionaire,https://apublica.org/2025/08/records-reveal-paulo-figueiredos-alleged-connection-to-fraud/#amp_tf=From%2520%25251%2524s&amp;aoh=17544941509950&amp;referrer=https%253A%252F%252Fwww.google.com&amp;ampshare=https%253A%252F%252Fapublica.org%252F2025%252F08%252Frecords-reveal-paulo-figueiredos-alleged-connection-to-fraud%252F,0.96,887,0,887
15,worldnews,'India’s sovereignty is non negotiable': China backs Delhi as Trump threatens tariff hike - BusinessToday,https://www.businesstoday.in/india/story/indias-sovereignty-is-non-negotiable-china-backs-delhi-as-trump-threatens-tariff-hike-488173-2025-08-06,0.95,794,0,794
16,worldnews,Radio Liberty release footage of Russian looting and execution of civilian in Bucha – video,https://www.pravda.com.ua/eng/news/2025/08/6/7525023,0.96,731,0,731
17,worldnews,Hezbollah rejects Lebanese government's plans to disarm the group,https://www.france24.com/en/middle-east/20250806-hezbollah-calls-lebanon-s-plan-to-disarm-it-a-grave-sin-vows-to-ignore-it,0.97,688,0,688
18,worldnews,"India, Russia sign protocol to deepen industrial ties at 11th Working Group Session",https://ddnews.gov.in/en/india-russia-sign-protocol-to-deepen-industrial-ties-at-11th-working-group-session/,0.93,618,0,618
19,worldnews,Trump plans meetings with Putin and Zelenskyy next week – NYT,https://www.pravda.com.ua/eng/news/2025/08/6/7525059/,0.87,256,0,256
20,worldnews,"Trump’s 15% tariffs on Japan not a ceiling, media reports say",https://www.investing.com/news/economy/trumps-15-tariffs-on-japan-not-a-ceiling-media-reports-say-4174954,0.94,248,0,248
21,worldnews,Victims of CIA-linked Montreal brainwashing experiments cleared to sue in class action,https://www.cbc.ca/news/canada/montreal/mk-ultra-depatterning-lawsuit-montreal-experiments-cia-1.7598486,0.96,242,0,242
22,worldnews,"‘Dirty Indian, go back’: 6-year-old girl assaulted, ‘hit in private parts’ in Ireland amid racist attacks",https://www.livemint.com/news/world/dirty-indian-go-back-6-year-old-girl-assaulted-hit-in-private-parts-in-ireland-amid-racist-attacks-11754531316832.html,0.9,191,0,191
23,worldnews,Brazil requests consultations at World Trade Organization over Trump's tariffs,https://apnews.com/article/brazil-wto-united-states-tariffs-economy-cf24d941fb7d9ae842a30c19dedda145,0.95,162,0,162
24,worldnews,"Ontario premier warns Trump could reopen CUSMA trade pact, calls for action to bolster economy",https://www.cbc.ca/news/canada/toronto/ford-trump-cusma-tariffs-us-trade-1.7602777,0.9,131,0,131
25,worldnews,"/r/WorldNews Live Thread: Russian Invasion of Ukraine Day 1260, Part 1 (Thread #1407)",https://www.reddit.com/live/18hnzysb1elcs,0.97,113,0,113
