,subreddit,title,url,upvote_ratio,ups,downs,score
0,worldnews,Israel says no humanitarian break to Gaza siege unless hostages are freed,https://www.reuters.com/world/middle-east/biden-warns-iran-over-gaza-israel-forms-emergency-war-cabinet-2023-10-11/,0.89,28772,0,28772
1,worldnews,France bans pro-Palestinian protests: interior minister,https://www.thelocal.fr/20231012/france-bans-pro-palestinian-protests-interior-minister,0.9,14576,0,14576
2,worldnews,Israel tells UN to evacuate the northern Gaza Strip within 24 hours,https://www.axios.com/2023/10/13/israel-gaza-hamas-evacuate-un-ground-operation,0.96,6253,0,6253
3,worldnews,"Israel allegedly strikes two airports in Syria, air defenses activated",https://m.jpost.com/breaking-news/article-767914,0.96,6196,0,6196
4,worldnews,Russian Naval Corvette Hit by Mystery Explosion - Cause and Outcome Unclear,https://www.kyivpost.com/post/22662,0.97,5341,0,5341
5,worldnews,Palestinian President Abbas condemns violence against civilians,https://www.reuters.com/world/middle-east/palestinian-president-says-he-rejects-killing-civilians-both-sides-conflict-2023-10-12/,0.9,4647,0,4647
6,worldnews,"Number of displaced in Gaza surpasses 187,000 as dozens of towns evacuate, U.N. office says","https://thehill.com/policy/international/4246839-number-of-displaced-in-gaza-surpasses-187000-as-dozens-of-towns-evacuate-u-n-office-says/#:~:text=More%20than%20187%2C500%20residents%20in%20Gaza%20are%20displaced,rise%2C%20so%20do%20the%20number%20of%20those%20displaced",0.92,3980,0,3980
7,worldnews,Russian journalist who protested on live television sentenced to 8.5 years in prison in absentia | CNN,https://edition.cnn.com/2023/10/05/europe/marina-ovsyannikova-prison-sentence-russia-court-intl/index.html,0.96,2318,0,2318
8,worldnews,NATO vows to respond if Finland-Estonia gas pipeline damage is deliberate,https://www.theguardian.com/world/2023/oct/11/nato-vows-to-respond-if-finland-estonia-gas-pipeline-damage-is-deliberate?fbclid=IwAR37DNbXTl2t4QCx7z7Hd6KtDsrIiYr5Ac4jFlA2CfRw93nreSlLMb73VRw,0.97,2273,0,2273
9,worldnews,Iran says crimes against Palestinians to receive response from axis,https://news.yahoo.com/iran-says-crimes-against-palestinians-222059379.html,0.9,2070,0,2070
10,worldnews,"More than 90% of people killed by western Afghanistan quake were women and children, UN says",https://apnews.com/article/afghanistan-earthquake-death-toll-women-children-e9ef4fd77603f2203e3695194fbf7851,0.95,1808,0,1808
11,worldnews,Iran accuses Israel of seeking 'genocide' with Gaza siege,https://www.reuters.com/world/middle-east/irans-foreign-minister-make-regional-tour-tasnim-2023-10-12/,0.81,1674,0,1674
12,worldnews,CIA publicly acknowledges 1953 coup it backed in Iran was undemocratic as it revisits ‘Argo’ rescue,https://www.nbcnews.com/news/us-news/cia-publicly-acknowledges-1953-coup-backed-iran-was-undemocratic-revis-rcna120154,0.94,1306,0,1306
13,worldnews,Chinese officials urge calm after Evergrande fears reportedly spark small bank run,https://www.cnn.com/2023/10/12/economy/china-bank-run-evergrande-intl-hnk/index.html,0.95,1241,0,1241
14,worldnews,/r/WorldNews Live Thread for 2023 Israel-Hamas Crisis (Thread 14),https://www.reddit.com/live/1bsso361afr0r,0.85,1185,0,1185
15,worldnews,France investigates suspected poisoning of Russian journalist who staged on-air protest against Ukraine war,https://www.cbsnews.com/news/france-investigates-poisoning-marina-ovsiannikova-russian-journalist-tv-protest-ukraine-war/,0.97,926,0,926
16,worldnews,/r/WorldNews Live Thread for 2023 Israel-Hamas Crisis (Thread 15),https://www.reddit.com/live/1bsso361afr0r,0.87,911,0,911
17,worldnews,PACE recognises Holodomor as genocide,https://www.pravda.com.ua/eng/news/2023/10/12/7423889/,0.93,911,0,911
18,worldnews,"Turkish President Recep Tayyip Erdogan has launched a negotiation process with Hamas for the release of Israeli captives taken by the Palestinian militants, an official source told AFP on Wednesday.",https://english.ahram.org.eg/NewsContent/2/8/510073/World/Region/Turkey;s-Erdogan-talks-to-Hamas-for-release-of-Isr.aspx,0.92,519,0,519
19,worldnews,Israeli Army’s Top Brass Received Troubling Info Night Before Hamas Attack,https://www.haaretz.com/israel-news/2023-10-12/ty-article/.premium/israeli-armys-top-brass-received-troubling-info-night-before-hamas-attack/0000018b-24e2-d680-af9b-26eed7b10000,0.91,436,0,436
20,worldnews,Israel calls for all civilians to leave Gaza City,https://www.reuters.com/world/middle-east/now-is-time-war-says-israels-military-chief-2023-10-12/,0.93,422,0,422
21,worldnews,Blinken says no 'direct evidence' that Iran was involved in the Hamas attack on Israel,https://www.nbcnews.com/politics/white-house/blinken-says-no-direct-evidence-iran-was-involved-hamas-attack-israel-rcna120110,0.9,362,0,362
22,worldnews,Philip Morris lobbying to stop WHO ‘attack’ on vapes and similar products,https://www.theguardian.com/business/2023/oct/12/philip-morris-lobbying-to-stop-who-attack-on-vapes-and-similar-products,0.9,269,0,269
23,worldnews,Hamas Militants Trained For Its Deadly Attack In Plain Sight And Less Than A Mile From Israel's Heavily Fortified Border,https://www.cnn.com/2023/10/12/middleeast/hamas-training-site-gaza-israel-intl,0.89,267,0,267
24,worldnews,"/r/WorldNews Live Thread: Russian Invasion of Ukraine Day 597, Part 1 (Thread #743)",https://www.reddit.com/live/18hnzysb1elcs,0.96,245,0,245
25,worldnews,North Korea raises specter of nuclear strike over US aircraft carrier's arrival in South Korea,https://apnews.com/article/north-korea-nuclear-weapons-us-aircraft-carrier-be56e91daba9eeeaf2edefdccf3c9133,0.87,185,0,185
26,worldnews,"Washington: It would be “insanity” for US, China to descend into conflict",https://www.scmp.com/news/china/diplomacy/article/3237684/ambassador-says-us-working-stabilise-ties-china-questions-beijings-peace-efforts-conflict-hotspots,0.91,163,0,163
