,subreddit,title,url,upvote_ratio,ups,downs,score
0,worldnews,US: Russia has committed crimes against humanity in Ukraine,https://apnews.com/article/us-russia-ukraine-crimes-against-humanity-harris-cee87f06cbf3fcdf37e0bb398360c8ee?utm_source=homepage&amp;utm_medium=TopNews&amp;utm_campaign=position_01,0.86,49518,0,49518
1,worldnews,Japan to criminalize sex with children under 16,https://english.kyodonews.net/news/2023/02/47e65949da08-japan-to-criminalize-sex-with-children-under-16.html,0.94,35952,0,35952
2,worldnews,"'Unthinkable’ that Russia does not pay for Ukraine’s reconstruction, EU chief says",https://www.cnbc.com/2023/02/18/unthinkable-that-russia-does-not-pay-for-ukraines-reconstruction-eu-chief-says.html,0.96,9895,0,9895
3,worldnews,Peruvian loggers given 28 years in jail for murder of four Indigenous leaders | Victims – among them environmental defender Edwin Chota – were tortured before their deaths in Peruvian Amazon in 2014,https://www.theguardian.com/world/2023/feb/17/peru-illegal-logging-murder-indigenous-leaders,0.98,6935,0,6935
4,worldnews,Macron wants Russia's defeat in Ukraine without 'crushing' Russia,https://kyivindependent.com/news-feed/macron-wants-russias-defeat-in-ukraine-without-crushing-russia,0.91,6428,0,6428
5,worldnews,Russian envoy claims West is determined to destroy Russia,https://apnews.com/article/russia-ukraine-politics-government-united-nations-93f82a411781354018708c1dc42756f0,0.93,6123,0,6123
6,worldnews,Taiwan undersea cable cuts linked to Chinese vessels,https://www.taiwannews.com.tw/en/news/4812970,0.97,5055,0,5055
7,worldnews,U.S. officials believe China may be providing Russia non-lethal military assistance in Ukraine war,https://www.nbcnews.com/news/us-news/us-officials-believe-china-may-providing-russia-non-lethal-military-as-rcna71336,0.96,3857,0,3857
8,worldnews,Antarctica Doomsday Glacier: ‘We should all be very concerned’ | Climate Crisis News,https://www.aljazeera.com/news/2023/2/15/antarctica-doomsday-glacier-we-should-all-be-very,0.92,3692,0,3692
9,worldnews,"Rail engineers to stage series of 48-hour strikes in March over pay, RMT says | UK news",https://www.theguardian.com/uk-news/2023/feb/18/rail-engineers-to-stage-series-of-48-hour-strikes-in-march-over-pay-rmt-says,0.97,3617,0,3617
10,worldnews,"Poland ready to support Ukraine with MiG jets if broader coalition formed, says PM",https://www.jpost.com/breaking-news/article-731961,0.96,3606,0,3606
11,worldnews,Netherlands orders Russian diplomats to leave | Russia-Ukraine war News,https://www.aljazeera.com/news/2023/2/18/netherlands-orders-russian-diplomats-to-leave?taid=63f131c5b1fa3800010f768c&amp;utm_campaign=trueAnthem%3A+Trending+Content&amp;utm_medium=trueAnthem&amp;utm_source=twitter,0.96,2267,0,2267
12,worldnews,"Scientists: Antarctic's so-called ""Doomsday Glacier"" is in trouble, could collapse",https://www.cbsnews.com/atlanta/news/scientists-antarctics-so-called-doomsday-glacier-is-in-trouble-could-collapse/,0.95,2130,0,2130
13,worldnews,"2,200-year-old flush toilet — oldest ever found — unearthed at palace ruins in China",https://www.ledger-enquirer.com/news/nation-world/world/article272529260.html,0.93,1948,0,1948
14,worldnews,Netherlands orders Russian embassy to downsize and closes St Petersburg consulate,https://www.reuters.com/world/europe/netherlands-orders-russian-embassy-downsize-closes-st-petersburg-consulate-2023-02-18/,0.97,1893,0,1893
15,worldnews,Macron calls out Russia for work with ‘neo-mafia’ Wagner group,https://www.politico.eu/article/emmanuel-macron-russia-mafia-state-wagner-group/,0.95,1671,0,1671
16,worldnews,Blinken claims China ‘strongly considering’ providing Russia with ‘lethal assistance’,https://thehill.com/policy/international/3864815-blinken-claims-china-strongly-considering-providing-russia-with-lethal-assistance/,0.93,1435,0,1435
17,worldnews,"Britain will help any country willing to send fighter jets to Ukraine, Sunak says",https://www.reuters.com/world/europe/uk-will-help-other-countries-willing-send-aircraft-ukraine-sunak-says-2023-02-18/,0.94,1376,0,1376
18,worldnews,"Kremlin critic, Andrei Pivovarov, missing amid prison transfer, allies say",https://apnews.com/article/politics-russia-government-st-petersburg-prisons-ddc9c6f5c26893de4278f9ff09bcb9c6,0.96,1117,0,1117
19,worldnews,UN says AI poses serious risk for human rights,https://www.news24.com/news24/world/news/un-says-ai-poses-serious-risk-for-human-rights-20230218,0.9,750,0,750
20,worldnews,Hungary's Orban accuses EU of prolonging war in Ukraine,https://apnews.com/article/russia-ukraine-politics-government-european-union-viktor-orban-a404e437593bddf9b0e8b23482f2872e,0.84,717,0,717
21,worldnews,US Secretary of State Antony Blinken warns China that balloon incursion 'must never happen again',https://www.lemonde.fr/en/china/article/2023/02/18/us-secretary-of-state-antony-blinken-warns-china-that-balloon-incursion-must-never-happen-again_6016387_162.html,0.92,647,0,647
22,worldnews,Chinese peace plan for Ukraine greeted cautiously by the west,https://www.theguardian.com/world/2023/feb/18/chinese-peace-plan-for-ukraine-greeted-cautiously-by-the-west,0.87,536,0,536
23,worldnews,"Stockholm police have again refused to issue a permit for another event at which the Quran was to be burned in front of the Turkish Embassy in the city, Swedish public broadcaster SVT reports",https://stockholmcf.org/stockholm-police-continue-to-deny-permits-for-quran-burning-events/,0.91,264,0,264
24,worldnews,"/r/WorldNews Live Thread: Russian Invasion of Ukraine Day 361, Part 1 (Thread #502)",https://www.reddit.com/live/18hnzysb1elcs,0.92,201,0,201
25,worldnews,Spy at UK's Berlin embassy jailed for selling secrets to Russia,https://www.bbc.com/news/uk-64669885,0.91,191,0,191
26,worldnews,"r/WorldNews Live Audio 🎙 Supreme Court Reviews Social Media Platforms' Section 230 Immunities | Monday 20 February 2023, 09h00 PST / 12h00 EST",https://i.redd.it/j5ni81znzyia1.png,0.67,44,0,44
