,subreddit,title,url,upvote_ratio,ups,downs,score
0,worldnews,Russia is becoming increasingly dependent on Chinese banks as its yuan borrowings more than quadruple,https://markets.businessinsider.com/news/currencies/dedollarization-chinese-bank-lending-to-russia-more-than-quadruples-2023-9?_gl=1*1l1dkvj*_ga*ODAwMzkwMDI5LjE2OTA5Njk2ODQ.*_ga_E21CV80ZCZ*MTY5MzgyMjQyOC4xOS4xLjE2OTM4MjI0MzEuNTcuMC4w,0.96,14025,0,14025
1,worldnews,Japan may seek to dissolve Moonies church in wake of Shinzo Abe killing,https://www.theguardian.com/world/2023/sep/04/japan-may-seek-to-dissolve-moonies-church-in-wake-of-shinzo-abe-killing,0.97,12773,0,12773
2,worldnews,Russia arrests mathematician on terrorism charges minutes after his release from prison,https://abcnews.go.com/International/wireStory/russia-arrests-mathematician-terrorism-charges-minutes-after-release-102907142,0.97,10906,0,10906
3,worldnews,Peru demolishes “Wall of Shame” dividing rich and poor neighbourhoods,https://ptv-news.com.pk/Peru-demolishes-wall-of-shame-dividing-rich-and-poor-,0.98,7183,0,7183
4,worldnews,Another Russian mercenary group shows discontent with the Kremlin: ‘A sign of more to come’,https://www.france24.com/en/europe/20230904-another-russian-mercenary-group-shows-discontent-with-the-kremlin-a-sign-of-more-to-come,0.98,4533,0,4533
5,worldnews,"Russia proposed three-way naval exercise with N. Korea, China: NIS","https://en.yna.co.kr/view/AEN20230904008951315#:~:text=SEOUL%2C%20Sept.%204%20(Yonhap,was%20quoted%20as%20saying%20Monday.",0.96,4487,0,4487
6,worldnews,"60,000 men: Zelenskyy's representative initiates cancellation of conscription deferment for some students",https://www.pravda.com.ua/eng/news/2023/09/3/7418276/,0.93,3953,0,3953
7,worldnews,Twitter accused of helping Saudi Arabia commit human rights abuses,https://www.theguardian.com/world/2023/sep/04/twitter-saudi-arabia-human-rights-abuses,0.96,2829,0,2829
8,worldnews,Teachers set to hold massive rally following suicide deaths of distressed teachers,https://www.koreatimes.co.kr/www/nation/2023/09/113_358422.html,0.98,2421,0,2421
9,worldnews,"Upward of 20,000 Ukrainian amputees face trauma on a scale unseen since WWI",https://apnews.com/article/ukraine-russia-war-amputees-wounded-soldiers-e2c5c47ea4b8326d980e630d3df87b77,0.97,2067,0,2067
10,worldnews,Kim Jong-un and Putin Plan to Meet in Russia to Discuss Weapons,https://www.nytimes.com/2023/09/04/us/politics/putin-kim-meeting-russia-north-korea-weapons.html,0.95,1921,0,1921
11,worldnews,Russia’s Putin says there will be no new grain deal until the West meets his demands,https://apnews.com/article/russia-ukraine-turkey-putin-erdogan-sochi-ac41cb453a6d6c597d543873850414eb,0.92,1762,0,1762
12,worldnews,Clashes erupt in Sweden's third largest city after another Quran burning and at least 3 are detained,https://abcnews.go.com/International/wireStory/clashes-erupt-swedens-largest-city-after-quran-burning-102903405,0.94,1636,0,1636
13,worldnews,“We Have Photo Evidence” – Ukraine’s Foreign Minister on Shahed UAV Crash in Romania,https://www.eurointegration.com.ua/eng/news/2023/09/4/7168773/,0.95,1143,0,1143
14,worldnews,Kim Jong Un to visit Putin in Russia for arms talks,https://www.bbc.com/news/world-asia-66713476,0.94,983,0,983
15,worldnews,"UK ‘brushing Saudi abuses under carpet’, say campaigners as arms sales hit £13bn since 2018",https://inews.co.uk/news/world/uk-brushing-saudi-abuses-under-carpet-arms-sales-2562016,0.96,920,0,920
16,worldnews,Biden Says He is 'Disappointed' By China's Xi Skipping G20,https://themessenger.com/politics/biden-says-he-is-disappointed-by-chinas-xi-skipping-g20?utm_source=flipboard&amp;utm_content=TheMessenger%2Fmagazine%2FThe+Messenger+Latest,0.92,719,0,719
17,worldnews,Moscow dissatisfied with Armenia PM statements on Russia in interview to Italy media,https://news.am/eng/news/778739.html,0.94,569,0,569
18,worldnews,pope acknowledges his russia comments were faulty,https://www.reuters.com/world/pope-acknowledges-his-russia-comments-were-faulty-2023-09-04/,0.89,369,0,369
19,worldnews,"Russian oil exports hit 11-month low as refinery downtime, output cuts bite",https://www.spglobal.com/commodityinsights/en/market-insights/latest-news/oil/090423-russian-oil-exports-hit-11-month-low-as-refinery-downtime-output-cuts-bite,0.94,346,0,346
20,worldnews,President of Estonia says PM Kaja Kallas should Have resigned over revelations of her husband’s business activity in Russia,https://news.yahoo.com/estonian-premier-kallas-resigned-president-160822208.html,0.94,322,0,322
21,worldnews,War costs us US$100 million a day – Defence Minister,https://www.pravda.com.ua/eng/news/2023/09/4/7418340/,0.85,290,0,290
22,worldnews,"/r/WorldNews Live Thread: Russian Invasion of Ukraine Day 559, Part 1 (Thread #705)",https://www.reddit.com/live/18hnzysb1elcs,0.98,286,0,286
23,worldnews,"UK: Airlines could face a crackdown on hidden fees, as part of a new government plan to improve transparency for people shopping online",https://www.bbc.com/news/business-66706495,0.97,281,0,281
24,worldnews,"Taiwan to Invest $4.1B in Military Research, Development",https://www.thedefensepost.com/2023/09/04/taiwan-military-research-development/,0.93,199,0,199
25,worldnews,Belgium’s cannabis legalization effort receives a big endorsement,https://internationalcbc.com/belgium-cannabis-legalization-effort-receives-a-big-endorsement/,0.91,119,0,119
