,subreddit,title,url,upvote_ratio,ups,downs,score
0,worldnews,Romanian president signs law allowing troops to shoot down Russian drones in country’s airspace,https://www.pravda.com.ua/eng/news/2025/05/19/7512967/,0.97,35701,0,35701
1,worldnews,"'We will abandon you if war continues,' Trump tells Israel",https://m.jpost.com/breaking-news/article-854628,0.94,12348,0,12348
2,worldnews,Pakistan warns India: don’t weaponise water.,https://tribune.com.pk/story/2546603/pakistan-warns-india-dont-weaponise-water,0.93,10947,0,10947
3,worldnews,Trump called Zelenskyy before talking to Putin,https://www.pravda.com.ua/eng/news/2025/05/19/7512994/,0.96,9419,0,9419
4,worldnews,Russia reportedly fails to launch intercontinental ballistic missile to intimidate Ukraine and NATO as planned,https://www.pravda.com.ua/eng/news/2025/05/19/7512913/,0.97,8982,0,8982
5,worldnews,Zelensky dismisses Putin's demand to withdraw troops from 4 Ukrainian regions,https://kyivindependent.com/zelensky-dismisses-putins-demand-to-withdraw-troops-from-ukrainian-territories/,0.97,8595,0,8595
6,worldnews,UK-EU deal 'breakthrough' as Keir Starmer to announce post-Brexit reset agreement after late-night talks,https://www.standard.co.uk/news/politics/eu-uk-deal-agreement-brexit-reset-starmer-fisheries-b1228452.html,0.97,5822,0,5822
7,worldnews,Putin confident he can fully seize four Ukrainian oblasts by end of 2025 – Bloomberg,https://www.pravda.com.ua/eng/news/2025/05/19/7512885/,0.96,5768,0,5768
8,worldnews,Trump and Putin hold phone call but Kremlin refuses Ukraine ceasefire,https://www.theguardian.com/world/2025/may/19/trump-and-putin-hold-phone-call-but-kremlin-refuses-ukraine-ceasefire,0.97,4432,0,4432
9,worldnews,Poland Seizes Boeing Aircraft Parts Headed for Russia,https://www.themoscowtimes.com/2025/05/19/poland-seizes-boeing-aircraft-parts-headed-for-russia-a89121,0.99,4240,0,4240
10,worldnews,Trump says he will not impose new sanctions on Russia,https://kyivindependent.com/trump-says-he-will-not-impose-new-sanctions-on-russia/,0.95,3837,0,3837
11,worldnews,"China 'fully' respects Denmark's sovereignty on Greenland, foreign minister says",https://www.reuters.com/world/china/china-fully-respects-denmarks-sovereignty-greenland-foreign-minister-says-2025-05-19/,0.96,3598,0,3598
12,worldnews,"Canada, Britain, France threaten action if Israel does not stop military offensive and lift aid restrictions",https://www.cbc.ca/news/world/israel-gaza-aid-military-1.7538495,0.91,3548,0,3548
13,worldnews,'It's our land' — Zelensky responds to Putin's call with Trump,https://kyivindependent.com/its-our-land-ukraine-responds-to-putins-call-with-trump-russias-demands/,0.98,2903,0,2903
14,worldnews,Finland to send €90 mln worth of ammunition to Ukraine funded by frozen Russian assets,https://tvpworld.com/86787254/finland-to-send-90-mln-worth-of-ammunition-to-ukraine-funded-by-frozen-russian-assets,0.98,2704,0,2704
15,worldnews,"Netanyahu vows to ‘take control’ of Gaza as UK, France and Canada threaten action against Israel",https://www.theguardian.com/world/2025/may/19/benjamin-netanyahu-israel-take-control-gaza-uk-france-canada-threaten-action,0.92,1812,0,1812
16,worldnews,French state covered up Nestle water scandal: Senate report,https://timesofindia.indiatimes.com/world/europe/french-state-covered-up-nestle-water-scandal-senate-report/articleshow/121266215.cms,0.97,1809,0,1809
17,worldnews,Australia's Liberal-National coalition splits after election trashing,https://www.bbc.com/news/articles/cev4dve4970o,0.98,1605,0,1605
18,worldnews,China to launch drone mothership,https://www.stuff.co.nz/world-news/360694603/china-launch-drone-mothership,0.91,559,0,559
19,worldnews,El Salvador arrests human rights lawyer helping deported migrants,https://amp.scmp.com/news/world/americas/article/3310982/el-salvador-arrests-human-rights-lawyer-helping-deported-migrants?module=top_story&amp;pgtype=homepage,0.96,537,0,537
20,worldnews,"Trump backs off meeting with Putin, calls for direct Ukraine-Russia talks",https://www.nbcnews.com/world/russia/trump-set-implore-putin-end-bloodbath-ukraine-high-stakes-phone-call-rcna207612,0.91,370,0,370
21,worldnews,"There will be a package of sanctions from Europe, and it will be very powerful - Zelensky | УНН",https://unn.ua/en/news/there-will-be-a-package-of-sanctions-from-europe-and-it-will-be-very-powerful-zelensky,0.95,365,0,365
22,worldnews,Poland seizes aircraft tyres bound for Russia in suspected sanctions breach,https://www.reuters.com/business/aerospace-defense/poland-seizes-tires-boeing-aircraft-headed-russia-2025-05-19/,0.97,348,0,348
23,worldnews,El Salvador arrests rights lawyer helping deported migrants,https://www.rfi.fr/en/international-news/20250519-el-salvador-arrests-rights-lawyer-helping-deported-migrants,0.94,282,0,282
24,worldnews,U.S. was neither involved nor informed on truce with Pakistan: Government tells parliamentary panel,https://www.thehindu.com/news/national/foreign-secretary-vikram-misri-to-brief-parliamentary-panel-on-issues-related-to-pakistan/article69592846.ece,0.93,170,0,170
25,worldnews,"/r/WorldNews Live Thread: Russian Invasion of Ukraine Day 1181, Part 1 (Thread #1328)",https://www.reddit.com/live/18hnzysb1elcs,0.97,151,0,151
