,subreddit,title,url,upvote_ratio,ups,downs,score
0,worldnews,Qatar's Gift to Trump Is Unsold Plane It's Been Trying to Dump for Years,https://www.newsweek.com/qatar-gift-trump-unsold-plane-2072564,0.92,51598,0,51598
1,worldnews,Told Apple CEO Tim Cook that I don't want him to build in India: Donald Trump,https://www.moneycontrol.com/news/business/told-apple-ceo-tim-cook-that-i-don-t-want-him-to-build-in-india-donald-trump-13027006.html,0.94,11815,0,11815
2,worldnews,President Putin sacks commander-in-chief of Russian Ground Forces,https://www.pravda.com.ua/eng/news/2025/05/15/7512429/,0.98,6198,0,6198
3,worldnews,‘My heart goes out to the beloved people of Ukraine’ — Pope Leo XIV receives list of Ukrainian POWs at Vatican,https://kyivindependent.com/my-heart-goes-out-to-the-beloved-people-of-ukraine-pope-leo-xiv-receives-list-of-ukrainian-pows-at-vatican/,0.99,5846,0,5846
4,worldnews,Australia has ramped up its travel warnings for the USA three times since April,https://www.abc.net.au/news/2025-05-15/australia-government-travel-advice-usa-trump-border-control/105293186,0.96,5584,0,5584
5,worldnews,Trump Backs Off Plan to Rename Persian Gulf After Backlash from Iranian Officials,https://www.mediaite.com/trump/trump-backs-off-plan-to-rename-persian-gulf-after-backlash-from-iranian-officials-report/,0.97,4806,0,4806
6,worldnews,Apple reassures India of commitment despite Trump’s objections,https://www.cnbctv18.com/technology/apple-manufacturing-us-president-donald-trump-comments-india-reaction-19605132.htm/amp#amp_tf=From%20%251%24s&amp;aoh=17473166865808&amp;referrer=https%3A%2F%2Fwww.google.com,0.97,4423,0,4423
7,worldnews,Russia has already started its summer offensive in Ukraine,https://gwaramedia.com/en/russia-has-already-started-its-summer-offensive-in-ukraine/,0.98,4249,0,4249
8,worldnews,Trump Says US Should 'Take' Gaza And Turn It Into 'Freedom Zone',https://www.barrons.com/news/trump-says-us-should-take-gaza-and-turn-it-into-freedom-zone-f71d1451,0.94,4011,0,4011
9,worldnews,India has approached Russia with the intention of acquiring additional S-400 surface-to-air missile (SAM) systems,https://en.defence-ua.com/news/india_wants_more_russian_s_400_systems_on_its_8th_year_of_waiting_for_the_previous_batch-14519.html,0.95,1947,0,1947
10,worldnews,Switzerland bans aluminium imports from Russia and Belarus,https://www.swissinfo.ch/eng/foreign-affairs/switzerland-tightens-its-grip-on-russian-and-belarusian-aluminium/89322593,0.98,1671,0,1671
11,worldnews,Canadian Tire Acquires Hudson’s Bay Intellectual Property in $30 Million Deal,https://www.todocanada.ca/canadian-tire-acquires-hudsons-bay-intellectual-property-in-30-million-deal/,0.97,1523,0,1523
12,worldnews,India revokes clearance of Turkey-linked aviation firm over national security,https://www.indiatoday.in/india/story/turkey-linked-firm-celebi-airport-services-security-clearance-revoked-by-india-after-countrys-support-to-pak-2725357-2025-05-15,0.94,1465,0,1465
13,worldnews,Germany's Merz says we will confiscate frozen Russian assets if legally possible,https://www.reuters.com/business/finance/germanys-merz-says-we-will-confiscate-frozen-russian-assets-if-legally-possible-2025-05-15/,0.98,1427,0,1427
14,worldnews,Beware unkempt tourists: Latvia tells citizens how to spot Russian spies,https://www.theguardian.com/world/2025/may/15/latvia-shares-spy-spotting-guide-to-help-public-expose-russian-saboteurs,0.97,1186,0,1186
15,worldnews,"Ontario reports 182 new measles cases, totaling over 1,600",https://www.cbc.ca/news/canada/toronto/measles-ontario-outbreak-1.7535861,0.96,720,0,720
16,worldnews,Loblaw warns of food price surge as pre-tariff inventory runs out,https://financialpost.com/news/loblaw-warns-surge-in-food-prices-tariffs,0.94,664,0,664
17,worldnews,"Deal In Pakistan With Links To Donald Trump, Asim Munir Under Scrutiny",https://www.ndtv.com/world-news/a-deal-in-pakistan-with-links-to-donald-trumps-family-asim-munir-under-scrutiny-report-8424070,0.94,627,0,627
18,worldnews,UK business group calls for 'reset' with EU,https://www.bbc.com/news/articles/cgmjyjpzy1lo,0.92,444,0,444
19,worldnews,Trump and Abu Dhabi ink partnership to build massive AI data center complex in UAE,https://www.cnn.com/2025/05/15/middleeast/trump-abu-dhabi-ai-center-latam-intl,0.91,322,0,322
20,worldnews,"Iran using criminal gangs for hit jobs abroad, court papers show",https://www.bbc.com/news/articles/c308p0rjq9zo,0.94,218,0,218
21,worldnews,"Pope meets with head of Greek Catholic Church in Ukraine, who invites him to Kyiv",https://apnews.com/article/vatican-pope-ukraine-zelenskyy-a34aa5868040c479df9322de5f473298,0.95,179,0,179
22,worldnews,Bucharest mayor overtakes nationalist frontrunner in Romania’s presidential race: poll,https://tvpworld.com/86725812/bucharest-mayor-overtakes-nationalist-frontrunner-in-romanias-presidential-race-poll,0.94,152,0,152
23,worldnews,"/r/WorldNews Live Thread: Russian Invasion of Ukraine Day 1177, Part 1 (Thread #1324)",https://www.reddit.com/live/18hnzysb1elcs,0.98,147,0,147
24,worldnews,Belgian parliament scraps nuclear phaseout plan,https://amp.dw.com/en/belgian-parliament-scraps-nuclear-phaseout-plan/a-72560001,0.95,111,0,111
25,worldnews,"Measles could keep spreading for a year, says Canada’s chief public health officer",https://www.theglobeandmail.com/canada/article-measles-outbreak-chief-public-health-officer-urges-vaccines/,0.93,88,0,88
