,subreddit,title,url,upvote_ratio,ups,downs,score
0,worldnews,Russian wives and mothers call on Putin to stop sending mobilized men ‘to the slaughter’,https://edition.cnn.com/2023/03/12/europe/russia-mobilization-putin-protest-wives-mothers-intl-hnk/index.html,0.9,58178,0,58178
1,worldnews,Moldova police say they foiled Russia-backed unrest plot,https://apnews.com/article/moldova-protests-russia-unrest-plot-24b55d877401cf3d2122c21fe17ef1da,0.94,34072,0,34072
2,worldnews,President of Switzerland supports ban on arms supplies to Ukraine,https://www.ukrinform.net/rubric-defense/3681550-president-of-switzerland-supports-ban-on-arms-supplies-to-ukraine.html,0.91,7366,0,7366
3,worldnews,One of India's trash mountains is on fire again and residents are choking on its toxic fumes | CNN,https://www.cnn.com/2023/03/07/india/india-bhramapuram-landfill-toxic-waste-fire-intl-hnk/index.html,0.96,4519,0,4519
4,worldnews,City of Lucerne votes to restrict Airbnb rentals,https://www.swissinfo.ch/eng/politics/city-of-lucerne-votes-to-restrict-airbnb-rentals/48353668,0.97,4076,0,4076
5,worldnews,France to Invest €100 Billion in Railway Infrastructure,https://railway-news.com/france-to-invest-e100-billion-in-railway-infrastructure/,0.97,2834,0,2834
6,worldnews,U.S. arms left in Afghanistan surface in Pakistan Taliban insurgency,https://asia.nikkei.com/Politics/Terrorism/U.S.-arms-left-in-Afghanistan-surface-in-Pakistan-Taliban-insurgency,0.95,2797,0,2797
7,worldnews,"Half a million Israelis join latest protest against Netanyahu's judicial overhaul, organizers say",https://www.cnn.com/2023/03/12/middleeast/israel-protests-benjamin-netanyahu-intl/index.html,0.97,2598,0,2598
8,worldnews,"Lufthansa flight crew asked passengers to erase pictures, videos of mid-air turbulence | Watch Video",https://nightmags.com/lufthansa-flight-crew-asked-passengers-to-erase-pictures-videos-of-mid-air-turbulence-watch-video/,0.95,1968,0,1968
9,worldnews,Rishi Sunak has electricity grid upgraded to heat his private pool | Rishi Sunak | The Guardian,https://www.theguardian.com/politics/2023/mar/12/rishi-sunak-has-electricity-grid-upgraded-to-heat-his-private-pool,0.87,1459,0,1459
10,worldnews,Facebook to block access to news if Canada adopts Online News Act,https://nationalpost.com/news/meta-to-block-access-to-news-facebook-instagram-canada,0.94,1447,0,1447
11,worldnews,"Civil disobedience needed if Israel passes judicial changes, former prime minister says | “It’s an attack on the very soul and nature of our democracy,” Ehud Barak said.",https://www.politico.com/news/2023/03/12/israel-civil-disobedience-barak-netanyahu-00086671,0.95,1246,0,1246
12,worldnews,Moscow fumes as Ukraine considers changing Russia’s official name,https://thehill.com/policy/international/3896712-moscow-fumes-as-ukraine-considers-changing-russias-official-name/,0.94,1243,0,1243
13,worldnews,Finnish president says disputes with Turkey still holding up NATO membership,https://amp.washingtontimes.com/news/2023/mar/12/finnish-president-sauli-niinisto-says-disputes-tur/,0.95,1064,0,1064
14,worldnews,CNN Wins First Oscar for ‘Navalny’,https://variety.com/2023/awards/news/cnn-oscar-win-navalny-documentary-1235544466/,0.9,835,0,835
15,worldnews,"Police use water cannon to end climate protest, 700 arrested",https://www.dutchnews.nl/news/2023/03/police-use-water-cannon-to-end-climate-activists-protest/,0.94,688,0,688
16,worldnews,"'Navalny,' portrait of Kremlin critic, wins best documentary Oscar",https://nationalpost.com/pmn/entertainment-pmn/navalny-portrait-of-kremlin-critic-wins-best-documentary-oscar,0.93,683,0,683
17,worldnews,"F-16s will 'eventually' be sent to Ukraine, former U.S. Joint Chiefs of Staff chair says",https://www.cbc.ca/news/politics/mike-mullen-f16-shipments-expected-1.6776514,0.92,650,0,650
18,worldnews,"In groundbreaking ruling, Middle Eastern Islamic council declares ‘fatwa’ against Hamas",https://www.foxnews.com/world/in-groundbreaking-ruling-middle-eastern-islamic-council-declares-fatwa-against-hamas.amp,0.89,640,0,640
19,worldnews,UK to spend extra £5bn on military to counter intensifying threats from China and Russia,https://news.sky.com/story/uk-to-spend-extra-5bn-on-military-to-counter-intensifying-threats-from-china-and-russia-12832595,0.94,579,0,579
20,worldnews,Cheetahs Back in Wild in India After Seven Decades,https://www.voanews.com/a/cheetahs-back-in-wild-in-india-after-seven-decades/7001041.html,0.96,494,0,494
21,worldnews,France challenging Russia as second biggest arms exporter behind US,https://www.theguardian.com/world/2023/mar/13/france-challenging-russia-as-second-biggest-arms-exporter-behind-us,0.96,493,0,493
22,worldnews,"/r/WorldNews Live Thread: Russian Invasion of Ukraine Day 383, Part 1 (Thread #524)",https://www.reddit.com/live/18hnzysb1elcs,0.96,290,0,290
23,worldnews,Ukraine War: Heavy Losses Reported As Battles For Bakhmut Rages,https://www.bbc.com/news/world-europe-64935449,0.93,281,0,281
24,worldnews,Hotel security guard in Germany assaults Ukrainian soldier for wearing his uniform,https://english.nv.ua/nation/hotel-security-guard-in-germany-assaults-ukrainian-soldier-for-wearing-his-uniform-50310135.html,0.86,230,0,230
25,worldnews,Moscow fumes as Ukraine considers changing Russia’s official name,https://news.yahoo.com/moscow-fumes-ukraine-considers-changing-014750866.html,0.9,221,0,221
