,subreddit,title,url,upvote_ratio,ups,downs,score
0,worldnews,"Putin has escaped to his secret palace in a forest amid anti-draft protests in Russian cities, report says",https://www.businessinsider.com/photos-putin-escapes-secret-palace-amid-anti-draft-protests-report-2022-9,0.88,109077,0,109077
1,worldnews,Italy's far right set to win election - exit poll,https://www.bbc.co.uk/news/world-europe-63029909,0.88,31205,0,31205
2,worldnews,Serbia won't recognise results of sham referendums on occupied territories of Ukraine,https://www.pravda.com.ua/eng/news/2022/09/25/7369012/,0.95,23022,0,23022
3,worldnews,Ukraine receives U.S. air defence system,https://www.reuters.com/world/europe/ukraine-receives-us-air-defence-system-2022-09-25/,0.96,16257,0,16257
4,worldnews,Fifth Iranian paramilitary member killed as president warns protesters will be dealt with 'decisively',https://edition.cnn.com/2022/09/25/middleeast/mahsa-amini-death-iran-intl/index.html,0.98,9040,0,9040
5,worldnews,Men in Russia to be banned from leaving after sham referendums in Ukraine,https://www.pravda.com.ua/eng/news/2022/09/25/7368981/,0.97,8617,0,8617
6,worldnews,Iran vows ‘no leniency’ as seething women-led protests enter 10th day,https://www.timesofisrael.com/iran-vows-no-leniency-as-seething-women-led-protests-enter-10th-day/,0.98,7096,0,7096
7,worldnews,Police clash with people opposed to mobilisation in Russia's Dagestan,https://www.reuters.com/world/europe/police-clash-with-people-opposed-mobilisation-russias-dagestan-2022-09-25/,0.98,6833,0,6833
8,worldnews,US in private talks with Russia over nuclear weapons to avoid public ‘tit for tat’,https://thehill.com/homenews/sunday-talk-shows/3660189-biden-adviser-us-in-private-talks-with-russia-over-nuclear-weapons-to-avoid-public-tit-for-tat/,0.97,4384,0,4384
9,worldnews,Iran protests Western stance on mass protests over woman's death,https://www.reuters.com/world/middle-east/iran-summons-uk-norwegian-envoys-unrest-persists-2022-09-25/,0.96,2991,0,2991
10,worldnews,Zelenskiy vows to liberate all of Ukraine as Russian ‘vote’ continues | Ukraine,https://www.theguardian.com/world/2022/sep/25/zelenskiy-vows-to-liberate-all-of-ukraine-as-russian-vote-continues,0.96,1954,0,1954
11,worldnews,"Our world is in peril, UN secretary-general warns general assembly",https://www.cbc.ca/news/world/un-general-assembly-world-peril-1.6588574,0.96,1901,0,1901
12,worldnews,Russia Desperately Tries to Sell Its Ukraine War Draft as Citizens Flee,https://www.thedailybeast.com/russia-desperately-tries-to-sell-its-ukraine-war-draft-as-citizens-flee-towards-the-borders/,0.98,1831,0,1831
13,worldnews,The Greens say cannabis could be legalised in Australia this year,https://www.theaustralian.com.au/the-oz/news/weed-could-be-legal-by-next-year/news-story/b222a09b685a4162234e9d6d4a888406,0.95,1227,0,1227
14,worldnews,"An ex-US Army general who witnessed Russia's basic training of recruits says it was awful, and the 'newbies' being drafted face disaster on the front line",https://news.yahoo.com/ex-us-army-general-witnessed-103605725.html,0.97,1145,0,1145
15,worldnews,"Japan bans chemical weapons-related goods to Russia, concerned by nuke threats",https://www.reuters.com/world/japan-bans-chemical-weapons-related-goods-russia-concerned-by-nuke-threats-2022-09-26/,0.98,1083,0,1083
16,worldnews,Secretary Blinken answers: Would anyone in Russia stop Putin if he wanted to use nukes?,https://www.cbsnews.com/news/secretary-of-state-antony-blinken-vladimir-putin-60-minutes-2022-09-25/?ftag=CNM-00-10aab7e&amp;linkId=182990672,0.92,922,0,922
17,worldnews,Canada struggles to restore power after storm; body found,https://apnews.com/article/storms-caribbean-prince-edward-nova-scotia-tropical-cyclones-955ef586969648801fed1150d3593595,0.95,900,0,900
18,worldnews,Zelensky reports ‘positive results in several directions’ in war with Russia,https://thehill.com/policy/international/3660564-zelensky-reports-positive-results-in-several-directions-in-war-with-russia/,0.96,805,0,805
19,worldnews,Iran summons UK envoy amid anti-government protests,https://apnews.com/article/iran-middle-east-london-dubai-united-arab-emirates-4a9644d816ccda0d29c5c7ef60038a57,0.93,676,0,676
20,worldnews,"More Than 260,000 People Fled Russia For Fear Of Being Sent To Fight In Ukraine",https://worldnationnews.com/more-than-260000-people-fled-russia-for-fear-of-being-sent-to-fight-in-ukraine/,0.97,584,0,584
21,worldnews,"/r/WorldNews Live Thread: Russian Invasion of Ukraine Day 215, Part 1 (Thread #356)",https://www.reddit.com/live/18hnzysb1elcs,0.97,510,0,510
22,worldnews,US warnings against Putin's nuclear threats mark a sobering moment for the world,https://www.cnn.com/2022/09/26/politics/us-warns-putin-nuclear-weapons-analysis/index.html,0.94,428,0,428
23,worldnews,Kazakhstan says it won't recognise referendums in eastern Ukraine,https://www.reuters.com/article/ukraine-crisis-kazakhstan-russia/kazakhstan-says-it-wont-recognise-referendums-in-eastern-ukraine-idUSKBN2QR099,0.95,295,0,295
24,worldnews,Kazakhstan says it won't recognise referendums in eastern Ukraine,https://news.yahoo.com/kazakhstan-says-wont-recognise-referendums-052219363.html,0.96,247,0,247
25,worldnews,"Drafted Russian Man Fires Rifle In a Draft Center, Killing the Commander",https://www.smobserved.com/story/2022/09/26/news/drafted-russian-man-fires-rifle-in-a-draft-center-killing-the-commander-irkutsk-region-of-russia/7109.html?m=true,0.97,219,0,219
26,worldnews,"Russian commander shot at military enlistment office in Ust-Ilimsk, Russia",https://euroweeklynews.com/2022/09/26/russian-commander-shot-at-military-enlistment-office-in-ust-ilimsk-russia/,0.97,214,0,214
