,subreddit,title,url,upvote_ratio,ups,downs,score
0,worldnews,Russians die under mysterious circumstances in Mariupol – City Council,https://news.yahoo.com/russians-die-under-mysterious-circumstances-095451323.html,0.94,17623,0,17623
1,worldnews,"Prigozhin arrives in St Petersburg, takes back seized weapons",https://news.yahoo.com/prigozhin-arrives-st-petersburg-takes-092701789.html,0.95,14539,0,14539
2,worldnews,Macron's call to 'cut off' social media during riots sparks backlash in France,https://www.france24.com/en/europe/20230705-macron-s-call-to-cut-off-social-media-during-riots-sparks-backlash,0.97,10686,0,10686
3,worldnews,US Navy says it prevented Iran from seizing tankers in Gulf - An Iranian navy vessel fired shots during the second seizure attempt. Hawkins did not say how the U.S. Navy prevented their seizure.,https://news.yahoo.com/news/shots-fired-oil-tanker-gulf-114859318.html,0.97,6144,0,6144
4,worldnews,FT: Xi warned Putin against nuclear attack in Ukraine,https://kyivindependent.com/ft-xi-warned-putin-against-nuclear-attack-in-ukraine/,0.97,5317,0,5317
5,worldnews,World's 1st 'tooth regrowth' medicine moves toward clinical trials in Japan,https://mainichi.jp/english/articles/20230609/p2a/00m/0sc/026000c,0.98,4143,0,4143
6,worldnews,"This July 4 was hot. Earth’s hottest day on record, in fact.",https://www.washingtonpost.com/climate-environment/2023/07/05/hottest-day-ever-recorded/,0.94,2792,0,2792
7,worldnews,"Saudi Arabia says ""New oil cuts show teamwork with Russia is strong""",https://www.reuters.com/business/energy/saudi-arabia-says-new-oil-cuts-show-teamwork-with-russia-is-strong-2023-07-05,0.94,2791,0,2791
8,worldnews,Kremlin denies China’s president urged Putin not to use nuclear arms in Ukraine | Russia,https://www.theguardian.com/world/2023/jul/05/kremlin-china-president-xi-jining-vladimir-putin-nuclear-weapons-ukraine-russia,0.96,2732,0,2732
9,worldnews,Canadian Police Just Arrested Influential Neo-Nazi ‘Dark Foreigner’,https://www.vice.com/en/article/z3m383/dark-foreigner-arrested-canada-terrorism,0.96,2277,0,2277
10,worldnews,Pope envoy working on 'mechanism' to return children to Ukraine,https://www.reuters.com/world/europe/pope-envoy-working-mechanism-return-children-ukraine-2023-07-04/,0.95,1901,0,1901
11,worldnews,Algeria to Replace French Language with English at its Universities,https://english.aawsat.com/arab-world/4412916-algeria-replace-french-language-english-its-universities,0.97,1813,0,1813
12,worldnews,Report finds 'deliberate mass killings' of Ethiopians by Saudi security officials along Saudi-Yemen border,https://www.middleeasteye.net/news/ethiopia-saudi-yemen-border-killed-tortured,0.97,1799,0,1799
13,worldnews,Climate activist Greta Thunberg has been charged with disobeying police during a June climate protest in southern Sweden,https://www.france24.com/en/live-news/20230705-greta-thunberg-charged-over-swedish-climate-protest-report,0.87,1007,0,1007
14,worldnews,“I’m here for my grandchildren”: Just Stop Oil protesters storm Wimbledon court,https://www.euronews.com/green/2023/07/05/im-here-for-my-grandchildren-two-pensioners-storm-wimbledon-court-to-demand-climate-action,0.89,913,0,913
15,worldnews,NATO-Ukraine Council to meet for first time on 12 July,https://www.pravda.com.ua/eng/news/2023/07/5/7409997/,0.96,862,0,862
16,worldnews,Belarus jails son of Lukashenko rival for 8 years,https://www.reuters.com/world/europe/belarus-jails-son-lukashenko-rival-8-years-2023-07-05/,0.95,766,0,766
17,worldnews,UN: Millions left with no aid as West Africa suffers worst hunger crisis in 10 years,https://apnews.com/article/un-food-west-africa-hunger-aid-conflict-3bac5025cc26ed59318bbf63c2e02626,0.9,495,0,495
18,worldnews,Joe Biden backs Ursula von Der Leyen for next Nato chief after Ben Wallace’s candidacy was blocked,https://www.lbc.co.uk/news/joe-biden-backs-ursula-von-der-leyen-for-next-nato-chief/,0.9,422,0,422
19,worldnews,"France has passed a law compelling social media platforms such as TikTok to authenticate users’ ages and gain parental approval for those under 15, as part of its effort to safeguard children online",https://www.scottishlegal.com/articles/france-new-parental-consent-law-to-regulate-childrens-social-media-use,0.97,415,0,415
20,worldnews,"/r/WorldNews Live Thread: Russian Invasion of Ukraine Day 498, Part 1 (Thread #644)",https://www.reddit.com/live/18hnzysb1elcs,0.98,383,0,383
21,worldnews,Ukrainian fighters decimating Russians with self-propelled guns in Bakhmut direction,https://www.ukrinform.net/rubric-ato/3732010-ukrainian-fighters-decimating-russians-with-selfpropelled-guns-in-bakhmut-direction.html,0.94,325,0,325
22,worldnews,"(Canadian) Federal government has suspended its advertising on Facebook, Instagram, says heritage minister",https://www.cbc.ca/news/politics/online-news-act-google-facebook-meta-1.6897186,0.95,286,0,286
23,worldnews,Cell phones to be banned from Dutch school classrooms next year,https://edition.cnn.com/2023/07/05/europe/netherlands-school-phone-ban-scli-intl-wellness/index.html,0.94,270,0,270
24,worldnews,Belarusian leader asks Wagner mercenaries to train his military,https://edition.cnn.com/2023/07/01/europe/belarus-leader-invites-wagner-train-military-intl-hnk/index.html,0.88,162,0,162
25,worldnews,Macron accused of authoritarianism after threat to cut off social media,https://www.theguardian.com/world/2023/jul/05/french-government-should-control-social-media-during-unrest-macron-says,0.91,101,0,101
