,subreddit,title,url,upvote_ratio,ups,downs,score
0,worldnews,Former South Korean President Yoon Sentenced to Life in Prison for Coup Attempt,https://www.bloomberg.com/news/articles/2026-02-19/ousted-korean-president-yoon-sentenced-to-life-over-martial-law?embedded-checkout=true,0.97,40331,0,40331
1,worldnews,Andrew Mountbatten-Windsor arrested on suspicion of misconduct in public office,https://m.independent.ie/world-news/britain/andrew-mountbatten-windsor-arrested-on-suspicion-of-misconduct-in-public-office-reports/a888485987.html,0.98,19773,0,19773
2,worldnews,UK refusing to allow Trump to use RAF bases to attack Iran,https://www.thenorthernecho.co.uk/news/national/25870894.uk-refusing-allow-trump-use-raf-bases-attack-iran/,0.96,19528,0,19528
3,worldnews,King Charles Breaks Silence After Ex-Prince Andrew’s Arrest,https://people.com/king-charles-statement-former-prince-andrew-arrest-11909488,0.95,6915,0,6915
4,worldnews,Russia Orders Google to Pay $1.2 Quintillion—A Fine One Million Times Bigger Than the World Economy,https://united24media.com/latest-news/russia-orders-google-to-pay-12-quintillion-a-fine-one-million-times-bigger-than-the-world-economy-16052,0.97,6797,0,6797
5,worldnews,Estonia refuses to broadcast Paralympics with Russian athletes under national flag amid war — calls IPC decision “disgrace”,https://euromaidanpress.com/2026/02/19/estonia-refuses-to-broadcast-paralympics-with-russian-athletes-under-national-flag-amid-war-calls-ipc-decision-disgrace/,0.98,2317,0,2317
6,worldnews,"Single vaccine could protect against all coughs, colds and flus, researchers say",https://www.bbc.co.uk/news/articles/cx2g8rz7yedo,0.95,2090,0,2090
7,worldnews,The USS Gerald R. Ford (CVN-78) is scheduled to enter the Mediterranean Sea in the coming hours.,https://www.diarioarea.com/campo-de-gibraltar/el-estrecho-de-gibraltar-cuenta-las-horas-para-que-el-uss-gerald-ford-el-mayor-portaaviones-nuclear-del-mundo-vuelva-a-cruzar-sus-aguas/,0.95,1883,0,1883
8,worldnews,Iran Protests: 17% of demonstrators were students — Over 200 killed were school-age children,https://iranwire.com/en/news/149315-17-of-protesters-were-students-parliament-member-says/,0.95,1838,0,1838
9,worldnews,Iran’s Currency Crashes to Record Low as $1 Hits 1.63 Million Rials,https://nomusica.com/irans-currency-crashes-to-record-low-as-1-hits-1-63-million-rials/,0.96,1626,0,1626
10,worldnews,Sweden allocates €1.2bn military aid package to Ukraine,https://www.pravda.com.ua/eng/news/2026/02/19/8021793/,0.97,1568,0,1568
11,worldnews,"Denmark's king visits Greenland, showing unity in the face of Trump threats",https://www.reuters.com/world/denmarks-king-visits-greenland-showing-unity-face-trump-threats-2026-02-18/,0.95,1202,0,1202
12,worldnews,Trump changed mind on Chagos deal ‘after UK blocked use of Diego Garcia for Iran strikes’,https://www.theguardian.com/world/2026/feb/19/donald-trump-turns-against-uk-chagos-islands-plan-iran,0.95,1178,0,1178
13,worldnews,Germany's Merz calls for real names on the internet,https://consent.yahoo.com/v2/collectConsent?sessionId=3_cc-session_b5053466-f67e-4f32-a1d2-e97e13eed0fb,0.83,1058,0,1058
14,worldnews,"Musk cuts Starlink access for Russian forces, giving Ukraine an edge at the front",https://www.bbc.com/news/articles/c0q3ndj7052o,0.88,757,0,757
15,worldnews,Belarus says US failed to issue visas for 'Board of Peace' meeting,https://www.yahoo.com/news/articles/belarus-says-us-failed-issue-195152368.html,0.95,655,0,655
16,worldnews,"'Enough is enough': Canadian intelligence experts to focus on extortion crime, federal minister says",https://www.cbc.ca/news/canada/toronto/federal-response-extortion-crime-canada-9.7097482,0.98,469,0,469
17,worldnews,Ukraine regains over 200 sq km in five days,https://www.pravda.com.ua/eng/news/2026/02/17/8021361/,0.97,452,0,452
18,worldnews,Microsoft Copilot Chat error sees confidential emails exposed to AI tool,https://www.bbc.co.uk/news/articles/c8jxevd8mdyo,0.95,396,0,396
19,worldnews,South Korea's ex-president jailed for life over martial law attempt,https://www.bbc.com/news/articles/cx28y8xd1vjo,0.96,225,0,225
20,worldnews,"/r/WorldNews Live Thread: Russian Invasion of Ukraine Day 1457, Part 1 (Thread #1604)",https://www.reddit.com/live/18hnzysb1elcs,0.99,137,0,137
21,worldnews,Epstеin files could be just tip of the iceberg for Andrew investigation,https://www.bbc.com/news/articles/cd032xnm804o,0.97,133,0,133
22,worldnews,Pentagon aggressively lobbies EU against Buy European weapons push,https://www.politico.eu/article/washington-lobbies-eu-against-buy-european-push-for-weapons-donald-trump/,0.91,110,0,110
23,worldnews,"Venezuela approves amnesty bill, paving way for release of hundreds of political detainees",https://www.pbs.org/newshour/world/venezuela-approves-amnesty-bill-paving-way-for-release-of-hundreds-of-political-detainees,0.95,103,0,103
24,worldnews,"1,000 Kenyans were recruited to fight for Russia in Ukraine, intelligence report says",https://www.npr.org/2026/02/19/g-s1-110724/russia-ukraine-war-kenyans-recruited,0.96,98,0,98
